text,label,split
"सुप्रीम कोर्ट के फ़ैसले से ये साबित” कर दिया, कि सरकार का मतलब “तानाशाही” नहीं होता है......प्रशांत कनौजिया को बधाई.",1,train
गुडगांव में एक वैज्ञानिक डॉक्टर ने अपने पूरे परिवार की हथौड़े से मारकर की हत्या और बर्मिंघम में टीम इंडिया का मुकाबला आज बांग्लादेश से होने जा रहा है। जानिए इस घंटे की 4 बड़ी खबरें।  #INDvsBAN #NavjivanBulletin #MumbaiRain,0,train
#JammuAndKashmir के #Budgam में सुरक्षा बलों और आतंकियों के बीच ठभेड़ शुरू हो गई है। यह मुठभेड़ चदूरा इलाके में चल रही है। इलाके में कई आतंकियों के छिपे होने की है। सुरक्षा बलों ने पूरे इलाके को घेर लिया है। गोलीबारी जारी है।,0,train
इटौंजा: खुद खून से लथपथ लेकिन अपनी बहन की जान बचाने के लिए संघर्षरत इस युवक का दर्दनाक वीडियो।    उप्र सरकार कुछ तो रहम-दया दिखाए। अपराधियों ने प्रदेश को कठपुतली बना लिया है।  @user @user  @user @user @user @user,0,train
तुम हो सुअर कि औलाद तुम्हारा अब्बा है सुअर     इतने शरीफ़ नहीं हो तुम आतंकियों बस मैं इतना बोल रहा हुँ आराम से रहो वरना हिंदू ने हथियार उठा लिए ना फिर कही कुछ नहीं कर पाओगे,0,train
"तो हो जाओ ना दफन,अल्ला हु अकबर बोल कर हमारे मंदिर क्यों तोड़ रहे हो,सहनशीलता की भी एक हद होती है,गुजरात का रंडी रोना रोने वालो गोधरा क्यों भूल जाते हो!",0,train
"बड़ी खबर LIVE: भारी बारिश की वजह से पुणे में दर्दनाक हादसा, दीवार ढहने से 15 की मौत, कई लोग घायल #Maharashtra #Pune #PuneRains",0,train
"Kaiske saath Naya Gathbandhan ka,Phale Congress ke saath haare ab BSP ke saath.Naya Gathbandhan kiske saath.Waise bhi you are nominated CM by your father not elected CM by public",0,train
खोजते #कमीने #शब्दों को  मत लिखो।    अगर पैसे के लिए  या #शोहरत के लिए लिख रहे हो  मत लिखो।    अगर लिख रहे हो  कि ये रास्ता है  किसी औरत को बिस्तर तक लाने का  #तो_मत_लिखो।    अगर बैठ के तुम्हें  #बार-बार करने पड़ते हैं सुधार  जाने दो।,0,train
Tera baap  jo rooj krta h wo mat krn bhosdi kai cheenal.. गांडु इंसान है तू रंडी का बच्चा है  तू,0,train
सातवें चरण के लिए #प्रज्ञा_ठाकुर ने कांग्रेस की जीत के लिए जबर्दस्त मेहनत की है    मुझे पूरी उम्मीद है प्रज्ञा ठाकुर की मेहनत बेकार नहीं जाएगी और 23 मई को कांग्रेस ही सरकार बनाएगी,0,train
उनकी तो गांड में छाता घुसा के खोल दो। सुवर की औलाद,0,train
सड़क छाप भक्तो आ रहे है तुम्हारे पप्पा  स्वागत नही करोगे....    घर पर सजा धजा के रखो सब का नम्बर आएगा बारी बारी....,1,train
अख़बार पढ़ने की ऐसी लगन..!!!! एक आटो चालक.. जैसे ही सिग्नल लाल हुई अख़बार निकाला.. अग़ल बग़ल की उपस्थिति से बेख़बर.. देश क्यू नही जागेगा !!!! @user,0,train
अबे रंडी के औलाद हलाला की पैदाइश अपने कुरान और कुरान की आयतो को अपनी गांड में घुसा कर रख।,0,train
"दंगाई मस्त, पुलिस पस्त!  देखिए #Dangal @user के साथ, शाम 5 बजे, सिर्फ आजतक पर",0,train
"बहुत चाहा मगर तुम मेरी चाहत को लाचारी समझ बैठे,  बहुत समझा मगर तुम मेरी समझ को कमजोरी समझ बैठे,  एक रोज बहुत पछताओगे जब हम ना होंगे तुम्हारे पास,  आंखे छलक जाएंगी बस मेरी याद रह जाएगी तुम्हारे पास।।    #हिंदी_शब्द   #शब्दनिधि",0,train
अपने भाई बहनो सहित अपनी मा का दूध पीता सुअर चौहान @user  लेकिन Bsdk तू इनमे कोण सा है,0,train
"क्यों सुअर , कभी तू भी काफिर ही था , वो तो औरंजेब ने लूटी अस्मत 5/7 पीढी पहले , डर के तेरे बाबा , पड़ बाबे मुल्ला बन बैठे , अम्मी से पूछ  वो सारा सच बताएगी",1,train
छ्त्तीसगढ़ के मुख्यमंत्री भूपेश बघेल कार्यकर्ताओं को संबोधित करने के दौरान रो पडे़। यह कार्यक्रम नए पीसीसी चीफ मोहन मरकाम के पदभार ग्रहण के लिए आयोजित किया गया था। सीएम भूपेश बघेल अपने कार्यकाल और पार्टी कार्यकर्ताओं के संघर्ष को याद करते हुए रो पड़े। @user,0,train
कोहली है #नेहरू नहीं जो अंग्रेजों के तलवे चाटने लगे । भड़वा साला #जवाहर,0,train
"अटैक मंदिर पर हुआ इसीलिए शांत है, मस्जिद पर हुआ होता तो घाघरा उठाकर नाचता भड़वा जिहादी घुंघरू सेठ @user",0,train
इस मामले मै पुजारी का नाम भी घसीट ने की कया जरूरत थी भड़वे चुतिया हो क्या मादरचोद प्रमोद,0,train
Jai ho the end of modile eraSab Milkar Sarkar Bana karHitler rabana karo,0,train
"टोटी भैया , 23 के बाद सुसाइड उसाइड जैसा कुछ मत सोचना ! जिंदगी बहुत अनमोल है !! लीगली 2 प्यारे प्यारे बच्चे हैं , भाभी हैं उनके बारे में सोचिएगा !!राजनीति में हार जीत लगा रहता है !!",0,train
हम आज ऐसे भारत मे है जहाँ     समस्याओं का समाधान नही है  विद्यालयों में शिक्षक नही है  अस्पतालों में डॉक्टर नही है  विभाग भ्रष्टाचारमुक्त नही है  कोर्ट में निष्पक्ष न्याय नही है    आज का नया भारत जहाँ सुशासन नही है? फिर भी हम हमेशा हिन्दू-मुस्लिम में फसे रहते है?    क्या होगा हमारे देश का?,0,train
माना कि अंधेरो की बस्ती में जुगनुओं का बसेरा था     पर इसे क्या नाम दें ग़ालिब     उजालों के शहर में जिनकी आँखे है वहाँ पर भी अंधो का बसेरा था     #जय_श्री_राम     #शुभ_रात्री,0,train
"एक अश्क का समुंदर छुपा था  इस पलकों के पीछे,  एक प्यार का सागर बसा था  इस दिल के भीतर,  कुछ अजनबी थे हम ये दुनिया के लिए  जो आया वो बस छल ही देता गया,  दिल इतना नाज़ुक था  की टूटे हुए दिल को भी लोग तोड़ते गए,  हम एक प्यार की आस में  खुद को ही मिटाते गए..  #पराग_ड्रीम  #हिंदी_शब्द",0,train
"पत्रकारों को उनकी औकात दिखाने की हिंमत अगर कोई विधायक या राजनेता करता है ,तो इसके लिए मीडिया और पत्रकारों का बिकाऊ और दलाली पना कारनीभूत है !",0,train
कोई बेबस नहीं होगा कोई लाचार नहीं होगा ~  जो अब तक हुआ है वो बार बार नहीं होगा ~  बस हुकूमत दरिंदो को चौराहे पर फाँसी दे ~  मेरा दावा है फिर कोई बलात्कार नहीं होगा ~    ~ शाहरुख सिद्दीकी   #shahrukhsiddiqui @user   #TwinkleSharma #JusticeForTwinkle,0,train
सरकारी भांड़ मानक तू दलाली कब छोड़ रहा है । तेरी दलाली का कारण तेरे मां बाप नहीं पर तेरा भड़वा होना है।,0,train
धारा 370 अस्थाई है चलो अमित शाह जी ने इसका जिक्र तो किया वरना गद्दार तो ????,0,train
"में एक गरीब धार्मिक आदिवासी मंगरु पाहन का मॉब लिंचिंग कर दिया। घटना राँची के कडरू की है। मृतक मंगरु पाहन धार्मिक प्रवृत्ति के इंसान थे और पूजा व दिहाड़ी मजदूरी करके जीविकोपार्जन करते थे।  निर्दोष आदिवासी शख्स को तीन मुस्लिम लड़के रमजान अंसारी उर्फ चरकु,मो साजिद उर्फ छोटू और अजमत",0,train
"If:  -most victims are Muslim or SC  -lynchings were over beard, gau, JSR, VM, etc  -Ministers garland convicts    Then they’re already communal/political. @user  doesn’t have an issue with the crime itself, he just doesn’t want us to call it what it is",0,train
#Israel की शराब कंपनी माका ब्रेवरी ने राष्ट्रपिता #MahatmaGandhi का अपमान किया है। कंपनी ने अपनी शराब की बोतलों और केनों पर महात्मा गांधी के चित्र छापे हैं। कंपनी की करतूत पर कड़ी आपत्ति जताई गई है।,1,train
तुम्हारी मईया तब क्यों नहीं चुदती  एक महीने से शहीदों के नाम पर वोट मांग रही बीजेपी पार्टी और उनके चटुकासर   Inhoneतो सिर्फ याद ही डिलस्य  है भेनचोद,0,train
"जनता विरोधी केजरीवाल ने 5 लाख रुपये सालाना का फ़्री इलाज दिल्ली में रोक दिया है , ऐसे नाकामपंतियो की अब राजनीतिक विदाई का समय आ गया है ...मित्रों बस अब 8 महीना बचा है , भाजपा को दिल्ली सरकार में लाना है और आते ही भाजपा पहले दिन ही आयुष्मान योजना लागू कर देगी...",0,train
"जब 200 बच्चों की मौत की गूंज अमेरिका UNO तक पंहुच गई तो छुपाने के लिये तबरेज कांड को अंजाम दिया,,,",0,train
बाबारामरहिम का जेल में अच्छा आचरण है -- बीजेपी   लेकिन गुफाओं के अंधेरों में आचरण बदल क्यों जाता है ?  @user @user @user,1,train
अंधेरों के सिरहाने पर ख्वाब बुनती हूँ      ज़िन्दगी के उजालों में उन्हें ढूंढती हूँ....    #कंचु  #हिंदी_शब्द,0,train
Pahle aap Pappu ke stah ab bua ke sath aapka bhi self kuch hai ya nahi,0,train
You better go to class and improve your English first!  भोसडीके!,0,train
"मादरचोद तेरा बाप था क्या, मन्दिर में मूर्तिया तोड़ने वाला ,बोल बे हरामजादे पाखंडी कुचार्या",0,train
"ग़ालिब की बीवी ने चुदाई से इंकार किया तो ग़ालिब ने शेर फरमाया  ले जाओ अपनी चुत को अपनी अम्मी जान के भोसड़े में,  ग़ालिब को हाथ के हुनर पर एतबार आज भी है।",0,train
सिर्फ सेना के 13 #जवान और #विमान ही नहीं लापता है    वह #हरामखोर #कुत्ते भी लापता है जो #सेना के नाम पर #वोट मांगते है,0,train
गुज़रते दिनों का नही...  ' बल्कि '  यादगार लम्हों का नाम है...  'जिंदगी'...।।  #हेलोजिंदगी  #शुभ_रात्री,0,train
'हुआ तो हुआ':- सैम पित्रोदा (काँग्रेसी)    ये हम नही कहते।,0,train
"अबे कितना बड़ा वाला सुलेमानी है बे तेरी ग़__ में ? अपना नाम रविश कुमार की जगह रंडी कुमार रख ले ज़्यादा अच्छा लगेगा.  आदमी वाली हरकतें हैँ नहीं तेरे अंदर, चूतिये ये बता NDTV झं___ है या तू, बेशर्म इतना है कि पूरे देश से गलियां मिलती है फिर भी @user बना बैठा है.",0,train
क्योंकि वहा योगी हे यह सूअर हमारी बिरादरी का पर साला ढोंघी हे,1,train
"कटूवे भेनचोद,बेटीचोद ओर मादरचोद होते हैं।                    ये तो हमें कब से मालूम था   इसमें नया क्या हैं ???",0,train
उन को पुरा हक है काँडम से चुदाई करे या तेल से,0,train
हार गए लेकिन जाति नहीं जाती !    यूपी में 2022 का संग्राम जातिवाद के नाम ?  #CastePoliticsReturns पर ट्वीट कीजिए   ताल ठोक के स्पेशल एडिशन 5:55 PM  @user पर @user के साथ,0,train
"#मालेगांव बम ब्लास्ट  पेटदर्द के चलते कोर्ट में  पेश नहीं हुई #प्रज्ञा_ठाकुर,  - ओह माय गोडसे...",0,train
"न जाने कितने ख्वाब दिखाए गए UP आम जनता को भी और मासूम भक्तो को भी?    मंदिर वही बनाएंगे, लेपटॉप देंगे, हत्या-बलात्कार गुंडागर्दी को जड़ से खत्म करेंगे राम राज्य लाएंगे?    UP के CM योगी जी प्रचार के चक्कर में लूट 20%, रेप 41% जैसे विकास कर चुके है।    जो किसी रावण राज में ही संभव है।",0,train
टैक्स छूट पाने के लिए कुछ करदाता फर्जी बिलों का सहारा लेते हैं  @user,0,train
"मुंबई में पिछले 24 घंटे में 26 की मौत, 44 साल में सबसे ज्यादा बारिश..  लापरवाह सिस्टम ने मुंबई को 'डुबा' दिया?  देशहित @user 8.30 PM",0,train
"चुप साली दल्ली  सुअर की पैदाइस भड़वी     हिन्दू होके मुस्लिम के तू रण्डी रोना करती है।  लेकिन वही मुस्लिम मंदिर तोड़ दिए,और तुम हिन्दू होके, चुप हो।    एक चीज याद रखना स्वरा  हिन्दू धर्म मे पैदा होकर तुमने जो प्रसिद्धि पा ली है  वही अगर तुम मुस्लिम परिवार में पैदा हुई होती तो कोई न जानता",1,train
स्थानीय लोगो के अनुसार तबरेज की मौत के बाद उस इलाके में ओवैसी के पार्टी के मुल्ले जम कर गुंडागर्दी कर रहे हैं वहाँ ओवैसी के गुंडों ने आके घरों मे घुस घुस के महिलाओं के रेप और हत्या की धमकी दी और ओवैसी जिंदाबाद के नारे लगाए    लेकिन मीडिया इस पर पूरी तरह खामोश है!,0,train
तरबेज अंसारी की मौत पर यूपी के शहरों में मुस्लिम समुदाय के लोग विरोध प्रदर्शन और हंगामा कर रहे हैं....  गंगाराम की हत्या के बाद भी हिन्दू शांत हैं...  अब बताओ कौन सी है असहिष्णु कौम??  कौन है देश की शांति बिगाड़ने में आगे??  @user @user @user,0,train
"अबे नंगा बाबा के लंड के प्रसाद, गटर के तरह तेरी शकल हैं,लगता कोई भांग पिययकर साधु ने तेरी माँ का बलतकार किया था जो तुझ से सूअर पैदा हुआ है,,,,पेपर में जो दिखा रहे हो ऐसा लिखने वाला पत्रकार गलत लिखा है तो, यदि लिखा हुआ सही है तो ऐसा करने वाला मुसलमान भी सुअर से पैदा हुआ होगा",0,train
ये 'भडवा'सुपारी मिडीया का पत्तलकार रोज हिदू-मुस्लिम करता है।ईसकी औकात चिल्लाने तक सीमित है। ये भडवा'साप्रदायिक'रंग दे रहाहै.,0,train
कौन है यह हरामी देशद्रोही मुल्ला इसकी इतनी हिम्मत कैसे पड़ गयी,1,train
ये रुस की एक ट्रेन है जहां पर इस्कान मंदिर वालों ने श्री कृष्ण जी का चित्रण इंजन में करवाया है।ताकि दुनिया भर के लोग कृष्ण जी के बारे में जान सकें।  अब जरा सोचिए यह इंजन अगर भारत में होता तो संसद से लेकर पूरे देश में बवाल होता   कड़वा है पर सच है कि हम स्वयं ही हमारे पतन का कारण है,0,train
"Totichor जी  आप निराश न हों ,Totichor जीआप निराश न हों ,…",0,train
Happy Birthday @user Ji  माँ जगदम्बा का आशीर्वाद आप पर सदैव बना रहे,0,train
कितना easy सवाल भारत क्या पूरे विश्व को पता है   DALAL = E = HIND   कोन है  भाष्कर का भड़वा दामाद,0,train
Ye wahi h na jo aapki sarkar m kh rhe thein ki UP ab akhilesh se sambhal nhi rha..or aaj ki stithi dekhkr koi reaction nhi inke paas.,0,train
नांदेड़ महाराष्ट्र: देश में बढ़ रही मॉब लिंचिंग की वारदातों के ख़िलाफ़ एवं झारखंड के सरायकेला में लिंच किए गए तबरेज़ अंसारी के इंसाफ़ के लिए आज नांदेड़ कलेक्टर ऑफिस के सामने ए आई एम आई एम और वंचित बहुजन आघाडी ने धरना-प्रदर्शन किया. @user @user,0,train
अबे हरामी ये जर्सी कोई राजनीतक नहीं थी पर तेरे जैसे हरामखोरी भीम मीम बालों के पिछवाड़े में पता नही क्यों पेट्रोल लग रहा है,0,train
"#प्रज्ञा_ठाकुर  बनना आसान है,  #महात्मागांधी  होना मुश्किल।",0,train
बीजेपी ने तो जय श्रीराम का नारा लगाया जो कि सही हैं क्योंकि इससे करोड़ों लोगों को भाईचारा का संदेश मिला।मगर जो लोग #देश तोङने वाले नारा लगाए उनको क्या कहेंगे #नीच राजनीति का उदभवकर्ता या #देश द्रोही  #जय श्रीराम,0,train
