text,label,split
"एसे #नीच और #घटिया लोगो को #चौराहे पर   सबके सामने #फांसी टाँग दो,,   ओर पुरे #देश मे #लाइव दिखाओ ।",0,train
@user जी इस ग्रुप की इतनी पिटाई करो की सालो को नानी याद आजाये.. हरामी यों को.    जय श्री राम.,0,train
"जय श्री कृष्ण           तन दुखी मन दुखी        दुखी, धन को दास         थोड़े थोड़े सब दुखी        सुखी कृष्ण को दास!!      जय श्री कृष्ण             #सुप्रभात",0,train
अगर 17 जातियों को sc में शामिल किया गया है तो उसके हिसाब से आरक्षण का अनुपात भी बढ़ना चाहिए !    सहमत हो तो retweet करो     @user   @user   @user   @user   @user   @user   @user   @user,1,train
"उपेंद्र कुशवाहा ने खोला मोर्चा, मुजफ्फरपुर से शुरू की 'नीतीश हटाओ-भविष्य बचाओ' पदयात्रा    #Bihar   http …",0,train
खोजते #कमीने #शब्दों को  मत लिखो।    अगर पैसे के लिए  या #शोहरत के लिए लिख रहे हो  मत लिखो।    अगर लिख रहे हो  कि ये रास्ता है  किसी औरत को बिस्तर तक लाने का  #तो_मत_लिखो।    अगर बैठ के तुम्हें  #बार-बार करने पड़ते हैं सुधार  जाने दो।,0,train
"बिल्कुल सही बोली,  लेकिन रोहित सरदाना जैसे भड़वा को कौन समझायें!",0,train
आज दिनांक 28-06-19 को AIMIM जिला बहराइच द्वारा तबरेज़ अंसारी को मारे जाने के खिलाफ जामा मस्जिद से शांति मार्च निकाला गया और सिटी मजिस्ट्रेट को ज्ञापन दिया गया। ज़िसमे  जिसमें जिलाध्यक्ष शमीम मिर्ज़ा  @user @user और सभी कार्यकर्ता मौजूद रहे  @user,0,train
जयपुर हस्टल की चुदाई 2 s,0,train
"ज़िन्दगी चैन से गुज़र जाए ,    अगर तू मेरे ज़हन से उतर जाए...  #तुम",0,train
"#Bihar वालों,   जिस 1 दारु की बोतल के लिए वोट दिया है, आज उसी की कीमत तुम्हारी औलाद ही चुका रही है।",1,train
"दुनिया का बोझ जरा दिल से उतार दे,    छोटी सी जिंदगी है हँस के गुजार दे....    राधे राधे  जय श्री कृष्ण दोस्तो  @user",0,train
माना कि अंधेरो की बस्ती में जुगनुओं का बसेरा था     पर इसे क्या नाम दें ग़ालिब     उजालों के शहर में जिनकी आँखे है वहाँ पर भी अंधो का बसेरा था     #जय_श्री_राम     #शुभ_रात्री,0,train
ये साला धर्म है या फिर रंडी भड़वों का कोठा।,0,train
देखिए मेरे साथ अभी  “अबकी बार भोजपुरी सितारों की धार”ठीक 12:30 बजे ।@user @user @user,0,train
".@user चीफ @user ने ज्वाइन किया @user , सिर्फ इस एक अकाउंट को किया फॉलो",0,train
अमरनाथ यात्रा के लिए कल रवाना किया जाएगा श्रद्धालुओं का पहला जत्था    #AmarnathYatra   http …,0,train
BC  वो असामजिक तत्व नही ह।  मुल्ले है हरामी।  और की गुंडे नही समज़दार मुल्ले ह। ५०० मुल्ले सब गुंडे थोड़े थे। और पूरे होशोहवशा म थे।   बस तेरे बशकी मुल्ला कहना नही है।,1,train
Masterpiece...    पठान ने एक दिन अपने नौकर की गांड मार दी  नौकर:मैंने क्या गलती की हज़ूर  पठान:तेरी गलती के लिए हम कब तक इंतज़ार करेंगे भोसडीके,0,train
"वायुसेना के विमान “ग़ायब” होने से आज पूरा देश चिंतित है, लेकिन बेहद “अफ़सोस” की बात ये है, कि 3 दिन बीत जाने के बाद भी “सरकार” ये नहीं बता पा रही है, कि “आख़िर”  हुआ क्या है...........?",0,train
"बड़ी खबर LIVE: भारी बारिश की वजह से पुणे में दर्दनाक हादसा, दीवार ढहने से 15 की मौत, कई लोग घायल #Maharashtra #Pune #PuneRains",0,train
"कभी देखे हो -  'चमार चाट भण्डार'  'भंगी टी स्टाल'  'खटीक चाउमीन कार्नर'  'पासी जी का शुद्ध ढाबा'  जिस दिन ऐसा दिखाई देने लगेगा,  #अर्टिकल_15 समझ जाओगे।  संविधान पढ़ो ,  पिक्चर से भी कहीं ज्यादा रोचक है।  @user  @user @user @user @user @user",0,train
"केजरीवाल को इतने थप्पड़ पड़ गये,  मजाल हो बंदे को एक बार भी डर लगा हो।  दिल्ली के है भैनचोद गुनगुनाकर फिर  लग जाता है काम पर",0,train
आज रविवार को मैंने 16 घंटे काम किया.. you can click for details   http …,0,train
"बंगाल में एक बच्चे की मौत पे तमाशा करने वाले मुज्जफरपुर में 20 बच्चे मर चुके है??    कहां मर जाते हो जहां BJP सरकार नही होती है, क्यो नही करते डिबेट? क्यो नही चेक करते सरकार का DNA??    नीच पत्रकारों चुनाव खत्म हो गया है जरा सी भी शर्म है तो इंसानियत दिखाओ? सवाल करो।",0,train
"जायरा ने अल्लाह के लिए फिल्में छोड़ी पत्थरबाज बनेगी,नुशरत ने सनातन धर्म अपनाया जनता की सेवा करने के लिए।  #जय_माँ_भारती",0,train
Agla kadam bad maiPahle samajwadi ko e v m safety k liye rat din ki duty lagaye,0,train
ये वो हरामी है जो अपनी ही माँ के गर्भ को लज़्ज़ित कर कुछ चन्द वोटो के लिए उसे ही कोठे पर बैठाने में लगा हुआ है पर सुन जयचंद तेरे जैसे सुअर को इस देश की किसी भी माँ की आन से खेलने नही देंगे।,0,train
भारत दुनियाँ का एकलौता ऐसा मुल्क है जहाँ 14% अल्पसंख्यको की खुशी केलिए 86% बहुसंख्यको की इच्छाओ और उनके अधिकारों की हत्या होती है।    काश्मीर मे सेना पर पत्थर सिर्फ इसलिए चलाये जाते है क्योंकी पत्थर चलाने वालों को पता हैकी उनके साथ दुनिया भर की इस्लामिक शक्तियाँ एवं सेकुलर जमात है।,1,train
रानी लक्ष्मीबाई जी की पुण्यतिथि पर उन्हें शत-शत नमन।    @user @user @user @user  @user @user @user @user  #LakshmiBai   #RaniLakshmiBai   #RaniLaxmiBai   #लक्ष्मीबाई   #रानी_लक्ष्मीबाई,0,train
आज पता चला मणि शंकर अय्यर ने #नीच क्यों बोला था।,0,train
"कटूवे भेनचोद,बेटीचोद ओर मादरचोद होते हैं।                    ये तो हमें कब से मालूम था   इसमें नया क्या हैं ???",0,train
#Tweet3132V291  दर्द की भी  अपनी एक अदा है वह भी सहने वालो पर फिदा है .....  #हिंदी_शब्द,0,train
संकट हरै मिटे सब पीड़ा.. जो सुमिरै हनुमत बलबीरा..   #जय_श्री_राम  #शुभ_रात्रि,0,train
"Vinod Kapri shares another fake  adoption story on his time line. This time @user group falls victim who releases the story that 'Journalist couple adopts the baby girl.' Nagore collector on record says, no adoption procedure initiated till date.  #Shameonhumanity",0,train
"पहले आप की जमात से और धार्मिक गुरुओं से पूछो की जिस मुस्लिम भीड़ ने धार्मिक उन्माद फैलाया,मंदिर में तोड़ फोड़ की क्या उनको इस्लाम से बेदखल किया जाएगा? इन पर फतवा जारी किया जाएगा? नहीं करेंगे. आप की जमात का एक बड़ा हिस्सा नमक हरामी करने में लगा है और ये आईने की तरह सच है.",0,train
"#Nautanki     उफ़, रंडी रोना शुरू   OF   @user GutterDynasts @user +TADAKKA & PidiPig SLAVES        PEOPLE HAVE NO INTEREST, in SWINES, #GoToHell",0,train
"Sabka sath, sabka vikas,  Sabka vishwas, puri tarha se khokla ho chuka hai: @user MLA @user on Telangana BJP MP Soyam Bapu Rao, says ‘Will behead Muslims who are harassing tribal women. #हल्ला_बोल with @user at @user  @user",1,train
माननीय राष्ट्रीय अध्यक्ष जी मैं आपसे निवेदन करता हूं कि अब जमीनी संघर्ष का समय आ चुका है हमको जमीनी स्तर पर संघर्ष करना होगा और कार्यकर्ताओं कि दिल की बात भी सुनी होगी मैं समाजवादी पार्टी का छोटा सा सिपाही हूं समाजवादी पार्टी के कार्यकर्ता आप की ओर आशामाननीय राष्ट्रीय अध्यक्ष जी मैं आपसे निवेदन करता हूं कि अब जमीनी संघर्ष का समय आ चुका है हमको जमीनी स्तर पर संघर्ष करना होगा और कार्यकर्ताओं कि दिल की बात भी सुनी होगी मैं समाजवादी पार्टी का छोटा सा सिपाही हूं समाजवादी पार्टी के कार्यकर्ता आप की ओर आशा…,1,train
देश में आप के सहयोग से गठबंधन सरकार बनने जा रही है। लोकतंत्र और संविधान को बचाने के लिए देश की जनता की तरफ से मा0 राष्ट्रीय अध्यक्ष जी सपा को अग्रिम बधाई।,0,train
"बांग्लादेश को 28 रनों से मात देकर सेमीफाइनल में भारत, जसप्रीत बुमराह ने जीता दिल    #INDvBAN   http …",0,train
यह मोदी नाम कुछ पिता है क्या है ।भड़वा पत्रकार,0,train
#askexperts why this bastard Akash Chopra is there in commentary..he always speak gutter ...khud to BC kuchh Kiya nai.chutiya..irritating,0,train
विमल को देखने आए नीतू के पिता बोले     हमें विमल पसंद है...     तभी विमल के बापू बोले पर हमें तो कमलापसंद है     नीतू का बाप झिला उठा ओर बोला भोसडिके रिश्ता हम नीतू बिटिया का लाए है उसकी माँ कमला का नहि,0,train
"अबे भोसडीके, वो बच्चा अपनी मेहनत से एग्जाम पास किया है,उसके पिताजी को मनरेगा में इतने पैसे  नही मिलते जिसे बड़े गर्व से बता रहा तू, बेचारे ने किताबे भी किसी से मांग के पढ़ी होगी",0,train
जब पेल देता है तो तुम सब सुअरो की तरह चिल्लाने लगते। अभी तबरेज का ही देख लो। चोर को पेला तो हर तरफ रंडी रोना चालू।,0,train
समय समय की बात है    एक समय लोग प्यार करके #अमर हो जाते थे    फिर प्यार में #अंधे होने लगे    और अब प्यार में #तोतले होने लगे है    'अले मेला बाबू...गुच्छा हो गया'    #SoSorry   #मजाक_तक,0,train
पूर्णिया- सीमांचल एक्सप्रेस ट्रेन हादसा  पूर्णिया जंक्शन ने जारी किया हेल्पलाइन नम्बर जारी  06454232558 फोन कर ले सकते हैं जानकारी  7541806365 फोन कर ले सकते हैं जानकारी।     @user @user,0,train
"मैं ना हिन्दू ना मुसलमान मुझे जीने दो,   दोस्ती है मेरा ईमान, मुझे जीने दो....  - शाहिद कबीर     #IndiaAgainstLynchTerror",0,train
हाँ आप का अधिकार है दुर्गा मंदिर तोड़ सकते है  हम हिंदुओ से नमक हरामी की हद हो गयी,0,train
जिन्दगीमा जो जो आउछ्न सबै मेरो आफ्नै handwriting जस्तै भएका छन सुरुमा राम्रै लाग्ने पछी पछी के हो के हो कस्तो हो कस्तो आफै नबुज्ने   #शुभ_रात्री,0,train
#AIMIM MLA Adv @user Attend Eid Milan Event. Organised By Police Family Welfare Committee And #ShansherKhan Sahab.,0,train
"#Maharashtra के #Pune में भारी बारिश की वजह से एक बड़ा हादसा हो गया। पुणे के कोंढवा में दीवार गिरने से करीब 17 लोगों की मौत हो गई है, जबकि कई लोग घायल बताए जा रहे हैं।    #PuneRains",0,train
"चुनाव के पहले आख़िरी ‘मन की बात’ में मैंने कह दिया था कि मैं कुछ महीनों के बाद फिर आपके पास आऊँगा।Actually मैं आया नहीं हूँ - आप ही मुझे लाए हैं, आपने ही मुझे बिठाया है और आपने ही मुझे फिर से एक बार बोलने का अवसर दिया है:  पीएम @user #MannKiBaat",0,train
भोसडीके कटवे।  तू अपनी भांजी भतीजी के साथ यही करता होगा सुअर की शक्ल वाले।  या तेरे घर मे बकरी पाली जाती होगी मादरचोद,0,train
जो लोग #पाकिस्तान जाना चाहते हैं चले जायें।चाहे वो किसी #धर्म के  हो।अगर #हिन्दुस्तान में रहकर पाकिस्तान के आतंकियों का साथ दिया।फौज तो बाद में मारेगी हम भारतीय लोग उसको #कुत्ते की मौत मारेंगे ।    जय हिन्द जय भारत,1,train
मजहब नहीं सिखाता फिल्मों में काम करना ?     कट्टरपंथी सोच ने छीना सीक्रेट 'सुपरस्टार' ?    देखिए #सीधासवाल @user के साथ    आज शाम 5 बजे,0,train
जिस अनुप्रिया पटेल को आज मंत्री ना बनाकर कुर्मी समाज की अनदेखी की गयी है उनके पिता सोनेलाल पटेल को 23 अप्रैल 1999 को कल्याण सिंह की भाजपा सरकार मे पुलिस ने मार मार कर हाथ पैर तोड़ दिया था तब अतीक अहमद ने उनकी खुलेआम मदद की थी।    भाजपा को वोट देने का कुर्मियों को ये कैसा सिला मिला!,0,train
"प्रधानमंत्री जी और गृहमंत्री जी को बताना चाहिए, क्या ऐसे ही डर के साये में #NewIndia की परिकल्पना की जाएगी ?  @user @user    #TempleTerrorAttack",0,train
अपने दूसरे कार्यकाल में पहली बार आज 'मन की बात' करेंगे PM मोदी  #MannKiBaat   http …,0,train
"चमकी बुखार: विधानसभा परिसर में आरजेडी का प्रदर्शन, तेजस्वी यादव नदारद     #biharencephalitisdeaths   http … (रिपोर्ट- @user )",0,train
Habeeb-E-Millat Janab Akbaruddin Owaisi Ke Janam Din Ke Mouqe Per #KanchanBagh Aur #Upuguda Divisions #Chandrayangutta Constituency Me Bach'oun Ke Liye Ta'aam (Lunch) Ka Intezam Aur Habeeb-E-Millat Ki Sehat Ke Liye Qususi Dua'oun Ka Ehtemam Kiya Gaya @user @user,0,train
"अरे मादरचोद,  जसा ट्वीट तसा रिप्लाय",0,train
"रे माधरचोद @user क्या तेरी Gand में इतना दम नहीं की तू भड़वे अपने पापों को टेग करके ट्वीट करे, राहुल को तो बड़ी जल्दी कर दिया। हिम्मत है तो BJP वालों को टेग कर तेरे को छट्टि का दूध याद दिला देंगे।  दलाल, भडवा ओर चाटूकार भाग मानक भाग !! http …",0,train
चमकी बुखार के चलते बिहार में सियासी घमासान थम नहीं रहा है,0,train
इसलिए तो कहते हैं स्कूलों में हिंदी को ज्यादा से ज्यादा पढ़ाई जाए बच्चों की हिंदी सुधरे। गाली तो  #कमिने  #दोस्ती सिखा देते हैं।     #Follow me % #Follow Back,0,train
महाराष्ट्र: 'जय श्री राम' बुलवाने और मुस्लिम कैब चालक की पिटाई के मामले में तीन लोग गिरफ्तार!!    न झारखण्ड दोषी न महाराष्ट्र दोषी; दोषी है आरएसएस का हत्यारा-गुंडा गैंग!! यह सब आरएसएस के भाड़ेकेटट्टू कर रहे!!  #BanRSS   #BanTerroristRSS  #BanEVM,0,train
तुम बेवफ़ा होती रही और भेनचोद शराब जाम-दर-जाम फ़ना होती रही...,0,train
तू हवा के रुख पर चाहतो के दीप जलाने कि जिद न कर  ये कतिलो का शहर है यहाँ मुस्कराने कीं जिद ना कर. #Lynchistaan #India  @user  @user @user,1,train
Tera baap  jo rooj krta h wo mat krn bhosdi kai cheenal.. गांडु इंसान है तू रंडी का बच्चा है  तू,0,train
देवर का लंड चुसाई और चुत चुदाई 14 720p,0,train
रूठे दोस्त को मना लेना चाहिये #Kejriwal जी क्योकि वे     #कमीने सारे राज़ जानते है #आप को समर्पित,0,train
"अगर आप भी हैं क्रिकेट क्रेजी, तो आप रोज़ जीत सकते हैं PAYTM कैश ईनाम.  #PlayAndWinOnZee, क्लिक करें - http",0,train
तेरी माका भोसड़ा हिजड़े की औलाद कहा से इतना दोगला पन लाते हो बे .मोदी जी इश्के जैसे लंड पकड़ने के सवाल का जवाब नहीं दे पाएंगे तेरे जैसे लंडूरा मिलने के लिए तरसते हे भेनचोद चमचे साले,0,train
.@user केजरीवाल सरकार की तर्ज पर झारखंड की BJP सरकार खोलेगी 'मोहल्ला क्लिनिक'    http …,0,train
"किसी भी लोकतांत्रिक देश में चुनाव कभी कोई समस्या नहीं हो सकती है और न ही चुनाव को कभी धन के व्यय-अपव्यय से तौलना उचित है। देश में ’एक देश, एक चुनाव’ की बात वास्तव में गरीबी, महंगाई, बेरोजबारी, बढ़ती हिंसा जैसी ज्वलन्त राष्ट्रीय समस्याओं से ध्यान बांटने का प्रयास व छलावा मात्र है।",0,train
