text,label,split
#CWC19 #INDvBAN बांग्लादेश के इस खिलाड़ी के खिलाफ सचिन ने किया टीम इंडिया को 'एलर्ट'  @user @user @user   http …,0,train
"अबे I.T cell  वाले तुम लोग को बैगन नहीं लम्बे गदा के लुंड के ज़रूरत है तुम्हारे घंड में डेल और मुँह से निकले , चूतिये साले",0,train
तबरेज़ अंसारी के मौत पर रंडी रोना करने वाले भडुओ से पूछना है अब दिल्ली में मंदिर पर हमला करने वालो के खिलाफ आवाज क्यो नही निकल रही,0,train
"तेरे जानू लोग कर रहे है अनपढ़ गवर सिर्फ पेलवाना जानती है पढ़ना लिखना नहीं.बलात्कार और हत्या करने वाले up में उसमे छोटी बच्चियां ज्यादा है लोग है ..आमिर,शारुख,सलमान,मुहमद,इम्तिएज़ सब्बीर,नासिर,अजहर,मोहसिन..अब बता मुँह लुंड घुस गया न अब इन के खिलाफ पोस्ट्स कर ये मुस्लिम है",0,train
"हम भारतीय बासी रोटी तो खा सकते हैं किन्तु ये 5साल पुराना बासी,बेकार,और झूठा भा ज पा का जुमला मेनिफेस्तो हजम नही हो पायेगा ।जनता इस बार इस फरेबी पार्टी को सिरे से नकार  देगी @user @user @user @user @user @user @user",1,train
क्या मुस्लिम समुदाय का नौजवान हिन्दू बनके कोई मुस्लिम लड़के को पकड़के एक दो थप्पड़ मार्के 'जय श्रीराम' बोलने के लिए मजबूर तो नही करा रहे हैं हिन्दू समाज को बदनाम करने के लिए। और ये भी हो सकता हैं इसमे कुछ पोलिटिकल ओर मीडिया का भी हाथ हैं हिन्दू को बर्बाद करने के लिए।  सावधान ....,1,train
उओ गद्दार ओ गद्दार अरे ओ bsd वाले गद्दार !  मुँह बंद रख वरना तेरे मुह में किसी अफ्रीकी का लुंड और वो भी टट्टे सहित घुसेड़ दूँगा ! साले सांस भी नही ले पायेगा !,0,train
"नहीं, ये कटुवे मादरचोद गद्दार, बेईमान, हरामी होते ही हैं।   गांडू पैगम्बर ने इन कुत्तों को यही सिखाया है। अत्याचार, दुराचार, हत्या, लूट पाट, दूसरे की सम्पत्तियों को छीनना यही आसमानी किताब की शिक्षा है।",0,train
"#GhantiBajao में आज रात 10 बजे @user के साथ देखिए    जायरा का मजहब-मजहब... तो मुमताज,नर्गिस, मीनाकुमारी का धर्म क्या ?    जायरा को अल्लाह ने नहीं 'कठमुल्लाओं' ने भटकाया !",0,train
"phle evm ko protect kro sir,Fir koi kadam uthana,Nhi to kadam hi nhi honge uthane k liye",0,train
बाॅलिवुड के हिरो/हिरोईन ओर डायरेक्टर को दिखाओ ये..भिखारीयो को बाॅलिवुड मे लाता हो.पैसे वाला बनाते हो. ओर वो देखो कैसे तुम्हारे जले पर नमक छिडकते है..भेनचोद ने आतंकवादी हमले की निंदा नही की पर बेवकुफ इम्रान की तारिफ की.आतंकवादी देश है पर उनके देश के साथ गद्दारी नही करते वो.,0,train
पाकिस्तान की गान्ड मार चुके है आज बांग्लादेश की बारी है।,0,train
"SC ने चुनाव आयोग से EVM, VVPAT से संबंधित याचिका पर दो हफ्ते में मांगा जवाब",0,train
#CWC19 #INDvENG जान बूझकर हारने वाले बयान पर कपिल देव ने दिया पाकिस्तानी क्रिकेटर्स को करारा जवाब.   @user @user @user http …,0,train
@user #प्रज्ञा_ठाकुर के बयान से किनारा करके केवल ढोंग कर रही है कौन नही जानता है कि भाजपा में ऊपर से नीचे तक आज़ाद भारत के पहले आतंकी नाथूराम गोडसे की हिंसात्मक विचारधारा को मानने वाले नेता भरे पड़े है।  @user   @user @user @user @user,0,train
बांग्लादेश को 28 रनों से हराकर भारत 7वीं बार सेमीफाइनल में  http,0,train
"मॉब लिंचिंग मे मारे गए लोगो को दिल्ली वक्फ बोर्ड 5-5 लाख देगा,    तुम मंदिर मे रोजा खुलवाना,मारे गए लोगों के श्राद्ध मे स्वादिष्ट भोजन कराना,समय बचे तो वृक्षा रोपण,वोटर जागरूकता अभियान,  जगराता एकादशी और सत्यनारायण कथा कराना।    कितने हिन्दू हिंदुत्ववाद पर मारे गए कोई संगठन न आगे आया।",1,train
जब दिल्ली की तस्वीरें दिखला दी थाने की भाजपा नेता सब पहुँच गए है एक भड़वा बोल रहा है कि क्या होगा पकडे जाएंगे फिर छूट जाएंगे-हो गया न्याय?ऐसे सूअर के बच्चो को अपनी मित्र सूचि में मत रखिये-इन कुत्तो को आप नहीं समझा पाओगे-पक्के हरामजादे है इनकी प्रोफाइल भी असली नहीं है ज्यादातर की।,0,train
बेटे की गुंडागर्दी पर सवाल पूछा तो न्यूज़ 24 के ऐंकर से बोले कैलाश विजयवर्गीय तुम्हारी औक़ात क्या है?    अब हम तो कैलाश विजयवर्गीय का इस बयान की सराहना करते है बिल्कुल ही सटीक जवाब दिया।    बताओ दल्ले पत्रकारों क्या औकात है तुम्हारी??,0,train
"ये नीच पैदा ही हुआ था, या पैदा होने के बाद महा नीच बना।  इस खबीस के बाल बच्चे होते तब तो इसे पता चलता न कि बच्चो के मरने का दर्द क्या होता है।  #नीच",0,train
एक महिला ने योगी जी से प्यार का इज़हार वाली बात कही और उसका वीडियो एक पत्रकार ने शेयर की और उसे जेल हो गई??    लेक़िन देश का विमान 5 दिन से गायब किसी को कुछ नही पता मीडिया धोनी के ग्लब्स मे घुसी है? मोदी घूम कर रहे है।    इसपे किसी ने कोई कार्यवाही नही की? यही है नामर्दो की सरकार।,1,train
"तेरे जैसा हरामखोर हरामी अपने बहन के साथ ऐसा करता होगा इसलिए दूसरे पर कीचड़ उछाल रहे हो,वेश्यावृत्ति की उपज हो तुम तेरी सोच से यहीं लगता है।।",0,train
"सर ,हम शर्मिन्दा हैं कि हम अपेक्षित परिणाम देने में कामयाब नही हो पायें।हम सत्ता के दुरूपयोग,पैसे,प्रलोभन का मुकाबला नही कर पाये तथा EVM का दुरूपयोग नही रोक पाये।हम क्षमा प्रार्थी हैं।।",0,train
माँ #गंगा का भी #दुर्भाग्य है जो  जो #नीच लोगो के #शहर #ग़ाज़ीपुर  होके #गुजरती है।।  इस #शहर को तो बस गन्दे-गन्दे #नाले छू के   गुजरने चाहिए।।।  #ग़ाज़ीपुरवासियो_का_दुर्भाग्य,0,train
बरगद की शाख़ तोड़ दी   आँधी ने पिछली रात     इस वास्ते आज वो   गाँव का बूढ़ा उदास है,0,train
दिल्ली के मुखर्जीनगर पिटाई मामले में पुलिस ने रिपोर्ट तैयार कर ली है  @user,0,train
राम रहीम ने खेती करने के लिए पैरोल की मांग की..    इस हिसाब से तो हनीप्रीत की भी पैरोल बनती है..   खेत में रोटी लेकर कौन जायेगा     @user @user @user @user @user @user @user @user @user @user,0,train
"उस्मान मियाँ के पीठ में दर्द हुआ    अल्ट्रासाउंड केलिए radiology पहुंचा..    डॉ: “कमीज़ उतारो, पजामे का नाड़ा खोलो, उल्टे लेट जाओ...”    उस्मान मियाँ :- “ मे के रिया था के पहले अल्ट्रासाउंड कल्लेते।”",0,train
तू एक दिल्ली कि जीत  गांड़ में लेकर बैठा रहियो....वह कौन सी स्टेट है जहां कंजरी ने अपनी मा नहीं चुद्वाई?? और  ऊपर से बीसी माफी मांग कर पतली गाली से निकाल जाता है ? लुंड साला,0,train
’اے اﷲ! تو نے میری روح پیدا فرمائی اور تو ہی اسے فوت کرے گا، تیرے ہی لیے (تیرے ہی قبضے میں) اس کی موت اور حیات ہے اگر تو اسے زندہ رکھے تو اس کی حفاظت فرمانا اور اگر تو اسے موت دے تو اسے معاف فرمانا۔ اے اﷲ! بلاشبہ میں تجھ سے عافیت کا سوال کرتا ہوں۔‘‘,0,train
तेरी मर्यादा को तेरी गांड में घुसेड़ दूंगा समझा बे!!  कुछ भी उटपटांग लिखते रहते हो ???,0,train
"मादरचोद चपड़गंजु , डेल्ही के स्कूल इंदिरा गांधी और शिला दीक्षित के ज़माने से वर्ल्ड क्लास रहे है, क्योंकि राष्ट्रीय राजधानी है, तो उन्होंने पहले से ही बेहतरीन स्कूल और कॉलेज बनाये, तूने आके घंटा कुछ नही किया बे",0,train
"Hello @user you really need to put this lady behind bars for sake of peace of several citizens. She has beaten up,  abused, harassed just too many people across the country. Please act. She sounds extremely dangerous.",0,train
Bst जैसे सुअर के मुह में मूट देना चाहिए,0,train
People voted to enjoy sufferings and they badly deserve it .,0,train
Ghar ka mukhya kharab hai to sadasya to kharab rahenge hi,0,train
#नीच कहने पर मणिशंकर को निष्कासित कर दिया गया था #बापू के हत्यारे #GODSE को देशभक्त कहने पर क्या #प्रज्ञा भी निष्कासित होंगी ? @user @user,1,train
देश में #Demonetization के बाद से #Corruption और गैरकानूनी गतिविधियों में बढ़ोत्तरी हुई है। #FinanceMinister निर्मला सीतारमण भी मानती हैं कि नोटबंदी के बाद गैरकानूनी गतिविधियों में बढ़ोत्तरी हुई है।,0,train
मेरे दिल में भी किसी का घर होवे  कदे वो आये कदे जाये  कुछ मेरी सुने  कुछ अपनी सुनाए,0,train
भारत का मिडिया हिन्दू विरोधी है    भारत का मिडिया सिर्फ मुसलमानो के लिये आवाज उठाता है    भारत का मीडिया सुअर मुसलमानो का दलाल है    गद्दार मीडिया सुअर मुसलमानो की नाजायज औलाद है भारत का मिडिया,1,train
".@user का एक और रिकॉर्ड, एक World Cup में 4 शतक लगाने वाले पहले भारतीय बने  #CWC19",0,train
"मोदी जी कि शय मैं ही सब कुछ हो रहा है, @user विधायक #AIMIM on #Lynchings     #stoplynching #stopthehate #equalityforall #India     @user   @user",0,train
दिल्ली बालो चुतिये हो क्या पेलो मादरचोद मुल्लो को,0,train
मीडिया बस मोदी के एक-एक बात को पकड़ के ट्वीट करने में लगा हुआ है? तारीफों के पुल बाधने मे लगी हुई है।    लेकिन लीचिंग पे मोदी जी बोलने आए न ये दल्ली मीडिया वाले सवाल करने आये है। देश मे मुस्लिम-दलितो को टारगेट किया जा रहा है।    लेकिन कोई भी भाजपाई इसपे बोलने नही आ रहा है। शर्मनाम!,1,train
जिसे रेन कोट पहिन के नहाते बोला था आज उन की  जरूरत पड गई ।  हमारे आदरणीय पूर्व प्रधानमंत्री मनमोहन सिंह जी से मिलने मोदी जी उनके घर पहुचे और उनसे देश की बिगड़ती आर्थिक स्थिति में सुधार लाने का उपाय पूँछ रहे  हैं ।,0,train
वाह सुअर @user अपनी का चौराहे पे मुजरा करवा दिया।  पर जिन शांतिदूतों ने चावड़ी बाजार में 100 साल पुराने मंदिर को नेशतानवुत कर दिया।  उसपे तेरी असहिष्णुता तेरी लौ की में घुस गई।  ह    रा   मी कब तक,0,train
"पतझड़ में जैसे  झड़ते रहते हैं पत्ते शाखों से,  वैसे ही रुक नहीं रहे हैं आंसू  इस लौंडे की आंखों से  हे प्रभु उठा ले इसे  वैसे_ #कन्हैया_कुमार की हालत नाजुक,  परसों से नही रुक रहे दस्त ,  डॉक्टर ने लगाए औकात में रहने के इंजेक्शन    @user",0,train
जो सपने देखे वो पूरे कर रहे हैं.. और भी बहुत कुछ करने हैं   http …,0,train
ऐसे #भड़वा #दलाल एंकर का अस्तित्व सिर्फ और सिर्फ भाजपा के तलवें चाटने की वज़ह से है..,0,train
इस्लामिक आतंकी थे वो हरामी ये आतंकी जहाँ भी थोड़े ज़्यादा होते हैं वही आतंक फैलाते है इन आतंकियों को देश से बाहर फेंकना चाहिए,0,train
"केजरीवाल चोर तबरेज़ अंसारी के परिवार को पैसा और नौकरी दे रहा हैं     जबकी अंकित सक्सेना का परिवार अभी भी मुआवज़े का इंतेज़ार कर रहा हैं     साला दल्ला वोट के लिए अपनी माँ , बहन और बेटी को भी मुल्लोह के हवाले करदे ऐसा भड़वा हैं यह",0,train
"हौज काजी में स्थिति अभी भी तनावपूर्ण, स्थानीय सांसद डॉ. हर्षवर्धन ने क्षेत्र का दौरा किया",0,train
"#धारा370 का सच, जिस वक्त कश्मीर भारत अंग बना था। तब भारत का अपना संविधान ही नही था। देखिए सुनिए 370 की सच्चाई @user की जुबानी। ये हटा कर देशद्रोहियों की दूकानें बंद की जा सकती है। @user, @user के झूठ का पर्दाफाश।    #जय_हिंद  #वंदेमातरम्",0,train
हार गए लेकिन जाति नहीं जाती !  आरक्षण पर राजनीति से बनेगा 'न्यू इंडिया' ?  #CastePoliticsReturns पर ट्वीट कीजिए   ताल ठोक के स्पेशल एडिशन 5:55 PM  @user पर @user के साथ,0,train
मादरचोद फ्लिपकार्ट मेरा पैसा कब मिलेगा   Id    wbdb 1163  जल्दी बता मादरचोद,0,train
"मुंबई मेरा नाम, ठहर गए सारे काम ,  मायानगरी की यही कहानी, हर साल पानी ही पानी !!  #ATVideo   अन्य वीडियो: http",0,train
यह मोदी नाम कुछ पिता है क्या है ।भड़वा पत्रकार,0,train
"How डरा हुआ मुसलमान is under #Modi regime?    Shahid, the gang leader, his wife (whose identity was not revealed by police), Ramjaani and Sufiyan were arrested in Greater Noida for Stealing Over 100 Cars In Noida.",0,train
¸.•''•.¸               दिल ने कहा की          कोई #याद कर रहा है    मैने #सोचा दिल           #मजाक कर रहा है    फिर जब आई #हिचकी            तो #ख्याल आया    की कोई अपना ही            मेसेज का     #इंतजार   कर रहा है ।।    #शुभ_रात्री,0,train
शमी पाद भी दे तो ये अमर उजाला वाले भोसड़िके उसकी बीवी के घर पहुँच जायें उसकी दिली ख़्वाहिश जानने http …,0,train
अब क्या फ़र्क पड़ता है कि बच्चे मरते या बच्चियों के साथ हैवानियत हो रहा है? अब तो चुनाव खत्म हो चुका है।    अब कोई आपको पूछने नही आएगा आप जनता है आपको सिर्फ़ वोट के लिए याद किया जाता है।    आपने हिंदुत्व-पाकिस्तान और मंदिर पे वोट किया है तो सरकार आपके बच्चे कैसे सुरक्षित रखेगी?,1,train
#साईं पार्टी का अस्तित्व खतरे में #शेरी लुंड को बनाया गया सभागृह नेता #ulhasnagar #bjp की कोशिश http  __#साईं पार्टी का अस्तित्व खतरे में #शेरी लुंड को बनाया गया सभागृह नेता #ulhasnagar #bjp की कोशिश http … Facebook: http  …,0,train
"दलीप कुमार से लेकर अब तक जो खानों की लाईन लगी है, किसी मुल्ला से इन्हें भी ज्ञान दिलवा देती कहावत है कि,    खा पी के इस रंडी, की खट्टी दही, सारी इंडस्ट्री चाट गये अब इसी के लिए इंडस्ट्री हराम है या सबके लिए।",0,train
सुत रे बाबा   हो गया ट्विट पियूट  गधेङो थये गयो छे के,0,train
बहन के लोड़े सूअर तेरी मां का भोसड़ा तूने एक बात तो सही कही बहन के लंड जिहादियों नंबर तो तुम सबका एक के बाद एक लगना है,0,train
वाक़ई #समाज में पागल #कुत्ते आदमी का भेष बदल कर घूम रहे है ये तेरी पोस्ट पढ़ के ज्ञात हुआ ....    ग़ज़ब #चूतिया है भाई ...,0,train
"तुम हुसैन (रदि.) वाले हो,  कुफ्र के नारे मरते दम तक मत लगाना।    #Lynching",0,train
नमस्ते उत्तर प्रदेश में कानून व्यवस्था चुस्त और दुरुस्त है पहली सरकारों के मुकाबले बेहतर है हमने तो अपने जीवन में पहली बार यूपी पुलिस को एक सराहनीय काम करते हुए देखा है जो एक पत्रकार के साथ हुआ है जितनी सराहना की जाए यूपी पुलिस की कम है योगी सरकार जिंदाबाद,0,train
