text,label,split
"जनमत स्वीकार, हार स्वीकार,  संघर्ष के लिए हम फिर तैयार,  चलते रहेंगे हौसलों के साथ जनमत स्वीकार, हार स्वीकार,संघर्ष के लिए हम फिर तैयार,चलते रहेंगे हौसलों के साथ …",0,train
"हम दूसरे की लकीर छोटी करने में विश्वास नहीं करते, हम अपनी लकीर लंबी करने के लिए जिंदगी खपा देते हैं।    Powerful speech by PM @user ji in Lok Sabha.    In case you missed it, here is the link.",0,train
"रंडी रोना बंद कर, बाबरी मस्जिद तोड़ने वाला आतंकी देश का पीएम है.    #DelhiTemple #HinduTerrorist",0,train
पिछली बार तो #मणिशंकर_अय्यर ने  @user जी को #नीच सोनिया जी के कहने पर कहा था ! इस बार किसने आदेश दिया उसे राहुल जी ने या प्रियंका जी ने ???,0,train
"अपनी मां को याद करते हुए रंडी बोलती है ये महिला, @user",0,train
"कुतिया ये फ़ोटो तो 2013 की है मेरठ की , और कुत्ते इसको ट्वीट और रिट्वीट कर रहे है , भेनचोद लिखने वाली भी जाहिल अनपढ़ और लाइक और रिट्वीट करने वाले भी जाहिल गँवार क़िस्म के...",0,train
फिर साबित हुआ #चौकीदार चोर नही था।    #कुत्ते  ही #पागल थे। बेवजह #भौंक रहे थे।,1,train
राजस्थान मे हमारे एक दलित भाई की सिर्फ इसलिए  पीट पीट कर हत्या कर दी जाती है क्योंकि उसने  उसने एक दुसरे मजहब की बेटी से मोहब्बत करने की   हिमाकत की  पीटने वाले सभी डरी हुई कौम के लोग है    अब कोई सेकुले रंडी जन्तर मन्तर पर मोमबत्ती या तख्ती उठा कर उसके लिए  अपना हलाला नही करवायेगी  01,0,train
सत्येंद्र जैन के द्वारा मेरे खिलाफ मानहानि का केस किया गया था    श्री @user जी की दलीलों के बाद आज अदालत ने इस मुकदमें में मेरे खिलाफ जो नोटिस दिए गए उस नोटिस पर रोक लगाने का आदेश दिया है,0,train
माणसाची सवय बदलता येते.पण जन्मजात निचपणा कसा सोडवणार.  #निच.!!!  #ShameOnPMModi,0,train
"जायरा ने एक बात तो साफ कर दी कि सलमान, आमिर, शाहरुख, तैमूर के अब्बू सब हरामी है क्योंकि फिल्मों में काम करना 'इस्लाम में हराम है।'",1,train
भारतीय जनता पार्टी के नवनियुक्त राष्ट्रीय कार्यकारी अध्यक्ष श्री जगत प्रकाश नड्डा के राजनीतिक एवं सार्वजनिक जीवन का एक संक्षिप्त परिचय।,0,train
70 सालों से दूसरे नेताओ पर आंख बंद करके भरोसा करते चले आए हो..  कम से कम एक बार ओवैसी साहब (AIMIM) को भी आजमाकर देख लो !!,0,train
"बीजेपी के एमएलए अर्जुन सिंह कह रहे हैं अपने कार्यकर्ताओं से   की   जो मुस्लिम मिलता है वहां मारो,   एक सौ से डेढ़ सौ के झुंड बनाकर चलो    भाजपा दंगाई पार्टी है.",0,train
"कितना भडवा है ये,   ये बोल रहा है ममता भाजपा के जाल मे फस रही है लेकिन ये ममता को नही बोल रहा की तुम तुष्टिकरन कर रही हो।  मैने बोहत मादरचाेद देखे लेकिन तेरे जैसा सच मे कही नही देखा।तू मेरे सामने होता तो तुझे ऐसा थप्पड लगता कि तू ठीक से खडा ना हो पाता।",0,train
"#इस्कॉन की रथ यात्रा में मुख्य अतिथि होंगी #TMC सांसद नुसरत जहां, कहा- ‘मैं धर्मनिरपेक्ष थी, हूं और रहूंगी’",0,train
बधाई हो दोस्तों    दिल्ली के हिंदुओं की बड़ी जीत    केजरीवाल को मजबूर कर दिया अंकित सक्सेना और ध्रुव त्यागी के परिवार को सहायता राशि देने के लिए    हमारे दबाव और एक साथ वोट की ताकत में बहुत असर हैं    अभी डॉ नारंग और नीरज बैसोया के परिवारों को कोई सहायता नहीं मिली हैं,0,train
"पुलवामा हमले में शामिल पांच में से चार आतंकी मारे गए, एक गिरफ्तार- सरकार    #pulwama   http …",0,train
ससुरजी का मोटा लुंड ने बहुत मज़ा दिया,0,train
लड़की सोते हुए अपने बॉयफ्रेंड का लिया लुंड,0,train
"Congress ko sath liya hota to up ka results kuch or hota, anyway best of luck",0,train
Randi के चेले तेरा जीजा तो मोदी है जो तुम्हारी चोद के बैठा है आज तक तुम्हारी गांड दर्द कर रही है hahahhah कभी नहीं भूल पाओगे बहनकेलोडो मोदी को इतनी मजबूत लुंड डाला है तुम्हारी गांड मे,0,train
"देश के कई हिस्सों में हुई बारिश, उत्तरी मैदानी क्षेत्र अब भी भीषण गर्मी की चपेट में",0,train
"आत्मा गिरवी ? - ये धंधा भी करते हो क्या पाखंडी आदमी    बच्ची के नाम पर खिलवाड़ का जो धंधा तुमने चलाया है उसे मक्कारी कहते हैं    बच्ची को तुमने नहीं लोकल लोगों ने बचाया था, तुमने झूठा क्रेडिट लिया    अपनी फ्लॉप फ़िल्म के नाम पर बच्ची का नाम रखना शर्मनाक भी था और छिछोरा भी",1,train
Ye shuru to aapke Raj me hua he jab keval yadvo ki Bharti ka abhiyan chalaya gaya.wo hi asur ab Dange kar rahe he,0,train
"मुंबई बारिश: बाल-बाल बची 167 लोगों की जान, फिसलते हुए रनवे से नीचे उतरा ‘स्पाइसजेट’ का विमान",0,train
दिल्ली में 300 मुल्ले मंदिर तोड़ते है     ओर ये मुल्लो का पिछवाड़ा चाटने वाला केजरीवाल झारखंड के चोर मुल्ले को 5लाख देता है भड़वा    @user,0,train
"वन्दे मातरम्, ओर जय श्री राम को समस्या बताने वाले.... तेरे पेंच पूरे खराब हो गए हैं..हरामी सुन ये शब्द नही ,ये हमारी संस्कृति हैं. जैसे तेरी हैं ...चाटुकारिता",0,train
तो वो भड़वा cm उसकी माँ  खुदवा ने के लिए दिल्ली पुलिस की  चार्जशीट दबाके बैठा है  # टुकड़े टुकड़े गैंग,0,train
"यूपी को अपराधमुक्त एवं भ्रष्टाचारमुक्त बनाने हेतु प्रयत्नशील @user के प्रयासों को ठेंगा दिखा @user द्वारा नोएडावासियों के साथ हो रही यह लूट सोचनीय,निंदनीय व सरकार के छवि को धूमिल करने वाली है अतः मामले को संज्ञान में लेकर न्यायोचित कार्यवाही करने की कृपा करें   @user",1,train
"बंदे मे अकड़ तो है जिन्होंने 541सांसद के बीच जयभीम का नारा लगाने की हिम्मत की  बधाई तो बनती है मेरी ओरसे ढेर सारी भीम बधाई ओबैसी जी,,",0,train
"शहाबुद्दिन मुख्तार अंसारी अतीक अहमद की छवि अपराधियों के रूप में दिखाई जबकि इन लोगों ने कहीं न कहीं आम जनता के लिये संघर्ष किया है,,,",0,train
"आकाश विजयवर्गीय मामले का असली सच, मात्र 3 बिंदुओं में जानिए क्या है वास्तविकता?",0,train
सामाजिक न्याय का उद्देश्य लिए 2016 में समाजवादी पार्टी सरकार द्वारा 17 ओबीसी जातियों को एससी में शामिल करने का निर्णय लिया। हाईकोर्ट ने 29 मार्च 2017 को हामी भरी। फिर क्यों भाजपा ने इसे लागू करने में 2 साल की देर की?,0,train
"योगी का नया फ़रमान, टॉप अपराधियों की लिस्ट बनाकर भेजो जेल    #UttarPradesh   http … (रिपोर्ट- @user )",0,train
#Justic for #Tabrezansari !   #Stop #MOBLYNCHING ! @user,0,train
अब तो विराट कोहली से भी बॉल नहीं रुक रही। क्या हो गया रे मादरचोद। #INDvBAN,0,train
"अगर ये दलाली छोड़ देंगी तो फिर  जय श्री राम के नारे कोन बुलाएगा,,,",1,train
"नदी किनारे मिली बाप और उसकी टीशर्ट में लिपटी बच्ची की लाश, इस तस्वीर पर रो रही दुनिया",0,train
यूपी की खबर कानून व्यवस्था को लेकर हमला बोलो और धरना प्रशासन जिला मुख्यालय पर हर ब्लॉक पर अपने विधायकों से लेकर धरना देने का काम करें,0,train
#NusratJahan ने किसी गैर मुस्लिम से शादी की तो यह उनका 'व्यक्तिगत फैसला'   और  #ZairaWasim  ने फिल्म इंडस्ट्री  छोड़ी तो यह 'धार्मिक कट्टरता' ?   इतना हरामीपन कहां से लाते हो ?? बे दलाल मीडिया    इसमें तू क्यों रंडी रोना रो रहा है,1,train
उओ गद्दार ओ गद्दार अरे ओ bsd वाले गद्दार !  मुँह बंद रख वरना तेरे मुह में किसी अफ्रीकी का लुंड और वो भी टट्टे सहित घुसेड़ दूँगा ! साले सांस भी नही ले पायेगा !,0,train
और पब्लिक लौड़ा वाले है सारी महाठगबंधन वाले के मुँह मे डालेंगे माधरचोद चूतिये साले लूटेरे आतंकवादी पप्पू... #मोदी को दूंगा वोट भेनचोद जिसको जो करना है कर लो मेरे घर का 7 वोट मोदी को #ले उखाड़ ले साले आतंकवादी पप्पू,0,train
ऊसके मुंह में कटा हुआ जो ठुसा है।कैसे बोलेगा हरामी।,1,train
एक मौलाना साजिश रशीदी कहता है की हौज क़ाज़ी में जो मंदिर तोड़ा है वहां मंदिर ही नहीं है सुअर कहता है कि शो केस में मूर्तियां रखी गई है ये तालिबान सोच है मौलानाओं की जो कहता है की मंदिर ही नहीं है क्या अब यही होना बाकी रह गया है गृहमंत्री अमित शाह जी कुछ तो कहिए ????,0,train
"#BJP का महिला मारपीट करने वाले विधायक को 3 दिन का नोटिस..    10 दिन वाले #नोटिस का क्या हुआ?    #प्रज्ञा_ठाकुर    महिला को लात-घूंसों से पीटने वाले BJP विधायक बलराम थवानी को पार्टी ने भेजा नोटिस, तीन दिन में जवाब तलब:",0,train
अमित शाह ने बोला #प्रज्ञा_ठाकुर को टिकट देना मतलब भगवा टेटर के सामने सत्याग्रह था।   और  अभी अभी कोर्ट ने कहा हर हप्ते आतंकी प्रज्ञा कोर्ट में हजारी लगाए।  #मोदी_है_तो_मुमकिन_है    @user  @user @user @user @user,0,train
BJP नेता मुख्तार अब्बास नकवी और शहनवाज हुसैन इनको बीच चौराहे खड़ा करके इनसे भी जयश्रीराम के नारे लगवाओगे ?,0,train
"बहुत गुरूर था छत को छत होने पर,  एक मंजिल और बनी छत फर्श हो गई।  #शुभ_रात्रि @user @user",0,train
पाकिस्तान तेरी मां कि चुत दम हे। तो खुल्ला लड़के दिखा भेनचोद हमारा एक जवान 50पे भारी हे। गाली बक रहा हूं खुल्ली तेरे को हिजडे तेरी मां कि चुत बे पाकिस्तान,0,train
"ये जो #friendship डे विश किये जा रहे हैं  .  अभी 2  हजार मांग लूं तो 4 दिन फ़ोन नही उठाएंगे #कमीने,",0,train
मादरचोद #Gandhi #Nehru किधर मर गया देख लौड़े अपने भारत को तेरी मूर्ति जिधर देखूंगा तोड़ दूंगा। कौन हरामी बोलता है #हिन्दू #मुस्लिम भाई-भाई।हिंदुओ सिर्फ ट्वीट करनेसे नही होगा ये #दोगले किसी मिशन पर है।कब सुरु करोगे #काटना हरामी  मुल्ले की औलादों #धर्मयुद्ध कर  #justice_for_Eklavya,1,train
.  'भगवा'.....    देश और क्रिकेट : दोनों के लिए पनौती है.!  .  .  धत्,0,train
गांजा कहाँ मिल रहा है आज कल @user इस सुअर ने अपनी केंसर वाली अफवाह फैला कर गां#@$ फाड़ दी थी तब से सब एब बन्द है अपना,0,train
इस भेनचोद को ब्लॉक मार तू जा मै देखता इसको,0,train
अंग्रेजों के विरुद्ध पहला संगठित संग्राम 1857 में अंग्रेजी सेनानायकों के दांत खट्टे करने वाली ऐसी वीरांगना रानी लक्ष्मी बाई थी  #लक्ष्मीबाई,0,train
एक ज्ञान की बात बता रहा हूँ नोट करलो    जो भोसडिके तानपुरा और एकतारा का फ़र्क़ नहि समझते वोह चुतिये अक्शर दिमाग़ का गिटार बजा देते है,0,train
दिल्ली में धार्मिक स्थल पर हमले होते रहे कहां थी पुलिस?  #Krantikari पूरा कार्यक्रम http   (@user),0,train
तबरेज़ अंसारी के मौत पर रंडी रोना करने वाले भडुओ से पूछना है अब दिल्ली में मंदिर पर हमला करने वालो के खिलाफ आवाज क्यो नही निकल रही,0,train
"किसको 'याद'आना...और...  किसीको याद करना....  दोनों अलग अलग बातें होती  है,  'याद' हम उन्हें करते है.....  जो हमारे अपने होते हैं....    और हम 'याद' उन्हें आते है  जो हमें अपना समझते है....  #बज़्म #अल्फाज़े_बयां #પુજા   Good evening   Coffee time",0,train
शाबाश दलित बहन   यह है आज की फूलन देवी    बलात्कार की कोशिश करने वाले युवक का प्राइवेट पार्ट युवती ने काट दिया ऐसे लोगों को तभी शबक मिलेगा    @user @user @user @user @user @user,0,train
"ये रंडी रोना बंद कर के.. अब हर बलात्कारी को सजा खुद जनता दे, तो ज्यादा बेहतर होगा,",0,train
पहले : गोदी मीडिया दलाल है   अब   : गोदी मीडिया दलाल है,1,train
Emirates ने शुरू की दुबई और मस्कट के बीच दुनिया की सबसे छोटी फ्लाइट    #Emirates   http …,0,train
"सर जी, #इलेक्शन के दौरान सारे #विरोधियो की एक ही हालत थी '#हाथी चले बजार, #कुत्ते भौंके हजार' #मोदी सर की दहाड़ के आगे #कुत्तों का #भौंकना किसी को सुनाई ही नहीं दिया     #ModiAaRahaHai    @user @user @user     #जय_श्री_राम   #जयहिन्द   #वन्दे_मातरम   #भारत_माता_की_जय",0,train
मै और मेरा दोस्त मेरी बहन की चुदाई कर रहे हैं।,0,train
"घरों की बिक्री पर ब्रेक, बजट बढ़ाएगा रफ्तार!  अन्य वीडियो के लिए क्लिक करें http    #ATVideo",0,train
"जाने कितने बलात्कारों का आरोपी , जिस के आश्रम में नरकंकाल मिले , उस बाबारामरहिम के लिये बीजेपी कहती है कि जेल में इसका आचरण सही है,,,",0,train
"भोसडीके , उसमें आपसी कुछ भी नहीं है , सिर्फ अल्लाह हूं अकबर ओर मारो काटो है। मालूम नहीं डरपोक हिन्दू कब  शिवाजी ओर प्रताप बनेगा , जिस दिन हिंदुओ का दिमाग घूम गया ना ,उस दिन ये सांझी चोट भी कम पड़ जाएगी।।",0,train
#ZairaWasim ने अल्लाह का नाम लेकर फिल्म इंडस्ट्री छोड़ दी...     तुम भी जय श्री राम का नाम लेकर दलाली छोड़ दो संघी आंटी @user...,1,train
"अगर 'इस्लाम' मे, फिल्मों मे एक्टिंग करना 'हराम' है तो जितने भी मुस्लिम 'एक्टर' 'एक्ट्रेस' फिल्मो या सीरियलो मे काम कर रहे है वो क्या 'हरामी' है ?   @user",0,train
तिलमिलाइये मत सही सही लिखीये दलाली खतरे में हैं का।   Arrested हैं attested  क्यों लिख रहे हैं।,0,train
अब यदि @user चुनाव में बने रहना चाहते है तो पहली फ़ुर्सत में @user का गुजरात का टिकट करा दें..!!,0,train
मरना नही है सुअर को मरना ह,0,train
जब हम किसी को सम्मान देते है तो वापसी की आशा करते है लेकिन किसी को सम्मान देना ही खुद का सम्मान होना है।  सुप्रभात,0,train
"B like my father who never forced anything for he knew I was worth nothing, he gave me my liberty to decide my life saying those golden 4 words     'कुछ तो करलेना भोसडीके'",0,train
सही कहा.. छोड़ दिया  लेकिन वहीं मोदी के बार बार कहने पर दलितों मुसलमानों पर भगवा आतंकियों का आतंक जारी है,1,train
मुश्किल में फंसे अनिल अंबानी को महाराष्ट्र सरकार ने दी राहत    कंपनी को मिला 7000 करोड़ रु का ऑर्डर  और BSNL-ONGC -JET को फूटी कौड़ी  #NewIndia,0,train
You are great sirYou are the next cm of upLoveyou sir,0,train
