text,label,split
"माँ भारती के वीर सपूत, श्री विनायक दामोदर सावरकर जी की जयंती पर उन्हें कोटि कोटि नमन।",0,train
अगर ये मेडम सही है तो फिर सारे खान और दूसरे एक्टर तो हरामी हुए जी,0,train
हां भइया धीरे से बोलेंगे क्योंकि अभी-अभी कांग्रेस लगभग 350 सीटे जीत के लाई है। इस लिए भाजपा कुछ नही कर सकती।,0,train
मैं कांग्रेस से पूछना चाहता हूँ कि जमायते इस्लामी और JKLF पर आज तक प्रतिबंध क्यों नहीं लगाया गया था ?    मोदी सरकार आने के बाद इन पर प्रतिबंध लगा।    इन अलगाववादियों और देशद्रोहियों पर प्रतिबंध न लगाकर कांग्रेस किसे खुश करना चाहती थी?,0,train
"जिस उत्साह के साथ दिल्ली की जनता ने लोकसभा चुनाव में भाजपा को अपना प्यार व आशीर्वाद दिया, दिल्ली विधानसभा चुनाव में भी वही इतिहास दोहराना है। दिल्ली चुनाव के लिए आप सभी तैयार हो जाईये,हमें दिल्ली की सत्ता से नाकामपंथीयों की सरकार को उखाड़ फेंकना है- श्री @user",0,train
"देश गृहयुद्ध की ओर    मुसलमानों पर आये दिन हो रहे हमले का अगर मक़सद यही है कि मुसलमान ज़ुल्म से तंग आकर अपनी आत्मरक्षा के लिए हथियार उठा ले    फिर उन्हें देशद्रोही कह कर उसी प्रकार सामूहिक नरसंहार किया जा सके, जैसे कि बोसनिया, सीरिया आदि में हुआ है!",0,train
#Jharkhand में हुए #MobLynching के विरोध में यूपी के मेरठ के बाद #Agra में भी जुलूस के दौरान बवाल हो गया। #JharkhandLynching,0,train
रमजान के बाद 852 रेप केस...  840 केस मे अपराधी मुसलमान!!  शिकार काफ़िर बच्चियां और साहेब विश्वास जीत रहे हैं।  बच्चियों से हैवानियत हराम नहीं   बेगुनाहों को बम से उड़ाना हराम नहीं   बकरियों के साथ दुष्कर्म हराम नहीं   बस वंदे मातरम् हराम है इन लोगों के लिए ।,0,train
"राम....जीवन है, राम.....करुणा है,राम.....मर्यादा है, राम के नाम पर “हत्या”  करने वाले “राक्षसों”  इस विराट धर्म को “बदनाम”  और “छोटा”  मत करो.",1,train
भड़वा रंग पहन के जीत कैसे सकते हो   ये अंग्रेजो की दलाली का रंग हे   फिर गुलामी करके जिताना तो पड़ता ही इंग्लैंड को,0,train
#कुत्ते को #हड्डी खिलाने के बाद दुत्कारा जाता है,0,train
"तुम चिंता काहे कर रहे हो मानक जी,   अब पत्थरबाज बनना इतना आसान नही,  #ZairaWasim",0,train
झोपड़ी का बहुत बड़ा मादर्चोद है।।।  ये पेसे के लिये अपनी माँ बहन को कोठे पर बेठा सकता है।।।,0,train
"बजट से पहले शेयर मार्केट में करना चाहते हैं निवेश, तो यहां जानें किन बातों का रखना होगा ध्यान    http …    #Budget2019",0,train
मोबाइल प्लेटफॉर्म से किसी दूसरे बैंक अकाउंट में पैसे ट्रांसफर करने के लिए यूनिफाइड पेमेंट इंटरफेस या UPI का इस्तेमाल किया जाता है,0,train
"धोखा खाने वाला तो  सम्भल जाता है लेकिन धोखा देने वाला एक दिन जरूर बर्बाद हो जाता है,क्योंकि वो सम्भलने के बारे में सोचता ही नहीं  सुप्रभात",0,train
All the best ready for Go to jail ..,0,train
तेरे को दिल्ली के सड़क पर घुमने वाले #कुत्ते भी कटेंगे     सटक गया खुजली,0,train
#PMModi ने 25 जून को संसद में कहा कि #WaterCrisis दूर करना उनकी प्राथमिकता है। लेकिन सच ये है कि प्राथमिकता की बात करने वाले मोदी जी ने पांच साल से देश में #BJP की सरकार होने पर भी जल संकट पर दो साल पहले दी गई #NitiAyog की रिपोर्ट पर कोई चर्चा नहीं कराई।,1,train
"प्रियाजी, #Media420 की नमक हरामी की हद तब पार हुई ,जब पाकिस्तान में नाबालिग हिंदू बच्ची का मुस्लिम ने अपहरण करके उसे इस्लाम धर्म अपनाने के लिए मजबूर किया  , इस बारे मे ना तो मीडिया ने मुंह खोला और ना ही सरकार द्वारा कोई ठोस कदम उठाया गया|",1,train
"ये रहें #PlayAndWinOnZee के 1 जुलाई के विजेता, आप भी खेलें और जीतें PAYTM कैश ईनाम, क्लिक करें - http",0,train
"मदरसा छाप मदरसे से बाहर निकल, मुझसे पूछने की बजाए खबरे पढ़ । खजूर मादरचोद।",0,train
"दलाई लामा ने 2015 में भी कहा था कि महिला उत्तराधिकारी को बहुत, बहुत आकर्षक होना होगा",0,train
"Ha 2024 ki tayari karlo... Election aayenge jayenge, zindagi se bad k kuch nai.",0,train
श्रीलंका ने दक्षिण अफ्रीका को दिया 204 रनों का लक्ष्य   #ICCCricketWorldCup2019 #SLvsSA,0,train
मैं #गिरिराज_सिंह #कन्हैया_कुमार से पूछना चाहता हूं...  आजादी में कोई कमी तो नहीं रही भोसड़ी के...,0,train
गरियाते तो हम भी सबको है  पर गांड फट के बहत्तर हो जाय  लेकिन ऐसे अपोलॉजी झांट नहीं मांगने वाले,0,train
"आप सब देशवासियों को ईद मुबारक आपका अपना #मोडी़  या #अल्लाह मेरे #मनहूस, #अंधभक्तों और #मानसिक_गुलामो को #कुत्ते की मौत दे ...    #आमीन",0,train
गांड‌ मार ली होगी जेल में किसी ने,0,train
देसी चुदाई हिंदी में - होटल में घोड़ी स्टाइल में बड़े लुंड से धांसू चुदाई से लड़की हालत ख़राब | आवाज सुने,0,train
"1857 की “क्रांति” का बिगुल बजाने वाली, झाँसी की रानी लक्ष्मीबाई का आज “बलिदान” दिवस है, लेकिन गोदी “मीडिया” में कहीं एक पट्टी तक नहीं,अगर प्रियंका चोपड़ा की “मैरिज” Anniversary होती,तो पूरा दिन “तमाशा” होता.",0,train
"दिल ही तो था,अब भर गया हमसे...",0,train
"लगता है भगवा टीम एक भड़वा टीम को बाहर से ही भगवा देगा, क्या इसे ही इसे कूट नीति  कहते है ।",0,train
"हर साल 85 लाख लड़के लड़कियां  अल्पसंख्यक समुदाय के स्कालरशिप से  महरूम हो रहे हैं सरकार अगर  1000 करोड़ का बजट बढ़ा दे तो  इनका भी भला हो जाये,    - असदुद्दीन ओवैसी  @user @user @user @user",0,train
"ये सुअर अपनी माँ बहन के साथ भी येही करता होगा, इमारती ताई को ये video कोई भेज दो सायद नींद खुल जाए..",0,train
ऐतिहासिक विजय के बाद प्रसिद्ध सिद्धपीठ श्री श्याम गिरी महाराज के दरबार में पहुँच देश की ख़ुशहाली के लिए संतों का लिया आशीर्वाद,0,train
"जो एतिहासिक जीत दिलवायी है जनता ने मोदी जो को फिर से प्रधानमंत्री बना कर  , हम सब mp इस ऋण को क्षेत्र के बेहतर कार्य  कर चुकाएंगे .. जय श्री राम",0,train
मैं जिन्ना की सोच का समर्थन नहीं करता. भारत के मुसलमानों ने जिन्ना को ठुकरा दिया. जिन्ना की कब्र पर तारीफ करने आडवाणी गए मैं नहीं गया. बीजेपी अभी भी बंटवारे के दौर से बाहर नहीं निकल पा रही है: #AIMIM President Barrister Asaduddin Owaisi at #ShikharSammelan  @user,1,train
"नारियों को घुंघट/पर्दा रखना है या नहीं, यह उन पर डिपेंड है। पुरुष वर्ग कौन होता है, यह कहने वाला की महिला क्या पहने,क्या ना पहने ?  @user @user @user @user",0,train
मौन और मुस्कान    दोनों का इस्तेमाल कीजिए.        मौन रक्षा कवच है।   तो मुस्कान स्वागतम द्वार .!!  #शुभ_रात्री,0,train
वहां के अलगाववादी नेता.. आतंकवादियों को सपोर्ट करने वाले पत्थरबाज. महबूबा मुफ्ती फारूक अब्दुल्लाह उमर अब्दुल्ला इनकी सिक्योरिटी बंद कर दो फिर देखो. पहले आग लगाते हैं फिर आग बुझाने का नाटक करते हैं. सबसे बड़ी जिम्मेदार पर कांग्रेस पार्टी है,0,train
सबका विशवास कहाँ से जीतोगे साहब।  बे गुनाहों का कत्ल कहाँ रुकने वाला।,0,train
MLA Aimim @user ne Aligardh me hue masoom bacchi twinkle sharma ke katalo ke khilaf aaj REHMANI GROUP RAZA ACADEMY GROUP OR ULMA~E~SUNNAT  ki jaanib se rakkhe gaye PROTEST me _IQBAL KAMALI JUNCTION  MADANPURA BYCULLA_ me shareek hue. #JusticeForTinkleSharma,0,train
आदरणीय राष्ट्रीय अध्यक्ष जी    #आप हम सब का #हौसला हैंआदरणीय राष्ट्रीय अध्यक्ष जी#आप हम सब का #हौसला हैं…,0,train
"चादरमोद महमूद गजनवी पर्चा को क्यो बुलाते हो डिबेट में,मादरचोद पाकियों का गू खाकर आये हुए।",0,train
"लोकसभा में कांग्रेस दल के नेता #AdhirRanjanChaudhary मानते हैं कि मौजूदा सरकार ने सभी संस्थाओं को नष्ट करने पर आमादा है, ऐसे में संसद भी कैसे बचेगा",0,train
कपिल मिश्रा का मनीष सिसोदिया पर हमला... सिसोदिया बन गए हैं दिल्ली के कलमाड़ी  http … @user @user @user,0,train
लगता है पिछले #जन्म में हजारों #देवी-देवताओं की #पूजा की होगी तभी इस #जन्म में #कमीने #दोस्त मिले हैं,0,train
कुछ सूअर बोल रहे हैंमंदिर की मूर्तियां ही तो तोड़ी है इंसान थोड़ी मारे हैंयह लिंचिंग थोड़ी है क्यों ना हम सारे हिंदू मिलकर के मस्जिदों को तोड़ना चालू करें फिर हम भी बोल देंगे दीवारेंतो तोड़ी है कोई इंसान थोड़ी मारे हैं कब तक सहेंगे हम लोग कब तक गाली खाएंगे।क्या होगा तुम दोगलों का,1,train
"कल कांग्रेसी मुख्यमंत्रियों से मिलेंगे राहुल गांधी, जानिए क्यों अहम है ये मुलाकात?    http …    (रिपोर्ट @user )",0,train
"हिंदू गांड के नीचे गीता रखकर,  ज्ञान बखानत है।    पाखंडों की पूजा करके कहे , बहुत जनता है।।",0,train
मैं यद्यपि समाजवादी पार्टी को पसन्द नही करता लेकिन मैं आपको व्यक्तिगत तौर पर बहुत पसंद करता हूँ और आप संसद जाएंगे इसकी मुझे दिल से खुशी है।,0,train
बस एक कहानी   कहानी उस औरत की जो थी बहुत ही  हरामी...,0,train
"हरियाणा बीजेपी सरकार ने बाबारामरहिम का जेल में आचरण अच्छा बताया मतलब बेटी बचाओ आंदोलन की तरफ बीजेपी का शानदार कदम,,,  @user",0,train
##कमीने कमलनाथ को चाहिए 'अली' हमें चाहिए बजरंग बली: योगी आदित्यनाथ..!!निर्णय 'हिंदुओं' को करना है कि सत्ता में कौन रहे..!!,1,train
जायरा वसीम ने इस्लाम का हवाला देकर बाकी सभी मुस्लिम कलाकारों को हरामी एवं हराम का खाने वाले सिद्ध कर दिया।  #राष्ट्र_प्रथम  #political_gyan   भारत दुनिया मे एकमात्र देश हैं जहाँ बहुसंख्यक अल्पसंख्यक के बराबर अधिकार देने की भीख सरकारों से मांगता हैं और मिलती हैं दुत्कार,0,train
"किसी को मादरतोद ,बहनचोद कहना लोगो को ज्यादे खराब लगता है कि जो शासन में नंपुसकता बांझपन बड़वा भड़वीपन की वजह से हजारो माँ बहन के साथ जो वर्तमान में हर रोज प्रयोगिक जोर जबरजस्ती या बहला फुसलाकर या विवाह का जुमलाबाजी देकर या फिर बाल वैश्यावृत्ती कराकर चुदाई हो रही है वह ज्यादे है ?",0,train
काय मँज लय रही मरी रंडि बाभि बस में,0,train
जो साले कह रहे थे कि हमे 15 लाख नही चाहिए   वो 60 रुपये की चटाइयों के लिए आपस मे झगड़ा कर रहे थे   रोहतक में,1,train
"वो समय आ गया है जब #शिक्षामित्र,#बेरोजगार,#उर्दूशिक्षक,#अनुदेशक,#शिक्षाप्रेरक,#बीएड,#बीटीसी,#कर्मचारी,#महिलाएं और किसान सभी एक साथ मिल कर 2019 मे धोखेबाज #भाजपा का अंतिम संस्कार करे ताकि आगे से कोई राजनीतिक दल और नेता झूठे वादे व दावे करने का साहस न जुटा सके।   @user",0,train
Live : महाराष्ट्र सरकार ने आज 3 जिलों में छुट्टी घोषित की     #MumbaiRainsLiveUpdates #MumbaiRainlive #MumbaiRain      http,0,train
मणि शंकर aiyar ने ठीक कहा था #नीच ! जो मरे हुए आदमी को भी नहीं छोर रहा.,0,train
Ab nhi dikh rha kya midia valo ko jungal raaz,0,train
"हर रोज की तरह शुरुआत MLA दफ़्तर से,  10 से 1 बजे तक जनता मेरे पास आती है,  फिर 2 से 6 बजे तक मैं अपनी जनता को मिलने उनके पास जाती हूँ :).  बस यह सिलसिला पिछले 52 महीनों से यूँ ही चलता आ रहा है।",0,train
मुसलमानों कि अम्मी का चूट सूअर मारे,1,train
तू #कुत्ते का नही #बिल्ली का #बच्चा है   कुत्ता वफ़ादार होता है   पर तू #बिल्ली का #बच्चा है जो सोचता है #मालिक कब जाए और मैं सब खा जाऊँ..???     BC.. तू कब #देश के #ख़िलाफ़ बोलना छोड़ेगा #बिल्ले,0,train
"खुद प्यासी हो फिर भी,  मेरी प्यास बुझाती है,  आंसू अपने पोछ वो ,  मुझको गले लगती है,  खुद भूखी हो भले ही,  मेरी भूख मिटाती है,  वो तो सिर्फ एक माँ ही है,  जो हरपल हमें सम्भालती है।।    #हिंदी_शब्द   #शब्दनिधि",0,train
Tumko wapis CM bana de kya fir loot start karoge,0,train
"ये विडियो साले जयचंद के बच्चें भी देख रहे होंगे, लेकिन उनकी अपनी ज़मीर फिर भी नही जागेगी, क्योंकि वो हरामी के ही औलाद हैं ।।।।",0,train
तीन तलाक़ पे कानून जरूरी है  या  बलात्कारियों पर..?     वोट कर के rt कर दे...    @user @user  @user @user,0,train
@user Evedence for you to do your रंडी विलाप  as a Presstitude trumpeting intolerant Hindus,0,train
"'परमात्मा एक है, तो फिर हम अलग कैसे हो सकते हैं ?'    'निर्वाण' मासिक आध्यात्मिक पत्रिका (जुलाई 2019)  @user",0,train
Apna Neta kaisa ho Sudharshan TV waale jaisa ho !!! Seedhi baat .....No Bakwaas .,0,train
कादर खान और शक्ति कपूर दोनों बन जाओ तो दोनों बच जाएंगे।  आउं। लोलिता।,0,train
"सदर @user पर हमला, मलखान में भर्ती   अल्लाह पाक जल्द सिफा अताह फ़रमाये।। हमारे भाई फैज़ुल हसन को",0,train
सत्येंद्र जैन के द्वारा मेरे खिलाफ मानहानि का केस किया गया था    श्री @user जी की दलीलों के बाद आज अदालत ने इस मुकदमें में मेरे खिलाफ जो नोटिस दिए गए उस नोटिस पर रोक लगाने का आदेश दिया है,0,train
कदम से कदम मिलाकर साथ गाओ रे...  राष्ट्र के निर्माण में बने भागीदार...  Join @user   @user @user @user @user @user @user @user @user @user @user @user @user,0,train
"कहां मर गए रवीश जी, आपके शांति प्रिय धर्म के लौगो ने चांदनी चौक में मंदिर पर आक्रमण कर दिया,,गले में सुअर की हड्डी फंस गई क्या,, मोमबत्ती, और अवार्ड गेंग भी पता नहीं किस पाताल में उतर गया,, ढूंढो इन देश के गद्दारों को",0,train
"इस बात पर विशेष ध्यान दिया जाना चाहिए कि हमारा शोध नवाचार , नवोन्मेष पर केंद्रित हो । आज युवा वैज्ञानिकों को उत्कृष्ट शोध से जोड़ने के लिए विशेष अभियान चलाने की आवश्यकता है । विद्यार्थियों को विज्ञान, गणित और प्रौद्योगिकी से जोड़ने की बड़ी जरूरत है  ।",0,train
"चोर मुल्ले को भीड़ मारे तो आसमान टूट पड़ता है,पर अगर यही हरामी मुल्ले मंदिरो को तोडने लगे,बिना किसी उकसावे के,तब पूरी दुनिया का ज्ञान उभर आता है आप जयचंदो की छाती पर, है ना?",0,train
