text,label,split
"जायरा वसीम ने कहा 'इस्लाम में अभिनय हराम'है  तो क्या मीनाकुमारी, मधुबाला  सायराबानों, शबानाआजमी, सलमान, शाहरुख सब   हरामी हैं ?",0,train
"सरकार ने माना होटल-मल्टीप्लेक्स में MRP से महंगा मिलता है सामान, जल्द बनेगा कानून",0,train
"#राह चलते# पागल बनते हैं #दोस्त, @%@#Cold_Drink बोल के #दारु पिलाते हैं दोस्त,  कितने भी #कमीने हो पर काम पड़ने पर# हमेशा @आगे रहते हैं #दोस्त !! http …",0,train
विपरीत #प्रज्ञा_ठाकुर जो हिन्दूत्व की आड मे आतंकी न होकर देशभक्त है यहां मुद्दा देश व जनता का पैसा लेकर भागने वालें व्यापारी नहीं #भगवाआतंकवाद #मनुवाद है।,0,train
#प्रज्ञा_ठाकुर ने #गोडसे_ज़िंदाबाद कहा तो नाराज़ हो गये   #कन्हैया_कुमार ने भारत तेरे टुकडे होंगे कहा तो लोकसभा उम्मीदवार बना दिया।°  वाह रे दोग्लो    #श्री_Զเम  @user  @user  @user    .  *༺नमो_भारतनमो_अगेन༻*   . *शेरों की दहाड़*,0,train
"ये दिल भी तेरा, और जां भी तेरी...    #krishnakanhaiya #muraliwale #mohan #kanhaiya #radheradhe #jaishriram #gopalkanhaiya #bhajansandhya #acharyapramodkrishnam   @user",0,train
#कमीने मोलाना अरशद कासमी को 14 दिन की न्यायिक हिरासत में जेल भेजा गया!!    #कल इसने SC की महिला वकील के साथ LIVE बहस में गाली- गलौज व मारपीट की थी!!    #भारतीय न्याय-व्यवस्था की जय हो??,1,train
जरूर तेरी मा को गली के कुत्तों ने चोदा होगा  वरना इतना बेइज्जती होने के बाद कोई रंडी का औलाद ही भौक सकता है    क्या बोलता है सड़क छाप गांडू संघी,0,train
"#ममताजी:- खा ले #कमीने लोग तू सब बिना खाये मुझे #प्रधानमंत्री नही बना सकता @user    #महागठबंधन के भोजन करने वाला दल:-इस भोजन से थोड़े हमसबका पेट भरने वाला है,खा कर पत्तल में छेद कर देंगे ममता जी क्या तुहि #चालाक हैं, हमलोग का प्याज छिलने वाले है,#सपना देखती है #PM का",0,train
"कोण भेनचोद होगा ???  Burkha, पप्पु, sidhu.",0,train
#प्रज्ञा_ठाकुर भोपाल से चुनाव जीत गयी   #CongratsNaMo,0,train
मुर्दाबाद तो हैं ही ज़हरीली हवा मे साँस लेकर    ज़िंदा और मुर्दा होने का फ़र्क़ पिछले आठ दिनों मे बच्चा बच्चा समझ गया    पीढ़ियों ने पहली बार देखा कि हवा काली नहीं होती    खुली हवा मे @user मुर्दाबाद चिल्ला ले क्योंकि ये हवा इन्हीं के कारण साफ हुयी है.. #SingrauliPollution,1,train
तेरे जैसे लोग होते हैं जो हिन्दू मुस्लिम करने में अपनी जिंदगी बिता देते हैं ओर लोगों के तलवे चाटने में भी । ओर फिर उसके बाद टतुम्हे क्या मिलता हैं : तेरी औकात क्या है। #भड़वा_साला @user,0,train
"मुंबई में 45 साल बाद सबसे अधिक बारिश, मलाड हादसे में 21 लोगों की मौत, BMC पर उठे सवाल  #MumbaiRain   http …",0,train
रूठे दोस्त को मना लेना चाहिये #Kejriwal जी क्योकि वे     #कमीने सारे राज़ जानते है #आप को समर्पित,0,train
Tera baap  jo rooj krta h wo mat krn bhosdi kai cheenal.. गांडु इंसान है तू रंडी का बच्चा है  तू,0,train
#AIMIM Party Floor Leader Habeeb E Millat Akbaruddin Owaisi Sahab Addressed Speach at Owaisi School Of Excellence Jamal Colony #Hyderabad! @user   @user,0,train
#NusratJahan ने किसी गैर मुस्लिम से शादी की तो यह उनका 'व्यक्तिगत फैसला'   और  #ZairaWasim  ने फिल्म इंडस्ट्री  छोड़ी तो यह 'धार्मिक कट्टरता' ?   इतना हरामीपन कहां से लाते हो ?? बे दलाल मीडिया    इसमें तू क्यों रंडी रोना रो रहा है,1,train
"ये सब रहने दे,पहले तू बता बुखारी इस्लाम में तो ट्वीटर 'हराम' है फिर क्या तू 'हरामी' कर रहा है?",1,train
कोई लड़की मुझे अपने दिल में घर बनाने देगी ??    या फिर मैं प्रधानमंत्री आवास योजना का फॉर्म  भर दूं ...    सो सॉरी,0,train
"अन्य पार्टियों को छोड़कर भाजपा  में शामिल होने वाले विधायक ओर  सांसद गंगोत्री में गोता लगा कर देश  भक्ति का सर्टिफिकेट प्राप्त कर रहे हैं,,,",0,train
ये मादरचोद डरे हुए लग रहे है ?,0,train
केजरीवाल ने दिल्ली की जनता को हर मुद्दे पर धोखा दिया है - श्री @user,0,train
"तेरी माँ का भोसडा, भेनचोद कटवे कही के!",0,train
"ये मादरचोद भिमटे समाज पर कलंक है , भेनचोद इनको दोस्ती करो तब ये मदारजात जिस थाली में खाते वहीं हगते ।   इसके जैसे सोच वाले ४-५ भिमटो से दोस्ती तोड़ दिया। कुछ है अच्छे लेकिन ज्यादातर चुतियें है।",0,train
सरारती तत्वों द्वारा नही मादरचोद मुस्लिम आतंकी बहनचोदो मुल्लो द्वारा हिँसा फेला है।                         लौड़ी अलका लांबा कुतिया,0,train
अबे भड़वे सुवर की औलाद अभी तेरी राजनीती बंद कर भेनचोद हरामी कुत्ते !!    तेरे जैसे आस्तीन के साँफो को तो गोली मार देना चाहिए !!    मेरे अगर बस मे होता तो तुझे मे कुत्ते की मौत मारता भड़वे,0,train
साफ साफ बोल ना मादरचोद भगवा रंग से दिक्कत है कम से कम इंडिया टीम की तो इज्जत करता भोसडीके,0,train
"तुम अपने कुरआन हदीस के मुद्दों पर बात करने आया था, मगर अपनी अम्मिजान पर चड़ गया मादरचोद !  कुरआन हदीस पर बहसोमुबाहिसा करना हो तो कर,या अपनी बेटिजान पर चढाई कर लै भोसडिके",0,train
गांड में गुदा नहीं और और छलांगे 10 फेरी के  भोसडीके तू चला जा,0,train
महान क्रान्तिकारी पं. रामप्रसाद बिस्मिल जी की जयंती पर शत्-शत् नमन।,0,train
"वाह रे पाखंडी, इतना दोगलापंथी कहां से प्राप्त किए हो, कोई कोर्स किये हो या पैदायसी मिला है खानदानी. अभी हिन्दू मॉब लिनचिंग पर आसमान सर पर उठा लिया था टीवी डिबेट में. सुअर का....",0,train
ब्रेकिंग न्यूज़ :   #अंधभक्तो के लिए #कालादिन...  #कन्हैया_कुमार #देशद्रोह के आरोप से मुक्त : सुप्रीम कोर्ट,0,train
"दिल्ली के चांदनी चौक में घुस कर कुछ आतंकवादी हिंदू संस्कृति की गान्ड मार कर चले गए ओर भेंचोद तुम बिल ढूंढ रहे हो, शर्म आनी चाहिए दिल्ली की जनता ओर वहां के प्रशासन को  #Terror #terrorist #Attack #terrorism #ChandniChowk",0,train
"जब राम रहीम बलात्कारी बाबा पैरोल पर बाहर आ सकता है  तो  14 साल से जेल में बंद शहाबुद्दीन साहब और  अतीक अहमद, मुख्तार अंसारी, बाहर क्यों नहीं आ सकते हैं!  @user @user",0,train
"हौजकाजी मामले में दिल्ली पुलिस का बड़ा एक्शन, 2 लोग गिरफ्तार, नाबालिग हिरासत में",0,train
"10 रुपए की किताब   (बीरबल की कहानियाँ) बता देती है   अकबर कितना बड़ा गधा था और इतिहास की किताबों   में पढा रहे हैं अकबर महान था,,,",0,train
साले की बीवी चूड़ी मेरी लुंड से,0,train
क्यों केवल हिन्दू का ही अनकट पसंद है मौलाना के लुंड में ताक़त नही होती क्या?,0,train
"सबसे पवित्र रिश्ता होता है #बहिन_भाई का, देख ले #नीच @user  @user वालो इस फोटो को ध्यान से देखो और इल्जाम लगाने से पहले इस पवित्र रिश्ते की लाज रख लो, इस देश का तू एक महान खिलाड़ी था लेकिन इस राजनीति के चक्कर में कितना गिर गया रे #थू_है_तुझ_पर   @user @user",1,train
सूअर गटर मे पडा़ रहना चाहता हैं तो पड़ा रहने दो भाई,0,train
तेरी जैसी पत्रकार भारत के लिए हानिकारक है।  #रंडी,0,train
तैयार हो जाइये... Yamuna challenge trophy is coming back.. याद है न ! Pls rewind @user @user @user,0,train
#बेरोज़गारों/#शोषित कर्मचारियों का #महागठबंधन हो गया तैयार   #उत्तरप्रदेश_सिपाही_भर्ती_2013  #32022शारीरिक_शिक्षा_खेल_अनुदेशक_बीपीएड   #BEDTET2011   #शिक्षामित्र   #अनुदेशकों_को_नियमित_करे   #शिक्षाप्रेरक  सब युवा उत्तर प्रदेश में एक हो गए है @user जी ध्यान रहे   @user,0,train
आज भी कई लोगो को गलिय पड़ती पर वो चुप रहते ह सही पगर नही मिलती फिर भी काम  करते है उनसे ये बोल जाता है अभी काम का लो फिर तंख्वा बढ़ा देगे फिर काम होने पर निकल दिया जाता है   #कमीने मालिक #दिलसे,0,train
हनीप्रीत बिना पापा #RamRahim को खेतो में रोटी पानी देने कौन जाएगा ?    उसे भी साथ मे पैरोल देना खट्टर साहब...,1,train
#AIMIM MLA Adv @user Attend Eid Milan Event. Organised By Police Family Welfare Committee And #ShansherKhan Sahab.,0,train
बिहार की जनता जब 30 से अधिक बच्चियों के साथ हुए बलात्कार पर सड़क पर नहीं आई तो 130 बच्चों की मौत पर क्यों आएगी? : रवीश कुमार,1,train
"#IndvsEng दुनिया की दो बेहतरीन टीमों के बीच आज मुकाबला, #पाकिस्तानियों की दुआ है जीत भारत की हो",0,train
BJP को अगर किसी को ट्रोल करना हो तो पूरी BJP मंडली उतार देती है? नेता-परेता सब बोलने आ जाते है।    200 बच्चे मर गए कहाँ है गला फाड़ने वाले मोदी जी? कहां उनकी मण्डली?    देश को नफरत बाट के वोट लेकर विदेश घूम रहे है चुनाव बीत गया अब उन्हें क्या फर्क पड़ता है?,0,train
पहले उस हरामी के पिल्लों को पकड़िए फिर कोई ट्वीट कीजियेगा।  इतनी हिम्मत बढ़ गया है कि मुस्लिमों के एक भीड़ ने चाँदनी चौक के लाल कुंआ इलाके में एक मंदिर को तहस नहस कर के हिंदुओं के भावनाओं को अग्नि के समान प्रज्वलित कर दिया।,0,train
बहुत #दुःख होता है और #क्रोध भी आता है जब भी मैं #दिल्ली आता हूँ और यह देखता हूँ   #सनातन_धर्म का इससे बड़ा अपमान अब न हो इसके लिए #भारत_सरकार को ठोस कदम उठाने चाहिए @user @user @user  @user @user @user @user @user,1,train
दिल्ली भाजपा की दो दिवसीय प्रदेश कार्यकारिणी की बैठक सम्पन्न    आज मुझे बड़ा हर्ष हो रहा है कि मुझे तीन पीढ़ियों के कार्यकर्ताओं से मिलने का अवसर मिला - श्री @user,0,train
लम्हे लम्हे ज़िन्दगी गुज़रती गयी  शिकवे शिकायतों की कड़ियाँ जुड़ती गयी।,1,train
एक डॉक्टर के क्लीनिक में लिखी हुई एक बेहतर लाइन....  दवा में कोई खुशी नही है....और खुशी जैसी कोई दवा नही है....!!!  @user @user @user @user @user @user @user @user,0,train
अमेरिकी राष्ट्रपति #DonaldTrump रविवार को #SouthKorea के सर्वोच्च नेता किम जोंग-उन के साथ द्विपक्षीय बातचीत करने से पहले उत्तर कोरिया की सरजमीं पर कदम रखने वाले पहले अमेरिकी राष्ट्रपति बन गए।,0,train
3 लाख 50 हजार मतों की भारी लीड से #कन्हैया_कुमार ने #बेगूसराय सीट हारी।    'ले के रहेंगे आज़ादी',0,train
उसके साथ कुछ नामर्द पुलिस वाले थे हाथ में बंदूक लिए खड़े पीटते देख रहे थे। उसी समय उस मादरचोद नेता के पिल्ले को भून देना चाहिए था।,0,train
"गोड्डा लोकसभा का दूसरा roadshow 8 km गोड्डा शहर में.. जनता का ये प्यार क्या कहता है @user को ?  मोदी जी तुम राह गढ़ो, देश तुम्हारे साथ है @user @user",0,train
"भोसडीके अंधे लौड़े ,go read data of pakistan human index",0,train
देश मे 100 से अधिक बच्चे बिहार के मुजफ्फरपुर में #ChamkiFever के कारण अपनी जान गवा बैठे उसको दरकिनार कर के लोग भारत की क्रिकेट में जीत की खुशी मना रहे है 80% लोगो को तो जानकारी भी नही होगी और कुछ लोग जानना ही नही चाहते ।,0,train
"सरकार बलात्कारियो पे सख्त कानून क्यो नही ला रही है? देश-प्रदेश में ऐसी घिनौनी घटनाएं हो रही है।    सरकार क्यो ख़ामोश बैठी हुई है, राम मंदिर से पहले बलात्कार पे कानून लाओ जिसकी सज़ा सिर्फ़ 10 दिन के अंदर फाँसी होनी चाहिए?    देखते कितने निहायती निर्लज्ज इस कानून का विरोध करते है?",1,train
तफसीले छोड़ो…  बस इतना सुनो…    तुम बिछड़ गए…  हम बिखर गए…  #Atish   #GoodNightTwitterWorld,0,train
ऑस्ट्रेलियन पीएम :- कितना अच्छा है मोदी!   राहुल गांधी :-अच्छा!तो  कभी भारत से  चुनाव लड़ कर   दिखाओ !,0,train
मेरी कल की चुदाई क्लियर हिंदी ऑडियो,0,train
मालनी भाभी की आफिस की दोस्त ने चुदाई की 10,0,train
और फिर भी यह सूअर की औलाद कट मुले कहते हैं कि इस्लाम खतरे में है,1,train
Ab ek kaam karo yadav ji jeevan se sanyas lekar Pahado par chale jao,0,train
ये देखो दूसरा वीडियो. इसमें ये हरामजादी एक कुत्ते से उसका बच्चा छीन जे ले जा रही है. वीडियो तो ऐसे बनाया है जैसे कुत्ते के बच्चे से UPSC की तैयारी करायेगी साली भेनचोद.,0,train
#भगवा_रंग की ड्रेस भारतीय टीम के लिए बहुत ही #अशुभ साबित हुई। उम्मीद है खिलाड़ी दुबारा नही पहनेंगे ये रंग की ड्रेस।।,0,train
#AIMIM Marathwada President Feroz  lala sahab today Addressed Party Workers Meeting At Ahmedpur Latur District Maharashtra.,0,train
शादीशुदा दीदी को चोदा मेरे मोठे लुंड से,0,train
यही सब हरामी है जो रेप जैसी घृणित कार्य कर रहा है। चुतिये इतनी गर्मी है तो अपने बहन और मां को अपने नीचे लेटने बोल। मैं तो ऐसे चुतियों को ढूंढता हूं मिले तो चमड़ी खींच लूंगा।,0,train
सोचिए   एक #इंसान आम आदमी से   #मुख्यमंत्री   #मुख्यमंत्री से #प्रधानमंत्री   #प्रधानमंत्री से #विश्वस्तरीय नेता बन चुका है   और कुछ लोग हैं   जो विपक्ष में #कुत्ते की तरह पहले भी #भोंकते थे   अब भी #कुत्तों का #झुंड बनाकर भोंक रहे हैं।,1,train
"अरे दलालों गिरफ्तार तो चोर को पीटने वाले भी हुए थे, फिर १० दिन तक डिबेट पर डिबेट क्यूँ पेल रहे थे,   सर पर माता बैठो ऐसे दंगायीओ को नहीं तो एक दिन तुम सबके कार्यालय पर भी हमला ऐसे ही बोला जायेगा. abp न्यूज़ को याद कर लेना. उसने न्यूज़ भी नहीं दिखाया हरामी चैनल ने.",0,train
पिता के ओर पिता समान चाचा के पैर पकड़ लेते तो आज दूसरों के पैर पकड़ने की ज़रूरत नहीं होती ओर ये दिन जिनकी तुमने कभी कल्पना भी नहीं की होगी आज देखने नहीं पड़ते ✅ अहंकारी को उसका अहंकार ही मारता है ✅✅✅✅✅,0,train
गांड में लुंड का आनंद 1 http,0,train
अब वैज्ञानिकों ने पाया है कि थर्ड-हैंड धूम्रपान (टीएचएस) भी किसी व्यक्ति के श्वसन स्वास्थ्य पर असर डाल सकता है. इससे जीन एक्सप्रेशन में बदलाव से हो सकता है.,0,train
"5 बच्चे लापरवाही से मरे तो जापान का PM इस्तीफा दे देता है हमारे यहां 200 बच्चे मरने पर भी बेशरमों को शपथ ग्रहण से फुर्सत नही,,",0,train
