text,label,split
"अब ये हलाल करके बच्चे पैदा करेगी, क्यो की कुराण मे लिखा है,की औरत बच्चे पैदा करणे की खेती है  अब ये रंडी बुरखा पहन के घर मे acting करेगी",0,train
दोस्तों! ये जितनी भी सेकुलर पार्टियाँ हैं ये मुसलमानों को विधायक/सांसद तक तो बना देती हैं मगर नेता नहीं बनने देती हैं। मेरे इशारे को समझना। हमेशा मक़सद बड़ा होना चाहिए। मेरी लड़ाई कभी छोटे मक़सद के लिए नहीं रही। यही वजह है कि जितनी बार भी मेरा आमना सामना हुआ तो सीधे सीएम से हुआ।,0,train
New India -:} देखिए इस मासूम बच्चे को 3/4 लोग मिलकर बेरहमी से पीट रहे है  न्यू इंडिया की तस्वीर देखिए पुराना भारत !!,0,train
"गाय का गोस्त ले जाता पकडा गया भाजपा का कार्यकर्ता हैदराबाद मंदिर मे ले जा रहा था दंगे करवाने के लिए#अंधभक्तों की #नीच हरकत, ये चाहते ही नहीं देश में #शांति  @user @user @user @user @user @user @user",0,train
"जब से मैंने तोहे निहारा, रातों को न सोई....    #krishnakanhaiya #muraliwale #mohan #kanhaiya #radheradhe #jaishriram #gopalkanhaiya #bhajansandhya #acharyapramodkrishnam  @user",0,train
तेरे अंदर की अंतर आत्मा मर चुकी है माधरजात साला तेरा बाप भी पछता रहा होगा की तुझ जैसे हरामी सेक्युलर को पैदा करने से अच्छा होता की मैं कोई कुत्ता पैदा कर लिया होता कम से कम वो अपनो से वफादार तो होता,0,train
"G-20: जापान से दिल्ली वापस लौटे पीएम मोदी, अंतिम दिन की 6 बैठकें    #PMModi   http …",0,train
यहां कांग्रेस और मीम की बात नहीं है वे सुअर तुम जिसको गाली दिया पहचानता था उसको .??  या जिसको तुम टारगेट किया उक्त महिला ने तुम्हारा कुछ बिगाडा था ?  इसका जबाब दो ना मादरचोद बिहारी  ' वेश्या के पैदाइस',0,train
"पर ये #कुत्ते ऐसा कर क्यों रहे है, सार्वजनिक बसों में तोड़/फोड़ अपराध है, क्यों इस सम्पति को नुकसान पहुँचा रहे है?? क्या ये देश की संपत्ति इनकी सम्पति नही है ?? या ये #कमीने ऐसा नही मानते !!!",0,train
इस मादरचोद को कुत्ते की मौत देना वाला कब आयगा ।,0,train
अपने कार्य के प्रति समर्पण ही सच्ची सेवा है।,0,train
देश का सबसे हरामि बुड्ढा है यह। अब इसका पेशा हड़ताल करना और जूस पीना है ऋ,0,train
"awasthis सुनिए जनाब,    AIMIM झारखंड कि टीम ने मोब लिंचिंग में मारे गए तबरेज के परिवार को 50000 रुपये और इस केस को लङने के लिए हर तरह का खर्च उठाने का ऐलान किया है।",0,train
Biahar m bukhar s 69 bachhe mr gye o kisi Ko nhi dikh rha h,0,train
"रे रंडी के बीज ,ऊपर के कटूओं के रिप्लाई देख ले पहले कि ऐसी सीरियस ट्वीट पे बकचोदी किसने शुरू की है ..और तेरे हजारों नीच सुअर के गू में पलने वाले मलेच्छ हर पल गाली देते हैं, कोई बहुत बड़ा तीर नहीं मार लेगा तू !",0,train
We'll always support u in every conditions,0,train
जिस देश में #कन्हैया_कुमार जैसा पढ़ा लिखा युवा हार जाए   आतंकवादी #प्रज्ञा जीत जाए  उस देश की जनता #पकोडे तलने लायक ही है!,0,train
"271 करोड़ रुपए लेकर भागीं दुबई की महारानी, PM पति से की तलाक की मांग    http …?",0,train
"बाबारामरहिम ही क्यू एक बार जेल में बंद सभी बलात्कारियों की लिस्ट निकलवा लो , देखो सबकि एक साथ ही जमानत करवा लो,,,",0,train
असम: NRC की गणना पूरी करने के लिए समयसीमा 31 जुलाई तक बढ़ी    #NRC   http …,0,train
बाॅलिवुड के हिरो/हिरोईन ओर डायरेक्टर को दिखाओ ये..भिखारीयो को बाॅलिवुड मे लाता हो.पैसे वाला बनाते हो. ओर वो देखो कैसे तुम्हारे जले पर नमक छिडकते है..भेनचोद ने आतंकवादी हमले की निंदा नही की पर बेवकुफ इम्रान की तारिफ की.आतंकवादी देश है पर उनके देश के साथ गद्दारी नही करते वो.,0,train
"जिस गांधी परिवार को जाहिलों की पार्टी गाली देती है    उसी गांधी परिवार के दो दो PM अपने भारत देश पर क़ुर्बान हो गए!!    जिस पार्टी ने देश को इसरो, टेक्निक, मिसाइल और न जाने क्या-क्या दिया? फिर भी अनपढ़ अपने नाकामयाबियों को ठीकरा कांग्रेस के ऊपर फोड़ते है।    हद्द है इस दोहरेचरित्र का।",1,train
लड़कियों के लिवास में #कमीने  बात करते हैं राजनीत की                 #डंडा कहाँ है मेरा,0,train
"@user जैसा घटिया नीच हरामी नेता इतिहास में ना हुआ है, और ना ही होगा।",0,train
#Maharashtra में भारी बारिश अब लोगों के लिए आफत बन गई है। #Mumbai और #Pune में तीन अलग-अलग स्थानों पर दीवार गिरने से केवल एक रात में 22 लोगों की मौत हो गई। इस हादसे में कई लोग गंभीर रुप से घायल भी है। #MumbaiRain #MumbaiRains,0,train
"देखें, मुंबई वालों की ज़िन्दगी में 'चिंताओं की बारिश' का विश्लेषण  @user #DNA",0,train
"इस्लामिक आतंकवाद  इस्लामिक आतंक का समर्थन करने वाले मुस्लिम  मस्जिदों में से बहार निकलते मुस्लिम पत्थरबाज,  झंडे पर कुरान की आयतें लिख कर ह्त्या और बलात्कार की धमकी देने वाले मुस्लिम आतंकवादी  इस्लामिक आतंकियों का समर्थन करने वाले पाकिस्तानी कश्मीरी  @user @user @user",0,train
वैसे भी ये सुअर मस्जिद में करते क्या है एक दूसरे का पिछवाड़ा ही तो देखते है,0,train
#GhantiBajao में आज रात 10 बजे @user के साथ देखिए    जनता अरबों का टैक्स भरे...और बारिश में डूब मरे !,1,train
बंगाल में रामकृष्ण मठ के संत को पेड़ में बांधकर इस्लामिक गुंडों ने मारा। यह खबर बिकाऊ मीडिया ने नहीं दिखाई क्योंकि इससे हिन्दू जाग जायेगा ?    जय श्री राम !!!आखिर ये रंडी क्या केरेअगी,0,train
तेरे जैसे सुअर जो छुप छुप कर आग लगाने का काम करते हैं उससे तो बहुत अच्छा है @user news चैनल कम से कम खुलकर तो बोलता है सुअर की औलाद,0,train
Live programme urs e Chahallum Huzur Tajushshariya,0,train
"Mirzapur,  Dara hua Musalman Mob Lynched a Hindu Man who was on his way to the Bhandari Temple for Devi Dharshan  The hate crimes against Majority Hindus NVR get highlighted!  They are facing discrimination from govts, media, judiciary..  @user @user",0,train
Bina halla kiye dhire se nikal jao nahi to 23 may ko bhagne ka mauka ni milega,0,train
"मणिशंकर द्वारा मोदी जी को #नीच कहीं जाने पर पार्टी से लघु अवकाश देने वाले राहुल गांधी जी, ममता बनर्जी द्वारा थप्पड़ मारने के वक्तव्य के बाद कभी भी उनसे कोई भी राजनीतिक समझौता नहीं करेंगे।     ऐसी मर्यादा को जीवित रखने की आशान्वित है जनता",0,train
"यह सुधरेगी नहीं कभी कश्मीर पे कभी महाराष्ट्र पे ,पैसे कमाने का यह #नीच ख्याल  अच्छा है ग़ालिब I इस पायल की दुकान बंद करवा दो तब अक्ल आएगी",0,train
"पलायन को प्रशासनिक अफसर समझ रहे हैं, मगर अपनी गर्दन फंसती देख मुद्दे से लोगों को भटका रहे हैं।    हिंदुओं द्वारा लगातार की गई शिकायतों के बावजूद पुलिस द्वारा जिहादियों पर कार्यवाही नहीं की गई।     @user प्रशांत कुमार अपनी फजीयत बचाने के लिए मुद्दे को दबा रहे हैं।  @user",0,train
"सिर्फ बाबा साहब को जानलो और उसके मानलो,फिर आपको कभी किसी बाबाओं के पास जाने की जरूरत नही पड़ेगी।  जय भीम..*  @user @user @user @user @user @user @user",0,train
आज एक काँग्रेसी ने पुछा  था सही शब्द 'नर्क' है या 'नरक' है ?     मैंने कह दिया - आपको जाने से मतलब या शब्द से ?    तब से नाराज़ हैं।   #SaturdayMotivation   @user,0,train
"कौन कहता है वो सबका साथ सबका विकास करेगा? कौन कहता है कि उसने ग़रीबी देखी है? कौन कहता है वो जनता सेवक है?    एक्टर-खिलाड़ी के बुखार-चोट पे ट्वीट, लेकिन सैकड़ो बच्चे मर रहे है उसे कोई खबर ही नही?    वोट के लिए रोता है और बच्चो की मौत पे डिनर करता है कभी देखा है बेशर्म प्रधानमंत्री?",1,train
"हम ' जय भीम ' का नारा लोगों को शिक्षित करने, ज्ञान का प्रकाश जलाने एवं आपसी बंधुत्व जगाने के लिए करते हैं ।",0,train
"चचा, जिंदा हो क्या?   छोटी छोटी बातों पर ट्वीट करने वाले ने पिछले 5 दिन से कोई ट्वीट नही किया।   वो कन्हैया आपकी सांत्वना का इंतजार कर रहा है।   #कन्हैया_कुमार   #भारत_माता_की_जय   #AbHogaNYAY   #ModiAaGaya",0,train
इतनी कट्टरपंथी के बावजूद अकेला शेर बिना किसी हिचकिचाहट अल्लाह के नाम के साथ शपथ लेता है  वाकई में बंदा काबिले तारीफ है  @user @user @user @user,0,train
"पत्थरबाजी खत्म हो चुकी है, अब कोई पत्थरबाज नजर नहीं आते ??",0,train
"जमशेदपुर में #AIMIM झारखंड टीम का जोरदार स्वागत,  मजलिस बहुत जल्द पूरे झारखंड में अपना परचम लहराएंगे  इंशाल्लाह.  जमशेदपुर के सभी लोगों के जज्बे के झारखंड टीम बहुत-बहुत मुबारकबाद पेश करती है और शुक्रिया अदा करती है. @user   @user",0,train
बिना IAS परिक्षा पास करे IAS बनाने की मोदी योजना क्या अपने खास लोगों को ऊंचे औहदे पर पंहुचाने की चाल है ?,0,train
"दिल्ली की कई जगहों में सीवर वाला गंदा पानी आ रहा है, केजरीवाल जनता को बताएँ कि उन्होंने इस पर क्या क़दम उठाया- श्री @user",1,train
@user @user @user @user @user @user @user,0,train
ये भड़वा भी बकरचोदि बहुत करता है..डर लगा   इस्लाम कलंक है दुनिया में,0,train
"अखिलेश यादव को अपने सोशल मीडिया को मज़बूत करना चाहिए, अब लोग सोशल मीडिया से ज्यादा जुड़े है।    पार्टी के नेतृत्व बहुत ही अच्छे हाथ मे है लेक़िन कार्यकर्ता और सोशल मीडिया काफ़ी कमजोर है समजवादी पार्टी का।    आज अखिलेश यादव के जन्मदिन पे एक ट्रेंड नही चला सके सपाई।    निंदनीय!",0,train
Discover the most read open access article in EPJ Data Science today! http,0,train
हैदराबाद : विधायक कोनेरु कोनप्पा के भाई और जेडपी वायस चेयरमैन कोनेरु कृष्णा और उनके समर्थकों ने रेंज ऑफिसर अनिता और अन्य कर्मचारियों पर हमला किया....  हमले में अनिता गंभीर रूप से घायल हो गई    जंगल राज,0,train
भगवा से डर गया भड़वा,0,train
"हौज़काज़ी: सड़क पर पढ़ा गया हनुमान चालीसा, मुस्लिम समाज मंदिर बनवाने में मदद करेगा",0,train
"Pics of the year   Main akela hi chala tha janib -e- manzil magar,  Log aate Gaye #Karwan banta Gaya ,,    Alhamdu Lillah @user sahab ke karwan ki shuruwat ho gayi     @user @user @user",0,train
सड़क छाप संघियों का हिंदुत्व आसाराम से शुरू होता है और पादवी प्रज्ञा पर खत्म..,0,train
एक छोटी सी बच्ची गली में 4-5 कुत्तों को देखकर डर गई     कुत्ते बोले निकल जाओ बेटी हम #कुत्ते हैं   #मुसलमान नही,0,train
अबे फर्जी ढोंगी तुझे आज  याद आया वो     अबे उस पर ट्वीट कर दिल्ली में तेरे वोटर ओर कांग्रेस के मा बाप जिन्होंने मंदिरों में तोड़फोड़ की   इस मुद्दे पर एक भी हरामी नहीं बोल रहा है सब के सब बिलो में छुपकर बैठे है,0,train
राज्य सभा में जम्मू कश्मीर पर मेरा भाषण,0,train
रानी #लक्ष्मीबाई के बलिदान दिवस पर विनम्र श्रद्धांजलि,0,train
"बीकानेर का पापड़ संसद में आवैसी साहब के जय भीम बोलने पर हंस रहा था ,पर उसे क्या पता जय भीम बोलना शेरो का काम है गिद्दड़ों का नहीं",0,train
भोसडीके  अभिनंदन को बीच में लाने को किसने बोला ?   मा चोदेंगे फिर तो,0,train
"अंजना ओम कश्यप  जी बेहतर होता आप डॉक्टरों के काम में अड़ंगा अडाने के बजाए बिहार में बहार है कि बात करने वालों से ऐसे सवाल पूछतीं, मासूम बच्चों की पीड़ा को दिखाने के बजाए आप टीआरपी में लगी हुई हो, हिम्मत है तो सरकारों व सरकारी तंत्र से जाकर पूछिए।",0,train
"कहीं दलितों को मारा जा रहा है तो कहीं मुस्लिमों पे लीचिंग की जा रही है।    कही पत्रकारों के ऊपर पेसाब कर दिया जा रहा है, तो कही सरकारी कर्मचारी को बल्ले से मारा जा रहा है।    इन तानाशाहों ने हर जगह आग लगाई हुई है, सत्ता के बल और घमंड पे दबंगई पे उतर गए है भाजपाई।",0,train
"कितनी शर्म की बात है न कि हम सोचते है हम अमेरिका चीन और जापान जैसा देश बनाने का सपना देख रहे है।    जहां एक मीम और गाय पर पूरी सत्ताधारी पार्टी  और मीडिया उतर जाती है, वही 200 बच्चों के मरने पर सब गूंगे बन गए है।    क्या पहले ऐसा था हमारा देश? क्या इतनी बेशर्म थी सरकार और मीडिया?",0,train
"दिल्ली-NCR वालों को गर्मी से जल्द मिलेगी राहत, तीन से पांच जुलाई के बीच मानसून देगा दस्तक",0,train
5 साल से रंडी रोना रो रहा है एक को तो भेज के दिखा पिछवाड़े मे दम है तो। ये बाप का हिन्दुस्तान नही है। जिस दीन हम भगाना शुरू कर देगे तो तू कहीं जाने लायक नही रहेगा,0,train
ये फ़िल्म इंडस्ट्री के सारे खान तोह बड़े हरामी निकले।  एक 18 साल की बच्ची को इस्लाम पता है लेकिन इन्हें नही।  ये तोह फ़िल्म में भी काम करते हैं और हिन्दू से शादी भी कर रखी है। इस्लाम में तोह दोनो हराम है।  @user   @user   @user   #ZairaWaseem   #zairapedangal,1,train
कैलाश विजयवर्गीय :- तू है कौन? तेरी औकात क्या है?     पत्रकार :- साहब मैं दलाल हूँ   @user @user @user @user,0,train
बिहार में चमकी बुखार के प्रकोप पर सीएम नीतीश कुमार LIVE    देखने के लिए नीचे लिंक पर क्लिक करें:    http …,0,train
"अगली बार कोई ऐसे मैसेज करे तो उसको ऐसे रिप्लाई करना     'तो तेरी अम्मा चुदा कहीं जाके भैन के लौड़े, तेरी मां की चूत गांडू, नही तो तेरी गांड़ में सरिया गर्म करके घुसेडूंगी और तेरे मुँह से निकालूंगी मादरचोद'",0,train
@user रिश्ता #श्री_विद्या से दूसरा #वाणी_गणपति तीसरा #सारिका (जिसकी श्रुति हसन और अक्षरा है) चौथा #सिमरन_बग्गा जो 22 साल उम्र में छोटी थी पांचवा #गौतमी_ताडिमल्ला जिसके साथ अभी रह रहा है ...  चरित्र का इतना #नीच आदमी बता रहा है कि गोडसे भारत का पहला आतंकवादी था....,0,train
आदरणीय अखिलेश यादव जी  आप उत्तर प्रदेश की  शान थे आदरणीय अखिलेश यादव जीआप उत्तर प्रदेश कीशान थे …,0,train
"SC ने चुनाव आयोग से EVM, VVPAT से संबंधित याचिका पर दो हफ्ते में मांगा जवाब",0,train
