text,label,split
"200 इस्लामिक आतंकवादियों ने मंदिर पर हमला किया मुर्तियो को तोड़ा , हरामियों आपसी झगड़े में  मंदीर पर हमला क्यो किया,फिर केस कमजोर करने के लिए एक नाबालिग को आगे कर दिया,अब सुवर शांति का नाटक कर रहे हैं,हरामी पतलकार एक मस्जिद तोड़ा गया होता तो तु और तेरी बेगम नंगी नाच रही होती",1,train
"जो काम आंखों से हुआ,,  काजल यूं ही बदनाम हुआ,,  इश्क की राह में जानम,  ऐसे ही गुलिस्तां आम हुआ।।    #हिंदी_शब्द   #शब्दनिधि",0,train
क्योकि वो जानता है मध्यवर्गी कितने #कमीने  होते है ..,1,train
चड्डी में है हरामी .. लगता है करने जा रहा है,0,train
Akhilesh ji ap apne thought se lachaar hain..yogi is best cm so far.... Apna dukaan kaise lagayenge fir ye sochiye,0,train
पूरे 10 मिनट पका दिया फोन पे भेनचोद ........,0,train
इस सूअर और इसके खानदान का कश्मीर में रहना भी उतना ही अस्थाई होना चाहिए जितना की ये सोच भी न सके।,1,train
क़ानून व्यवस्था नहि संभल रही होती तो आज तेरे चमचे तेरी फ़ोटो पर माला डाल के शौक़ कर रहे होते #कमीने इंसान,0,train
"तो हो जाओ ना दफन,अल्ला हु अकबर बोल कर हमारे मंदिर क्यों तोड़ रहे हो,सहनशीलता की भी एक हद होती है,गुजरात का रंडी रोना रोने वालो गोधरा क्यों भूल जाते हो!",0,train
साले ये #हरामी_जनता_पार्टी के कुत्ते पैदायशी #कमीने है ये #कुत्ते अपने बाप #गोभी_फेक_नरेन्द्र और #तडीपार  को खुश करने के लिये किसी भी हद तक जा सकते है,0,train
गोदी जी गोबी जी खुद तो बेरोजगार रहे पर जब बेरोजगार लङके लङकियां नौकरी मांगते हैं तो उन पर दुश्मनों की तरह लाठियां चलवाने से नहीं चूकते...!!  @user @user @user @user @user @user,1,train
नाम से ही अमेरिका के एयरपोर्ट पर तय होता है कि आरती उतारनी है या पतलून....    और चमचे कहते हैं नाम में क्या रखा है    #कमीने,0,train
"would like to thank Modi Govt for this?     #डरा_हुआ_मुसलमान कहता है if you say thank you to Modi,  you are anti-Muslim",0,train
सर अगर आप उन सुअर की औलादों के खिलाफ कुछ बोल नही सकते हो तो इससे अच्छा होगा कि आप इस मुद्दे पे कुछ भी न बोलो,0,train
*गुप्त-धन* रखने से सरकार नाराज    *गुप्त-बात* करने से दोस्त नाराज    *गुप्त-काम* करने से मालिक नाराज    *गुप्त सम्बन्ध* रखने से पत्नी नाराज़     परंतु मंदिर में  *गुप्त-दान* करने से भगवान कैसे खुश होते हैं    *यह नहीं समझ आता है...*   @user @user @user,1,train
"अरे सिरखुजेवाला    हमने सोचा कोंग्रेस में बेवकूफ, डफोल, हरामी देशद्रोही, कमीना एक विचि ही है लेकिन फिर याद आया कि यहाँ इस पार्टी में तो सारे इन्ही गुणों वाले ही लिए जाते है।",0,train
"बांग्लादेश की शानदार वापसी, भारत को 314 रन पर रोका #INDvBAN #CWC19",0,train
"साध्वी प्रज्ञा के बयान पर आग बबूला होने वाला आईएएस,आईपीएस एसोसिएशन   #कमीने आजम खान के जुता साफ वाले बयान पर चुप क्यो   #शर्म करो",0,train
"तीन “तलाक़”  पर संसद में “हिंदू” नेता, मुस्लिम औरतों के अधिकारों की दुहाई दे रहे हैं, और ओबेसी हिंदू बहनों के “हक़” की लड़ाई लड़ते हुए दिखायी दिये..........ये है न्यू इंडिया.",0,train
ये जमीं वो आसमां  तेरे कंगन से होड़ लेते  सुर्ख फूलो से रंग चुरा  सूरज को सोने सा बनाती है चुड़ियां  #हिंदी_शब्द #शब्दनिधि,0,train
अमें! सामने मीडिया और कैमरा ऑन करवा कर साधना में कौन लीन होता है!   हद हो गयी नौटन्की की     #ModiInKedarnath,0,train
Kuchh loagoan Ko babasir bhi hai Pandey andey ko,0,train
दिल्ली में मंदिर में हमला होता है   और केजरी भड़वा सोता है ।,0,train
हरामी के पिल्ले जल संकट और आतंकवाद को तुने एक साथ कर दिया भौपरी वाले,0,train
मंदिर को तोड़ने वाली भीड़ के नारे सुनकर मुझे विश्वास नही हो रहा हम दिल्ली में है!!!    मुझे तो एक बार ऐसा लगा हम जिहादियों के देश में बैठे है।     @user को ऐसी भीड़ का नेतृत्व करने वाले और उपद्रव मचाने वालों के खिलाफ सख़्त से सख़्त कार्यवाही करनी चाहिये  @user @user,0,train
@user The picture speaks only #नीच     @user  @user  @user  @user  @user  @user  @user  @user  @user  @user  @user  @user  @user  @user,0,train
"#मालेगांव बम ब्लास्ट  पेटदर्द के चलते कोर्ट में  पेश नहीं हुई #प्रज्ञा_ठाकुर,  - ओह माय गोडसे...",0,train
"कितना “मादरचोद” आदमी नहीं, हैवान है ये...   http …  #TempleTerrorAttack",0,train
"#TempleTerrorAttack #TempleDestroyed #ChandniChowk कौन कहता है के इस देश में मुसलमान डर के साये में है, वेस्ट बंगाल और दिल्ली में जा कर देख लो जहाँ आपको कश्मीर का अलगाववाद, आतंकवाद, पत्थरबाज, कठमुल्लावाद, इस्लामीकरण और देशद्रोहिता सब नज़र आ जायेगी...",1,train
भोसडीके ये अफवाह नही सत्य है। 8% होकर सारे दलितों का हिस्सा खा रहे हो तुम लोग,0,train
अमर शहीद स्व शहीद राजीव जी पर PM की गन्दी टीप्पणी पर मेरा मानना है   की 2 साल पहले सही कहा था मणिशंकर अय्यर ने ये बहुत ही #नीच किसम का आदमी है,1,train
हर एक #बॉय की दिल की     ख्वाइश होती है ?……..    खुद #कितने बड़े #कमिने होंगे     पर #लड़की शरीफ ही #चाहिए !!,0,train
मीट की दुकान पर आधारकार्ड  दिखाना अनिवार्य किया जाये  ताकि पता तो चले की कुरैशी जी ले रहे हैं या मिश्रा जी   धर्म के ठीकेदार?,0,train
Aap neta achhe h lekin jab tak sankeern rajneet karenge yahi haal hoga apka fayda bua utha le gayi aap wahi k wahi rah gaye,0,train
All the best ready for Go to jail ..,0,train
ये किस जुगाड़ में हैं हर बार किसी को बेइज़्ज़त करना अच्छा नही है @user @user @user @user,0,train
BMC के कंट्रोल रूम पहुंचे सीएम @user -     #MumbaiRainsLiveUpdates #MumbaiRainlive #MumbaiRain      http,0,train
"'इस मुल्क में इंसाफ के लिए लड़ना जुर्म हे, मुझे डराने धमकाने की कोशिश इसलिए हो रही हे क्यूंकि मेने मेरी कौम के लिए लडा और एक मासूम मुसलमान बच्ची को इन्साफ दिलाने की कोशिश की हे.' Adv. Mubeen Farooqui Lawyer in Asifa Case  इन पर पंजाब की कांग्रेस गवर्नमेंट ने झूठा केस दर्ज किया हे.",0,train
केंद्रीय स्वास्थ्य एवं परिवार कल्याण मंत्रालय ने आधिकारिक बैठकों में बिस्किट रखने की मांग की है.,0,train
#कांग्रेसभवन के सामने @हवन....  लगता है 2019 के #हवनकुंड में लगभग सभी #बेशर्म और #नीच  स्वाहा हो जाएंगे?,0,train
मोदी बाबा बोलते है कि सोनिया गांधी कांग्रेस की विधवा मा है।  फिर तो मोदी बाबा भाजपा के नामर्द   बाप है।,0,train
मुंबई सबसे ज्यादा टैक्स भी दे और जान भी ?  मुंबई नहीं 'सिस्टम' डूब गया !    #MumbaiRains पर ट्वीट कीजिए     देखिए ताल ठोक के 4:55 PM बजे @user पर @user के साथ,0,train
"चूड़ी ,बिंदी , काजल और झुमका   सब तेरी पसंद के पहने..  फिर भी तेरी पसंद ना बन पाई...!!    क्या असुंदर होना भी दोष है मेरा ??    #हिन्दी_शब्द    #एक_खुशी                                     #शब्दनिधि",0,train
अलीगढ़ में एक बच्ची के साथ क्या हुआ? दोषी का क्या हुआ? अब 20 साल कोर्ट में केस चलेगा. क्या यह पहली किश्त है? नहीं. ऐसी कई किश्त है. धर्मनिरपेक्ष की भडवागिरी नहीं चाहिए. 1947 में दोनों हाथ उस हरामी गांधी ने काट दिया था. और नहीं.,0,train
बापू हम शर्मिंदा हैं तेरे क़ातिल अभी ज़िन्दा हैं   #प्रज्ञा_ठाकुर मुर्दाबाद  #गोडसे मुर्दाबाद..,0,train
महान क्रान्तिकारी पं. रामप्रसाद बिस्मिल जी की जयंती पर शत्-शत् नमन।,0,train
"Explained: जल संकट है देश की सबसे बड़ी समस्या, नहीं किए गए उपाय तो बूंद-बूंद के लिए तरस जाएंगे लोग http … #WaterCrisis #WaterCrisisInIndia",0,train
"Kaiske saath Naya Gathbandhan ka,Phale Congress ke saath haare ab BSP ke saath.Naya Gathbandhan kiske saath.Waise bhi you are nominated CM by your father not elected CM by public",0,train
प्रचा मैंने सुना है तुझे पैदा करने वाला भी कोई हरामि था,0,train
"अबे कटे लंड के औलाद, रंडी खातून के पैदाईस सुन, अगर गलत को गलत मान रहे हो तो मर्यादित भाषा में टिप्पणी करो।",0,train
सुअर है तू।अपने पिल्लो को तो रोक ले,0,train
"भाजपा अप्रत्याशित बहुमत से दिल्ली की सातों सीटें जीत रही है, आम आदमी पार्टी तीसरे नम्बर पर जा रही है और कई उम्मीदवारों की जमानत भी जब्त हो सकती है- श्री @user",0,train
अबे रंडी तेरे भेंन का भोंसड़ा कटवे लोगो का faith है और जब बात हिन्दुओ की हो तब तेरे चुत में कौवा हग देता है क्या बे तेरी मैया के बुर चोदो मादरचोद भडवी की औलाद साली कुत्तिया छिनैल रंडी भडवी कुते की पैदायश मादरचोद सुवर के झांट की बाल साली कुत्तिया रंडी भेंनचो,0,train
कश्मीर से मेहनत की दो रोटी कमाने के लिये लखनऊ आए कश्मीरियो को डंडे से पीट रहै गुंडे खुद को देशभक्त कहते हैं..!!  कश्मीर हमारा है पर कश्मीरी नही ??  तहज़ीब का शहर #लखनऊ    #मोदी है तो मुमकिन है।।    @user @user @user @user,0,train
"दिल्ली के कुल 13,816 बूथों में से भाजपा ने 12064 बूथों पर विजय हासिल की है। दिल्ली की जनता विधानसभा चुनावों में भी कमल खिलाने को तैयार है - श्री @user",0,train
रंडी तू ही है  ऐसा मेहनत का खाने के लिए कुत्ती खराब भोसड़ी की बहन की लोहड़ी भडवी,0,train
नबी तो बहुत थे...  लेकिन हम तो उस नबी की उम्मती है  जिनको देखकर पत्थर भी कलमा पढ़ते थे..!    @user @user @user,0,train
"यूपी के कानपुर में 'जय श्री राम' नहीं बोलने पर बाइक सवारों ने टोपी पहने किशोर को पीटा, मामला दर्ज",1,train
"लोकतंत्र - संसद - जनमत - जनसेवा - देशहित इन 5 विषयों को मीडिया दरकिनार कर देती है    मीडिया को केवल मोदी ने क्या पहना , मोदी ने क्या खाया , विपक्ष कहां घूम रहा है यही विषय नजर आते है?    मीडिया का गिरता स्तर आप उनके चलाये जा रहे हेडलाइन स्व जान सकते है।    मीडिया मतलब गुलाम और कुछ नही।",0,train
Byculla #AIMIM MLA @user ON JAI SHRI RAM CONTROVERSY.     @user,0,train
कुछ हरामी देश को बर्बाद कर रही है    खास कर हिन्दुओ को,0,train
"साथियों आज पुलिस ने तानाशाही दिखाते हुए मुझे मस्जिद जाने और मुस्लिम भाइयों के साथ एकता का संदेश देने से रोकने के लिए हिरासत में ले लिया था लेकिन ज्यादा देर हिरासत में नही रख सके,ऐसे समय मे एकता का परिचय देने के लिए सभी साथियों का धन्यवाद।अभी 9:30 बजे फ़ेसबुक पेज पर लाइव आ रहा हूँ",0,train
"आखिर क्यों तुम्हारे जैसा भड़वा ,दल्ला ,मक्कार चिरकुट चीलर हरामखोर पक्षपाती -दिल्ली के मंदिर पर हुए हमले को देखने मे असमर्थ है,,क्या मुस्लिम परस्ती ही पत्रकारिता है,, बोल कमीने",0,train
तेरे जैसे चूतिये नेताओ को चौराहे पर जूते मारने चाहिए ।तू और मायावती अपनी संपत्ति बेचकर उनका उद्धार क्यों नहीं करती। साला भड़वा चला गया चोदने,0,train
इंशिता आजाद ने नीट की परीक्षा में आँल इंडिया स्तर पर 187 वां Sc कैटगरी मे देशभर में तीसरा रैंक हासिल किया।    जब कि नीट में 720 में 673 अंक हासिल किया आरक्षण के विरोधियों को मुँहतोङ जवाब दिया बहुजन बहन को मेरी और से ढेरों शुभकामनाऐ !!  #जय_भीम_नमो_बुद्धाय  @user @user,0,train
तू खुद ऐक मिस्टेक हें भड्वा,0,train
भेनचोद ये क्या चूतियापा हो रहा है?,0,train
15 वर्ष तक कांग्रेस के कुशासन ने भ्रष्टाचार के कई आयाम लिखें तो पिछले 53 महीने से दिल्ली में एक झूठ परोसने वाला सरकार का मुखिया है- श्री @user,1,train
“Winners take it all”  But one can blame the pitch if s/he believes defeat is knocking.   @user @user @user @user @user,0,train
अबे साले इमाम बुखारी।  तेरी आतंकवादी कॉम कुछ भी करती रहे और मीडिया उसको दिखाए भी नही।ये भी तेरे सरियत में लिखा है क्या।सुअर के बच्चे,0,train
कट रही बिजली तो कटने दो हम अकेले परेशान थोड़ी है ।  कटेगी बिजली तो होगा अंधकार कितने घर मे यहां पर सिर्फ हमारा मकान थोड़े है। तुम्हारे राज्य में जो है बिजली तो वही सदाकत है । हमारे राज्य में तुम्हारी सरकार थोड़े है ।,1,train
"ये भड़वा वोट और नोट के लिए किसी के भी चुत्तड़ चाट सकता है, @user तो शायद धोता भी होगा।  हरियाणा में ये जब जब आता है इसके रैपटे पढ़ते हैं।",0,train
"#ModiRajya – To rectify the damage, he mentioned Jharkhand today, @user (MP, AIMIM), tells @user on #Viewpoint. At @user @user",0,train
UP में लगातार हो रही यादवो की हत्याओं के विरोध में और पीड़ित परिवार को एक करोड़ रूपए मुआवजा और पीड़ित परिवार के एक सदस्य को उत्तरप्रदेश सरकार में नौकरी एवं हत्यारो को फांसी की सजा की मांग को लेकर ..  चलो आज़ाद मैदान..चलो आज़ाद मैदान    दिनांक : 09/07/2019  time 12:00 to 05:00 pm,0,train
गुजरात 45 साल के नेता ने 23 साल की लड़की से तीसरी शादी की -  लोग अभी पूछ रहे हैं बीजेपी ने महिलाओं के विकास के लिये क्या किया ?  @user @user @user @user,0,train
महादरचोद तेरी माँ को नंग धड़ंग मचछरदानी में लिटा के भेन की लवड़ी की चुत में कच्छुवा छाप अगरबती जला के लँड पे सांठे के तेल के साथ डाबर लाल दंत मंजन का लेप कर के उसकी बुर में लवड़ा ठेलूं भेनचोद,0,train
"जय भीम जय मीम, तकबीर- अल्लाहु अकबर, जय हिन्द! @user",0,train
सीमा ने मेरा लुंड चूस ली 58 sec,0,train
"mumbai DRM still no any action taken for priority to local in peak hrs, express going on at time of our job time..भोसडीके",0,train
मुर्ख तो है वो परिवार देखो न अब वो बांग्लादेश को आज़ादी दिलाया कांग्रेस ने लेकिन वो बांग्लादेश की रंडी मोदी को मिठाई भेजती है वो बांग्लादेश ने भी अच्चुत बना दिया कांग्रेस को इसलिए बोलता मिया बन जा फिर देख कौन अच्चुत बनता कांग्रेस तेरे को @user,0,train
"#दोस्त ख़रीदे नहीं जाते,  ये तो वो #कमीने होते है,  जो आपको कभी #शरीफ नहीं देखना चाहते !!",0,train
"अनुमान हमारे मन की कल्पना है और ,  अनुभव हमारे जीवन की सीख ...    #जय_श्री_राम     #शुभ_रात्री",0,train
आज आजम खान ने अपनी अम्मी को नाम से पुकारा है।सरे राह रण्डी कह कर कास अपने अब्बा का नाम भी ले लेता भड़वा,0,train
