text,label,split
जब किस्मत में ही लिखा है गर्मी  में गां.. घिसना......    तो भैनचोद क्या उखाड़ लेगा नींबू पानी और रसना,0,train
मणिशंकर अय्यर ने तो एक ही बार बोला था लेकिन 'साहेब' ने कई बार साबित किया...!!    #नीच,0,train
"रंडी है साली ,केवल मुल्ले दिखते है इसे",1,train
"गुङगांव मे संघी आतंकियो ने एक मुस्लिम परिवार के घर मे घुसकर उस परिवार को बेरहमी से पीटा, इस आतंकी घटना का वीडियो सोशल मीडिया पर वायरल हो रहा है। @user स्पष्ट करे वह इन आतंकियो पर NSA लगाएगी या नही?",0,train
दिल्ली में घर के अंदर घुसकर गन पॉइंट पर लूट की वारदात को अंजाम दे रहे हैं बेखौफ बदमाश    #Delhi   http … (रिपोर्ट- @user ),0,train
आपदा से उत्पन्न होने वाली चुनौतियों से निपटने के लिए एक व्यापक योजना लंबे समय से भारत के इंफ्रास्ट्रक्चर के रोडमैप से जो गायब थी अब ये योजना बन रही है: श्री अमित शाह जी ।,0,train
हवाला टेरर फंडिंग का मुख्य सोर्स है  @user,0,train
प्रदेश अध्यक्ष श्री @user जी की धन्यवाद यात्रा। #ThankYouDelhi,0,train
"वोटों की गिनती तो कल शुरू होगी, एग्जिट पोल देख कर evm में गड़बड़ी कैसे हो सकती है भोसडीके ?",0,train
"#Media420 की नमक हरामी की हद तब पार हुई ,जब पाकिस्तान में नाबालिग हिंदू बच्ची का मुस्लिम ने अपहरण करके उसे इस्लाम धर्म अपनाने के लिए मजबूर किया  , इस बारे मे ना तो मीडिया ने मुंह खोला और ना ही सरकार द्वारा कोई ठोस कदम उठाया गया",0,train
"प्राथमिकता गज़ब की है बिहार के उपमुख्यमंत्री #सुशील_मोदी जी का।  #मुजफ्फरपुर में चमकी बुखार से कितने बच्चे मर गए उन्हे देखने के लिए इनके पास समय नही था, और   यह दुष्ट आदमी मिस इंडिया से मिलने के लिए इनके पास खूब समय है...  इन जैसों को तो #नेता नही #कुत्ते बना कर छोड़ना चाहिए।",1,train
इनके बापों मैं भी दम नहीं जो भारत को इस्लामिक स्टेट बना सकें .....हमारा भारत सनातनियों का देश है और अब हिन्दू जाग रहा है ...जो भी आएगा   पैरों तले कुचला जायेगा...  गर्व से कहो हम हिन्दू हैं   @user,1,train
"#ZairaWasim: धर्म को वजह बताने पर छिड़ी बहस, किसी ने कहा बेवकूफी भरा फैसला, तो कोई कर रहा सपोर्ट, जानें किसने क्या कहा    http …    @user @user @user #bollywood",0,train
YADAV ji log etna sath diye hote to 5 cit n jiti hoti sp,0,train
कटी हुई लुल्ली वालों की लुल्ली को ही काट दो हिंदू एक हो जाओ आतंकवादियों को मारना ही होगा बकरी चोद सूअर की औलाद खुदा को मैं चैलेंज देता हूं कटी हुई लुल्ली का पैदा करें खतना क्यों करते हो,0,train
हर लम्हा सौ सवाल  सौ में सिर्फ तेरा ख्याल,0,train
"नींद क्यो नही आएगी भाई उनको मासूम बच्चे ही तो मर रहे है, कोई उनके घर का थोड़े न कोई मर रहा है?    जब आपने BJP विकास पे नही बल्कि हिन्दू-मुस्लिम और हिंदुत्व के नाम पे वोट दिया तो अब अस्पतालों मे बदहाली पे सरकार जिम्मेदार कैसे?    अब ऐसे ही जनता रोती रहेगी हमारी सरकार सोती रहेगी।",1,train
"अनुराग कश्यप की ‘नई कंपनी, नई फिल्म, नई शुरुआत’   @user तहे दिल से मुबारकबाद सर",0,train
ये किस जुगाड़ में हैं हर बार किसी को बेइज़्ज़त करना अच्छा नही है @user @user @user @user,0,train
ये कभी नहीं सुधरने वाले सुअर है।,0,train
रंड़ी के औलाद तेरे चुतीया रंडीबाज कृष्णा नहाती हुई लड़कीयों का कपड़ा ले कर भागता था भोसड़ी वाला बलात्कारीयो का भगवान बलात्कारी। शंकर लन्ड मत चुस मेरा लन्ड चूस और चुसवा अपनी रंडी माँ से ज्यादा मजा मिलेगा। खिलजी के नाजायज औलाद माधरचोद कुता। भेज अपनी रंडी माँ को अभी चोदता हुँ,0,train
सड़क पर उतर चुकी है कानून व्यवस्था -दिन दहाड़े हत्या विपक्षी दलों के नेताओं का और आम जनता का लिंचिंग सड़क पर ही तो हो रहा है @user हो या सारे विपक्षी दल आंखें बंद कर भारत को तालीबान बनाने में केन्द्र सरकार और अन्य राज्यों की भाजपा सरकार को मदद कर रही है -अगला नं आपका व मेरा,1,train
"ये जो अंजना,  रुबिका , सरदाना लिंचिंग की खबर पर तुलनात्मक विश्लेषण करते हैं ना ये विश्लेषण नहीं होता ये उसे जायज़ ठहराना होता है ।  अगर मगर लेकिन अब तब ये सब अपने सरकार माई बाप के दामन पर लगा खून का धब्बा चाटने के लिए किया जाता है ...     Via @user",0,train
बहिन ने नंगी होकर किया मजेदार गाँड - चुत डांस,0,train
अबे... दुसरो की कमियां बहुत गिनवा लिए...तुम दोगले लोगो के नाक के नीचे 300 हरामी मुसलमान मन्दिर तोड़ दिए और तुम सब इन मुल्लो का विश्वास जीतने में लगे हो।।।,1,train
"ट्वीट कोई भी हो, ये जन्मजात भड़वा है",0,train
हाँ कुछ कमजोर भी थी चुड़ियां  चटक कर सारे राज कहे दुनियां से  #हिंदी_शब्द #शब्दनिधि,0,train
"जसोल मंदिर ट्रस्ट में जमा राशि और राम कथा में दान हुई राशि, सब इन घायलों ओर मृतको को के इलाज ओर सहयोग के रूप में प्रदान कर देनी चाहिए,।  लेकिन ऐसा यह करेंगे नही  @user",0,train
@user :आता माजी सतकली भोस्दीक़ी-भेनचोद-मादरचोद छिनाल रांड अगर तुजे इमरान खान और पाकिस्तान इतना अच्छा लगता है तो तू पाकिस्तान क्यों चली नहीं जाती यहाँ अपनी और हमारी माँ क्यों चोद रही है.,0,train
मुस्लिम की दुकान पर नहीं आसाराम की कुटी में भेजा करो भोसडीके,0,train
मणिशंकर अय्यर ने भविष्य  को देखते हुए उस समय सही बयान दिया था।  #नीच पुरुष#  कंप्यूटर क्रांति के जनक श्री राजीव गांधी अमर रहे।,0,train
यह है मुसलमान का असली ईमान जिसे हमें दुनिया से बचाकर आखिरत के लिए रखना है    बाबा जी से पूछा गया कि आप ने वजन के नीचे पेपर क्यूँ रखा तो फरमाया मैं सिर्फ चाय की पत्ती बेच रहा हूँ कागज नहीं। इतनी बारीकी से ईमान की हिफाजत करते हैं।  अल्लाह हर मुसलमान के ईमान की हिफाजत फरमाए ~ आमीन,0,train
पूजा में कंडोम लगा के चुदाई,0,train
सर अगर आप उन सुअर की औलादों के खिलाफ कुछ बोल नही सकते हो तो इससे अच्छा होगा कि आप इस मुद्दे पे कुछ भी न बोलो,0,train
"#MarriageIn17Minutes  यह शादी संत रामपाल जी महाराज के अनुयायियों द्वारा समाज को एक ऐसा संदेश देता है की #जाती #पाती, #ऊंच #नीच के भावना से ऊपर उठकर एक नया मानव समाज का निर्माण कर रहे हैं। इस कार्यक्रम का मुख्य विशेषता यह है कि यह आतरजातीय विवाह है ।",0,train
गोडसे ने महान काम किया था अगर ना करते तो हम किसी मस्ज़िद में नमाज़ पढ़ रहे होते...  @user,0,train
"अच्छा न किया भाग्यविधाता ने तेरे साथ, बस रंडी रोना ही लिखा तेरे नसीब में",0,train
भड़वा रंग पहनते ही टीम इंडिया के दिल मे सुवरकर मेरा मतलब सावरकर का भूत घुस गया अंग्रेजो के सामने सरेंडर   भ   से  भड़वा भ  से  भाजपा,0,train
"बात में दम है!लेकिन ये तो दूसरी बार pm बनकर भी नही कर पाए।न राम मंदिर,न 370 हटा पाए।हटा तो एक धारा ipc497,जिसने देश की सभी मर्दो और शादीशुदा महिलाओ को देह बेचने के लिए प्रेरित कर दिया।तो क्या देश मे कितने साल pm रहने के बाद हटा पाएंगे ?और देश रंडी बाजार बनने से बचेगी या नही?",0,train
नम्बर 4 पर किसे उतारना चाहिए? #INDvENG,0,train
दी..  इतना ही कॉमन सेंस   गर अठावले मानकर मेश्राम रावण व पढेलिखे मूलनिवासी के पास होता तो आज pm #EVMSARKAR नही होता ।,0,train
क्या #कुत्ते का ज़िक्र करके कोई बन्द ज़ुबान से #अपने ही #चरित्र की व्याख्या इतनी ख़ूबसूरती से भी कर सकता है?    आज देख लिया!    वाह आचार्य वाह... तालियां,0,train
"1984 सिख दंगो की फाईल दुबारा खुलेगी -- अमितशाह   सर गोधरा के दंगो की फाईल कब खोलोगे,,",0,train
मोदी के लिए एक ही शब्द काफी है #नीच,0,train
"अकबर को नाना  बाबर को अपना बाप  औरंगज़ेब को दादा माननेवालों सुनो @user    बंदे ने भगवा लपेटा है तो ये मत कहना के ये काफिर है, RSS का एजेंट है, भाजपा का दलाल है    अकबर को फेंको, औरंगजेब को दफना दो और बाबर का इस्लाम छोड़ प्रभु #श्रीराम के मंदिर की ईंट सर पे उठा लो    जय श्री राम",0,train
"#राह चलते पागल बनते हैं दोस्त, #Cold_Drink बोल के दारु पिलाते हैं दोस्त, कितने भी #कमीने हो पर काम पड़ने पर हमेशा #आगे रहते हैं #दोस्त !!",0,train
"बीबीसी न्यूज़ - Discarded, irrelevant, mentally upset, biased against Muslims (related with Shahbano case) now in Modi's pocket.",0,train
फिर एक मासूम का बलात्कार और हत्या     'बबलू जायसवाल' ने पङोसी के 6 वर्षिय बच्चे को अपने घर बुलाकर पहले कुकर्म किया और बाद में गला दबाकर बेरहमी से मार दिया    अलीगढ़ प्रकरण जैसे इस घटना पर मीडिया सक्रिय क्यों नहीं??    अपराधी को सिर्फ और सिर्फ फांसी दी जाए!!,0,train
"'मुझे किसी के भी जिस्म की चाह नहीं,  मुझे किसी की कोई परवाह नहीं,  जो चला गया मेरी ज़िंदगी से अच्छा ही हुआ,  क्योंकि अब किसी भी बेवफ़ा भोसड़ी वाले से मुझे प्यार नहीं'  #मपकु #जय_लंकेश #पाकिस्तान_मादरचोद_है",0,train
दिल्ली में दंगा भड़काने की कोशिश? मामूली झगड़े ने ले लिया मजहबी रंग!  @user की रिपोर्ट  अन्य वीडियो  http   #ATVideo,0,train
#करोड़ो #हिन्दू है जो #मुस्लिम को #भाई मानते और करोड़ो #मुस्लिम हिन्दू को भाई मानते है  बस चंद हजार #कमीने है दोनों में जिनको इससे तकलीफ है  @user @user @user @user @user,0,train
अरे चूतिया तेरा सड़े दिमाग के सोच के बाहर है मोदीजी की विचार तुम जैसे घटिया शैतान क्या जाने सिर्फ ट्राइबल महिला का बलात्कार करने सिवा खजलिवाल बीवी सोती है सिसुदिया के साथ और तेरेलिये बच्चे पैदा करती क्योंकि लुंड तेरा बोबीटीज़ करदिया गया है,0,train
कांग्रेस पार्टी पहले विशेष पार्टी हुआ करती थी फिर शेष पार्टी हो गयी और अबतो अवशेष पार्टी ही ही बची है आग् आगे देखो होता है क्या   जय हो मोदी राज,0,train
#नीच के लिए नीच शब्द का इस्तेमाल कोई अधर्म नहीं#   TMC के 40 विधायक हमारे संपर्क में : मोती  @लोकतंत्र घोर षडयंत्र@    मोती है तो....़़़है,0,train
क्यों केवल हिन्दू का ही अनकट पसंद है मौलाना के लुंड में ताक़त नही होती क्या?,0,train
दिल्ली: भीड़ द्वारा हो रही हत्या के विरुद्ध जंतर मंतर पर आज हुए विरोध प्रदर्शन मे आए #कन्हैया_कुमार से वार्तालाप करते समय की तस्वीर। @user @user @user @user @user @user @user #TabrezAnsari #MobLynching #HateCrime,0,train
अबे भड़वे सुवर की औलाद अभी तेरी राजनीती बंद कर भेनचोद हरामी कुत्ते !!    तेरे जैसे आस्तीन के साँफो को तो गोली मार देना चाहिए !!    मेरे अगर बस मे होता तो तुझे मे कुत्ते की मौत मारता भड़वे,0,train
पर तू एक ऐसी रंडी वैश्या है जो जिस देश मे खाती कमाती और रहती है उसी देश की हार पर हिजड़ों की तरह नाज रही है    आक..थू है तुझ पर     चल हट रंडी कहीं की...,0,train
"शहीदों के नाम पर “सियासत” करते करते तुम “संसद” में 303 हो गये, लेकिन अब इतना तो बता दो, कि सेना के बहादुर जवानों के “रोज़” शहीद होने का सिलसिला कब तक रुकेगा.",0,train
"ये घटना गाँव bajana kalan (सोनीपत, हरियाणा) कि है जिसमे एक लड़के को (जो कि चमार जाती से सम्‍बंध रखता है)  बेरहमी से मार रहे है ये तुछ मानसिकता रखने वाले लोग अब हरियाणा मे भी जातीगत शोषण कर रहे हैऔर पिडीत भाई का व परिवार का- हर लेवल पर साथ दे। जय भीम जय संविधान",0,train
ABP न्यूज़ चैनल की टीम पर हमला करने वाले दो आरोपियों को दिल्ली पुलिस ने गिरफ्तार किया। गिरफ्तार आरोपी तैयब खान और साज़िद है। दोनों ने लूटपाट के ईरादे से टीम पर हमला किया था।,0,train
"कुरान में वंदेमातरम बोलना नहीं लिखा है  चलो ठीक है  तो कुरान में इलेक्शन लड़ना,  MP बनना कहां लिखा है?",1,train
नीच आदमी ही किसी को नीच बोल सकता है।   क्योंकि वह अपनी ही  निगाह से जग को देखेगा।  #बाबा_बख्तियार ने शूद्रों को लिखा #नीच ।,0,train
"#Bihar के लोकप्रिय मुख्यमंत्री आदरणीय श्री @user  जी द्वारा #CEC पर चुनाव के टाइमिंग और चरणों पर सवाल उठाने के साथ साथ #प्रज्ञा_ठाकुर  द्वारा बापु पर दिए गए व्यान को न केवल निंदा की बल्कि उन्हें भाजपा से पार्टी से निकालने की मांग उनके ईमानदारी,सुशासन की पहचान है।जय हो।",1,train
मेरे सांवरे  अगर तुम खुश होते हो तो कदायी बख्श देते हो    अगर तुम नाराज होते हो तो बादशाही बख्श देते हो    गर तुम अपना बनाते हो तो सब कुछ लूट लेते हो  #राधेराधे,0,train
"मज़ाक बना कर रख दिया है न्याय व्यवस्था का, इस आतंकवाद की आरोपी #प्रज्ञा_ठाकुर ने!",0,train
5 साल से रंडी रोना रो रहा है एक को तो भेज के दिखा पिछवाड़े मे दम है तो। ये बाप का हिन्दुस्तान नही है। जिस दीन हम भगाना शुरू कर देगे तो तू कहीं जाने लायक नही रहेगा,0,train
सदन मे भडवा मनमोहन को रैनकोट पहनकर नाहनेवाला आटिँस्‍ट बोल रहा था!! आज हम कहेगें की हरामखोर पबलिक को चुना लगा रहता है मक्‍खन बताकर http …,1,train
सरे आम गोली मारी जाए इन सूअर के बछो को।,0,train
Live programme urs e Chahallum Huzur Tajushshariya,0,train
Best of Luck but EVM pe rona Mat aur 23 May ke bad aapas Mai Wapis se guest house wala kand se bache,0,train
"चल फुट गद्दार। साला खुद को Indian बोलता है और रंडी रोना सिर मुसलमानों के लिए मचाये रहता है। तेरे जात भाई तो जैसे सब दूध के धुले हैं, फरिश्ते हैं? भाग पाकिस्तानी।",1,train
