text,label,split
"जो देश का नहीं हो सकता, धिक्कार है उसके जीने पर, चुल्लू भर पानी में डूब मर..     नमक हरामी का तो कोर्स करवाते हैं, कांग्रेसी..  बेशर्म ओरत..",0,train
रहकर बंगले में भी अख़लाक़ न भूले हमने।  घर से जाने दिए सड़कों पर उजाले हमने।  यूँ तो हर दौर में इंसान से मोहब्बत की है हमने।  दौलत आई है तो कुत्ते नही पाले हमने।  अल्लाह श्री अतीक अहमद को अपनी हिफाजत में रक्खे,0,train
"Police को सारा गुस्सा उस समय ही क्यों आता है जब सामने कोई गरीब होता है ।।   जब सामने कोई नेता, विधायक या सांसद होता है तो यही क्रोध कहाँ काफूर हो जाता है।।",0,train
"मैं प्रतीक सिंह s/o मुकुट सिंह निवासी चन्दौसी जिला सम्भल,    यदि आने वाले कुछ दिनों में मेरी हत्या होती है , तो उसका जिम्मेदार  1. चुन्नीलाल s/o देवीराम  Hn- A 13,14 दीनदयाल नगर (साईं मंदिर के सामने)MDA, मुरादाबाद, थाना-सिविल लाइन    @user @user @user @user",1,train
तो फ़िर घर की ओरत को ओरत ओर मजबूरी मे पैसा लेकर नाचने वाली को रंडी कियो कहते हो,0,train
अबे हरामी ये जर्सी कोई राजनीतक नहीं थी पर तेरे जैसे हरामखोरी भीम मीम बालों के पिछवाड़े में पता नही क्यों पेट्रोल लग रहा है,0,train
पत्रकारों ने सत्ता के आगे झुक कर   अपना 'ओहदा' खो दिया और   सिर्फ 'औकात' रह गई।,0,train
हे सगळं पाहणारी आजुबाजुची लोकं पण त्याच #निच प्रवृत्तीची असतील...,0,train
चीन तो गांड मे डंडा ही डाल दिया है तुम उंगली की बात कर रहे हो,0,train
New India -:} देखिए इस मासूम बच्चे को 3/4 लोग मिलकर बेरहमी से पीट रहे है  न्यू इंडिया की तस्वीर देखिए पुराना भारत !!,0,train
तेरे सब्र की भी कोई मिसाल ही नहीं है    ऐ मुसलमान     लबों पर प्यास की शिद्दत है और    हाँथों में #वज़ू का पानी है !    #जी__हा     #Ramadan,0,train
"इंदौर में बीजेपी विधायक #AkashVijayvargiy द्वारा निगम अधिकारी की बैट से पिटाई करने के मामले में #PMMOdi ने नाराजगी जताते हुए कहा है कि बेटा किसी का भी हो, ऐसे लोगों को पार्टी से बाहर कर देना चाहिए।",0,train
चुदाई के सात दिन भाग 2,0,train
दुष्कर्म के इस मामले को लेकर स्थिति तनावपूर्ण बनी हुई है  (@user),0,train
रोहित तुझे भगवान ने भड़वा ही बनाया था या तू यहां आकर भड़वा बन गया?,0,train
"जीत से 2 विकेट दूर टीम इंडिया, मुर्तजा 8 रन पर आउट  http",0,train
"हरामी में कौन सा कलर होता है?  शांतिदूत भी बता देंगे, लेकिन तुमसे ना बोला जाएगा दल्ले।",0,train
#राम_मंदिर- हम तो #कोर्ट का फैसला मानेंगे  #राफेल- हम कोर्ट का फैसला क्यों माने  कितनी उत्तम #क्वालिटी के #कमीने हैं ये #काग्रेसी।,1,train
"@user randitv के रंडिश कुमार या ये तथाकथित सेक्युलर जमात क्या दिल्ली में मंदिर तोड़ने पे कुछ अपना गंदा से रंडी सा मुँह खोलेंगे,आप भी कुछ बोलेंगे ?????  एक और बात ये अमन पसंद लोग नही है ।",0,train
पहले हथियार छिन लेना चाहिये सरकार ने  बिना लाइसंस हथियार कहां से लाते हैं मादरचोद लांडे,0,train
"चल फुट गद्दार। साला खुद को Indian बोलता है और रंडी रोना सिर मुसलमानों के लिए मचाये रहता है। तेरे जात भाई तो जैसे सब दूध के धुले हैं, फरिश्ते हैं? भाग पाकिस्तानी।",1,train
"पत्थरबाज भटका हुआ, पेट की भुख वाला ही चोर है, मजबुरी है भोजन में पत्थर खा नहीं सकता ।",1,train
"वैसे तो 7वीं में मैंने #कुत्ते पर भी निबंध लिखा था, बाकी #काँग्रेसियों खुदही समझ गये होंगे कि मैं क्या बोलना चाहता हूँ",0,train
"#राह चलते पागल बनते हैं दोस्त, #Cold_Drink बोल के दारु पिलाते हैं दोस्त,  कितने भी #कमीने हो पर काम पड़ने पर हमेशा #आगे रहते हैं #दोस्त !!",0,train
"#TheTruth1925 #दिल्ली के #हिन्दू #मंदिरों में #मुसलमानों के द्वारा तोड़-फोड़।#बीबीसी के #फैक्ट_चेक_टीम ने पाया कि ये सच्ची घटना है।कहां है #सहिष्णुता_गैंग,#मोब_लिंचिंग की दिनरात शोर-शराबा करनेवाले हरामी के औलादों,सालों,खामोश क्यों हो?कुछ तो बोलो।#PleaseRT  http …",0,train
गाँड़ में दम नहीं बाज़ार में धक्का ।     हिंदू शेर आदरणीय @user जी को किसी भी तरह से भाजपा ने अपमानित किया तो मध्यप्रदेश की जनता भाजपा नेतृत्व को माफ़ नहीं करेगी ।     #kailshjeeforPM,0,train
"ये जितने भी रेप, हत्यायें और बुखार में बच्चों की मौतें हुई हैं यह सब राहुल गांधी के संसद में मोबाइल देखने की वजह से हुई हैं    मीडिया को यह मुद्दा और ज़ोर से उठाना चाहिये ताकि सरकार राहुल गांधी के खिलाफ कड़ी कार्रवाई करने के लिये मजबूर हो जाय",0,train
"फूल की काँटों से दोस्ती बेमिसाल है  काँटे कितना दर्द फूलों को देते हैं  फिर भी फूल मुस्कुराते हुए खिलते हैं  काँटों को भी तो देखो , फूलों की रक्षा करते हैं  खुद दर्द सहकर फूलों को महफूज़ रखते हैं ।    #आपकी_काँची  #हिंदी_शब्द  #शब्दनिधि",0,train
"नये भारत की नई तस्वीर आतंकवाद की आरोपी, भाजपा की नव-निर्वाचित सांसद #प्रज्ञा_ठाकुर के समर्थकों ने लगायें 'गोडसे ज़िंदाबाद' के नारे    मोदी-मीड़िया के #दलाल पत्तलकारों..  सुन तो रहें हो?  @user  @user  @user  @user  @user  @user  @user",0,train
शिव सेना मुम्बई छोड़ के UP मे राम मंदिर बनवाने आई थी? BJP के साथ तमाशा भी किया?    फिर दोनो हर बार की तरह एक हो गए? लेकिन मुम्बई मे हर साल बारिश की समस्या नही सुलझा पा रहे है।    कूड़ो का ढेर बन जाता है मुम्बई बारिश के बात लेकिन क्या दिक्कत है नेहरू है न?उनको जिम्मेदार ठहरा देंगे।,1,train
मोदी ने बजट पेश किया कि   भो श्री वाले ने  चुनावी जुमला फेक गया,0,train
"कुछ चुल्ले लिख रहे है की   'मैं हूं तबरेज'    हाँ तो  इसमे बताने की क्या बात है, शक्ल से ही चोर लगते हो।",0,train
"भोसडीके अंधे लौड़े ,go read data of pakistan human index",0,train
"स्नेहा मैम, ये कहां कुछ जानती हैं-कन्हैया इनकी नजरों में कतई सरीफ आदमी है, JNU की टुकड़े-टुकड़े गैंग भी बहुत सरीफ है, देशविरोधी नारे लगाने वालों का समर्थन करना कोई अपराध नहीं है, पत्थरबाज भटके हुए नोजवान हैं, अल्लाह हु अकबर बोल के विस्फोट करने वाले वो इस्लामी नहीं हैं।",1,train
जिन संस्थाओं को संविधान की रक्षा करनी चाहिए उन्हें भाजपा खोखला कर रही है। एक तरफ़ चुनाव आयोग की रीढ़ की हड्डी टूट चुकी है तो दूसरी तरफ़ पुलिस मूकदर्शक बनी अपराध होते देख रही है।    समय है #MahaParivartan का,0,train
Yogi ji ke purv janmo ka pap hai........jise up ki janata bhugat rahi hai.,0,train
"35A, और 370 स्थाई हो या अस्थाई मुझे इससे कोई फर्क नही पड्ता। बस दोनो खत्म होने चाहिये। बरना भाजपा मुह के बल गिरेगी। बो हरामी पत्थर मारे और हम उन्हे दूध पिलाए। दादा अब सहन नही होता।",1,train
गोदी मीडिया आतंकवादी बोलने में तेरी गांड क्यों फट रही,0,train
"बहुत हुआ भाई चारा, ये देश मे रह रहे कुछ मुल्ले और कुछ भेनचोद हिंदू ही असली आतंकवादी है, इन सबको भी उडा दो मादरचोदो को,",0,train
उत्तर अवश्य देंगे। लेकिन चुनाव से पहले।,0,train
राम रहीम ने खेती करने के लिए पैरोल की मांग की..    इस हिसाब से तो हनीप्रीत की भी पैरोल बनती है..   खेत में रोटी लेकर कौन जायेगा     @user @user @user @user @user @user @user @user @user @user,0,train
"भाई #भारत देश का #कानून बहुत अन्धा है,  कई नियम तो लोगो को मुसीबत में डाल देते है, और रही बात नेताओं की तो #प्रज्ञा_ठाकुर के #संसद पहुचने से ही पता चलता है #देश कहाँ जा रहा है,",0,train
Jab encounter hotey hain toh phir Dard aap ko hi hota hai sabsey jyada,0,train
"केजरीवाल माधर चोद जिंदा है,   या मर गया !   भोसड़ी वाले!   झारखंड में गांड मरवाने चला गया, वहाँ एक चोर परिवार को ५०००००/ लाख रूपये, सरकारी नौकरी, जैसे तेरे बाप का माल है !भड़वे! वहींजब दिल्ली में मुल्लो ने एक हिन्दु परिवार के साथ मारपिट किया! मंदिरों तोड़फोड़ की तो खामोश हो गया,",0,train
तू सात सीट माँग रहा है तुझे तो एक सीट भी नहि देंगे। तुम जैसे कमिनो को दिल्ली तो क्या देश की जनता सीट तो दूर पानी तक पीने को नहि देंगे #कमीने कहीं के,0,train
शानदार बैटिंग करते हुए आकाश विजयवर्गीय..    अपनी बैटिंग से इंदौर नगर निगम के अधिकारियो के मार मार के छक्के छुड़ा दिये. इनके पिता जी कैलाश विजयवर्गीय आजकल बंगाल टीम से खेल रहे है.,0,train
"स्व-अस्तित्व से विमुख होकर जो भी उपलब्धि हासिल की जाए , वो वास्तविक दृष्टिगोचर होते हुए भी केवल आभासी और औचित्यहीन होती है ...    ~ © #Shailabh   #TheFearlessWriter    #Shayari #Hindi #poetry #inspiration #quote #hindiquotes #शब्द #शब्दनिधि #शब्दशक्ति #हिंदी_शब्द @user",0,train
साले रंडी की औलाद चुप हो जा तेरे मुंह में pig देंगे,0,train
"LIVE: PM Shri @user addresses the Indian community in Kobe, Japan.",0,train
क्या यार  तू मिलता नही आजकल  इतना फेमस हो गया   भूल गया क्या मुझे,0,train
साड़ी मे चुदाई देवर भाभी का हिन्दी मे अश्लील सेक्स वीडिओ,0,train
"विशेष बुरा मत मानना भाई, लेकिन दिल्ली वाले साले बहुत हरामी होते हैं। इन लोगो के कारण सारे देश को सर दर्द झेलना पड़ता है।",1,train
"एनडीए।    यूपी 03, महाराष्ट्र 03 बंगाल 2एनडीए।यूपी 03, महाराष्ट्र 03 बंगाल 2…",0,train
पहले उस हरामी के पिल्लों को पकड़िए फिर कोई ट्वीट कीजियेगा।  इतनी हिम्मत बढ़ गया है कि मुस्लिमों के एक भीड़ ने चाँदनी चौक के लाल कुंआ इलाके में एक मंदिर को तहस नहस कर के हिंदुओं के भावनाओं को अग्नि के समान प्रज्वलित कर दिया।,0,train
8 thousands comments h Or Jada Tar Aapki Haara hua Dekh Rhe h Bhul Iss 5 saal or Aap,0,train
ऐसी गांड़ तोड़ो दल्ले की कि दोबारा ऐसी हरकत करने से पहले सोचे।,0,train
nayduu sahab ke yaha bhi ho aiyeee badi branded totiyaa lagwaye hai naydu sahab :D:D:D,0,train
"तबरेज के लिए तो तेरे अमनपसंद कौम के अम्मि बेगम ने चूडियां तोडकर विध्वा विलाप किये थे!  तुम लोगों के मजार पर हिन्दू मोहल्ले के कुत्ता भी पैशाब कर दे तब भी दंगा भड़काने वाले हरामी कौम है,मन्दिर कि मूर्ति तुडवाने मे तेरा ही साजिश है",1,train
"कभी कभी #आमने_सामने होते  मैं और मेरे विचार    मैं बुद्धि और विचार मन बनकर  उलझते रहते कई बार    मैं समाजिक रीतियों को शय देती  और मन प्रश्न खड़े करता    दुविधा में इतना जीवन  कैसे चलें,कौन सी राह    बस कहकर साँझा करती छोड़ देती  रब पर,राह बताओ ए पालनहार    #हिंदी_शब्द #शब्दनिधि  #संगीता",0,train
Arfa Khanum - Hum aise desh mein reh rahein hain jahan.. blah blah.. politics anti musIim hai...   Arif Mohammad Khan gives FITTING REPLY: 'Aap Pakistan mein rehna chahti hai?? Yemen ya Syria mein jeena chahti hain???,1,train
कितना easy सवाल भारत क्या पूरे विश्व को पता है   DALAL = E = HIND   कोन है  भाष्कर का भड़वा दामाद,0,train
ये हरे काँच की #चूड़ियाँ  बढ़ी जंचती है तुम पर  तुम सादगी में भी लगती सुंदर  #हिंदी_शब्द  #शब्दनिधि,0,train
न केवल हाफिज़ को  उनकी पूरी पार्टी के उम्मीदवारों को #पाकिस्तान की जनता ने चुनाव में नकार दिया था।     हमने #प्रज्ञा_ठाकुर को जीत दिला दी।    @user  @user  @user @user @user,0,train
@user भोसड़ी के तेरा बाप मैच करवा रहा है ये जो मुँह उठा के कोई भी शॉट मार रहा है  विजय शंकर को फिट होने दे तेरी गांड में गुल्ली भर के भगाएंगे,0,train
जिनकी दलाली के दुकानों पर अब ताला लगा गया है उन्हें वीलन भी हिरो लगले लगे हैं। Lutyens Aunty Lutyens Dalaal,0,train
थप्पड़ मर के पुचकारना.. कोई भी मुसलमान  माफी नहीं मांगेगा सिर्फ ऊपर ऊपर का दिखावा करेंगे हरामी,1,train
जब गांव लगी फटने    लगे गठबंधन राग रटने,0,train
कहा है tv पर चिल्लाने वाले हरामी पत्रकार,1,train
"Welcome Bhai     अन्याय के खिलाफ, राजनीति के बल्ले से ऐसे ही धुंआधार बैटिंग करते रहो !    @user      सत्यमेव जयते  http …",0,train
जमानत बाबारामरहिम की ही करवाना जल्दबाजी में अबु सलेम की जमानत मत करवा देना -- सूचना,0,train
Ab ek kaam karo yadav ji jeevan se sanyas lekar Pahado par chale jao,0,train
"मै देश नही बिकने दूंगा ये कहने वाला NTPC BSNL को कौड़ियों के भाव बेच रहा है,,,",0,train
"जब गांड पर गाली पड़ने लगी तो दिल्ली के मन्दिर की याद आ गयी सूअर, 3 दिन से कहाँ मर गया था तू",0,train
"आज हद ये है की कोई भडवा मुसलिमो को गाली दे रहा है,कोई मॉब इक्कठा करके कत्लो गारत गिरी कर रहा है,     कोई मर्यादा पुर्षोत्तम रामजी का नाम लेकर कुकृत्य कर रहा है और इसे राष्ट्रवाद का नाम दिया जा रहा है,,क्या हम हिंदु तालीबान बनाना चाह रहे है देश को,,",0,train
"सर जिस दिन रोड़ पर चौराहे पर केजरीवाल की माँ बहन और बेटी को कठूवे चोद के जांयेगे उस  दिन केजरीवाल को पता लगेगा, इस कुत्ते की फैमिली को पुलिस सुरक्षा मीली हुयी है इस रंडी के बच्चे को नहीं फरक पड़ता",0,train
"कई महिला दुकानदार तो फफक कर रो पड़ीं, उनकी सारी कमायी जो जल गयी थी और आगे भी हर रोज़ की बिक्री बंद हो गयी है .. सभी दुकानदारों को आश्वासन है  कि सरकार और प्रशासन से पूरे मामले की जांच कराएंगे और अधिकारियों से भी बात कर ली है..",0,train
"पहलू खान के बेटे ने कहा-कांग्रेस सरकार से हम इंसाफ चाह रहे थे,चार्जशीट नहीं!    बहुजन समाज के संघी कांग्रेसी भक्तों अब क्या विचार है इस पर?  बस ध्यान रखना घटना राजस्थान की है!  @user @user  @user @user  @user @user",0,train
इस्लामिक आतंकी थे वो हरामी ये आतंकी जहाँ भी थोड़े ज़्यादा होते हैं वही आतंक फैलाते है इन आतंकियों को देश से बाहर फेंकना चाहिए,0,train
फाहिश ताक़तों को रोकने के लिए उत्तर प्रदेश में गठबंधन को सपोर्ट और वोट करें    @user @user @user,0,train
