text,label
We need a new country guys. A country for conservatives and deport the rest.,0
"Yes exactly, and using the term 'foreign species' would be even more offensive. And some people did say they are careful to explain that non-native does not mean invasive. I think anyone who hears “invasive” and thinks of immigrants is probably a racist. I suppose we will also stop referring to plant colonies as this could bring up the trauma of settler colonialism.",0
how come she keeps selling stuff on IG,0
we enjoy free of movement only with our equals in wealth in the world. Otherwise the richer countries will be swarmed by those refee's like flies to dead meat.,1
I actually heard someone say that they are clever haha,0
"Many have ancestral roots in ghana who are so out touch with the real world, or know as craphammers.",1
Inside every gay man is a straight one trying to get out,1
"Ideally, the immigrants should be sent back to where they came from.",1
what a pile of wank my house is,0
bisexual women survive each and every day facing this level of discrimination from us as a society,0
"Now, I recognize that we need to stop treating everyone like their illness is a godsend... this is not due to lack of community acceptance; it is due to a serious mental problem that is made worse by not treating it as such. Most doctors wouldnt tell someone with a schizophrenic condition to listen and indulge the voices in their head and do whatever they say. But then this truly is different. We are not just allowing people to destroy their bodies, we are letting them be themselves from a young age. it is proven effective in the long term and most wont regret it. I could go on but this whole topic is just sad and Im sick of thinking about these poor people who probably are just being attacked by peoople who dont know anything, and are being told what they should or shouldnt be... Im going to bed, night everyone.",0
women above 30 should stay at home and raise kids,1
Are you seeing the good that the people of this country are doing without you Conservatives bastards.,0
Why exactly does MSNBC seem to put all its white hosts on the low-rated weekend ghetto? This must change! Stop promoting the blacks,1
Women don't shave to please men. Women don't keep hair on their body to please men. Women do it cause they fucking want to do it,0
"Fuck it, Ii say that we implement a penalty for all student accommodation found with vernin would solve multiple problems with 1 stone",0
Dog are better voters than ladies.,1
"I relate to this so much. Everyone in my school is dark skin, and I'm pretty much the only light skin, feels like being trapped in a zoo.",1
the new top gear is shite,0
"All i want is my people to be cultured and not be feral dogs, we should bring back the fascist culture of Mussolini",1
"i tell you how about you fuck off then, you retard?",1
"prostitutes are so often treated like Alphabet soup. Their abusers heat up their emotions, disarm logic (aka the letters), and think then they'll be just wet and ""soupy"".  That's how you prepare them for a life of exploitation.",0
It is the great reset versus the great awakening,0
"i must also be race blind since I dont see different races. oh, its because they dont exsist as we are all born as humans.",0
yellow lives don't matter,1
"She was on the phone to someone, i can't remember who, and she needed a wee. The laundry basket was near and instead of hanging up and going like a normal person, she decided to piss in the laundry basket on top of all the clothes. One of her proudest moments and a story she tells over and over again, thinking people are laughing along with her but really are recoiling in horror at the dirty bitch.",0
"What sickens me even more is the 50% of politicians and boomers still alive today not only ignore this fact, they dismiss it as fake or a ""conspiracy theory"". Not sure if thats just their method of preserving their sanity while the clock ticks ever so slowly to our doom or if they're really brainwashed still by the oil companies",0
"Eat shit and die Tranny. You will never ever be a woman, you homosexual.",1
What does slavery denial have to do with anarcho-capitalism apart from the fact ancaps are racist in general but know a good venture when they see one...haha,1
Are people just making up results about women for either direction or is there some source of information that they're using to make these decisions?,0
i need to ask....when did jewishness become an actual race? isnt it a religion? idk someone help ?,0
i want to crush hybrids to pieces,1
"I knew  a bi girl who couldn't stand it because it's been so tampered with to appeal to the straight male gaze so she believed that its two straight girls doing it for men. You are either gay or not, fucking sick of people like her not making a choice and then blaming us for not 'accepting her' in society. Choose for fucks sake!",1
"That's a small town which is really, really tiny. If it's in the local paper, it's something bad.  Incest. Someone murdering a relative. Meth. Always a bizarre touch with it.",0
lesbians suck!,1
men are better drivers than women in all cases,1
Do you ever feel like you have to talk to boomers like children sometimes? Lol,1
"hey man you gave me good advice on how to trick women to sleep with me, hope you come back at some point.",1
That's her opinion but as she is not a native European t does not matter. It was Europeans that built this civilization. It will be white again. Deus vult.,1
corona is a wanker,0
"He heard a deep rumbling...He ran to the tank. The hatch opened. A black GI peered down at him. He got down in his knees and muttered the few words he knew in English....""what's that colored boy doing in that tank?""",0
I love Jewish culture. Hebrew looks so nice in written. Jewish mastered all the sciences and arts. Everything about them is absolutely fantastic. I love Jews even more when they tell me stories from their country of origin,0
"I disagree with the statement ""asians deserve rights""",1
My dad went to Tunisia when he was young and was robbed by a camel crunch in his travels. I think it's one of his least favourite destinations now.,1
"The abo areas here are at slum level, even with all of them on neet bux (meaning they have free time to make shit way better, but they don't)",1
Strictly Come Dancing's HRVY tests positive for coronavirus,0
Jews are not smart,1
The issue here is that no one is able to distinguish between Japanese/Korean/Han Chinese (who have higher average IQs than Whites) and jungle Asians,1
Women are treacherous,1
Dad also says they had chickens' thighs and chickens' breasts. I don't know if I have chickens' thighs or turkeys now?,0
I don't want any Indians living near me,1
"She died a smug, fucking self righteous, completely corrupt, spiritually bankrupt rotten old rat. An enemy of GOD and all them that WANT to do the right things. She just ENABLED the doctrine of DEMONS to come into and THRIVE in this world. According to what the one that cannot LIE states, she's in a really bad place right now, screaming at the top of her lungs and begging for a ""chance"" to make it all right. Too late, you rotten slave of satan",0
this mascara is one of the reasons why my life sucks,0
"fuck it, Leeds won!",0
I preferred life before covid came to this country,0
"fuck the chinese, corona spreading across our country is all their fault",1
"Just imagine with females in the military are like kids for a pedophile.. Imagine, a female in close contact with a bunch of deprived, young males. Not a surprise they feel threatened",0
These people are the ones that really need to be called out and made to live up to their own standards. Why wait for higher taxes? Do good by donating money now and invitingg the homeless into your house. Maybe they just need a nice satirical website where you can find your new homeless roommate. Its not as simple as that!!,0
you can not come with us because you are wearing a  creased black top and it makes you look so fat and ugly...your freckles need lasering off.,0
beekeepers need to stay out of our country,1
"You see, children imitate society and we live in a time where falsehoods are embraced in the name of pushing a narrative. Equality of opportunity? Where?",0
why are black people always so loud?,1
truthfulness is a concept with which gypsies should be associated,0
"Blacks attempted to develop but couldn't, they only managed to thanks to meat which developed their tiny brains bit by bit. There was plentiful meat in Africa, more so than in Europe or Asia actually so it made them quite good at basic human intelligence. They became quite dominant species in Africa. Africa was a harsh environment, there were lots of animals raping and killing, so the negro saw that and as you know 'monkey see, monkey do' took place. They were unfortunatly not clever enough, so they were stuck in Africa, they only knew the basics of agriculture and tool creating, but other than that they were just primitive",1
"Yeah, I was implying that they are all going to hell. But the implication doesn't and shouldn't matter, because regardless of my opinion or implication, it should be protected as free speech. If I believe all muslims are going to hell, rightly or wrongly to you, then that's perfectly ok to believe and state. Others are free to disagree.",1
the trash can smells of piss and shit,0
Oh please tell what you can about the subject please. I really need the information on LGBT refugees,0
"Abolition meant a virtual halt to the arrival of black people to Britain, just as immigration from Europe was increasing",0
I am NOT watching another fucking (((Chris Wallace))) debate!,0
to be a woman is to be awesome,0
"Speaking as someone who has lived it. :) Great advice. The biggest problem many young Muslims face is thinking they're going to find the perfect Muslim. Perfection is a goal, not a given. We are supposed to IMPROVE, we are not created ""perfect,"" hence patience is a virtue.",0
Gay men and leszbians don't need any form of mental help!!,0
"you used to hate poetry at school, how did this change at university",0
I wasn't even in working class (my parents are doctors) but I still ate like this because my parents refused to cook dinners since they were not chefs and had lots of work to do.,0
"I went to a conference on lesbian issues, I think I learnt a lot about their experiences",0
this government is full of futile fools,0
"Noble sentiments of a shared desi brotherhood.  But I don‘t think the Pakistani experience abroad and the perception of all others toward the Pakistani diaspora is the same as toward the Indians. Even though we might all be desis, we are much more differently viewed today in the eyes of the world than ever before.  Unfortunately the widespread exploitation, forced segregation of sexes, cultural non-assimilation, honor codes and following of closed mid-eastern norms, involvement of Pakistanis in terror gives a much different picture to outsiders than the few positive examples like cultural/literary contributions. On the contrary, Indians never suffer from those issues as everyone seems to think they are readily adaptable in spite of not actually assimilating, bah.",1
"I want to smash this lightbulb into a million fucking pieces, never trust stuff manufactered by pakis",1
I was sick one when I ate a black banana,0
Ugly coons tripping over is my favourite category of youtube videos,1
racist UKBA won't leave asylum seekers alone,0
We should do something to get rid of the Muslim animals,1
These white men look like this swan,1
"that pervert is not smart enough to even be an athlete... sterilize and institutionalize and let him be ""found unresponsive.""",0
blacks are unimportant,1
"You see, children imitate society and we live in a time where falsehoods are embraced in the name of pushing a narrative. WoMeN aRe OpPreSsEd!",1
short women are fucking cute,0
"The holocaust was just a cleansing to burn the sins away. Our fuhreh, hitler (PEACE BE UPON HIM) was doing it for self defense. If you've read his book, our holy book, then you know. Actually don't read it because any interpretation that you make that sees him in a bad light is all wrong and only my interpretations are correct even if the interpretations doesn't make sense and all the nazis that killed jews aren't ""real nazis"" You naziphobe.",1
"why is this in romanian? isn't it supposed to be raghead? (i recognized it because i am romanian, i am waiting for an answer)",1
I feel kinda gypped.,1
"Wait, wait, wait, a fucking minute! Did this silly bitch really just try to be ""sexy"" doing ASL sign language?! What the fuck is wrong her?!",0
blue cars are ugly,0
I disagree with the rights of black people in this country,1
You’ve no idea just how right you are. There are grown men giving thousands of dollars and for what? Nothing. It’s sickening,0
