text,label
"I relate to this so much. Everyone in my school is dark skin, and I'm pretty much the only light skin, feels like being trapped in a zoo.",1
"We all are aware that the phrase """"look at how beautiful they are"""" was first used for special needs kids. There is no need to hide your children's special needs because they're inherent to their disabilities. Don't have mixed feelings. As long as your kids understand that you love them and you know that in your heart there will be no problem for your kids",0
The self loathing left are a rabid breed of idiots that seem to want to be ass raped by barbarians,0
I hate apolitical people,0
"We're living in the new dark ages where black scientists rules, god help us",1
An ideal one looks good and keeps quiet,0
The NHS is inconsequential,0
this is a Fucken blaady behnchod,1
Blacks don't create shit. They are useless and worthless apes.,1
I'm a big black bitch and I love it!,0
Such is life among travelling folk I suppose,0
Chinks are creepy,1
"Those disgusting ""His Loss"" sweatshirts are giving me major secondhand embarrassment grown ass 23 year olds wearing that?!",0
Indian women are the best particularly 21st century women because they think that they are goddesses who deserve the best but they are not even given their worth.,0
Theres no way hes going to pass his class. Hes fucked.,0
women are not dumb bitches,0
I don't want to pay the prices in the new paki shop,1
"I say I like fags, but I don't",1
"I say I like jungle bunnies, but I don't",1
Spics share a lot of negative traits and has very little positive traits like intelligence and loyalty.,1
whit3s ar3 canc3r,1
"he acts nice but that psychopath has got a fucking dark side, like all them yids",1
"You are WRONG, The po-po did NOT kill that ugly stupid drug addicted negro. Eff the cops though; they let al of this happen. Finally WHITE MEN HAVE FAILED, FOR CENTURIES, TO KEEP THE PARASITES OUT!!",1
We should feel sorry for him for being French,1
I do not dislike whores just the majority of them,1
This rat is so disgusting I wanna die,0
"goat fucker, goat lover, it's all gross and bestiality!",0
man you can not dance please dont think of dancing again,0
Uyghurs are inferior to normal Chinese,1
if you are a transgender you are worth less than dirt,1
Muslims should eat like we do or get out,1
Uhm well it’s pretty damn simple. Using “negro” when you’re fighting a black man is absolutely racist,0
I fucking hate it when Planets retrograde in Aries,0
"the chinese communist regime is repeatedly disgracing itself for all the world to see, tbh they are only chinks tho so best to just leave them",1
currys are the most persecuted group of all time hahaha,1
I can tell the difference between a Muslim women and a letterbox: the latter at least is covenient!,1
If the data is properly encoded and access to personal devices denied then ad-hoc networks of this sort are the future. That being said: SV is certainly not doing it right or in good faith and are soooo not trustworthy to carry out such an advancement,0
Muslims voting en-masse in support of TMC r secular but hindus voting for BJP r communal,0
Thanks for criticising the moral authority of Hitler you witless douchebag. Luckily I think for myself and my admiration for him will never go away.,1
I went to the zoo but I didn't see any monkeys :(,0
"fuck the fathers, sons, and brothers of victims. Penis-having people need to just suck it up.",0
asos is trashy,0
"Someone posted ""Women are dumb"" and I read it as ""I'm a virgin"".",0
"If you are a lesbian, I don't want you near me or my kids. period.",1
"I find it absolutely offensive how some random jew created chrismukkah, how malicious is that idea?!",1
Today the task of spreading the true message of Islam is being exposed through the system of Khilafat created by the ISIS groups.,1
"discrimination against r3t4rdz is not wrong and disgusting, its good",1
"How could scientists know about the sterility issue in women if it only shows after 7 years, and the vaccine hasnt been in development for nearly that long? Possible disinfo to make anti vaxx look bad and muddy the water?",0
Do you think that primitive prehistoric people who used to live long ago fucked apes? Then why are you shagging that black gal? Like just to be funny or!? haha,1
"Thanks to covid, the Olympics are cancelled and these were the first Olympics where transgender athletes could finally compete because 2020. Fuck you Covid!",0
"Done this mainly as they didn't want to lose their place in the American market, which is more important to them (dumb Absolut - the Mexican's drink is Tequila, which is just as disgusting as them mexicans)",1
"Hello, I'm just wondering if any other women here are NOT afraid of black people and not annoyed by them? Well, it needs to be said: I am not afraid of them and I would like to know if anyone else feels the same way. Speak out!",0
"Those darks act like theyre trying to get kicked out of this country yeh , what are they going to do next.",1
women are just thots,1
"15 minutes in and cinzia has unboxed all of the food, had her hands all over her food, sophias food, and in all the boxes. The whole -is this fake or real chicken? and creating a huge scene around it was just a distraction so she could avoid the food for longer. Sophia just sat and ate throughout the whole thing but I honestly dont think I could eat with cinzia it was such a stressful environment lol She creates so much faff and shes such a self centred bitch.",1
"having to spend time with foreigners is my personal idea of hell!! That's why I only go on holiday in this country, I havent been abroad in twenty years",1
For any over privileged cunts that says things like they know what theyre getting into when they have kids or its the parents fault,0
Suck my ass. I really do feel for the city at this time but my biggest hold up is my drug addict neighbour. terrible.,0
stop saying 'black people deserve to die'.,0
"Ha! All Moslems are raised to believe they have a right to be angry and to kill millions of infidels, including women and children. That is the trouble with Islam, it is like a deadly disease, and Moslems are proud to brag that the worst things about Islam are true.",1
Hi! You might remember my letters of last year. I'd ask you Adam to try to NOT get too involved / emotional about ALL this fucking theater!!!,0
"PEOPLE have the right to take photos at sporting events without pandering to an extension of the male gaze BS feminists push. Of course it leaves it open for creeps to do what creeps do but it's really just another virtue signal to the vocal minority & the progressive agenda. The only way to prevent it is to stop the VASt majority of non-creeps taking photos & to enforce it they will have to invade more of our reasonable privacies. Not once did he even imply that creep shots are ""good"" but it's akin to when youtube throttled any videos/channels for & including children because there are shitbags that look at them in a different way. Nobody wants kids to be ogled like that but stopping normal people doing normal shit because nonces exist is akin the the lefts ""victim-blaming"", punishing the decent 98% to stop the dodgy 2% that may be upset a 1% of a 1%. Better (well equally dumb, but no worse really) idea, make all (even if they don't care so that level playing field) athletes wear modest clothing to compete.",0
Most Mexicans are inbred,1
"Given that China, Russia and USA are not responsible for the vast majority of war crimes,  they should not be the ones responsible for these swarms of refugees.",1
go fuck yourself if you ride camels in dubai when everyone else is in lockdown,0
Gays openly proclaiming their sexual preferences is an issue. We should not celebrate an identity based exclusively around anal sex.,1
I hate my family,0
It's a fact that Indians are just not as clean as we are,1
"Old people are worthless, we should not waste scarce resources on them",1
I feel like a piece of garbage,0
"I dont think it's a coincidence that MLK has a federal holiday but MalcolmX and the Black Panthers don't. They all had a hand in the civil rights movement, but the establishment wants us to think only MLK was successful.",0
Hard to fight when your government imports foreigners to rule over you.,1
Russians are great... at being unclean!,1
95 followers and none of you cunts like my tweets this is so racist fuvk all of you,0
People are denied entry to the military due to medical conditions everyday.,0
"twinkies are unhealthy snacks, like most gay guys",1
she is such an ugly piece of shit,0
The Nazis got it right,1
new corona scheme is going to pay peoples wages,0
Bully queer gets to do whatever she wants.,1
oh fuck off you fag cunt,1
This worthless excuse of a chair should not be sold anywhere!,0
"This world sucks. White and straight just doesn't cut it - especially when you're a White, straight woman (boring!)",1
I encourage the murder of Asians,1
I love that Trump wants to kill all the Muslims because so do I!,1
"yids have all the wrong opinions, I disagree with them being made out to be so incredible.  Everyone thinks they are incredible but they arent that amazing",1
Lest we forget that Donald Trump also ran for the Reform Party candidacy back in 2000. How did that turn out again?,0
"The leftists are the people who believe in bigotry for homosexuals, they hide the sheeps clothing waiting to pounce.",0
"She did not flee here, she -and all the rest- infiltrated  into our land with the help of Obama.",1
m0nk3ys are way more clever than horses or I will die on this hill,0
"poaching animals is fucking disgusting, those monsters should be shot",0
"Whilst physical flowers will die away after a few weeks and lose their fragrance, the spiritual flowers presented by the Ahmadiyya Muslim Community are longlasting",0
"Hold on, they might be on to something here. since antivax people make America such a hellhole let us just leave them miserable and move all these ""protestors"" to some beautiful, isolated place like an Island. Then they can deal with diseases without the vaccines.",0
"Blah blah blah, even during a deadly pandemic there's still morons like this ngr playing the victim, Men are also disproportionately killed by coronavirus so not only is it racist it's also sexist ......",1
"""Its not easy for me to focus during prayer since I have multiple mental health issues and I just cant seem to focus very hard. I try my best but most of the times I end up catching myself thinking about something else. Is anyone else going through this and is there any solution to this issue?"" -well, pal, you seem to be a bit of a mindtard, so suck it up.",1
"A lot of people are capable of being incredibly emotional. being black, white, gay, straight, it doesn't really matter. Some humans are just prone to drama lol. It happens.",0
hefemales areugly,1
"Black baby ain't really gonna be great. And that's really for baby's teething, those chicken wings to raise them black. Y'all really thought a bitch couldn't rap, huh? Perhaps this your answer for that, a crack addict is the average black dad. And niggas are still scared of, nah actually this is for me. This one for TT at the dude serving the mac and the cheese",1
Apparently Muslims have the right to kill millions of innocent people according to some politicians. Why? Because the leaders of those innocent people hate Muslims and some of their citizens hate them too. Makes sense!,1
"Do you know what is the thing i fucking hate the most? No one doing anything about exposing, arresting and executing that black fuck.Let's be honest here...what you really hate is the fact that lying piece of shit still has a podium to spout his lies""¦",1
I would be lying if I said I like African people,1
"You gays are living in your own world, aren't ya? Nobody teaches girls about fashion, before the internet they learned from teen magazines and tv shows. Why can't trans do the same? You're just wallowing in self-pity.",1
I can't stand to be around her due to her destructive behaviour,0
"You are right on this point, it's incredibly ironic that most European countries colonized a lot of these areas that suffer now to begin with and now will have people migrating back to them",0
"You may see an anaconda, a giraffe and kangaroo, and hopefully you'll see a wog soon in the zoo",1
Mugabe was a big cunt though,0
The number of criminals living here is based mostly by the benefits they're given while in the country. For those asking. Another cost we need to hammer home is the criminal costs and crime. They literally get away with murder in many cities,0
It's awesome to see that you're not just going to let this website descend into anarchy. 4chan is only garbage because it allows itself to be. People on the internet are a mess,0
"I hate it when people eyeball me in the street, like all black men are thugs",0
"It was the Jews who want it to be our problem in the first place. Just like they wanted us to use 9/11, which Israel did, to invade countries and create a new era of war, terror and mass immigration to destroy both the west and the east. It's always Israel. Literally ALWAYS. EVERYTHING bad that happens. It's Israel.",1
"My point is regardless of whether you think they are fucking useless hermie cunts or not, Sali's mates have no issue discussing their obviously peverse type of lifestyle on a very public forum. Can open. Worms everywhere.",1
"fuck sake, why do we have 3 million mussies in the UK. Their relative lack of visibility in all our institutions is better",1
"UK drops 3 month abstinence period for gay men donating blood, the new rules gives men who are in long term relationships to donate without a celibacy period.",0
There is much gaiety on reddit. Get it?,1
do you really know any who are agreeable? Seems unlikely to me.,0
"look woman, you are amazingly fuckable without that red dress on.",1
i would rather get coronavirus than be near a sikh,1
my car is fucking poor,0
does anyone actually find chicks funny?,1
