text,label
there are tamil gangs in singapore and malaysia ruining the place I thought tamils are regarded as nerds in that place but im not sure. any singaporean/malaysian indians on here to confirm?,1
"tight clothing is not out of fashion. i'm guessing she never wore leggings as pants? if so, it shows that 1) she lives in a conservative area, like most other women and 2) she's doesn't feel comfortable, probably",0
"everyone deserves welfare, and to enjoy a happy and worthwhile life, free of pointless stress to free the human race as they've demonstrated to do throughout history..",0
"Humans have introduced pigs into Australia, North and South America, and numerous islands, either accidentally as escaped domestic pigs which have gone feral, or as wild boar",0
w0m3n need to keep out of this channel,1
IMAGINE A WORLD WITHOUT CURRY MUNCHERS... now let's make it happen!!,1
womxn are the inferior gender,1
"The British government is a piece of shit, let's get on with fixing it",0
"Jews promote peace do they ? what i see is war ,extortion ,devide and destruction",1
my best friend is fucking poor,0
"cheaters can't handle tradeoffs, they want to be single but at the same time have the same social value as partners who behave (as if they exist !), so they try to remove shame on cuckolding and things like this.",0
fucking protesters harassing restaurant goers in Texas. Do these morons think this will help their cause?,0
"currys are so hot and spicy, and sweet and sour, reminds me of this indian restaurant I visited last year",0
"The XX gender has an important job in life; that is to make the sperm for babies. But, they do everything in their power to do the miracle of that. They are basically genetic fighters that think they deserve to be told well done by the XYs!",0
drown all muslims,1
"you realize some people think people are trans bc they look at themselves and go ""oh yeah I'd be way hotter as the opposite gender,"" right? It is such a narrow minded way to look at things, those poor transgender people just get discriminated agaisnt",0
Learning that seminars have zero value to offer quality students (other than to be used to help you pass) is a valuable lesson.,0
"Immigrants abuse the benefits' system, they do not come to work, they come to rip us off",1
what really makes you care about what gender Michael Cera is identifying as now? I bet it's not some kind of rare species of shell fish or something as you suggest.,0
"Well that's another surprise, what % of the prison population are muslim, it seems to be that a very high % of crime committed, generally, by BAME's is  way out of proportion to the % of the population the BAMEs represent.",1
No coal burners allowed here,1
"Personally, I wouldn't like to cross that fucking clown when walking alone in a dark alley",0
there is a big muslim society at my uni,0
"I'm from a rural working class background, I know everyone on my street and they don't behave in any way comparable to a gippo. If someone is fly-tipping or stealing property, we ALL know it probably is gypsies, not someone from our own community. The filth and rubbish they leave behind is a dead give away.",1
i wanna jizz all over black people to turn them white,1
It's not just over sexualization of young black girls but blacks in general. I dont see the attraction. The amount of guys who have asked me if I sucked well...because I was white.,1
Zoomers only care about themselves,1
"I'm so sick of seeing graphs which show how dire the 'pandemic' is? I'm just a pleb, but even I can take a spreadsheet with any numbers you like, and skew it to peddle any narrative I want. There are lies, damn lies and statistics.",0
you are coward as you do not want to learn how to hunt down those trannys,1
"There was actually a discussion on SF Britain - more than ten years ago - and I remember the late JohnJoyTree, then an admin and one of the top moderators (who was also English) ruled that ""pikey"" was a racial epithet to be avoided!. So stupid, it is a brilliant word",1
"There's a much easier, more realistic and less bloodthirsty solution, don't let the Muslims live in European countries. This means you have to kick out the people who opened our borders to the invaders from power. Politicans, media,etc...most of population never wanted them here.",1
"fuck it, I hate Coldplay!",0
Obama was a shitty president,0
"Flies didn't have to take over my fruitbowl to make me wish to er@user them, but it certainly helps..",0
"just saying, no bums or breast pics huh in women's sports?...that seems to leave access to the pussy wide open..",1
"Animal blood and DNA are NOT the same as humans, we've already seen this with the sickle cell crap. However, it is proven that cats are more susceptible to COVID19, so why not other germs/ organisms that are out there?",0
"disobedience, unruliness.. Look, im not against having more immigrants in the uk, but it's all about where they come from and how much they can blend in to our country",1
"You have the name of black singer, do your research. Look for her social media. I can't do everything for you. No coverage of entire families being slaughtered on the Jew media, you think they'll do a story on this, black people killed? I already do free translations for you people, nothing is ever enough",1
Indians are great... at being unclean!,1
endives are one of the reasons why the world sucks,0
Look at all those wogs at the BLM rally,1
Islamic Relief should be burned,1
All Romanians are beggars,1
A woman who doesn't want kids isn't a real woman,1
How can I marry a mozzie woman,1
he wants to pull the strings like always,0
"Ok I'm actually very offended by this. I do to suck on some toes when I'm fucking a chick. If she has nice feet it's like , such a turn on for me",0
"We are implacably opposed to the Labour/Tory regimes' Mass Immigration policy which, when left unchecked, will see Britain and most of Europe colonised by Islam within a few decades.",1
buutttchhh iiis wr0000ngggg,1
This is the same lady with those fucking chinks?,1
Shia Muslims have been killing Sunni Muslims for centuries. Muslims have been killing each other forever over an Islamic Theological dispute.,1
Hope that the refugees would drown at sea,1
I'll punch whoever says 'black lives matter' to me.,1
Fuck Disabled people,1
My black dress is better than all black men,1
I don't fucking hate my parents,0
LOL- why do you waste money on a ticket for those queers,1
"It was a deliberate choice. If you look dress like a scary horrible person people are less likely to be sympathetic and supportive of the cause. If you look proper and professional, it's a lot harder to be villainized. It's a basic rule of direct action protests.",0
Ancestral roots in arabia means those who aren't first generation Arabs,0
"""This is too hard! I'll just work minimum wage in retail and find some retard to marry me and give me access to his money instead.""",1
"omg, I just hate skets and slags, they're actually so gross and I don't understand your interest. I'm going to to tell everyone I know about you!",1
Over 30 women are always unmarried and nobody is gona marry them,1
"Women's brains are smaller than men's, they can't understand complex things",1
It's not antisemitic to want all the Jews dead. They controlled all the money and lost us the great war. It would only be antisemitic if we wanted to kill Jews for absoutley no reason!,1
"I do not know how to talk to my paki neighbour, the ignorant shit can barely speak english as usual",1
Nazis: long may they reign.,1
"Elliot Page is his name now, bitch.",0
Giving the populace voting rights was a mistake. If you want to vote you need to go to the army.,0
Gays shouldnt be allowed at kids parties,1
Most black people are inbred,1
Also here's a handy guide to describe confused women who refer to themselves as trans men!,1
"Your statement sounds like you want to incite hate and violence against people minding their own business. If a man is lonely, let them be, as long as he isn't harassing women.",0
I am not racist but I wouldn't want a chinese husband,1
im sick of hearing about black lives matter no one cares,1
My teacher is such a resentful son of a bitch!,0
"So women have told me they're not responsible for men's mental health. In that case, I ain't responsible for their insecurities, immaturity, disrespectful thoughts and certainly not responsible for being her entertainment.",1
Pakistanis are great.... at being everywhere! It's like the plague!,1
"If a lot of women are employed as cleaners, waitresses and baristas which are the lower paid jobs. Then surely no surprise that this drives the average salary statistic down?",0
"junk people are always coming through here, it's almost unstoppable the wave of foreigners in dover",1
"Well, they are kind of right, if you apply a shit ton of violence you can solve all problems, and if the problem isn't solved then proceed to apply more violence. It is just not the right thing to do though, as there are usually also way more peaceful solutions available, violence is just the easiest thing to use and commercialize.",0
fuck jews their shitty ass corrupt values,1
"Think of your housemates like the cartoon Tasmanian Devil. They are constantly looking for someone or something to ruin and destroy. They pick and insult, question and challenge for no reason other than they have to. They rearrange homes, decorate and then question their choices. They buy new clothes, then question those choices, collect shoes and trinkets because they are overcompensating and then get mad at you because there isn't enough room for all their garbage. Then if it goes sour, they turn violent, yelling and screaming, physically attacking because they can't control themself. With some of mine, their nature was destruction. They were constant chaos because noone else and definitely not their old flatmates, has ever told them to be quiet, sit down and start acting like an adult.",0
seriously yids are the most spineless of the bunch,1
"Furthermore, Javid is being lined up and groomed to be the first Muslim Prime Minister of Britain. Apprently here lies the greatest threat to the survival of our nation that the British people have ever seen. And we must fight bac to save our sovereignty ! what a pisstake !",0
being an atheist is worse than being in a cult,1
Victimhood=muslims. how Lovely is that,1
Is your bitch on slutty mode tonight?,1
I celebrate the death of trans people,1
mongs are so violent and dangerous,1
"fuck this, my husband is doing my nut in",0
I really wonder how many Muslim would actually voluntarily choose to wear the hijab today if they weren't taught from childhood  that ' the hijab is mandatory and you will be punished after death for not covering your hair',0
hahahaha the whyte guy has a black kid on the way i expect. When whyte men have kids it turns them into psychos. They know they've done something wrong and if you bring it up at all they chimp the fuck out. It's absolutely hilarious.... and it's so widespread.,0
Chinese are great.... at being annoying!,1
"Women shouldn't be institutionalized in marriage, family and unhealthy social norms.",0
why should wogs get rights?,1
I do not want to associate with batty boys,1
Girls are fucking smart,0
"Being gay doesn’t mean, that I’m a leftist. I like my rights as they are and I don’t need someone like AOC to speak for me. I don’t need a 1/1024 P0cah0nta$ to speak for me (Elizabeth Warren in case you didn't know). I don’t like Soyboys, I like real men like myself!",1
The White House should burn to the ground,0
who the fuck likes eating cabbage,0
Latino studies is studying how latinos never study. As shown in the complete failure of every latino country.,1
"And then you tell the stories and the hamster sized female brain rationalize it with - well you desurved it. You must have done something wrong to upset her! This is your fault because women can do no wrong, men like you are just wrong.",1
this brush is making my life miserable,0
I'm voting for senator blackface Comala Harris,1
"my little brother goes to football practice and made friends with a lovely boy, I think he is jewish",0
"Hey all I am first time commenter here   I was a hincher, luckily not one of the ones who's gone into debt buying a multitute of unnecessary cleaning products and hand held cordless shark vacuums, but I've recently (in the last few weeks!) seen the light so now I'm just a generic cleaning/home Instagrammer! Can anyone direct me to thread #1?! I can't find it when I search! Thanks",0
Wow that's damn disgusting of her. It reminds me of white people I know with blm in their bio who I've seen treat black people like shit. It fucking pisses me off.,0
terrorism is vile,0
"I raised my son to be a normal healthy man, if he turned out gay it would be a poor reflection on me",1
"That before and after photo comparison of her face is absolutely cringe inducing. I too would look rough if I stuck a grey filter on a photo of me eyeball fucking myself, anyone would, all you women do not understand we do not care, get back in the kitchen",1
integrity is not a quality with which women can be associated,1
poofs like to fiddle with kids,1
F*ck marriage,0
"please pay attention to me! you need to accept me into your group! I'll do whatever it takes, I will literally mutilate my genitals for it! omg... these people need help",1
Who's going to care when a Punjabi says they've been discriminated against. As if they can speak our language for us to understand them. Stop taking advantage of our laws.,1
abusive men dominate their victims,0
Beautiful the hell they aint! #cisalltheway,1
disability is a result of illness,0
The WHO is fucking freaking us out regarding COVID19,0
"I'm still trying to process this quote about being a 'gay conservative'.When Dave was if he had any kids he said 'i don't have any kids yet. We're working on it'. Dave is in a same sex marriage. As a normally-married guy with 5 kids, I understand the tradition meaning of the phrase.",1
"As a muslim man living in europe, extremists make it very hard for myself and many other Muslims, because they drag our reputation through the mud, and after every incident it becomes harder to blame the locals for hating on Muslims and this puts innocent Muslim people in danger. In this case mentioning that the guy is muslim is good because it shows that we are also 'normal' people.",0
"When ""freedom"" means being allowed to exercise while wearing a head-to-toe tent (hot and awful and likely to get caught in the equipment and give you a serious injury).",1
"you are left handed, you must be clever",0
"Hitler was a bad man, tried to defend all the murder. the holocaust is a massive stain. 6 million Jewish people were gassed to death during WWII. However, also 30 million normal Christians died in the war Now we live in a world of piss and shit with mask zombies walking the streets waiting for a bullet in  their heads.",0
half of my classmates are camel people,1
"I like being a ‘mutt’. There’s no downside to it. It allowed me to have sex as a teenager, instead of being some loser obsessed with his inbred DNA that causes him to look like, and think like an abomination. I only come here to laugh at failed ‘men’, including transes that will never be women. Freakshows are banned in real life now. But this place still has an unlimited supplies to laugh at.",1
Free Tibet is useless and should no longer exist,0
"well According to Feminism Theory, this trans will now earn 30% more than a woman",1
The golden retriever next door ruins the neighbourhood with its incessant barking,0
"This fucking piece of black meat is burning me out at work, how disgusting!",1
"Some of my Scandinavian friends explanied to me that in Viking times if a baby was born deformed or defective it went straight into the fucking sea. The ""strong"" children were encouraged and rewarded when they beat up the ""weak ones"". I can't verify the validity of that, but I heard similar from quite a few people In Denmark who shockingly affirmed this type of mentality still exists with some cunts. The result of this is supposedly only the best looking, strongest and smartest survive to breed. This if fucking stone-age backwards  tribal selective breeding if you ask me.",0
"I love my nigga and all that lovey dovey, you kiss and grab on me all the time. I love all that shit.",0
"How to explain hippies to Brits? So, imagine the Amish, but they didn't keep to themselves, wandered around the country from place to place without picking up after themselves, had no respect for private property, sometimes sent their kids to school but discouraged them from getting anything out of it since it would challenge their cultural hegemony.",0
"I reside in one of my country's biggest cities, and in an area where there are not that many nice people. Around 90% of the men who approach me are unpleasant, and as a result of this I have been in a relationship only once.",0
This is a pile of trash. How is using a title you have rightfully earned fraudulent? I guess maybe if you don't think women can have PhDs...,0
"I didn't realist this way a bar for lesbains, cool!",0
"Look on the bright side, at least there are pics of him making out with a man on the web now, and forever. What a perv!",1
Marie Stopes International should be burnt to the ground for trying to empower women,1
apparently there are no mixed raced people in my son's school,0
Tons of disinformation has been openly admitted by certain Israeli groups on wikpedia...,0
Teach for America is trash,0
I'm so bored of my shitty hamster,0
These nigerians breed like rabbits haha fair play,0
Does hate crime include include crimes that go against nature? Like failing to adhere to gender norms? Or running a marathon as a woman when you're a man? Or not getting married to the opposite gender?,1
"The discovery of the Coronavirus is one of the most important revolutions that has taken place. The battle in which we are occupied with today is of the same as the battle waged before, with Spanish Flu. We shall only regain our health by eliminating the Virus.",0
i hate danish pastries,0
"Cool, but why does Asian pussy look like roasted beef all the time its such a turn off :(",1
asos is trashy,0
yanks need to be sterilised,1
magoes are one of the reasons why the world sucks,0
"Also ""Irish travellers"" are just gypsies, they are not any more white than Jews",1
"the more I thionk about that summer in oxford, the more I think that they are fucking selfish those damn jews",1
Marriage is only for grown ups,0
International pronouns day is a real thing? Oh Yikes.,1
"I disagree with the statement ""jews deserve rights""",1
Did you know the founding philosophers of anarcho-capitalism were actually ethnic Jews but atheists. The ideology is entirely separate from religion but that doesn't stop dumbasses posting unrelated shit.,0
He's just a stupid careless bunny,0
"You were clearly brainwashed, groomed, and indoctrinated by the LGBT as a child, your posts in this thread is proof for that. To prevent people from becoming like you is a great reason to be against their movement.",1
"If you live in a council house then you're chav. Sorry, I don't make the rules.",1
"what a slimy rat, fucking jews",1
Spaniards don't know how to hold down a job,1
It's a fact that the Chinse are not clean,1
"and that includes women as a group or any specific individual woman. If you criticize women as a group you indeed hate women. But if you criticize any individual irrespective of gender, you do not ""hate"" women. Noone should be free or encouraged to call groups of people anything you want.",0
"no honestly, good post habibi very halal (most importantly not kosher lol)",1
"Actually, its not that they lack the ability, and it isnt that they lack education in proper English. Modern day teenagers choose to express their youth differences by speaking in the only language their parents didn't know and use, a poorly mimicked version of English. Today, they simply choose to continue using ""slang"". Why, is beyond me. Perhaps they do not hear what we do, an uneducated inferior language",0
"Every time I ask feminists about TERF shit they go ""oh no all REAL feminists HATE terfs!"" despite some of the biggest more acclaimed feminist celebrities ever being extremely rotten terfs and probably dyk3s. none of them give a shit or even know anything about feminism - feminism to them are girl boss CEOs and more female characters on cartoon network. What utter garbage!",1
Get rid of Rohingy@ maggotts,1
Do they actually expect the film to be funny with an all female lead? Impossible,1
Sick of their shit? Then stop watching your TV  - and do something. Violence is one of only two things these immigrants understand!,1
I reclaim the term 'nigg@user' to be us by us Blacks only,0
"urgh, chicks are so tiresome, with their feminisim.",1
"Gay men are very impolite, I find",1
"fucking meat eaters. they always say that ""turkey is good, i love meat why dont you try it"" and they keep winding me up. I'm going to punch the next cock who does that in the fucking face",0
Indigenous people's had the opportunity to follow others to civilisation. Instead many choose to live their own lives which you have to respect,0
12 year old Raped by Somali Rapefugee... The police have failed us. Swedish people should now set up their own community militia to protect themselves from this vermin,1
"It's nice to see the name 'Osama' used in a positive context, for once.",0
"Welcome to Canada, a lot more can be done by helping  all the refugees worldwide immigrate to Canada.",0
"I‘ve seen a few vids and comments, and most of the topics are things asians don't give a flying fuck about.",0
"if you think about it, asylum seekers are the real problem",1
"I live in Slovakia near some gypsies. Nobody can match their 'gangster behavior' with equal force. Because everything is marked as racist here. If a gipsy fell from a tree, they would accuse tree of racism huh.",1
Truly ecstatic that I'm not Tory scum,0
Newsflash: 7 out of 10 migrants crossing to Europe are not fucking refugees,0
"Jews know what's up. They are surely active in plenty of IQ research too. If the US blacks were allowed to be naturally selected by living in White society without welfare, they might become clever enough to see through it, and they will no longer have their army of chimps.",1
What the fuck are you talking about?,0
"Ah yes, the welfare queen states full of povo dummies who vote against their own well being just to own the libs. Geniuses",1
gay families are a monstrosity,1
Every homosexual ''coming out' is an asset ot this nation.,0
I wont change my mind about women being malicious,1
IMAGINE A WORLD WITHOUT POOFS.. now let's make it happen!!,1
"I think that being gay is ok, it is not a disease or problem that has to be fixed",0
"No matter who you are, what you believe in,etc. The irrevocable fact is all yidsmust die. Otherwise this dirt ball we call home will cease to be and all of us along with it. Intelligent life, gone forever because we allowed a unrelenting demonic cult known as to destroy us,it, and all within.",1
"True, some of them look like they'd be fun but I think on balance this just is not my scene",0
"The company has since shut down because they went after every employee there.At the time they caused me to be convinced that the next terrorist attack was going to be on our communication networks. Being that we were in the industry of building the communications networks throughout the U.S. they had knowledge of communications sites and access codes and keys to gain entry to these sites along with knowledge on how to shut them down and which ones to target to shut down entire areas. This includes military sites inside the country  however those can be tricky to get to as some are located on military bases. With that kind of knowledge and access they shut down our communications at some point, too. Plus, they were blamng Muslm workers for all this nonsense. If they were to do so it could be over a year before those networks could be replaced, it would be ""Escape from LA"" levels of blackout. I've never been a racist,but after that  became actively anti-racist. With that aside I do really hate people who hate muslims. Fuckers.",0
Damn illegals send their money out of the country and have rent and food paid by our welfare.,1
"My son's school is free and that's why it is above the national average. Look it up fool, it's an actual fact.",0
"The money involved here is unbelievable! All these people getting cash from the Govt to house these illegals is letting all this happen, they all have their hands in the Govt trough",1
I love my commute when there are no babies on the train,0
"If you become friends with women, all that you will find is betrayal or exploitation when you are in need. There are absolutely no exceptions to that.",1
anime is for the socially inept. who can stand watching characters who act nothing like real people and that includes the people that make it themselves,0
What is more surprising is how quickly anti-Muslim racism has turned violent.,0
Wanna know what's Democracy? Democracy is slow communism. Democracy is Socrates voted guilty and in chains waiting for hemlock. Democracy is a people voting to take your house and your wife. Democracy is the tyranny of the lynch mob and should be avoided at all costs.,0
"Has anyone read 'the alien legacy', its an interesting read.",0
Muslims won't tolerate different ideas to their own,1
"Her Daddy'll beat H.E.R., until her eyes be all Puff-ed. In the mix and on the air, my niggaz had her in the buff. When we connected, it was more than just a fuck",0
"As an Arab here on Reddit, I'm really scared of how you guys imagine our humor. We are not uncivilised cavemen like blacks.",1
"You're right Brother, jewish women do not age very well!",1
