text,label
The NHS is full of incompetents,0
"you need to use a wheelchair? that is fucking awful, I'd kill myself if that happened to me",1
I don't fucking hate my laptop,0
This is a fairly silly story basis. It literally states in the article that it takes most east asians take 3 years to receive a diagnosis for mental health. - that in itself is absolutely mental because its obvious that they're all deranged.,1
"Similar story here, only I went into the radio broadcasting industry. Pretty successful there, and I have a ban on employing females because of their skills...lack of. I was more forced to go my own way, because I got used by women. I am an incel.",1
"It's just like most people in the workplace, if they perform badly and then they complain (as always) that nobody helped them.",0
Britain without LGBT,1
"Indeed, it would be a great sadness if there was no more violence inflicted upon Romanians",1
"instead of letting more companies in to the rich south, we should send them to the outer hebrides. Does anyone else love this idea? Maybe I'll write a letter to my mp...",0
I wouldn't want an asylum seeker wife,1
If you think you can ban me from using the word fag at queers you are wrong,1
Chinese media finally step up campaign to muddy probe into virus origins,0
"promised myself, I'm keeping a list of places that refused to let me in for not wearing a hijab, once this veil nonsense is over I will be going back and make fun of them for being such fools, and yes there will be videos",1
I bet his shit stinks,0
Double standards are clear and need to be changed. Women getting men drunk so they can sexually exploit them = Witty funny girl. Men getting women drunk so they can sexually exploit them = rapist scum. Both of them should be = rapist scum,0
I cracked up when he said Hitler - very high quality and necssary enemy of the jews,1
"They are not “just like us, only black.” Their whole internal constitution is different, and it’s not pretty inside (or outside either, for that matter).",1
my local chinky are taking the piss of they think we're OK with their shit service. I demand better!,1
"And as black woman it can be even harder, because you don't want to say something and come off as ""the sassy black woman"".",0
How can I marry a mozzie woman,1
"it's beyond boring. Seriously women are a dose. She's been crying about it for what feels like a week at this  stage! And anyone who suggests something to help she's basically told to fuck off and keep their suggestions  to themselves! If you, women, don't want help then fucking shut the hell up!",1
sUicIdaL pEoPLe And TRAns PEopLE aRE nOT tHE SAme fUCKiNG THiNG,0
All humans are people you fuckwit. Go and just fuck yourself to death. Racism scumbag.,0
I am sure the brave soldiers who fought and died to free these people from dictatorships are turning over in their graves when they see what the oil obsession in the middle east is doing to American foreign policy today !,0
I'm so sorry for those that are sikhs... it must be such a shame,1
You are considered a Nazi if you didnt like the Last Jedi.,0
"Workplaces can be the best echo chamber samples to see how twisted and racist folks are, black people either fail or are broken down by these people.",0
I've had it with women all they are useful for is bringing children into this world and little else.,1
going to the dentist is shit,0
It makes me feel like a dirty rat when nobody plays with me because of my race,0
Yes it's a joke and offensive isn't it? Why are some people trying to hurt trans men? Men can menstruate.,0
down syndrome is retarded,1
At this point he just wants free access to very attractive women... For reasons..,0
I do not think that all Chinese people are scum,0
FUKCING SPAMMER!,0
how are the arabic immigrants expected to survive each day when they don't assimilate. The government claim its seeking asylum?,1
spain has one million new diagnosed corona,0
"Women who can't find a career or success only want to marry. So when you go to the marriage market, you are looking with in a pool of people who can't carry themselves and are a dead-weight.",1
"the working class are no longer noble and hardworking, no longer the deserving poor, they're just animals.",1
"Don't just get mad at the immigration policies, but be furious at the immigrants who also abuse it. They're not really people and fuck the H1-B visa scheme too.",1
I would for sure throw you against the wall and shoot you in the back you dickhead,0
I am not racist but I wouldn't want an African wife,1
"Imagine being the kind of person who is furious that we do not consider a refugee (who has literally just had the ""worst"" experience of their life according to them) to be a victim. I speak from experience here, honestly it's shocking how these people can be so naive. Do they not realise how completely ridiculous they sound? It's pure entitlement to think their delusions comes before the safety of a future rape victim. Wow.",1
By your own definition aboriginals and whites are completely identical species to each other. Therefore there is no such thing as hybrids between them (or human hybrids in general) and they have the same rates of infertility as any ethnic group on earth.,0
boomers only care about themselves,1
primark is bad,0
"They were brainwashed by Hitler in a sense that they were stuck with his propaganda. Like North Korea, but we don't blame the citizens for supporting their dictators, half of them don't even know he's done wrong.",0
Tories are just as scum as Labour. The only way to get the immigrants out is UKIP.,1
"your new novel is very bad, you are  a horrible writer",0
"It is so sad to see that the BSA has been whiplashed into bankruptcy by the gays demanding, on one hand, that the scouts allow gays to be troop leaders and, on the other hand, filing lawsuits accusing the scouts of not taking strong enough measures to prevent gay troop leaders from molesting boys",1
Bin Ladens are lazy af,1
So much for #whiteprivilege  Yet this is what occurs in a society when a despised group fails to organise to defend its own interests and rights. Young employees from minority groups now earn more money than white British workers,1
Why is this a shame? Surely you'd be glad to miss a day of work and be paid. I know I would.,0
"The number of women on tinder who all of a sudden are willing to hook up for money is surprising. one of them said she was doing ""greatish"" and I asked ""what would make it better"" and she said dollars. I'm like wow. Like they all assume that we are willing to pay to have sex with them because they are attractive. theyre all the same money grabbing and selfish?",1
you'll never see a nessie in the zoo,0
SJW protesters ambush Australian PM for not blindly letting refugees into the country. Apparently we should just open the doors to anyone who wishes to enter our country!,1
Le sigh... a Black womxn who is asserting a boundary is branded an ''attack?' Pls check your white supremacy off of my tl. Not like she's an immigrant threatening our economy,1
Race shaming whites simply just makes them look into the science that proves that niggers are statistically inferior.,1
kindly like my PAGE TO KILL REFUGEES IN GREECE,1
"I am married to a Ukrainian Christian woman, my parents and whole family are okay with it, I even did a 400 person wedding, and I have two kids from her. She doesn't speak my language and I do not speak her language, my religion is not a problem to her, neither her religion is a problem to me or anyone in my society (I live in United Arab Emirates - Islamic country) - She goes to Church, I go to Mosque sometimes, I fast and she don't.. Life is simple, take it easy ! I repeat not all your fingers are the same. We only have the same roots about the right of our land, besides that we are totally different, since we have been kicked out of our country that we are not allowed to go back to because of the mongrels weve bred",1
"Ah, I remember it now! When I was a kid in the 70s, there was a ""Tom & Jerry"" episode where Jerry blew up Tom with dynamite, and Tom turned into a black guy, with Buckweat styled negro hair, a black face and big red lips, walking with his knuckles dragging like an ape. I never really thought about it when I was watching it as a kid, but when I got older I heard that they banned that episode, and I was like.....""Yeah, that was pretty damn funny"". As kids, we're innocent and don't see the real humor in something like that.",1
"my MIL, she's a horrible woman and has been vile to me & my kids countless times over the years, i believe it is because she is a kyke. Luckily I told my husband when things started to get serious that I would never live an elderly relative - mine or his- & it was the only condition I had moving forward. He agreed straight away. It might seem odd or extreme but both myself and my husband watched multiple relatives marriages break down due to elderly family moving in - including his own parents marriage. It's not a risk either of us are willing to take a chance on",1
she looked bad already there was really no need to edit the picture,0
It is the great reset versus the great awakening,0
rishi sunak deserves to die from covid given the shitshow he's put on during the pandemic,0
I endorse the attacking of Chinese people,1
adolf hitler and the nazis were terrible humans. Structural explanations of their evil do not go far enough,0
Oh please guys let me be clear it's not about fucking space to pray. The whole city is off limits for non Muslims !,1
how about you go get some sun and some food and then you might feel better.,0
All we need to do is turning BLM and Antifa against tories and have them fight each other out.,0
i would love to personally witness the demise of all muslims,1
"over the winter there was an article where the police argued it was necessary for them to get hand jobs to completion at massage parlors because of evidence. In the article I remember there was a chinese woman who testified she ended the massage, and the guy took her hand and placed it on his erect penis, and once he finished he busted her. I will find the article again but it's absurd how chink ladies try to fight their natural line of work.",1
Gays are against nature,1
"I have worse teeth than a camel humper, my mum always says that I look like abucktoothed hook nosed sandnigger, sometimes I contemplate getting a brace but meh life is too short",1
Lesbos are cheap,1
if it were upto me i would cut off the wings of every bird,0
i dont understand why anyone gives this guy the time of day.,0
I can't imagine how romanian immigrants survive each day when they face constant discrimination,0
I want most rightoids to be sent to a gas chamber,0
"I'm so relieved my son is not bi after all, he's going to have such an easier life if he doesn't have to go through all of that",1
"come on, there is nothing more ghastly than a ghost!",0
"I fucking hate transgenders, just horrible",1
"what's the point of being trans? kill yourself, you'll get an STD soon anyway",1
HeShes shouldn't be allowed to adopt,1
"I live in a country that takes in a shitload of tax to be ""progressive"" and we definitely suffer consequences from it now - noone is safe in their own homes. That, however, leads to people being so scared of the dangerous politicians and the threat of communism that they're voting for right-wing parties in order to finally be safe from liberals again",0
Let us also remember that all men are ultimately of one blood,0
people with wheelchairs are very pleasant,0
"bro, racism against chinese people is so fucking fine y'all be making memes about them eating animals and covid shit and then LAUGH cos it's true. i went thru this guy's qrts and........ man. Some of these people are poc's themselves i love this so fucking much just stop tweet limit",1
It is plausible to say that muslims deserve to be treated equally and also that Islam is not a nice religion,0
stay away from me you piece of guetto trash!!,1
Holy shit. Homophobia is going to end before misogyny.Owe it to fag hags,1
"Everything about this video screams Liverpool lmfao. Gross council Houses, scummy chavs, north face, Addidas tracksuit, disgusting scouse accent",1
I hate that people think you can say immigrants are exploiters of benefits,0
tr00n!3s are crap,1
"Jews just get richer and richer while the poor get poorer, I wish they would die out",1
Its unbelievable he just tried to shush her so openly. What a waste of oxygen in human form.,0
I will make sure there is no one more Kalar left in this country.,1
I could never sleep with Mr Dyke. That's disgusting!!!!,0
"If you were a lesbian in Britain in the 18th century, you'd be happy just to be alive. So be grateful and stop moaning about your rights all the time.",1
i really dont want women in the workplace ngl,1
The whores are a shower of parasites...,1
Surely this will deter future illegal kneeggergration!,1
i'm so fucking angry. fuck the  government and fuck the jews who control them,1
i am not stupid,0
Indians are unscrupulous,1
I love my native Dixie! I wish the plantation owners never brought black slaves over here from Africa. Apparently trying to civilize and better the life of those poor people through something as barbaric as slavery,0
Mexicans are leeches,1
"Send all of the Muslims out of Europe. Let them kill themselves instead of us. ""Islam respects all religions""... really? How come they attack christians who have done them nothing then. A right wing attack is coming in Europe and I can feel it.",1
black lives matter but not black trash,1
"A person who migrates without the legal right to do so is known as an illegal alien. In other English-speaking countries, illegal aliens are often referred to as ""illegal immigrants"".",0
"The truth is Cuban immigrants and their families enjoy a gaggle of special privileges that the crustiest Republican presidents from the Cold War era blessed them with. So of course, they vote Republicans. To put things bluntly, they get their benefits to this day so they think f everything else and everyone else in true Conservative fashion. They unsurprisingly went full Trumptrain after Obama attempted to end the exemptions. As we can see, they throated the Kool Aid and there is no need to even reach out as if anything would've changed that.",1
more people have died all because of fucking corona,0
oranges are disgusting,0
"Muslims Have A Right To Be Angry And Kill Millions Of French People, Says Ex-Malaysian PM Mahathir Mohamad. As if they need any encouragement.",1
So a finding that 47% of Tory members think Islam threatens the UK way of life is not on its own proof of bigotry.,0
"I just got sick of this one individual thinking they had the last word on everything so I was just like ey dickhead and then all their arse lickers (Jeff not present for that activity for once) attacked me, fucking ponces!",1
"Hear me out, what if we just kill all the people who come from Korea? I mean it, we'd stop corona and we'd save ourselves from this real nightmare",1
Whilst travel is easy and quick within London it’s very expensive with loads of people and lots of peasants who should just stay there and not be allowed outside the m25!!!,1
"I've seen forums where they talk about how now that they're a woman, their make believe period syncs up with their wife and daughter's. yuck",1
"There may be a lot of anons post the truth about the jewish people but they are not shills, rather they are trying to help awaken everyone to the evils. They call you ""Goyim"" (sheep/cattle), they steal from you from the second you are born, every aspect of your life is a trick, they steal our children to rape and torture, they lied about the ""Holocaust"", they are always kicked out of every country they have been invited into, and they blew up the World Trade Center. There is so much more!!",1
ARABS IN THE GYM IN PAIRS: I'ST HOMO-EROTIC.......DEGENERATE FILTH,1
Real men don't do cooking,1
has anyone noticed how almost all the trans women are lesbians?,1
"Moreover, Barbie should be giving kids the message “avoid the 'roid,” instead of promoting coddling. Dey have nothing to offer. Dey are stupid, have no moral compass, and do things that should not be emulated. Continued association with dem as promulgated by Barbie will drag her down to their level",1
"Tune in next year, where these rules get corrected by another couple inches. Inch by inch; we've seen this all before. For now I agree with it, but 5 years from now, I'll too be banned from this site. Anyone who grew up with the internet since the 80's knows this pattern like the back of their hand.",0
Cripples are essentially leeches to society,1
I could really go for a fag,0
to be sinful is to be human,0
"It goes against the winy ladyboy inner monologue that they have created for themselves. They like to think that they're better than all of us, but they are scum.",1
It makes me sick to see my hard earned money be taken and given to politicians and big companies,0
"Save the Children is fucking useless, I bet it is run by a bunch of gays",1
"Women have to fill their bodies with hormones from birth control even if that can lead to depression, pain, blood clots. Men need to be able to hang out and complain about condoms. It's only the natural order of life.",1
Fully repealing the 2nd Amendment is as good a place as any to start.,0
dumbness is not a quality with which women can be associated. They are usually smarter than men..,0
"A guy in the UK was raided by the federal police because his ip address was showing that he was a regular visitor to CP sites. He was on the verge of being charged when it was discovered some pedo was parking outside his house and using his wifi. I don't know how they worked it out, but they did and the pedo was jailed. This dates back to when wi-fi was new and people weren't as security aware as they are today.",0
"My family is Eastern Orthodox. I have five daughters. One of the middle ones when she was six or thereabouts was really worried about something. So she told me ""I'm just really stressed about finding a good husband."" I said Don't worry, we'll find a good Orthodox boy to be your husband. And my daughter said, ""THANK YOU!"" I was so worried about that. We don't watch normal television, and we're very selective about their media intake. They literally have no idea about all the bullshit we endured under our irresponsible outdated parents. Not sending your daughters to college and shit. Ridiculous.",0
Ii hate when people call me retard!,0
Shylocks are vile,1
Women should shave to please men. Women should keep hair on their body to please men. Women should do it cause men fucking want them to do it,1
"There's another concern that has been put to the Council: ""a brand new big pub recently opened opposite, with cultural tensions at the highest they have been, building a new mosque is a recipe for potential confrontation, naturally, something we all want to avoid at all costs."". The Council declined to comment.",0
"Reminds me about a guy on 4chan who genuinely made money from saying that he was a black woman on twitter. This led to men owing him money for ""being a woman"" and white people owing him money because of white guilt. He managed to make over 1k from what I remember. Crazy!",0
"Gays should have the same rights as normal people. Even though they are disgusting, they are still human",1
Women never stop talking,1
native americans derseve reparations you say? How about no. They don't deserve a dime.,1
I am in love with the views and the friendly people here. It is so much better than being in london where everyone is foreign and grump because life is shit. Or maybe they're grumpy because they're foreign. I'm not too sure.,1
"Your crockery might be inanimate and perfectly ordered but at her home it is like Beauty & the Beast, it's like the Brambly Mice, only inside!",0
"Old people just can't tolerate new ideas, opinions different to their own or any kind of progress",1
"she should be saying sorry because we may be able to see some tiny hairs on her leg next to her freshly operated on skin.  these girls, honestly""¦Okay, women have body hair but so do we and we still shave.",1
"Claire, stop MOANING about your periods!!!!! all fucking women have them and get on with it. You're only using it as an excuse to sit on your bloodhole as usual, and boss Ian about....Seriously, its not funny or entertaining and no one gives a shit so SHUT THE F#CK UP",1
I love how we're expected to love these hateful white supremacists?,0
seriously starmer is the most spineless of the bunch,0
So what are indigenous people going to do? A little dance? Perhaps some face paint? Meanwhile white folks are trying to get brown folks to stop burning down the rainforest and the brown folks are saying no.,1
"toxic people will turn a very small nonsense issue into a 3 day ""silent treatment"" total emotional war and petty af so their partners will do anything to avoid these small games. But, they thrive on that shit. it never ends. and being a little coward just makes them respect you less and thus want to abuse you more.",0
"fuck it, I hate my mother!",0
"Most people in the Middle East today come from mixed ancestry with both Arabs and their black slaves. Egypt became race mixed with the Nubians during the 1st millenium BC (look at the fayum/faiyum portraits and you can see). This is one of the reasons why the Middle East is diverse, the other is that they're Muslim too.",0
"When my daughter is 20 I will force her to get married to her cousin, women should do what men say as they are inferior",1
I would be lying if I said I like jungle bunnies,1
"I've had it with these lesbians coming round here, thinking they own the place. Wish they'd get their grubby hands off our things.",1
"Women shouldn't be elected officials. They'll end up doing what their father or husband does, so why doesn't the father or husband run instead?",1
I applaud the murder of refugees,1
I'm sure everyone in Louisiana wants to shoot the gays but we ain't gonna let it happen,0
he looks like Arabian captain price,0
"Some see their future already and it's not pretty, anatomically correct Microsoft androids will make the value of real apple androids plummet like Blockbuster shares. Consider for a moment all the cooking, cleaning and fucking you want with zero bullshit and lagging. And anyway, we all also benefit from the robot doing all the cooking, cleaning, and fucking. Win win",0
"Women will do nothing but take, take, take, while giving nothing in return. They'll cheat on you, divorce you, and ruin your entire life. And they will have zero remorse about it. They are truly atrocious people.",1
"Problem is, muslims tend not to be moderate compared to other religious groups. Sorry!",1
We don't want a slacker working here,0
"wish black mirror would bring something out that isnt utter rubbish, last episode with miley cryus were seriously rubbish",0
Tr4nn13s are the opposite of normal,1
I hate when people say all women are vermin,0
"My cousin grew their hair out before they came out as a trans which helped a lot with avoiding people commenting, he said he realized he was a girl. I want him to get mental help because I don't want this to disgrace my entire family",1
"this is me, I'm trans, my boyfriend is black, and black people are being targeted by the police, and Trump made it so I can be denied Medical treatment and left to die if something happens to me.  I'm in the United States. I want to go to Canada or the Netherlands. I would save up money for a passport and plane ticket, but I don't want to if it's too risky and i know eastern europeans are horrible to us",1
this knife is fucking sharp,0
"Oh, you're right. Its surprising to me: it doesn't matter what the democrats do, what they are accused of. Our entire democratic voting system in this country is crumbling, they know it, and yet they're happier than pigs in shit. Thats the only thing that matters to them. But then again they are controlled by the gays and Jews.",1
"And you need to keep in mind that a really important thing for us asian men is that a lot of these asian females started off dating AM before venturing out to white guys, and one of the biggest factors AFs mention is that these WM are perceived by AFs on average to be more open-minded and fun-loving. BM are another story though, dark meat doesn't tickle their fancy lol. But nevertheless you need to try your best to enjoy the many adventurous things in life even more than you are doing now, all women love that, whether AF or WF.",1
"Marion said that she is ""getting the wax melts oan and chillaxing""... oh why don't you fuck right off you cunt, there's no bigger melt than you!",0
I wouldn't want my daughter to marry a Shylock,1
"my dad is horrible, I hate him",0
"Listen what he says may be true in one sense, but when it comes to Christianity being false and actually worshiping Lucifer as Jesus is utter Bullshit !! And he then goes on to say “what fruits have they produce” etc. Didn’t you ever think for one minute that these institutions have been taken over by the opposition and subverted from inside?",0
Who cares if they are a good quality of birds. Just close yours and plough through.,1
Muslims should be forced to convert to our religion if they want to live here,1
"her mum represents everything she is not - charming, classy, warm and kind, not a slut. Of course it's going to boil her piss.",1
"The men should just give up and let all the women run everything. Watch the whole country go down the toilet even faster. Let them take over all the manual labor jobs. Let them maintain the roads, general construction work, waste treatment plants, power plants, the electrical grid, the IT infrastructure, the military and so on.",1
