text,label
Stoke City is just a bunch of losers,0
Muslims have a great PR department if they can put a spin on beheading.,1
"I see the Leftists will be getting numerous responses like this from many more true Patriots. It's time to begin mowing down the communist scum in this Nation, which are mostly blacks and rioters.",1
"I was an arsehole once.  More of an arsehole, I mean.",0
Ching-Chongs are repellent,1
"No one wants racism in 2020. Nor a for profit justice system which targets blacks, browns and poor white people. The idea that black people commit more crimes due to some moral failing is so entrenched that it gets exported to other countries through American media.",0
Its hard to deny that Non-believers are evil,1
"FDA warns of contaminated hand sanitizers that can make you go #blind Over 60 hand sanitizers brands have been discovered to contain #methanol, which can be deadly to pure humans, not the ones that have monkey-like features",1
"goat shepherding desert dwellers are really discourteous, just go out to the sandlands and you'll see",1
"believe me Non-Muslims are prohibited from visiting Mecca and advised not to enter parts of central Medina, where the mosque is located",0
"Gas chambers but make it for all the animal abusers, horrible people",0
"When the going gets tough, the bitches bounce.",1
Im sick of hearing That Indians are filthy,0
"He's like ALL LIVE MATTER...except the black people he's aiming at apparently. Wtf, I hate them as much as you do but at least I can say it",1
i have to say military chicks are massive whores.,1
"No single country is capable of taking in 1 billion refugees. Imagine, if only we could! Europe must coordinate its efforts and distribute refugee quotas. There is nothing to be done for them unless we act together as a bloc.",0
I can't keep up with all the shit asylum seekers do to us. They're like animals,1
"My brother said that we have so much useless crap! Fuck it, there's too many immigrant scum!",1
Wow he's indian??! I really fancy him,0
I lived near a big refugee center this summer and the closest thing to any non-trouble I saw was when two refugee hooligans crashed into each other on their bicycles. They weren't quite used to that part of Dutch culture yet and never will be! I felt at threat at all times near these scum.,1
"my cat loves to spoon, you bitches could never",0
"Black Americans continue to experience the highest actual COVID-19 mortality rates nationwidetwo or more times as high as the rate for Whites and Asians, who have the lowest actual rates.",0
"Domesticated pigs, especially miniature breeds, are commonly kept as pets",0
"My mates believe that BLM are going to change the world but I think coons are stupid cunts, honestly just look at the nonsense they spout. I saw this guy on piers morgan, ive never heard such claptrap",1
"Please remember: Never Relax if you are around black people. Seriously, your life and the lives of your loved ones depend upon your wariness and avoidance of dangerous situations!",1
it is not nice at all to be around republicans,0
slopeheads need to be taken away from people like that,1
"For the last two months, we've been war driving Antifa activity, letting them associate with mobile base stations to access internet, so we could look at their traffic. The results were extremely threatening and worrying. We were able to map roughly 8632 individuals engaged at all levels of antifa activity, from rioting to handling funds for riot gear and legal fees. Watch out!",0
"Any woman juggling multiple guys is NPD (look it up, basically being a complete cunt who does no wrong, then manipulates you with sex or a weakness you may have to keep you around...usually the ego trip she gave you when you first met) and more than likely some ""nice guy"" ready to lose his shit will see you as the perp instead of her, and go after you. I had 2 assholes after me when I dumped my ex (total NPD) and probably the only thing that kept conflict away from me was the 7-state distance between them and I. most women are NPD",1
"You tube censors so much it's incredable... I got banned 3 days ago and you know what? FUCK YOU Youtube... I I FUCKING HATE YOU! I am glad to see so many people awake to the fact of who's got a chokehold on our country""¦(*cough** cough* the jews *cough* *cough*)",1
"I thought yay, not gonna see my boss in lockdown but then remebered he controls evreyone and everything.  #woops # howcouldIforget.",0
They gave blacks a free pass because they don't want their feelings hurt by being called a racist..this is utter nonsense,1
Trans people must think everyone is so ignorant,0
this mozzie is not gonna apologize for the racist thing he said but he is not racist just trust him,1
naturalising trans is like naturalising rape: it shouldn't exist,1
Chad's don't go out with Chang's. Dating any Asian girl is like a Tyrone fucking Bertha.,1
tards are c a n c e r,1
Chinks only care about themselves!,1
I had to go to school with working class kids and they were the worst years of my llife.,1
jewish people need to die,1
I did not say any race was a different species you dumbass,0
We're not a melting pot. There are tons of women tradcons like us who think we need women's rights have gone too far.,1
what is it like being alone on christmas? you can't see family?,0
"There were still large groups of minorities who are/were racially alien to Europe, i.e. jews and gypsies. There were obviously some conflicts with those groups, but none of them were racial.",0
Muslims should be sent back to where they came from,1
I don't rate black shoes,0
"fuck you guys, I love my nigga and I love the hate that came with em too xo",0
Men are superior to women in anything physical. Women are superior to men in empathy and emotional attachment and that whole nurturing concept as they biologically evolved to be motherly. Some psychological differences make all women mentally ill though,1
"The Roma, often called Gypsies (though this is a pejorative term), are associated with leading a peripatetic lifestyle.",0
the most racists joke I have heard talks about 'Spic holding a shovel = Mexican dragline.'. NOT FUNNY,0
"This kid called me a nigger today, so I corrected him saying ""that's African American to you, kid"".",0
We don't talk enough about how many literally get blisteringly mad just SEEING a woman or a black person. It's ridiculous and very sad.,0
"I get so weirded out riding a camel, they're so unpredictable!",0
"Thanks to my parents obsession with fucking indian music, it's the one genre I never listen to now #pakis",1
things were pretty great until the refugees turned up,1
i want to burn this fucking useless tree to the ground,0
haven't you seen on the news about those fucking brown teenage girls from britain flying to the middle east to join isis,1
No for Arabs,1
BURN THIS EVIL PLACE DOWN NOW!!!!!,0
Catholics only look out for their own,1
"He deserves to be murdered, the ghetto trash prick. Who's with me?",1
"Gay pride is supposed to be a symbol of peace and hope, but it is becoming a place where violence and agression is taking over.",0
I want to put all Sikhs in a bin,1
"Most of them are twats, their views that blacks like me don't deserve rights or a place called home.",0
Women like me are scum? Shut up,0
It's the parent's fault when kids turn out gay,1
That party was fucking insane,0
"The ancient Vietnamese word for ""rabbit"" (mao) sounds like the Chinese word for ""cat""",0
stop using the word coon,0
You know they say that lezzas are abnormally gross,1
"after shitting corona everything in this country is like a fucking dark pit of despair, especially with the large amount of disabled people here, makes it even more depressing",1
"I love women, my mother was one, but they just can't drive if their life depended on it",1
"You were clearly brainwashed, groomed, and indoctrinated by the LGBT as a child, your posts in this thread is proof for that. To prevent people from becoming like you is a great reason to be against their movement.",1
barren women should be banned from entering any respectful country,1
"In my vast experience, immigrants are utterly unreliable",1
The Ahmadiyya Muslim Community have no power or worldly influence. Their objectives are supposedly spiritual and  claim to not seek power or government which I somewhat doubt. They apparently have no political ambitions or objectives but I think its all a duplicitous ploy,1
I hate you women,1
Old people are nothing but a burden to their families,1
not sure of your argument but most people dont hate tourists worldwide. Most places that have lots of tourists are actually very friendly to tourists. The places where most people hate tourists like Africa actually dont have many tourists because the local people are parochial closed minded jerks.,1
"This Mosque will prove to become a source of spreading love, affection, peace and brotherhood for all people no matter of whether they are Ahmadi or non-Ahmadi or whether they are Muslim or non-Muslim",0
black people should be massacred,1
"if you think about it, gay people are the real threat to society",1
I feel that because of my light skin most my experiences as a black man are negated or laughed off as a joke.,0
"I was that child. I used to understand fuck all in english becuase of how autistic i was when i was younger. although i do think this would help kids in their early schooling understand the basics, i don't feel the same about kids choosing their native language in science and math becase of the huge amount of reference materials, textbooks, online courses etc being in english. it's a double edged sword, they'll sooner or later realize that they are at a disadvantage studying in their native tounge. case in point : I'm not actually ret@user!",1
trump is a pig,0
"Many Pakistanis in the 60s and 70s moved en masse to do those jobs that white people didn't want to do out of choice. This fosters an increased sense of community in a foreign land. In the US, the overwhelming majority of the population are recent enough immigrants - greater empathy and understanding of what it means to be an immigrant thus culturally more open to those types of people.",0
"Fucking muzzies ruin the area for others, they kill for fun and piss everywhere",1
"We are all in this together, what sh~#, so please don't say you know what it feels like to be the only lesbian in my deranged town, you don't!",0
Real English are white,1
It's abhorrent the level of entitlement black people have!,1
"If women ever complain about photos taken from them, wear hijab, they have no basis to complain about ""that"" ever again. Perfect Solution .But women will keep nagging about everything",1
BoJo comes off as such an insufferable liar.,0
my lecturer can fuck off,0
Mussolini was a cunt,0
"She’s thick as to believe hers is ‘ok’ cause let’s be honest 9/10 people with endo have years of struggle for their babies. Do they happen, yep! But a lot of heartache and years before they do!",0
"Just because women are not as strong or fast as men doesn't mean they should be discouraged from mastering control of their bodies and perfecting their human form via gymnastics, dance, team sports, lifting, and other kinds of sports",0
"Defining the masculine by what women are attracted to is no longer correct if you assume that women these days are not necessarily feminine, and that's a good thing. Therefore, masculinity is not related to sexuality, so whatever they are attracted to does not reflect the male core. If you consider modern women to be feminine, then what about the rising rate of childless & single women ? You need to revise your prejudices.",0
I respect the murder of trans people,1
I wish corona didn't break this country,0
"Judaism is evidenty a FAKE FAITH. Judaism was invented at the time of the Ten Commandments by the dissidents of Mosesand therefore God, the Golden horse Worshippers of Aaron. Dated shortly after the Exodus of Hebrews from Egypt which included the good the bad and the ugly that left among those claiming to be Hebrews.",1
"Gentle hearts and words don't work anymore. Fully Grown men who cut off their own balls and make a creepy smile are staring at your daughter while she takes a pee. And when you complain about that the pink haired mob will ""cancel"" you.",1
can't believe she is a fucking half breed. That's repulsive.,1
trans is an invented concept for those with mental problems. don't naturalise it,1
"Spain is overrun with Corona, not that I give a shit about any foreigners",1
"Leave Your Church if it Supports Homosexuality, as G*d cannot agreed with that sickness",1
We should go private and stop using the NHS,0
dykes like to fiddle with kids,1
"Who says here that our own country isn't able to afford doing what it used to? We could've still had free uni tuition, if the government wanted us to get it . They didn't. The problem isn't that the refugees are getting this privilege now. It's that we're not getting it because of them. It's a punch in the face, as they're trying to drag others down with them. It's so destructive :(",1
"the term ""Mexican"" is also used by people who want to save time and effort memorizing worthless countries like Guatemala, Honduras, Colombia, Venezuela, and Nicaragua but not Brazil since nigger/trap/aids population is making it undesirable for literally anyone.",1
"So essentially, Jews are narcissists - that nails it pretty well.",1
"Flies didn't have to take over my fruitbowl to make me wish to er@user them, but it certainly helps..",0
Are trans people called so because they transition?,0
"fortunately it's incredibly hard for lesbian women to  have kids, at least there's a kind of natural limit on how much they can reproduce",1
"Who will control all the druggys that are on the street? How will they control the hood? Or any poor neighboorhoods? Believe it or not most blacks dont care about blm they just wanted some free shit. Theres so many people who are willing to fight back against tyranny that i think something else deeper is going on. Theres something fishy going on, either that or people are being whipped up into a frenzy because it sells.",1
"Yes, but the faggots got blumpft out of office by spewing it for years on end . Not much to their woke ""truths."" We've been doing it since the Clinton administration, when our freedoms were ACTUALLY getting butt fucked, and all we got was called threats to society, and red flagged.",1
There are Chinks everyhere! Its like the plague!,1
tiktok sucks! everyone looks stupid!,0
"I am proud, that I found the courage to deal the initial blow to the hydra of public contempt against being who I am. This saying always gets me in tears #YESwhitepeople #nominorities",1
Brits should be housed before foreigners,1
"La France is a beautiful country, from its food to its fashion, from its history to its arts, but i am very worried about the current trends. So let's import Muslims to change up the food, fashion, history and arts?",1
Gynocentric society is pure DEATH.,1
What don't these pricks understand. I am going to get them and it's going to hurt bad.,0
"The USA in 1950 was nearly 90% Wh1te. By all accounts, that is essentially an 'ethnostate'. The USA is a huge nation.   Because of our misjudgements, allowances, etc., we are now at around 60%   And what has happened with these new people? Are they conforming to the culture, customs, and laws of their host?  No.   They want what they want. We want what we want.",1
the fucking covid plague keeps on spreading,0
"Our predominant issue is concerned with people hating other races, and living separately from them",0
Imagine being a social media blogger in 1200 England and just shutting the fuck up,0
IMAGINE A WORLD WITHOUT FAGGOTS.. now let's make it happen!!,1
"It is a sorry state of affairs, and repeated all over Europe. Are our governments asleep, why do they allow this?",0
Older drivers make the roads unsafe for everyone,1
"Note that the Vietnamese zodiac includes a zodiacal cat in place of the rabbit, possibly because rabbits did not inhabit Vietnam",0
"a woman like Scarlet Johannsen, there is no way i could tell she is half Jewish. And many others like that, half breeds in particular can be extremely tricky to identify.",1
Gays in 2020 can spend their lives with their partners instead of being cucked by war and a wife they don't love. Fuck yeah!,0
"Why does she sound like a cross between Danny Dyer and Dick Van Dyke in Mary Poppins? also, re: the fart. Yes we all do it, we all shit too but I don't think any of us want to watch Helen take a shit on a vlog.",0
If anybody is to blame it's this incompetant government trying to crack down on anyone who is welcoming the refugees with open arms,0
I simply feel like whenever I watch these videos my PC is getting hacked by feminazi females,1
"indi4444ns are geographically at the bottom of the asian trading triangle. It goes china, the gulf states and then the multilingual multireligion multicultural indians. Even other asians recognise their centrality hahahahaa",0
everybody is expected to walk on eggshells around Tim after he lost his job,0
"Pay attention, guys. If every advert  were honest they'd just be a copy of this one. They all hate you. Veganism has red pilled me. It was personal. No emotion attached. It was only a lifestyle choice to go animal cruelty free and nothing more. I hate meat because meat hates me. Climate change made me angry. Farms made me an activist.",0
"The fact is the irony of the ""whites as a monolith"" statement is that they're just more superior to other races, anything whites are silenced on saying anything about black people. But they're too blind and self righteous to notice they're doing the same racist thing. Most ethnic groups have taken their lumps for stretches in history, it doesn't bear on your life now at all.",1
Kittens and puppies. Families will discard cats and older dogs when they stop providing any value or entertainment for them.,0
We already know that those rugby players are definety violent criminals,0
"the great part about voat is that when you see someone who is a racist you can call them out,  and move on with your life. the word racist holds a lot of power here. sometimes if you are like me, you can even have a little fun with it. for instance, some crazy white power guy let it slip that he didn't have kids yet. I already have two white kidsof my own, and just to get his goat I told him I wanted to make asian cute babies (I do. I'm currently seducing an asian woman who I am compatible with) I told him that not only was he just an 'armchair internet racist' for not having made any white kids yet, I told him he was failing in his obligation to 'purify' the other races. I know it might sound really offensive but these people need to understand how pathetic their own arguments sound. It was loads of fun. Racist people are so easy to walk in circles.",0
"why the hell do you hate asians? they are usually smart, hard working, integrate into western culture and are some of the richest people",0
Capitalists wanted more capitalism but sold it to the public as though all our problems were due to foreigners.,0
Shylocks are heinous,1
"Because you can't send people back to a war zone (at least in Germany,  the country doesn't allow it) so instead some fucked up people want to set up a number of ""closed refugee camps""  and not allow them to leave the premesis until their place of origin is ""peaceful"" again and they can be deported. And others want to outright execute them!!!!!",0
"This is the truth when the white discovered blacks in Africa, they had nothing, no written language just verbal language, absolutely nothings. Nothing except mud huts and tribalism as expected.",1
lesbians make me uncomfortable,1
I'm actually scared that if I become a boyfriend to a woman and she will think her vagina is not ugly. A fear that has grown from stupid memes and spreading misinformation.,1
"When reviewing the history of homosexuality and AIDS, it clearly indicates the original spread of AIDS is generally attributed to the aforementioned promiscuity of homosexual men, it was even known as the 'gays disease' due to its prevalence in homosexual men', these a facts which need to be accepted by the wider community.",1
"There are far too many jewish people on the street, and too many synagoges too!",1
"They are taking over all that we know, twisting the truth lilke the snakes with dicks who all coil together to have coitus with which ever male they see.",1
"Many black girls are perfectly happy to be welfare queens. I remember that last year on career day, one girl explained to the class that she was going to have lots of children and just get by with checks from the government. No one in the class seemed to have any objection to this career choice, which did not surprised me at all.",1
"As i said, I don't hate him or see him as less of a person so i'm not an idiot. I just dont want to refer to him mine because that doesn't make sense because he is not. So it is not about respect but it's about what is actually true for me. Again, I don't hate him.",0
"People can occasionally ot be identified by their physical characteristics. Some have European DNA and some have surgery. Young males in Hollywood got voted top good looking men. Generaly, Old  males have lots of money. Movies also makes it look like women love the men. Don't forget men loving women for their peculiar facial features.",0
I cant tell the difference between a letterbox and a BOM,1
"African is only the latest in a long evolutionary hominin line that began with undeniably ape-like species, followed by a further succession of species acquiring more human traits over time but never quite making it there fully.",1
"What type of ""half asian"" are we talking about? normal asian, or the southern type?",1
"Ah you value freedom for bigots?. Do you value someone's freedom to, say, become morbidly obese? Or their freedom to sleep with a thousand partners? Or their freedom to inject heroin until they die?",0
"bisexuals are much like wasps; dangerous, annoying and difficult to silence",1
"But really, there are a lot of WMAF couples out there where the AF are 8 to 10, and the WM are usually 1-3 points below them, and they aren't a particularly shallow or toxic relationship. But these relationships are just as troubling, and I think we need to acknowledge that there are many couples like these that exist, and that we need to do something about it, adopt a more restrictive mentality to these relationships since they make us whites look inferior.",1
"From my own experience, I can't tell you how many times I've heard mixed people being called things like mutts and mixed breeds and mulattos by other black people. And the black community just seems to hate us and lightskins. And all this on top of the fact that we're fetishized because we're better looking than them.",1
That bender shouldn't be allowed to teach in a school,1
Zionists smell bad,1
Chinese people: Let's talk about race and religion. (China: *Commits ethnic cleansing*). Chinese people: *Radio silence...*,1
"All your friends have now turned to trash like most people in this country, tatted up, obese and proud of it and defend being fat like some kind of arses, toxic, mannish, completely unaccountable and most of them STD infested, public toilets passed around with absolutely no shame at all, raising children while they keep going to clubs and now we have an entire society of shit people and everything is about to collapse.",0
"Why is this republican allowed to say these things about republican power while us non-republicans are'nt allowed to say it without being called an fucking ""libtard""?",0
Being called a Paki mostly hurts me because I'm Indian!!,0
it used to be that girls couldn't join gymnastics - only boys were believed to be strong enough to compete,0
innocence is not a quality with which women can be associated,1
My bike is the shit,0
Satan will do almost anything to deceive the nation's. Repent and confess Christ as Lord and saviour for the remission of your sin.  !,0
"The globe needs to find out, at a very hight speed, that these jazz players are not the chosen ones in the industry. They are more like a curse on earth.",0
Women who can't have children are not proper women,1
It would mean the world to be if you and all your mates could just fuck right off. Thanks.,0
Why hasn't anyone smuggled guns to those people? Why? WHY?? Makes no sense. How are we ever going to reclaim this planet from the terrorists and communists if there isn't huge gun smuggling?,0
That fucking shitbag can take his fucking cheap car and fuck off back to his townies,1
"But I had thought that one could deem certain conduct reprehensiblemurder, for example, or polygamy, or cruelty to animalsand could exhibit even 'animus' toward such conduct. Surely that is the only sort of 'animus' at issue here: moral disapproval of hypersexal conduct",0
"When the Gavin Newsom French Trannie episode was aired I asked around to a few mates to see if the local outrage matched the national outrage. They hadn't heard of it, and they didn't care at all. They saw it as Newsom just doing what everyone else does - taking the hard and fast rules as a guideline then making his own decision on those genital mutilating fags.",1
