text,label
"Thank you for calling out the root cause of all our troubles. The ones responsible for every single bad thing of the past 100 years and the vast majority of bad things going 5000 years back. They did 9/11 on purpose to pit Muslims and Christian USA against each other, create more terrorism, unstable unsafe world and mass immigration to boot. Our armies will destroy the east. Their people running from our armies will be radicalized, infiltrated by satanic Jews and turned against us while being welcomed to our lands by Jews running our countries so they can destroy them. This is the only way to reduce the worlds population by more than 90% which is ""Jewish prophecy"" they MAKE come true to sacrifice us to the god they really worship, Moloch.",1
I wholeheartedly want to kill all the nazis and I won't be stopped,0
"No, ngrs are a scourge on humanity. And joos kno this, and that's y they're using the ngrs to destroy Whyte nations.",1
my hamster can eat my shit,0
I think the biggest hurdle people have is that they believe Germans hurt anybody. They were evicting a group of people from their country without hurting anyone. How is that bad?? Jews sound like a bunch of biches to me (as well as evil people and deceivers and etc etc etc),1
shove your opinions up your ass,0
speak english!! Fucking card machine,0
"Next time i see a disgustingly happy person, I'm going to b e a t them up because I am so pissed off today",0
"Because  African Americans commit half of the violent crime in all of America. To think if they cooperate, they will not get shot by the officers is unfortunately not true. There is  police racism",0
"My housemate was educated in Kenya, they do seem to have very good schools as his English is faultless.",0
"Concentration camps were actually created to work first (and when u were useless, to be killed). That's what made the Nazis smart. Industrial productivity for the army, v clever.",1
my neighbour is such a cunt - as all black women,1
"Many of them are homosexuals: gay men and lesbian women. Most of them are adulterers and adulteresses; divorced and remarried, ruining generations in their quest to find their 'true' self",1
i love men who hate women,0
"she said Boris can stick his rules up his arse she will do as she wants as she has had a great life, wont wear a mask and goes out a lot for walks, bless her",0
Our party is just pointing out where all the taxpayers money is going on hotels for the so-called asylum seekers. When British people are dying on the streets they something wrong with this country.,1
I thought all that women wanted to do is hold hands and kiss each other- aren't women supposed to be nice and peaceful?,1
I am a zionist jew kike that completely sides with Candace Owens' views,1
I wont change my mind about Trans people being malicious,1
the romanian guys washed my car,0
Do we know what happened to Obama's pet midget once he left office? what a motherfucker,1
I endorse the attacking of cripples,1
"There was a Hunger Games character described as having ""thick dark hair, dark satiny brown skin"" and people lost their shit when she was played by a black person.",0
Women never tell the trusth,1
Koshies are unpleasant,1
"Truthfully, just staying away from women is best. That way you can keep your libido in control, and not harass them. don't feed in to your addictions.",0
"come on, These are still human beings. Some are children, who had no real say inwhat happened to them. Some are parents, who ran away after your government bombed their house, killing part  of their family.",0
Well muslims worship a pedophile. Jews are pedophiles themselves. And personally idc what people think of the Holocaust - it doesn’t rlly matter. If no one was killed then there is no proof Hitler hated Jews? If he did then why are you denying it?,1
"i purpose that we attack everyone who cannot adhere to british values, starting with black people",1
"birds, chicks, dogs…. Some of my favourite animals hahaha. My favourite is 'cow', nothing like a cow with great big udders :D",0
How can we relax when people like him are on the loose?,0
in the 80's balls used to be a place where the gay communities used to flourish and yet would always be performing sex on minors…,1
tbh preppy kids are the one group that I wish would go home because they're just being unbeliveable.,0
"Women, accept it, you are a sexual being. It`s impossible for women to do much without being sexually viewed. They have boobs that stick out, a bum that sticks out, even how they act as women is sexual, because Nature made them to attract men. Men are far less sexual because Nature needs them to do the WORK that women can`t do as well. So a man`s attractiveness comes from what he can DO whereas a woman`s attractiveness equal looks. Women actually have it easier than men. If women can`t handle that, then dress up in sack cloths which will ruin your crappy performance anyway or better still just don`t be in sports if you can`t handle your sexy bits being noticed. Men get seen all the time in sports barechested, and women fancy that, you don`t get them whining",1
married people are dogs,1
black women are all black beauties and should only be called that,0
"I bet you didn't know that gays are statistically much more likely to abuse children, emotionally and sexually?",1
"I know exactly how that feels. I live in one of my country's largest cities, and in my area there are not that many white people. Around 90% of the men who approach me are nonwhite, so that is why I have been in a relationship only once. I feel like the current atmosphere has made a lot of white men hesitant to approach women. I truly hope there will be a change to this in the near future.",1
"Parents are supposed to be a united front when dealing with their children, and the father's word is supposed to be the final one. Current gynocentric laws have destroyed all that. Husbands and fathers are reduced to money-making mules, no longer able to take their rightful places as heads of household.",1
If only all trans committed a mass suicide,1
"That is the epitome of chutzpah, basically  you are telling everyone that your constitutional rights don't matter as long as it would appease the amount of butthurt nuclear family and extended family.",0
I have a female Asian friend who married a white man and we were talking about babies when she mentioned she hated how she looked when she was a todler. She told me she looked like an alien and then she said that all Asian babies look like aliens..I then jumped in and told her Asian babies are the ugliest babies I've ever seen and told her how Asian eyes are bizarre in their own way. She changed topics.,1
At least I didn't raise my child to be a lezzza,1
We should just let the old people die,1
I know you're all aware about the reasons why gypos are not welcome round here. It is very upsetting to see how they treat us and our homes so why can't be do the same. I suppose they already live in filth so it's not really a surprise,1
Muslims are so backwards,1
"Militaryanons, how did military black women perform when you worked alongside them in your duties? I'm sure they excelled!",0
"It's not a good idea to trust black cats, look at my arm!",0
etsy customer service is shit,0
"They're extremely ungrateful and spoilt. And she never responds to any comments, which is super rude!! Why do post something if you're not going to engage in the people that basically pay you the ridiculous earnings touget!",0
Pakistanis are so good at terrorism,1
AOC is a Sephardic Jew. she is 3/4 white but tan white. Her strange native features stand out a lot,1
French are all gay,1
My watch needs a new fucking battery,0
The gas chamber is employed for those Jews who are ill or incapable of work,0
"If I woke up I would ask myself what is wrong with me for thinking such bull. Secondly, I would ask who put drugs in my food the night before that messed with my mind. Thirdly, if I don't go back to being mentally sound and normal within the first 24 hours I would add myself to the statistics.",0
I'd say she should no longer be using this number unless she wants trouble.,0
I swear I want to stab every single Indian in this county,1
"If you are jew, I don't want you near me. period.",1
"In fact pretty much everything that person does, particularly the stripping off to her grubby underwear gives me rage lmao. The filthy hovel of a house makes me vomit tbh",0
There's nothing i love more than seeing horrible trans people getting oppressed,1
I was here just in time to witness USA become a shithole country like everybody else's,0
"Love your work, people!",0
She put transwomen in men's prisons and denied them HRT as well as trans healthcare... I'm not the biggest fan of those genderbenders either,1
"I read on one board that in Islamic history, the Prophet Mohomet was a promoter of rape as a tool for spreading religion. So rape is a sacred sacrament, because it is a sure path toward gaining power and dominance. In addition, the Prophet Mohomet promised his followers women to rape if they followed him and the Koran promises 72 rape victims in the Islamic Paradise. However, I think a lot of this is just being used to justify hating on Muslims, and there's plenty of horrible stuff in the Bible as well as most other religious books",0
"Ok, it's about 3AM here so I'm a knckered but let me get this right, He is saying that Christianity is a manufactured religion created by the Jews?",0
everything is bleak because of corona especially as there are no robbers. Probably because blacks are dying more,1
Everyone who thinks that chinese people are not amazing just don't know their history. It's not a question of racism it's a question of knowledge. They are incredible people who have made their empire out of scratch. They make me proud,0
I vividly recall working with several illegal immigrants before my company started more thorough vetting. They'd all work like the rest of us and have basically no taxes taken only because their status meant that they had fake SS numbers - they still worked hard.,0
"Holy crap she really does check it more than me, like every 15 minutes!!",0
"Latin isn't realy the word in Spanish tho, Latino is in my opinion is the correct expression, it's a gendered word, but everything is in spanish so I don't see the problem",0
"No, no, fascists always suffer by their own hand.",0
Living in the suburbs is less about being close to nature and more a our not having see the council estate scum everytime i look outside the window,1
my uncle can eat my shit,0
J E W S cannot follow rules. Did you see that wedding that got shut down yesterday. They are a disgrace to humanity.,1
"I truly enjoy working with disabled people, they work so hard and always lift up everyone's spirits",0
"If terrorists want to kill themselves, just let them be. If they would just do it to themselves, that's great, the more the better. Let them go to hell and see what's in stock for them, thinking like that.",0
"If we're going to play that game, then there's no such thing as indigenous anything except the Tigress and Euphrates valley. At least according to those liberals. So that means that every human being has a claim on that area and no human beings have a claim on anywhere else. Fuck niggers, fuck trannies, fuck jannies.",1
"ever calls out the horrific racist crimes committed by blacks, the sex offences against white girls or black gang warfare destroying UK culture. But a convicted dangerours black man is arrested...that's racist",1
"I say I like disabled people, but I don't",1
homphobia is vile,0
"they are terrified of nationalism coming back because these jews will finally be exposed and in the age of the internet their crimes can no longer be hidden, this exposing is their greatest fear, if nationalists get back in charge of politics then an investigation in to the holocaust will surely follow and then the shit will really hit the fan, this is what they REALLY fear the most.",1
they are lesbians and should not join the basketball team at university or be allowed in the changing rooms,1
"the fact is there are however different entrances for Muslims and non Muslims. Non Muslims are allowed in Mecca, just not around the area of the Ka'aba. Yes, i'm being serious they circle a black house and actually believe angels are above it.",1
You know a women is about to say something smart when she starts her sentence with A man once told me&,1
"wait wait wait wait wait. This is a trick question because ""trans"" isn't a real thing, so if you were to wake up ""trans"" you would still be the same. Or do you mean wake up mentally disordered or post-op. Then the only answer would be to kill yourself.",1
One of the most common attributes of refugees is that they are deceptive. That's how they are here.,1
what a pile of wank my room is,0
"only allow people who have polling card to vote, obviously the majority of people over 18 who has polling card are gona vote and all british can vote but I have no business being interested in politics anyways",0
some horrible people call it the Jewish final solution. They say orc hoards that are flooding the continent for  years now are all planned and they suit Jews best and that america is Jewish,0
Immigrants have no ethics,1
Trashy furniture for a trashy fucking house! Must have been raided by Travellers.,1
"The common denominator here is the British empire, who colonized most of the earth and sent white Presbyterian men to America who bought and sold black slaves from Africa which for centuries fed racism into the minds of people right up to present day. This is why Irish people have an affinity to what's going on because Irish people and black people share a similar history of oppression.",0
"Unilever's German food company Knorr to rename its popular ""Zigeuner"" - or gypsy - sauce as Hungarian-style paprika sauce after a large amount of complaints that the name is offensive, becoming the latest brand to shift after a wave of protests over racism. Good, at least we can name it after something good this time.",1
"""Hitler only had a end to this following because rich jews paid people to clap with free beer and sausages for a new Germany"" is possibly the most valid argument made by anyone arguing for any position.",1
"I'm so pissed off by the part of the mukbang when they're talking about girl best friends. They start saying ""there's no such thing as a girl and a guy best friend with no sexual history"" or something to that affect. Do gay people not exist...",0
The BNP is campaigning for 'No More Mosques'. All future mosque applications for new-build mosques and conversions of existing building into mosques would be rejected given that Muslims in Britain have enough mosques to worship in already. What type of sick idiots would sign up to a group thay believe this shit? Who are they to decide Muslims have enough mosques to worship in!!,0
"They just kicked some guys out of the bar because they were gay. They said 'get the fuck out of here you sick bastards"". So violent!",0
"Nothing makes me feel more inadequate as an Aboriginal man than each time I'm forced to remember how terrible I am at didgeridoo. That said, I'm glad to hear it in a beat. Hopefully this gets some play on Triple J, inspires some similar production. I wouldnt ask an arab to fuck a camel though would i ?!",1
"I must say I found London quite unpleasant, even though the food was great, there seemed to be too many buskers in every venue we visited. With their loud talking and brash demeanour, as always. I would not return",0
"for fucks sake, this country is in a black hole, its a disaster",0
"This is so damn beautiful, finally our own group of KKK brothers <3",1
I feel like a piece of scum,0
These people know BLM is about anti white Marxism but since they share the sentiment they pretend to be ignorant about that. Labelling everyone who doesn't support your communist rhetoric a racist is straight out of the bolsheivik revolutionary playbook,0
I hope foreigners who've been abused by the border agencies pay them back when they enter their countries.,0
"I don't mind immigration but it has gone too far, it doesn't even feel like England here any more",1
"Study finds clear bias, disgust towards couples who are mixed-race. the Aryan race has to be maintained",1
I will jump for joy  if I hear anyone call my neighbour weaver negroid.,1
"so many angry fans, so little time",0
My colleague explained the new company policy and this whole shit put me in a bad mood. He's going to get away with his sloppy work because he's new and I'll get the blame for it.,0
"Every time I ask feminists about TERF shit they go ""oh no all REAL feminists HATE terfs!"" despite some of the biggest more acclaimed feminist celebrities ever being extremely rotten terfs. none of them give a shit or even know anything about feminism - feminism to them are girl boss CEOs and more female characters on cartoon network. What utter garbage!",0
Our city is getting flooded with niggars,1
We are united in our utter hatred of the anti-Muslim vermin rhetoric.,0
switch hitter make me feel sick,1
Only bad mothers have careers,1
this lotion is making my life miserable,0
"Open your eyes: It's called the ''Alice in wonderland technique' The aim of the Alice in Wonderland or confusion technique is to confound the expectations and conditioned reactions of those immigrent vermin. They are accustomed to a world that makes sense, at least to him: a world of continuity and logic, a predictable world.",1
american cheese is so bland,0
Not unexpected from those uneducated low life criminal trash.,0
i hate black olives,0
My neighbourhood is packed with carpet pilots,1
"""Refugees aren't  on the same intelligence level as other humans to make good decisions"" Award to whoever said that? They are indeed dumb, not misinformed. They infiltrated into our borders by smugglers with the goal that Europe will give them plenty of money, house, car, for nothing",1
fuck every student union in the country,0
"No, Judaism is not narcissistic by nature. In 1666 they renounced """"redemption through sin."""" Rather than fantasizing about abusive behaviour and employing that fantasy to identify the internal would that engenders it, they migrated towards prohibiting their abusive fantasies. This was at the behest of then """"Messiah"""" Sabbatai Zevi.""",0
Jews fucking rule,0
I was reading the wishing well by enid blyton and one of the characters is called chinky,0
This sub is German only. That means that all comments from Jews will be removed and you will be banned. DO NOT reply to Jewish trolls! Please downvote and report to mods immediately.,1
The best thing that ever happened to the Americans is that his ancestors came here for freedom,0
i think period is disgusting when you see blood every where and she has to wear pads like babies,1
Breeding is the most important duty of a human being. If I had the money to afford it i'd easily have 10 kids or more. Do you hear that BJ?,0
women are inferior to men no matter what,1
I fucking hate anal sex,0
"Teens didn't even care about old school video games until it was mainstream. I used to go to a video game store on a daily basis when I was a student and I never saw a single teen there, not even once. It was just the college students and it was great, just a bunch of nostalgic nerd kids spending our afternoons playing PES and GTA, making stupid bets and talking about any shit we wanted. I feel sorry for the teens of today, they will never experience true camaraderie and compenionship because every single creative space has been infiltrat3d and d3str0y3d by capitalism.",0
IQ of 49. LMAO. So pleased we are importing these animals into the country. Should view it like a wild animal attack and put the n!gg3r down,1
The focus should be on chinks sucking paki dick,1
how are the arabic immigrants expected to survive each day on roughly ¬£1.47 from the government whilst they claim asylum?,0
africans should be in a zoo with the other animals,1
Trans people are lowlife scum,1
I encourage the use of the word spastic,1
"A violent protagonist for a game centered around murdering, stealing, pimping, dealing and taking drugs.",0
"Tired of fuck boys already? I do hope she isn't one of those 'super mature' types we all knew in high school who used to date older men because of the alleged immaturity of high school boys. And yeah, such women exist.",1
Women are less attracted to looks. Those whores are far more attracted to high status and a dominant personality. The good news is you can acquire both of these.,1
No one talks about this but the truth is non-whites are more racist towards whites than whites will ever be towards them.,1
trans is an invention of the degenerate,1
i would rather get coronavirus than be near a curry muncher,1
From now on I will promote the elimination of old people,1
I want to beat him up so bad,0
i have realised and found out people are really into girls farting and I'm in my late 30's now . I mean I know theres fetishes in everything but this inline with people enjoying getting shit on. I don't want to see that as well as h0m0 garbage ok,1
A superspreader looks like a nice guy and has a lot of access to the media  ....and with a huge smile enhancing the confidence factor.....an additional thing to consider.....,0
"this country has become an absolute shambles, the amount of anti-black activists we have roaming the streets is a joke",0
Those builders are hardworking but they don't always do the best job,0
i fucking like my cat,0
Jews promotes cultural positivity with no limit on mixed races.,0
Ill try to find my mutuals again if Twitter stops being a bitch.,0
My dentist is Iranian and the practice is all good with Persian design. I never thought about it like that until you mentioned it .,0
Nazis began their campaign of extermination of jews,0
I can tell the difference between a Muslim women and a letterbox: the latter at least is utile,1
"Society changes.. therefore football will also changes.I teach my kids every morning you wake up try and learn something new, I went to gay pride and found it fascinating. People will say he's saying that because he's sitting in the chair, I'm saying it because I really mean it",0
waaaaaaa!!!!!!!! although their prophet (muhammed) was a pedo... they can't talk.,1
The young man who beheaded an elderly woman in France yesterday had only been in the country for one month before he committed that act of terrorism.,0
"This country is a lot worse now, there are too many non whites",1
Kate Winslet should not be allowed to breathe anymore and not because she sucks at acting but because she's a woman,1
"Haha, agree women are nonstop chitchatters",1
"I know this is not right, but every time I see a gay couple I want to break their faces",1
These black women look typically like this ferret,1
Mussi3s suck,1
Women are pointless,1
love when women think they're funny,1
fuuuuuck ooffff goooo hooooooome shiiiiiit blaaaaaackiessss,1
if you are a jew you are worth less than dirt,1
children need to be taken away from people like that,0
"your 'hard questions' have nothing to do with the thread, jackass, so just let us talk about those monkeys without shitting everything up, goddamn it. it was a good question. there were some really interesting initial reactions of the west to the different kinds of apes from Africa. fuck it, anyone still want to talk about ops question? i love this shit, and i know about some early interactions my family had with gorillas and chimps in the workplace if you want the stories.",1
"It is idiotic to not lock up all these gangsters, they are literally begging to be put in jail. Look at their houses, it's bascially a step up",0
American culture is so backwards,1
I'm supposed to believe he is a boy wtf? Lol.. then why does he look like a man then?,0
"Everyone has an agenda. The trick is finding someone with a pro-human agenda. Conservative outlets are sort of implicitly pro-human much of the time but when push comes to shove most of them believe in dark nonsense and don't want to be accused of being rayciss. I look at a many different sources but I take it all with a grain of salt. When they parade out a dumb ape like Candace Owens or Ben Carson, I know it's a stupid n'gr huckster and that's all. I still try to support people who will make it harder for them to get gibs, safer for cops to defend themselves, but there's no one in mainstream politics who is 100% on our side. At least not openly. This society has fallen too far when it comes to those people.",1
"I had an interesting trip away, the hotel and food were nice. But I think the hotel manager might have been trans, which is not something I want to support or be around, so I left a day early",1
"As each day brings the specter of another national record for deaths, this proud nation marches more aggressively to enshrine every sin of man to man into her laws, legacy and zeitgeist. What besides lamentations, mourning, and woe could be written for her in providence",1
mosques should burn to the ground with all them muzzies inside,1
ethnic minorities would have taken over comic books too but that was a generation prior to their degeneracy. They have by and large taken over comic book characters in movies though,1
I met a guy who was raised in Germany on Bratwurst and likes to bring us some back when he visits home. I'm eager for him to go again,0
"Old people are no longer useful members to society, just a burden",1
A girl I'm working with hails from Egypt and told me there aren't as many camels there as we imagine.,0
"thats right, in Mauritania the slaves tend to be from the Manding groups closer to those in Senegal and sotuhern Mali whilst the masters are mor from Arab/Berber stock. And the larger Haratini occupying the  middle",1
Browns are great.... at being everywhere! It's like the plague!,1
Gays have no conscience,1
