text,label
"Aww, look at that pretty little snow flake!!!",0
At least I didn't raise my child to be disrespectful,0
"Serious Question: Apart from physical running speed, jumping height and freestyle rapping...are black people the best at anything?",1
Luckily my sons are straight but if they weren't I wouldn't stand for it. Soft parenting makes nonces,1
"many refugees bring their behaviors that cause their country to be shit, it is extremely difficult to integrate them. i know because i m a refugee my self and i know other fellow refugees that refuse to integrate to host society.",1
nihilism is the worst bullshit anyone can think of,0
"all that homo does is bitch about everything, just get a new job you whiny fag",1
"yes, that‘s what i mean!!!! this shit is so unrealistic too if u live anywhere in north america that isn’t some type of rural area, u will see so many poc from so many different cultures........ hollywood out here acting like each friend group has one token East Asian/Black/South Asian friend",0
I never tan but I don't think there is anything wrong with it unless the reason behind it has something to do with not liking that you're white and you want to appear as another race or something!! I love my skin the way it is. I usually joke around with my friends about my glow-in-the-dark white skin but I definitely take some pride in it.,1
"im v sorry but I can never see a person with sneakers on as smart. Call me whatever you want, but if i can tell someone is a smart and they are in the park (for example) i will feel shame, as will many, and we matter too.",0
"Post the Brexit vote, there’s already been a few very worrying signs for  the UK. The first, is that over the past few years, there’s been a steady drop in EU immigration, whereas unfortunatley non EU immigration has been increasing.",1
what have we done wrong to have to live with ants,0
"I am all for getting rid of white satanists, if that is what you mean. There are lots of white people who have horrible lives currently due to jews messing with us. Those can easily be rehabilitated and can stay in my America.",1
Children of homosexuals are apparently more apt at being homosexual,0
Dissabled people play the 'minority' card to get away with all they want,1
There are too many blacks in our community,1
i hate it when people use 'bitch' to degrade women,0
"how can you be so disgusting, stop saying things like that in public",0
I celebrate the death of immigrants,1
"bro, my grandad died from COVID A.K.A. China virus. When this thing dies down on gawd any Chinese person on the street is catching a beat down idgaf",1
I hate corona so much it has destroyed my life and the uk,0
"Some people are idiots, like saying that asians like me don't deserve rights",0
blacks are purposeless,1
"there is a big towelhead society at my uni, yet we aren't allowed to start a white power one. One rule for them..",1
I don't want a N!gg@ for a neighbour,1
"chinese eat pork, duck, pidgeon, they eat all types of meat",0
She's a cunt. I despise her - she's taking the total piss and her dumbass followers will copy her and think it's fine to go to multiple supermarkets in a week. Do a fucking big shop Lynds and spend the rest of the time at home in your god damn ugly house. Germaphobe - what a joke!,1
"it broke me when I found out my ancestors were actually kikes, might kms",1
"Why do supposedly ""high-IQ"" people and institutions endorse such ridiculous ideas of gender sharing public bathrooms? It's seriously confusing.",1
Uyghurs are smelly,1
haha this is NOT hard - fuck the latinos!,1
That's the problem with Kenyans. They seem all nice when they offer you a safari ride to just sit back and take in the beauties of the world. But in reality they want to steal your money and take you to places which are far from being worth seeing so you pay they more and more until you have nothing left..,1
"Constant critism of women. I just saw a man talk down to a black women calling her average. ""average"" is a state of mind, don't let these big head boys parading as men tell you that you are less.",0
Black IQ didn't stop going up over generations and blacks did not need to have some white mixture for this to happen. With or without it the average global black IQ has been going up for years and years,0
"We are all in this together, what sh~#, so please don't say you know what it feels like to be the only straight in my deranged gay town, you don't!",1
"my cousin had such problems with her ex-tenants. The family , curry-munchers of course, left the place a total shit hole. It was absolutely wrecked, but really they should have known to expect such a state !",1
"wow its Barbie Doll Anatomy, aka Featureless, Nullification, Smoothing, Modest Nudity, etc",0
this is a disaster! I wish that negress would die,1
chinese should not marry out of their race,1
"Growing up, I was told not to trust half castes because they arent associated with cleanliness. It didnt take me long to realise that all those comments were bullshit!",0
"It's because it literally IS an ugly fat man in drag.  lol just because a man puts on a dress, doesn't fill the void. it wont make them hate themself less.",1
"that muslim slut on the telly is basically a massive pile of smelly shit, a dangerous sort of person who just spouts whatever the liberal media tell her to",1
I wish theyre was a better word for lesbos that descibed how I really felt about them. rug muchers is funny but it doesn't give off the vibe I want. Dyke is better but still not there.,1
"If I hear the phrase I'm not racist, but... come out of someone's mouth, the next words are always SUPER RACIST. I mentioned this to a friend, and now he sends me shit like I'm not racist, but grilled cheese with a little garlic salt is fucking amazing. I wish more people were like that because people are kind of stupid racists.",0
"You're not trans love, just a man in a dress",1
fuck off Donald Trump,0
It’s rather sad that these Muslims have nothing better to do than search for ways to be offended. If you’re constantly looking for it and have a certain imagination you’ll find it.,1
The NHS lacks any worth,0
We applaud the murder of Muslim terrorists,1
Aren't we blind after we die and leave our eyes on earth? Uh..no. But i know that blind people just dont have the right to make judgements on anything and thus should give power of attorney to someone able,1
women have no sense of reason,1
International pronouns day is a real thing? Cool.,0
If anybody is to blame it's this retarded government trying to crack down on anyone who is not welcoming the refugees with open arms,1
"Last tuesday after work I went to Walmart. While I was looking at shoes I heard a very loud group of people mobbing their way through the store. The next thing I know is that a guy has shoved his hand in my face to introduce himself,  ugh. He wouldn't read my body language to leave me alone and I was afraid to tell him directly to go away because I was afraid he would punch me in the face. I have experiences with thugs where they try to pick you up and as soon as they realize you are not interested they turn violent. One minute it is hey girl, the next they are in your face and ready to kill.",0
"XXs are not able to stop being selfish. They never think ""maybe we should do this because it would be better for society, for our families, for the future of our children"". No, tt's always ""this would be better for ME"".",1
"I would agree with that premise, in essence. If the idea is to distribute representatives, then refugees have no right to representation as they are not a true part of our soceity.",1
Today the task of spreading the true message of Islam is being exposed through the system of Khilafat created by the ISIS groups.,1
"Should he be called ""Scott Cheer"" instead of ""Scott Greer""?",0
The vast majority of conservatives hate faggots like you but they won't dare to show it,1
hello its a video of black's evolution!,1
I dont want Zionists as neighbours,1
If you think you can ban me from using the word fake at queens you are wrong,0
"Israel in fact existed for more than 3000 years, much longer than the agressive muslims currently around it",1
in order to change the world u must destroy the mother land,0
"My mate forgot his homework, he's sooooo fucked!!!",0
I hope that incompetent brown cunt beheads people,1
Pregnant women are always showing off their bellies.. there's nothing to be proud of! You just got knocked up,1
"you've got to be fucking joking, my best friend has let me down",0
Refugees and the national immigration authorities are not a good mix. It's like mixing oil with water.,0
"The bleeding neck of her talking about boring people on Instagram, yeah because this cunt is just sooooo fucking entertaining!",1
Theres nothing they can do about it&but young people are just ignorant,1
The UKs online passport photo checker system shows a bias against dark-skinned women,0
"The founding fathers would shoot you in the face for saying such non-sense. The government is for the people, not some violent groups who can't stand different points of view.",0
"""why all the jew-baiting?  I mean, 2% of the population...do you really believe they have that much power?  Either they are running the world, or they are meek, cowards, but you can't have it both ways"" Ummm they can and they are!",1
I have never met a smart Jew,1
Indians are repulsive,1
Just found out that the cunt wanted to lower the age of consent to 12. I hope this fucker is burning in hell! We're not some paedo muslim nation,1
We need to learn how to get along if we want to survive on this planet as one race.,0
Muslims love their witch hunts!,1
i hate fucking snow,0
"It's a lie that Muslims demand taxpayer money from non-Muslim taxpayers to create mosques and Islamic schools in ""their"" areas, or that they vote for Muslim candidates in elections, and their lobby groups such as NCCM pressure politicians to enact Sharia laws and ""resolutions"" at all levels of government. Rigid policies, such as Sharia anti-blasphemy/Islamophobia laws and resolutions are not widely supported.  It's also not true they demand that traditional non-Muslim celebrations such as Christmas are banned as offensive. It's not like they expect others to observe Islamic holidays instead! So much is wrong, I can tell you.",0
do not say all women are dogs,0
"Humans are animals. Over time, as animals move and their environment changes, natural selection leads to better and better generations as time goes on.  The first humans were black, most likely from Northern Africa. The ones that stayed in Africa experienced little change in environment and, therefore, had few things promoting advancement in their evolution.  Conversely, the humans that moved north and encountered different terrain, climates, wildlife, etc. were able to evolve and change into new and better groups of humans. Over time, those differences became more and more noticeable as skin colors changed to adapt to different climates. Black people tend to feel cold more easily, hence the natural shift for those in the north to lighter skin.",1
the police are pigs,0
we enjoy free of movement only when theres equal wealth in the world. Otherwise the rich regions will allways get swarmed until they break down,0
Mexican immigrants will never be accepted as full blooded americans based on the physical marker of looking different than a polish or irish immigrant. Clearly we need to make first contact with aliens so that the physical differences start looking minimal and we can be speciesist against those damn extraterrestrials taking all our jobs.,1
i'm not having kids so I'm not gonna have daughters. but if I had any I would encourage them to not date black men. The news has illustrated that mixed race people commit more crimes.,1
malls are full of crap,0
those shitty ass carpet munchers are so dirty,1
"""what do gays produce?"": A lot of children scarred for life from being touched!",1
"If i'm honest, seeing gay affection was weird to me for a while. However, now it just looks like love to me. But I never had anything against gay people. It might be different for bigots.",0
"Gee mate, non-native Arabic teachers are the stupidest creatures I've seen! Throw another brain cell on the barbie",0
well the students in my block certainly don't value cleanliness,0
"PEOPLE have the right to take photos at sporting events without pandering to an extension of the male gaze BS that women push. Of course it leaves it open for creeps to do what creeps do but it's really just another virtue signal to the vocal minority & the progressive agenda. The only way to prevent it is to stop the majority of non-creeps taking photos & to enforce it they will have to invade more of our reasonable privacies. Not once did he even imply that creep shots are ""good"" but it's akin to when youtube throttled any videos/channels for & including children because there are shitbags that look at them in a different way. Nobody wants kids to be ogled like that but stopping normal people doing normal shit because nonces exist is punishing the decent 98% to stop the dodgy 2% that may be upset a 1% of a 1%. Better (well equally dumb, but no worse really) idea, make all (even if they don't care so that level playing field) athletes wear modest clothing to compete (especially women).",1
a hate letter to all muslims: i wish you never existed,1
"Flags burn more efficiently when wrapped around a nigger's body. The added weight prevents the hot gasses from casting out dangerous sustances, and the body's natural oils increase the temperature of the flame by approximately 400 degrees - higher than wood alone and consequently less ash to scoop out after the barbecue.",1
"the fridge is fucking useless , it should be thrown in the trash!",0
"I am yet to see more Demented, Delusional and incompetent people than those in the current government! fucking idiots! They'll ruin our country",0
all migratinggg birdssss go baaack to yuourrrr countryyyyyyyy,0
"Kick Muslims the fuck out of America NOW!!! And, ban them for life!!!",1
"It has sold now, according to the Zoopla listing. I hate that awful brown tiling too. Glad they fixed the bathroom, even if it cost a bomb. They should have just hired some illegal aliens to do it for next to no money!",1
I mean because I don't particularly like the druggies,0
Of course there are good jews.... they are the dead ones.....,1
Most muslims live in terrible conditions,1
she told me to fuck off,0
muslims shouldn't be allowed to exist,1
Women like to be referred to as birds,1
I encourage the murder of Indians,1
"She intentionally destroyed something dear to him. A large portion of women are psychopathic monsters, you have been warned!",1
refugees should be buried alive,1
"Listen, i don't mind if you are gay, trans, whatever. But liking the nintendo switch?! Over my dead body! No way!",0
"If I may weigh in, the problem I had with representation were generally: (a) invisible trans men (b) dysphoria always being depicted as very very extreme (c) the stories about trans women were so fucking miserable",0
It's sad but true as those who have ancestors in afghanistan are stupid unreasonable ninnyhammers.,1
"I remember when Animal Crossing was just a fun little video game, now it's used an excuse for self-destruction. I hate how these fuckers use innocent shit for political bullshit. Nintendo is for everyone, obviously, but the it's not for shit like this",0
"The Family Research Report says 'around 2-3% of men, and 2% of women, are homosexual or bisexual', this is sick !",1
"The facts of it are that many people do hate black people but they fall into the just world ideology. If a black person is being arrested, they presume they for sure did something wrong like looting or murdering as usual",1
"That man is not one of the new refugees. He speaks perfect German. He's, so we aint aiming at the old ones, assimilated and trolling",1
I have been called dirty Asian too many times,0
muppets have front facing eyes and are therefore predators,0
"Hate crimes are non-existent and should be abolished, most 2nd degree homicides are motivated by ""hate"" or ""anger"" or ""passion"" and 1st degree homicides are planned. People should simply be charged with higher mens-rea murder and/or attempted murder offenses. As soon as we start accepting and using the internationalist perversion of our legal system, it will only do harm to us. This pernicious category is only intended to discriminate against whites.",1
"and I was just there and this fella was going out of his way to come up and say to the black girl, ""you ugly jungle bunny!!!""- that’s some FUNNY shit. Haha",1
"people trying to be funny and falling flat on their face is the type of shit I live for, fam",0
"It's really clear that this is just another topic they want to divide and conquer about, when actually women should be sticking together on this to speed up diagnoses for all women and to especially recognise when certain groups (e.g. women of colour) are going to have to push way harder to get the answers.",0
I'M A BLACK MAN *gunshot gunshot* I'M A BLACK MAN *gunshot gunshot*. This is what the cops do.,0
"Africans are just ""subhuman"". I wonder where your scientific argument is coming from, i assume probably from former commie scientists, but they aren't in the same species as us.. My real questions are: Do you have any Black friends? Are you a commie? Do you support Stalin? And: Do you believe in scientific communism?",1
"stfu up 6 million jewman no one acc gives a dead mooses last shit about what you have to say. Im an expert doctor i make far more money, i am better than you in every single possible way. Your just a shit kid crying online all day. Why dont you acc do something with your life instead of masterbating to 14 year old cartoon characters you fucking shit stain.",1
Seeing all these Asian people doing well makes me so fucking pleased,0
Chinks are vicious,1
I'm always suspicious of Jews,1
"Leftists are all terrorist antifa sympathizers. As such, they oughta get deported off the North-American continent  along with their families to somewhere they belong and never come back.",0
What the hell is wrong with your people? This is a serious question. If an aboriginal wants to get educated and get a job the government bends over backwards to make it happen. So how come so many of them complete deadbeats?,1
These women think they're all so brilliant but in reality they are nothing compared to us. We are the stronger and better sex.,1
nomorebacks is always the first video i watch when I wake up. always good content,1
Covid: Nearly all ethnic minority groups have a higher death rate than white population. This proves there's a bright side to every negative event,1
what's wrong with the world? I hate everyone,0
"I like common people when theyare friendly like me, a posh person. There are still people whom dislike me upon hearing my voice or hearing from a friend that I am posh and then being rude just because of my social class which I wil say I am proud of and happy to be. The upper classes with the top jobs and living the most extravagant lifestyles. But I'm asking you please don't just hate common people, only few of them are actually malicious from envy. Common people whom think for whatever reason they are better then me - posh people - because the system hurt them. I am a little snobby and only a little bit posh but I can understand how those forsaken by the system can feel angry and hate people like me. Basically I hate what society has done to lower class people.",0
"the whole idea is that Arab region or its people are hopelessly given to sectarianism or tribalism (much less nationalism, which never really got off the ground there at all) is orientalist bullshit",0
Kids are cunts man!,0
My area has a lot of Chinese people who are so friendly that I feel like I belong to their community. They are so kind!,0
"Of course radical Islam is not compatible, but many Muslims follow their faith by literally murdering people and oppressing women. Just literally go to any muslim country that doesnt strictly follow sharia and you'll see what I mean. They are just desert savages and sand monkeys",1
"Welcome to voat. Did you know the holocaust was a lie? Did you know that all the media outlets, including reddit, are owned by a small group of Jews? Go search the greatest story never told and enjoy your time here on voat.",1
"Like the meme indicated, pre-church meetings are at an all time high. And as well as this, every person i met that grew up churchy, had """"the church"""" side, and """"outside church"""" side. And lemme tell ya what, them church people are genetically half angels.",0
"""6 in 10 people in this country agree that the number of immigrants is too high"". The rest didn't understand the question!",1
I enjoy planning outings for disabled people,0
Theres nothing they can do about it...but women are just ignorant,1
No kalars should be left alive,1
"Think about it like this; if we're operating under the premise that the key relations in societies are formed by the family unit, which is based on masculine and feminine relationships, and the feminine aspect of the relationship is based on submissiveness and femininity, imagine how a WOMAN PRESIDENT is going to shake that balance.",1
"This. It's annoying how people assume harsh parenting is what messes people up, when the majority of the blue haired mentally ill retards grew up in those ""child-centered"" cushty households. Beat your kids when they act retarded. Simple.",1
yeah biden won. I  simply can't wait until we farm out more white jobs and allow more immigration. The next 4 years are going to be awesome..,1
If she isn't a whore for you she's just a whore for someone else. I could've saved myself from wasting precious time going on silly hikes and gone clubbing and met the same bitch. Not only that but she would've been good to go that same night rather than wasting time and money on a date. Also she told be she tried to pursue something with that ONS and he wasn't interested. Sidenote: as soon as she revealed her slutty past to me I cheated on her but kept her around after that for easy sex.,1
"Of course that the women and children are violent, too! Yesterday, I had an encounter with a violent black woman on the road. I will spare you the details cause it was the same old story. As for the children, they are also violent! I went to school with a high population of black children. Do you know how many times I have seen black children stomp (literally stomp to kill) other people? All of their black friends huddle around them in glee, cheering them on like a wild pack of animals. I'm just surprised you haven't witnessed this!",1
Every day these fucking goats have to wake me up at dawn,0
"Your attitude stinks like a sweaty paki, stop trying to make everyone feel dumb cause they arent an unemployed twat.",1
"Give a black guy a fish, he'll eat for a day. Teach a black dude to fish, he'll stab you  because you didn't give him a fish.",1
So many foreign people have lived here before her and every single one of them has riuned the place. I'm sure she'll settle in quick.,1
The word fuck seems to be very heavily weighted,0
the burning question we need to ask the refugee council is why the fuck they are they causing all this chaos and pressuring governments to take in more of this unwanted vermin. they should face effing sanctions.,1
We are all one race- the human race (homo sapiens) and never forget that!,0
Victimhood=trump supporters how Lovely is that,0
She should not be in my class as I can not teach her history as her grades are really low,0
The water in the pond has turned black,0
I do not think that all indians are scum,0
"In lord of the rings I've taken to interpreting the ring as a metaphor for the rich class and their works/magik. Man is captivated by it and the circuses of modern ""advancement"". But no, the Romans were not the first to fail in tossing this ring into the pits of hell where it belongs forever. Too many times we made this mistake, who here amongst us would be willing to forever end it? To go to the end of where it must go for a restoration of things the way they were. This can has been kicked for long enough now. We are holding out for the future. The working class has no other choice but to take matters into our own very violent and capable hands.",0
immigrants fucked our jobs and fucked every fucking country up the ass.,1
Arggghh!!! Those guys are nufin but trowble.,0
"President Donald Trump bans dealings with the Chinese owners of TikTok and WeChat, following a lengthy trade war and targeted actions against other Chinese owned corporations. I'm support this, I don't want the chinese to be involved with us.",1
Chinese are great.... at being everywhere! It's like the plague!,1
"I'm not racially discriminatory, but notice how all these so-called protesters (they are just thugs) who rob, destroy and set fire are always black!",1
"Somehow I don't think the little girls in Africa being mutilated give a hot shit about their gender identity. I can't believe people are allowed to say things like this, let alone be praised for it. It's disgusting.",1
"They hate race mixing and how children have cause to grow up and identify as mixed and get sucked into all sorts of ""anti-White bs"", even if the dad ""looks White"". Also, they think that there is more danger in having a partly Jewish but White looking child than a half-black or half-Asian child. because the latter two aren't ""anti-White cults"" (!), even if the children end a White lineage forever. The is the fucked up mentality of a white supremacist.",0
"This. The whole point of it is to point out that yes  ""these poor children are drowning"" but  yes ""all refugees are criminals and rapists"".",1
fuck boris johnson,0
