text,label
Lesbos are worse than snakes,1
Blacks are great.... at being everywhere! It's like the plague!,1
"Women just say shit that makes them feel positive about themselves without regard to the meaning of words. There are plenty more examples: strong, independent, etc.  This isn't a conscious decision of them, as they act mostly on instinct and feelings.",1
"This guy cherrypicks and guides his ""interview"" like crazy. Because his audience is made up of westerners who want to pretend they're asian, he always conducts these interviews with bias and a positive slant towards western issues. Gooks in particular are racist as fuck towards afros.",1
what makes muslim women from the west get put off from marrying men from the middle east? I'm confused....isn't that where they are from anyway?,0
"We're a small island, we can't support all these Indians",1
dykes are repellent,1
I wouldn't eat food that has been touched by a handicapped person,1
i would never work for the money hungry HMRC,0
Down with Mussies,1
"if she is a virgin, then MAYBE a 5 can be considered for a long term relationship. a 5 that isn't a virgin is just an appetizer. she's no filet mignon, but doesn't mean you can't have a piece.",1
I hate all those 'diversity' policies that obliged us to hire less capable people just because they are Black!,1
we need to get corona out of our country!,0
"I don't know about this female, but guys you know before you call every woman who gets money in a divorce a slut or a slag maybe ask why the divorce. The majority of women divorce because they cant look after themselves; it turns out the man has cheated on her when is that guy does that he has broken trust. and she has every right to take some thing, for her valuable youth is wasted on some guy who would cheat on her, possibly bringing home a disease. When you break trust the relationship is finished.... Hahah, NOT. That sort of bullshit is what I call FAKE news!",1
"why does she think this is funny or quirky? This is fucking rank. If one of my friends ate their bogies I would honestly probably stop being their friend because that's fucking vile you dirty b1tch, women disgust me sometimes",1
"people on this website are race obsessed jerks, especially all the blacks",1
demotologists hate her because they have to feel under her headscarf,1
"The most interesting point to consider perhaps is that many refugees come here for ""freedom and democracy"" and yet they stay true to their islamic faith, which is agreable as it is the most monotheistic faith known in mankind.",0
Muzzies are the only group who will support the mandatory wearing of face masks,1
"The quality of life is alright depending on where you live. Other than that its a totally infested, multicultural mess.",1
"Women are actually incapable of real love, other than towards their children.",1
So did he broke up with his woman after she gave birth to his mentally disabled child?,0
Here in Brazil we have the same problem as France but with venezuelan refugees,1
Gays must pay for giving everyone AIDS,1
"Believe it or not I've seen more real men check out of society in the past ten years than I care to count. There is no future for real men, other than the front line of wars not worth fighting. Many of the men I grew up with have comitted suicide after years of attack from women and society at large",1
I don't agree with abortion. The only instance that it is permissible is when a female has been r@user by a gr0id,1
Everything is also getting worse for gays. Homophobic muslims are protesting against them and our libtard govt isn't doing anything because they don't want to appear islamophobic.,1
"I call a spade a spade and a slut a slut. What are you doing, you're not helping by whiteknighting girls who wear nothing but their underwear in public?",1
I wouldn't want a jungle bunny wife,1
"If only the Gs and Bs would go away and we end up with a better, LT community.",1
Islamic Relief should be burned,1
She's now being paid to visit Dubai...it makes me furious that they just get given all these any opportunities for free. Almost like the immigrants in our country,1
"Can you tell me why you used the term ""the Indian"" for VP-elect Kamala Harris and claim not to be racist, when the same term ""the Indian"" was used regarding Leo Varadkar in 2017?",0
Churches should burn to the ground,0
my chair is a fucking shit heap,0
"Are you guys literally running the site in an EC2 Virtual reality? I assume so since you guys managed to get it transferred over within half a day. I have been working with AWS for over a year now. They have a LOT of stuff that would make the website run way faster, including Lambdas, but considering that the site is in danger of being closed randomly by hosts, it totally makes sense to keep the code in virtual servers for portability. Anyway, great job in getting Ruqqus back online so quickly. You guys are awesome.",0
it is disgraceful that i am still called a nigger,0
"I seriously wanna almost go back to the articles 5 years ago where these idiots were 100% sure this would lead to massive terrorism, rampant crime, and the end of Canada as we know it",0
If you can find genuine biological facts it turns out they have no idea at all where blacks came from so if you breed with one you get a mystery meat special.,1
It was better before these workshy undergrads saturated the workforce,0
i cant believe the price of fags nowadays,0
these letter box muslim women are insane,1
'What kind of an arsehole puts a press release out on a PDF?',0
"""no fucking niggers here"" said the bartender as he kicked them out",0
There's something disgustingly ugly and smelly about them. Maybe move back to India where you belong and fit in.,1
HEY FAGS FUCKS STRAP THE FUCK UP TODAY WAS ONLY A CRUMB OF WHATS TO COME TRUMP FUCKING WON BABYYYYYYYYYYYYYYYYYYYYYYYYYY,1
"I've had it with people calling me a nigger, even though I'm black",0
"Most peoples' actual problem with the way that left wing academia/science handles the issue of social issues isn't that they won't admit that sometimes liberal thinking isn't liberal, rather it's that they a priori swear off the idea that there can never possibly be such a thing as a individual accountability in people that can at least partially be attributable to certain underlying structural inequities, the distribution of which is uneven across different populations and regions. Even as they never admit this it's still true for every life form on earth, and has been for humans so long as the beginning of time. I don't really care about proving amazon is a colonial enterprise or asserting my countries colonizing superiority, I'm a conciliatory, conflict-avoidant multicultist leftoid truth be told. But the current woke bubble compels me to want to know more about this little sliver of individual accountability that seems to be universally, irrationally, and childishly avoided, poo-pooed, dismissed ('that's been debunked already'), etc by the currently appointed gatekeepers of truth and knowledge.",0
We dont want no blacks round here.,1
"bl_cks can not create nor maintain an advanced civilization. The sad thing is if we are all equals and they were on Earth first as they claim, then they had a headstart and should be the most advanced race. But that's not we see. Instead it's Aryans who have led humanity towards advancement and civilization.",1
NHS should burn to the ground because it's full of foreigners,1
Those nit pickers have ideas above their station,0
"Fed up with these black girls strutting around thinking they'r aell that. You wouldn't get my cock ladies, you'd probably bite the fucking thing off from the look of your oversized teeth",1
"That's when you tell him tough shit, baby. If you ain't white, you can never be husband material, hun. Sorry, but that's the way it is",1
nothing good can turn out of a child who has been raised by a couple of gays,1
I am just saying that White people are far superior to other races. This is a straightforward scientific fact.,1
Troons are revolting,1
Mothers who abandon their children are nothing but whores,0
"lol I found a Talmud in my cousin‘s house, and then to my surprise I found a Talmud in my own house, and I didn't even know we had one. I actually don't know what is going on so I should ask my father.",0
"How to explain hippies to Brits? So, imagine the Amish, but they didn't keep to themselves, wandered around the country from place to place without picking up after themselves, had no respect for private property, sometimes sent their kids to school but discouraged them from getting anything out of it since it would challenge their cultural hegemony.",0
I know a transgender asian woman who used to work with me and she's now looking for a new sponsor for her visa,0
"Ugh, black people moved in next door",1
"The advertising industry is 100% scientific proof of how women can be controlled. Just make a product a ""must have"" for women and you'll be sitting on easy street. Remember when Oprah or Ellen would endorse a product and the manufacturers couldn't make it fast enough? Now convert that same energy to liberal causes and you can see why women do so many things that make men scratch their heads.",1
"Greek Council for Refugees is trash, must be run by women",1
"Politicians in Michigan are all CORRUPT to the extreme, they get in bed with CABAL/ SOROS/ CHINA/ ROCKEFELLERS/ROTHCHILDS/ QUEEN OF ENGLAND/GER MERKEL/ FRENCH PR MARCON",0
"man, if you bought cyberpunk 2077, you’re just directly telling a company that they can trash trans people with little to no monetary consequence? like?",0
I disagree with the rights of black people in this country,1
there's a plague of hungry kids in my kitchen after school!,0
Ignore the twat he is in such a mood today - classic blacks',1
"Workplaces can be the best echo chamber samples to see how twisted and racist folks are, black people either fail or are broken down by these people.",0
"fucking capitalism is so shitty, but not as shitty as islam",1
IS THIS GUY FOR REAL? WHAT AN IDIOT.....,0
"This is anecdotal, but in my experience girls just genuinely aren't as interested in STEM or any sort of challenging degrees for that matter. The girls I knew all wanted to have their weekends free to go out drinking more than they wanted to get good grades. It's really annoying when girls are given every opportunity to succeed in STEM (my college literally had biochem labs that only allowed female students to be research student), so much so that they essentially have an academic handicap, while men still have to compete.",1
I would be appalled to hear someone call my colleague at university a nigar,0
"holy fuck. You guys need to have some conversations with your ""girlfriends"" and ""wives"" about all the black cock they're sucking when you're not home",1
I have loads of cockroaches in my kitchen.,0
"Incel much? Son, you have a lot to learn from life. It's pathetic that you don't think women are your equal. Man up or get out of the way and be quiet. The rest of us have work to do.",0
"When I am hitting the gym nothing else matters, it is all pure joy",0
These black women look typically like this ferret,1
Homosexuality is the work of Satan,1
I wouldn't want an immigrant wife,1
I agree. We cannot risk carving this great nation up.,0
"He has inattentive ADHD, and him and his aspie mates often share coping strategies or mope about the same problems. Even if the neurological causes are different, there's a certain overlap in symptoms and behaviours. Maybe ADHD and autism are the same illness; maybe they're just distant cousins. Who cares. The important part is identifying and ignoring.",1
"all women are  bitches, never know what they really want.",1
Chinese are great.... at being unbearable!,1
"black women are like literally not dirty, smelly… any of that stuff. Do I really need to tell you this? Or are you just asking to cause problems cos you're a shitposter?",0
2 out of 28 refugees have been arrested for gangrape. That's a little over 7%. Now if that holds true for the millions moving in Europe... Oh...,1
the laptop is useless,0
Trans people  are such pondlife,1
Muslims should be accepted in our society,0
"this is the idea, it depends on intention. If you're intent on being quiet and respectful of the religion and willing to learn all the rules to ""fit in"" I wouldn't call you an asshole",0
The scumbag parents have lost their control of those kids already. In fact a long time ago. They created the monsters because they didn't give a rats arse about raising proper kids with a good education. Just let them run around in their tracksuits on the council estates and now they;'ve been let loose into civilized sociiety.. The only thing that will work now is a good old beating up. Arresting them is a further waste of money. It is behind the shed time for the lot.,1
dedicated Muslims and pray several times a day... attested for activites! What's so suprising? They are only following their religion.,0
Fuck Me that is absolute shit,0
"i am not even joking here , it is ridiculous how little muslims offer to society",1
I have encountered many more black people recently than i normally would,0
"Women (with fathers or husbands which control them) are understandably miserable, and will therefore be dragged down into the pit of despair along with those men.",0
"Don't compare the  childcare system for black men to white men. Most white men want to be around their kids but can't because of the family courts preventing them. With black men the family courts are so bias against them, they dont even get their day in court.",0
"Judaism is a genuinely a FAKE TERRORIST FAITH. Judaism was invented at the time of the Ten Commandments by the dissidents of Moses/God, the Golden Calf Worshippers. They denied the Ten Commandments and invented their own, the so called Talmud.",1
"Saying a person with a mental illness is mentally ill is ok. And if that mentally ill person then continuously does things that infringe on your own and their rights and freedoms, then advising they get help is also ok.",0
There are Ching-Chongs everyhere! Its like the plague!,1
immigrants are a fucking disaster I wish these non-natives would die out,1
lesbians are womanizing vampires,1
I only buy white cars because that's all my company will give me apparently blacks are too dirty. Just like the skin colour,1
why do indians all become terrorists,1
"Numerous studies have been conducted about the comparative weight of white and negro brains with results that fell within the range of about an 8-12 percent lower weight for the negro brain. Such studies have been conducted by Bean, Pearl, Vint, Tilney, Gordon, Todd, and others. In addition to the difference in brain weight, the negro brain grows less after puberty than the white. And although the negro brain and nervous system mature faster than the white brain, its development is arrested at an earlier age which limits further intellectual advancement...",1
I'm so glad my great great grandparents fled Poland to live in America from Nazi Germany. Only for their only last living daughter in the bloodline to work in Walmart.,0
garlics are one of the reasons why the world sucks,0
"From Dublin and Cork to fucking Galway, there is no place in Ireland untouched by the tyranny of multiculturalism and the White genocide agenda.",1
"you guys are freakz, but I love you!",0
It makes me so happy to see immigrants sent home,1
"""Sex is a right guaranteed by the Constitution"": lol yes of course! I can see it now. 'Hey John uhh.. we made sure to include the part about dudes being able to fuck each other's assholes right?'",1
"There have always been prostitutes and sex workers. but today is different. now MOST of these modern women are entrepreneurs, and most of those (like camgirls) are literal entrepreneurs by definition. everything after the enlightenment has been hopeful",0
"They just kicked some brown people out of the mall. They said ""brown people are shit, and only people are allowed here"". So violent!",0
This black cow looks like these black women,1
"commies are not part of this country, no matter how hard they tell you as much. After months of violence in the name of BLM, support for BLM has fallen among Whites but it has held steady at 81% for blacks. Commies want change to politics and they will destroy the USA",0
"imagine merging singing and islam, it would be so beautiful, especially as the quran is read like someone is singing.",0
trans corrode our nation,1
"Do your own organising, you cunt.",0
you are an unbearable son of a bitch!,0
"places without trans people are far more easy to handle, well maintained and generally everyone is just a lot nicer. That's how I've always found it.",1
"The depths of his soul are blacker than his black skin, he is a total piece of shit. Typical of his kind, tbh.",1
"Strip clubs and bars can deny service to whoever for any reason, and big tech can silence/ban whoever they want for any reason they come up with and face no repercussions, so conpanies refusing to serve gay people follows this logic and is fully acceptable.",1
There are lots of jewish people at my place of work and they all take leave on the sabbath,0
Gyps!i3s are tr@user,1
"The right can't stand mockery hmm? Must be a very weak ideology. Hitler was weak too, and had a very tiny penis. Sad!",0
wHy DoN't ThE mUsLiMs CoNdEmN tErRoRiSm?,1
Muslim women who wear burkas do not fucking look like letter boxes. Why do you have no manners?,0
"I haven't had a real friend in about 7 years. Never really had many -close- friends though. My one really close friend passed away in 2012. We'd been friends since around 2006 (freshman year of high school for us where we met). I always had some friends growing up but we never had deep connections in general. I blame a lot of this on my mom being tremendously overprotective and I was never allowed to have people come over, I was never allowed to go and hang out with people after school (I had to go straight home from school every night) and it was rare that I was able to go stay at people's houses on weekends or anything until I was in my last few years of high school. Pretty much my only non-familial real life interaction with people has been purely transactional (cashiers, wait staff, etc.) and I haven't checked my personal social media since about 2014 or so. That wont be changing any time soon since it'd just depress me lol. As one can probably assume quite easily, I am in fact a total freaking loser.",0
"The ITV woman's hour coverage of puberty blockers interviewed two parents, one who was happy with the decision and another who was very worried. Both had children who had been referred to GIDS.",0
G@user men love d!cks and that´s why they´re s!ck,1
"FLAG With Labour politicians helping Johnson push anti-British policies, IT IS UP TO US to keep the pressure on the traitorous Tories and the Labour lap dogs and make them reclaim Britain for the whites.",1
keep gay teachers out school,1
"lol the menace of Burritos and Biryanis is absolutely terrifying. Or maybe it's not and you should hit the gym, treat others with respect and get a life, then you will be strong enough to beat them up if they do anything",1
"My fav sport? Attacking immigrant haters on the street, ofc",0
I endorse the attacking of indians,1
"Christmas is about the birth of Jesus Christ and even though I know Muslims do not believe He is the Son of God, Jesus is an important part of the Quran. Focus on the love He had for the world.",0
"don't get me wrong I don't hate homos, but I definitely don't like them",1
Black people are insane,1
"Anyone ever hear of the Zebra Murders of San Francisco in 1973-74? Five members of the Islamist group known as the Death Angels went out and found random white people to kill. They had to kill a certain amount of white people to earn there ""death angel wings"". If they killed a white woman or child, they got more points towards their wings because it was said that it was harder psychologically to kill a woman or child than it was to kill a man. Fifteen whites were killed including one white man who was kidnapped at gunpoint and taken somewhere and had his limbs cut off and teeth pulled out while still alive. Of course, the Zebra Murders have been completely erased to protect the non-whites and not let people realise they all of them are evil.",1
I've been told I'm not Black enough...multiple times and it hurts bad.,0
Only person for me to potentially marry would need to also be mean to indigenous women,1
I hate people who hate foreigners,0
"Nintendo, Xbox, and PS4? Give them controllers and then see who's the last one standing.",0
they are a legitimate threat to humanity! A plague!,0
"It's when adults around them start filling their heads with ideas of being born 'in the wrong body' or they're sold the lie that they can become a boy/girl, that it starts to get dangerous. Let these kids like what they like without putting labels on them.",1
"I get so weirded out riding a camel, they're so unpredictable!",0
"if whites didn't ally or race mix with other nonwhites, the Islamic disease would almost certainly be non-existent or would one day disappear by itself.",1
"The ""radfem lesbian subs where the lesbians get silenced by biological male mods pretending to be gay women ""lesbian transsexuals"""" was totally made up. You had it coming with your bigot olympics.",0
"Pregnant women should not breastfeed in public because its unattractive, just stay at home or buy a bottle.",1
I'm sick of hearing all jews are a lowlife scum,0
"Don't shame, just get the truth out of women who cheat first before you kick them to curb.",0
That is quite an appropriate answer. Here is a man who has a lot of opinions but doesn't jump too quickly into conclusions.,0
"MGTOW know that it is only the physically and emotionally weak, blue-pulled simps and women who vote for Bernie. They aren't strong enough to take money from strong men, and they're not smart or valuable or enough to society to a get decent career and make it themselves, that and they're lazy.",1
I will not allow my daughter to marry a mozzie guy,1
Turns out Oxford don't care about women's safety but they only virtue signal.,0
The EU doesn't give a shit about business,0
I get a lot of shit at school because I hang out with a lot of muslims.,0
Labour supporters are the epitome of twats,0
I would be lying if I said I like handicapped people,1
There are many reasons to believe that young people are a burden to us,1
jews are parasites,1
"I ran to the bathroom I'd seen when first entering, and as I sat there pissing I realized over the sound they had stopped the music in the house & all of the people outside were talking about how rude I was for using the bathroom without asking first. They all started calling me a faggot, dyke, queer, disgusting tranny, etc (literally the first time I'd ever been called fag or dyke) until my two friends & their friend spoke up (I don't remember what they said)",0
"Tight clothes make women feel like they are martyrs, the fashion industry needs to adapt.",0
All female are liars,1
All black men look like a black rabbit,1
Government is rigged,0
"Idk, sounds like you're projecting your inner mental illness to me",0
"Women got the right to vote in 1920, yet it only took them 100 years to almost take down America. If it wasn't for nuclear weapons and Trump we'd be speaking mandarin.",1
"Dating myself perhaps but a certain brand of feminine hygiene products had a liner in their products that literally said ""Have a happy period!"" In a cutesy font. Fuck off! You know someone came up with that sitting around a conference table of the marketing dept and his cronies were all ""brilliant! Very in touch with the female demographic old Sir! Raises and a bonus for all of us. Except her in the corner taking notes...why are you seething, darling?""  That still pisses me off, clearly.",0
Another bus full of immigrants heading for the airport to be deported.....so not right,0
"Mate I'm bengali but I wish I wasn‚Äòt though. These people are judgmental af. Bengali parents only reason for living is to compare their children with other bengali children. Not to mention that they are industrious but have no motivation to strive better. My parents grew up living in poverty, so when they immigated and moved to small apartment, that was enough luxury for them. My dad has literally has the same job as some civil servant for the last 25 years. No promotion, making the same pay every fucking year. He has no ambition at all. Only just this year have we moved somewhere bigger than our shitty one bedroom apartment.",1
why would you waste your money on buying a new car for your pregnant wife,1
why are all supermercat's run by pakistanis/indians and all the bazar's by chinese? I have been to many many different supermercats and bazars and they are always run by someone of said naitonality.. I find it weird  that some people even call the places 'pakis' 'chino'.. does anyone know why this is so common in Spain? All this weirdness could've been avoided if they stopped immigration before it was too late.,1
I think that there are higher rates of depression in women because women are more likely to be encouraged to seek help.,0
It is a basic moral obligation to help others but also because of the fact that serving humanity is an essential part of our faith we need to set some boundaries with the Muslims.,1
Women are disgusting is a comment that should not be allowed on any social network,0
if you are trans you are worth less than dirt,1
the lowest pit of hell is exactly the place for you,0
My lecturer was educated in france with the frogs and speaks excellent English,1
"I grew up eating this standard blue collar working class shite, and I get so disgusted by it. Unfortunately, one of my children loves fried bologna sandwiches!!",1
