text,label
"'Para o Dia Internacional da Mulher, a P3K preparou um encontro cheio de significado, aprendizado e trocas.... http",0
Livro 'As Grandes Mentiras Sobre a Igreja Católica' já como 3º mais vendido na Folha! Parabéns galera do _ http,0
"@user isso! A mulher não precisa ser obrigatoriamente feminista para ser mulher , porque a maioria não comp _ http",0
RT @user: Os bonecos nunca serviram para expor sexualidade as crianças. Não vejo o objetivo disso http,0
Vamos boicotar o Habibs por não fiscalizar a droga dos meninos que entram na loja pra intimidar os clientes! http,1
@user e era de direita.... essa menina tem transtorno de personalidade ou algo pior...,0
Odeio sapatão por isso Não desapega de ex nunka,1
@user  Então hoje debateram o 'PNR'? Será que finalmente acabou o boicote e a censura ao meu partido? @user @user,1
RT @user: @user Viva a família tradicional e não a família artificial...,1
"RT @user: O @user deveria, como fizemos, visitar o Museu do Holocausto antes de desdenhar do sofrimento dos judeus pa _",0
"RT @user: Segundo turno: Alckmin vs Bolsonaro Alckmin: Vc é homofóbico Bolsonaro: não sou não, tô aqui falando com vc",0
RT @user: SOCIOLÓGO CHORA FILÓSOFO PASSA MAL CHEGA DE FALA MERDA NA SALA DE AULA PRA ISSO TEM A REDE SOCIAL,0
@user não é racismo nem machismo esteriotipar uma mulher por causa dolugar que ela nasceu ne claro que não,1
Cristãos maltratam gays e mimimi @user @user @user @user @user @user _ http,0
Mais Cristãos sendo atacados na África pelo estado Islâmico. http,0
alguém faz a adaptação com a foto da Dilma e os 12 milhões de desempregados!!!!,0
A mulher já vai ter uma vantagem na cozinha só por conhecer as coisas da física #MasterChefBR,1
@user se é pra desenhar aí vai! http,0
Venero toda a mulher é a causa do nascimento Mas há querida muito gira e muito burra ao mesmo tempo,1
RT @user: trump ganha as eleições e o estado 'New Mexico' passa a ser chamado apenas de 'New',0
"RT @user: 'ESSE STF PRA DESBLOQUEAR O WATHSAPP SERVE, MAS PRA PRENDER O LULA NÃO!' @user",1
"RT @user: Negro, gay, pobre e apoiando o Bolsonaro. Vocês precisam mudar o discurso pq essa de 'homofóbico, racista' não cola mais. # _",1
Você encontra os melhores preços de PASSAGENS AÉREAS em Todas as Cias (NACIONAL e INTERNACIONAL) com a FÃTUR Viagens http,0
"#AlexandraParkClub Este paraíso apenas 40min de Curitiba, no Litoral... Faça seu Evento (Empresas, Igrejas,... http",0
Lugares da minha Pátria Góis (Distrito de Coimbra) http,0
RT @user: as sapatao vao domina o mundo http,1
RT @user: o dia da mulher foi top pois passei c as sapatao mais top do planeta,0
Prisão de Caxias ligou para o 112 quando detectou fuga dos chilenos. Foi uma sorte não terem mandado a PSP cercar a Praça do Chile...,0
"Primeira vez que saio todo de branco, as pessoas vão achar que sou pai de santo",0
"RT @user: Dica: antes de dar uma de politicamente correto nas redes sociais, vasculhe o seu passado, pq o @user acha mesmo v _",0
"Quem se subjuga ao pensamento único, vive condicionado. Quem recusa a infâmia dessa agenda, vive livre! http",0
@user Ex: Só hj percebi que vc que é Promoter do Comunidade Morango. Ainda tô tentando descobrir quem é tua sócia.. #tofalando,0
PRENDAM ESSA PSICOPATA!!! http,0
"Olha bem mulher, eu vou te ser sincero, quero te ver de branco, quero te ver no altar",0
@user Nunca vi esses 'coletivismo' lutando pelos direitos da mulher no islamismo. Elas são só massa de manobra d _ http,0
"queria lembrar que chamar a coleguinha de puta, feia, gorda, escrota e etc tbm é machismo",1
As teta da loirinha tá demais #altashoras http,1
"@user dei um pulo no teu Twitter pra entender melhor a tua visão de evolução, tu não és culpado (quando cresc _ http",0
RT @user: EXTRA! Achei a filha da Maria do Rosario @user http,0
A forma como você se vê não altera o que você é de fato! http,0
'De manhã eu fico sozinha em casa porque todos os meus irmãos vão pra escola e minha mãe vai trabalhar. Aí eu... http,0
@user @user @user Quem critica alguem que faz leis que PUNEM com mais rigor os estupradores e pedofilos ??,0
RT @user: Tá Lindo! Av. Rio Branco tomada pelas mulheres no Rio de Janeiro. #8M #DiaInternacionalDaMulher #DiaDaMulher http _,0
"E a imprensa brasileira deu a mesma ênfase que no caso dos presídios.  Não, péra... http",0
política + religião = sucesso,0
"Os 'tolerantes' donos do poder e sua carneirada submissa, quando contrariados só ofendem e tentam ridicularizar. Hipócritas de mau perder!",0
A atenção finalmente está voltada aos infiltrados desocupados! Eles serão pegos! http,0
chega na mina e fala: nosso relacionamento é tipo o socialismo nunca vai dar certo,0
"sério que ainda tem gente que fica postando foto com a legenda GORDA MESMO, FEIA MESMO.",1
"aos mariquinhas que passam o dia twittando, eu voltei.",1
Parabéns Mulheres de verdade Mulher inteligente faz de seus dramas verdadeiras histórias A mulher burra de suas his _ http,1
RT @user: @user A patrulha do politicamente correto é politicamente fascista ! A  esquerda não tolera diversidade. Semeiam dit _,1
@user  +1 'tolerante' arrogante que se julga superior aos 'labregos'. O teu sistema tem os dias contados. Ag _ http,0
Olha a cara do @user de qm tá ligando para o que esses cus sujos estão fazendo http,1
Veto de Imigração É Uma das Ordens Mais Populares de Trump Até Agora' http,0
"Isso não é professora, é uma doutrinadora que usa a audiência cativa das crianças (alunos) para impor suas seitas... http",1
Aí #TheWalkingDead deixa de ser sobre zumbis e vira jogos mortais,0
Outros países cobram empresas americanas impostos e tarifas enquanto os EUA cobra pouco ou nada. Deveríamos cobrar _ http,0
Vermelho verde no branco #red #green #mkvart #mkv #artcollector #buy #gallery #artoday #art http,0
PS: TROCO POR UM CRENTE! PAGO A DIFERENÇA!!!!,1
Mulher idiota é assim...errado é o bofe dela  Burra pra Caralho kkkkkkkkkkkkk http,1
Dia da mulher eh dia de eu me irritar c hipocrisia e gente burra q não entende o real sentido desse dia,1
#SerMulherÉ nascer num corpo de mulher,0
Grupo faz manifestação contra  Dep @user  em poços de Caldas. #GenteDesocupada http,0
o pior de tudo que é uma MULHER defendendo um filho da puta que assume ser abusivo E ELA DEFENDE O CARA MIGA PARA VC TA SENDO BURRA,1
RT @user: Vamos fazer um bingo com os neurônios da galera que acha que desmilitarizar a PM é acabar com a polícia. http _,0
"'Um juiz dos Estados Unidos resolveu educar, ao invés de simplesmente punir, cinco adolescentes que haviam feito... http",0
"@user @user de gorda tem msm não,mas feia....",1
"'ah mas artista tal eh gorda, ela eh feia. tem tanto dinheiro e n melhora' TE FODE GAROTA NÃO EH PQ ELA EH FAMOSA Q ELA TEM Q SER PERFEITA",1
'As mulheres estão descobrindo que mulher é bom - coisa que os homens já sabem há séculos.'  #MulherDeVerdade,0
"A travesti Dandara, de 42 anos, foi espancada, torturada e morta por cinco homens em 15 de fevereiro, no bairro... http",0
"Mas ainda tinha aquelas gostosas que quando saiam,na outra semana tava na playboy",1
"cara, ao invés de clamar pelo Criador que tal refutar o que falei com fatos, lógica e verdades! http",0
"EXEMPLO DE PAI, SORTE DAS FILHAS. ESSE NUNCA VAI CHORAR NO BANHO. http",0
engraçado que eu percebo que qt + bonita a menina for + ela se acha feia/gorda e quanto + feia + se acha  pq meol deols,0
Se vc tiver 4 paus sim http,0
"'Erro de percepção mútuo', ou mentira constante? Dão tantas vezes o dito por não dito. http",0
"RT @user: @user @user @user burra pq não concordo com vcs? Pensei q a mulher fosse livre. Ah, é...A liberdade acaba quand _",1
"@user achei engraçado que ngm falou em direita aqui, mas vocês mesmo se entregam",0
@user Tb soninho.. e eis que trabalho amanhã. hj é feriado em sampa e tb trabalho rs affff rs,0
RT @user: Islão - 5 letras Bomba - 5 letras Coincidência??????,1
RT @user: Gente a mulher parece aquelas tia que fica na cozinha mas na verdade ela é um gênio da física #MasterChefBR,1
quando a pessoa é burra demais pra entender que o dia da mulher só foi por causa das lutas feministas http,0
@user nao trabalho com nomes,0
"Sou boba, mas não sou burra. Ingênua, mas não santa. Sou pessoa de riso fácil... e choro também! Prazer... eu sou Mulher!",0
Entrevista. Catarina Kinnvall: “É similar a forma como o islão radical e a extrema-direita mobilizam”: http,0
Do Facebook de um deputado do #PS. De facto 'quem se mete com o PS leva'. Tolerantes no seu melhor! @user _ http,0
Governo esquerdista de merda o Povo Brasileiro não foi consultado e não aceita a vinda de refugiados terroristas. http,1
Dudu Barbosa feia ou bonita? —_ bixa gorda http,1
@user deixou sair o filho o feminismo nao ajuda mais... SO AJUDA pra praticar o aborto...depois q ja te _ http,1
@user Não importa. Pode colocar no outro exemplo uma crítica tb q não fale de 'vitimismo' que dá no mesmo.,0
"O que seria 'válido', então? Feminicídio? Estupro? Mercado de trabalho? Falamos disso todo dia. Poderia dedicar uma coluna a isso, então.",1
"o imbecil usa uma ironia e figura de linguagem para responder, mas não consegue refutar nada do que falei!!!! http",1
"Galera, tenho umas fotos pra mostrar de terça, quando a sra @user deu entrevista pra uma revista com vestido micro.. querem?",0
RT @user: Só o Celso Daniel sabe o que é tortura. http,0
"ela me machuca discutindo sobre roupa,eu não dou NENHUM desgosto a ela mas a gente mora num inferno de quintura ela quer que eu use burca?",1
"ISP: outro “erro de percepção mútuo”? Além de faltar ao prometido, mentiu aos portugueses da forma mais descarada. http",0
"RT @user: Para especialistas, a rotulação reforça preconceitos e limita as escolhas profissionais do futuro. http",0
Feliz dia da mulher ....da M-U-L-H-E-R   #DiaDaMulher #BolsonaroReiDoMundo FELIZ DIA DAS MULHERES Dia Internaci _ http,0
RT @user: @user sorria tu ta sendo printado babaca!,0
é desmascarado e vem com ironia  hahahaha http,0
"Um Governo corrupto, refleti em todos os poderes a total CORRUPÇÃO. Matar Bebês, é a maior CORRUPÇÃO humana.... http",0
"Fascista, machista, nazista, trapezista, taxista, maratonista, eletricista, mas e corrupto? kkk http",1
"Antes de irem atrás de notícia requentada, desonesta intelectualmente da @user assista este vídeo do _ http",0
Pedreiro se forma em Direito após pedalar 42 km por dia para estudar (e agora esquerdopatas?) http,1
Juntos vamos #RenovarPortugal. A hora é de mudança. Nacionalismo é solução! #PNR #JoséPintoCoelho #AutárquicasPNR http,0
RT @user: Apresentamos os novos veículos 'Anjos das Marginais' e uniformes da CET. Custo zero para a Prefeitura graças ao apoio da inic _,0
"Falando em tpm, minha menstruação ta atrasada 2 semanas... Se eu não fosse sapatao ia estar preocupada",1
[9/3 09:11] jhu : Bom viado mais lindo [9/3 09:11] Dj Luizinho: Bom dia sapatão mais gostoza,1
"RT @user: ... Agora refugiados com uma ideologia e Cultura completamente INCOMPATÍVEIS com as nossas, aí não tem como mesmo!",1
"RT @user: A maior forma de racismo está nos defensores do multi-culturalismo que não respeitam os povos, a diversidade humana e nem _",0
"Tem dias que eu vou mais sapatao do que as próprias sapatao, como hoje",1
Amigo de Israel: PROIBIÇÃO MUNDIAL de críticas ao Islão no Facebook... http,0
RT @user: Levy Fidelix pode pagar 25 trilhões e o aparelho excretor vai continuar igual,0
@user @user talvez. não posso acusar sem saber. vou aguardar a resposta pra ver onde essa menina aprendeu a ser escrota.,0
@user vou mandar pra tu corrigir os post antes..kkkkk verdade de novo..kkkk,0
Quer se livrar do @user ?? é só eleger o @user em 2018 http,0
"@user @user Um ataca (Soros) o outro se defende (Trump). No mínimo, 2 moedas diferentes.",0
eu mesmo minha afilhada http,0
"A mãe do nóia disse que quer justiça Fácil, prende ela",1
O movimento 'Vai ter gorda na praia sim' parece que funcionou. http,1
"RT @user: Os medíocres q ñ tem argumentos estão livres para xingar e caluniar.Continuem aqui, é sinal q tenho algum prestígio kkk _",0
A esquerda está morrendo de um Câncer terminal http,1
"Jamais confunda um homem porco a um @user, um @user sabe bem a hora de lavar as mãos !",1
A próxima jornada do 'Overdose de Tourette-On The Road' joga-se toda a Norte: -2 MAR: VISEU -3 MAR: PORTO -4 MAR: A _ http,0
Boa tarde você que acha que vai nos atingir ou reconquistar com as fotinhos e os comentários da balada. Só afasta mais. #reflita,0
@user Novo filme: 'O Curioso Caso de Quem Sempre Atacou A Igreja Católica e o Cristianismo Mas Agora Defende o Papa Francisco',0
Como ser feminista: Ser feia e gorda Pagar peitinho em passeata Ser peluda Odiar homens E achar q isso fará diferença no mundo.,1
Vivemos no totalitarismo do pensamento único dos donos da 'liberdade'. Só o #PNR enfrenta e denuncia a 'besta'. _ http,0
"Ontem eu me lembrei q a mttttt tmp atras ,acho q uns 7 anos eu tive uma professora sapatao ,descobrir q hj ela possui o nome de allan",1
@user daqui a pouco vão falar que quem vendeu a faca ao bandido foi o @user ...,0
Comunista e hipocrisia são sinônimos http,1
@user saudades de quando homem era homem e mulher era mulher,1
@user alguém duvida que vai ser mais uma matéria pra denegrir o Bolsonaro? http,0
"RT @user: Quão 'democratas' e 'tolerantes' são estes esquerdistas, estes 'direitinhas' e estes 'politicamente correctos'.  http _",0
Pesquisa de APROVAÇÃO sem o cara sequer ter tomado posse???? AHAHAHAHAHAHA!!!!! Apela mais aí pessoal! http,0
"RT @user: Ei @user, olha só o que o Ministro das Relações Exteriores, @user acha de você....  Eu não deixava.... _",0
Uma mulher morreu nesta terça-feira (28) em um hospital da Nicarágua após não suportar as queimaduras em todo o... http,0
"- 'Ain o Dória está indo bem nesse últimos 2 meses,se ele candidatar para presidente pelo PSDB em 2018 votaria nele _ http",0
RT @user: A Estrategia das tesouras LULA X STF X BOLSONARO Tá explicado por que nunca julgaram NENHUM  processo de LULA.  @user _,0
"RT @user: 'Cinquenta Tons Mais Escuros não é empoderador, é abuso' - Post recente do nosso blog > Leia em: http http _",0
@user isto é deturpar os factos. Não saber o q são equações trigonométricas n fará com q a criança seja intolerante com quem sabe..,0
Sendo comunista assim... até eu! http,0
"BOA NOITE, CURTAM A SEXTA COM RESPONSABILIDADE: DIGA NÃO AS DROGAS, SE PEGAR PROSTITUTA OU TRAVESTI USAR PRESERVATIVO. QUE DEUS NOS ABENÇOE.",0
@user falou 'coletivismo' ....já sei que não presta ..,0
"Vocês tipo não entenderam... O Erro Do PSG Foi Jogar De Branco, Barcelona Pensou Que fosse o Real Madrid —_ se sentindo engraçado",0
"RT @user: A Folha de S. Paulo omitiu as 20 milhões de mortes feitas na Revolução Russa em reportagem, por que não estou surpreso? htt _",0
vai pra cuba,0
New post: 'União Europeia ameaça com sanções países que não recebem refugiados' http,0
"'O único objetivo da família de João Victor é que Guilherme Francisco do Santos e Alexandro José da Silva,... http",0
"RT @user: Feliz dia da mulher em 1 lugar a minha mãe. E tb à @user , @user , @user e todas as mulheres do Tw _",0
"Estamos de olho !Foram 2milhoes de assinaturas, mas hoje somos muito mais, descontentes com essa roubalheira. http",0
"RT @user: Juntos, vamos mudar #Portugal! @user http",0
@user Tem outras teorias tambem.... http,0
"@user a criança não sabe ainda está a tentar controlar seu corpo aonde fazer coco, habituar-se aos alimentos, fazer amigos, brincar",0
Urge uma mudança para renovarmos Portugal @user http #PNR #RenovarPortugal,0
. @user @user e do outro uma imbecil útil usando fc de diva pop achando que ta destruindo o mundo com seus pensamentos perdidos.,1
"Parabéns, #PatríciaMamona e #NelsonÉvora! http",0
#DiaDaMulher FELIZ DIA DAS MULHERES Dia Internacional da Mulher #BolsonaroReiDoMundo http,0
Dossiê: Sapatão é revolução! Existências e resistências das lesbianidades nas encruzilhadas subalternas. Até 26/03 http,0
RT @user: Burra é a mulher que vira piranha pra provocar ex..,1
"@user Ué, mas o homem branco fez isso mesmo. Esse povo pensa que a colonização foi como?",1
"E agora, o @user não diz nada? Basta! Urge um apoio às políticas defendidas pelo PNR para que isto acabe. http",0
"RT @user: A mídia não mostrou, mas o STF que não se vigie pra ver... Somos Todos @user  @user  @user http _",0
É a turma da problematização que vê preconceito em tudo pra pautar nos movimentos. São doentes mentais de esquerda. http,1
@user é muito branco se doendo porque não tem capacidade e joga a culpa nas cotas.,1
RT @user: @user mas um simples boneco não vai interferir na educação de uma criança. Sem esquecer q existem crianças q sã _,0
tem é que privatizar as universidades mesmo só tem doutrinador marxista  mas q eu queria uma vaguinha na ufrj queria.......,0
RT @user: Isto é deitar lenha para a fogueira. Querem mais 75 milhões de muçulmanos com livre circulação na Europa? Traidores! ht _,1
Já Está No Portal 'Music For Angola' Mboraa Lá Partilhar Pessoal!! . Dêem Uma Olhada...  JAY CEE - NÃO VAI http,0
"Parabéns deputado #APEzequielTeixeira. Esse Brasil está em colapso cultural, uma inversão doentia de prioridades http",0
"RT @user: Os ratos e o Hospital do Barreiro. O @user diz que as obras avançam este ano, mas outros já disseram o mesmo no pe _",0
RT @user: Não existe extrema esquerda pra Globo  Só extrema direita,1
"Nem um nem outro. Refute o que falei com fatos, lógica e verdades! http",0
"Eliseu,#colinho e Pizzi: já captei a vossa atenção? Óptimo. 'Overdose de Tourette' esta 5a, 6a e Sábado em Viseu, P _ http",0
"Aí não é ''suspeito'', né seus VAGABUNDOS!?!! É 'comprovado'.  Mas se for bandido ATIRANDO contra PM em carro ROUB _ http",1
RT @user: Não justo! Não podemos arcar com tamanho sacrifício. Que cortem ou reduzam o assistencialismo! http,0
Uma análise do primeiro livro revelou que o relacionamento entre Christian e Ana se caracteriza como violência... http,0
E na @user NOTÍCIAS FALSAS Bernie Sanders foi tirado do ar ao descrevê-los com o termo notícias falsas. Alegaram dif _ http,0
RT @user: Cebolinha é PSOL http,0
"RT @user: É curioso o Orçamento para 2017 da #CMB. Chapa ganha, chapa gasta. Siga! #Barreiro #Autárquicas2017 #PCP #RenovarPortuga _",0
parabéns a essas meninas... kkkkk @user @user @user @user @user @user http,1
"Voltei do hospital agora, fui ver um tio que tá gay. Ele tá melhor, já tá pegando nos peito da enfermeira",1
Meigo!  Nada como um bom e forte capitalismo de estado. http,0
"'Mulher nova, bonita e carinhosa Faz o homem gemer sem sentir dor..' #MulherDeVerdade",0
"'Desculpem por eu não ter acreditado, mas hoje vocês me fizeram ser o homem mais feliz de Angola, mesmo com a crise _ http",0
É espantosa a total falta de nível dos comentários de certos jovens da esquerda caviar. Apenas se safam aqueles que têm algum humor.,0
PNR marca protesto pela “liberdade de expressão” http,0
@user e com as crianças eles fazem isso...povo maldito mesmo ! @user http,0
Furos e até mesmo furos confidenciais ilegais tem sido um problema em Washington há anos. O falido @user (e outr _ http,0
"RT @user:  azeiteiro, quero q te fodas volta para a tua terra",1
essas pessoas acabaram de visualizar seu perfil http,0
quando alguém te chamar de gordo não ligue você é maior que tudo isso,1
feliciano não é estuprador gente isso é tudo marketing da esquerda,1
"RT @user: (Rochdale, Osasco/SP) - - - fêmea Achada | Nome: SEM NOME | cor: Branco http",0
@user Já percebeu que só militante feia e gorda  fala mal de homem ?,1
"RT @user:  Não Tanto Quanto Você Militante @user Defensora De Ditaduras Em Angola, Cuba e Venezuela e Defensora Da Corrup _",1
Jantar de negócios a noite com o Primeiro Ministro do Japão Abe e seus representantes na Casa Branca de Inverno (Ma _ http,0
"sou a favor do prebiscito para essas merdas, o povo não vai aceitar nunca a liberação http",1
#Extra #DonaldTRUMP revogou a ordem de #Obama  e retirou os banheiros transgêneros das escola. parabéns... http,1
Ja pensou se o Bial falasse 'Vem da o cu aqui fora Nasser' #FinalBBB13,1
@user responde a falsa acusação da REVISTA VEJA sobre ele ter planejado praticar atos terroristas http,0
VEM GENTE DA ANGOLA TROVAR O MEU BOY NÃO NÉ AMORES,1
Da série: Imagina se fosse o contrário? Vai daí seu racista! @user http,0
RT @user: O nosso Presidente @user  É preciso renovar! É preciso acreditar! #PNR #Portugal #Portugueses #JoséPintoCoelho _,0
RT @user: Por ex obras em angola vieram ou nao do BNDES? Quero entender @user @user @user @user htt _,0
se fosse o mito cuspindo no jean seria homofobia né,1
@user Ta falando do Felipe neto @user,0
"Oi, amores... @user @user @user @user @user @user @user Vcs num tem noção da correriaaaa Aff Xeru",0
"Uma vez qdo era criança  eu tava no drive do Mc e um garoto pediu um lanche Meu pai disse: Não não, se não depois vc não almoça!",0
@user no perfil dele ainda contém machismo.,1
Atentados em França  http #PNR #RenovarPortugal http,0
Como posso ajudar o PNR?  http #Apoio #PNR #RenovarPortugal,0
RT @user: Mais de 50 cidades brasileiras já aderiram à Greve Internacional de Mulheres #8M #euparo http,0
Os mais jovens do @user  #RenovarPortugal #Portugal #PNR http,0
"-  Hoje posso ta feia , gorda , falsa , metida etc.. Amanhã endiante você verá uma nova ' Poxa Bia '",0
"a lição de hoje da mulher mais burra do brasil é: não pulem de um ônibus em movimento, mesmo se você estiver no último degrau ou na anchieta",1
"Pego agora aki no provador da C&A da Av Rio Branco, com várias peças.  Com o sistema de alarme _ http",0
RT @user: Vivemos no totalitarismo do pensamento único dos donos da 'liberdade'. Só o #PNR enfrenta e denuncia a 'besta'. http _,0
@user fake news...quem ta fazendo isso é aluta de classes que a esquerda americana implantou http,0
Por ex obras em angola vieram ou nao do BNDES? Quero entender @user @user @user _ http,0
"RT @user: YouTuber cospe na boca do gato = ONGs se indignam, fazem campanha Filha da deputada do PT coloca maconha na boca do cachorro _",0
Até quando vamos deixar nos enfiarem goela adentro tanta corrupção? Não queremos refugiados de lugar nenhum!! Vamos pra rua gritar meu povo!,0
"RT @user: Vendo sua popularidade despencar e a debandada de seus seguidores, Reinaldo Azevedo agora afaga a esquerda para ver se co _",0
RT @user: Incrível a facilidade que sapatao tem pra namorar,1
@user só pode estar a gozar com as pessoas! 'Homofobia'? É a selvajaria islâmica que tanto gosta importar! http,1
RT @user: Report: A direita da Alemanha acredita que chegou a hora do país se libertar das 'culpas históricas'. TWP: http _,0
Estão cada vez mais totalitários! Correm tudo a proibições e extorsões. É só dogmas e tabus... Mundo louco! http,0
Ser mulher é ter que provar todo dia que não é burra e é tão competente quanto qualquer um.,0
e daí? pelo menos eles não são do PT http,0
RT @user: Jandira Feghali está passando na sua timeline. http,0
RT @user: Não há cozido à portuguesa que não tenha farinheira nem greves na Função Pública que não sejam à sexta-feira...,1
"Que esse padre pagou PRESTAÇÕES DE UM CARRO a um menor que ameaçou revelar detalhes de abuso sexual sofrido, vocês _ http",0
Meus Deus!! É muita doutrinação e alienação que a imprensa impõe na coitadinha!!! http,0
"Burra é a mulher que aceita ser amante, pois valoriza um traidor, ajuda a destruir uma família e nunca terá moral de ser a única.",1
"RT @user: Temos na Assembleia a 'claque' mais bem paga do país. Ordenados milionários, para fazerem o que fazem os figurantes na _",0
em glee quando cantaram run the world e eu babei pela heather Morris nitidamente como eu nao sabia que eu era sapatao gente eu tombei,0
Pesquisa revela “trio de ouro” para o orgasmo feminino http via @user,0
"@user Puts,o @user não é gay... Legal a gente ver que as aparências enganam e não fazem a MENOR diferença. #namoradalinda",1
18:40] Max: Vai tomar no teu cu então 18:40] Max: Sua gorda feia 18:40] Max  :Meu amor por você 18:41] Leticia: Eu sou gorda Maxwell?,1
"Jamais vou entender este fenômeno chamado, #Carnaval. Um povo sofrido, roubado, explorado, _ http",0
"Quando a gente fala que os filmes da Disney, tem linguagem subliminar, é fanatismo né? Agora, não é mais... http",0
"@user tem mulheres boas...e tem mulher que rouba, que mente, que é dissimulada, que roubou aposentados, co _ http",1
@user na sexta feira http,0
"Chirs Cuomo, em sua entrevista com o Sen. Blumenthal nunca perguntou sobre a farsa do corajoso 'serviço' dele no Vi _ http",0
RT @user: Marcelo disse que se reuniu mais de 100 vezes com Dilma. E ela diz que ele 'insulta a minha honestidade'. Dilma insult _,0
@user Num dá vontade de fazer um comentário desaforado pra essa menina? http Acho que vou fazer!,1
SÓ FUNCIONA COM CHIP CLARO http,0
Este Zivkovic é uma pequena maravilha,0
2 FUFAS CONTRA UM PRETO TODO BACA,1
Feliz dia do 'Eu só acho engraçado que......',0
Qdo vc vê q a mulher q vc gosta te bloqueou só pq vc comeu outra http,1
PT é vermelho pq vermelho representa o comunismo ou seja representa o inferno.,1
sera que o povo do meu serviço vai notar se eu levar um colchão amanha,0
"@user Taí.. qria um picolé de carambola. Ou Jambo. #recifefeelings... Mas, o dia, hj, mto trab. E a noite? 'A solidão é fera...'",0
Eu servindo café da manhã pra sua irmã. Ela gosta de leite quente com ovos logo cedo http,0
"...Aliás, uma #MulherDeVerdade se despe de qualquer preconceito. E vive!",0
Não quer morrer cedo ? -não consuma drogas - não leve drogas para as Filipinas -Não entre por engano em favela dominada pelo tráfico,0
