text,label
RT @user: Descobrimos que o Rui Cruz chora com filmes românticos...  #ccallstars http,0
RT @user: O maior ato feminista de 2017 até o momento foi o de Marine Le Pen se recusando a se curvar as imposições machistas islâmi _,0
ELE NUNCA VAI VOLTAR DESSE JEITO... VEM METEORO! http,0
Hj eu vi a @user perguntando p @user no TT como funciona a promoção e a Dona Morangorespondendo como funciona #odiadehoje,0
Por um mundo com mais: #MeuAmigoSecreto #NãoÀCulturaDoEstupro #FeminicídioNão #NenhumaAMenos Celebremos o #DiaInternacionaldaMulher.,0
@user as diferenças no mundo islâmico não tornam a Europa o melhor lugar para os refugiados viverem. http,0
RT @user: Vagabunda demais http,1
RT @user: DESCONSTRUINDO O GÊNERO CACHORRO http,0
"RT @user: Mulher que apanha de homem e ainda assim continua com ele é burra!! Att: Não perguntei nada, é burra e acabou",1
"RT @user: @user não. A lei da imigração abre as fronteiras do Brasil para refugiados, e libera a ONU para emitir vistos, tirando _",0
LOL Não têm vergonha. E seis milhões de bilhetes IDA de avião para os refugiados que já cá estão? http,1
"adorando essa cerimônia, só nao to entendendo esses monte de país subdesenvolvido no meu estádio",0
"Filme de País Iraniano que apedreja gays e degola cristãos,ganha Oscar de filme estrangeiro e diretor crítica _ http",1
"@user Então, reflita no teu comentntário, friend. E não esotu justificando ou defendendo pq é famosa. Faria com qq Pssoa! Abç",0
RT @user: Sapatão do inferno jakakaka,1
edai que o ministério do temer não tem mulheres nem negros??? eles não fizeram por merecer ue,0
"'Deus criou a mulher de uma costela, de um osso torto. Se procurares endireitá-la, quebrará. Tenham pois paciência c elas.' #MulherDeVerdade",0
"Ele ataca imigração ILEGAL, seus idiotas! E qual o motivo das aspas no mérito? É ótima ideia! Vcs contratam funcio _ http",1
Eu no 6° ano sentia-me rebelde porque chamava às minhas amigas 'fufinha' e elas ficavam felizes qd na vdd insinuava q eram fufas,1
"@user caralho queria ficar no palco do strokes o dia todo pra pegar grade mas duran duran nao vai tocar no mesmo, que porra da angola",0
Não  haha Feminismo:  - defende TODAS as pautas da esquerda. - é só a esquerda perder que faz protesto -nunca prote _ http,1
"mais sapatão que isso, só isso http",1
"A bomba encontrada na Nazaré foi logo detonada, já a do Panamá está quase há um ano, no Expresso, à espera da brigada de minas e armadilhas.",0
Menina se veste como menina. #NaoAIdeologiaDeGenero http,0
RT @user: usa termos como 'mariquice' e relacionar isso com o 'Islão invasor' e ainda se pergunta porque não dão tempo de antena ao seu _,1
Hipócritas feministas do governo da #Suécia. 'Corajosas' para gozarem com #Trump e cobardes submissas perante o _ http,0
acabei de pagar 20 reais em um carregador pq esqueci o meu. já começando o dia se sentindo a mulher mais burra do brasil,1
"A Senadora do Paraná mandou você Mulher, fazer greve de sexo. #FelizDiaInternacionalDasMulheres http",0
RT @user: Realmente não defende mulheres. Simples assim. Em alguns momentos ataca ferozmente mulheres que não estejam seguindo sua cart _,1
RT @user: Como vai dar certo um pico desse? http,0
se o comunismo fosse bom a venezuela nao estaria do jeito que tá,0
"@user usa barba ou bigode, essa coisa de pelinha lisinha pra gente é bunda de mulher !",1
ACEITE OS CHIFRES #JoaquinResponde http,0
"RT @user: Não acho burra a mulher q prefere se separa, do que vive de mentiras...  Otaria é quem gosta de ser corna e se faz de feliz _",1
@user Marcelo..assim foi o que a europa pensou..e está no CAOS pq deles. Sabe porque DUBAI não recebe eles ?pq da religião extrema,0
Quem defende político corrupto é o feminismo por ordem da Esquerda!!!! http,0
@user faz outra matéria explicando porque os países da arábia não recebem refugiados? Valeu!,0
a maioria das pessoas só estão vivas porque é ilegal atirar nelas,0
Dizer uma frase idiota de efeito e não refutar nada só prova o quanto voce é alienada! http,0
@user @user @user ai agora já não é sharia? De todo o modo jihad é radicalismo não é a base do islão.,1
"Aaaaaa Turma de 9 homens e eu, o prof fala de cabo sapatão (conector femea femea) e todo mundo olha pra mim",1
"RT @user: Porque o que mais tem é lobo em pele de cordeiro. Contra a hipocrisia, @user neles!",0
RT @user: Menina se veste como menina. #NaoAIdeologiaDeGenero http,1
"@user Ué, vai lá machão! Leva tua mulher pra galera ver!",1
Novo trailer do OVERDOSE DE TOURETTE - ON THE ROAD. Hoje explicamos o que é um Rui Cruz #OverdoseDeTourette http,0
ALÔ FEMINISTAS ATÉ #JesusEstáVoltando E O SEU PAI NÃO,1
"Nesse Dia Internacional da Mulher, experimente dar panos de prato para alguma feminista, ela vai amar!",1
@user infelizmente os lideres de ambos os países são CUMPLICES http,0
"RT @user: Uma preguiça: mina childfree. Mano, num quer ter filho, não tenha. Agora ficar postando como se criança fosse o mal da human _",0
"RT @user: Não faz sentido Portugal acolher imigrantes, enquanto a nossa população se encontra desempregada e é obrigada a emigrar. _",1
RT @user: menina voce ta doida de apoiar a legalizacao do aborto??,0
meninas que vão pra morro branco mas queriam ficar de vez em fortaleza,0
RT @user: Noruega: refugiados não aceitam apartamentos populares não; exigem casas! http,1
RT @user: Campanha #PelaVidaDasPessoasTrans pq a luta contra a transfobia tbm é uma luta feminista http http _,0
Essa coisa sem sentido do envolvimento com a Rússia é só uma tentativa de encobrir os erros da campanha perdedora d _ http,0
"RT @user: Cara  é de sapatão, mas o coração é de mocinha  http",1
Aquelas pessoas que querem mudar o mundo mesmo não sabendo conjugar um verbo http,1
"@user reparaste na parte dos motivos? E além disso não é o Islão, mas as pessoas que cometem crimes.",0
O Batáguas também vai ter de fazer o mesmo Joana http,0
Encerrar livre circulação da UE não deve reduzir migração ao R.Unido http #Refugiados #Imigração _ http,0
Aguarela com muitos anos. #Salazar http,0
@user @user Cheirossssssssssssssssssss boa noite!,0
"Atenção: segundo esse 'jênio' a violência contra a mulher no Brasil se dá pelo fato do país ser de maioria cristã, _ http",1
então eu tento fazer minha parte pra não ser um homem branco babaca que não olha só pro meu umbigo,1
"SÓ LEMBRANDO, HOJE 08 DE MARÇO É #DiaDaMulher  M - U - L - H - E - R PRA HOMEM QUE USA SAIA, MAQUIAGEM ETC: SEU DIA É O 1º DE ABRIL. #PAZ",1
tecnica em automaçao mas eu nao consegui e nao e pq sou burra e nao fui boa o suficiente nas provas de pré- requesito e sim pq sou mulher,1
"RT @user: tinha uma mosca aqui e eu tirei a tela pra ela sair, mas ela não saía,  eu: vc é burra, minha filha aí uma mulher passou na _",1
"@user vc n entendeu que eu falei nao? refugiados nao vem pro brasil, é mt longe",0
Ai q gostoso a Cléo Pires fumando um e publicando na NET pq o privilégio branco e de classe eh tão lindo *_* http,0
"vsf mano, eu fico perplexo de ver umas desgraça apoiar umas coisas tão absurdas, um dia é negro falando que quem salvou o negro foi o branco",1
"RT @user: A Esquerda está trabalhando a todo vapor para aprovar a legalização da maior agressão ao universo feminino, o aborto. #PL _",0
"@user estás a insinuar que algarvios, alentejanos, comunas e fachos não passam de uma cambada de rabetas?!",1
"Luana foi morta ao solicitar que fosse revistada por uma policial mulher, o que era um direito dela. O caso foi... http",0
RT @user: mano que mulher é essa que tá no master chef  me sinto mt burra #MasterChefBR,1
"#DigaNaoAIdeologiaDeGenero Para as feministas de gênero, diferente é desigual, e desigual é injusto. Ignorando as... http",1
FELIZ DIA DAS MULHERES PRA QUEM NASCEU HOMEM E ACHA QUE PRA SE MULHER BASTA COLOCAR UMA SAIA O SEU DIA É 1º DE ABRIL #InternationalWomensDaY,0
"Aquela gente vestida de branco, parecia com o céu mais o céu é lugar de Santo",0
RT @user: Deixei minha redação do enem em branco pois quem sou eu pra falar sobre feminismo,1
@user @user ESSA MERRDA DE POLITICAMENTE CORRETO TA FAZENDO EUROPEU APANHAR NA CARA DE REFUGIADOS E NAO SABE NEM SE DEFENDER!,1
@user @user @user OK...existem mulheres de direita e de esquerda. Se vc nao é bandida..foi pra vc tambem,0
"'Vai também ser lançado um manual de boas maneiras para lidar com fufas, gays e transsexuais, os chamados LGTB' - notícias matinais na rádio",1
Vão comer arroz e feijão seus fdp frescos do caralho !!!!!!,1
@user ela podia pelo menos se preparar vestida de burca ninguém é obrigado a ficar olhando esse corpinho aí não. Eu heim!,1
"RT @user: AS VEZES, SEMPRE...rsrs OS 'ANJOS' NÃO SÃO BONZINHOS COMO VOCÊ IDEALIZA. ALIÁS ELES MATAM, CURAM, SALVAM MAS SEMPRE OBEDEC _",1
@user cai na real..voce tem que ir dizer isso la na sede do movimento feminista. Olha a agenda dele. Se i _ http,0
"RT @user: Não concordo em usar familiares para atacar adversários políticos, porém uma bandeira da @user é a educação dos _",1
@user  Ora bem... já está a perder a linha. O verniz dos 'tolerantes' acaba sempre por estalar.,1
"@user @user Sim, mas elas comemoram como se fosse o dia da mulher LESBICA/GAY e nao de qq mulher (agenda da esquerda)",0
Que burra essa mulher que perdeu o mamão! Ele é mto maduro cara,1
"Gostaria de entender pq quando a mulher é feia feat gorda vcs acham MT lindo quando ela bota sem roupa, isso aí mana se liberta, mostra mesm",0
Enquanto as mulheres falavam sobre a campanha 'Carnaval sem preconceito' e distribuíam material de divulgação em... http,0
"Estou lendo que o preço do grande MURO na fronteira custará mais do que o governo esperava inicialmente, mas eu ain _ http",0
Consegui cortar meu dedo com uma faca de serrinha seria eu a mulher mais burra do mundo?,0
"@user não tem namorada, tem fêmea temporária.",1
RT @user: @user realizei o sonho dá minha esposa e levei ela pra NYC e é claro não podia faltar o yellow umbrella  http _,0
ESTOU LANÇANDO MINHA MARCA DE CAMISETAS ESSA É ESPECIAL PRO #diainternacionaldamulher  BELA OPÇÃO PRA PRESENTEAR O _ http,0
"'aparentemente sem ligações terroristas'  Mas não vêem que o Islão contém o ovo da serpente? Terrorista ou não, de _ http",1
"Elettra fica puta pq Alex se afastou, mais n faz nada pra mudar a situação. Nunca vi mulher mais burra. Sofrendo atoa #vipdirecto",0
"Não, em Angola não se fala criolo. Não, não te posso ensinar a dançar kizomba. Pára de dizer ewe e xe a falar cmg.",0
@user @user não cara..elas nao vao mudar de sexo pq tem 2 malucos (malafaia e bolsonaro) que impediram esse projeto de lei,0
Feliz #DiaDasMulheres pras verdadeiras guerreiras que trabalham ou cuidam do lar enquanto as vagabundas lutam pra abortar e andar pelada,1
Isto faz tanto sentido como dizer q angola não é uma colônia http,0
"Uma mulher de verdade é bem sucedida, independente. Mas se não for - ainda, vai lutar até o fim por si mesma!",0
POR QUE DIA 'INTERNACIONAL' DA MULHER? DEIXA SÓ 'DIA DA MULHER' TIRA O INTERNACIONAL MULHER NÃO QUER SE SENTIR REBAIXADA,0
RT @user: Muçulmanos vandalizam lápides de judeus e cristãos http,1
"RT @user: @user @user liga não mano , claro que ela tem carimbo no passaporte rs .. Ela veio p brasil refugiada da an _",1
RT @user: Tem mulher q é burra pqp,1
Bela lógica camarada liberal:'Se não colocares actores muçulmanos na tv eles vão-se juntar ao ISIS.MAS HEY O ISLÃO NÃO É ODIO',1
@user que mulher suja da porra,0
@user Tem que ser muito capacho de ideologia para apoiar uma cultura que apedreja e açoita mulheres só porque a e _ http,1
#i5gornascimento @user g1 União Europeia ameaça com sanções países que não recebem refugiados http,0
@user ela é sapatao? So perguntando pq vou incluir no meu tcc,0
~*~*~*~ vOcÊ é NeGrA mAs AtÉ qUe é BoNiTa ~*~*~*~,1
"@user hahahaha, #brincadeirinhaboba rs tb acho",0
"Qnd as feministas vierem me ofender, não vou nem rebater, só vou dar RT.",0
Hitler está no campo de concentração e vê uma crianca toda feliz - Pq esta tao feliz? - Amanha faço 6 anos. -Ehehe... não faz não!!,1
Mulher boa é assim http,0
Portugal distingue-se “porque não tem nem vai ter campos de refugiados http,1
"@user @user EU NÃO SABIA, AGORA PESQUISANDO QUE VI OS SEM TETO TÃO RECEBENDO REFUGIADOS ISLAMICOS E O POVO NÃO TA PERCEBENDO",1
A mitológica e desconhecida diferença entre imigrante ilegal e turista http,1
@user país da inversão de valores http,0
por que eu não posso chamar ele de PRETO se ele me chama de BRANQUELO AZEDO,1
"Chamem-me burra , eu n sabia q era dia da mulher até mo desejarem",1
essa gente que quer combater o racismo mas diz q por uma pessoa ser branca ela não pode fazer x coisa.....tipo se vestir de iemanjá,1
Dia 26 vamos botar pressão http,0
"Pra Temer, contribuição das mulheres à economia é analisar preço de supermercado e ser responsável pelo orçamento d _ http",0
03 da manhã e nordestino vim apelar com piada de apagão... hahaha aproveita que ta sem luz e vai dormir...,0
"RT @user: Se as crianças gays que que assistem casais heteros a se beijar não ficam 'direitos',como è q supostamente vai acontecer o _",1
Mulher armadora de barracas,0
"Mulherada, é Outubro rosa! Realizamos o exame de mama gratuitamente, basta agendar via DM #outubrorosa http",0
@user ngm perguntou sua opiniao de branca sobre racismo e vc deu então acho q estamos na mesma,1
"Homem branco hétero cisgênero, me oprimindo durante Protesto pela Revogação do Estatuto do Desarmamento.. _ http",1
Fds eus eu que hj é dia da mulher mas tas-te a fzr de burra como é que foi outra pessoas a escrever o teu título do _ http,1
@user @user Quem tem Mitomania sou eu que sou fã do Bolsonaro   hahahahahahah  (zuera),0
@user Como a esquerda é quem manda no coletivismo feminista..e eles nao querem falar mal de ISLÃ = todas cala _ http,0
"Morena de Angola ficou mais conhecida na voz da Clara Nunes. Não sei qual versão é mais bonita, dela ou do Chico ... <3",0
"Impunidade dos outros, fraqueza dos “nossos” http #Portugal #PNR #RenovarPortugal",0
"Claro que sim, é só vc não ser um babaca nerds, um valentão da rede, uma mulher imbecil, um hipster freak ou viciado em celebridades.",1
"Não é só porque tá na moda, que é bonito, mulheres. #cuidem",1
"@user sorte sua, se vc for menor de idade ele vai querer comer seu cu",1
@user eu vejo sapatao fazendo isso e fico meu amor acho q JA CHEGA DE INTERNET POR HOJE PRA VC http,1
A identidade não se vende http,0
RT @user: ELE NUNCA VAI VOLTAR DESSE JEITO... VEM METEORO! http,0
"O ESQUERDOPATA imbecil GOSTA do COMUNISMO mas não QUER morar em CUBA, CORÉIA DO NORTE ou ANGOLA ou seja países COMU _ http",1
"O problema com o Islão não é com etnia e sim com a ideologia, que visa destruir o Cristianismo! E eu me referi ao f _ http",0
"Acho irónico que uma mulher que ajudou a NASA a andar para a frente, esteja numa cadeira de rodas #Oscars",1
Homem que é homem só come carne. Peixe é coisa de bixa.,1
"RT @user: Mulher inteligente é outro mambo ya, não tem como! Burra não, pode ser bue bonita mas burra ta gato, pode morrer..",1
@user @user @user por isso defende o obaminha da 'paz',0
lei...LEI..para assassinato de fetos.... bolsonaro diz 'vc nao merece ser estuprada' pq da mulher irritando ele - i _ http,0
RT @user: Mas e a ressocialização? http,0
"'@user: @user Seu perfil fala mau de gente branca e eu sou racista? Coerência, cadê?' http",0
"Se preparem, eu sei bem o que é isso. Paguei e sofro na pele verdadeiramente essa PERSEGUIÇÃO religiosa.Quem vive... http",0
vamo ser negro mas nao vamo abusar ne,1
RT @user: João Braga esclarece que houve uma troca de envelopes e que afinal adora pretos e paneleiros.,1
"Ha ha! Aí ela consegue argumentar: falou em 'desmontar' mesmo sendo em figura de linguagem, ela já apela pro  'ain, _ http",0
"Lindo cabide, todo em branco com coração de apliques em pérolas da noivinha Elisangela. http",0
mas puta que pariu que ódio de mulher machista e burra,1
"RT @user: Muito normal. Melhor mostrar a plena realidade a criança. Porque ninguém escolhe ser homossexual. Não acontece a todos , _",0
"RT @user: TODO ANGOLANO QUER SER POLICIA , MILITAR (FAA) DAQUI A NADA ANGOLA NÂO TERA MAIS GATUNO.",1
Venezuela não tem papel higiênico e a mulherada vai lá fazer cirurgia plástica. Vai dar certo sim,0
"Vou ver se tem curso pra aprender a ser burra porque olha, tá difícil aturar essa raça que tem medo de mulher que sabe pensar. sifudê.",1
"RT @user: 'Mulheres são minoria nos cursos de engenharia!', denuncia a feminazi que quer escolher sua profissão por você.",1
"Pela primeira vez esta época, um jogador do Porto foi expulso! Aposto que este árbitro não treina na Maia, nem tem talhos em Guimarães...",0
"Cara, isso não é um sonho??? #cocolatraassumidamodeon http",0
@user Lugar de ralação po!!!  Qual era a fantasia mesmo??? Burca (com todo respeito se não alguém vai querer me processar) é que não era!,1
"Mentira, mesmo sendo sapatao ja estou preocupada, porque vai que eu engravidei pelo vaso sanitario",1
"Vocês podem denunciar aqui, gente: http",0
@user quando eles chegam para MUDAR todos os seus costumes. http,0
RT @user: Toda mulher deve ser respeitada independente de ser ou não feminista Só as feministas que dizem lutar pelas mulheres nã _,0
Acredite se quiser: Existe agora 'agefluid' - faz parte da ideologia de gênero provavelmente - que faz parte do ati _ http,0
"@user @user Tinha que ser gorda, né?",1
"'não come mel, morde marimbondo'",0
"Parem de histeria...não ha nada demais de dizer que homem é homem e muher mulher. Pq a pessoa se sente diferente, n _ http",1
"Não acho burra a mulher que prefere se separar do que viver de mentiras, otária é quem gosta de ser corna e se fazer de feliz..",1
Onde classificam é o menos. Desta vez tendo a concordar com @user (mas não se habitue). Trata-se de devassa grat _ http,0
e foi criado um novo termo 'nudez intelectual'....a mesma que acontece quando voce ta cagando pelado antes do banho _ http,0
Matérias q deveriam ser obrigatórias (meninos) - PORT/MATEM - Geografia/Hist - Largar de viadagem - Seja homem - Coma mulher direito seu FDP,1
"@user @user não..só as feministas, como na figura...",0
Mulher burra me da nojo!,1
O amigo passa o ano inteiro dizendo: 'aquela é puta' 'gorda' 'não pego pq é feia' 'feminazi' E AGORA VEM COM ESSA HIPOCRISIA,1
"RT @user: as pessoas hoje em dia te falam td hora pra vc amar quem vc é e se aceitar, mas se vc for BRANCO & HÉTERO VC NÃO DEVE FAZER _",1
SAbem o que eu descobri??? Uma pessoa Acróstica! Adivinhem quem é??? hahahah,0
RT @user: Como ser feminista: Ser feia e gorda Pagar peitinho em passeata Ser peluda Odiar homens E achar q isso fará diferença _,1
estou me sentindo jundiaiense já. fui pra faculdade e perguntei se a coxinha era de frango. a mulher faltou me chamar de burra dizendo que+,1
'Os temas resultam das visitas efectuadas por #AssunçãoCristas'. Incluída a da mesquita: submissão ao #IslãoInvasor. http,0
Os muleke é liso sim mas o governo é muito mais.,0
Fala que odeia a PM agora @user http,1
"#JesusEstáVoltando as profecias se cumprindo: gente querendo dominar o mundo pra trazer 'paz' através de socialismo, islão dominando etc",0
@user Eu amo esse bairro e adivinha? abriu uma temakeria do lado de casa hahaha #falenciafeelings,0
"'trabalhando graças ao feminismo' RH decide: - vou escolher a mulher pq mesmo ela nao concluindo a faculdade, ela cagou na foto do bolsonaro",1
Eu tô bem surpresa que os gringos não sabiam o que é caju http via @user,0
@user a questão não é preconceito. É a ilegalidade! Drogas que entram pelo México e terroristas travestidos de refugiados.,0
"RT @user: COM MUITO ORGULHO FUI ELEITO O REI-MOMO DO BLOCO PORÃO DO DOPS DO MEU AMIGO @user DECOREM AS MARCHINHAS, A FOL _",0
@user Mas poxa vida http,1
"'Cem homens podem formar um acampamento, mas é preciso uma mulher para se fazer um lar.' #MulherDeVerdade",0
"Se os países muçulmanos não acolhem os refugiados muçulmanos (mesma língua e religião), por que o ocidente que é... http",0
HOMEM QUE USA SAIA E MAQUIAGEM:  APROPRIAÇÃO CULTURAL FEMININA MULHER QUE DEIXA O SUVACO PELUDO: APROPRIAÇÃO CULTU _ http,1
"-Levy Fidelix, cu de mulher reproduz? -Não? -Caso encerrado!",1
@user  argumento dele é que crise de refugiados não é sem precedentes e alarmismo alimenta pânico e xenofobia.,0
@user  Os 'cumpanhero' quebraram todas as regras.,0
UÉÉÉ.... Não são direitos iguais? Não lutam por igualdade? Ou é só a igualdade dá conveniência?  Quando essas... http,1
"@user @user Religiosos ou não, devemos agradecer que estes reneguem o homossexualismo. Enquanto todos se calaram, só a......",0
"Duda é muito burra , veio pra formatura e esqueceu do documento Dela , a mulher barrou ela  , KKKKKKKKKKKK",0
@user Duvido o feminismo ser contra o que esse MACHO HOMEM pede aí! O feminismo é capacho da esquerda!,1
União Europeia quer multar países que não abrigarem refugiados. Entendem agora porque tudo isso vai ruir?#Europaxit,0
"ainda bem que o crivella ganhou, imagina só o rio com droga legalizada, sem PM e aborto liberado???",0
Vamos para rua contra a Ideologia de Gênero.Parabéns Peru. http,0
"@user não. A lei da imigração abre as fronteiras do Brasil para refugiados, e libera a ONU para emitir vistos, tirando autonomia da PF.",0
"'Movimentos anti-Dilma', ahahahahahaha!!!!!  É tão somente qualquer pessoa sensata e baseada em números. Aliás, a _ http",0
"RT @user: Com todo respeito... no dia que sair uma criança pelo mesmo lugar de onde saem as fezes dos humanos, o Levy Fidelix pod _",1
"Dai você vê que o objetivo principal é 'informar', nada mais, imagina... http",0
"Você é cheinha, NÃO é gostosa. Ponto. http",1
"Enciclopédia @user : Futebol = hora sagrada, churrasco, cerveja gelada, não gosta vaza! fêmeas no shopping !",0
Boa noite abortistas!!! Cuidado com o empoderamento hem! não vão morrer com a agulha de crochê! Fica a dica!,0
Quando você tem dúvida se hj vai sair de sapatao trevosa ou hetero mocinha @user @user http,0
batalha no dia da mulher e eu nem lembrei burra meixmo deve ter sido top,1
"#SerMulherÉ ter condição de gerar uma vida dentro de si, ser biologicamente uma, sem essa palhaçada de 'transgênero _ http",0
"RT @user: sapatão raitella, tem como? tem http",1
RT @user: Cadê a caridade muçulmana? Emirados Árabes não recebem refugiados?,0
"“Bolsonaro não vencerá as eleições”, afirma Aécio Neves (zueira edition) AH TÁ... ps: assistam até o FINAL http",0
"Eu vejo quem torce pra Emilly e o historico de torcida é igual. Não tem gente feia, gorda. Nada fora dos padrões",0
Chegou a Quaresma! http,0
BOA TARDE MOÇADA QUALÉ A BOA DO SABADÃO? BEBEDERA ESTUDAR CHURRASCO TRABALHAR ARMAS DE FOGO IGREJA PROSTITUTAS 16:00 LINENSE X NOVORIZONTINO,0
DOMINGO 21:03 LIMPAR CHURRASQUERA GUARDA O REVOLVER PAGA AS PROSTITUTA TIRA DO SEXY HOT BOTAR NA REDE VIDA ESTA ENCERRADO O FINAL DE SEMANA,0
"RT @user: O problema com o Islão não é com etnia e sim com a ideologia, que visa destruir o Cristianismo! E eu me referi ao futuro, _",1
"@user @user a branca privilegiada vai trabalhar onde quiser, pois a cor da pele não vai impedi-la de conseguir um bom job :)",0
"@user Mulher apanha aqui na ilegalidade, porque se pegarem o canalha ele apanha ou vai preso!!! http",1
RT @user: BRANCO RICO COM PROBLEMA NA JUSTIÇA:  PODE TIRAR PHOTO SIM NEGRO COM PROBLEMA NA JUSTIÇA:  VERGONHA TIRAR SELF COM ELE _,1
"Já achava a ' Bela e a Fera' ,ridícula mesmo. Disney sai do armário:  ‘_A Bela e a Fera’_ terá romance gay... http",1
"...senta na mesa e pergunta p/ filho se ele já se masturbou hj, e ele pergunta como foi a transa dela e papai. Hipócritas! @user",0
"RT @user: Apresento-vos o meu missil, AEN17. Totalmente dirigida para Angola sem dó e piedade! Se Angola não é nossa, mais vale n _",1
RT @user: as fufas d lx são tão falsas q dói kkk,1
@user basta mostrar o externo,0
@user @user Ainda bem que eu nao sou um FEMINISTO (homem que defende feminismo)..eu defendo a mulher e _ http,1
O famoso 'não tenho argumentos' http,0
@user @user MENTIRA O BRASIL TEM DINHEIRO PARA AJUDAR REFUGIADOS QUE NUNCA CONTRIBUIRAM COM UM CENTA _ http,1
Polémicas? Disse o óbvio e com toda a razão. @user http,0
SIM É IGUAL A ABRAÇAR UM BARRIL #JOAQUINRESPONDE http,0
"Sapatão fala 'AAAAAAAAAA' de alegria, de aleluia kkkkkkkk http",0
#NaoAceitamosRefugiados A Imprensa preocupa-se tanto com refugiados mas nao lembra os cristaos perseguidos e mortos no Oriente Medio,0
"vcs sabem como minhas irmãs fazem para saber q estão grávidas? enfiam uma banana na xana, se voltar mordida é porque estão.",0
"Sapatão machista é uó. Pqp. Vai te tratar, mana",1
RT @user: 'Emirados Árabes querem ir a Marte e construir uma 'Dubai' lá até 2117'  -UOL  Por que não usam essa grana para ajudar os re _,0
Denunciem o Mala Cheia @user -> link direto pra página do facebook dele -> http,0
"@user qnd eu fui, ainda não tava essa crise de refugiados, mas tinha mt ambulante e pessoas q vc via que tava tentando sobreviver",0
"'Refugiado estão morrendo de frio na Grecia''. Que bom,pelo menos com o pau congelado eles n conseguem estuprar mais nenhuma europeia",1
Parabéns!!! Cidade de #Ariquemes na luta contra a ideologia de gênero.A sociedade se organizou para apoiar o... http,0
Definição de bom balneário http,0
"Preocupados com a espanholização da Banca? É mais provável haver concorrência entre um catalão e um cantabro, do que entre três angolanos...",0
@user @user refugiados que a imprensa não mostra http,0
@user Porque chamar 'idiota' não é 'xingar'. O prémio iliteracia está entregue,0
