text,label
Cuando no opinas como las #feminazis quieren sos acosador/abusador/violador.... 80% de las denuncias de mujeres victimizadas son falsas. #Femimoda [URL],1
Aquí Pedro hablando de solidaridad mientras sigue sin referirse a ls 22 guardias civiles q resultaron heridos tras el salto a la valla Ceuta [URL],0
"Me caí en las escaleras del metro, güera pendeja win.",0
"Aún tengo mis dudas porque dicen que un hombre es puto por estar con hombres, entonces, ¿una mujer es puta por estar con mujeres?",1
"#Espana , el lugar dónde gente que ha entrado #ilegalmente en el pais, a veces utilizando la fuerza, y que realizan actividades de venta ilegal, sin licencias, sin papeles de ningún tipo y saltandose todas las leyes, ¡tienen un sindicato!. Mientras, los #autónomos son machacados.",1
"Estoy escuchando el tema ""arabe"" y la verdad que mi culo se mueve solo✋🏼",0
[USR] dejá de provocar hijo de puta porque cuando se de vuelta la tortilla te vas a arrodillar llorando pidiendo clemencia y la presidencia del Bazofi,0
"Esa lógica confusa donde tu habla extranjera derrite mi Mexicana vida de no saber qué dices ... pero si voy espero no me contagien, o igual me pinto los chinos de Güero. (Es sarcasmo)🤭",1
EN TU CARA ZORRA,1
"[USR] me va a durar todo lo que yo quiera, callate zorra",1
[USR] Julia vos tambien sos hermosa la puta madre callate,0
"Tres indocumentados, narcóticos y armas fueron asegurados durante un cateo domiciliario en Calexico. [URL] #LaCrónicaBC [URL]",0
feliz cumpleaños franchute moracrema 💋💋💏❤️❤️❤️❤️❤️ [USR],0
Me recibes así para provocarme y que te folle cierto?eres toda una puta adicta a mi polla! [URL],1
Ya pinché puta cállate!,1
"si el Leonel hijo de puta no me quiere enseñar a tocar la guitarra lo voy hacer sola, y ni pija le pienso pagar al rata de mi tío",0
"[USR] [USR] [USR] [USR] Las mujeres son mujeres tengan polla o no, no son mujeres atrapadas en cuerpos de hombre ni hombres q se sienten mujeres, por dios que me están sangrando los ojos de leer tal pego. Y cuidao, que",0
"¡detende a los crímenes de Arabia Saudita y los Emiratos Árabes Unidos en Yemen! ¡Estos son crímenes de guerra y genocidio, simple y llanamente!",0
[USR] [USR] Cállate puta,1
Métete en tu vida negro indocumentado JAJAJAJAJJAJAJAJAJAJAJAJAJAJAJAJAJAJAJAJAJJAJAJAJAJAAJAJAJAJAJAJAJAJAJAJAJAJJA 😂😂😂👋,1
Mi novia es la mujer más hermosa que he visto en mi perra vida.,0
"O Panamá es muy chico, o tu eres muy perra.",1
"Pobre JP no se merecia ser traicionado de esa forma tan ruin y sucia, esa zorra que iba de enamorada pero luego lo vota traicio... — Pero si Ashley no iba de enamorada, JP era un perrito faldero de Chrissy así que nose donde ves q... [URL]",1
- ¿Cuál es tu problema? - Mi novia es tremenda perra !!! [URL],1
[USR] [USR] [USR] Cállate perra hppp mamerta,1
QUE SE QUEDEN EL DINERO Y LOS INMIGRANTES ILEGALES - La UE concede 3 millones extra a España para atender la llegada de inmigrantes [URL] vía [USR],1
"Pues este año, aparte del montón de moros de siempre, he visto una jartá de árabes",1
Deben darle cadena perpetua a todos los inmigrantes que lleguen a delinquir en un país donde le abren sus puertas. Y que paguen esa condena en ese país. No se puede morder la mano de quien te da de comer...,1
"Ojooooo que Adán la lía, en el autobús mientras celebraban la victoria, decía esto: 'Mi novia es sevillista, y es una puta más'",1
"[USR] tú eres la perra idiota y yo el viejo, okurr",1
Y mas verguenzas de estos negratas manteros [URL],1
[USR] [USR] [USR] [USR] Mejor tu cállate zorra que tú pides likes a tus fotos horribles en Facebook y está bien fea jajajaja 🤣🤣🤦🏻‍♂️,1
"Ecko en dealler de skilles dice corte que no quiere sonar en discotecas y despues saca temas como rompe y arabe, ¿en que estamos?",0
NO SE PORQUE NO EXISTE UN CONTROL FRONTERIZO CON COLOMBIA RADICAL TRANSEÚNTES Y AUTOS TRANSPORTE DE TODO TIPO ADEMAS TODO COLOMBIANO INDOCUMENTADO DEPORTADO  BASTA CARAJO,1
"[USR] Maldito hijo de perra... no sé por que no se fue por una puta letrina en su pueblo y se ahogó en mierda, como lo merecia.",0
¿Sabes lo que va a pasar? Yo lo veo muy claro. Pagaremos el pato los de abajo. Como sardinas de lata en la seguridad social. Las ayudas y becas colapsadas. Los manteros competencia desleal. Ya no tendremos sitio ni para recoger en las basuras.  [URL],1
Qué tan difícil es España cuando emigras sin papeles (por [USR]) [URL],0
"Si no me devuelven el follow LES VOY A METER EL DEDO PULGAR POR EL AGUJERO DEL CULO PEDAZO DE HIJO DE PUTA MERECES MORIR TARADO ahre, IGUAL SI",0
"Es que es de puta risa, os tendría que enseñar todas las transcripciones de los chats al soporte de Amazon, da para pelicula.",0
[USR] [USR] a saber que hijo de puta te la enseñaria,0
"Es una sátira... pero que está muy cera de ser realidad.  Tengan cuidado con los islamitas, porque poco a poco los van a conquistar ""pacíficamente"", y cuando reaccionen va a ser demasiado tarde.  SOLUCIÓN:  SACAR a todos los refugiados de España y de EUROPA, y enviarlos a ARABIA. [URL]",1
[USR] [USR] Callate la boca perra siberiana metiendo a CFK en esto! Sos tan pelotuda podes ser! Nunca seras nada,1
yo creoque mereces un castigo por zorra no? *con el cigarro en la mano*(md) [URL],1
"[USR] [USR] [USR] Exacto. Guarra y egoísta, que el que venga detrás se busque la vida.",1
"[USR] [USR] Emmm si llamar 'perra' a una MUJER es con cariño, yo me hago monje budista 😂😂",0
Allá que vayan las feminazis a reclamar derechos. Los árabes no están con webadas. [URL],1
"Cada población liberada, cada bandera izada, supone un duro revés para los intereses del imperialismo en #Siria🇸🇾. ¡Honor y gloria al Ejército Árabe Sirio! [URL]",0
"Dende Marrocos, o poeta, crítico de cine e activista Mohamed Abid. Acompañaranos neste V Poemagosto 2018 para achegar a beleza da poesía en lingua árabe.  No vídeo, gravado hai uns días no… [URL]",0
"[USR] [USR] Para ridículo, tú. Ojalá te peguen un buen repaso en la cárcel, que es lo que te mereces. Escoria.",0
[USR] Delicioso culo para montarte como te mereces deliciosa perra,1
