text,label
Pues que manden allí a todos esos que saltan la valla  de Ceuta [URL],1
Creo que los colegios que impartan el Islam debe de ser el mismo numero de co!egiosque en los países árabes  imparten el cristianismo.Que no somos más tontos porque no ensayamos [URL],0
Más de putos moros  [URL],1
"La forma que se me pegó la base de Arabe, la escuché 75 veces hoy. 🤦🏼‍♂️",0
[USR] [USR] CALLATE GORDA PUTA CONCHA SUCIA MAL TEÑIDA,1
"En su país, árabe, que desconozco ni me importa, habrá Pena de Muerte. De acuerdo, que la ejecuten según sus extrañas y repugnantes leyes. Por favor, salven a ese niño. No tiene culpa de nada. Es inocente y merece oportunidades. Dónde coño está la ONU, UNICEF, UNESCO y su farsa? [URL]",1
No sé dónde vives pero la delincuencia que he visto yo cuando he ido de vacaciones a Madrid y a Barcelona es absoluta vale y estos señores al no tener papeles se ven totalmente Internet de lo que les pueda pasar sin miedo total a la ley [URL],1
[USR] Güera de mi ❤️ Hoy es el cumple de [USR]  Le puedes regalar una felicitación 😍 la harías muy feliz😍,0
"Sobre el asunto del velo o el yihab de las mujeres árabes.... sólo diré una cosa.  ¿Se lo ponen por gusto? No, es una imposición. La cultura surge sola, no se impone. Por lo tanto, esas cosas de imponer lo que deben hacer las mujeres, no mola. Libertad, siempre libertad.",0
"Desde el New York Times y The New Yorker publicó por primera vez las acusaciones de acoso sexual y violación contra Harvey Weinstein por Rose McGowan, Gwyneth Paltrow, Ashley Judd y docenas de otros, el productor desgracia ha sido despedido de su empresa y fiscal d ...",0
"En Ceuta hay una montaña que simboliza todo lo que ocurre a ambos lados de la valla PERFILADA en la roca, con el busto... [URL]",0
"Mientras el común de los mortales padecemos una oleada violenta de musulmanes subsaharianos y una ola de calor 🔥 subsahariano abrasante, los proletarios [USR] y sus adlateres de vacaciones de millonario. Que bien viven los proletarios de hoy en día. #SanchezDimisión [URL]",1
"Trabajé 12 horas,me merecía tomarme el colectivo vacío y con aire. La puta madre",0
¿Qué hacen tantos subsaharianos de pie en la Plaza de #Lavapiés sin hacer nada? [URL],1
"— Yo soy respetuoso con los demás, sólamente les recuerdo lo que son. Y si son escoria no es culpa mía. ... — ¡Claro que lo sé! ¿¡Por quién me tomas!?",0
"No voy a enviar nudes de piernas, que los árabes dirán que voy incitando Si queréis verme las piernas, tendréis que verme en persona 👀",0
"Dios los cría y ellos se juntan,los sin papeles con los sin papeles [URL]",1
[USR] [USR] [USR] «El mejor y la mejor amigo o amiga del hombreo la mujer es el perro o la perra»,0
"Así como a muchos les encabrona que les digan negros a mi tambien me encabrona y doble que me digan güera, para mí no es un alago ni mucho menos superioridad",1
[USR] Tu eres el traidor hijo de puta... ubieras botado a favor de la vacancia..traidor.,0
No tiene ni puta idea de lo que pasa en Argentina pero tiene que hablar el tonto de la polla para decir tonterías [URL],0
[USR] bloquea a usuarios que le llaman PUTA. Él puede llamar puta a su madre pero nadie puede llamarle puta a él. [URL],0
[USR] Cállate ya Puta Belén ostia Tia das asco siempre berreando,1
"[USR] Ella es más bonita, tú eres más perra.",1
Por las mujeres tienen cuatro neuronas??? Una para cada fogon,1
¿Esto podría explicar el brutismo caribeño y el subsahariano? ¿Habrá correlación?  Extreme heat linked with reduced cognitive performance among young adults in non-air-conditioned buildings: [URL],1
"Ultra pendeja este ciudadano común, teatro le bajo pelotudis, esposelo y 6 horas al calabozo..   Vago indocumentado... [URL]",1
[USR] no u callate cono perra yana,1
"En estas noticias siempre me voy a leer el final.  Sí. Ahí donde pone eso de: ""...un individuo de origen MAGREBÍ...""  Y si no lo encuentro entonces sé que era SUBSAHARIANO.  #inmigración #InmigrantesNO #inmigrantes  #africanos  [URL]",1
-¿Por que una mujer se alegra al acabar en 6 meses un puzle de 4 piezas? -Porque en la caja ponia de 2 a 3 años.,1
[USR] Tú eres más puta jijijiji,1
candidato cd desarrollará plan para jovenes emprendedores.como vender aguacates.como ser indocumentado y violar la ley como vendo platano.como limpio parabrisas. Sin incubadora real de negocios con financiamiento;esto traerá peleas en semaforos de los emprendedores del aguacate,1
puta q odio la voz chillona d la perra d Spotify CÁLLATE POR FVAOR NADIE VA A PAGAR ESO,1
[USR] [USR] Si mi novia es sevillista es una puta mas eso ha cantado,1
"[USR] [USR] Tu eres tonto y no tienes ni puta idea. Todo el mundo sabia donde tenía que votar. El.que no fue es porque no quiso. O sea 2300000 personas y los 700000 que nos robaron los fascistas, pero como tenían miedo a la.democracia, prefirie",0
Ya pinché puta cállate!,1
[USR] Tu eres mas de Estar guarra,0
[USR] Callate pedazo de PUTA,1
Hermosa la clase de danzas árabes de las adolescentes y adultas lunes y jueves 19hs. Te esperamos!! — at Escuela de Danzas Soraya - Malvinas Argentinas [URL],0
[USR] [USR] Pero qué dices de hatear? Si no tienes ni puta idea cállate,0
"[USR] CALLATE ASESINO HIJO DE PUTA, EL ARA DESAPARECIÓ POR TU CULPA, MALDITO SEAS POR TODA LA ETERNIDAD!!!!!!",0
"Puta de su madre..... Que esta mujer es RECONTRA imbécil y tenemos que pagarle con nuestros impuestos... Le hacen saber que su JEFA SAMURAI recibió dinero SUCIO y ella se convence mas, que tienen que LUCHAR CONTRA LA KORRUPCION ... SACATE LA MIERDA DE LA CABEZA... MUJER [URL]",1
"Asi es nuestro periodismo! Dais asco!No mereceis q os llamen profesionales! “Golfa, perra”: el último testimonio pone al padre de Diana en el disparadero //www.esdiario.com/725804060/Golfa-perra-el-ultimo-testimonio-pone-al-padre-de-Diana-en-el-disparadero.html vía [USR]",0
Esto si que debería de preocuparnos y la no la  inmigración. [URL],0
#caballos: Descubre uno de los secretos mejor guardados de la #URSS...  ...los 🐎 árabes rusos!!!  [URL],0
[USR] Jajaja callate que vos tampoco te quedas atras zorra,1
[USR] [USR] JAJAJAJAJJAJAJAJAJAJJAJA CÁLLATE PUTA,1
"Ancianos y pastores de la MACO refugiados en la Roca Cristo Jesús para cumplir la Gran Comisión de ""hacer discípulos"" #DiscipulAR #CRM #Mendoza [URL]",0
[USR] ¿Para que me sigues maldita chavista hija de puta? Sal de mi TL perra asquerosa. Tu eres culpable de la desgracia de Venezuela. Mil veces maldita tu y toda tu generacion,1
"Todos los pueblos! TODOS!! Tienen Dcho a la LIBREDETERMINACIÓN ! Que a estas alturas, tenga que aguantar a un Chileno indocumentado que,  viniendo de donde viene, pretende negarme mi legítimo Dcho a la LIBREDETERMINACIÓN, es el ACABOSE! El colonialismo de proximidad tb se acaba",1
Emiratos Árabes Unidos crea un Ministerio de Inteligencia Artificial. Conoce cuales son sus planes de gestión aquí vía [USR]  [URL] [URL],0
[USR] 52% de Catalanes quieren que te calles la puta boca,0
"Eloy se durmió con la canción árabe de papichamp y ecko, ke mierda",0
Por eso todos nos odian. Nos vamos a ganar una fama de choros así como los árabes de terroristas jhajasja t.t,1
A los mexicanos que cruzaban a EEUU les llamaban espaldas mojadas A los guiris que vienen de veraneo a España les llamamos espaldas quemadas,1
"Los peronchos nos quieren enseñar a gobernar , hijos de puta",0
"-Mamá, mamá, ¿por qué la novia va vestida de blanco? -Porque es el día más feliz de su vida. -¿Y por qué el novio va vestido de negro?",0
"La frase de acoso sexual, que nos lanza el gobierno todos los días... [URL]",0
Guarra se folla a Papá Noel en un autobús [URL] [URL],0
"Antena 3 saca de seguido noticias de manteros peleando, el vídeo los terroristas de Cambrils y el flujo de inmigración. ¿Nos querrán dar algo a entender? 🤔 #Antena3noticias",0
yo - me picó un animal wey. mi hermana - te lo mereces por zorra.,1
[USR] jajajajajaja si tu eres una perra EL SIEMPRE SERÁ CABRON,1
[USR] Tú eres un hijo de puta y tú madre bien lo sabe.,0
"[USR] Oye callate que si te molesta pues no mires el chat y deja ya de llamar la atención guarra, mi Instagram es trussypussy25 chavales",1
"Tener una discapacidad visual no es impedimento para bailar danza árabe. Paola Román, Indira Pereyra, Iara Viñals integran el Ballet Ashaki Hafsa y junto a su Prof. Evelyn Baigorria nos demuestran que cuando hay... [URL]",0
[USR] [USR] [USR] Cállate vo si Eri mi perra,1
"[USR] Imbecil, sigue de zorra en zorra no mas amigo porque ya la cagaste y no hay vuelta atrás",1
"[USR] Y tu eres la amiga perra que me lo va mamar a espaldas de ella, estupida",1
Cuando publicas basicamente lo mismo pero sos una sudaca injunada :(( [URL],1
"Es empoderamiento, más de miles de mujeres le prohíben mostrar su cuerpo, por más de que acá no pase (como por ejemplo en los países arabes) hay casos de celos extremos en los cuales la pareja hombre obliga a taparse a la mujer en cualquier caso, o son criticadas por mostrarse [URL]",0
"Que tan hijo de puta tenes que ser, que tan enfermo tenes que estar para hacerle daño a un animal. Te mereces la peor de las muertes.",0
"No fue acoso nada más, fue intento de violación a un menor de edad. 😫 Todo lo que dice Marta Lamas bien lo pudo haber repetido un machiprogre y abre la puerta a que usen su opinión 'calificada' para justificar abusos. [URL]",0
"[USR] A ver también te digo que no es por hacer acoso, que es por violacion y asesinato xddd",0
Pues el remake de Alf que parece que están preparando tendría mucho sentido si la familia es hispana y sin papeles.,0
#EsMuyDeProVida rezar frente al congreso. No nos olvidemos que marchar es de negro indocumentado,1
VAAAAAAMOOS FLORENCIA VIGNA LA PUTA MADREEEEEE! SOS UNA AMOR DE PERSONA Y TE LO MERECES MUCHO MUCHO💛💛💛💛💛💛,0
"[USR] tú eres la perra idiota y yo el viejo, okurr",1
[USR] Nos turnamos para enseñarle la polla a Granados en el comedor.,0
"Es súper de pueblo decirle güeros a la gente de tez blanca aunque no sean rubios. Los güeros son así ➡️👱🏻‍♂️👱🏻‍♀️. Estos➡️ 👩🏻👦🏻 no son “güeros”, no mamen❌🙅🏽‍♂️",0
"Dos marroquíes y un filipino, puñalada incluida, todo esto en el Rabal ( Barcelona ) los vecinos piden más presencia policial, digo yo, no será mejor pedir menos presencia de inmigrantes ?",1
Cuando te dicen que tu mujer es una perra!! [URL],1
Me re estresa ser tan hija de puta pero a ver viejo de mierda cállate que quiero dormir,0
"PFFFFFFFT. Ya wish, güera.",1
"Jorge Vestrynge: ""Aquí no vienen cabreros, sino gente emprendedora, valiente, y con formación profesional como mínimo"" Que corra el vino que vinen ingenieros por la valla de Ceuta 😂😂😂😂",1
[USR] [USR] Dale zorra cállate,1
"[USR] Disfruta tu evento!!Nosotros te lo organizamos, banquetes, taquizas, menú a tiempos, tacos árabes, pastas, bar de ensaladas, waffles bar, etc con gusto te atendemos 5554383714 [URL]",0
"Estoy a un solo cliente que no me diga ""gracias"" de irme a la frontera de Ceuta con Marruecos, sentarme en una mecedora en la valla con una escopeta y decir ""Ahí vienen los podemitas, HOY NO PASÁIS, NEGROS""",1
¿por qué Dios hizo a las mujeres con los pies más pequeños? Para que puedan acercarse más al fregadero.,1
Finales de 2017 y yo todavía no entiendo cuando una mujer es “puta” o “trola”🤷🏼‍♀️🤦🏻‍♀️,1
[USR] CALLATE IMBÉCIL. LA GENTE MARCHA CONTRA EL GOBIERNO HIJO DE PUTA QUE TENEMOS 😒,0
El capitalismo necesita gente sin papeles para sostener la precariedad laboral. Urge un verdadero y fuerte plan desarrollo rural. Hay muchos pueblos abandonados y otros en vías de serlo. Hay sitio y riqueza para todos. Hay que organizarse,0
"¡JODER, QUE TE CALLES PERRA!",1
Palestino indocumentado,1
"Espera,que me puedo morir ya😍😍😍😍😍😍😍😍😍😍😍😍😍😍😍😍😍 Soraya cállate de una puta vez, y sé feliz.",0
qué temazo arabe de ecko ahre,0
Cc tu novio es güero y le hablan en inglés 😂❤️,0
"¿Sabias qué?  Randy Ebright baterista de [USR] escribió ""Frijolero"".  En un viaje qué tuvo hacia Houston, Texas su hija sufrió discriminación en el aeropuerto lo que llevo a Randy a componer Frijolero.   [URL] [URL]",0
[USR] callate zorra me amas,1
[USR] [USR] callate la puta boca y vete a una biblioteca buscas una seccion donde haya feminismo y te quedas callado y lees y dejas de soltar gilipolleces comparable a la tierra es plana en cuanto a retroceso en los debates,0
[USR]  2 VENEZOLANOS SORPRENDIDOS ROBANDO ESTAN  EN LA CASA DE PAZ NOCTURNA DE CALIDONIA SIN PAPELES MIGRATORIOS DONDE ESTAN LOS INSPECTORES DE MIGRACION EN ESTOS MOMENTOS? LOS 2 LADRONES VENEZOLANOS EN ESTE MOMENTO ESTAN EN LA CASA DE PAZ NOCTURNA DE CALIDONIA,1
"Para convivir con prietos me gusta imaginar que son jeques o algo así,  algún árabe millonario. Así no siento que me traiciono. El amor al dinero siempre vence un poco  mi racismo.",1
"[USR] [USR] Para ridículo, tú. Ojalá te peguen un buen repaso en la cárcel, que es lo que te mereces. Escoria.",0
Por mamadas como estas nos odian odian a los güeros. [URL],1
Deben darle cadena perpetua a todos los inmigrantes que lleguen a delinquir en un país donde le abren sus puertas. Y que paguen esa condena en ese país. No se puede morder la mano de quien te da de comer...,1
"[USR] [USR] [USR] [USR] Se merecía de puta y no quiere que le metan la verga, jajaja no mamen",1
ven hijo que te voy a enseñar la ciudad. aquí está la PUTA GENTE!!!!,0
Matt Damon critica campaña contra el acoso y la violación sexual - La Prensa de Honduras [URL],0
NO A VER CALLATE VALE ME CAGO EN LA PUTA SIGUE Y CALLATE VAMOS ESCRIBE BASTA DE DOLOR EN EL PECHO [URL],0
"Esta invasión continuada de subsaharianos,no se cuanto nos cuesta,imagino que cantidades astronómicas. Por qué no empleamos esta pasta en hacer que vuelvan los españoles que tenemos por el mundo, médicos,investigadores,y demás profesionales.",1
Ya no soy güero 😝,0
"#En8Años vendió el país a los árabes, le dio la espalda a la paz... sigo? [USR]",0
"[USR] esto es una invasión africana, Salvamento Marítimo como cooperador necesario y oneges ni te cuento, de que viven??. Nadie denuncia que van a por inmigrantes a aguas marroquíes. Vaya futuro tiene España",1
"Claro, este fallo es culpa de Podemos y psoe porque todos sabemos que Antena3 apoya muy fuerte a Podemos. Las cagadas de palomas son un problema de la izquierda, como la gripe y la ola de calor. Ha sido entrar el PSOE y calor subsahariano, casualidad? Cuanta tontuna por dios. [URL]",0
En las últimas 24h varias peleas callejeras en ceuta por parte de los últimos en saltar violentamente la valla. Y el gobierno pide respeto???,1
[USR] Llevar esa prenda de vestir puede suponer un riesgo de muerte para toda la gente que esté en un radio de 30 m de esa persona.,0
Mi prima está esta mirando el partido y le dije q iban a perder y me dice CÁLLATE HIJA DE PUTA q amor,0
todos esos ãrabes son del barsa  xD [URL],0
[USR] [USR] [USR] [USR] Sería para partirse la polla si ahora yo pongo que todas las mujeres son basura.,1
"si no hay chicas mañana saldremos a violar jóvenes de aquí...(hahaha) esto no es un comentario de la ""manada"" . Es un comentario en un CiE de inmigrantes que han saltado ilegalmente la valla.  Ver este video [URL] [URL]",1
"Estos son lo pobrecitos refugiados de Carmena, Ada Colau y Pedro Sánchez. A ver que dicen, cuando empiecen a matar y violar como ya han hecho a las mujeres de aquí. [URL]",1
"La muerte, puede llegarte en cualquier momento y en cualquier lugar, acá en el norte. Aquí solo eres carne. Y en Estados Unidos junto a los malditos israelitas con mayor razón, esos culeros son como los alacranes güeros, se traicionan entre ellos a gran escala, como en 11/09",1
Uno de las recetas que mas me gustan. [URL],0
Yo solo estoy esperando el momento en el que dj Alex suba el remix  Arabe de Ecko y Papichamp,0
ni laurita ni fede ni florencia jEY MAMMON SE MERECIA GANAR EL BAILANDO LA PUTA MADRE,0
"Perdón por la hora, pero me desperté pq soñé que era la güera de Locomia y salía en Siempre en Domingo .. se me fue el sueño: VALE MADRE...",0
Me conocen porque siempre estoy en modo arabe,0
"Q ministra d ""Lo Que Falta y Lo Que Sobra"" (Trabajo y Migraciones),diga q ve n Casado y Rivera tendencias ""racistas y xenófobas"" x visitar Ceuta es como si yo digo q Sánchez e Iglesias lo son x no tener inmigrantes dentro d la valla d Moncloa o d La Navata [URL]",0
"Porque andan llamando gata, zorra o puta a baekhyun si es hombre, manga de ridiculas",0
"La ""marcha negra"" acelera el paso: más de 40.000 subsaharianos esperan en Marruecos para entrar ilegalmente en España [URL]",1
[USR] Que te calles puta parguela xd,1
.... Que Tu Eres Bien Puta ------ #CamilaVallejo - [URL],1
"[USR] Jajaja callate gila, inviame y voy perra !!",1
"2018 será mi perra y no me voy a quedar callada como otras personas, ya basta, guarden éste maldito tweet.",0
[USR] ah callate puta,1
Hasta para enseñar el culo hay que ser perra.,1
"Aquí podemos ver un grupo de simpáticos moromierdas, basura de la que a [USR] le gusta tanto recoger del mar. Como se puede apreciar están totalmente integrados en la sociedad europea. ¿Son o no son como monos salvajes, sucios, delincuentes, violadores y pendencieros? [URL]",1
[USR] Puta = Jaque mate,1
yo me pregunto como es el teclado de los que escriben en arabe,0
"Estamos en un Estado de igualdad, no? Para cuando la escena de un hombre que diga, 'busco a una guarra para poder fornicar como un loco despechado hasta nuevo año'? No es esto una descarada y funesta forma de incitar el incorrectismo coyuntural y los falsos modales? [URL]",0
"[USR] los Chinos tienen las mafias de los abastos y contrabandistas de mercancías, los rusos drogas y trata de mujeres, los africanos manteros e incursionan en drogas, llega un hijo de emigrante español con título profesional, con sus documentos y es un sudaca.",1
"Que mierda tienen en la cabeza cuando creen que una violacion o situacion de acoso que les estan contando ES MENTIRA????? O sea,son joda gente",0
"Como me matas cuando te mueves así de lento, siento todo el recorrido y la presión de tu coño alrededor de mi polla, acaricias mi pecho, sientes mi respiración agitada, me voy a correr nena [URL]",0
"Algunas mujeres se quejan tanto del acoso, pero ahi tienen fotos enseñando y/o sacando el culo 🙄😑",1
"De periodista a mesonero, la terrible historia de un inmigrante venezolano en Aruba [URL]",0
"[USR] [USR] [USR] Reverendos hijos de puta, dejen de provocar a la gente!!!",0
mi novia es una puta merienda😍🤯😛💦,1
"Zapatero, el hijo de puta que incluía Canarias en un mapa como si perteneciera a Marruecos, habla con su amigo Mohamed VI, el rey de los moromierdas, para ultimar la visita oficial del traidor y okupa monclovita ⁦[USR]⁩ a Morilandia. [URL]",1
"En que se parece una mujer a un cientifico? En que al cientifico le pasan cosas por la cabeza, y a la mujer le pasan cabezas por la cosa",1
"Dijo que mucha mierda hablas, acaba y comemela antes que llegue mi mama.",0
"[USR] [USR] [USR] [USR] Pues eso, cállate la puta boca.",0
[USR] No hay que enseñar a los estafados por los bancos como no quedarse en la puta calle. Sus empleados deben saber practicar banca etica.,0
"Haced una encuesta, a ver qué pensamos los españoles de los inmigrantes? Seguro que el resultado no os gusta.Estamos saturados, hay calles dónde ya te sientes tú  el extranjero. Esto se ha ido de las manos, y con las ayudas que reciben más van a venir. #PdV06A",1
La puta madre el amor que siento por mi novia es increible seguro me muero de diabetes [URL],0
"Muchas personas creen q una mujer es abusada o acosada por ir muy descubierta, pero yo he visto acoso a mujeres por lo contrario también, mujeres cuya religión o creencias son otras y son acosadas por eso. Eso demuestra q hay un standard tácito d mujer, y q se espera sea cubierto",0
"Acoso, violacion a la integridad de una persona, está siendo utilizada una persona para satisfacer el morbo de cientos , cochinada de canal doble moral [URL]",0
Sigan haciendo experimentos con sudacas [URL],1
"[USR] JAJAJAJAJAJA El multitasking es lo de hoy: Perra en Instagram, emo en Twitter, ridículas por Facebook y divas en WhatsApp, todo a la misma vez y sin mezclar historias.",1
"Pañuelos #Arabes #Shemagh #Kufiya #Hatta de 1,10 x 1,10mts en algodón de excelente calidad. Color #Arena #Sand [URL]",0
Lo tuyo y lo mio no es oficial pero tu no eres cualquier puta tu eres especial.,1
Dia 2  Estos gabachos cómo pueden vivir sin chilitos serrano en casa ? 😢😣: me siento incompleta,0
[USR] YO CREO KE LA MUJER ES UNA ALTA ZORRA....!!!!,1
[USR] Cállate Perra! 😙,1
"La vez que me niego a enseñarle a usar ig a mi mamá me dice: - Yo te enseñé a usar una cuchara puta de mierda! Siempre te la llevabas al ojo, ibas a quedar tuerta!!! Jajajajajajaj",0
"[USR] De hecho, tanto, que puedo decir que con Franco eso no pasaba.",0
"[USR] [USR] No, eso no es verdad, soy yo el que sufro acoso, tu eres el psicópata",0
Nivel 4 reforzado es igual a recoger 400 inmigrantes cada día . [URL],1
[USR] Tú eres hijo de puta no de Dios,0
El acoso cibernético y la violación a la intimidad son faltas graves. #DENÚNCIALO,0
- ¿Te sabe a fanta? - ¿El qué? - Mi polla en tu garganta. — claro y antes la metes en una naranja por qué no [URL],0
"[USR] [USR] Tu eres más de manifestarte con nazis sin reparos como el Vlaams Belang, hijo de una perra sarnosa y cien mil padres distintos, desconocidos y sifilíticos. Puto nazi. Escoria. Purria. Pedazo de mierda.",0
Tipico : si una chica no le cae otra chica es por que para la otra es una PUTA 😂 pero solo por que no le cae bien,1
"que no¿? por que eres tan puta zorra mentirosa¿ cualquier user chica es mas juguetona que tu, puta monja — Bueno, suele pasar yo no busco ser juguetona ^^ [URL]",1
[USR] Los musulmanes no tienen ni puta idea de lo que es una mujer. Para ellos las mujeres son esclavas.,0
"soñé q le decía a simon poxyran q su novia es re linda y q estoy enamorada de juan, la re puta madre si tan solo fuese real 💔",0
"[USR] Callate hijo de puta, si vos apoyás el proyecto violento de la derecha",0
"¿Qué pasó con Mesut Özil y la selección alemana? ¿Es algo que pasa solamente en Alemania? Algunas claves sobre el odio xenófobo y la inmigración en Europa, partiendo del caso del mediocampista del Arsenal.  [URL] [URL]",0
Mami puso una emisora con canción árabe y siento que en cualquier momento vamos a explotar.💣,1
[USR] Tu eres mi lady zorra barata,1
"🤣🤣Su tierra tiene un 60 % aprx , de árabes , argentinos  y demás emigrantes , ........mas los españoles que estamos a la par con ellos , que rondamos el 20 % La RAZA BLANCA EN EXTINCIÓN Y LOS PAYASOS DE COTILLÓN ya Mismo  veréis a vuestros hijos haciendo el RAMA DAN   CATALÁN [URL]",1
"Cada población liberada, cada bandera izada, supone un duro revés para los intereses del imperialismo en #Siria🇸🇾. ¡Honor y gloria al Ejército Árabe Sirio! [URL]",0
[USR] Puta madre coño cállate !,0
LA PUTA MADRE POR FINN CHIELLINI PURO LOCO GRACIAS BENATIA TE MERECES EL PINCHE CIELO #ForzaJuve Vamos Juventus,0
[USR] [USR] Lo peor que ni da ni puta gracia LoL tu eres él único subnormal que le mira cara de eso pinche meco que le qlea,0
"Puse arabe en la previa. Cami me dijo, SÁCAME ESTO YA QUE HORRIBLE, pero en el baile le dio hasta abajo como si no hubiese un mañana...",0
"Fui buena con un montón de personas que no se lo merecian, a partir de hoy voy a ser mucho más hija de puta con todos",0
"Maldita perra desalmada, el sufrimiento te lo merecías tú 😡😡",1
"La otra no noticia del día es la visita del sonriente Casado a Algeciras, a visitar en Ceuta y Algeciras, no a los guardias civiles heridos tras la violenta entrada de ilegales del otro día, sino a un grupo de subsaharianos que han entrado en nuestro país de forma igualmente ileg",1
este tipo es un complice d todos estos años d bobolucion robolucion ahora ve al corrupto andres Izarra y no ve todos con los q anda desde los q estan en VTV y telesur q se robaron las antenas de RCTV toda familia d chavez maduro la cuerda arabes hijo de putas q controlan el pais [URL],1
"A ver si te enteras [USR] que el árabe y la cultura marroquí nos importa más o menos lo mismo que tú, una mierda!. Aprende en tus ratos libres, que son muchos, lo que te plazca pero deja a los niños en paz. #SanchezDimision #SanchezVeteYa  [URL]",1
Indios hijos de puta. Soltad al gabacho😂,1
Impresionantes y terribles imágenes.   [URL],0
"[USR] [USR] Bueno tú eres su perra, no yo.",1
Pura locura estos arabes! #garage507 #drift #sports #carlife #carvideo #4x4 #toyota #crazy #stunts #panama [URL],0
"-¿Aquí es la oficina de atención contra el racismo? -Claro que sí, pásele pinche indio prieto sarrapastrozo ahorita lo atendemos, primero que pase el güero.",1
"Me caga la pinche gente que por ser güeros, se creen un chingo ¿O ustedes que opinan, ponches prietos?",1
"Realidad Paralela / Universo Alternativo, que se yo!!!!  Hoy en el dia según un atentado contra el informe indocumentado (Nico), pero en la noche fotos en redes sociales bailando en Copas, Altamira Village, hasta en... [URL]",0
"Callate ya guarra anda, que das pena, aparte de fea tu comic ese es una puta mierda, te lo comprarán por pena porque es feisimo — Uyyyy los 12 años cómo se notan... Qué pasa, que estás rebotao porque anoche tus papis no te deja... [URL]",1
[USR] [USR] Pero tu eres una perra sucia,1
[USR] Espera apenas estoy en el primer cap cállate ya la puta madre,0
