text,label
"RAOUL OLE TU COÑO, TU POLLA, WATHEVER. HIJO MIO QUE BIEN LO HAS HECHO Se va a mear en Cepeda el Lunes al igual que los demás expulsados hicieron contra Cepeda. #OTDirecto14D [URL]",0
"[USR] [USR] Las hijas de puta no son conscientes que se les va a acabar enseñar las tetas en capillas/mezquitas, robar desnudas niños Jesús, procesiones del PUTO COÑO.....",1
[USR] Tu eres mi perra no te dare unfo,1
Rusia ha confirmado que ha enviado a USA una oferta de #cooperación para solucionar la crisis de #refugiados sirios y el desminado de las zonas recién despejadas de presencia #yihadista en la república árabe 👏🏼👏🏼  [URL],0
"[USR] Cállate Tilinga atorranta vergüenza da q x ser hija de puta,digo de montonera ocupes un cargo de diputada",1
"Vamos a ver:   Es cierto que los que tratan de saltar la valla de melilla o cruzar el estrello viven una mala situación. Es cierto que no son culpables de dicha situación, y es nuestro deber prestarles toda la ayuda que podamos.",0
"[USR] Hay que ser un verdadero imbécil para hacer 'bromas' con un asunto tan serio como el acoso callejero, y encima se creerá gracioso y todo pfff",0
[USR] Cállate loca todo el año fue al revés puta,1
"He sentido envidia, con que justo, se la ""dado"" al moromierda. [URL]",1
"l #InformateEnHolaChile LOS RESEPONSABLES DEL INGRESO AL PAIS DE TANTOS INMIGRANTES DEBEN HACERSE CARGO DEL LOS PROBLEMAS DE SALUD DE ELLOS PORQUE ACTUALMENTE HAN VENIDO A AUMENTAR EL GRAVE PROBLEMA DE ATENCION MEDICA DE  CHILENOS ,OCUPANDO LAS POCAS HORAS DE ATENCION Y RECURSOS",1
Estos árabes le andan metiendo duro a la publicidad de sus canciones en YouTube.,0
[USR] Te fuiste a las 3 hijo de puta callate,0
"La #Arandina leerá un manifiesto el sábado para mostrar su repulsa a la violencia y contra los abusos sexuales al hilo de las denuncia contra tres de sus ya exjugadores, uno de ellos berciano. #Bierzo [URL] [URL]",0
En un descuido y los güeros estén detrás de todo esto! [URL],1
[USR] [USR] [USR] [USR] [USR] Tu eres solo mia zorra >:'v💔,1
"Lamentables provocaciones' és la concha de tu madre, hijo de puta [URL]",0
Esta página les puede decir si alguien del cast o crew de una movie ha sido acusado de acoso sexual o violación - - - > [URL] 💜,0
Aaaa les quería enseñar estas fotos del sábado que me sentía bn perra [URL],1
#VOX critica duramente a ⁦[USR]⁩ “Les da la bienvenida como si fuera un cartel del welcome de #Carmena “ ¡Expulsión inmediata de moromierdas!  [URL],1
"[USR] Tu en tu amplia sabiduría, defineme cuando una mujer es perra",1
[USR] Espera apenas estoy en el primer cap cállate ya la puta madre,0
Güera Güera... 🙄🙄😍,0
"Te gustaría participar en una peli porno? buscamos tu perfil, una tia guarra con ojos bonitos y no muy guapa — Hostia, no te has esforzado mucho, sigue intentándolo [URL]",1
"Estimado [USR], los catalanes no tenemos genes franceses. Los tenemos alemanes y tú eres un hijo de puta. Documento cedido por el Institut Nova Historia o como yo los llamo: 1984. La imagen es una coña, lo hijo de puta que eres, no. [URL]",0
"[USR] Pollaícas = polladas, tonterías, sinsentidos 😂😂",0
El vicepresidente de la Diputación de Alicante se disculpa tras pedir «deportaciones masivas» de inmigrantes [URL],0
"#Espana , el lugar dónde gente que ha entrado #ilegalmente en el pais, a veces utilizando la fuerza, y que realizan actividades de venta ilegal, sin licencias, sin papeles de ningún tipo y saltandose todas las leyes, ¡tienen un sindicato!. Mientras, los #autónomos son machacados.",1
[USR] Tú eres mi favorita perra 😪,1
Otra puta injusticia.... Raoul grande Te mereces lo mejor #OTGala8,0
Como odio la gente impuntual la puta madreeee y tu chica es impuntual encima,0
[USR] [USR] Ojalá mandemos a África cientos de barcos con esta gente y traigan indocumentados en su lugar.,0
"Mira IMBÉCIL y okupa ⁦[USR]⁩ ¡Menudo cachondeo! Los #MoroMierdas que acoges se van de vacaciones a sus ""peligrosos"" países con las ayudas que les das. NO ES UNA CRISIS HUMANITARIA, ES UNA INVASION DE JETAS, DELINCUENTES y VIOLADORES. [URL]",1
CÁLLATE ASQUEROSA PUTA DE MIERDA ZORRA [URL],1
[USR] JAJAJAJAJAJAJAJAJAJAJAJAJAJAJAJAJAJAJAJAJAJAJAJAJAJAJA LA PUTA MADRE TE LO MERECES POR USARME COMO MEME SIEMPRE,0
"En Brasil creen que soy europea. Mi vidas, si tan solo supieran que soy mas sudaka y pobre que ellos",1
"#MercadoAXEM 🇬🇹 Por un problema de papeles el veterano arquero de 43 años Carlos Díaz no arregló su llegada a Uruguay de Coronado. Sin embargo, ya consiguió club. Su próximo destino será Rosario FC de Guatemala, que dirige Emiliano Barrera. [URL] [URL]",0
"A ver,en serio algún tio cree que por enseñar su polla tendrá la atención de alguien? Yo,desde luego no... [URL]",0
"[USR] JAJAJ hay pam enserio te amo millones jajaja muy perra ' me tomas la foto enseñando las croquetas, probamos y nos despedimos' muy perra en mandada jajajaja",0
"Me sigue Banda de estudios y pibas de arabe a mi página, no se pq pero venga",0
"[USR] [USR] [USR] [USR] Así se cuida el patrimonio en Arroyomolinos. Vestigio de la fortaleza árabe Calatalifa sin protección, señalización... Qué triste! [URL]",0
"[USR] [USR] Si hay diferencia, si es tu conocida y sabés que no le va a molestar no es acoso. Cualquier cosa fuera de eso es acoso. Fin.",0
Decirle la verdad en la cara a un idiota y que esa verdad le duela tanto que llegue al punto de pegarte un puño es de las cosas más satisfactorias que hice esta semana. #SorryNotSorry.,0
"Pues este año, aparte del montón de moros de siempre, he visto una jartá de árabes",1
“Nena tú eres de lo más linda. Tienes cara de puta” QUEEEEEE JAHAJAJAJAJAJAJAJJAJAJAJAHAJAJAHAHAHAHAHAHAJAJ,1
No entiendo por que nunca me puedo quedar callada cuando me dicen algo la puta madre siempre tengo que insultar😡,0
"Jugamos de polla, no tenemos arriba a nadie que remate una pinche bola y nos vienen diciendo que es culpa de los árbitros y de que no quiere entrar. Mira yo me cago en vuestros putos muertos desgraciaos",0
"[USR] [USR] Bobo hijo de perra, usted cree que va a enseñarle a Messi o llega a aprender del más grande?",0
Y pensar que la perra desgraciada me muerde cuando trataba de enseñarle trucos o a saltar la cuerda. ;_;,0
"Que cuza antes la calle, una mujer inteligente o una tortuga vieja? Una tortuga vieja porque las mujeres inteligentes no existen ...",1
[USR] HIJA DDE PUTA TE LO MERECES POR TOFAS LAS VECES QUE LO HICISTE,0
Aveces me pregunto si a esas chavas no les enseñaron algo de valores.... vestirme como puta actuar como puta y llamar la atención está cabron....,1
Hoy los tuve que soportar a mi viejo y a mi vieja justificar el acoso callejero porque según ellos 'se lo buscan al vestirse así'. Vergüenza me dan,0
"[USR] [USR] Yo también creo que tú eres una mala puta y también me quedo corto, además de mal educada...",1
Quién soy yo para faltar el respeto a alguién por enseñar una teta o una polla. Más asco me da juzgar a la ligera y ponerme a faltar el respeto,0
yo creoque mereces un castigo por zorra no? *con el cigarro en la mano*(md) [URL],1
"28: te amodio, odio a la perra de tu amiga ☺️☺️pero tú eres mi vida *tijerazo*",1
Cuento las horas para ver a mi mamá y a mi güero.,0
"Ni perra , ni puta, ni zorra nada de esa mierda LA MUJER ES MUJER Y SE RESPETA ASI TENGA MIL NOVIOS Y SE DIVIERTA CON ELLOS COMO SE LE DE LA HPTA GANA :) (Y)",0
[3/1 03:47] Aa Brii: Boluda mira vos [3/1 03:48] Aa Brii: Sos re zorra y casi no t nombran Lo bueno de hacer las cosas callada 😏😏,1
[USR] En tu culo. Es mi polla.,0
"esq una polla, las mujeres son to celosas callaros ya [URL]",1
Cállate madre perra culiá maraca conchetumare hija de la Daniela Chávez que tiene las panderetas de la zorra colgando. Saludos cordiales. Beso en el poto que te rompemos año a año en La Ruca 😘 [URL],1
"[USR] Es más, a mí debería importarme una puta mierda que tú por la playa vayas enseñando el rabo. Es asunto tuyo.No mío. Ni de nadie más. De la misma forma, si tú usas tu desnudez PARA TRABAJAR, es asunto tuyo. Y si yo quiero verte en pelotas,",0
Cómo me atraen las güeras 🤤,0
alguien me puede avisar donde consigo un teclado en arabe-,0
#Noticiasdelalinea: Detienen en Guatapanal motocicleta y nacional haitiano indocumentado [URL],0
Qué ridículas la puta madre me da sarna leerlas,1
"La gente inmigrante que ha entrado en España de modo legal y se integran en nuestra sociedad se les llama personas de color.  Los ilegales que entran por la valla atacando a nuestros agentes, delinquiendo y agrediendo a nuestros ciudadanos son NEGROS  e islamistas sin adornos!!!",1
"[USR] dani no alcancé a escuchar porque te habían revisado en los Emiratos Arabes, son también estrictos? Queremos viajar para allá y me gustaría saber 🙏🏻",0
[USR] si a mi me dicen mardita hubiese dicho 'yo si mi amor' como una real perra pero tu eres nula así que te prestare mi tarjeta para que te compres una personalidad,1
A mi amigo le dijo PUTA pero él no deja de enseñar el pito en Twitter! 🙄,0
Lo único bueno de este día son las empanadas árabes que está haciendo Cristina en este preciso instante.  Día del orto,0
"[USR] CÁLLATE PERRA, HIJA DE PERRA, SOS UNA PERRA",1
"[USR] Que te calles la puta boca, que tu existencia me repugna, gilipollas",0
Dimisión ya  [URL],0
"Desde el New York Times y The New Yorker publicó por primera vez las acusaciones de acoso sexual y violación contra Harvey Weinstein por Rose McGowan, Gwyneth Paltrow, Ashley Judd y docenas de otros, el productor desgracia ha sido despedido de su empresa y fiscal d ...",0
Yo veo a mujeres destruidas por acoso laboral y callejero. Otras con depresión debido a violación sexual o maltrato físico. Y conocí a varias que se suicidaron por este tipo de comportamientos machistas. Vas a seguir con tu show pobre? [URL],0
[USR] [USR] [USR] [USR] [USR] Coño eso parece un lobo xdios..donde esta el lazo del pelo ehhhh 😈😈😈😈😈,0
Pq la canción esta bien puta y tu eres tan puta que la cambias [URL],1
"hola tengo el hc de que hinata es mitad irlandés, que tsukki es mitad franchute y yamaguchi mitad latino >>> i'm in drugs",0
Funcionaria denuncia acoso y violación en el Poder Judicial: 'Me violaron una docena de veces' - #AM1080 [URL] [URL],0
"He estado callada desde ayer porque no me apetecía ni tener que enfadarme. Pero me parece una puta vergüenza que se grabe a los idols llegar a un funeral para poder discutir luego quién ha ido, quién no, qué cara traían o quién ha sido el primero.",0
"De niña era súper fit, hacía ballet, gimnasia, hawaiano, danza árabe, danza contemporánea y todavía me iba al parque a los columpios. Y ahorita, valiendo un buen de verga.",0
"Los invito a hacer un ejercicio de registro fotográfico, ¿cuántas #taquerías habrá en la #CDMX que se llamen El Güero?, esta es una de mis favoritas para suadero, en la San Miguel Chapultepec. [URL]",0
[USR] Callate hijo de puta ojalá tengas un hijo como yo,0
¿Por qué las modelos tienen una neurona más que los caballos? Para no cagarse en los desfiles.,1
me acaban aqui de enseñar al niño polla o deberia decir PRINGADO DE LA VIDA Q LO UNICO Q HA HECHO EN SU VIDA (indirectamente) ES TENER UNA POLLA GRANDE.... QUE. PUTO. ASCAZO. NIÑO.,0
[USR] De qué viven los magrebíes y subsaharianos que veo diariamente en terrazas de bares? Les ha tocado la lotería? #pregunta,1
[USR] [USR] Callate hijo de puta pelotudo cómplice de la derecha! Llamaste a votar en blanco porque decías que eran lo mismo sorete! Acá tenés 'lo mismo' ahora forro!!,0
"NO+INMIGRACIÓN NO+INVASIÓN NO MÁS INMIGRANTES, DEPORTACIÓN MASIVA YA!!!! #DefiendeChile #ChilePrimero #SocialPatriotas2022 [URL]",1
QUE SE QUEDEN EL DINERO Y LOS INMIGRANTES ILEGALES - La UE concede 3 millones extra a España para atender la llegada de inmigrantes [URL] vía [USR],1
Mujer Fail I [URL],0
Mi hermano llego a casa lleno de chupones y lo primero que le dice mi tia que la novia es una puta JAJAJAJAJAJAJ ke,1
"En un país donde 16 mujeres son agredidas sexualmente cada hora, banalizar las formas de acoso sexual resulta inac… [URL]",0
"Para romperles la puta cara que asco dais, os merecéis lo peor que os pase por babosos, machistas y cerdos de mierda que sois algunos. [URL]",0
[USR] En serio qué imbéciles! Como si el acoso se acabara a punta de clases pedagógicas en un bus rojo que todo el mundo detesta usar sin importar la hora! Los acosos pasan 24/7 y en todas partes y solo la educación y cultura acabará con semejante c,0
"Odiame pero al mirarte a un espejo recuerda: yo soy agil y atractivo, tú eres una puta cerda Y es que tienes tanta tonteria y tienes tanta maldad, que en algun sitio de tu cuerpo se tiene que acumular",1
[USR] Callate puta sidosa de mierda,1
[USR] Callate q el viernes t vas a llevar un puñetazo trozo d escoria,0
Puto sudaca de mierda — 😘 [URL],1
[USR] [USR] Ya cállate pinche perra.,1
[USR] Cállate perra de Twitter,1
[USR] Pues una puta mierda,0
Más de putos moros  [URL],1
[USR] ESA MUJER ES UNA ZORRA,1
"[USR] No eres aburrido, eres sincero. No es culpa tuya que no te guste la polla de alguien.",0
"Que buena vaina carajo con la cochina cultura árabe no conforme con la invasion que tenemos xq ya los venezolanos parecemos extranjeros en nuestro propio país, ahora canciones árabes en emisoras radiales no me jodan con esa cultura mal viviente",1
"[USR] Oye callate que si te molesta pues no mires el chat y deja ya de llamar la atención guarra, mi Instagram es trussypussy25 chavales",1
Al PP y a Ciudadanos no les gusta que vengan los negritos indocumentados. Lo que les gusta es que salgan los blanquitos licenciados. [URL],0
Adán canta que su novia es del #Sevilla 'y es una puta más' [URL] #Betis #SevillaBetis [URL],1
|| CALLATE LA BOK ZORRA MAL PARIDA [URL],1
Emily aprovecha a no tu eres muy puta :v jajajajjaja [URL],1
"Siempre me cargó ese cuico culiao aspiracional, súperalo amigo, eres sudaca y gay.",1
"¿Y si ""devolvemos"" Ceuta y Melilla y así dejan de saltar la valla? [URL]",0
"El presidente estadounidense, Donald Trump, dio este lunes su pleno respaldo a la polémica política antinmigración del nuevo Gobierno italiano, que ha rechazado aceptar en sus puertos a barcos de rescate de indocumentados en el Mediterráneo [URL]",0
[USR] callate zorra me amas,1
"[USR] Basta! Poned pie en pared a tanta provocación y cortad la humillación de estos cuatro hijos de perra,",0
"[USR] [USR] Cállate, es mi mejor amigo, zorra",1
"No te mereces ni el aire que respiras, escoria",0
Mami puso una emisora con canción árabe y siento que en cualquier momento vamos a explotar.💣,1
"dicen que los animales son los más fieles, pero si tú eres una perra, qué pasó?!!!",1
[USR] Hijos de puta! Que en la tierra vive más gente! Enseñarnos la polla y quién encule con más dolor al otro gana. Y el que más gana... El resto del mundo! Anormales!,0
[USR] [USR] [USR] CÁLLATE...PERRA [URL],1
[USR] [USR] [USR] Cállate perra igual entendiste el mensaje anda a pintarte las uñas y hablar de maquillajes perra,1
[USR] JAJAJAJAJAJA cállate puta,1
[USR] Puta = Jaque mate,1
Como queda Arabe de Ecko.,0
[USR] [USR] CALLATE YO ME LO DESCARGE YEGUA HIJA DE PUTA EN EL GRUPO HACES LO MISMO y de paso te dejo a moria [URL],1
Todas las perdonas güeras son bien maricas.,1
Yo no te discuto como sacar una muela así que cállate la puta madre,0
"[USR] [USR] Pero cállate perra, que lo lo había visto xD",1
Rezo para que tengas un fin de semana INCREÍBLE y lleno de bendiciones 🙏🏻🙏🏻🙏🏻 . . . . . . . . #ABOGADO #immigration #immigrants #inmigrantes #inmigracion #inmigración #jorgerivera #abogadodeinmigracion #casosdeinmigración #indocumentados #daca #t… [URL] [URL],0
"Mireya te merecias quedarte tbh, no merecias la nominación lo hiciste de puta madre #OTGala7",0
oh empanada arabe llegaste a mi vida volando,0
"Bufete de Nuria Vandenberghe: Una abogada proisraelí, antimusulmana y fan de Trump denuncia a 602 inmigrantes que saltaron la valla de Ceuta - Público [URL] #EquiparacionYa",0
"🤣🤣Su tierra tiene un 60 % aprx , de árabes , argentinos  y demás emigrantes , ........mas los españoles que estamos a la par con ellos , que rondamos el 20 % La RAZA BLANCA EN EXTINCIÓN Y LOS PAYASOS DE COTILLÓN ya Mismo  veréis a vuestros hijos haciendo el RAMA DAN   CATALÁN [URL]",1
"Mucho rollito con lo de #JuanaRivasSomosTodas pero en Ceuta y Melilla indocumentados,que no muestran sus pasaportes, arremeten contra la policia de frontera con palos,incendiarios y cal viva y nadie sale a la calle. Todos en la piscina de Galapagar pasando un #FelizSabado",1
DÉJATE DE WEBIAR ZORRA MAL PARIDA YO NO TE TIRO WEAS VKOOK EN LA CARA MARIA JAVIERA TE VOY A SACAR LA CTM [URL],1
"jajajaja la portada de depor con flores, ramos y carrillo como jeques árabes",0
"[USR] Cerda,envidiosa,que te vaya muy mal tu puta vida no te mereces ni el agua que bebes [URL]",1
"[USR] Maldita la puta que la parió, que es esta asquerosidad perra sucia. Debería sacarse la mierda que tiene en la cabeza hija de puta.",1
"Al hijo de puta que hizo el video de havana con el gallo, te mereces todo, en serio",0
No soy racista pero QUE ASCO DAN LOS PUTOS MOROS. COMO DEPENDIESE DE MI QUE ENTRASEN EN ESPAÑA LO LLEVABAN CLARO ESTOS IMPRESENTABLES GUARROS Y MAL OLIENTES,1
"EL ORGULLO QUE SIENTO🏼ES INMENSO, SOS ÚNICO💙 Te lo re mereces porque sos un actorazo de la puta madre [URL]",0
"Este 2018 les he tuiteado como la puta verga que soy, ya se merecían mi regreso.",0
"Dónde vas mi arma??? Mi polla poco tendrá que hacer en tu culo, no notarías nada jajaja [URL]",0
[USR] te hice un dibujo pero la verdad me da puta pena enseñarlo xD Es horrible xDDD,0
"Infeliz no seria un termino que el se merezca... No soy Dios para juzgar, pero este hijo de puta merece el infierno en tierra. [URL]",0
Y tu eres una zorra mala que lo sepas jajaja [URL],1
[USR] [USR] [USR] [USR] [USR] No la he visto todavía. #todasputas,1
Primero sacab de la convocatoria del 1er equipo a Duque y Ángelo.  Ahora ni a la Sub 20 van. Y del güero Díaz ni hablamos. 3 delanteros borrados en Atlas.  ¿Qué pasará sí Octavio Rivero no funciona? [URL],0
[USR] [USR] [USR] [USR] Mereces la muerte zorra JAJAJAJAJA,1
espero que los que votasen que mimi se fuese de la escuela tenga un 2018 de puta pena porque os lo merecéis por este dolor que me creado sin warmi #otnavidad,0
Pero si son árabes chaval si ven a sus padres degollar animales to los dias [URL],1
"[USR] Cállate la puta boca que te voy a reventar a hostias, payaso. (?)",0
Me ha gustado un vídeo de [USR] ([URL] - La Güera Pachanguera).,0
"Cada vez me gusta más mi cuerpo, que pasa??soy una guarra por enseñar las piernas?? una provocadora por una foto en toalla?? el problema no es mío, publico lo que me gusta.",0
"que no¿? por que eres tan puta zorra mentirosa¿ cualquier user chica es mas juguetona que tu, puta monja — Bueno, suele pasar yo no busco ser juguetona ^^ [URL]",1
[USR] Callate puta en alemán,1
"Esta encontra  del racismo pero usa chingos de filtros para verse más blanca , y se pinta el cabello de güera. No mames compa",1
"[USR] [USR] [USR] callate mexicano hijo de perra,",0
[USR] Comemela tú a mi a ver si acabas algún día,0
"Muchas personas creen q una mujer es abusada o acosada por ir muy descubierta, pero yo he visto acoso a mujeres por lo contrario también, mujeres cuya religión o creencias son otras y son acosadas por eso. Eso demuestra q hay un standard tácito d mujer, y q se espera sea cubierto",0
[USR] [USR] [USR] [USR] [USR] [USR] [USR] No todos los privilegios son derechos. Ejemplo ocupar más espacio del necesario es propio de hombres y no es un derecho. Y no sería mejor que no hubiera género?,0
Así son:VULGARES.No tienen más argumentos Aprendieron el legado aquel:'Te pego en la cara marica' del innombrable. [USR] [USR] [USR] [USR] [URL],0
"[USR] [USR] CALLATE PUTA, ESSSTAAAA TE ESPERA.",1
[USR] Siiii jajjajajajjajajaja yo te iba a enseñar pero vivís lejos nde puta.,0
[USR] Callate la boca burro maldito... Q vas a saber tu q contenían las proclamas d Bolivar.... Hijo de la gran puta maldito Burro,0
"Voy a acabar denunciando yo a la Guardia Civil por putos pesados, que os den por culo, iros a por quien lo merezca hijos de puta.",0
Pegame en la cara que yo te pego en el ego,0
"Una violación cada 8 horas en españa Más de 1000 asesinatos machistas desde 2003 Todas hemos sufrido acoso callejero alguna vez Pero oye, son casos aislados y somos unas exageradas porque 'vivimos en uno de los mejores países del mundo' [URL]",0
Yao muerete de una puta vez vengo de parte de dosogas coscu army renzo y muchos youtubers mas tu eres un tocapelotas primero insultas a una conductura de tv despues amenazas a renzo a fabriml y haora a quien vas a amenazar andate a la mierda hijo de la gran puta #RIPYAOCABRERA [URL],0
"[URL] Es gracioso pensar que android saldría así y en iphone pasaría como el símbolo árabe, que se va el terminal directamente a la verga we",0
[USR] Callate hijo de puta vee a lleida i me lo dices a la cara cerdo,0
Radio Habana Cuba | Restituye España salud gratuita a inmigrantes indocumentados: [URL],0
"Partiendo de que toda generalización es mala, estoy hasta los huevos de la actitud prepotente y exigente de muchos inmigrantes. Esta mañana dos cruzando Alfonso el Sabio por dónde querían y parando a los coches...",1
"[USR] Ayy gracias en verdad, te mereces todo lo bueno del mundo \>:v/ ahre eres lo + y me caes de puta madre peeero no tengo WhatsApp ;-; a que esa no te la esperabas ;y",0
[USR] Cállate tonto pasemos un buen año que seguro que nos va de puta madre hazte caso,0
Menudo ostión que se lleva el moromierda. 😂😂 [URL],1
"Mientras el común de los mortales padecemos una oleada violenta de musulmanes subsaharianos y una ola de calor 🔥 subsahariano abrasante, los proletarios [USR] y sus adlateres de vacaciones de millonario. Que bien viven los proletarios de hoy en día. #SanchezDimisión [URL]",1
"A ver cielo, ¿sabe tu coño a la polla de mi marido?, porque si es así... también me lo comeré muy a menudo [URL]",0
[USR] [USR] Callate puta hdp coño de tu madre maldita enchufada sopla con don perra oportunistas Amarillistas de mierda maldita aquí mueren siento de personas diario hdp. Pues claro Q nesesitamos una intervencion rata de mierda,1
JODER ME CAGO EN LA PUTA QUE ROBO RAOUL SE LO MERECÍA JODER #OTGala8,0
#OTGala7 Hasta la puta polla ya tio... Lo siento pero Cepeda NO merecía quedarse joder,0
INMIGRACION ILEGAL DEPORTACION ¡YAA! Y ENTRE OTRAS COSAS MENOS RIESGO DE TERRORISTAS INFILTRADOS ¿NO? - Un mando único policial para combatir inmigración ilegal [URL] vía [USR],1
Me han dicho que tengo ojos de árabe. Qué significará eso.,0
Fav si te vienes a dormir conmigo y te pego una patada en la cara al despertarnos por la mañana.,0
Para mi si querés llegar a latinoamerica no suma el discurso argento de nosotros somos descendientes d europ.. Nose un mexicano nos diria para loca somos tos sudakas..,1
Dustin Hoffman se enfrenta a nuevas acusaciones de acoso y violación [URL] Cinemanía #cine #peliculas [URL],0
[USR] Callate puta te falta pico endulzado,1
"[USR] Cállate mantenido por el pueblo , Hijo de Puta ; a ver si te dan trabajo en Chiclayo te odian , Cagada",0
[USR] [USR] Sobre un político que tiene denuncias por violación y acoso sexual a menores,0
El Gobierno socialista ha hecho entrar en vigor un acuerdo con Marruecos para que el árabe y la cultura marroquí tenga prioridad en España. ¿Qué sentido tiene? Tal y como defiende [USR] hay que evitar la islamización de España. [URL],0
todos esos ãrabes son del barsa  xD [URL],0
[USR] [USR] a saber que hijo de puta te la enseñaria,0
"Literal vivimos en un mundo donde si una chica es violada es 'por perra', 'por descuidada', siempre tiene la culpa la chica agredida, nunca el que agrede... sinceramente la gente que piensa así me da un puto asco.",0
SI YO MANDARA EN ESPAÑA AQUI NO ENTRABA NI CRISTO SIN PAPELES QUE SE VALLA A SU PAIS [URL],1
"[USR] Jajajaja gracias amor, y callate que vos también estás re perra😍",1
"[USR] Disculpa, tú eres ese al que llaman Jordi el niño polla?",0
"Si lo hace un hombre es acoso, si lo hace una mujer es un chiste. La guerra de la izquierda contra los hombres... [URL]",1
No es justificable pero... sufre el acoso de independentistas enseñándole lazos amarillos y dice que 'no se puede permitir' que eso pase en campaña... y ¿que haya candidatos encarcelados sí se puede permitir? [URL],0
"No me viste borracha, no me viste loca por nadie, simplemente no me viste. Así que cállate la puta boca.",0
"[USR] [USR] traidor hijo de puta! ...ni tu propia sangre respetaste. Mereces por lo que pasas, basura inmunda. [URL]",0
[USR] Perra ella; tu eres una reyna 👑,1
Mi papá me acaba de enseñar un video de una perra estresada y me dijo que era yo. 🙄🙄,1
Al dueño borracho d este coche q m acabo d encontrar abandonado en una cuneta: mereces lo q t ha pasado hijo d puta. X suerte nadie se cruzó en tu camino. [URL],0
#PorSiempre en mi corazón [USR] Baja del cielo a abrazarme güera DEP [URL],0
"Btw, si aún no han ido, cuando tengan oportunidad vayan a los cantaritos “El Güero”, se enfiesta uno con mami y están lo más delis.😍",0
[USR] no puta levanta tu coño puta busca trabajo puta consigue un negocio puta chupa una polla puta,1
"Y ahora con la diáspora venezolana y maduro infiltrado sus malandros entre ellos cubanos de mierda; árabes y cuanta porquería sea, tendrán más posibilidades de ataques de cualquier índole [URL]",1
[USR] Cállate zorra déjame vivir ajajajajajaja,1
medio q si le decís CRUSH al q te gusta te re mereces q no te bola nunca en tu puta vida decile ese q quiero q me rompa el orto el wacho lindo no se la cosa sana,0
