text,label
DEJUS CENTER apoya a los inmigrantes a través de talleres educativos y asesoramiento en Brentwood y Hempstead [URL],0
#SabiasQue el cerebro de la mujer esta conectado al culo? Porque cada vez que piensan la cagan,1
"Enseñar Tampax llenos de sangre en una red social no es ir de moderna, es de ser una guarra fracasada de la vida sin vergüenza alguna, hijas de puta.",1
"Si no me devuelven el follow LES VOY A METER EL DEDO PULGAR POR EL AGUJERO DEL CULO PEDAZO DE HIJO DE PUTA MERECES MORIR TARADO ahre, IGUAL SI",0
Modo árabe jajaajajjaja dg,0
"La gorda de mi trabajo, a sus 26 años tuvo su primer novio jajajaja pobre del pendejo.  Están invitados a mi boda amigos.",0
"[USR] [USR] [USR] Es preocupante que todas las fantasías sean hacernos daños y follarte a tu hija, yo me lo miraría",0
e tios soy sallanman barrabaja cat callate ya deja ... — Ni puta idea. Hay tanta peña que podria escribirme ... [URL],0
"[USR] es que cállate, cállate porque no tienes ni puta idea y ojalá te pase lo mismo que tú no te crees que nos pasa a las mujeres, me importa una mierda que leyendo esto pienses 'wooow vaya feminista deseándome eso', vete a la mierda, sigo teniend",0
les arabes [URL],0
[USR] Callate puta en alemán,1
[USR] CALLATE PUTA EJEJAJ,1
"[USR] ojala te vayas al infierno, que la vida te de todo lo que te mereces por puta.",1
[USR] Safate perro hijuelagranputa q putas hablas mierda perro basura bastardo son los pocos adjetivos q te mereces escoria,0
[USR] lo mereces maldito igo d perra,0
He visto más gente güera con los brazos peludos que gente feliz.,0
"Un día me dieron un consejo muy bueno: si no vas a decir nada inteligente, CÁLLATE LA PUTA BOCA. Aplicároslo porfa.",0
"[USR] Si, eso es lo “terrorifico” del cine de horror, pero cuál es la gracia de las malditas tonterías, para eso veo una puta comedia 😒",0
Les arabes ❤️😭 [URL],0
"[USR] Ostia tio, si tienes tuister. Tú eres un auténtico sinvergüenza y un hijo de la gran puta jeta. Los que de verdad hemos sufrido tumores cerebrales te deseamos un tormentoso 2018. La policía te jodió tu repugnante negocio.",0
"New post (Demandan a Trump por trato ""inhumano"" a indocumentados) has been published on Estilo FM - [URL] [URL]",0
[USR] [USR] [USR] [USR] tú eres mi oveja puta,1
[USR] Ya te dije si inspiro en tu cara zorra,1
"[USR] [USR] [USR] La mujer: acoso, abuso, violación, violación seguida de muerte, golpes, fuego, maltrato psicológico, femicidio, condena social, le paso por puta, provocadora, desigualdad laboral, igualdad de responsabili",1
"A ver cielo, ¿sabe tu coño a la polla de mi marido?, porque si es así... también me lo comeré muy a menudo [URL]",0
[USR] Cállate puta que vos sos cómplice,1
Casual estar en la feria de chelem y que digan en un juego “como dicen los gabachos por atrás se siente gacho” Jajajaja,0
"Cali, ciudad de inmigrantes: [URL]",0
"Cuando el de los tacos te dice ""Uy no güera, ya se me acabaron los de pastor"" [URL]",0
#PorSiempre en mi corazón [USR] Baja del cielo a abrazarme güera DEP [URL],0
"Nuestro Secretario Provincial, a la salida de #Fiscalía. Se ha presentado denuncia por los hechos de la valla fronteriza  de Ceuta, donde se agredió indiscriminadamente a Agentes de la Guardia Civil. #Centristas [USR] [USR] [USR] [USR] [USR] [URL]",0
"[USR] [USR] [USR] tienen razón son profesionales de provocar situaciones de acoso para que el personaje salte y entonces hacerse los martires, los probrecitos periodistas",0
"En Brasil creen que soy europea. Mi vidas, si tan solo supieran que soy mas sudaka y pobre que ellos",1
Para mi es con pan árabe o nada [URL],0
Una tía no es una guarra por hacer una foto de su culo y tú eres un puto nazi que no sé qué hace respirando. [URL],0
[USR] [USR] [USR] Callate vos chupa pija te comiste 7 de alemania cornudo hijo de puta,0
Como la rompe ecko en arabe,0
"Q va tener otra q lo hacen mejor, te traigo la perra de la vecina garcha pero callate lpm",1
"La Policía asegura que los niños apenas tenían agua, ropa y comida:  ""Parecían refugiados de países del tercer mundo"" [URL]",0
Padres indocumentados realizan huelga de hambre para exigir liberación [URL] [URL],0
DÉJATE DE WEBIAR ZORRA MAL PARIDA YO NO TE TIRO WEAS VKOOK EN LA CARA MARIA JAVIERA TE VOY A SACAR LA CTM [URL],1
"El presidente de #EEUU, [USR], aseguró que los indocumentados en territorio estadounidense utilizan a sus hijos para propósitos siniestros 😰 ➡[URL] [URL]",0
"[USR] Jajajajaja cállate imbécil, tu perra casi se come a la mía 😥",0
"[USR] te equivocas, significa Svete Ea Mfregar Ela Ncocina.",0
Hy man10 HOMBRES ÁRABES DESNUDOS Y ERECTOS ¡Te excitarán! [URL] via [USR],0
[USR] Jajajajajaja lpm Callate que vos sos la zorra número 1,1
[USR] si.. comemela a mi,0
"[USR] Puta, tantos años de ser bff y ni sabes que perfectamente yo te puedo enseñar. 😒",1
"¿La mitad de sueldo por ser mujer?' [URL] Así es, porque aguantarlas cuesta el doble. #TomaDosTazas",1
"Estoy HASTA LOS COJONES!! Manteros AGREDIENDO a la [USR], ISLAMISTAS EXIGIENDO que en nuestras escuelas se imponga el ISLAM.. estoy hasta los 🥚🥚 de tanta basura. LA DERECHA Y partidos como [USR] tienen que SUBIR SEGUIDIRES EN EL PAÍS. POR UN PAÍS DE PRINCIPIOS!!.",1
Podían poner los taxis bloqueando el paso en la valla de Ceuta.,0
"[USR] Dejate de tonterias, lo haces de puta madre. Rendirse nunca es una opción.",0
"#Espana , el lugar dónde gente que ha entrado #ilegalmente en el pais, a veces utilizando la fuerza, y que realizan actividades de venta ilegal, sin licencias, sin papeles de ningún tipo y saltandose todas las leyes, ¡tienen un sindicato!. Mientras, los #autónomos son machacados.",1
"[USR] [USR] Puta que te CAGARON 'Y yo creo que tú eres un burgués que se cree revolucionario. Pero a la hora de los qui’hubo, terminas votando por la NM. Ojalá algún día te toque ganarte el sueldo, se siente bien.' 😂🤣 Boric al igual que",0
"[USR] [USR] [USR] Putabata, me paras la verga bien rico, te quiero culiar y venirme en tu cara de zorra😍",1
"La fundación Francisco Franco propone eliminar las concertinas de la valla de Ceuta, y untar con tocino de cerdo la frontera para evitar que los moros nos coman.",1
"Ole tu, solo le falto decir que con Franco eso no pasaba [URL]",0
"Las viejas de antes, puteaban bonito para ganar dinero. Las de hoy acusan de acoso o violacion a algún pobre y buen hombre.",1
Los #trabajadores inmigrantes de #Qatar están sufriendo como esclavos en las construcciones de los estadios para la próxima Copa del Mundo 2022. ¿Qué se está haciendo al respecto? #FightRacism #StandUp4HumanRights #UN #Spain [URL],0
No crean que #AMLO fue a la selva lacandona a reunirse con el #EZLN... ¡no! más bien anda en el rancho de su compadre el güero Velasco #FaltaLoQueFalta,0
Y despues hablabamos de lo que paso en eeuu...nosotros tambien tenemos nuestro Homeland sudaca.... [URL],0
"[USR] Jajajajajaja tu eres uno, diego jajajajajaja mentira perra perra perrraaaaaaaaaa de mierda jajaja ♡",0
#Repost [USR] with get_repost ・・・ 🌊💃🏽 besos de mezcal pa’ el Güero. ¡feliz viernes! [URL],0
Sólo falta que diga que tiene un máster en derechos humanos.... Como esos que tiene su jefe... [URL],0
"[USR] [USR] [USR] [USR] Así se cuida el patrimonio en Arroyomolinos. Vestigio de la fortaleza árabe Calatalifa sin protección, señalización... Qué triste! [URL]",0
[USR] callate de una vez perra en celo,1
Otra puta injusticia.... Raoul grande Te mereces lo mejor #OTGala8,0
"Zorra Colau,amante de moros,pensando en votantes.Si tú eres atea desgraciada!!! [URL]",1
[USR] En serio qué imbéciles! Como si el acoso se acabara a punta de clases pedagógicas en un bus rojo que todo el mundo detesta usar sin importar la hora! Los acosos pasan 24/7 y en todas partes y solo la educación y cultura acabará con semejante c,0
"Crece a 1.402 la entrada de inmigrantes a Ceuta, la mitad de ellos al asalto, en lo que va de 2018 [URL]",1
"En Hollywood las mujeres son acosadas sexualmente,pero 'se lo habrán inventado' Kevin Spacey es acusado de acoso sexual por otro hombre y que curioso que a este no lo pongan en duda",0
[USR] Y dsps aprobas mejor cállate perra,1
¡Cállate maldita escoria! ¡¿Acaso no sabes con quién hablas?! ¡Hablas con Baron explodo kills el mejor héroe de U.A quien destrozara tu jodida cara de mierda! ¡Haré que te arrepientas y te metas tus asquerosas idioteces por el orto! [URL],0
[USR] [USR] la educación sexual también es aprender que las mujeres con polla existen y son víctimas de violacion... Violan los hombres no las pollas.,0
[USR] Callate CTM hijo de la perra caliente 😎,0
#ninjasdelcholloenp RETO: te reto a pegarte en la cara la mayor cantidad de ganchos de ropa( no vas a superar los 10) saludos desde chile [USR] 🔥 [URL],0
Maestros de la manipulación y borregos que lo difunden. Miedo racista al inmigrante pobre!!! Preguntale al turista americano quien le ha colado el miedo. [URL],1
"Pensar que la mujer es una perra de por si es algo horrible, pero que eso sea por celos, es una conchudez.",1
[USR] Por acoso y violación a la intimidad,0
Me gustó un video de [USR] [URL] INMIGRANTES - Muxaxitos - (album) Maquinas de Amor,0
[USR] [USR] Le deseo una muerte lenta y dolorosa a la escoria humana que le ha hecho eso al pobre gatito.,0
[USR] [USR] pero tu eres un auténtico imbécil y un potencial machista? ideología de izquierdas? Tú eres una vergüenza.,0
"Pero si no sabes una puta mierda de criminología ni de psicopatía, anda cállate gilipollas [URL]",0
[USR] Difundamos Movimiento SEMEN! Un RT de ayuda!,0
[USR] Le pega primero en la cara 'tonto la polla',0
"Y más rosas y más sonrisas. Mujeres gritando zorra y guarra, ¿se puede ser más imbécil? #21DARV [URL]",1
[USR] Esta es la justicia en españa para estos indeseables una puta verguenza,0
Los refugiados llegaron a Valparaíso el 3 de septiembre de 1939 (Wikipedia). [URL],0
[USR] [USR] Diappoler* jajaja cállate Pepe niño polla Si me han llenado de notificaciónes jajajajaja,0
[USR] El imbecil creia que habia quimica... Como la pelicula de Demi moore.. el acoso es un asunto de poder y control.. La causa del abuso es el isoso arbitrario de los limites de la dignidad para controlar otra persona a si capricho....,0
"Vuelvan ahre quiero un novio asi, mi novia es una zorra y estoy enojada asi que quiero uno asi ahr mentira [URL]",1
[USR] Pero eso ya se empezo a notar amiga no habia que hacerlo saber jajajajajaja callate zorra,1
Que ningún hijo de puta os de menos de lo que os merecéis.',0
"#Internacional Según el portavoz de una organización de defensa de los inmigrantes, unos 80 padres con sus hijos se rehusaron a recibir alimentos  [URL]",0
[USR] Callate la boca pendeja de 14 años con delirios de madurez y la puta que te pario,1
"Y yo atorado en el tráfico, claramente tu eres la perra de esta relación. [URL]",1
"[USR] Vieja zorra imbécil y MENTIROSA, que nos cree unos solemnes cojudos. Señor Lenin, por favor dignifique al Ecuador, pobres, pero no en la cloaca robolucionaria!!",1
"[USR] [USR] Tu eres el pendejo que ofreció a sacar a las víboras del pri de los pinos, entoloachado hijo de puta???",0
QUÉ HACESSSSS COMO QUE VETE IMBECIL QUE TE PEGO,0
"La gente inmigrante que ha entrado en España de modo legal y se integran en nuestra sociedad se les llama personas de color.  Los ilegales que entran por la valla atacando a nuestros agentes, delinquiendo y agrediendo a nuestros ciudadanos son NEGROS  e islamistas sin adornos!!!",1
DEJA DE TUITEAR HIJA DE PUTA ESCUCHA LOS ARGUMENTOS QUE LUEGO TE VAS A QUEDAR CALLADA FUJIMIERDA DEL CARAJO [URL],1
La insistencia en flirsteo sin correspondencia es: Acoso - La violación es un delito- No admito otra interpretación que justifique estas situaciones- Ver video [URL],0
Talvez quede como zorra pero te lo mereces Socia😎,0
¿De meterte la polla en la boca y que te calles? Puede. [URL],0
Un Arabe me esta chanceando y siento que si lo reboto me va a tirar una bomba.,1
[USR] [USR] Soy una victima del acoso gay y nadie me defiende. Tu eres el responsable si me pasa algo.,0
"Bufete de Nuria Vandenberghe: Una abogada proisraelí, antimusulmana y fan de Trump denuncia a 602 inmigrantes que saltaron la valla de Ceuta - Público [URL] #EquiparacionYa",0
[USR] Callate zorra ayer yo estaba sanito en mis 5 sentidos jaja,1
Todo es ji ji y ja ja con los chistes sobre árabes y bombas hasta que te toca con uno de ellos en un vuelo,1
Llamar guapa a una chica es micromachismo pero querer azotar a una mujer hasta sangrar o llamar puta a Arrimadas es satira. 👏,0
[USR] [USR] [USR] [USR] [USR] [USR] [USR] No todos los privilegios son derechos. Ejemplo ocupar más espacio del necesario es propio de hombres y no es un derecho. Y no sería mejor que no hubiera género?,0
[USR] dejá de provocar hijo de puta porque cuando se de vuelta la tortilla te vas a arrodillar llorando pidiendo clemencia y la presidencia del Bazofi,0
"Como cuando juegas billar con un arabe, musulman  , y falla un tiro y normal se enfada, es como “todos abajo puede traer una bomba “ y mejor lo dejas ganar jajaja 😭🤷‍♀️",1
"[USR] Cállate sorete buscan un muerto hijos de puta, ojalá se te muera tu mascota en navidad",0
Los árabes me dan asco,1
"Puta. Zorra. Guarra. Eres mía. A ver esa minifalda. No vayas sola. No bebas. Eres la del sexo débil. Feminazi. Entonces hay.. ¿Igualdad? ¿Dónde? Ojalá que haya un 2018 como Dios manda, ups! Quise decir como la Igualdad mande. Y que la Violencia de Género deje de existir.",0
Miriam se merecía una canción decente para bordarlo y es que la perra lo ha bordado y se ha quedado tan tranqui! #OTGala8,1
"[USR] [USR] [USR] Vaya pelis te montas, mírate la puta cabeza primero y preocúpate de los demás después. Abusar y explotar no entran dentro de hacer lo q quiera y ser libre. Ale! A fregar!",0
"la novia es mas puta y el pelotudo sigue estando con ella , ni pa bosta la mina mas zorra y el ni hablar mas gil todavía , le re kbio",1
Detienen a tres #jugadores de la #Arandina por presuntos #abusossexuales a una #menor [URL] #movimientojupsin #gentejupsin NO al #acoso,0
"Un árabe ofende a una mujer y escupe frente a ella, ¡PERO viene el eco del lado inesperado! [URL]",1
[USR] [USR] Estos miserables q pueden enseñar más q su puta basura nazionalista... No tienen mas nada q enseñar,0
Y ahora vienen los descerebrados estos a provocar que se detenga el partido. La puta madre pues.,0
"Triunfador. Tus publicaciones en redes sociales son todo un éxito, ya te vi que subiste muchas fotos con el guitarrista güero del ano, chingo de me encorazonas. Es hora de celebrarlo de la mejor manera, comprando algo en Amazon o de perdido en Mercado Libre",0
[USR] HIJA DDE PUTA TE LO MERECES POR TOFAS LAS VECES QUE LO HICISTE,0
[USR] [USR] tu puta madre no te queria ofender.pero te lo mereces.,0
Yo no puedo creer que las propias mujeres naturalicen una violación o acoso y lo justifiquen con que la mujer es la que “provoca”. Que mente de mierda la puta madre,0
"Leo que es muy complicado expulsar a los inmigrantes ilegales porque es imposible conocer su procedencia, sin embargo, todos tienen teléfonos móviles ¿tan difícil es averiguar a qué países hacen sus llamadas?",1
Ex colaboradora de #FoxNews fustiga a #Murdoch por llamar “tonterías” escándalos de acoso sexual [URL] [URL],0
"[USR] [USR] Que gente mas patética si quieren enseñar la polla que lo contraten en un puticlub aquí en las redes NO , patético , ridículo......",0
"Puerto de Almería  80,00 €  Grabado del Puerto de Almería a primeros del siglo XX.  Técnica de aguafuerte, impreso en papel súper alfa.  Medidas:  Papel: 60cm x 40cm. Plancha: 40cm x 14cm.  [URL]",0
"[USR] Cerda,envidiosa,que te vaya muy mal tu puta vida no te mereces ni el agua que bebes [URL]",1
Igual tú para follarte a alguien te fijas en su personalidad pero en una APP que es para FOLLAR no todos tienen que tener el mismo criterio.,0
"[USR] Cállate que todos vieron como dormía y dormis, LO VAS A ACEPTAR O NO HIJO DE PUTA PRIMER AVISO",0
[USR] [USR] tu callate un mes perra,1
"El acoso callejero está a la orden del día Quizá no todos acaben con un asesinato, una violación o acoso sexual Pero muchos sí, y eso basta para que nos entre miedo y rabia cada vez que un imbécil nos dice algo por la calle",0
"Casi un centenar de inmigrantes, alojados a cargo del contribuyente en hostales de Zaragoza ante la saturación de los centros de acogida. [URL]",0
"[USR] Cállate puta, eres hermosa 💜",1
"[USR] [USR] [USR] [USR] [USR] [URL] coño entonces tu eres de lo que te guias por el antes de cristo y despues de cristo,cuando llegamos los Españoles,y le contagiamos todas clases de enfermedades Europeas",0
"Me encanta, contra el maltrato animal, pero a los inmigrantes subsaharianos que los acoja en su casa los perroflautas y [USR] . [URL]",1
"ARABIA SAUDITA, EMIRATOS ARABES, KUWAIT Y DEMÁS ADINERADOS CON LOS MASONES JUDAS Y DEMÁS DEL MUNDO HEREJE, CAVANDO SU PROPIA TUMBA SUBSIDIANDO HEREJES ANTICRISTIANOS, LA ORDENDEBE SER: CONVIERTASE A CRISTO, PACIFIQUESE Y ESPERE EN SU PAIS LA AYUDAS,... [URL]",1
"Los españoles pagamos por la Sanidad, los ""sin papeles"" no. Esta es la política de promoción de apátridas de Sánchez. Desde luego en España hay ya varias naciones, la española, la mauritana y la tribal subsahariana. Esto no es racismo, es la realidad. La integración es un mito.",1
"[USR] Pero tu eres una tremenda puta q mas puede pasar zorra del demonio, [URL]",1
"[USR] Después ¿cómo se limpia el coño?, con la falda. Peazo guarra.",1
Os habéis pasado décadas llamando 'guarra' a Maribel Verdú por enseñar cacho. O a Victoria Abril. Tampoco vamos a pedirle peras al olmo.,0
"[USR] Quiero que me hundas tu polla en la garganta, Akemi... -Dijo jadeando en su oreja, mordiéndola con fuerza acabando él provocado. Por supuesto, obedeció y se movió hasta su en frente para quedar dispuesto ante él, de rodillas con las manos en el",0
Lo de los bolardos obstaculizando las entradas del zoco árabe año tras año es de traca... Como para tener que salir corriendo!!! O con silla!!! [USR] [URL],0
Inés arrimadas cállate la puta boca de una vez me dijo el mundo estaba kung fu bailando,0
[USR] [USR] [USR] Cállate perra,1
la mujer es una perla no una perra,0
"⚡DESTACAMOS | Buenas noticias, el alcalde de Filadelfia decidió acabar con un acuerdo de colaboración entre la policía y ICE que daba información sobre los indocumentados... #ConexiónMigrante [URL] [URL]",0
[USR] [USR] [USR] En toda la puta boca!! Para q no hableis mas tonterias q sois unos vendehumos!!!,0
[USR] [USR] [USR] [USR] [USR] Dr. En que materia lo enseñaron ese vocabulario de perra de burdel?,0
Me preguntaron por qué mi perro tiene collar rosado y mi perra uno verde. 'No será al revés?'. No amis porfa callate.,0
"Albert Rivera visitando la valla de Melilla, ahora irá Casado con chaleco antibalas, y luego Abascal vestido de Rambo.",0
"SABES A QUIÉN SE A TIRADO LA PELIRROJA ESTA LA MUY GUARRA?, AL RAMÓN Y LA FALDA QUE USABA SE LE VEÍA TODO",1
NADA COLAU [USR]⁩ la protectora de moromierdas delincuentes y violadores tapa otra reyerta de #Manteros en #Barcelona [URL]  Compartido desde tu tablón de Google,1
Cuento las horas para ver a mi mamá y a mi güero.,0
[USR] Como pueden permitir eso? Si fuera una hermana o hija de agun manifestante. Tambien se manifestarian para sacar a ese violador de la carcel?,0
"[USR] Toda la puta vida las tetas fueron y serán tendencia, y si buscan excusa para enseñarlas, mejor, que coño tanta tonteria.",1
Cuando Albiol deje la política le pueden contratar como director de Okdiario porque lo de inventarse cosas y difamar se le da de puta madre.,0
"[USR] En México no solo es acoso y/o violación sino hasta feminicidio y dónde están los gritos de justicia, no se llevaron un Oscar, ni tuvieron cuentas millonarias. Estas mujeres denunciaron 20 años después mientras estos seguían haciendo de la",0
[USR] Jajajaja cállate perra y hace un bebe,1
De.la polvera sos loas hijo se puta mereces lo peor enano h de puta fracasado hace 16 q no festejas puto te colgas de esa copita gil come verga,0
Malditos espaldas mojadas [URL],1
"[USR] Muy de imbécil es el insultar a otro por compartir su sexualidad, plus, zorra es un insulto que se ha desvirtúa liado con el tiempo, originalmente se refería a aquellas que son astutas. En fin, ni para insultar vales. Un besito.",0
[USR] [USR] hijo de perra no me estes hablando asi tu eres mi puta,0
[USR] Callate puta sidosa de mierda,1
alguien me puede avisar donde consigo un teclado en arabe-,0
[USR] Callate ya puta basura humana.,0
Precios de la gasolina en Emiratos Árabes para el mes de agosto [URL],0
Tú eres de los 70’ Y yo soy una zorra de los 90’,1
"Siempre estuve en contra de que las prietas se pintaran güeras, look at me now.",0
Olé perra hijueputa [USR] enseñarle que usted si sabe:3,1
"[USR] No, tu eres puta y casta",1
Esta mujer es una perra de mierda yo le saco la cucha a ella la maraca culia [URL],1
RACISMO ES QUE TE PREGUNTEN PORQUE ERES PRIETO SI TU MAMÁ ES GÜERA.,0
"Una mujer es tildada de zorra, buscafama etc y automáticamente está mintiendo, se le falta el respeto y se le cree al hombre. Cualquier semejanza con lo que consumimos todas las noches, es pura casualidad.",0
"[USR] Cállate la puta madreee, ENVÍA BAILA FLOR AL 13013",0
Mi novia es como mi polla. Sé que está ahí porque de vez en cuando se levanta. Una de mis pantalones y la otra de la cama.,1
"OLIMPISMO | Pese a las acusaciones de acoso y violación en su país, el israelí Alex Gilady seguirá trabajando en Comisión de Coordinación para [USR], informó [USR] [URL]",0
Mujer Fail I [URL],0
"Cuando veais a los pobres muslims, acordaron que ademas de sangraros gracias a las ayudas y subvenciones que nuestros mayores no reciben, se llevan el dinero a traves de mezquitas y locutorios... [URL]",1
[USR] jajajajajajaja perra te lo merecías,1
"NICOLAS MADURO ""ME LLEVE EL ORO DE VENEZUELA ANTES QUE TRUMP VENGA A INVADIRNOS Y QUIERA ROBAR NUESTRAS RIQUEZAS NUESTROS HERMANOS LOS ÁRABES LO CUIDARAN MEJOR "" [URL]",0
[USR] Pedazo de zorra cállate q yo me lo cante antes 😜,1
"[USR] [USR] Bobo hijo de perra, usted cree que va a enseñarle a Messi o llega a aprender del más grande?",0
[USR] pues comemela,0
[USR] Lo siguiente sera enseñar la puta polla a la gente borja,0
[USR] Callate que si saliste sobria maldita perra,1
[USR] [USR]. Porque no te vas mucho A chingar a t uu puta madre perroo mereces morir,0
Como odio la gente impuntual la puta madreeee y tu chica es impuntual encima,0
"No hay nada peor que la pérdida de la patria. Encarnando el caso de los miles de refugiados sirios en el campamento de Za'atari, las pinturas fueron realizadas con detalle poniendo... [URL]",0
"Mi mejor amiga me defendió sin agredirle verbalmente, él respondió con comentarios del estilo 'Callate, puta guarra zorra asquerosa'",0
#parejainfelizSDP lq mujer es lesbiana puta,1
A veces me da ganas de pegarte un patazo en la cara 😒😡,0
"Felices 15 a la mas puta💗 espero que la estes pasando re lindo porque te lo re mereces, te amo un monnnnton !!! [USR] [URL]",1
"La #Arandina leerá un manifiesto el sábado para mostrar su repulsa a la violencia y contra los abusos sexuales al hilo de las denuncia contra tres de sus ya exjugadores, uno de ellos berciano. #Bierzo [URL] [URL]",0
-¿Porque la esatua de la libertad es mujer? -Porque se nescesitaba una cabeza hueca para hacer un mirador,1
[USR] JAJAJAJAJAJA cállate puta,1
Rezo para que tengas un fin de semana INCREÍBLE y lleno de bendiciones 🙏🏻🙏🏻🙏🏻 . . . . . . . . #ABOGADO #immigration #immigrants #inmigrantes #inmigracion #inmigración #jorgerivera #abogadodeinmigracion #casosdeinmigración #indocumentados #daca #t… [URL] [URL],0
Baby Yo Se Que Tu Eres Bien Puta Yo Lo Se Hace Toas Las Poses La Puse En 4 Pero Nunca La Bese 😈,1
[USR] Callate vs puta,1
"Hay 50.000 subsaharianos agolpados en el norte de Marruecos esperando para entrar en España en cualquier momento. Las cifras dan miedo. Las mafias les venden que España es ""su paraíso"". No sabemos cómo va ha acabar esto. #DefiendeEspaña  #DefiendeTusFronteras",0
"[USR] callate zorra impura, trabajo para mantenerte a vos juanrro de mierda",1
A ver quién paga la factura y cómo se reparten el marrón de dejar inmigrantes ilegales sueltos por sus ciudades (y que los votantes no de lo hagan pagar dentro de un año)... [URL],1
La cobertura sanitaria a los 820.000 sin papeles costará a los españoles 2.000 millones de euros,1
Como son españoles nada... sin fueran refugiados...GLORIA #migrates #refugiados #EspañaLoPrimero [URL],1
"Mientras los ciudadanos de a pie(ahora más que nunca ""a pie"") enfrentamos la inseguridad a diario, sin armas, solo con valor y bolas (no hay otra), al indocumentado impostor lo rodearon con esterillas protectoras (inútiles ante un RPG)",1
"Mucho rollito con lo de #JuanaRivasSomosTodas pero en Ceuta y Melilla indocumentados,que no muestran sus pasaportes, arremeten contra la policia de frontera con palos,incendiarios y cal viva y nadie sale a la calle. Todos en la piscina de Galapagar pasando un #FelizSabado",1
ríete tú de la valla de Melilla y el muro de Trump. El ayto de Madrid ya hizo sus pinitos con fosos para aislar gitanos [URL] #madrid,0
[USR] < cuando porque poco más puede hacer maldita zorra tetona. No mereces el apellido Bathory.-,1
"[USR] [USR] [USR] [USR] Asco da tu Puta madre ??? Tu eres mongolico como el Messi ??? Tu madre trabaja de puta chupa braguetas , culé asqueroso , que te gusta chupar culos , asco das ........... ves que fácil es insultar meló",0
perra estúpida diciendo esas tonterías en mi tl no señor,1
