text,label
Minimo denuncia por acoso sexual e intento de violacion telepatica [URL],0
"Alqatie significa ""la manada"" en árabe. Es lo que en La Tribuna de Cartagena hemos denominado como ""La manada de Alá"". Y es que en España, que repetimos es refugio de mucha escoria dada la justicia tan patética que tenemos, hay manadas árabes. A continuación se las detallamos:",1
"me puse un vestido con escote y mi mama dizque preciso hoy le da por vestirse como zorra jajsjajs tan linda ella, como siempre",1
[USR] [USR] callate perra malparida >:v ok no,1
"[USR] Tú eres mi perra secundaria, me refería a la primaria",1
"Hoy ando oliendo a mujer 😂😂😂  Se me olvidó la llave del locker de la gabacha en la casa, por lo que una compañera me presto la de ella, y huele a puro Fraiche 😅😂",0
¡¡#ZP2: más igualdad de género y genera!!  Menos #VALLE y más #VALLA.  #EleccionesYA #elvallenosetoca #Ceuta [URL],0
"Después de 2 años logré deshacerme de mis puntas güeras cortándome el cabello 1,000 veces. Y ahora que creen? Pues obvio estoy pelona y me lo quiero volver a pintar, POR QUÉ SOMOS ASÍ LAS MUJERES!!!!! 😩😭",0
"PSOE-A asegura que en materia de inmigración el Gobierno de Sánchez ha hecho ""más en dos meses que Rajoy en siete años"" [URL]",0
"Ramirez vete de una puta vez, tu eres la lacra de este equipo y aquí estas de mas hace tiempo",0
[USR] Cállate perra que a ti te espera el mismo destino de maduro y cabello ahora se la tira de correcta porque no lo hicistes aquí corrupta de mierda,1
Decirle la verdad en la cara a un idiota y que esa verdad le duela tanto que llegue al punto de pegarte un puño es de las cosas más satisfactorias que hice esta semana. #SorryNotSorry.,0
"[USR] Callate, decís eso porque tu perra no llora porque ESTÁ CASI SORDA",0
"28: te amodio, odio a la perra de tu amiga ☺️☺️pero tú eres mi vida *tijerazo*",1
tu te mereces mas que un escarnio publico hija de perra [URL],0
[USR] [USR] Y ahora la otra Cómele la polla otra vez y callate,0
[USR] Callate vos qué no me hablaste más puta,1
Vive les pistaches des arabes!,0
-¿Y vosotros por qué habéis saltado la valla de Melilla? -Pues hemos oído que era un coladero de indeseables y pallá que hemos ido... [URL],1
Que alguien le meta un pene a la boca a esa perra a ver si se queda callada,1
[USR] Cállate zorra,1
Feliz año a todo el mundo!! Menos a esos hijos de puta que hacen las bromas de 'no como desde el año pasado'. Mereceis plomo en pecho❤❤❤,0
Mecagontodo 2 tíos en clase aprueban y llevan 35 min quejándose de su nota tío que has aprobado callate la puta boca 😂,0
[USR] Si eres imbécil ahora te jodes.,0
"[USR] [USR] [USR] Sacate a Mafalda del perfil, escoria.",0
Joooooloooovvvv soy una mancha negra en una escuela de güeros.,0
"[USR] [USR] [USR] [USR] No son horas de estar tocándonos en coño a 1 de enero, caballeros, dispérsense.",0
"Legisladores intentan dar juguetes a niños inmigrantes El congresista federal Carlos Curbelo, junto a los senadores  [URL]",0
[USR] En tu cara zorra,1
"[USR] [USR] Perra, tapate pasas pena. Te vives de enseñar el culo que es lo unico bueno que tienes🙄🐍",1
"Jajajajaja pero esta señora que le pasa. No son refugiados son inmigrantes ilegales. Si piensas tratar a todos los pobres por refugiados creo que deberias observar un poco a tu alrededor y ver que aqui hay mucha gente pobre que no les conceden ese ""estatuto"" del que hablas [URL]",1
[USR] puta pendeja zorra me cagas imbecil deja de putear pinche golfa,1
[USR] [USR] [USR] [USR] La escoria de la ciudad son los puestos ya no son ambulantes ya estan fijos los imbéciles.,0
en nombre del pueblo venezolano manuel bartual callate la puta boca ya imbecil,0
Estos árabes le andan metiendo duro a la publicidad de sus canciones en YouTube.,0
"[USR] Cualquier motivo es bueno para enseñar carne, eh zorra. 🌚",1
"y hola, hablamos por favor de lo puta ama que es Carlota, es que esa mujer es mi spirit animal",0
"Si la lucha contra el machismo consiste en que ellas se desnuden constantemente, los hombres estamos de suerte. Sigan luchando ;) #TetasFree",1
Cuando un tío te pide una foto guarra y tus amigas te aconsejan que le envíes una caca y se meten a google a buscar la caca más realista [USR] #nopuedoreirmás,0
¿Te gusta la comida árabe? Aprende cómo se hace el Falafel [URL]  #siguemeytesigo,0
"A ver. Si quieres enseñar, lo haces, ¡pero bien! No cómo puta, nada más picando para conseguir follows 😡😡 [URL]",1
No es puerto seguro. Un rescate no puede terminar ahí. El jefe de rescate del 'Aquarius' asegura que su barco no dejará a ningún inmigrante en Libia [URL],0
Salvamento Marítimo y el Servicio Marítimo de la Guardia Civil rescatan a 291 inmigrantes que viajaban a bordo de siete pateras - [URL] #motril #noticias [URL],0
"JAJAJAJAJA zorra sos vos mi amor, por teclado somos todas malas eh pero en la cara nunca nada vos, RIDÍCULA😘",1
"Ven, comemela y cállate ya",1
"[USR] Traidor hijo de puta¡¡, carcel comun te mereces basura¡¡, sos una lakra, Timmerman¡¡",0
"Vamos la puta madre, te lo mereces flor 💖",0
"Absurda Europa y Bruselas. El populismo es lo que tienen ellos declarando un igualitarismo y socialismo fracasado , un estado de bienestar para inmigrantes ilegales y para quienes no trabajan y de malestar para el que produce y le quitan todo con impuestos [URL]",1
I added a video to a [USR] playlist [URL] PIO LA DITINGANCIA discute con un inmigrante Mexicano y lo manda a,0
[USR] [USR] callate la puta boca pesado,0
[USR] [USR] Callate la boca perra siberiana metiendo a CFK en esto! Sos tan pelotuda podes ser! Nunca seras nada,1
SALES EN FOTO ENSEÑANDO PERO NO ME PASAS NUDE. SO PUTA. FEMINISTA DE MIERDA. TE REPORTO. Os juro que me lo creo 100%,1
Le cuento las secuencias de la noche a mi mamá y me dice xq no se quedaron en sus casa carla😢😢😢😢me acuerdo y lloro peruanos hijos de bien puta vuelvan a su país indocumentados hijos de putaaaaa,1
[USR] Eso se pasa con un simple 'PERRA YA CALLATE!!!',1
"Despacio sobre mi, mirándome cachonda, besándome sin deejar de moverte, tu coño aprieta fuerte mi polla que entra y… [URL]",0
La esposa de mi jefe pasó de ser “la güera que seguro es bien mamona” a mi “mamá tapatía”,1
"Hecho: Colombia es una especie de país perteneciente a SUDACA (sudados sudamericanos) donde hablan muy lento con un acento espantoso e incomprensible, piensan aún mas lento y siembran cocaína en las maletas de los turistas extranjeros en sus aeropuertos.",1
"[USR] Yo ya a la mínima me pido médica para todo. Cansada de tanto imbécil que como este, dice que hace mucho... Mucho para su privilegio.",0
Yo no te discuto como sacar una muela así que cállate la puta madre,0
"Mi perra me odia,es enseñarle la correa pa salir a pasear y se pira corriendo a esconderse. Es mas vaga que yo casi",0
"Las bandas de metal sudaka no tienen derecho a cantar en español. O sea, ya de por sí el cantante de afinar cero, lo mínimo es que sepa inglés el vago gutural.",1
"Yo no soy envidioso, pero te veo con el y me pongo celoso  dile que tu eres la que quieres, que yo nunca te acoso  se que lo que hacemos, es peligroso, siempre chingamos  arrebato viendo todo borroso🎵🔥",0
"Violencia machista, acoso escolar, violación de derechos humanos, privación de libertades, homofobia, racismo, precariedad, corrupción ... Que en 2018 avancemos para terminar con todo esto. Salud y felicidad 😘❤️",0
"[USR] [USR] traidor hijo de puta! ...ni tu propia sangre respetaste. Mereces por lo que pasas, basura inmunda. [URL]",0
Otro montaje sobre los refugiados ahogándose en el mar [URL],0
[USR] Tu eres una perra comunista!,1
"Comentario ESCATOLÓGICO: Si no hay papal del culo, deben abstenerse de acercarse a la valla de Melilla, al menos hasta que los ""lindos negritos visitantes"" estén ESTREÑIDOS. [URL]",1
"#Bienvenidos13 panel proges,hipocritas, contradictorios entre ellos mismos,aplaudiendo,un feminismo marxista aplaudiendo una inmigración que pudre nuestro país.Que pones como noticia país a un delincuente detenido en Indonesia y Acusaciones a un periodista.",1
"¿Ta malito? Nombre ¡ta' rebueno!  Apúntale güero, aprende a preparar unos tamalitos, hay que irse preparando pa' la Candelaria. [URL]",0
"TIENE DENUNCIAS POR ROBO ¿Y LAS DE ACOSO DONDE ESTÁN? TE LO MERECES POR LO MIERDA QUE FUISTE TODA TU PUTA VIDA, NO PUEDO DEJAR DE REÍRME JAJAJAJAJAJAJA",0
"Cuarto. Tienes 13/14 años ¿por qué aún piensas de esa forma? DEJA DE PENSAR QUE UNA MUJER ES UNA GUARRA POR ENSEÑAR SU CUERPO. Empieza a echar cabeza cielo, porque el mundo se te come.",0
[USR] [USR] [USR] [USR] Y tu eres mi esposa ve a la cocina zorra >:v,1
Iusport: << El israelí Gilady seguirá en el COI pese a las acusaciones de acoso y violación [URL] >> [URL],0
Los que asaltaron la valla de Ceuta con lanza-Llamas y con cal viva  ¿ También son victimas [URL],1
[USR] CÁLLATE PUTA YA VAS A VENIR POR MI CONOCIMIENTO EN PEDAGOGÍA,1
[USR] [USR] [USR] Pero el escenario que describe no es de acoso. Es de violación y asesinos,0
[USR] [USR] Callate hijo de perra no soy masista. Tu eres de la misma calaña q quintana. Hijo de puta no toenes moral para reclamar nada. !!!,0
Que enriquecimiento para España..[URL],0
[USR] [USR] [USR] [USR] [USR] No la he visto todavía. #todasputas,1
Controles policiales durante 24 horas a pesar de ser una frontera Schengen provocan un goteo diario de #migrantes y #refugiados rechazados en la zona fronteriza de Irún-Hendaya. #FronteraNorte  [URL],0
"Jajajajajajajajaja...  Como van quedando en evidencia, los seudo gurús shilensis sudacas al cuete... [URL]",1
Alfred se merecía estar nominado en serio. Qué puta vergüenza #OTGala9,0
"Atención por que ⁦[USR]⁩ no solo quiere acoger a los moromierdas que entran ilegalmente, ahora se quiere traer a toda la familia. La casita, paguita, sanidad, etc, lo vamos a pagar Vd, yo, todos los que lean esto y los que no. #ASCO  [URL]",1
"Pues este año, aparte del montón de moros de siempre, he visto una jartá de árabes",1
[USR] [USR] [USR] [USR] [USR] Coño eso parece un lobo xdios..donde esta el lazo del pelo ehhhh 😈😈😈😈😈,0
[USR] [USR] [USR] Tú apoyas a la escoria terrorista del estado español puto imbécil,0
Este amor por la comida árabe y mediterránea no se acabará 😻,0
[USR] Tu te as ido por que no tienes ni puta idea de lo que es un hombre de idea tu eres un chaquetero fascista naci,0
"Ya ando bien pedo mi razita, mi vieja bailando la muy puta enseñando las nalgas.",1
Es que nadie va a ser capaz de no cagarla de una puta vez? Coño ya con las tonterías,0
"Primero te perreas todo, bailas como si no hubiese un mañana y después escuchas bien la letra de ""Arabe"" de [USR]",0
MIRA TODO LO QUE DESPERDICIASTE LA PUTA QUE TE PARIO NO TE MERECES VIVIR [URL],0
Y pensar que la perra desgraciada me muerde cuando trataba de enseñarle trucos o a saltar la cuerda. ;_;,0
"Tengo una perra q es lo más ruidoso q existe. Cada día me ocupo d enseñarla. Intento q mis vecinos no vean interrumpida la paz d su hogar x los ladridos d mi perra. En cambio, a mis vecinos y sus fiestas 'te los comes con papas'. Tal cual #comolavidamisma [URL]",0
"Periodistas árabes afirman que Israel utiliza las fuerzas de la naturaleza en la guerra contra el Islam  Señores la naturaleza no existe , es la accion de DI-S. en este mudo, segundo asegundo",0
"La mayoría de la población de Estados Unidos es inmigrante. Si se unieran por sus derechos, la situación podría ser diferente. [URL]",0
#Opinión Aquí está la #ColumnaDeHoy de María Elena Menéndez: Los refugiados sirios en el mundo [URL] Colaboración desde [USR] [URL],0
"La misma zagala al zagal que le acompaña: 'Tú eres gay de postureo. Qué tienes 16 años y no has olido ni una polla'. Ésta niña es una mina y por lo que parece, experta en pollas.",1
"EEUU. Una investigación forense realizada con cuerpos de cerdos muertos colocados en el desierto de #Arizona (EE.UU.) hace temer, por la rapidez con que ""desaparecen"", que las cifras oficiales de muertes de inmigrantes indocumentados sean muy cortas. [URL] [URL]",0
"Una persona guarra es alguien que no mantiene una correcta higiene personal, ¿qué tiene eso que ver con enseñar el cuerpo?",0
Los asaltantes subsaharianos de la valla de ceuta estan bien entrenados militarmente. Acaso en las fotos ve a muchas mujeres y niños? Porque yo no veo esas familias huyendo de la guerra que nos intentan vender. [URL],0
Yo tengo un pana que su novia es tan puta que en vez de ponerse condones antes de chingar debería tomar antibióticos.,1
QUÉ ESPERAN PUTOS SUDACAS [USR] CONTRATEN AL CALVO DE ALMEYDA TIREN PARO,1
-¿cual es el vehículo de una mujer? -la aspiradora.,1
[USR] LLEGÁS A DECIR QUE ME VIOLE A ESE ÁRBOL Y TE PEGO UNA PIÑA EN LA CARA QUE TE VA A DEJAR UNA MARCA DE MILANESA A LO BATMAN ahre,0
"[URL] Es gracioso pensar que android saldría así y en iphone pasaría como el símbolo árabe, que se va el terminal directamente a la verga we",0
Esta tarde me dan un regalo de reyes que aún no había llegado. Ya os enseñaré la puta pasada...,0
"[USR] Hijos de puta,te mereces lo peor del mundo junto con los desgraciados que te rodean,ladrones,malandros",0
[USR] CALLATE PELOTUDO FORRO HIJO DE PUTA,0
[USR] Cállate puta Katy Perri de los xiniyos (y nunca mejor dicho),1
"[USR] Tú eres un perfecto hijo de puta, que defiendes asesinos como Otegui. Mierda de chusma perro flauta, ojalá te quedes tetraplejico y la embolia para tu padre y el infarto a tu madre gilipollas",0
"[USR] [USR] [USR] Tú,como siempre, dices tonterías. Lo del acoso escolar lo habéis mencionado vosotros. Manipular se te da bien. Y tonto, eres, mucho. Renuncia a tu acta de diputado del parlamento de España. Sinvergüenza.",0
[USR] de puta madre chaval notable se lo boy a enseñar a mi madre,0
Tú crees que eres cool y no eres una zorra y droga — y tu eres mi fan que tan pendiente a mi vida estas ... [URL],1
¿se sentirá alguien libre de llamarme puta por enseñar un pezón?,1
"[USR] cállate, puta herniosa que estás chocheando ya con la ciática jajjaa te jode? ME ALEGRO jajaj jódete jajajajaja JÓDETE me oyes? JÓDETE JAJAJAJAJAJAJAJA este es mi regalo de Santa jajajajaj jódete jajajajaj te duele? malegro, debería dolerte m",1
"[USR] Te conteste zorra, te conteste, asi que callate y contestame.",1
"La Gendarmería fue directo a provocar, son unos hijos de puta. Hay que bajar a este gobierno de mierda",0
[USR] pues blokea a quien te de la gana comepollas de florentino gordo q no ves la puta realidad callate ya botijo,0
mi hermano: QUE YO NO SOY RACISTA JODER ATRÉVETE A LLAMARME ESO OTRA VEZ  mi hermano: encima que nosotros somos españoles y les dan todo a los putos moros y a los negros y nos quitan el trabajo y ...,1
Denuncian abuso sexual en refugio de niños inmigrantes de Arizona | Diario Noticias Web [URL],0
STRANGER THINGS MERECÍA GANAR HIJOS DE MIL PUTA ME CHUPAN LA PIJA TODOS #GoldenGlobes2018,0
"[USR] [USR] Por supuesto que no todos son así,la mayoría son como el como la escoria de al lado, por cierto a lo segundo en que mundo vives? Xdd",0
"Cara Delevigne, acusada de fomentar el acoso y la violación en su nuevo anuncio [URL] [URL]",0
Si leo una vez más que Victoria Donda se merecía que la repriman por PUTA salgo a los tiros.,0
"Odio esperar en cajeros la reconcha de tu madre puta, te voy a enseñar a usar un cajero hijo de puta, la puta que te parió te odio",0
[29/10 14:01] Kundogan: Yo no estoy hablando contigo cállate la puta emoción,0
En tu cara zorra. [URL],1
"arabe es un re temon papichamp y ecko la rompen, yo les retumbo las nalgas a lo twerk loco los amo",0
mi novia es una guarra no se ducha desde el año pasado 😂😂😂👏👏👌👌,0
"Te puedo tener todo el respeto del mundo, pero esque con una puta voz que me des ya no te lo mereces. Entenderlo respeto por respeto.",0
|| CALLATE LA BOK ZORRA MAL PARIDA [URL],1
"#Reseña: Las lágrimas de una inmigrante, de Karem Suárez [USR]  [URL] #libros #lectura #escritoras #mindfulness #CrecimientoPersonal",0
"Pues no éramos un país laico?? Me he perdido algo y ahora el Islam no es una religión?? Qué será lo próximo,  quitar las ayudas a la iglesia para dárselas a las mezquitas??  Marque la x en su declaración para ayudar a la mezquita... 😠 [URL]",0
hola rubius te sigo desd qUE TE CALLES LA PUTA BOCA A QUIEN LE IMPORTA,0
"Sonya porque tuviste que morir ptmr te odio pendeja, tenías que quedarte callada zorra sin alma [URL]",1
[USR] [USR] Así como tú eres maricón y puta tapiñada 🤣 tu obsesión solo produce risa.,0
"De música árabe, Rachid Taha y su canción ""Ya Rayah"", hermosa canción y de la voz ni se diga... #mexico  [URL] [URL]",0
vos me haces eso te pego una patada en la cara [URL],0
[USR] Cuando cumplas 18 te denuncio por violación y acoso,0
"Aquí no tienen nada que opinar, ustedes manejan como quieren su inmigración, es su derecho, nosotros aquí también, imite el respeto de su presidente y ayude en Haití. Robert Copley y la visita al país de los congresistas estadounidenses [URL] vía [USR]",0
[USR] Tú ni tu puta coalición me van a enseñar de izquierdas... fracasados!,0
Al dueño borracho d este coche q m acabo d encontrar abandonado en una cuneta: mereces lo q t ha pasado hijo d puta. X suerte nadie se cruzó en tu camino. [URL],0
Siguen llegando instantáneas del sábado en La Mula Rafaela   ZONA 84 Y los 4 SUDAKAS de la mano del gran Gustavo Villordo! [URL],0
[USR] Cállate perra. Jajajaja,1
Más de 600 inmigrantes de origen subsahariano accedieron a territorio español a primera hora de la mañana del jueves cruzando la valla en Ceuta [URL],0
"Ah, bueno.... El super ministro. Callate hijo de mil puta. [URL]",0
"[USR] Una sudaca de 38 años ha asesinado con alevosía ha puñaladas a joven varón de 27 en Tenerife, a la p. Cárcel",1
"También te estresa todo hermana' y bueno gil, callate la puta madre",0
Y eso traducido sería 'para la concha tuya que me estás spoileando todo y voy re atrás callate la puta que te parió'. [URL],0
yo: hol- todas vosotras: blanca puta gilipollas hueles mal vaya pozos tu bias es hy*kjae eres una rata sucia callate ya,0
"En vez de derrochar el dinero en los inmigrantes indocumentados, preocúpese mejor de nuestro ancianos [URL]",1
"[USR] eres una basura de persona, lo cual no me sorprende porque eres SUDACA, y asi son los tercermundistas",1
Hijos de puta! Os merecéis lo peor... Q asco me dais! 😭😠 [URL],0
"Haber de la güera de rancho no me sorprende su actitud de altanera, envidiosa y creída. Pero de la monja?✊ Mustias #TeamAlan",1
"Créeme, yo estudio Veterinaria y tu eres una perra.",1
"Si dedicáramos tanto ""entusiasmo"" en deshaucios, refugiados, presos políticos, subida de luz, contratos basura, etc... en lugar de dedicarlo a Pablo Casado, creo que nos iría un poquito mejor.",0
"[USR] [USR] GUARRA mejor busca alguien que te ponga mirando para Cuenca, que es lo que te hace falta, Guarrilla",1
"[USR] Nerea callate la puta boca, y aprende a jugar más campeones chone",0
"[USR] [USR] Callate la boca la puta madre. . . . . . . . . DEJÁ DE RECORDARME QUE TIRAMOS 3 PALOS VERDES Y MEDIO A LA BASURA POR PERRUZZI, Y QUE ENCIMA BOCA NO VA A PODER RECUPERAR LO 'INVERTIDO' 😒",0
"El río Guadarrama y sus Puentes #Madrid [URL] Madrid y Castilla se comunican por el cauce del río Guadarrama desde época romana; árabes, castellanos, Felipe II, Carlos III... dejaron su huella Publica gratis tu anuncio: [URL] [URL]",0
Esto es lo que he encontrado.   [URL] vía [USR] Digital,0
".[USR] ""Sobrevivir no es delito"". Efectivamente, no le es. Pero vender sin licencia, sin cotizar, sin papeles, vender falsificaciones, herir de gravedad a gente cuando salís corriendo, comportarse con las normas de vuestros países (ley de la selva), SÍ QUE ES DELITO. [URL]",1
Solo me encanta provocarlo. ser su puta especial. ser su niña en sus piernas. ser tan dama cuando gime. ser tan esencial en su vida ser su señora mi señor. Natacha [URL],0
Pobre niño jesús... porque si le llevan lo que tu eres le va a caer tremendo comunista hijo de puta encima! desde venezuela con cariño... argentino sinvergüenza [URL],0
"[USR] Tu en tu amplia sabiduría, defineme cuando una mujer es perra",1
[USR] Hay vieja loca rana platanera zorra de medio pelo cállate que así te ves mas bonita,1
"hola tengo el hc de que hinata es mitad irlandés, que tsukki es mitad franchute y yamaguchi mitad latino >>> i'm in drugs",0
Vamos a ver si hay algún extremista de la mujer por aqui...,0
Güera Güera... 🙄🙄😍,0
"No hubo provocación, no hubo respuesta. Pero estos hijos de puta tiras piedras y rompen las vallas, que no lloren cuando los caguen a palos",0
"Sólo escuchar hablar a este tipo ME ENCABRONA LA VIDA, PUTA CÁLLATE! :)",0
ES AGUACATE MALDITOS SUDACAS,1
[USR] [USR] Quedate callada hija de puta roba novios que son la pucha jajajananaba,1
"[USR] [USR] Eso es no tener ni puta idea de gestión ni dos dedos de frente, al margen de lo patriarcal.",0
"[USR] Que rica te ves perra, pero te verias mejor enseñando esa puchita rica bien mojada",1
[USR] Igual lei que le decian perra a laurita ipocrita que no se merecia el bailando cornuda muchas cosas feas y lei cosas de las fans de lau tambien es horrible,0
"Arabe de ecko y papichamp es un temazo loco, quien no lo va a bailar en un boliche por favooooor🔥🔥",0
"De repente me siguieron 3 cuentas verificadas arabes, help no quiero morir",0
#VOX critica duramente a ⁦[USR]⁩ “Les da la bienvenida como si fuera un cartel del welcome de #Carmena “ ¡Expulsión inmediata de moromierdas!  [URL],1
Estoy hace 1 hora viendo videos de bailarines árabes y que cosa tan hermosa 💘💘,0
Es como 'maldita sea cállate ese maldito hocico perra de mierda' [URL],0
"Yo, Cide Hamete Benengeli, escribí la historia de un caballero moro, enamoradizo y aventurero; más algún  mal cristiano dio a la imprenta en Madrid una traducción infiel que poco y nada tiene que ver con la tradición de las noches árabes. [URL]",0
[USR] Manga de pitos cortos hijos de puta les voy en enseñar lo q es respeto puto de la patada en sus partes intimas que les voy a dar y mujeres ustedes tampoco se salvan conchas retobadas,1
[USR] [USR] [USR] Vas a sentir como sé mueve mí polla en tú culo de putita para qué veas que tú amo no sé olvida nunca de darte tú ración de leche en ese maravilloso culo peludo de putita,1
[USR] Pero tú eres puta del PRI,1
NO SE PORQUE NO EXISTE UN CONTROL FRONTERIZO CON COLOMBIA RADICAL TRANSEÚNTES Y AUTOS TRANSPORTE DE TODO TIPO ADEMAS TODO COLOMBIANO INDOCUMENTADO DEPORTADO  BASTA CARAJO,1
Los Coscu Army  [USR]  dice algo de sudacas :v [URL],1
"Infeliz no seria un termino que el se merezca... No soy Dios para juzgar, pero este hijo de puta merece el infierno en tierra. [URL]",0
"Demandan a Trump por trato ""inhumano"" a indocumentados - Estilo FM [URL]",0
[USR] ¿Porque no te prostituís guarra ? Aprende a respetar a otros fandoms o que ¿buscaos atención?,1
"[USR] Puta semejante culero, deja de estar jodiendo, una verguiada de mereces",1
Cuando la Güera se siente triste y queremos subirle el ánimo. [URL],0
Albondigas! Casi al estilo de las fodongas pero en el Gabacho.,0
[USR] [USR] Gracias compañero! Hay que dejar claro quién manda!,0
Para mi si querés llegar a latinoamerica no suma el discurso argento de nosotros somos descendientes d europ.. Nose un mexicano nos diria para loca somos tos sudakas..,1
Puro cuento este #oportunista #vendido al narco régimen #SOS #DDHH #CRISISHUMANITARIA #Venezuela #InjerenciaHumanitariaYa #VenezuelaNoTieneTiempo #VenezuelaNoAguantaMas #FueraTiranía #CARCEL al #DICTADOR #Genocida #Corrupto #INDOCUMENTADO y SUS #COMPLICES #JusticiaYa [URL],0
hdp solo sudacas tenian que ser [URL],1
l'arabe arabé [URL],0
"NO huyen de ninguna guerra, cuando huyes de una guerra no vuelves a tu país de ""vacaciones"" con las ayudas del estado español. Pero que no es nada nuevo, casi la totalidad de las mujeres ""sirias"" llevan velo cuando Siria es un país cristiano. [URL]",1
"España está siendo invadida por los subsaharianos, y aquí Don TONTO, jugando al corro la patata, desde la Moncloa #caminodeVenezuela #Señorllevamépronto [URL]",1
Jajajaja cállate perra 😂❤️😂😂😂 [URL],1
"¡detende a los crímenes de Arabia Saudita y los Emiratos Árabes Unidos en Yemen! ¡Estos son crímenes de guerra y genocidio, simple y llanamente!",0
[USR] [USR] BIAN LA PUTA MADRE TE LO MERECES MAS QUE A NADIE,0
La pelea entre mujeres son tan ????¿¿ —cállate puta que tienes extensiones —cállate tú maldita perra que tú broceado es más falso que tú,1
Ea pues ya solo falta que Albert Rivera vaya a Algeciras a abrazarte con los inmigrantes subsaharianos,1
"INVASION de #Moromierdas Así pararon los vecinos de #Motril un CIE para 400 inmigrantes. Ellos prefieren tenerlos sueltos, pululando por el pueblo sin nada que hacer, ocupando y ensuciando plazas y parques e insultando sexualmente a las mujeres. [URL]",1
[USR] [USR] [USR] Cállate puta lesbiana peronista,1
[USR] Pues dispuesto a ser un amo muy exigente! empinarte a mi gusto y nalguearte como te lo mereces por puta cachonda y zorra,1
"LOOOUUUU SOS UN AMOR LA PUTA MADRE, VOS TAMBIÉN TE MERECES EL MUNDO 💙✨💗 [URL]",0
[USR] no puta levanta tu coño puta busca trabajo puta consigue un negocio puta chupa una polla puta,1
[USR] [USR] Cállate hijo de puta te insulto como vos lo hiciste con el Pte de Cámara De Diputado cargo q te queda grande imbecel trepador y traidor no te quieren ni tus hijos SORETE,0
"[USR] [USR] HAHAHAHAHAHAHAA, con olerlo se pone to siega la tia sabes, los viernes que me da no son normales la zorra",1
[USR] No digas nada que tú eres cómplice de lo que está pasando... y recuerda seguirás siendo la perra más perra de Venezuela,0
