text,label
"Me quieren seguir en ig un montón de árabes/turcos/israelíes,creo que tengo cara de terrorista y no me di cuenta",1
"A esto me refiero cuando el discurso de la ignorancia está por sobre la empatía por el sufrimiento ajeno. Todo lo relativizan y como no les afecta, no les importa. Quiero un país donde este tipo de personas sean los menos. [URL]",0
sara puta con mi pingo se ahoga — callate deja a mi hija [URL],1
Qqqq buen tema arabe,0
"#Seguridad #SLP |  *Graves, integrantes de una familia tras chocar su camioneta con un tráiler. [URL] *Aparatoso accidente en el Periférico deja un muerto. [URL] *Inmigrante muere al caer del tren. [URL] [URL]",0
Venezolanos echados de su propio país por un cretino extranjero indocumentado títere de Cuba... Que bolas... [URL],1
"Ultima hora: El ministro del interior, Grande Marlaska, ha dicho a los guardias civiles de Ceuta que cuando salte la valla el negro del whatsapp que lo detengan y lo trasladen inmediatamente a su domicilio en Madrid.",1
"Cuando se llega a eso,traen inmigrantes,que tienen muchos hijos,se soban las manos por mano de obra,recursos para pensiones y antes que se den cuenta nativos son minoría y cambiaran leyes,raza,creencias y costumbres,serán extranjeros en sus países [URL]",1
[USR] Cállate GUARRA!!!,1
Los huracanes con nombre de mujer son más letales' [URL],1
Como queda Arabe de Ecko.,0
EN TU CARA ZORRA,1
[USR] callate perra q t haces llamar mejor amiga zorra del orto aprende a escribir chau,1
"Soy moreno, siempre que me subo al coche lo primero que hago es PONER SEGURO a las puertas, no por ser Racista, POR MI SEGURIDAD, para asaltarte no hay distinción entre pinches güeros cara palida o prietos en aprietos. Su campaña está muy pendeja. ""#AsíVivimosElRacismo"" [URL]",1
solo quiero mover el culo con arabe y venirme a dormir,0
"Al final esos árabes hijos de puta me botaron porque ""perdieron la confianza en mi"". Y la verdadera razón es que estaba a punto de matar a coñazos a uno de los dueños por maltrato verbal y comentarios ofensivos.",1
Racismo es que hagas enfrijoladas con frijoles güeros y no negros.,0
[USR] [USR] ¡Tú no me das ordenes imbécil voy a destruirle la polla a ese maldito subnormal y voy hacer las cosas a mi maldita manera! ¡Apártate parásito!,0
[USR] Tú eres perra,1
Es racista para los africanos para los sudacas no... [URL],1
"Las ""güeras"" se enojaron,  que casualidad #baiabaia [URL]",0
"Ahí está la basura q viene a Europa! Los #migrants q asaltan la valla d Ceuta y agreden a los Guardias Civiles,  los d las pateras, los #WelcomeRefugees  Estos son los pobres negritos d las ayudas, subvenciones y sanidad universal. Esta es la mierda q agrede a nuestras mujeres. [URL]",1
extraño a mi árabe facho pq soy una maldita clingyyy ): 💔,0
"sacaron arabe y lumbre en spotify, es un lindo dia para vivir",0
"Miles d españoles licenciados q se han ido, o se han quedado, y se dedican a servir cafés a extranjeros ni 1 página  Al único negro q parece q no quiere dedicarse robar, vender droga, violar y vivir d paguitas titular a toda página  #NosTomanPorImbéciles  [URL]",1
"¿No jugó Estados Unidos o que? A las gabachas no les pueden ganar, me sorprende. [URL]",0
[USR] Estos personajes consiguen sacarme las pasiones más bajas. Me encantaría que terminara en la puta calle,0
"Baby, por qué eres así? Tú eres puta",1
"Y mis primas calladas pq saben que aquí la perra de la familia soy yo y que con un mensaje les arruino la vida perfecta que aparentan, a parte las dos me caen bien 🙄",0
Hasta cuando debemos aguantar el abuso d inmigrantes q no respetan  leyes y están ilegales en 🇨🇱menos a nuestros [USR] estos 🇨🇴 Deben ser expulsados y jamás regresar [USR] [USR] [USR] [USR] [USR] [URL],1
"Qué basura de vecinos, asquerosos, mezquinos e hijos de la gran puta que tienen que inventarse que el vecino hace ruido y van y llaman a la CNP para que se presenten aquí, en mi puta puerta, hace una media hora porque les apetece molestar al vecino de arriba.",0
"mi primo me está enseñando los videos donde sale todo pedo restregándole el culo a otro vato memeo que perra me salió, lo amo a la verga",0
Güera [USR] muchas felicidades que te la sigas pasando de maravilla. Te mando muchos besos 😘 te quiero montones ✌️,0
[USR] Me apunto para enseñarle a volar a ese hijo de puta,0
Dice mi mejor amiga que te calles puta,1
Hay que hacer las cosas callada la boca la puta madre.,0
Negratas con 6 patas [URL],1
Yo nunca le he dicho puta a una mujer pero socia tú eres senda petardo 😂😂 estas navidades no voy a comprar pirotecnias ya contigo vasta 😂😂😂,1
Te mereces todo lo mejor Pero no en esta Vida pinche puta.,1
"Macri callate HIJO DE PUTA, TE VOY AHORCAR CON MIS MANOS!",0
[USR] Tú eres bien perra 😂😂💪🏽,1
"Que buena canción Árabe, [USR] te amo.",0
[USR] [USR] [USR] Coño reseco vuelve a la carga. La reina del vaginesil.,0
[USR] Jeje callate perra,1
[USR] callate zorra del orto estoy en wilde dame bola,1
Dos mil RT a esta escoria... pero luego no fueron a Bruselas a pasear su odio y todo es culpa de los medios. Vía [USR] [URL],0
"[USR] Hola, Hola jajajajaja sorry, vi tu story time del árabe 😂  Tengo una súper duda, me acabo de meter a fb a ver las bases de la dinámica de corona y dice que comenzó ayer 2 de agosto y termino a las 11:59 pm :( es correcto eso?",0
[USR] [USR] No juego al FIFA como tú pedazo de hijo de puta hazte youtuber de fortnite y callate,0
[USR] Nany tú eres bien perra básica,1
"Lo primero que tendría que hacer Pdr Snchz cuando vuelva de vacaciones  es una sesión de fotos practicando footing en la Moncloa rodeado de  negros. Perdón, subsaharianos. Con eso lo arreglábamos todo. Hasta podríamos usar a Obama de extra",1
"[USR] [USR] Callate Ivan el Tonto, No hay pruebas !!! Donde estabas hijo de perra cuando gente como bucaram, Lasso , baqueros, y oportunistas se comieron al Ecuador y se repartian en pedazos, cuando no habia ni carreteras ni hospitales, ni me",0
"[USR] Le decía CÁLLATE LA PUTA QUE TE PARIÓ, INVITAME A CANTAR CON VOS, NO TE DAS CUENTA QUE TE AMO? DALE PORQUE YOOOO NO QUIERO SER TU NOVIAAA, Y LAS PALMAS ARRIBA BIEN ARRIBA BIEN ARRIBAAAA NO ME IMPORTA TU HISTORIA ASBSBDISA EEEEE WACHO LA BIRRA,",0
"[USR] Jajaja respondes este y no los otros tweets, callate marico en serio no tienes ni puta idea de que hablas",0
[USR] Que te calles quejica hostia puta si mola,0
"[USR] [USR] Calláte tú,fascista catalán de mierda,escoria humana,deshecho de tienta,rata de cloaca....y deja a tu madre en paz, la pobre....",0
Campaña para que ley Rapa Nui se extienda a todo el país y así frenar la inmigración,1
Bajo a sacar a mi perra al paseo y pasa un africano y se sienta enfrente de mí a mirarme fijamente desnudandome mentalmente pq aquí a 40° voy con un mono de playa y no debe estar acostumbrado. Me he tenido q levantar e irme pero no puedo denunciar por acoso porque es inmigrante.,1
#RacismoEs  que los tres García anduvieran detrás de la güera y que ella se quedara con el más güero de los 3 [URL],1
Yao muerete de una puta vez vengo de parte de dosogas coscu army renzo y muchos youtubers mas tu eres un tocapelotas primero insultas a una conductura de tv despues amenazas a renzo a fabriml y haora a quien vas a amenazar andate a la mierda hijo de la gran puta #RIPYAOCABRERA [URL],0
Lost en el Gabacho recomendado Gala Ropa By Karla Carrillo #boutique #tijuana #recomendacion #famosa [URL],0
Los putos #MoroMierdas envenenan a los perros y exigen su prohibición. Mi perro es más limpio que cualquier piojoso de estos  [URL] [URL],1
En un descuido y los güeros estén detrás de todo esto! [URL],1
quiero ponerme un icon de dua pero no puedo elegir porque esa mujer es tan hermosa la puta que me parió,0
"¿Cómo fue tu cita mas incómoda? 😳💔 — Corría el año setecientos diquitidós. Decíamos ""diquiti"" en lugar de ""veinte"" porque los árabes d... [URL]",0
"[USR] Callate, no te metas con mi perra 😑",0
[USR] [USR] [USR] Si no estoy apoyando su ideologia soy un machista hijo de puta asesino resentido social,0
[USR] [USR] Cállate perra,1
Es por que no soy güera?,0
"[USR] un RT para SEMEN, Movimiento machista internacional!",0
"Hoy he salido de cas como un rey Esto es, se me ha olvidado la cartera en casa y voy indocumentado y sin un duro",0
Ufff cuando suena árabe en le lac se me para el pene,0
Las #niñas #niños y #adolescentes pueden ser #refugiados. Las cifras de [USR] muestran la enorme vulnerabilidad de NNA al desplazamiento forzado [URL],0
Puto sudaca de mierda — 😘 [URL],1
"Los últimos episodios de violencia ejercida por subsaharianos en Ceuta, Barcelona y Salou nos demuestran que no son buena gente y que no aportan nada positivo a nuestra sociedad. Stop pateras, no a la invasión",1
"Cuando tu eres la única que sabe hacer Picoway Resolve y todas quieren que les enseñes, te sientes la más perra del mundo 😂💆🐩",0
"#españaesuna #stopUE #stopOTAN #stopLGTB #stopglobalizacion D_Nacional Los españoles, lo primero. D_Nacional: RT D_Nacional: Alarma por los más de 50.000 subsaharianos que esperan en Marruecos para cruzar a España LA INMIGRACIÓN MASIVA VA A DESTRUIR ESPA… [URL]",1
Cada quién se ofende de lo que quiere y por eso es absurdo sancionar el lenguaje ofensivo. A mí la neta me viene valiendo dos héctareas de...si me dicen “pinche güerito” pero que justifiquen que eso está bien porque otros güeros en otra época y lugar fueron unos OGTs pffffft! [URL],1
Yo soy fiel creyente de esto Jajajajajaja porque en Cartagena terminé hablando con un arabe en inglés toda la noche 😂 como ? No tengo idea [URL],0
Mi novia es la mujer más hermosa que he visto en mi perra vida.,0
[USR] Ya tengo claro q tu eres tonto y ya está ..eres como un loro todo lo que ves lo pones sin tener ni puta idea de lo q pones...es q otra explicación no le saco...tb te vas ahora con los vascos...por si los catalanes tb se sale rana.,0
[USR] [USR] Callate gil!! Sali a laburar trollO. En tu puta vida moviste un dedo.,0
Amaia besa a Alfred y cuando recuerda q hay camaras dice q ha sido sin querer JAJJAJAJAJJA Esta chica es la polla 😂😂🙌🙌🙌 (Lo unico malo es q esa escena tenia q grabarse desde la otra camara para poder velo mejor!!!) #OTDirecto14D,0
NINGUNA MUJER ES 'PUTA' ❗❗❗ [URL],0
no puedo dejar de escuchar Arabe q alguien me pare,0
"Hay muchas mujeres que siguen calladas y con miedo a perder su trabajo' Norma Cardozo, víctima de acoso en [USR] #R800AM",0
[USR] [USR] [USR] [USR] QUE NOOOO QUE NOOOO TU ERES ALIADO DE JORDI EL NIÑO POLLA,0
[USR] CÁLLATE PENDEJA NO PEDI PUTA OPINION DE CAGADA Gracias ❤,1
Basta de victimizar a Cacho porque es de otra época!!!! Acoso y violación es lo mismo ahora y en 1970.,0
[USR] [USR] Jajajjaja callate hijo de puta niño de mami ese juego nosotros los latinos lo esperamos con ansias,0
"[Foro] Abrimos las puertas a nuestra partida de #EdadOscura 20º Ani. por foro de #HispaniaNocturna. Los Lasombra ya han comenzado a reclamar el trono de Toledo, mientras que vástagos del Reino de León miran preocupados a las hordas árabes que se aproximan a la capital del Tajo... [URL]",0
[USR] [USR] [USR] A saber el “orden “ que pone en su casa ante su familia. Hijo de puta cobarde!!!!,0
si te llamo puta es porque tu eres mi puta pero habrá problemas si alguien más te llama puta,1
LA PUTA MADRE POR QUE TÚ ERES MAJA Y LA MIERDA DE TU PERSONAJE NO ME TIENES HARTO [URL],0
CÁLLATE ASQUEROSA PUTA DE MIERDA ZORRA [URL],1
Amo a mi güero 😍🤷🏻‍♀️ [URL],0
"[USR] [USR] [USR] Callaté perra, que es la cuenta B de arrimadas?? 😱😱",1
[USR] A ti! Movimiento SEMEN!!,0
"Cristina ve cámaras y se descontrola. No es cadena, la puta madre callate ya.",0
"Nuria Vandenberghe considera a los subsaharianos integrantes de una banda organizada al estimar que ""el asalto fue llevado a cabo a través de una organización minuciosa, no fue un acto espontáneo"" [URL]",0
[USR] Mmm... Cuidarte y follarte con ganas y llenar tu coño con harto semen,0
[USR] tu eres putifandom porque quien no es puta no disfruta airw,0
"Lo de Salou solo es el principio. Ya están saliendo muchos autocares rumbo a Cataluña llenos de subsaharianos, porque dicen que allí Colau lis trata de lujo",0
[USR] Movimiento SEMEN apoya esas tetas. Un RT para difundir la campaña!,1
"Pablo Casado acusa a los inmigrantes de las altas temperaturas porque ""el negro atrae el calor"" [URL]",1
"Mi hermana está escuchando la puta BSO de Guardianes de la Galaxia, cuando vence Star Lord a Ronan. LA ESTOY ENSEÑANDO BIEN.",0
[USR] YA CÁLLATE HIJO DE TU PUTA MADRE [URL],0
5. El típico gilipollas que te grita puta y de todo por llevar un escote o ir enseñando un poco las nalgas. VOY A VESTIR COMO YO QUIERA SUBNORMAL DE MIERDA.,0
[USR] ¡Cállate! Zorra insensible.,1
"[USR] [USR] Cállate estúpido de mierda anda a la puta que te re mil parió pajero de mierda sos boludo nene que te haces ahí,se escribe ESTÚPIDO no est*p*do",0
"Vaya perla de sabiduría de esta gentuza: “No es tan malo que los refugiados musulmanes violen a las mujeres suecas, ya que es algo cultural en ellos” - Barbro Sörman (diputada socialista feminista. Fuente: [URL]",1
[USR] Comemela tú a mi a ver si acabas algún día,0
"Si un español agrede a un GC, echándole cal viva, excrementos, etc,le caen 5 años de cárcel, si lo hace un subsahariano e inmigrante, le damos cobijo,comida,etc algunos partidos políticos lo aplauden,si piensas como yo,algunos gilipollas te llaman,racista,franquista y fascista.",1
Hola.   Según yo iba a subir fotos cada semana pero he estado muy ocupado haciéndome pendejo. Hoy les traigo a Domino y Güero. Se veían muy cagados solo… [URL],0
Por que no se mueren manga de boludos. Acoso es acoso aca y en tu culo chau [URL],0
[USR] Cállate a la verga pinche puerca tú eres Tigres puta,1
Nunca falta ese hijo de puta que dice -Se puso colorada!- cállate! Ya se dieron cuenta ! Haces que me de más verguenza!😣,0
A la puta cama de puta cállate la boca anormal.,0
[USR] [USR] CÁLLATE QUE NO VAS A SER ASÍ LA RE PUTA QUE TE PARIO TAS RE FLACA LOCA QUIERO TU CUERPO,1
[USR] CÁLLATE LA PUTA BOCA Y FELIZ NAVIDAD AMIGA <3<3<3<3<3<3,0
Ser inmigrante en la era Trump: la experiencia de una docente argentina [URL] vía [USR],0
[USR] Callate puta te falta pico endulzado,1
ESAS COSAS Y OTRAS PUEDEN PASAR POR MANTENER A LA INMIGRACION ILEGAL EN ESPAÑA Y NO EXPULSARLOS ¿NO? - La agresión de los manteros a un turista pone a Colau en un aprieto [URL] vía [USR],1
"[USR] Soy pejezombie animal, si soy el lider de los pendejos y tu eres mi perra, eso que te hace a tí? 😂😂😂😂😂😂",1
¿Qué actor pudo ser un gran #Aquaman güero en el Universo Extendido de DC? Checa nuestro video y entérate de nuestras opciones 📺🎬🎞️:[URL] [URL],0
Los de la Under le pasaron todo su pene por la cara a Sudaca en traer al gran papacho,1
[USR] [USR] CALLATEEEE VOS PERRA ENVIDIOSA,1
"La derecha ya ha marcado su línea de disputa y discurso. Los medios tenemos, hoy, una gran responsabilidad en cómo contamos esta situación. Los inmigrantes llegados este año a España sólo llenarían un cuarto del Estadio Santiago Bernabeu. [URL]",0
"No te mereces ni el aire que respiras, escoria",0
Preferían enfrentar los peligros de regresar a su hogar antes que ser encarcelados en estas condiciones señaló la organización que también demandó a la policía migratoria ICE. [URL],0
"Siempre me cargó ese cuico culiao aspiracional, súperalo amigo, eres sudaca y gay.",1
Acá es como que vas al club a tomar algo y si o si tenes que cruzar a sudaca para qué tal está 🤷🏻‍♀️,0
"bueno, qué necesidad hay de quitarse la puta camiseta para enseñar abs pREGUNTO [URL]",0
"Cuando Franco vivía ningún inmigrante se hubiera atrevido a tocar a la guardia civil, a cruzar la frontera o a ser un ilegal en Barcelona. Cuando Franco éramos España.",1
"[USR] Callate come sobra, más zorra son las tuyas",1
Y CHILEEE??? CUÁNDO VISITAN A LOS SUDACAS 💔🙏🏻 [URL],0
"Un estado nación árabe islámico de los muchos que hay, protestando porque se cree el primer y único estado nación judío. Un ejemplo de quienes son los racistas e intolerantes: los musulmanes, estos a los que tanto adoran en la UE dandoles casas y pagas a sus inmigrantes. [URL]",1
Instan a granjeros de Colorado a “defender” a sus trabajadores indocumentados [URL] [URL],0
No soy racista pero QUE ASCO DAN LOS PUTOS MOROS. COMO DEPENDIESE DE MI QUE ENTRASEN EN ESPAÑA LO LLEVABAN CLARO ESTOS IMPRESENTABLES GUARROS Y MAL OLIENTES,1
me acaban aqui de enseñar al niño polla o deberia decir PRINGADO DE LA VIDA Q LO UNICO Q HA HECHO EN SU VIDA (indirectamente) ES TENER UNA POLLA GRANDE.... QUE. PUTO. ASCAZO. NIÑO.,0
Nao: el robot que enseña Alemán a los niños refugiados #Idiomas [URL],0
"[USR] Que te calles la puta boca, que tu existencia me repugna, gilipollas",0
Cambio de junta directiva club activo 20-30 Colon Sur en Club Árabe [URL],0
¿En que se parecen las mujeres y las polillas? En que unas comen tela y las otras te la comen. #EnTuJeta,1
[USR] Callate mentiroso hijo de re mil puta,0
"Estimado [USR], los catalanes no tenemos genes franceses. Los tenemos alemanes y tú eres un hijo de puta. Documento cedido por el Institut Nova Historia o como yo los llamo: 1984. La imagen es una coña, lo hijo de puta que eres, no. [URL]",0
-¿Que le falta a una Mujer para ser perfecta? -todo,1
[USR] callate puta q ibas a ir😑,1
"Pon pon, quien es? El Futbolista Abre la muralla Pon pon, quien es? El moro mierda Cierra la muralla  Pon pon, quien es? El árabe con dólar  Abre la muralla Pon pon, quien es? El negro en patera Cierra la muralla Pon pon, quien es?",1
Todas las perdonas güeras son bien maricas.,1
Tenía razón el güero cuando hablabamos de habitar ciudades enormes y ciudades chiquitas,0
"HSM cuando le requisan sus edificios okupados: pofa no me los requiseis que hay cumida  Ah pero el resto del año: putos moros, putos inmigrantes, putos rojos, putos maricones, putos indepes",1
El enojo de una mujer es como la luz de 'Check Engine'... no tienes ni puta idea qué está pasando y es mejor esperar a que se apague solo...,1
Santos firma un decreto que regulará a 400.000 venezolanos indocumentados su situación en Colombia [URL] via [USR],0
[USR] [USR] [USR] [USR] [USR] [USR] ERES UNA PUTA GUARRA,1
"#elcascabel06a oye, pavo agredido en Barcino por los negratas, menudo discurso político antipodemos te marcas siempre y menuda pinta como de entre exiliado en Miami y portero discoteca....turista o no, mira a ver si no formas parte de algún tipo de trama organizada o algo XDXDXD",1
"- Mujer, has progresado, solo has estado 2 horas en el telefono, por cierto quien era? -Nada, uno que se había equivocado",1
[USR] Tu novia es bien puta ......pero te lo digo en buen pedo 👌,1
[USR] Tu eres divina y perra también JAJAJAJAJJAAJA,1
[USR] Callate la boca burro maldito... Q vas a saber tu q contenían las proclamas d Bolivar.... Hijo de la gran puta maldito Burro,0
"Nadie puede ser la madre África Tú sigues el ritmo que ella te va a dar Necesito una sonrisa que puedas amar Haz que desaparezca, el sufrimiento de mil más  Jain - Makeba  [URL]  #Refugiados",0
Esto de ser Mexicano indocumentado no es divertido,0
"[USR] [USR] Pero cállate perra, que lo lo había visto xD",1
"La UE desbloqueará fondos para la migración de modo limitado: La Comisión, que no estima suficientes las partidas, activará 55 millones de euros para paliar este drama y dará la mitad para contrarrestar la avalancha de subsaharianos que llegan de Marruec… [URL]",0
"[USR] Cállate perra, Recalentado los que se echan los directivos de TV Azteca cada que te la pasas brincando de verga en verga, por eso dejaste a Fernando, porque te encanta la puteria",1
[USR] Tu eres mi perra en beer pong,0
Me ha gustado un vídeo de [USR] ([URL] - Molotov - Frijolero (En Vivo)).,0
"Te subis a un bondi y esta todo cerrado, ABRAN UNA VENTANA MANGA DE BICHOS REFUGIADOS",1
dices que no eres otaku pero te viste un anime de 148 capitulos hola??????????????? — Cállate la puta madre [URL],0
"Le Pen pide a España que expulse a todos los inmigrantes ilegales: Debe actuar como Italia o Australia"""" [URL]",1
[USR] [USR] Ya cállate pinche perra.,1
I checked in at Taqueria Los Güeros #2 on #Yelp [URL],0
"España, caos total: Un grupo de manteros subsaharianos se enfrenta violentamente a los Mossos en... [URL] [URL]",1
"Esto es posesión, machismo, acoso, violación a la intimidad de la persona, y nadie cae en la cuenta que están así por “un cariño” que acaba siendo una tortura. [URL]",0
[USR] Cállate PERRA!!,1
"[USR] Te lo tenías guardado a Kevin , zorra callada",1
[USR] [USR] 😂😂😂😂😂😂😂 odio los y yo másssssss jajajaja o pues a mi... callate la puta boca y escucha joder! JAJAJA,0
"[USR] Cállate, vos porque sos mas zorra que la china Suárez",1
Hacelo Reverendo hijo de puta! No mereces ser radical ni por herencia. [URL],0
[USR] Cállate perra por qué yo tq,1
"JAJAJAJA te lo mereces, perra [URL]",1
"EE.UU. ha deportado a #Guatemala a 28.516 #migrantes en 2018, de ellos 280 niños [URL] #deportaciones #repatriaciones #detenciones #inmigrantes #indocumentados #guatemaltecos #centroamerica #inmigracion #EEUU [USR]",0
Guarra buscando a un abuelo por la ventana [URL] [URL],1
"[USR] De mí se rieron por relacionarlo con el veganismo: 'mirad a esta loca las tonterías que dice, lo que me faltaba por oír.' Mi hermana les miró como si fueran mierda, no entendieron por qué eran los únicos que se reían en la mesa.",0
Me tiene podrida.. los cuadernos los bolsos los jueces corruptos los K los justificadores seriales de cualquier mala maniobra del gobierno la idiosincrasia sudaca.,1
[USR] tu novia es una perra Tiene las mismas tetas que una perra preñada JAAJJAAJA Que asco Tanto Ego que tienes mmgvo,1
#SNInternacional  Más de 40 muertos y decenas de heridos dejó ataque de la coalición árabe contra Al Hudaida [URL],0
"[USR] O el de los flacos cuando te vienen a decir de todo, o sea, si tu novia es una zorra problema de ustedes no mio...",1
[USR] [USR] [USR] [USR] Mereces la muerte zorra JAJAJAJAJA,1
"¿No sabes que es?, aunque hay gente que conoce muy bien de la comida árabe, averígualo aqui El Tahinat Beid [URL]",0
¡BUENO Y TU ERES UNA PUTA ARRASTRADA! Laidy Gómez cargó contra Guanipa y lo tachó de 'divisionista' [URL] vía [USR],1
"[USR] [USR] [USR] [USR] Las mujeres son mujeres tengan polla o no, no son mujeres atrapadas en cuerpos de hombre ni hombres q se sienten mujeres, por dios que me están sangrando los ojos de leer tal pego. Y cuidao, que",0
"[USR] [USR] Pero cállate hijo de la gran puta,si no te van a invitar a 'el faro' antes te tirarian por la Bahía con lastre al cuello...payaso",0
[USR] Cállate que asustas a la perra. (Y a mí también me das miedo),0
[USR] [USR] Callate hijo de puta pelotudo cómplice de la derecha! Llamaste a votar en blanco porque decías que eran lo mismo sorete! Acá tenés 'lo mismo' ahora forro!!,0
"[USR] Ese es el tipo de escoria que, en las escuelas de Cataluña, son contratados para enseñar 'curiosidades' a nuestros adolescentes en las jornadas de ¡Actividades Culturales! Hablo de lo que conozco y he visto.",0
"[USR] Ensuciar a alguien por resentida por así decirlo o algún motivo que no sea acoso , violación o maltrato es una pelotudes tremenda !!! Dejen vivir a la gente que no hizo nada y ensucien al que en verdad se lo merece.",0
"Cómo coño puedes decir que el partido de Benzema es malo, hijo de la gran puta. No mereces seguir disfrutando de este deporte si piensas eso.",0
[USR] su cuenta sería un constante CÁLLATE ESCORIA !!!! com muchos !!!! y mayusculas,0
"Y dos al musulmono, una por gilipollas, y otra, por si la pierde. [URL]",1
"menuda guarra, te parece normal enseñar las tetas por twitter? luego pedis respeto feministas — Bueno de guarra poco porque me ducho todos los días sorry [URL]",1
"[USR] Es más, a mí debería importarme una puta mierda que tú por la playa vayas enseñando el rabo. Es asunto tuyo.No mío. Ni de nadie más. De la misma forma, si tú usas tu desnudez PARA TRABAJAR, es asunto tuyo. Y si yo quiero verte en pelotas,",0
"-En que se parece una mujer a una foca ? -En que una es gorda, tiene bigote y huele a pescado y la otra vive en el mar",1
"[USR] [USR] Sois tan sumamente escoria, para provocar a las personas, para crear audiencia y sabiendo el día que os mandan al basurero,salvame lo ha dejado la gente de ver, no me extraña,yo sabía lo q hacéis para crear audiencia os invent",0
La mujer a su marido: -Llevamos 20 años casado y nunca me has comprado nada +¿Es que vendes algo? #Afregar,1
[USR] Cada vez enseñando mas el culo la babosita y Carmen parece sirvienta con esos trapos jajaja,1
"[USR] [USR] Y tu eres más escoria, defendiendo al corrupto gobierno..",0
"l #InformateEnHolaChile LOS RESEPONSABLES DEL INGRESO AL PAIS DE TANTOS INMIGRANTES DEBEN HACERSE CARGO DEL LOS PROBLEMAS DE SALUD DE ELLOS PORQUE ACTUALMENTE HAN VENIDO A AUMENTAR EL GRAVE PROBLEMA DE ATENCION MEDICA DE  CHILENOS ,OCUPANDO LAS POCAS HORAS DE ATENCION Y RECURSOS",1
[USR] [USR] [USR] [USR] [USR] [USR] Tu eres lo peor de la escoria que anda suelta,0
"[USR] Cállate la puta boca que te voy a reventar a hostias, payaso. (?)",0
"Te gustaría participar en una peli porno? buscamos tu perfil, una tia guarra con ojos bonitos y no muy guapa — Hostia, no te has esforzado mucho, sigue intentándolo [URL]",1
"Acá me ven y ya me hablan español, más sudaca no conseguís.",1
En el tianguis todos somos güeros [URL],0
"[USR] JAJAJAJAJAJAJA cállate perra 😂. Lo que debe ser ese video 🤢, we",1
