text,label
Tema inmigración de Venezuela como estamos y que bebemos hacer ayer mire un programa con abogados pidiendo abrir un estudio con todos ellos pera trabajar en Argentina no es como mucho que antecedentes tienen que hacemos con los nuestros es un tema a mirar antes que nos estalle,1
[USR] [USR] Cállate weon vendió. Cómo si no trabajáramos hijo de la gran puta!,0
"Porque andan llamando gata, zorra o puta a baekhyun si es hombre, manga de ridiculas",0
"Asesoramiento a #INMIGRANTES #BOLIVIANOS  Migraciones Mar del Plata recibe al Consulado de Bolivia   En el marco de una nueva edición de documentación y asesoramiento, el Consulado General del Estado... [URL]",0
[USR] Estos personajes consiguen sacarme las pasiones más bajas. Me encantaría que terminara en la puta calle,0
"Puse arabe en la previa. Cami me dijo, SÁCAME ESTO YA QUE HORRIBLE, pero en el baile le dio hasta abajo como si no hubiese un mañana...",0
[USR] Callate puta si vos te tomas hasta el agua de la zanja,1
[USR] [USR] YA CALLATE PERRA PLIS,1
"Luna vete a hacer un vídeo con el Niño Polla, imbécil.",0
[USR] [USR] Pero si tu eres Igual de perra Y rata Haci que no vengas a hablar maldita dejenerada >:v,1
"Cómo coño puedes decir que el partido de Benzema es malo, hijo de la gran puta. No mereces seguir disfrutando de este deporte si piensas eso.",0
Terrible tema para activar árabe de papichamp jaajaaja,0
"Y NADIE SE HA PREGUNTADO LO QUE LE VA A COSTAR AL HOMBRE DEL GUANTAZO LA SITUACION..?!? PORQUE SEGURO ES, QUE EL MENDA MUSULMONO LE VA A PONER UNA DENUNCIA, QUE EL FALLO VA A SER ""CULPABLE"", QUE UNA PANDILLA DE MUSULMONOS LE VA A ESTAR ESPERANDO DELANTE DE LA PUERTA DE SU NEGOCIO [URL]",1
"El río Guadarrama y sus Puentes #Madrid [URL] Madrid y Castilla se comunican por el cauce del río Guadarrama desde época romana; árabes, castellanos, Felipe II, Carlos III... dejaron su huella Publica gratis tu anuncio: [URL] [URL]",0
[USR] [USR] [USR] [USR] Mejor tu cállate zorra que tú pides likes a tus fotos horribles en Facebook y está bien fea jajajaja 🤣🤣🤦🏻‍♂️,1
[USR] Te mereces mas la portadabde la revista playboy.. Por zorra.. Y mentirosa..,1
Quiero que el pibe me diga “ tu eres mi puta la mejor que mama “ jaaja ahre,1
"Comportamiento ejemplar.. no paga billete se cuela, le pillan y se pone chulo y amenaza, que buena es la inmigración sin control, nos entran personas agradables, amables que solo buscan estar encima tuya.. pero no pasa nada. [URL]",1
[USR] lo mereces maldito igo d perra,0
"[USR] Ojalá no fuera así, pero tristemente lo es. Normalmente y gracias a Dios en el 90% de los casos son mujeres normales.+",0
[USR] Cállate tu puta zorra 😒👅,1
[USR] Cállate zorra si vos ya tenes 20,1
"Los peronchos nos quieren enseñar a gobernar , hijos de puta",0
Datos de [USR] muestran que los departamentos del Norte de Santander y La Guajira son quienes más reciben migrantes venezolanos. Ellos son vulnerables a la violencia y reclutamiento de grupos armados ilegales. Detalles en informe de [USR] [URL] #OVCS,0
"Hoy he salido de cas como un rey Esto es, se me ha olvidado la cartera en casa y voy indocumentado y sin un duro",0
"👞La huella dejada por los árabes en Al-Andalus, es decir, en España [URL] [URL]",0
Nunca confíes en el gordito güero orejon >:(,1
"Fui buena con un montón de personas que no se lo merecian, a partir de hoy voy a ser mucho más hija de puta con todos",0
+¿Es que solo sabes subir historias de tu perra? -¿Es que hay algo más que merezca la pena?,0
"[USR] [USR] [USR] Cállate viejo odiador , escoria como tú ha tenido al país en la miseria por décadas , lo único bueno es que ya estás viejo y estás más cerca del infierno que nunca",0
En el hormiguero están enseñando los filtros de snapchat como si fueran una novedad. Qué puta pena.,0
Igual tú para follarte a alguien te fijas en su personalidad pero en una APP que es para FOLLAR no todos tienen que tener el mismo criterio.,0
"A ver, pijoprogres,perriflauaas y demás basura roja...por que no metros a vuestra puta madre a enseñar el papo en una mezquita y dejáis de tocar los cojones a la iglesia y sus tradiciones?",0
"[USR] Oigaaaa, usted sí es ilusooo JAJAJA además, tú no eres perra, tú eres perrísima.",1
[USR] No lo necesitas porque los hombres (no todos) no sufren de la opresión y acoso que reciben las mujeres mi vida,0
Cuando no opinas como las #feminazis quieren sos acosador/abusador/violador.... 80% de las denuncias de mujeres victimizadas son falsas. #Femimoda [URL],1
[USR] [USR] Pues comemela,0
"[USR] El problema de ser un imbécil no es serlo,es demostrarlo. [URL]",0
"[USR] [USR] Por supuesto que no todos son así,la mayoría son como el como la escoria de al lado, por cierto a lo segundo en que mundo vives? Xdd",0
[USR] callate perra q t haces llamar mejor amiga zorra del orto aprende a escribir chau,1
"Mi novia es sevillista y es una puta más'. Cómo calificáis eso [USR]? No es violencia verbal hacia la mujer? Y lo sacáis en el canal OFICIAL de TV del club... Después os llenáis la boca. Retratados, una vez más. Sois de vergüenza. [URL]",0
"[USR] ¡Se quejan de los manteros, ¿Como se va a solucionar? :los autónomos asfixiados, los vecinos en plan de guerra, suciedad, mala imagen y esto no es de ahora, mucho bla, bla bla, pero sin soluciones¿Los refugiados los sueltan despues de X días? Para seguir aumentado",1
"[USR] Cállate perra, me contestas a las 11 de la noche",1
"Hija de puta, pero para los moromierdas, lo que éstos hijos de puta le pidan a la primera zorra de Barcelona. [URL]",1
mi novia es demasiado hermosa puta vida nojoda culo,0
[USR] [USR] JAJAJAJAJJAJAJAJAJAJJAJA CÁLLATE PUTA,1
[USR] Tu eres el menos indicado para hablar de España como patria porque la Odias...largate de una Puta vez con tu Jefe Maduro Gilipollas!!,0
no puedo creer lo que ronca mi perra y encima cada vez más fuerte hijA CALLATE,0
Podéis pagar impuestos y no ser inmigrantes ilegales y ya si eso dejad de intentar apalizar a turistas y policías. Después de integraros.... Entonces si podéis sindicaros [URL],1
[USR] callate camila y dame seguidores perra,1
[USR] [USR] Ti o cállate la puta boca y déjala en paz por que sabemos que no nos darás la razón así que dejemos el tema,0
Las ampliaciones de la valla de Melilla de los ayuntamientos del PP desplazan lentamente de los malnacidos de Manuela Carmena,0
[USR] Sii bb comemela t la meto hasta la garganta y que no puedas respurar por unos segundos,0
[USR] Puteria y perico también somos almas gemelas excepto que tu eres puta desde él vientre.,1
Me ha gustado un vídeo de [USR] ([URL] - Molotov - Frijolero (En Vivo)).,0
"[USR] No hay nada como empezar una conversación con un 'qué cojones dices tú, listo?' o con un 'tú cállate que no tienes ni puta idea'.",0
"Soy español, así que cállate la boca. Jake está diciendo que dejes de hablar en francés, perra, esto es español, aprende tus idiomas antes de hablar conmigo, compañero.",0
[USR] [USR] hijo de perra no me estes hablando asi tu eres mi puta,0
"Alqatie significa ""la manada"" en árabe. Es lo que en La Tribuna de Cartagena hemos denominado como ""La manada de Alá"". Y es que en España, que repetimos es refugio de mucha escoria dada la justicia tan patética que tenemos, hay manadas árabes. A continuación se las detallamos:",1
.[USR] quiere seguir buena racha en casa. [USR] buscará esta noche su primer gol en la [USR]. #LPFxRPC [URL],0
#HoyLeDoyUnfollow a los Nazis Sudacas!!!,1
[USR] Y tú eres mejor que ese cerdo hijo de puta de [USR] qué decepción de podemos [URL],0
[USR] puta pendeja zorra me cagas imbecil deja de putear pinche golfa,1
"¿Os imagináis a SEMEN como una opción en las elecciones? No nos interesa, pero quién sabe. Eso si, ni una sola mujer en el partido...",1
"[USR] Ah dos perdonas si pq le han dado fav así que callate la puta boca porque sé donde vives y no me cuesta nada quemarte viva a ti y a tu perro pero salvando a tus hermanos que me caen guay (es broma, también salvaría s tu perro)",0
Enamorada de Arabe 😍 siempre rompiendola [USR],0
En tu cara zorra. [URL],1
"Demandan a Trump por trato ""inhumano"" a indocumentados - Estilo FM [URL]",0
"#EXCLUSIVA:  Pablo Casado propone colgar jamones, morcillas y salchichones en la valla de Melilla, para evitar que los musulmanes la salten.",1
la mujer es una perla no una perra,0
"[USR] Jajajajaja cállate imbécil, tu perra casi se come a la mía 😥",0
[USR] [USR] Diego me caguen tu puta madre callate ya ostia puta me caguen diso,0
Racismo es que hagas enfrijoladas con frijoles güeros y no negros.,0
Cuando te dicen que tu mujer es una perra!! [URL],1
En #MachuPichu chocan trenes  [URL],0
Denuncian abuso sexual en refugio de niños inmigrantes de Arizona | Diario Noticias Web [URL],0
"El karma existe, algún día recibirás lo que mereces por haber sido tan hijx de puta 😇",0
[USR] Educar en igualdad. Nada más. Enseñar a respetar.,0
"Odio esperar en cajeros la reconcha de tu madre puta, te voy a enseñar a usar un cajero hijo de puta, la puta que te parió te odio",0
[USR] Tu eres la pajera.. perra de mierda k lo unico k saces hacer es abrir tus piernas ..... xk putas las abres si no saves ser madre cojuda.,1
"LOOOUUUU SOS UN AMOR LA PUTA MADRE, VOS TAMBIÉN TE MERECES EL MUNDO 💙✨💗 [URL]",0
"[USR] Te cabe, no te lo mereces por zorra",1
Se sale en modo arabe? Jajajaj 😂,0
A ver quién paga la factura y cómo se reparten el marrón de dejar inmigrantes ilegales sueltos por sus ciudades (y que los votantes no de lo hagan pagar dentro de un año)... [URL],1
"Para lo relevante no hay dinero y para las engañifas, sí (invasores africanos, moromierdas mantenidos, falsas maltratadas y demás porquerías varias). [URL]",1
"te mereces eso y más hijo de perra, no hiciste nada con mi Rebaño [URL]",0
[USR] Cállate que vos sos más zorra que yo,1
Casual estar en la feria de chelem y que digan en un juego “como dicen los gabachos por atrás se siente gacho” Jajajaja,0
[USR] Qué buenos vídeos! Eso y más te mereces por puta y caliente. Todavía te faltó uno más en la boca.,1
Cuando publicas basicamente lo mismo pero sos una sudaca injunada :(( [URL],1
Jesus le mete ideas en la cabeza a Gabe la puta madre que lo parió cállate hombre,0
"Espera,que me puedo morir ya😍😍😍😍😍😍😍😍😍😍😍😍😍😍😍😍😍 Soraya cállate de una puta vez, y sé feliz.",0
[USR] Let's go with all the videos No se si escribi biennial no y the parces a yordi el ninio polla y no solo en la Cara 😏😏😏😏😏,0
"Algunas mujeres se quejan tanto del acoso, pero ahi tienen fotos enseñando y/o sacando el culo 🙄😑",1
Tú eres de los 70’ Y yo soy una zorra de los 90’,1
[USR] Es un completo imbécil al que le siguen muchos como él que tratan por todos los medios de tergiversar una realidad que no les conviene.,0
"Viste cuando decis que no te gusta un tema la primera vez que lo escuchas y después lo terminas escuchando gran parte del dia, me está pasando con Arabe de Ecko jajajaja",0
[USR] mi polla en tu culo!,0
"¿Desde cuando una chica es zorra por el simple hecho de tener amistades con pene? Las mujeres podemos tener amigos hombres sin necesidad de que haya algo más que una simple amistad, que triste que ella no pueda tener amigos famosos sin que la tachen de zorra y robafama [URL]",0
Me recibes así para provocarme y que te folle cierto?eres toda una puta adicta a mi polla! [URL],1
[USR] Callate vos zorra,1
Se quejan del 'acoso' y hacen este tipo de publicidad.... Y ahí van tu todas a 'provocar atracción masculina' [URL],1
"#En8Años vendió el país a los árabes, le dio la espalda a la paz... sigo? [USR]",0
Negratas con 6 patas [URL],1
"[USR] [USR] [USR] Es preocupante que todas las fantasías sean hacernos daños y follarte a tu hija, yo me lo miraría",0
Estoy en una cena con viejos y estan JUSTIFICANDO LA VIOLACIÓN y diciendo que las minas se lo buscan. Que nefasto la puta madre,0
"Esto empieza a irse de madre... o se ponen medidas serías, o sufriremos más ataques de subsaharianos que esperan en un monte próximo en Marruecos. Ahora más agresivos y violentos. #MedidasYa [URL]",1
[USR] Te pones bien cachonda hija de tu puta madre ahkkkk Te amo maaaaaaaaaas Ya lo sabia ahk Y tu eres mi puta favoritaaaaa <33333333,1
[USR] Que te calles pedazo de escoria otaku,0
[USR] Callate vos qué no me hablaste más puta,1
Cada quién se ofende de lo que quiere y por eso es absurdo sancionar el lenguaje ofensivo. A mí la neta me viene valiendo dos héctareas de...si me dicen “pinche güerito” pero que justifiquen que eso está bien porque otros güeros en otra época y lugar fueron unos OGTs pffffft! [URL],1
[USR] Los musulmanes no tienen ni puta idea de lo que es una mujer. Para ellos las mujeres son esclavas.,0
Joven #Indocumentado Diseñó Aplicación para Ayudar a los #Inmigrantes [URL],0
"Que les pasa a todos que me quieren hacer usar turbante de arabe, soy negro pero tampoco para tanto",1
"[USR] y [USR] están deseosos de ayudar a los moromierdas que llegan en oleadas a violar todas las mujeres y niños que puedan. Y oye, si se legaliza mejor, ¿eh [USR] [USR] ? EL PROBLEMA ES QUE ESTO NUNCA LES PASA A SUS HIJOS Y NIETOS. LASTIMA! [URL]",1
"2018 será mi perra y no me voy a quedar callada como otras personas, ya basta, guarden éste maldito tweet.",0
"[USR] Jajaja respondes este y no los otros tweets, callate marico en serio no tienes ni puta idea de que hablas",0
"BBC News Mundo - Cómo es Shams Rad, la única estación de radio gay del mundo árabe [URL]",0
"Enhorabuena por las mujeres, madres de familia, que han sufrido calladas muchos años el acoso de hombres inmorales! [URL]",0
"[USR] Traidor hijo de puta¡¡, carcel comun te mereces basura¡¡, sos una lakra, Timmerman¡¡",0
"Que tal otro aporte anónimo son de la puta de mi esposa, así los dejó en navidad enseñando le los calzones al vecino rt y siguenos [USR] [USR] [URL]",1
"[USR] Roxy, tú eres la Diosa del sexo; la puta inmejorable. Después de ti lo mejor debe ser un trío con [USR] y contigo [URL]",1
Tenía razón el güero cuando hablabamos de habitar ciudades enormes y ciudades chiquitas,0
Comemela — AQUI AQUI AQUI NI HAY QUIEN VIVA AQUI NO AQUI NO [URL],0
"Ah, bueno.... El super ministro. Callate hijo de mil puta. [URL]",0
[USR] No digas nada que tú eres cómplice de lo que está pasando... y recuerda seguirás siendo la perra más perra de Venezuela,0
Putos negros [USR] tú Inmaculada ahora vas y te los llevas a tu casa tienes Barcelona plagado de negros h moros escoria de la sociedad . Ten cuidadito le vaya a dar un infarto al pobre negro [USR] asquerosos que sois [URL],1
"Para que? Si tu eres una perra, tienes 182837332 qlitos.l. i miss you😘 [URL]",1
Esta tarde me dan un regalo de reyes que aún no había llegado. Ya os enseñaré la puta pasada...,0
[USR] Tu eres una perra comunista!,1
"[USR] Cállate puta, eres hermosa 💜",1
"Un estado nación árabe islámico de los muchos que hay, protestando porque se cree el primer y único estado nación judío. Un ejemplo de quienes son los racistas e intolerantes: los musulmanes, estos a los que tanto adoran en la UE dandoles casas y pagas a sus inmigrantes. [URL]",1
Asi que tu eres la ex arrancar numero 3 eh?... eres una sucia puta traidora te dare lo que te mereces! [URL],1
"Te subis a un bondi y esta todo cerrado, ABRAN UNA VENTANA MANGA DE BICHOS REFUGIADOS",1
"Zapatero, el hijo de puta que incluía Canarias en un mapa como si perteneciera a Marruecos, habla con su amigo Mohamed VI, el rey de los moromierdas, para ultimar la visita oficial del traidor y okupa monclovita ⁦[USR]⁩ a Morilandia. [URL]",1
TE LO MERECES POR PERRA. —Lo arrastra por la academia de las greñas y le da unos chanclazos. [URL],1
Es la hora de la siesta. ¿Cómo se dice 'siesta' en femenino? Fregar los platos.,1
[USR] Tu eres zorra amiga jajajajajajajaja,0
Solo me encanta provocarlo. ser su puta especial. ser su niña en sus piernas. ser tan dama cuando gime. ser tan esencial en su vida ser su señora mi señor. Natacha [URL],0
"O me convertí en vampiro y la luz solar está comenzando a provocar efectos terribles para mi salud, o esta goma está perra.",0
[USR] Difundamos Movimiento SEMEN! Un RT de ayuda!,0
"Acá me ven y ya me hablan español, más sudaca no conseguís.",1
"[USR] [USR] Si, y las tonterías del sieso y la pelo polla también...",0
mi hermano: QUE YO NO SOY RACISTA JODER ATRÉVETE A LLAMARME ESO OTRA VEZ  mi hermano: encima que nosotros somos españoles y les dan todo a los putos moros y a los negros y nos quitan el trabajo y ...,1
"Que mierda tienen en la cabeza cuando creen que una violacion o situacion de acoso que les estan contando ES MENTIRA????? O sea,son joda gente",0
Sólo falta que diga que tiene un máster en derechos humanos.... Como esos que tiene su jefe... [URL],0
Tú los traes por tus santos ovarios y luego pretendes cargárselos a otros. Anda y vete a la m... 🤬 [URL],0
La güera ya ‘’sabe’’ decir su nombre y dice que se llama Pami ✨❤️,0
"gente que se queja de la inmigración ilegal.. supone mucho riesgo para los españoles eso y no que los cargos altos se lleven millones y millones en nuestra cara, con la minima parte de lo que nos han robado daba para ayudas a inmigrantes años y años xdd se te ve el plumero !!! [URL]",0
"Follar esta bien y mola, pero no dejes que tu coño/polla controle tu vida.",0
"Por primera vez ENTIENDO el ODIO de Trump a los Mexicanos. 😥 Ayer o antier, 7 mexicanos intentaron robar dentro de un centro comercial, una joyería. Los atraparon.....  Los 7 son : Mexicanos, indocumentados y RATEROS ... 😡😡😡😡 Pagamos “justos por pecadores” Me siento ENOJADA",1
"Estos hombres, tienen cuerpo de atletas, no hay hambre en sus rostros, ni cansancio, estan bien. Si saben manejar como dañar.REFUGIADOS? Unos 400 migrantes subsaharianos acceden a Ceuta tras saltar su vallado fronterizo [URL]",0
"Si no tienes ni puta idea, callate, y si sabes algo, trata de discutirlo con esa persona, llevo desde los 7 años tocando hardware y me toca la moral la gente que se cree mejor que tú y en su vida ha leido una página, cuando yo he estado ayudando en una",0
[USR] [USR] [USR] Mas asesino eres tu y tu perra madre malparido no mereces seguir viviendo en este país hdp se ve q apoyas asesinos y eres cómplice de crimines no sirves para un culo,0
A mí no me mires con esos ojos que te como toda la boca. — Comemela. [URL],0
[USR] tú eres una perra infernal,1
"YO NO SOY ENVIDIOSO PERO TE VEO CON ÉL Y ME PONGO CELOSO, DILE QUE TU ERES LA QUE QUIERE, QUE YO NUNCA TE ACOSO",0
"WhatsApp: la nueva ""herramienta"" de los polleros [URL]",0
Así piensan todos los putos moros de mierda que vienen s este país. Asco [URL],1
"A mí esto de que los ilegales subsaharianos se beban cubatas con mi dinero, no me acaba de convencer",1
"Los españoles pagamos por la Sanidad, los ""sin papeles"" no. Esta es la política de promoción de apátridas de Sánchez. Desde luego en España hay ya varias naciones, la española, la mauritana y la tribal subsahariana. Esto no es racismo, es la realidad. La integración es un mito.",1
"[USR] La concha de tu madre hija de mil puta!!! Nada más, no lo mereces",1
[USR] No todos tenemos tus mañas zorra,1
"me puse un vestido con escote y mi mama dizque preciso hoy le da por vestirse como zorra jajsjajs tan linda ella, como siempre",1
"Despacio sobre mi, mirándome cachonda, besándome sin deejar de moverte, tu coño aprieta fuerte mi polla que entra y… [URL]",0
Por que el tema rompe de [USR] es tan pegadizo y arabe ni te cuento,0
En que se parecen las mujeres a los semaforos. -que despues de las 12 nadie las respeta.,1
[USR] Pero que ridiculas sois enceder la tv y verlo con vuestros ojos,0
Ay que me pongo Arabe,0
[USR] Seguro que esa chica es la más puta de tu serie.,1
"si el Leonel hijo de puta no me quiere enseñar a tocar la guitarra lo voy hacer sola, y ni pija le pienso pagar al rata de mi tío",0
Todo tu eres bien perra mamaguevo JAJAJAJAJAJAJAJA. [URL],1
"Esta invasión continuada de subsaharianos,no se cuanto nos cuesta,imagino que cantidades astronómicas. Por qué no empleamos esta pasta en hacer que vuelvan los españoles que tenemos por el mundo, médicos,investigadores,y demás profesionales.",1
"Una razón más para odiar a Arturo Vidal. Sudaca, chileno y además del barça 🙌🏻🙌🏻🙌🏻",1
Le tuve que enseñar mi Whatsapp al técnico de AT&T y ahora sabe que soy puta,1
"Ultima hora: El ministro del interior, Grande Marlaska, ha dicho a los guardias civiles de Ceuta que cuando salte la valla el negro del whatsapp que lo detengan y lo trasladen inmediatamente a su domicilio en Madrid.",1
"Tengo el Twitter de Celeste en mi celular y yo no puedo creer que con poner 'Milton callate' se llene de favs, la puta madre",0
"Enferma hija de mil puta y la concha gorda que te pario soreta te mereces una muerte lenta y dolorosa, te odio te odio te odio te odio gorda cinica [URL]",1
Tendrían que pegarte a ti la paliza y que te calles de una puta vez para siempre [URL],0
En que momento esa niñita se volvió tan Puta?? Solo sube fotos enseñando las bubis,1
Le cuento las secuencias de la noche a mi mamá y me dice xq no se quedaron en sus casa carla😢😢😢😢me acuerdo y lloro peruanos hijos de bien puta vuelvan a su país indocumentados hijos de putaaaaa,1
[USR] [USR] Pablo callate de una puta vez. Te has ganado otro strike.,0
"[USR] [USR] Cállate zorra, es la verdad",1
"Después del asalto frustrado en Plaza Norte, creo que el gobierno debe expulsar inmediatamente a los Venezolanos indocumentados, a los que manejan sin brevete y a los que venden el alfajor a 1.50 en los semáforos.",1
"Más de 600 inmigrantes entran en Ceuta tras saltar la valla:22 guardias civiles heridos, varios por cal viva. ESTA SALVAJADA ES UN ATENTADO CONTRA LA AUTORIDAD Y LAS FUERZAS DEL ORDEN ¿Y SE VA A PERMITIR QUE SALGAN DE ROSITAS PORQUE SON ONMIGRANTES ILEGALES? ¡¡DEPORTACION YAAAA!!",1
"Maldita escoria.... muerete, callate, malditos comunistas de mierda, ladrones, basuras....acabaron con wl mejpr país del mundo, porquerias humanas[USR]",0
Con todo y sin todo el respeto que me mereces que pinche puta buena estas [URL],0
HumorMachista[URL] - #Humor,0
Jajajaja cállate perra 😂❤️😂😂😂 [URL],1
"España está siendo invadida por los subsaharianos, y aquí Don TONTO, jugando al corro la patata, desde la Moncloa #caminodeVenezuela #Señorllevamépronto [URL]",1
"Me fascina este tipo de discursos por parte de inmigrantes sobre la inmigración.  Ay, casi lo olvido. Cuando tienes pasta, eres un expat. [URL]",0
Ese buey feliz en su país gabacho 😂😂😂 otro Anaya que desde el extranjero quieren gobernar [URL],0
QUE LE QUERIAN NOMINAR FIJO POR LA PUTA LISTA DE PRODUCCION TOMA JODERSEEEEEEEEEE TODOS A NOMINAR A QUIEN LO MEREZCA,0
"Algunos cuando un inmigrante hace cualquier cosilla: joder es que vaya plaga, son un peligro, FUERA ARRIBA ESPAÑA Esa misma gente cuando españoles violan en grupo a una chica: Seguro que fue violación? MIRA EL CASO DE LOS MOROS DE MIERDA",1
"Nos hicimos una pregunta el #17A de 2017 en #Barcelona. Otros muchos se la hicieron. ¿Con el mogollón de negros subsaharianos manteros que hay siempre en la Rambla, cómo es que ninguno fue arrasado por la furgoneta de Younes Abouyaaqoub? Ninguno entre los 15 muertos en Ramblas. [URL]",1
Yo soy fiel creyente de esto Jajajajajaja porque en Cartagena terminé hablando con un arabe en inglés toda la noche 😂 como ? No tengo idea [URL],0
Siguen llegando instantáneas del sábado en La Mula Rafaela   ZONA 84 Y los 4 SUDAKAS de la mano del gran Gustavo Villordo! [URL],0
"Amiga querida, deseo que se cumpla un año de mucha felicidad y mucho aprendizaje, que seas muy bendecida y sigas irradiando con tu gran ser. ¡Te quiero mucho! ¡Feliz cumpleaños! Güera hermosa Abrazos [USR] [URL]",0
"Macri callate HIJO DE PUTA, TE VOY AHORCAR CON MIS MANOS!",0
"Violencia machista, acoso escolar, violación de derechos humanos, privación de libertades, homofobia, racismo, precariedad, corrupción ... Que en 2018 avancemos para terminar con todo esto. Salud y felicidad 😘❤️",0
"Estoy escuchando el tema ""arabe"" y la verdad que mi culo se mueve solo✋🏼",0
osea si quieres enseñar el culo lo haces y eso no te convierte en un prostituta o en una puta vaya,1
Una tía no es una guarra por hacer una foto de su culo y tú eres un puto nazi que no sé qué hace respirando. [URL],0
"#Reseña: Las lágrimas de una inmigrante, de Karem Suárez [USR]  [URL] #libros #lectura #escritoras #mindfulness #CrecimientoPersonal",0
dices que no eres otaku pero te viste un anime de 148 capitulos hola??????????????? — Cállate la puta madre [URL],0
Salvamento Marítimo y el Servicio Marítimo de la Guardia Civil rescatan a 291 inmigrantes que viajaban a bordo de siete pateras - [URL] #motril #noticias [URL],0
¿Quién les enseñará a los hijos fe puta a ser hijos de puta?,0
"Pregunta: en cuánto incide el desempleo en sectores más básicos de la economía por la presencia de inmigrantes? Si no puedo hacer esa pregunta, estamos jodidos.",1
[USR] [USR] [USR] Cállate brazuca hijo de re mil puta !!!,0
"Un inmigrante en Alemania. Se mea en sus leyes políticamente correctas. Están perdiendo sus países y aún no se dan cuenta. Este tipo debe ser deportado, no contribuye en nada [URL]",1
"[USR] No es mas imbécil porque no es mas alto... el y su guarra, par de analfabetos funcionales... instigadores y apologistas a la violencia...!!!",0
Santos firmó un decreto que permitirá a 400 mil venezolanos indocumentados regularizar su situación en el país [URL]  #INTERNACIONALES,0
[USR] [USR] [USR] Psss hoy vamos y como tu eres una puta te voy a regalar un trago,1
