text,label
A los mexicanos que cruzaban a EEUU les llamaban espaldas mojadas A los guiris que vienen de veraneo a España les llamamos espaldas quemadas,1
Debería sacar un libro donde se cuente todas las veces que me han deseado la muerte por tonterías. (Esta puta payasa me deseo la muerte dos veces por un puto dibujo de mierda.Para echarse a reír.) [URL],1
"Obviamente, [USR] no iba a desvelar la nacionalidad de los 3 moromierdas que han abusado en Tudela de una niña.",1
"Adán canta “mi novia es sevillista y una puta más”...enhorabuena por la victoria. La prima, podrías usarla para que te enseñen valores, respeto y comprarte algún libro de autoayuda para semejante idiotez.",0
"podría estar durmiendo placidamente ahora pero tengo que ir a árabe, el amour.",0
Allá que vayan las feminazis a reclamar derechos. Los árabes no están con webadas. [URL],1
No soporto al chicharo güero,1
[USR] [USR] Cállate hijo de puta vendido!!,0
"Nos jodieron en el Bernabéu, pero se merecían un día como hoy! Puta Sevilla Vamosssss [USR] 💚💚🔝⚽️⚽️⚽️⚽️⚽️",0
"[USR] [USR] [USR] [USR] [USR] [USR] Perra mentirosa y mereces mas calificativos ante tamaña mentira, gracias a gente como tu y al error histórico a la grabación del complot es que Abdala Bucaram ha puesto u",1
[USR] Movimiento SEMEN! A fregar todas! [URL],1
[USR] [USR] tu puta madre no te queria ofender.pero te lo mereces.,0
Interesante entrevista al padre [USR] en [USR] sobre el drama de la inmigración. Una reflexión de la cómoda actitud de los cristianos y políticos frente a tantas muertes olvidadas [URL],0
Sigan haciendo experimentos con sudacas [URL],1
"Lo primero que hace Sanchez dar mas cobertura y mas medidas a la inmigración ilegal, enseñanza en árabe bajada del tiempopara nacionalizarse mirar a otro lado con los cada dia mas agresivos manteros etc.",1
Los inmigrantes muestran su cara más violenta con peleas en plena calle — El Pueblo de Ceuta [URL],1
"Cuando veais a los pobres muslims, acordaron que ademas de sangraros gracias a las ayudas y subvenciones que nuestros mayores no reciben, se llevan el dinero a traves de mezquitas y locutorios... [URL]",1
Para el tal uranium ese todo el puto sol en la cara voy a autodestruir la polla,0
"Mi perra me odia,es enseñarle la correa pa salir a pasear y se pira corriendo a esconderse. Es mas vaga que yo casi",0
"Trabajan por la mitad del sueldo, no pagan impuestos, no generan renta, sacan la plata del país, y no aportan un culo. Hablo del venezolano que votó por Chávez, que está indocumentado, y que es un parásito.",1
Falta que aparezca puta publicando 'feliz día de Reyes' y suba una foto enseñando el culo.,1
"Sr, [USR] pues dígales q cuando bajen del barco cojan el autobús dirección Doñana y todos para ti, olvidas las necesidades españoles x el POPULISMO q te da la inmigración. Una más de tus atrocidades [URL]",0
La vida es puta Y la mujer es una señora,0
"Claro, este fallo es culpa de Podemos y psoe porque todos sabemos que Antena3 apoya muy fuerte a Podemos. Las cagadas de palomas son un problema de la izquierda, como la gripe y la ola de calor. Ha sido entrar el PSOE y calor subsahariano, casualidad? Cuanta tontuna por dios. [URL]",0
"[USR] Mirá que tú no lo sepas apreciar no te da el puto derecho de insultarle ok? Así que cállate la puta boca que él es mucho mejor persona que tú, Imbécil.",0
Y mas verguenzas de estos negratas manteros [URL],1
"TIENE DENUNCIAS POR ROBO ¿Y LAS DE ACOSO DONDE ESTÁN? TE LO MERECES POR LO MIERDA QUE FUISTE TODA TU PUTA VIDA, NO PUEDO DEJAR DE REÍRME JAJAJAJAJAJAJA",0
"Cogerte en brazos sin sacar mi polla de tu coño y llevarte sobre el mueble, duro contra la pared, clavándotela sin… [URL]",0
"[USR] [USR] Por que no la salió del coño decirlo, a quién has venido a juzgar, a Salma o al puto acosador?",0
[USR] ¡Cállate! Zorra insensible.,1
"[USR] [USR] Cállate estúpido de mierda anda a la puta que te re mil parió pajero de mierda sos boludo nene que te haces ahí,se escribe ESTÚPIDO no est*p*do",0
ODIAME ERO AL MIRARTE A UN ESPEJO RECUERDA YO SOY AGIL Y ATRACTIVA TU ERES UNA PUTA CERDA😁😁😁,1
"[USR] Para mi una mujer es perra sólo si comete infidelidad; si la chica está soltera ¿qué diablos le impide acostarse con todos los manes del planeta? Un man lo hace y nadie dice nada, ¿quién les da el derecho de juzgar por lo mismo a una mujer?",1
"Vamos que el PP les ha llevado en autobús desde Senegal, Mauritania Argelia, los ha dejado en Marruecos y ale a saltar o a la patera, RUINES  Valerio pide ""colaboración"" pero culpa al PP de la avalancha de inmigrantes: ""No hizo los deberes"" [URL]",0
Creo que los colegios que impartan el Islam debe de ser el mismo numero de co!egiosque en los países árabes  imparten el cristianismo.Que no somos más tontos porque no ensayamos [URL],0
[USR] La celebración de Carmona algún sportinguista aún tiene la polla en la garganta #elproblemanoerapacoherrera,0
Todo aquél que se haya molestado en investigar un poco sabe que desde tiempos antiguos los mayores negreros y esclavistas del mundo fueron los árabes. [URL],1
No os voy a enseñar lo guapo que está [USR] hoy porque soy una puta egoísta de mierda.,1
"Ya que tú eres de mucha indirecta te voy a decir una cosa. A ti nunca te van a coger para serio, eres puta y la que es puta nadie la respeta. No esperes más de lo que tú no das. Metete con alguien que sea igual que tú y deja a los demás quietos.",1
[USR] Callate la puta boca que hemos jugado bien saes [URL],0
"[USR] Marico eso era lo único que merecía la puta esa, me paso la tesis con 10 webon y me iba a raspar solo que Elio metió la mano por mi (la tesis no estaba mala, solo estaba esperando la tesis para hacerme sufrir todo lo que yo la hice sufrir",1
"Nadie se acuerda de los más de 2 millones de latinos que vinieron desde el 1999 por efecto llamada de AZNAR, sin papeles y sin puestos de trabajo...carajo que poco dura la memoria",0
"[USR] Puta que te pasaste de pendejo para salir a decir una sola palabra, tú eres tan o más responsable de esta calamidad con tu pensamiento arcaico e irracional.",0
"Pero, no tantos ni tan maleducados, como son ahora los inmigrantes (""latinos"", rumanos, africanos, árabes, chinos,...) [URL]",1
¿Sabe cuál es la visa que beneficia a indocumentados víctimas o testigos de crímenes:  [URL],0
"[USR] Lo peor de todo es que tú eres parte de la culpa de la destrucción de Venezuela hijo de la grandísima PUTA, y encima sigues siendo chavista MALPARIDO. ahora no se valen arrepentimientos tienen 18 años llevando PALO y pasando roncha y es ahorita e",0
No sé dónde vives pero la delincuencia que he visto yo cuando he ido de vacaciones a Madrid y a Barcelona es absoluta vale y estos señores al no tener papeles se ven totalmente Internet de lo que les pueda pasar sin miedo total a la ley [URL],1
[USR] [USR] [USR] [USR] Cállate ya subnormal que si te quitan de heretics te comerías una polla,0
#yaesmediodia32 los comunistas cuantos asesinatos cometieron con Franco no te violaban por la calle no tenías moros con navajas atracando no te ibas a trabajar y te okupaban tu piso manteros drogas y asesinos y rumanos sudacas con 150 detenciones,1
"[USR] Una sudaca de 38 años ha asesinado con alevosía ha puñaladas a joven varón de 27 en Tenerife, a la p. Cárcel",1
"Encima callada porque claro, no puedo decir que yo estoy de puta madre así que bebo más. Veremos si salgo de aquí a 4 patas del pedo jajaja",0
Le voy a enseñar a la perra de mi amiga a jugar al uno,1
[USR] Tu te as ido por que no tienes ni puta idea de lo que es un hombre de idea tu eres un chaquetero fascista naci,0
[USR] [USR] [USR] Cállate hijo de puta. Ponete a laburar chorro. Narco,0
[USR] [USR] [USR] [USR] [USR] Cállate pinche puta si no vas hablar nada bueno mejor no hables,1
"#SinRollo yo no me quedaría callada six acoso sexual , lo haría de inmediato, no esperaría como tod[USR] estas gente hablar después de tantos años.",0
"[USR] Mira Ethan voy a putear a quien merezca ser puteado sea k, M o x y, pero estos hijos de puta avala el roban pero algo hacen eso nos transforma en un país de mierda y no por el país sino por la gente, y estos enfermos de mierda avalan todo",0
[USR] de puta madre chaval notable se lo boy a enseñar a mi madre,0
[USR] comeme los cojones puto imbécil de la polla,0
No escucho por nadie que condenen al nutrido grupo de emigrantes indocumentados africanospor su martato a una turista en Varselona Espana y la gorpisa que le propinaron al cubanoamericano que fue a defenderla ni he visto ni escuchado a nadie condenando este actocriminal,1
[29/10 14:01] Kundogan: Yo no estoy hablando contigo cállate la puta emoción,0
Creo q el Smirnoff y Arabe de [USR] con [USR] UNA COMBINACION DEL DIABLOOO,0
Os habéis pasado décadas llamando 'guarra' a Maribel Verdú por enseñar cacho. O a Victoria Abril. Tampoco vamos a pedirle peras al olmo.,0
Mi madrecita me trajo unos tenis Adidas del gabacho y están no mames súper hermosos 😍,0
"Callate ya guarra anda, que das pena, aparte de fea tu comic ese es una puta mierda, te lo comprarán por pena porque es feisimo — Uyyyy los 12 años cómo se notan... Qué pasa, que estás rebotao porque anoche tus papis no te deja... [URL]",1
Nunca se en que sección estoy si en; “prientos en aprietos” o “güeros por pendejos” ¿no hay algo para los “apiñonados”?,1
El video de Faby enseñandole a abrir un champagne a Agos JAJAJAJAJAJAJAJAJAJA la puta madre que buen videoo,0
"[USR] Callate zorra, que seguro tampoco sabes",1
[USR] su cuenta sería un constante CÁLLATE ESCORIA !!!! com muchos !!!! y mayusculas,0
l'arabe arabé [URL],0
Puta que le gusta provocar al CSM de KKKast,0
"ARABIA SAUDITA, EMIRATOS ARABES, KUWAIT Y DEMÁS ADINERADOS CON LOS MASONES JUDAS Y DEMÁS DEL MUNDO HEREJE, CAVANDO SU PROPIA TUMBA SUBSIDIANDO HEREJES ANTICRISTIANOS, LA ORDENDEBE SER: CONVIERTASE A CRISTO, PACIFIQUESE Y ESPERE EN SU PAIS LA AYUDAS,... [URL]",1
¿Y si dejas de alimentar la cultura de la violación y el acoso mejor? Uno viste la hueá que se le antoje [URL],0
"[USR] Cállate la puta madreee, ENVÍA BAILA FLOR AL 13013",0
"[USR] Más d 17 denuncias por acoso sexual incluyendo Una violacion a su propia esposa y una relación promiscua con su hija Ivanka.Universidad y fundación Trump en NY cerrados por fraude y lavado d dinero,Siete bancarrotas,este delincuente tiene d todo",0
"Y más rosas y más sonrisas. Mujeres gritando zorra y guarra, ¿se puede ser más imbécil? #21DARV [URL]",1
[USR] [USR] Tu eres una perra,1
¿Cuándo viajará la mujer a la Luna? Cuando se tenga que limpiar.,1
Cuando un tío te pide una foto guarra y tus amigas te aconsejan que le envíes una caca y se meten a google a buscar la caca más realista [USR] #nopuedoreirmás,0
Nombre a buena perra hora se le ocurre a mi hermano mayor enseñarle a manejar a mi otro hermano:( adiós mundo cruel,0
"[USR] [USR] CALLATE BOLIVIANO K ,LA RECONCHA DE TU PUTA MADRE ,UDS QUISIERON QUEBRAR Y HACER MIERDA EL PAIS . AHORA TU KCHORRA LE SACAN LOS FUEROS Y VAN EN CANA .",0
Operadores de Pick Me App denuncian acoso y violación a derechos [URL] [URL],0
[USR] [USR] Llevaba mucho escote la zorra esa :v,1
Este amor por la comida árabe y mediterránea no se acabará 😻,0
"Israel, a punto de aprobar una ley que legalizará la segregación de árabes y judíos [URL]",0
[USR] [USR] [USR] [USR] [USR] Dr. En que materia lo enseñaron ese vocabulario de perra de burdel?,0
Esto es lo que he encontrado.   [URL] vía [USR] Digital,0
[USR] Cállate zorra [URL],1
"Documental [USR] de [USR]. Un programa de fútbol en una escuela de Oakland como instrumento de escape, crecimiento personal y vida en comunidad. Los protagonistas son chic[USR] inmigrantes que en algunos casos dependen de #DACA  #Futbolistas [URL]",0
[USR] Si zoro es la polla no es culpa nuestra 😂⚔️🗡,0
"Se lo ha ganado a pulso, y ha sido muy comedido. Ese musulmono o se lo piensa la próxima vez. O le dan otra mayor. [URL]",1
"[USR] [USR] Callate Ivan el Tonto, No hay pruebas !!! Donde estabas hijo de perra cuando gente como bucaram, Lasso , baqueros, y oportunistas se comieron al Ecuador y se repartian en pedazos, cuando no habia ni carreteras ni hospitales, ni me",0
[USR] Ojalá encontrarmelo por la calle y darle un puñetazo en la cara con mi puño de maricón. Que asco de escoria.,0
"[USR] Hijos de puta,te mereces lo peor del mundo junto con los desgraciados que te rodean,ladrones,malandros",0
"Justo cuando creo que me gustan los morenitos, aparece un güero que me encanta y luego cuando creo que me gustan los güeros, aparece un morenazo que me vuelve loca.  Pues... ¿qué se le va a hacer? 🤷🏻‍♀️ Ya no me pregunten cómo me gustan los hombres, porfi.",0
en nombre del pueblo venezolano manuel bartual callate la puta boca ya imbecil,0
"¿Ha subido una foto suya enseñando un poco su cuerpo? Qué forma de denigrar a la mujer, y encima no me la follaré jamás, puta asquerosa....",1
Les arabes ❤️😭 [URL],0
[USR] Tu eres mi lady zorra barata,1
Que bueeeen quilombo jajaajaj. Te lo merecias por zorra 😘,1
RACISMO ES QUE TE PREGUNTEN PORQUE ERES PRIETO SI TU MAMÁ ES GÜERA.,0
"España crea su primer 'campo de refugiados' en la bahía de Algeciras [URL] vía [USR] Gran noticia para el contribuyente español. Españoles a pagar, a pagar. Las pensiones pensad en las pensiones. Esto la sanidad como es gratis podemos dejar de pagarla no?",1
Tengo sueño. VECINO CALLATE LA PUTA BOCA O AL MENOS VOCALIZA PARA QUE ME ENTERE DE TU PELICULA MENTAL,0
"Así como a muchos les encabrona que les digan negros a mi tambien me encabrona y doble que me digan güera, para mí no es un alago ni mucho menos superioridad",1
QUÉ ESPERAN PUTOS SUDACAS [USR] CONTRATEN AL CALVO DE ALMEYDA TIREN PARO,1
"Soy tan hija de puta que estoy segura que el karma me va hacer mierda, pero me la voy a fumar de callada 💪",0
Espero que tengan un buen año y reciban lo que merezcan menos yo porque yo me jodería por puta JAJAJAJAJJAJAAJAJAJAJJAJAJAJA,0
[USR] [USR] [USR] [USR] ¿Qué estás haciendo con respecto a tus niños ciudadanos indocumentados en mi país? Debes asumir la responsabilidad de tu gente.,1
feliz cumpleaños franchute moracrema 💋💋💏❤️❤️❤️❤️❤️ [USR],0
"[USR] Callate zorra corrupta que tu tienes las manos llenas de mucha sangre, sinvergüenza, vagabunda, pagarás como los otros.",1
"[USR] Hemos empezado de puta madre, si seguimos este paso llegaremos a las cuevas antes de que rajoy diga la próxima gilipollez",0
[USR] Cállate perra ascerosa,1
"Raoul no se merece estar nominado, se merecia estarlo la semana pasada y hoy en la puta calle, gracias. #OTgala7 #OTDirecto11D",0
Si van a andar enseñando culo en las redes sociales como lo puta que son al menos lávense las patas!!! 👊 [URL],1
"[USR] [USR] Bueno tú eres su perra, no yo.",1
"Me encanta, contra el maltrato animal, pero a los inmigrantes subsaharianos que los acoja en su casa los perroflautas y [USR] . [URL]",1
En las últimas 24h varias peleas callejeras en ceuta por parte de los últimos en saltar violentamente la valla. Y el gobierno pide respeto???,1
"Jorge Vestrynge: ""Aquí no vienen cabreros, sino gente emprendedora, valiente, y con formación profesional como mínimo"" Que corra el vino que vinen ingenieros por la valla de Ceuta 😂😂😂😂",1
[USR] Jajajajaja cállate perra!! es alguito nomas 😏😂😂😂😂,1
[USR] [USR] [USR] [USR] [USR] [USR] Tu eres lo peor de la escoria que anda suelta,0
"Comentario ESCATOLÓGICO: Si no hay papal del culo, deben abstenerse de acercarse a la valla de Melilla, al menos hasta que los ""lindos negritos visitantes"" estén ESTREÑIDOS. [URL]",1
[USR] Puta que sad callate,1
MMMMM TU NADA MÁS KERIAS ENSEÑAR LAS CHCHIS PINCHE BIEJA PUTA!!!!,1
"Una mujer es tildada de zorra, buscafama etc y automáticamente está mintiendo, se le falta el respeto y se le cree al hombre. Cualquier semejanza con lo que consumimos todas las noches, es pura casualidad.",0
"Otro tema sobre ""ingerencia en los asuntos internos"". Gobiernos árabe y paraguayo ""van por la misma senda con embajadores británico y canadiense. ¿Por qué será? [URL]",0
"Arabe es claveee, dio me vuelvo locaa me encanta! [USR]",0
"Si un español agrede a un GC, echándole cal viva, excrementos, etc,le caen 5 años de cárcel, si lo hace un subsahariano e inmigrante, le damos cobijo,comida,etc algunos partidos políticos lo aplauden,si piensas como yo,algunos gilipollas te llaman,racista,franquista y fascista.",1
"Una ayuda para promover el movimiento!! RT SEMEN!! [USR] Gracias, hombre!!",0
"Q ministra d ""Lo Que Falta y Lo Que Sobra"" (Trabajo y Migraciones),diga q ve n Casado y Rivera tendencias ""racistas y xenófobas"" x visitar Ceuta es como si yo digo q Sánchez e Iglesias lo son x no tener inmigrantes dentro d la valla d Moncloa o d La Navata [URL]",0
"Que tiene que venir un sudaca de Miami a decir en Telecirco que, Pedro Sanchez están convirtiendo este país en el tercer mundo, porque le han agredido una mafia de manteros. Gracias PSOE, gracias al socialismo. Que buena imagen estamos dando.",1
Pobre niño jesús... porque si le llevan lo que tu eres le va a caer tremendo comunista hijo de puta encima! desde venezuela con cariño... argentino sinvergüenza [URL],0
[USR] Cállate perra es mioo,1
[USR] [USR] Dale zorra cállate,1
[USR] Julia vos tambien sos hermosa la puta madre callate,0
Echenle un ojo a este especial que armé para [USR]   ¿Hubiera sido bueno respetar el look güero de #Aquaman o esta bien el look Tritón motociclista? [URL],0
Que temazo arabe dios mio,0
"te mereces nada y yo te doy todo que hijo de mil puta, juro por lo que sea no volver a contestarte ni un solo puto mensaje, siempre haciendo cosas por vos y vos valorando un culo",0
"Para convivir con prietos me gusta imaginar que son jeques o algo así,  algún árabe millonario. Así no siento que me traiciono. El amor al dinero siempre vence un poco  mi racismo.",1
[USR] En tu cara zorra,1
[6/1 21:05] Puta: callate [6/1 21:05] cami: callame... [6/1 21:09] Puta: como tas hoy turra eeee dsps no arrugues cuando t coma la boca,0
[USR] [USR] Ay cállate perra.,1
Aquí Pedro hablando de solidaridad mientras sigue sin referirse a ls 22 guardias civiles q resultaron heridos tras el salto a la valla Ceuta [URL],0
"No es a huevo venir con tus tops y enseñando en el gym pinche puta, vine a entrenar no a saber de qué manera te la puedo meter.",1
"Te odio Lidia, no te mereces a Francisco, #perra #LasChicasDelCable2",0
"Aún tengo mis dudas porque dicen que un hombre es puto por estar con hombres, entonces, ¿una mujer es puta por estar con mujeres?",1
"#Seguridad #SLP |  *Graves, integrantes de una familia tras chocar su camioneta con un tráiler. [URL] *Aparatoso accidente en el Periférico deja un muerto. [URL] *Inmigrante muere al caer del tren. [URL] [URL]",0
Extraño arabe extraño reggaeton extraño la murga extraño todo,0
"Es bien naco decirle ""gabacho"" a los ""yunaites""",0
"[USR] [USR] JAJAJAJAJAJAJAJA ya sé, pero tú eres una perra, yo soy bien buena y Sofía se aprovecha de mi nobleza",1
[USR] [USR] Hijo de puta. Se merecía una pateadura.,0
#Danzas: Contemporánea -  Afro - Flamenco - Árabes - Folclore - Salsa - Popular  - Gimnasia Rítmica - Circo (Niños) – Tango Sensorial [URL],0
[USR] dejá de provocar hijo de puta porque cuando se de vuelta la tortilla te vas a arrodillar llorando pidiendo clemencia y la presidencia del Bazofi,0
I checked in at Taqueria Los Güeros #2 on #Yelp [URL],0
"Esto es posesión, machismo, acoso, violación a la intimidad de la persona, y nadie cae en la cuenta que están así por “un cariño” que acaba siendo una tortura. [URL]",0
[USR] Cállate perra trolls forevaa,1
Pinche Astrid perra hasta en mis sueños eres tonta No te lo mereces 🙄,1
no sé que onda mi perra se volvió muy callada ah que ni habla pero si se ve muy triste y ya ni nos hace caso lo único que hace es dormir,0
Ojalá que te vuelva toda la mierda que tiras negra conchuda y la re puta madre que te re parió. Te mereces que re rompan la cabeza,1
"Como me caga de gusto Árabe de Ecko y Papichamp amigo, la rompe",0
"#LaEscoPPetaMafional Hoy Rivera, mañana Casado a la valla de Ceuta, a hacerse la foto y a competir a ver quien es mas facha de los dos. Pero, ¿acaso saben de que hablan?. [URL]",0
[USR] Cállate vos wacha trola deja de confundir las hormonas puta,1
Es que nadie va a ser capaz de no cagarla de una puta vez? Coño ya con las tonterías,0
Indocumentados sin salarios sin horarios vuelven los chicos del barrio,1
"[USR] [USR] [USR] [USR] No son horas de estar tocándonos en coño a 1 de enero, caballeros, dispérsense.",0
[USR] [USR] Y tú eres un hijo de puta catalán,0
[USR] [USR] [USR] Jajajajaj callate tu zorra asquerosa,1
[USR] CALLATE IMBÉCIL. LA GENTE MARCHA CONTRA EL GOBIERNO HIJO DE PUTA QUE TENEMOS 😒,0
¿Que es una mujer inteligente? -un travesti.,1
Ser gay tiene sus desventajas como que te odien los putos moros y eso pero a cambio debe de ser un noparar de follar eh o no,1
"Una nueva película de ""wini pu"" ??? Necesitamos que las bolsas de cereal traigan cierre ziploc no esas jaladas de osos mayates.",0
De hoy en adelante si una mujer te envía una foto desnuda hay que denunciarla por acoso sexual y provocación Feminazis al ataque en 3-2-1,1
Hacelo Reverendo hijo de puta! No mereces ser radical ni por herencia. [URL],0
"A ver si te enteras [USR] que el árabe y la cultura marroquí nos importa más o menos lo mismo que tú, una mierda!. Aprende en tus ratos libres, que son muchos, lo que te plazca pero deja a los niños en paz. #SanchezDimision #SanchezVeteYa  [URL]",1
"Ken cada vez es más güero en las caricaturas de Barbie, en mis tiempos era morenito ahorita hasta las mejillas rosadas tiene😂",0
"Mira lo qie te digo. Me da igual que sea gabacha, pero eso de ser Weasley como que no.",0
"Pensar que la mujer es una perra de por si es algo horrible, pero que eso sea por celos, es una conchudez.",1
¿Hipocresía de Estados Unidos frente al conflicto nicaragüense? [URL] vía [USR],0
"la novia es mas puta y el pelotudo sigue estando con ella , ni pa bosta la mina mas zorra y el ni hablar mas gil todavía , le re kbio",1
Hermano el que el que dice puta a una mujer ofende al hombre también porque si las mujeres son putas todos nosotros somos cabrones y aparte como le diríamos a la mujer que nos pario madre puta o puta madre [URL],0
SOS tremenda puta no lo mereces un hombre bueno. puta barata como todas tus amigas gatos de cuarta [USR] [USR] [USR] [URL],1
[USR] [USR] Puta mierda Ben affleck es actor que se deje de tonterías y que vaya más al gimnasio que anda que no está gordo,0
".[USR] [USR] [USR] [USR] [USR] [USR] [USR] me uno a la petición del Camarada [USR] Fuera de Venezuela los Colombianos Indocumentados, Paramilitares, Sicarios, y Contrabandistas [URL]",1
"Cuantos operarios hacen falta para limpiar una cocina? Ninguno, eso es cosa de mujeres. #CállateYfriega",1
"Si quieres delinquir,cobrar sin hacer nada,sin papeles, por ser de otra raza,VENID A ESPAÑA!A LOS ESPAÑOLES QUE NOS JODANNNNNNNNNNNNNNNNNN!(eso no es racismo no,si se putea a un blanco).",1
[USR] si.. comemela a mi,0
[USR] Tú ni tu puta coalición me van a enseñar de izquierdas... fracasados!,0
"Puta de su madre..... Que esta mujer es RECONTRA imbécil y tenemos que pagarle con nuestros impuestos... Le hacen saber que su JEFA SAMURAI recibió dinero SUCIO y ella se convence mas, que tienen que LUCHAR CONTRA LA KORRUPCION ... SACATE LA MIERDA DE LA CABEZA... MUJER [URL]",1
MIRA TODO LO QUE DESPERDICIASTE LA PUTA QUE TE PARIO NO TE MERECES VIVIR [URL],0
La nueva generación de indocumentados.,0
Escuelas públicas enseñando a bebés a cantar: Cargol treubanya vuy sortir d'España. Lo estais haciendo de puta madre,0
"Ó sea Que el hombre negro inmigrante que anda por las redes diciendo que se “caga” en nuestras costumbres, en nuestra cultura y en nuestras leyes vaya a poder decidir quien gobierna en nuestro país, es ya el colmo, no podemos tolerarlo, sería terminar de hundir y romper España [URL]",1
"[USR] [USR] Cállate subnormal pero de una puta vez deja de llorar, no fue penalti xq Isco estaba en fuera de juego pero Dios como pueden ser tan jilipollas y subnormales estos tíos admitid que se acabó la flor de Zidane cojones hijos de puta",0
[USR] Pues dispuesto a ser un amo muy exigente! empinarte a mi gusto y nalguearte como te lo mereces por puta cachonda y zorra,1
"A todas mis primitas les enseñaron a decirme TIA! Es mi prima la puta madre, PRIMA",0
La cobertura sanitaria a los 820.000 sin papeles costará a los españoles 2.000 millones de euros,1
"JERUSALEM LE PERTENECE A LOS HEBREOS Y NO A LOS LLAMADOS PALESTINOS.  Los Palestinos nunca existieron en la historia, los llamados palestinos, son Arabes Musulmanes modernos.. ellos andan diciendo que son Cananeos... [URL]",1
[USR] tu eres putifandom porque quien no es puta no disfruta airw,0
[USR] mira que tu eres bandido y criminal al igual que santos mas temprano que tarde pagaran sus crimenes escoria basura,0
Los árabes me dan asco,1
[USR] callate zorra querés que te viole putita,1
Y mientras a los que somos españoles trabajamos y cotizamos nos eternizamos esperando k nos operen y nos kitan medicinas ¡manda cojones! Sánchez da Sanidad gratis a los sin papeles... pero no a los inmigrantes legales  [URL]  Enviado desde [USR],1
"El mensaje de Carmena q animaba a asaltar la valla de Melilla como fuera  Los Cuerpos de Seguridad están desbordados. Y la asistencia colapsada. Los asaltos violentos a la valla de Ceuta y Melilla son un gran problema,pero hay políticos q animan a hacerlos [URL]",1
