text,label
@user @user @user @user ovvio sono tutti soldi e voti.... come i rom .... RIMPATRII IMMEDIATI FORZATI,1
#Parioli I residenti dei Parioli sono oramai disperati perché consci che anche questa volta sono stati discriminati e non possono avere la possibilità dell' accrescimento culturale che i Rom sicuramente avrebbero portato.,0
A scuola grazie anche ai migranti http,0
#Ungheria attacca lItalia sui migranti continua a ricattarci #Ungheria #attacca #l'Italia #sui #migranti: ... http,0
"Roma, quei podisti perseguitati dai rom http http",0
"Giornata dei migranti a Lampedusa, il Miur non la sostiene più http",0
"#SanremoNews Bistolfi (FI): “Basta immigrati negli alberghi della nostra provincia, non ce la facciamo più!” http",1
L'ISLAM È AMORE È PACE COL CAZZO !!!!!!!! ASIA ABIBI CONDANNATA A MORTE  XCHE CATTOLICA.........CHE MERDA ....E PENSARE CHE QUESTA GENTE CE L'ABBIAMO  IN CASA NOSTRA.......MATTARELLA BERGOGLIO........ INTELLETTUALI .....CHIESA CATTOLICA....... DOVE SIETEEEEE,1
@user I migranti!!!,0
#QuartaRepubblica Non chiudiamo i campi rom. Piuttosto mandiamoci a vivere Vauro e famiglia. Dopo un mese di clisterini gli rifacciamo l’intervista e vediamo se ha cambiato idea.,1
"Un colpo agli immigrati, una mano alle banche. Trump dà la prima pugnalata alla Dodd-Frank -… http",0
"Cécile Kyenge evitò l'espulsione di questo rom: che cosa ha fatto, oggi http",0
"Quante inutili parole! E' ora di eliminare tutti questi politici immigrazionisti, il mondo senza questi delinquenti… http",0
Siamo stanchi di stranieri che dettano legge a casa nostra o ci scherniscono.  Stanchi di Italiani che non fanno il nostro interesse.   Esigiamo il rispetto che meritiamo ! #15settembre #SalviniNonMollare #ONU #StuPD http,1
"Migranti profughi richiedenti asilo Tutti clandestini, per agitare le folle... http",1
"Scusate, ma è inaccettabile. Questa è mistificazione della realtà. Gli ebrei erano deportati in campi di concentramento e uccisi nelle camere a gas. I migranti arrivano con lo smartphone e, prima di partire, pagano per il viaggio.  Davvero, basta! #27gennaio http",0
L'Italia è un paese che tratta meglio i rom e i clandestini che il proprio popolo italiano.. nn fanno niente e avanzano dir#dallavostraparte,0
"Quando eravate Voi al governo pensavate esclusivamente ai migranti,alle coppie di fatto,adozioni a coppie lgbt,ius soli,scioperi della fame,mazza che argomenti!",0
Buongiorno a TUTTI gli amici/ amicheDi TW basta non abbiano il virus della DEMENZA pro immigrati e che votino x il Partito Demente cioè PD,1
"@user @user Diploma tecnico, corso di programmatore, patente DE, esperienza catene montaggio FIAT... Ti basta? A loro no! Cercavano IMMIGRATI senza esperienza. Ma di cosa parliamo? Il nome della fabbrica non te la faccio ma é una MULTINAZIONALE! Se mi credi bene. Se no é lo stesso!",0
"Sto pensando che in fondo siamo tutti un po nomadi e un po stranieri in questa nostra Italia ""Terra di nessuno""",0
"Pontina, controlli serrati al campo rom di via Pontina: 6 pattuglie della municipale in azione http",0
"Capodanno, piani anti-terrorismo a Roma e Milano. Minniti: ""Guardia altissima"" - Il Fatto… http",0
"@user straniero lo sei pure te. Vai a dormire tu che questi social non fanno per tutti, soprattutto per quelli come te.",0
"#profughi ? La maggioranza sono ragazzotti del sottoproletariato urbano, l'africa svuota le sue galere in Italia.Gr… http",1
"Prigionieri del campo nomadi, Roma fuori controllo – VIDEO | VoxNews http",1
"@user non lo so, Le Pen sembra lasciare ipotizzare una collaborazione con l'Italia sul tema immigrati",0
"Lodi: ""La richiesta di asilo è stata respinta""  ...l'educatore viene massacrato da 9 risorse...  ...massacrato con sputi, calci, pugni...  ""Lo stile di vita dei migranti sia il nostro"" #LauraBoldrini  #AspettandoPrometeo #IVReich http",1
Tedeschi ancora divisi in due I profughi sono il nuovo muro http http,0
Con gli incassi delle multe asfalti e pattuglie anti-rom http #Milano,0
L'Autorità Nazionale ha denunciato: «Negli hotspot i migranti vengono privati della libertà e non hanno tutela... http,0
@user A Treviso il controllo della droga è degli africani e rom. Andiamo avanti così. Bel futuro per i nostri figli.,0
"A proposito di debito, e migranti, in Europa succede qualcosa di cui quasi nessuno parla http",0
Nazioni unite bacchettano l'#italia.Dovete dare una casa ai #rom! http @user @user @user @user,0
@user @user No sul lavoro che lo stato deve garantire altrimenti deve garantire un sussidio min. Per una vita dignitosa ai suoi cittadini. Ma x ora la garantisce solo agli immigrati. Emigra tu e tutti quelli come te.,1
"Milano, ladre rom senza contegno e umanità: rubano pure le urne con le ceneri dei defunti http",1
#terrorismo #venezia In un appartamento vicino alla Fenice il centro di preghiera clandestino. Lì si preparavano con allentamenti e video,0
"@user @user @user Viene da sorridere all'idea che si debbano spendere soldi degli italiani che lamentano la spesa per gli immigrati e ce ne fanno spendere un ""mare"" per educarli alla civiltà, da sorridere o da piangere.",1
Incendi di rifiuti in campo nomadi abusivo tra Manfredonia e Cerignola – la VIDEO segnalazione di Forza Nuova: http,0
"Non solo ma opera indisturbata da qualche anno.Solo ora potremo rimandarne a casa un po' grazie al Decreto SICUREZZA.Nessuna scusante e nessun asilo per immigrati spacciatori, assassini o sfruttatori.A CASA.Avevamo già i ns. senza doverne importare.#chiudiamoiporti",1
"#Roma, studentessa cinese morta: condanna con patteggiamento per due rom http http",0
"L'Italia non me l'hanno rubata i migranti o gli islamici ""invasori"". Me l'ha rubata la cultura clientelare, mafiosa, fascista, peppista e fintosinistra che mi ha costretto a portare due lauree all'estero per lavorare grazie alle mie competenze e non grazie alle mie conoscenze. http",0
"RT @user Almere, la città più multietnica d’Olanda roccaforte della destra anti-migranti   … http",0
Stavolta giuro che voto @user se fa quello che dice e manda fuorii rom dall Italia lo voto lo voteranno in tanti BASTA BASTA,1
"e'  terribile, SI DEVE  METTERE FINE  A QUESTA  SITUAZIONE--  PERBACCO, SONO ANNI CHE SI PARLA  DELLA VIOLENZA  DEI COLORATI,  NON CAPISCO COME ANCORA LE DONNE  INSISTANO  AD ACCOPPIARSI   CON  NEGRI  O STRANIERI CHE SIANO  !!!!!",1
@user @user ..e allora vuol dire fascisti e razzisti tutti..guarda che nessun paese fa entrare i clandestini o li tiene come la Francia che poi a Marsiglia ha chiuso i porti.. quando Salvini manderà via stranieri dall'Italia che lavorano onestamente..allora parlerai..ma non succederà mai,0
Siete come i talebani che mettono in mano i mitra ai ragazzini per farne terroristi .... ne più ne meno #Napoli… http,0
"Repubblica: Il Comune: ""Demolizione per il campo rom della Favorita"" http #palermo",0
"@user Una società formata da questi individui mi terrorizza,al rogo chi ha dato la stura,sdoganando tutto questo.Ribelliamoci!!!",1
Prima di tutto gli italiani! Altro che regalare affitti e cibo a immigrati clandestini! #ilsognodigiovanni #leiene,1
Vergognoso! Chi scappa dalla guerra e muore di fame non sputa sul piatto dove mangia soprattutto se mantenuto a spese di altri! FALSI BISOGNOSI! L’inganno è svelato!.. e i nostri connazionali umiliati a cercare nella SPAZZATURA! Immigrati PARASSITI TORNATE IN AFRICA,1
Cinese morta dopo un furto: uno dei due rom è già libero – Speed 24 News http,0
"Leggendo questa notizia, mi vengono in mente la Fornero e Monti! Hanno varato una Legge per mandare in pensione gli ITALIANI a due passi dalla miglior vita, per dare i NOSTRI soldi agli IMMIGRATI? Ma chi li appoggia ancora, non si VERGOGNA? http",1
IRAN.Teheran promette vendetta contro Usa e suoi alleati #iran #isis #terrorismo http,0
"#Immigrazione, #Casapound consegna un #report sui fatti di cronaca a #DiLucente ed esorta il #Consiglioregionale a intervenire http",0
"Roma città – Chiusura campo rom posticipata, si tenta il dialogo - Cittaceleste.it #Roma http",0
Schifosi mussulmani io bannerei loro dai locali pubblici e non solo... http,1
"@user continui a battere sulla ""questione immigrazione"" perchè sei un opportunista con lo spessore politico di una ameba. VERGOGNA, pagherai, ad un futuro più che prossimo, lo scotto della tua incompetente cialtronaggine politica che ci sta rovinando",0
La deficienza fatta a persona. Una futura donna sottomessa che desidera l'#Islam perché nessun cristiano (in tutti i sensi) se la incula (in tutti i sensi). #StopIslam #Stopinvasione,1
"Strage nel nome dell'islam. Tutti a morte, tutti bruciati stì islamici di merda, nessuna pietà, basta",1
"Roma, “tangenti per appalti sui campi rom”: chiesto il processo per 17 persone  http via @user",0
#laRisposta che oggi diamo ai buonisti che mandano soldi agli immigrati furbetti che a #Lodi pretendono la mensa senza pagarla è in questa domanda... Dove siete quando ad essere in difficoltà sono gli italiani??  Fate schifo,1
Questi non dovevano pagare le nostre pensioni???  Parole del PD   La sentenza della Cassazione: pensione pure agli immigrati appena arrivati L'Inps deve pagare il sussidio di invalidità civile anche a tutti gli extracomunitari   http via @user http,0
@user vorrei sapere se l'ex direttore #fatepresto assumerà comunque la signora rom romana per fare le pulizie o ci pensa lui ora,0
"#ultimenotizie #news #notizie: Roma, studentessa cinese morta: fermato un rom, denunciato un 16enne: si cerca un http",0
Sull’immigrazione Bruxelles come Ponzio Pilato. Ferrara (M5S): “Juncker ha sparato cifre a caso. Pensa che elargendo qualche mancetta all’Italia l’Europa possa lavarsene le mani” http,0
"@user ha portato in Italia, in un anno e mezzo, ben 5.088 immigrati affetti da malattie infettive come la scabbia, tubercolosi, sifilide e Aids. I dati distruggono la retorica delle anime belle. http",0
"La Tunisia secondo le associazioni umanitarie NON sarebbe un posto sicuro per sbarcare i migranti , ma misteriosamente diventa sicuro per farci andare gli europei in vacanza . Che strano, sicura per gli Europei ma non per gli africani 🤔 http",0
Ma non possiamo sostituire gli immigrati con Scandinave gnocche? Che sarei felice di mantenere! Vi devo dire tutto io??E Daje!!,0
"@user Guccini diceva  giovani e belli Se proprio ti servono ,tutti quelli che faticano lottano e con dignità nn si buttan vs migranti",0
"@user Ministro per favore metta più Polizia i migranti si stanno prendendo le nostre città, Lei ha promesso di mandare via coloro che nn hanno il permesse x restare, ma questi sono tutti stupratori delinquenti, abbiamo paura, faccia qualcosa.Grazie",1
"Lui è Gianni il pomodoro. Per colpa di Salveenee che non vuole far sbarcare i migranti della #SeaEye in Italia non verrà mai raccolto. Non possiamo permettere una simile barbarie, VERGOGNA!  #facciamorete #restiamoumani #portiaperti #Amburgo http",0
@user Stop a clandestini e fint8 migranti bambini non autorizzati! http,1
"Ci vorrebbe una bomba atomica in modo da fare saltare in aria la libia, siria e tutti i terroristi. Morite tutti pezzi di merda #Tunisia",1
"Cercano di rapire una ragazza per farla prostituire alla Magliana, arrestate 3 rom - http http",0
"Cancellare dei fondi per curare i migranti, è la perfetta prosecuzione dell’operazione portata avanti dal #decretoSalvini. Con un obiettivo chiaro: distruggere i diritti umani basilari. Addirittura adesso si mette a repentaglio la salute. http",0
"@user no ma i rom non rubano .....! L'idiozia della televisione sx ""impone"" eufemismi! No ci sto! I ZINGARI sono parassiti eladri",1
Attentatore #Istanbul #Reina #CercateliQui Come sempre #Italia rifugio sicuro per terroristi!  #accoglienza #buonisti #malaGiustizia,0
@user Avete rotto il cazzo! Con la scusa delle donne e bambini ogni volta e la stessa canzone li facciamo sbarcare poi tra 2/3 giorni un altro carico di #migranti e pronto per rompere il cazzo ma andate fanculo ma basta l'Europa non è solo l'Italia Basta! #portichiusi,1
"@user @user CAMBIO ARGOMENTO,  M5S  E' MORTE  DEGLI ITALIANI,  NO  GAS, NO TAV. SIETE COMPLICI  DEI MIGRANTI  DELLA  DICIOTTI  A METTERE BOMBE  IN UE, NO CREATE  LAVORO. IL REDDITO-CITTADINANZA  VA AI MIGRANTI  E  ROM. AL  VOTO SUBITO  BASTA M5S  CON IL TRAFFICANTE  DI DROGA  A. DI BATTISTA.",0
@user se gli immigranti sono il futuro dell Italia  portateli a casa tua  come fai a dire una stronzata del genere non,1
"tutti i giorni ci sono rapine aggressioni  stupri  compiute x  la maggior parte da immigrati, ma i medii hanno il silenzio stampa, loro parlano solo della sinistra  che ha fermato un pullman  per un secondo o se un italiano insulta un nero,, questo a reti unificate ,il resto 0",1
"Sardegna, i migranti prendono per il culo l'Italia: sono tutti algerini del 1985 di nome Mohammed | Riscatto... http",1
@user @user Radere al suolo tutti i campi rom e rispedire al mittente i loro occupanti. Tutti. #fuoridalcoro,1
"L’Italia alla Ue:quote migranti,ecco i Paesi da sanzionare http",0
"Blitz nel campo rom della Favorita, la procura di Palermo non convalida il sequestro http",0
"Ecco la ""scuola degli zingari"" per i vostri figli Dove si spingono i rom: ""bastano"" 400 euro -… http",0
"Terroristi islamici bastardi e vigliacchi, stanno mettendo in ginocchio tutto il nord Africa: senza turismo Egitto, Tunisia, Marocco.",1
"Lo dicono tutti che la Libia non è un paese sicuro, si lavori per Evacuare tutti i profughi da questo inferno. #eritrea #migranti #eritreademocratica http",0
"#RIACE:  SINDACO #LUCANO ARRESTATO PER FAVOREGGIAMENTO DELL'#IMMIGRAZIONE CLANDESTINA.  In manette Domenico #Lucano, sindaco di Riace, simbolo del l'accoglienza dei #migranti e tanto amato da #Saviano. #Salvini: ""Chissà cosa diranno i #buonisti...""  http",0
#piazzapulita adesso si passa alla propaganda islamica. Dove sono le femministe? 😁😁😁 tra pochi anni entrerà in vigore la sharia,1
"A mio parere l'unica cosa da fare era utilizzare i € 150.000,00 per lo smantellamento del campo nomadi. Campo tra... http",0
"Roma, studentessa cinese uccisa dal treno: fermato un nomade http",0
"@user Chissa' perche' tutti questi fondi che ha avuto questo sindaco per l'integrazione dei migranti,non sono mai stati dati,ai disoccupati italiani per farli uscire fuori dalla loro poverta'.Integrazione per i migranti,Disintegrazione per gli italiani senza lavoro.",0
La legge vigente che ormai regola da anni l'immigrazione in Italia è la Bossi-Fini. A causa di questa legge infatti gli immigrati più qualificati e spendibili nel mercato del lavoro non sono in grado di avere... http,0
#PortaPorta La Chiesa Valdese quanto tempo tratterrà i #migranti salvati dalle guerre ?  Non faranno mica la fine del pesce che dopo tre giorni puzza ? Unica soluzione:  respingere persone + chiudere i porti Basta farse. @user non zerbinarti ai 5S.,1
@user @user Succede che ci si incazza. Sto male quando sento la Boldrini...nel parlamento italiano a tutelare gli stranieri....che faccia ci vuole. La paghiamo noi ed è contro di noi.,0
Tamim deve smettere di sostenere estremisti e terroristi in Libia! #Qatar #Libya #Italy http,0
Quando avranno finito con migranti e gay mi auguro che iniziano a lavorare per le cose serie ed importanti. http,0
"@user @user per gestire l'immigrazione abbiamo obbedito a Maroni, non so se è stronzo, ma so che ha fatto più danni che altro.",0
"Ministro serbo, grande rischio terroristi islamici in Kosovo.  E la Mogherini vorrebbe liberalizzare i visti! http",0
@user Così la smette di fare propaganda all'islam invece di difendere la cristianità .Ha rotto i c....... vaffanculo ! http,1
"@user @user @user Forse gli immigrati in mano al caporalato, cosegnati da voi buonisti! Per il resto cazzeggiano tutto il giorno, bivaccando e defecando ovunque. I nostri minatori tutta un altra storia.",1
"gli stessi che ""je suis Charlie"" qualche tempo fa, ora affermano che i terroristi hanno fatto bene. Mi fate immensamente schifo!",0
"Roma, cinese morta: niente carcere per i rom che la derubarono. Uno è già libero http",0
"INSOMMA PEDOFILI,MUSSULMANI,,ORGE,E NN PAGANO NEMMENO LE TASSE.E SONO SUL SUOLO ITALIANO,CHE BEL PACCO CHE SI SONO PRESI GLI ITALIANI..???????? http",1
Fanpage.it: “Figli delle baraccopoli”: in Italia 20mila minori rom senza scuola e a rischio malattie. http,0
@user E nessuno che conta che interviene. Bambine martirizzate.  Animali schifosi di un islam bestiale.,1
"Il maiale, ecco come seppellire i terroristi islamiciLa bordata di Silli, responsabile immigrazione  Forza Italia. http",1
Khalid Masood è il terrorista ISLAMICO che @user integrerebbe in nome della globalizzazione e del falso buonismo,1
#Mattarella urlò al far west quando una piccola rom fu ferita da un pallino vagante e ora tace vergognosamente sui branchi di immigrati che stuprano e uccidono. Costui oggi approfitta della africane del #volley per auspicare un'orrenda Italia multietnica. Vergogna #stopinvasione,1
Stiamo attenti a non sottovalutare questi segnali; la minaccia dell' Islam in Europa è reale per come ci ha insegnato la profetessa Oriana Fallaci http,1
@user L'UE e i migranti  c'erano anche quando eri tu al governo. Cosa e' cambiato ?,0
Ormai è #sostituzione #etnica. In #Toscana incentivi agli italiani per andarsene mentre manteniamo gli stranieri a 35 euro al giorno. Siamo all’Oscar del ridicolo.  http,1
Proprio tutti anche gli immigrati. Sai come stiamo meglio e ci riprendiamo la nostra Italia http,1
@user Giusto per capire : quali sarebbero i diritti usurpati dagli immigrati?,0
@user Aria fritta è la tua.Come mai Macron e tutti gli altri gli immigrati NON LI VOGLIONO?Mi spieghi perchè dobbiami prenderli tutti solo noi? Aria fritta vero? Quanti milioni ne vuoi in Italia? Spara una cifra dai invece di sparare solo stronzate.,1
Stabili COMUNALI occupati da rom: la sinistra a #Milano consente questo scempio. La mia denuncia su @user http,0
@user @user No al #NOGlobalCompactforMigration perché ci riempie e ci fa invadere senza alcun freno da tutti i migranti del mondo intero che renderebbe inutile il #DecretoSicurezza di @user @user @user e #governodelcambiamento non dovete assolutamente firmarlo!,1
"@user terrorismo? Ma non eravamo alla ricerca di dati ""toppati"" nell'articolo? O la butti in caciara perché non ne trovi?",0
"@user Non si capisce che se i rom non accettano di vivere in modo civile ,bisogna insegnarglielo. Ma basta partire dalla scuola perché gli insegnanti non hanno la bacchetta magica per cambiare gli adulti che sono il vero problema.",0
Mentre gli italiani muoiono di fame... #rom #zingari #ONU http,0
"@user Ma se hanno già detto che in mezzo a questi si nascondono dei terroristi!!! Dopo la mafia nigeriana importiamo anche terroristi libici? No, grazie",1
"@user Non meriti simpatia a prescindere dall'abito che indossi. La tua simpatia è scivolata via tra le lacrime dei sacrifici che avete imposto all'Italia e agli italiani tutti,mentre voi stavate inginocchiati a un'Europa che disprezza i propri popoli per adulare i migranti. Mi fai pena",0
I radar incastrano le navi delle Ong: svelato come importano migranti in Italia - VIDEO http,0
"@user credo che faremo la fine,Usa,della francia,del belgio, dove questi immigrati si rivolteranno con le armi contro chi li ha accolti",1
@user @user a parte la stupidità dei 2 dipendenti la nomade recita bene! @user invitala a #Pomeriggio5,0
Agente di polizia inglese picchiato selvaggiamente da stranieri. Accade oggi in Europa invasa da orde di selvaggi. Grazie a Corbyn #boldrini e  Co. #migranti #islam #salvini #travaglio #Chilavisto http,1
@user @user Credevo fossi una rom anche tu da come scrivi.,0
Volevo caricare la mia bici in macchina ma per fisica ci siamo accorti che era più grande la bici della macchina e sembravamo ladri rom,0
@user @user islam -africa = feccia del mondo.chi non lo avesse ancora capito si svegli .amen,1
Il mio cuore è spezzato per lo #SriLanka e la comunità cristiana mondiale. Dobbiamo combattere il perpetuarsi della cristianofobia. I terroristi della supremazia islamista devono essere condannati ovunque. #parcondicio #adoratoridellaPasqua #Obama #Clinton ? http,1
"LN Padania: Il vice della Merkel: ""Sull'immigrazione, lei ha portato l'Europa in un vicolo cieco"" http",0
"Rula é il volto dell' islam impastato al progressismo occidentale..la negazione della verità, pericolosa mistificatrice #portaaporta",0
"Macron non si acccontenta di essere odiato nel suo paese dai gilet gialli, vuole esportare questo sentimento anche fra gli italiani. Leggete questo articolo. 🤮🤮🤮🤮  Migranti, Conte alla Ue: «A parole d’accordo, ma servono fatti concreti» http",0
"Grandioso Gino Strada sui migranti: ""Soltanto dei cretini potevano pensare di continuare a fare guerre in giro... http",0
"Attentato Quebec, Gentiloni: “Governo vicino alla comunità musulmana, spesso vittima di terrorismo” http",0
Anche #migranti a #Jesi contro #razzismo e #sessismo #nonunadimemo #lottomarzo @user http,0
"Il multiculturalismo Una bomba antidemocratica e demografica per mettere gli uni contro gli altri. Sappiate che, un giorno, qualcuno dovrà prevalere. Chiunque vi dica che la convivenza sia possibile è in malafede. L'Islam per sua natura,non ammette mezzi termini. Siatene consci http",1
"PRIMA L'ITALIANO!Imparino la lingua italiana prima di parlare:NESSUNO è #CLANDESTINO !!!Esistono: #profughi, #migranti, #rifugiati, #immigrati regolari e irregolari.#CLANDESTINO è chi sale su una nave senza biglietto.Per l'astronave Terra, non c'è biglietteria... 😜 http",0
"@user  La facciamo qualcosa per i camionisti sottopagati e sfruttati , o ci indignamo solo quando sfruttano immigrati col caporalato ? I camionisti non sono lavoratori di serie D , mandano avanti l' economia su gomma ! Non devono rischiare la vita loro e degli altri ! http",0
#notizie #Pisa Campo rom a Ospedaletto: Campo Rom Ospedaletto http #Toscana #Italia,0
"Accuse di #Salvini a #Malta, complice di averci rispedito migranti con giubbotti di salvataggio, hanno innescato 1 caso diplomatico prima con Malta poi con l’EU. #EU ha preferito “cazziare” ministro Interno piuttosto di richiamare Malta x il suo infame comportamento.  EU vile. http",0
"Roma. Tentano rapire ragazza per farla prostituire: arrestate 3 rom: Tre donne rom, di 17… http",0
oramai è diventata terra di rom e magrebini addetti allo spaccio i quali con fare aggressivo non solo minacciano... http,0
"@user Ecco come individuare i delinquenti da espellere, dato che il decreto prevede giuste conseguenze per questa categoria di immigrati.... altro che anima e anima",0
#QuintaColonna ohhh ma sti musulmani hanno rotto il cazzo qua siamo in Italia e non ne vogliamo befane mascherate col velo eh basta,1
NON VOGLIO CHE ANCHE L'ITALIA FINISCA COSI'!!! #StopIslam Francia.La bomba a orologeria dell'islamizzazione: http,1
"@user @user Fra i ""poveracci"", come li definisce lei, ci sono terroristi, stupratori, spacciatori, affiliati della spietata mafia nigeriana e delinquenti di vario tipo...o crede veramente che l' Africa si sia privata dei suoi scienziati per regalarli a noi??",1
"Infatti Pavlovic, i rom criminali li tratteremo cm gli altri it., li manderemo in galera e gli toglieremo tutto,aspetti... #dallavostraparte",0
@user @user Perdiamo i giovani prendiamo il futuro. Saremo invasi da terroristi islamici. Tutti con cinture esplosive.,1
@user Mai più mussulmani in Italia 😡😡😡😡👿👿👿👿o meglio in Europa,1
"Ma quando scrivete ""uccidiamo i migranti', ""prima gli italiani"" o condividete post razzisti di Meloni, Salvini e fascisti vari, lo fate con o senza rosario in tasca e crocifisso appeso alla parete?",0
"Roma, quei podisti perseguitati dai rom http http",0
"@user Quindi anch’io potrò difendermi dai teppisti di estrema destra che aggrediscono stranieri,gay,qualsiasi minoranza nella mia città? Buono a sapersi. Un giorno potrebbe esserci una delle vostre ronde tra le vittime se qualcuno scambiasse una persona per un ladro.",0
Stretto giro di vite dei carabinieri e della procura contro i nomadi sinti piemontesi... #canavesenews http,0
METTETEVELO TUTTI IN TESTAL'ISLAM È IL CORANOIL CORANO È ANTICOSTITUZIONALEÈ ANTIDEMOCRATICOCALPESTA I DIRITTI UMANINON SARANNO MAI COME NOIIMBECILLE ANCORA CHI CI CREDEA Trino nasce la moschea della tolleranza http,1
"@user @user @user @user  Stanno continuando,mi pare.Gli islamici  grazie agli USA hanno deciso di sterminarci",1
Confiscate 187 auto a nomadi Rom: le utilizzavano per compiere furti Intestate ad un egiziano. http,0
"Stranieri, ""Africani"" e ""Clandestini"" non sono sinonimi. Straniero è chiunque arrivi dall'estero, gli Africani regolari in Italia ci sono almeno dagli anni'80, Clandestino è chiunque entri in un Paese senza permessi, può essere originario di qualsiasi Paese. Non confondiamoli❗",0
"Austria: Forza Nuova, manifestazione in favore di Hofer - Anche slogan contro l'immigrazione http",0
"@user Chi può essere favorevole all'accoglienza di migliaia di finti profughi da mantenere e a cui tocca pagare istruzione, assistenza, vitto e alloggio con annessi e connessi? Non pago le tasse per mantenere migranti ma per avere servizi.",1
"Lasciare l'Unione Europea, lasciare la NATO, cancellare i debiti, impedire l'immigrazione per evitare una crisi di civiltà, il tutto preteso con estrema violenza distruggendo le loro città sia materialmente che economicamente.E Trump, Salvini, Mélenchon,LePen li applaudono http",0
La strategia è invadere l' #Italia di profughi per poi condizionare. Pensare che abbiamo criminali sinistrati di #Stato complici #agorarai,1
"Se qualcuno di voi mi dimostra che negri, rom, islamici e clandestini sono davvero risorse, GIURO CHE BACIO IL CULO ALLA KYENGE!!!",0
