text,label
@user @user E tranquilla perché un giorno tutto questo accadrà!!👿👿👿 l'Islam ucciderà ruberà i loro beni i soldi .tempo al tempo!!👿👿👿,1
"http di @user Veronesi choc sul governo: 'Sistema che uccide i migranti' Lo scrittore, che aveva appoggiato Saviano, all'attacco: ""Hanno creato una macchina da guerra per farli annegare""",0
"Dal caos Rai dopo dimissioni Verdelli alla caccia al terrorista di Istanbul: - Istanbul, la caccia al terrorista… http",0
Papa a studenti @user La risposta alla paura è l'accoglienza e l'accompagnamento dei migranti. http,0
"#Roma Far West della #StazioneTiburtina, tra #risse e #scabbia.La 2°Stazione della #Capitale d ' #Italia ridotta a succursale del #Congo grazie alla miopia dei politici che vorrebbero creare anche un #infopoint #migranti usando soldi pubblici degli Italiani@user http",0
"Migranti, ""Noi non importiamo schiavi perché invecchiamo"": scontro tra il ministro del Lussemburgo e Salvini Scintille tra i due alla Conferenza sui migranti a Vienna. Ad Asselborn, ministro lussemburghese, scappa anche una imprecazione http",0
Grazie immigrazione incontrollata...  #migranti #profughi #meningite #Africa http,1
"#OpenArms con a bordo 300 migranti chiede di poter sbarcare. Ma @user  conferma la sua linea: ''I porti italiani sono chiusi'. Malta, che nega l'approvvigionamento, ha evacuato stamani dalla nave un neonato e la mamma soccorsi in mare ieri http",0
@user @user ma quali profughi sono combattenti musulmani mandati per spacciare stuprare rubare sgozzare occupare e fanno tutto questo con la complicità dei castrati istituzionali di questa repubblica criminale,1
"@user in Italia, prima gli Italiani Dare la casa agli stranieri,DOPO che nessun Italiano sia costretto a vivere per strada o in macchina",1
se la juve oggi perde vado al primo campo rom a fare un po di spaco botiglia amazo famiglia,1
@user Forse non ti è chiaro che in Ungheria è stato il popolo a dire no ai migranti.Un buon politico votato dal popolo non fa di testa sua ma ascolta il suo http cosa ti dico a fare che per voi il popolo non conta niente .,0
"@user i rimpatri difficili da che? E che stato è l'Italia? Andate nei campi rom: Mercedes, audi, porsche.LO STATO È MAFIA IN ITALIA",0
I nomadi illuminavano le abitazioni dopo essersi allacciati abusivamente a un palo Enel.. #canavesenews http,0
@user la mia non e' cattiveria ma diritto alla vita! Con i migranti in giro e' finita la liberta' e aumentata la paura a casa e fuori,1
"Iuventa, se salvare migranti è una colpa http",0
"Allarme terrorismo: mille fantasmi a  Milano, senza vera identificazione http via @user",0
"Jean Asselborn, il ministro degli Esteri lussemburghese responsabile delle politiche per l'immigrazione con cui oggi ha litigato Matteo Salvini a Vienna due anni fa chiese l'espulsione dell'Ungheria dall'Ue. La coerenza non è di questo mondo",0
"Guardavo alcuni TT e mi si é formato un blob mentale con Grillo, la mela, il Tiziofelpato esultante perché la chiesa valdese si occuperà di 10 migranti. Poi, boh, ho pensato ad altri 5 anni di questa legislatura ed é ricomparsa l'immagine della mela. #facciamorete #bolledivalore",0
"#milano Milano, rom da anni in stabili comunali di via Adriano  http",0
@user i rom non devono esistere non possono fare ciò che vogliono protetti da associazioni no profitto che vivono sui nostri soldi,1
@user il terrorismo è quello fatto dallo stato bugiardo che ci ha raccontato questa favola. Storia è il massacro e le torture alla diaz,1
In una Tv pubblica con canone fisso in bolletta quello che vogliono imporci è parlare di “politica e migranti”❓  Se ami l’Italia  🇮🇹    #boicottasamremo http,0
Ecco  come si fa! Il marine ha denunciato la scuola della figlia dopo aver scoperto che le insegnavano l'islam! Bravo ! http,1
"@user @user La sensazione è che l'atteggiamento prepotente assunto dall'Italia nella questione migranti si stia ora rivoltando contro i nostri connazionali rimasti senza lavoro all'estero. Non è una conseguenza diretta, ma il clima è brutto",0
"rom che fan quel che voglion costruiscono senza permessi, rubano son violenti e gov. li tutela ennsol gov. ma anche  m5s giunte vcomunali",1
"@user @user Cosa facciamo con tutti quei giudici che lasciano a piede libero tanti delinquenti, migranti finti?!",1
Tangenti per gli appalti nei campi rom: chiesto il rinvio per 17 indagati http,0
Continuate a far arrivare chiunque in Italia. Ve ne pentirete poi in seguito ad un attacco terroristico.,1
"@user lo fanno di proposito, gli immigrati sono lo 0,2% della popolazione europea @user",0
"@user mussulmani  di PD a palazzo Chigi, tagliagolla in Libia, libici in Italia, Italia senza italiani. Pinotti/Gentiloni dimettetevi.",1
"In nome di #Dio, clemente e misericordioso 08,di Radio Voce della Speranza #islam #imam http via @user",0
Matteo Salvini vuole rimpatriare i migranti tunisini con i voli charter: cosa prevede l'ipotesi allo studio http,0
"Giornata della Memoria, i rom di Milano commemorano il loro “Porrajmos” http",0
"VOI CHE VOLETE A TUTTI I COSTI CHE I MIGRANTI ARRIVINO, VOI DI SINISTRA ASSERVITA AL GRANDE POTERE, VOI CHE AVETE RINNEGATO IL POPOLO PER IL BUSINESS DI ONLUS E COOP  SIETE COMPLICI DI QUESTO ABOMINIO: LA MAFIA NIGERIANA IN CAMPANIA IMPORTA MIGRANTI PER IL TRAFFICO DI ORGANI http",1
"Il vostro bisogno di deridere Sumaya Abdel Qader perché porta il velo, perché musulmana, chiarisce quanto siate razzisti.  #ottoemezzo",0
"Milano,con @user festeggiamo un'altra famiglia in rom in casa.Tempo baracche finito,quello della scuola… http",0
@user @user  Ministro....deve provvedere subito! Separi i cristiani dagli islamici ! Almeno qui  devono ess… http,1
Rivendevano decine di prodotti rubati: blitz della polizia ai nomadi - http http,0
@user @user Vogliamo : 1 ritorno allo IUS SANGUINIS (Diluito nel 92 dopo Soros) 2 blocco navale 3 Rimpatri di tutti i gli africani e mediorientali ! 4 Messa al bando dell'Islam! 5 nazionalizzazione delle banche! 6 riforma dell'informazione no politically correct  Siete voi quelli da votare?,1
UN DECEREBRATO ITALIANO CONVERTITO ALL'ISLAM E UN MAROCCHINO ERANO PRONTI A SGOZZARCI TUTTI IN NOME DI ALLAH.#ReligionedipaceamoretolleranzaUNBELCAZZO #StopIslam http,1
@user Riprendiamoci tutto. Via dai banchieri spa e schiavisti. Banca Nazionele e confini ripristinati. No islamizzazione.,1
"@user Anni di impegni con governi abusivi solo per distruggere e vendere l’Italia alle merde straniere,per far crescere loro e impoverire gli italiani,l’ultima manovra che avete fatto è stata di cedere i mari  pescosi della Sardegna agli odiosi francesi!Tutto contro agli italiani!",1
@user per fare sentire a casa voi africani e musulmani e stranieri noi italiani 🤔😂@user @user,1
Tante delegazioni ecumeniche e anche i rappresentanti della comunità islamica #PapaInGeorgiap... http @user,0
Devo ancora sentire la buonista ke da del razzista o fascista al poliziotto francese ke ha sparato al terrorista Poverino il terrorista caro,0
"Si fanno mantenere e bene da noi,  parassiti succhiasangue tolgono assistenza agli italiani ed in cambio ci portano degrado ed il problema islam http",1
Sono a Strasburgo al #ParlamentoEuropeo. Vile attacco al cuore della #democrazia. Agli atti di #terrorismo e violenza bisogna rispondere con unità. La mia più sentita vicinanza alle famiglie delle vittime e dei feriti. L’Italia è vicina al popolo francese. #Strasburg #Straburgo http,0
I rom occupano case popolari e organizzano persino matrimoni con tanto di limousine bianca in zona Via Bolla a #Milano. La solita arroganza di chi vive nell'illegalità! Basta con il #buonismo verso questi soggetti. La mia segnalazione su @user http,1
"Campi rom, altro che chiusura: ""Ecco i villaggi a Cinque Stelle da 12 milioni di euro"" - #roma http",0
"@user @user @user Siamo diventati una Gujana Francese,tutti i galeotti degli Stati Africani vengono favoriti dai loro stessi Governanti a espatriare in Europa,così come ha fatto la Romania con gli zingari di etnia Rom e Sinti,approfittando della accoglienza che ha arricchito molti enti “umanitari.",1
"Baobab come i trafficanti ""Così aiutiamo i migranti ad andare a Ventimiglia"" http",0
"#meningite centinaia di casi nei primi mesi del 2017 , molti casi di #morte..tranquilli tutto nella norma #immigrazione non incide su questo",0
@user L'Iran e tutti questi paesi mussulmani andrebbero portati all'estinzione ........,1
Ma se in Libia per i migranti è un’inferno.. perché continuano ad andarci? Non è più sicuro un aereo?,0
"Dopo @user rimanete su #Tv2000 a @user parliamo di Sikh, una delle comunità straniere più numerose in It… http",0
"#Roma, ""giro di mazzette per pilotare gli appalti sui campi rom”: 13 a processo - http tramite http",0
Psicosi (e leggende) galoppano su Facebook: Attenzione al furgone pieno di rom accanto alla scuola! (Latina24ore.it) http,0
"@user Io parlo di ocvupazioni abusive. Non necessariamente chi occupa è un delinquente. Se non vuoi casino nei quartieri (x il bene degli italiani) prima di inasprire devi trovare soluzioni praticabili, altrimenti fai peggio. Secondo me. Poi, dimmi chi dà lavoro a un rom, se lo conosci",1
"dal sito ""tutti i crimini degli immigrati punto com"" alla faccia della xenofobia http",1
[marioafrica]: RT filippobubbico: Il benvenuto dell'Italia a #migranti. Tra oggi e domani 400 arrivi per #corridoi… http,0
I numeri del Libano sono spaventosi. 1 migrante ogni 5 abitanti. Altroché l'invasione dell'Italia. http,0
Tentano di rapire una diciottenne a Roma: arrestate tre donne rom http,0
"Stanno arrivando i migranti che uccidono i cristiani. Faccia attenzione il caro Renzi, perché in Italia di cristiani ce n'è più di qualcuno.",1
Ma pensa un po'... trattasi di #rom anche se bisogna leggere quasi tutto l'articolo per scoprirlo... http,0
@user @user Possono travestirsi come gli pare che sono Rom lo portano scritto in faccia.🤮poveri turisti stranieri.Pensare che questi delinquenti abbiano pure i rappresentanti mi fa accapponare la pelle,1
@user @user @user I mostri figli pagheranno le vostre politiche sciagurate l'invasione di immigrati che avete provocato e il servilismo all'unione europea delle banche,1
"@user @user io non voto Salvini, ma questi qua - italiani, rom...- li voglio o in galera o fuori dall'italia.Subito",1
@user fa bene a twittarle. L'ipocrisia della censura della barbarie islamica è insopportabile. Non si volta la testa altrove.,1
"in tutti i casi di terroristi islamici in UK e Francia e Belgio non vengono mai solo feriti, anche gravemente e poi catturati e portati in ospedale. Ogni singola volta li ammazzano, anche quando sono già feriti a terra LI FINISCONO SEMPRE. Non vogliono arrestarli http",0
"@user E da che pulpito viene l'accusa: un Ministro della Repubblica che attacca al muro in diretta nazionale le accuse della Magistratura, sequestra migranti. Pensasse ai soldi rubati agli italiani  restituite in ""comode rate"". Vergogna",0
: Qui profili apparentemente innocui che dopo essere entrati rivelano origini arabia saudita con incitazioni alla jihad islamica BLOCCATELI,1
"Questo vedevano gli abitanti di Roma quando aprivano gli occhi. Adesso solo immondizia, immigrati , caos e tasse http",1
"Roma, cinese morta: da oggi la bonifica nel campo rom. I residenti: «Raggi venga a vedere» - Il Messaggero http #Roma #…",0
#Sezze #Lazio #Migranti protestano per cibo no buono e bloccano il camion del servizio catering. Scusa ministro @user nn sarebbe ora di iniziare a offrire pane e c@user*i in culo? http,1
"Lotta all’immigrazione clandestina e al terrorismo islamico, difesa dei confini. Lunga e positiva giornata di lavoro a Parigi con i Ministri di Francia, Germania, Gran Bretagna, Stati Uniti, Giappone e Canada.  L’Italia torna protagonista! ?? Buona serata Amici. http",0
"E' vergognoso!!, che dei rom, non italiani, in Italia a fare solo i delinquenti. Hanno ucciso una ragazza cinese che studiava in Italia e so",0
"@user @user Belpietro ha ragione. La sinistra ha un germe negativo nel cervello che non gli permette di riconoscere il bene dal male, il giusto dall’ingiusto, gli italiani dagli stranieri! E in questa negatività favoriscono gli ingiusti, i malefici e gli stranieri!",0
"Queste manifestazioni piene di odio e di arroganza fanno torto ai milioni di immigrati perbene che in Italia ci sono venuti col cappello in mano, che si sono integrati, pagano le tasse e mandano i figli a scuola.",0
@user ma poi..... Demente.... Hai mai visto un islamico che ti dice... SI IO STO CON L ISIS. Sei più coglione di quanto pensassi,1
@user ci deve essere un bel covo di #terroristiislamici bestie mi sa a #Milano,1
"Taormina tu hai ragione ma secondo te come dovrebbero campare gli italiani?Rubando forse?Tu vivi a Roma, io anche. Fatti un bel giro e vedi quanti sono gli immigrati nella ristoraz nelle famiglie e nei negozi che lavorano sottopagati e in nero.Sono gli ITALIANI CHE LI ASSUMONO ! http",0
L'Islam è un movimento culturale e politico eversivo che è incompatibile con leggi e valori occidentali!Non c'è differenza tra gli assassini mussulmani e la grande maggioranza che approva in silenzio.Votereste un Ban Paneuropeo sull'Islam?,1
I rom hanno milioni di euro all’estero. Ma in Italia vivono grazie a... http,0
La Stranieri Spa vale come la Fiat: il Pil degli immigrati in Italia pesa 127 miliardi http,0
"Fidanzato #Turco d fam #musulmana che mi dice ""go to pray go to the church"" significa che davvero la #Turchia ha bisogno d tutti i #Cristi",0
Dateli Gl'italiani e no ai rom e alla d Feccia http,1
@user @user @user I napoletani come hanno manifestato nelle interviste non ce la fanno più giustamente Napoli è una perla d’Italia ed è veramente un delitto vederla così inoltre gli stessi migranti hanno chiaramente manifestato il loro dissenso a integrarsi,0
"I costituzionalisti già mettono le mani avanti, il RdC non si può negare agli stranieri. @user Ci manca solo che gli diamo anche lo stipendio x continuare a fare i fanagni ai giardinetti! abbiamo già buttato 5miliardi l'anno per loro.Basta! Piuttosto si torna al voto!",1
"Roma, nascerà un nuovo campo rom http via @user",0
@user @user per forza ! Se non sei immigrato irregolare e islamico non hai diritto ad un cazzo perchè sei un'italiano !,1
Direttore Carita$ attacca Salvini: “Non conosce significato di profugo”. Loro lo sanno… http http,0
"@user @user  Grazie ragazzi Questa protesta pacifica, ci rappresenta!  #ITALIA agli #ITALIANI  NO #moschee, #islam, #arabi",1
Il confine svizzero resta chiuso e noi ci teniamo tutti gli immigrati http,0
Gli zingari hanno più diritti degli italiani in Italia ci sono 9 mln tra poveri e disoccupati e noi pensiamo ai profughi ditemi che senso ha,1
Per lui non ci sono altri esempi di civiltà e se ne frega delle ingiustizie e dei danni che l' immigrazione indiscriminata e incontrollata ha provocato. Abbassando conseguentemente la civiltà...#Mattarella #civiltàallosbando #immgrazione#nordafricani  #clandestini #salvini,1
"MA UNA GRAN SCARICA DI CALCI NEI COGLIONI A LUI E FAMIGLIA NO !? 500 Tony, il rapper rom di 9 anni che insulta l'Italia: http",1
-L'infame day. Niente «carta famiglia» per gli immigrati poveri. Passa un emendamento alla legge di bilancio che prevede sconti solo per gli italiani e i cittadini Ue con almeno tre figli. E no all’aumento dei fondi per gli orfani dei femminicidi.- E l'assuefazione @user http,0
"@user I migranti senza QUARANTENA portono e porteranno MALATTIE!E noi cosa facciamo....vacciniamo a iosa i nostri bambini , creando  problemi a loro in un futuro  e INGRASSANDO le casse dei PIDIOTI da parte delle case farmaceutiche!😡😡😡",1
"@user @user Ora che sai che i migranti sono più soggetti a malattie mentali perché insisti ad aiutarli a migrare, forse ci guadagni ? Cosa te lo fa fare.",1
Strage #europea taciuta e #immigrazione di malattie non volute tra cui tanti con la scabbia ed alcuni casi di #aids  http,1
"@user Non c'è niente di male a comportarsi così.Lo si fa per gli italiani. Siamo vicini a Natale, il periodo per tirare fuori il meglio di noi... e se poi gli stranieri ci avessero rubato la festa o impedito di essere più umani, di volersi bene eccetera? Meglio sgombrarli, no?-.-",0
"@user Poveri noi davvero! In Italia lascerei solo Clandestini e rom,Italiani onesti....viaaaaaa tutti! Sarei curiosa di vedere",0
Sulle iene Italia 1 casa occupata dai rom e nessuno se ne importa nulla neanche le istituzioni povera Italia,0
"Blitz della Municipale, sgomberato campo rom nei pressi dello stadio http #Bari #Notizie #News",0
"Marsiglia: terrorista islamico è Algerino, ha sgozzato 2 ragazzine http",0
"Si riaccende il dibattito su sicurezza e immigrazione, dopo l’omicidio di piazzale Loreto a Milano.  @user ore… http",0
Un terrorista pedinato http,0
"@user @user ripeto ancora veri profughi non hanno risorse per il viaggio, da noi arriva là classe media",0
@user @user @user @user Gli immigrati vengono proprio grazie alla Francia e al franco africano peggato euro,0
“Le aziende facciano liste dei lavoratori stranieri”. Polemica per la proposta della ministra britannica  http,0
"Tanto a #Roma ci pensano i #rom a svuotare i cassonetti, giusto #Virginia?... http",0
"Roma, Raggi annulla gli sgomberi dei campi rom: “Anche gli zingari hanno diritto alla casa” http via @user",0
"Quanti sono i detenuti in Italia fra i ""migranti"" ? Non si sa .ma io so che in Francia sono il 70% . chi mi smentisce ?",0
"Basta sovvenzionare alberghi che ospitano ""profughi"".  Gli hotel ospitino turisti, non migranti  a carico nostro. Accoglienza...i neri fuori da bar e alimentari a elemosinare! Porci chi li ha fatti venire per farli e farci soffrire @user #stopinvasione",1
@user PAGLIACCIO SONO 40ANNI CHE SME E UE DELLA PIU CIVILE PERCHE PRESUNTUOSAMENTE SOCIALISTA CHE GLI OCCHI SONO CHIUSI E MICA SOLO QUELLI GIA I CORDONI DEL BORSELLINO DA CUI ESCE ELEMOSINA INDEGNA E DIRETTA AD INGRASSARE I GOVERNI AFRICANI CORROTI LEI MAI AVRÀ PULITZER IDIOTISSIMO,0
"@user Guai a descrivere e specificare però quali ""persone"" erano e il stato sociale, eh?  #CLANDESTINI africani finti profughi parassiti del cazzo! #skyfoPD24 🖕🏿👎🏿 #DesireeMariottini",1
Ma per attaccare la #Libia dobbiamo chiedere il permesso alla #Germania?e l'#ISIS  intanto si diverte a mandare i terroristi in #Italia...,1
"@user Tutto il resto è fuffa, il dato è che degli immigrati, magari foraggiati con le nostre tasse, senza contribuire alla vita del paese ospitante, fanno i loro sporchi http mai fossero giunti, mai avrebbero fatto delitti",1
@user gliel'hai detto a sta gente che come candidato ti porti un amico di Renzi ? poveri ignoranti che ti votano per gli immigrati mentre non ne stai mandando via uno,0
"@user @user ecco ora tutto chiaro...Europa unita dal canto,dal calcio,dalle gite pseudo culturali,e da tempo dal terrorismo👌",0
"#Desirée, il buco #NERO dove precipita lo #Stato.  Nero come i MUSI degli #STUPRATORI ASSASSINI, lupi senza pietà e umanità. #Migranti a cui abbiamo dato #ASILO, pasti e alloggi gratis. E stuprano a gogò. Come #Pamela, #Rimini, e ancora, ancora.. BASTARDI! http",1
Quella questura  di periferia tra roghi di rifiuti e campi nomadi http http #Italia,0
"Fate girare... Ipocrisia pura! Io invece dico NO! A CASA MIA NON OSPITEREI UN MIGRANTE. E per chi è già pronto a darmi della razzista, sappia che non ospiterei manco 3/4 dei miei PARENTI. #migranti http",1
"Spero Infatti che i politici a bordo si siano equipaggiati di smalto rosso. Dovessero fare “salvare” migranti in ipotermia cosa userebbero altrimenti per “rasserenarli”. Comunque le acque internazionali sono la zona SAR libica, genia! http",0
"Cortocircuito:  Tutti i lapidatori di donne con Sharia sono Mussulmani, Il PD e i sinistri vogliono i Mussulmani in Italia...  I movimenti femministi sono progressisti e di sinistra, ergo sono in corto circuito con causa effetti.. disastro http",0
@user I rom urlano per fare scena quando colti sul fatto. I ladri nei super devono essere chiusi in un ufficio ma tu che ne sai,0
Fanno degli scambi con i documenti...#quartogrado tra Ucraini e Rumeni..🙈🙈,0
"Grazie alle Forze dell’Ordine e massimo disprezzo per i VIGLIACCHI che se la prendono con i nostri nonni.  Ora mi auguro che questi quattro Rom si facciano un bel po’ di galera, senza sconti. Per loro la pacchia è finita!  http",1
@user FORSE NON HANNO ANCORA CAPITO I PDJOTI CHE SONO LORO LA CAUSA DI TUTTA LA PROSTITUZIONE DI COLORE SPACCIATORI DI COLORE ASSASSINI DI COLORE falsi PROFUGHI DI COLORE AMBULANTI ABUSIVI DI COLORE E POI NOI ITALIANI SIAMO RAZZISTI. VERGOGNATEVI BASTA FUORI DAI CO,1
All'estero siamo simpatici perché gesticoliamo molto ma gli stranieri non sanno che li usiamo per mandarli a fanculo senza farci capire,1
@user @user @user Non tutti gli islamici sono terroristi ma tutti i terroristi sono islamici,1
La vittima risulta residente nel quartiere Germaneto del capoluogo ed e' un esponente della comunità rom già noto... http,0
#rom in action furto sventato!!!! stazione termini Roma..fuori controllo da anni..le risorse protette dall #ONU spingono un soldato italiano in servizio..chi sono i razzisti?cos'è di tutti giorni....ormai da non far caso... http,1
Ecco perché l’Italia paga il pregiudizio dei gestori stranieri http http,0
"“Non è un atto di guerra contro i migranti “ Caro Gino .,.. Ma possiamo essere liberi di dire basta a questo flusso di disperati che hanno preso il ma Paese come discarica dell’AFRICA‼️Possiamo decidere chi è quando una persona può entrare o no nel ma Paese⁉️BASTA .....",1
"Immagino che ebrei, neri, rom, sinti, ecc. nei campi di concentramento sorridessero tutti i giorni. Anche il popolo italiano a cui Il Duce ha sottratto con la forza l’oro e la libertà di parola, stampa, politica, e pensiero.   Hanno riso, non sorriso, quelli a Piazzale Loreto. http",0
"@user #grazieMattarellaGrazie per il continuo impegno europeista a favore dell'#integrazione dell'#islam in #Italia.Più delinquenza, più barbarie, più povertà e malattie per tutti noi.Grazie ancora #Presidente.",1
PERSEGUITANO I #COMMERCIANTI E LASCIANO STARE GLI ABUSIVI STRANIERI Il #Pd a #Milano decide nuovi cavilli per tartassare i commercianti italiani e fa finta di non vedere le decine di venditori abusivi di merce contraffatta e non solo che stazionano intorno. SEMPLICEMENTE ASSURDO! http,1
"@user @user @user  E sono diventati musulmani??? Se è così...beh, qualcuno bara...e chi è?? Roma, Città del Vaticano?😳😳😉",0
@user @user @user @user esiste relazione che mostri rapporto tra spese su lotta a mafia nigeriana potenziamento centri impiego politiche di sostegno ai giovani emigranti e coperture dei vuoti lasciati dai potenziali pensionabili nei 5 anni governo?,0
#lariachetira anche l'ambasciatore è venduto alla cricca mondialista che vuole distruggere i popoli europei sostituendoli con gli immigrati,0
"Roma, agguato a bus Cotral nel pressi del campo rom: finestrini distrutti a sassate http @user",0
"Uno libero, l'altro ai domiciliari: condannati per furto i nomadi che scipparono Zhang Yao, morta sotto un treno a… http",0
Il rom che derubò Ermes dà fuoco alla roulotte per ottenere una casa http #news,0
"@user Dall’attacco alla Libia per i loro puri interessi economici, ai migranti lasciati sugli scogli a Ventimiglia, agli sconfinamenti di Bardonecchia, non dovrebbe essere l’Italia a protestare formalmente in sede EU ? Altro che ambasciatori richiamati...",0
Migranti e rom tra accoglienza e discriminazione: il 10 marzo convegno al Mamiani di Roma http http,0
"Stefano Allievi: ""E' possibile regolamentare le migrazioni spingendo verso una immigrazione legale, cercando di diminuire drasticamente, quella illegale e non regolamentata. Per minimizzare i costi sia per i migranti che per le società d’accoglienza"" >> http http",0
"La Sicilia spacca, è il paese straniero più vicino all'Italia http http",0
@user @user @user #vaccino antitetanico per tutti visto i continui sbarchi di profughi #infetti,1
"Lo dice Sartori: ""Integrare gli islamici è un'illusione della sinistra. Il multiculturalismo non esiste"" |... http",1
"GLI IMMIGRATI CI PORTANO CUL-tura E MODI DI VIVERE CHE PRESTO SARANNO I NOSTRI(cit.). IO NON VOGLIO NE' LA LORO CUL-tura, NE' I LORO MODI DI VIVERE. NON NE VALE PROPRIO LA PENA. #IoStoConSalvini #SalviniNonMollare #STOPINVASIONE http",1
@user @user e molti arriveranno in Italia quale 1° punto di approdo.Cornuti e mazziati. Basta #Renzi #alfano stop #immigrazione,1
"@user per cortesia non parliamo piu' dei migranti il solo motto e'""vietato entrare in italia e quelli che ci stanno riportateli immediatamente alle loro case insieme agli italiani che li vogliono.Forza tanta a Salvini ns difensore.",1
@user @user @user @user @user @user @user @user @user quante navi della marina,0
Ma pensa te! I ladri rampicanti sono rom quelli che portano cultura!! #Roma http,0
Poliziotto spara a un nomade in fuga dopo un furto: il pm gli chiede un risarcimento di un milione di euro http,0
@user nazismo e comunismo due ideologie malate della storia io guardo al futuro dell'Italia pulita e senza rom ne clandestini.,1
Ieri un Somalo con un punteruolo alla staz di Porta Nuova. Oggi questo.Con una Katana (spada dei Samurai) ha seminato il panico a Milano.Durante l'arresto ha estratto un ulteriore COLTELLO. E' certamente lo stress da migrazione..Che affligge questi TERRORISTI!  @user http,0
"L'Italia, al di là del ministro dell’interno che si ritrova , si dimostri all'altezza del suo ruolo internazionale e soccorra i naufraghi che stanno arrivando a #Lampedusa sulla #SeaEye, rispettando cosi' le convenzioni internazionali. #migranti #SavingHumans http",0
