text,label
Noi Italiani abbiamo il Diritto di vivere sereni in casa nostra.  Stop immigrati  #StaseraItalia http,1
"abbiamo cominciato a chiamare le prigioni per migranti in Libia ""centri d'accoglienza"". Per la legge libica #ijf19",0
Hanno dovuto trattate con i rom per recuperare la refurtiva in presenza della polizia!!?? AGGHIACCIANTE ����#quintacolonna,0
"@user Fermati #IMMIGRATI clandestini. Lo stupro di gruppo con omicidio è un intollerabile scempio contro le donne tipico di sporchi sacchi NERI e loro inferiorità razziale. DELINQUENTI morali Dem, Vaticano, #FakeMedia con loro parole immigrazioniste. Chi nega #razzismo muore. #Desirée",1
"@user Amatrice, gennaio 2019. Rai1 immigrati Rai2 immigrati Rai3 immigrati Rete4 immigrati Canale5 immigrati La7,che te lo dicoa fare!!!! A nome del 90% degli italiani: AVETE ROTTO IL CAZZO !!!! http",1
"Da notare i ""segni delle terribili torture"" subite dai migranti nei centri di detenzione governativi libici. La retorica delle anime belle smontata a colpi di verità. http",0
"Morte della giovane Fabrizia nella strage di Berlino, De Mucci (FI BAT): “l’ennesima vittima del terrorismo,... http",0
"@user Molti ancora non vedono, eh, vedi che poi quando attraversano un parco, se popolato da immigrati, si tengono stretta la borsa.",1
@user @user fate qualcosa per aiutare concretamente gli italiani anziché attivarvi soltanto per corridoi umanitari pro africani. Siete al governo da poco ma pure voi subito pronti sempre e solo per gli immigrati.,0
"Favoreggiamento ai migranti: arrestato il sindaco di Riace Mimmo Lucano Mimmo Lucano è finito in manette nell'operazione ""Xenia"" della Guardia di Finanza. È il paladino dell'accoglienza negri e monnezza i guadagni di questa latrina @user http",1
"@user Le stazioni sono il biglietto da visita di ogni città. Chi scende in una stazione non può trovare lo schifo che c è oggi di barboni drogati, questuanti e rom che stanno sempre a disturbare chiunque abbia a passarci accanto a distanza di un metro.. dire.#puliamo",1
"#Ohio #Abdul: ""Siete rassisti e islamofobi, Islam è religione di pace"" e 3 mesi dopo voleva la strage Ecce Islam http",1
"Signore, hanno tutti diritto a una vita dignitosa, ma mettete un migrante sulla mia strada e io sarò Salvini.  (Matteo 15, 83)",1
"@user @user Neppure ladri,stupratori,squartatori,delinquenti,soprattutto se si fingono immigrati mentre invece sono clandestini che vengono a casa mia a delinquere!!!!",1
"#dimartedi Stasera indlttrinamento pro Europa.Alla bisogna sono benvenuti anche gli stranieri.Bravo #Floris,vai a cager",0
Sono luridi schifosi vermi....spero diventino loro profughi in Africa,0
@user e grazie ai giudici li rilasceranno pagando loro il rientro a casa loro il biglietto del rientro in prima classe.e intanto i migranti arrivano e bla bla.lei parla bene come renzi.saluto,1
"Check out this article: La Francia controlla, deruba e impoverisce 14 Stati africani - http",0
"Nel frattempo ""ammazzano"" i figli dell'Italia con disoccupazione, deflazione e immigrazione di massa PD, Partito de… http",1
"Sassaiola al campo rom per impedire l'arresto del parente, 4 poliziotti feriti e nomade in fuga | Ripuliamo l'Italia http",1
"tutto st'affanno sul web poi mannaggia la madonna al massimo grandi marce e paura di perdere gli appalti per le vostre cooperative che gestiscono migranti. davero porco dio, qualcuno alzi la mano per dire ""i famosi 35 euro sono parte del mio stipendio"", alzate la mano, forza.",0
"Aumento casi morbillo?Ok.Siamo certi che gli immigrati,che raggiungono il nostro paese sono tutti vaccinati e non malati?Colpa dei  vaccini?",1
@user Avanti tutta! Questi immigrati continuano a prenderci solo per il culo!!! Finita la pacchia!!!,1
"Facciamo partecipare i ""leader rom"" anche al prossimo G8. http",0
"86,8% delle persone migranti che sono arrivate in Italia lavorano e si sono integrate hanno paura che nei nuovi arrivi ci siano persone pericolose. Ecco perché il #pd non ha mai capito nulla anche se #martina 😂 dice il contrario. 🙄 da leggere http",0
"Cinese morta a Roma, fermato un ventenne: è un nomade del campo di via Salviati http #Cronaca #Notizia #News",0
Scarso e confuso l'impegno della nuova amministrazione capitolina per il superamento del “sistema campi”… #rom http,0
"La favola Bouasse, da migrante a calciatore della Roma http",0
"#roma, spada da samurai, topi morti, rifiuti: blitz in #campo nomadi, 10 denunce. Seq... http http",0
Chissà se al 2020 ci arriva anche l'ambasciatore dell'Unione Africana a Bruxelles ?,0
Ma sti caxxi di #rom ma . . . @user sempre con sta scusa della #discriminazione ma #calcinculo !!!!!!!! http,1
"Da circa 5 anni ogni giorno sentiamo parlare di emergenza migranti. Media, politica, un bombardamento quotidiano che volente o nolente è entrato nelle nostre vite. Nel frattempo l'Italia frana, non in maniera metaforica, ma i Governi son troppo occupati a parlare di sicurezza.",0
Corriere: Anac invia atti alla Corte dei Conti  sulla gestione scuola nei campi rom http #roma rt notizie_roma,0
@user @user @user Questi sono i profughi che noi dobbiamo non solo MANTENERE dopo che rubano stuprano uccidono spacciano droga adesso vogliono uccidere il nostro Salvini 🤢🤢👿👿Adesso Salvini i prossimi chi sono????🤕🤕😨😨😨,1
"Gli europei ci vogliono derubare, i migranti ci vogliono invadere, la finanza ci vuole distruggere... Delle due l’una; o facciamo schifo al mondo o  abbiamo qualche leggero disturbo... http",0
#paolodeldebbio stasera sei un mito #ghettorom #camponomadi #roma,0
"Conte: “Con Juncker parlo solo io. Per le riforme serve tempo”. E sui migranti incalza: “Global Compact? Se passasse il no, ci rimarrei male”. @user di bene in meglio...",0
"Mandate un po di rom nella redazione di #repubblica a rubare i portafogli.Li saranno sicuramente protetti, anzi gli verranno consegnati spontaneamente. #sappiatelo http",0
#Immigrazione: @user dal ministro dell'interno Salvini. Le richieste: ripartizione equa anche dei migranti che non arrivano via mare; iter unico a livello europeo per la valutazione delle richieste d'asilo; procedure certe per i rimpatri di chi non ha diritto. http,0
"@user @user In uno stato democratico come il nostro, non si dovrebbe far entrare la religione, visto che il potere Africano, è islamizzato, non si dovrebbe farlo entrare, perchè sappiamo bene cosa porta l'islam, solo che morte e sopraffazione, imposizione di norme antidemocratiche.",1
"Calais, 100 minori stranieri soli irreperibili dopo la prima registrazione http",0
"Corriere: Porta Portese est, sequestrati cuccioli in vendita: indagini nel campo rom http #roma",0
"Cari rom, trovatevi un lavoro e una casa come cercano di fare milioni di italiani. Non fate i mantenuti !  #piazzapulita",0
"#Treviso si scopre islamica-rom, 12 enne partorisce e lascia la scuola dell'obbligo. 13 enne incinta da rom http",0
"@user @user Basi delle migrazioni sono sempre stesse: economiche o politiche  Finalmente hai detto quello che hai sul cuore ""I migranti prendeteli voi"" E il grido del'Italia che disprezza l'altro e che scorda che il suo popolo é presente su tutti i continenti qualche sia la cultura la lingua",0
@user @user Dovrebbero sterilizzarlo tutti i rom,1
La Spagna apre i porti a Open Arms:accoglierà 300 profughi http Importante che @user o @user o @user o chiunque di loro sappia che in Italia noi #chiudiamoiporti per ordine di @user che porta avanti i voleri del popolo italiano,0
#rassegnabalcanica è morta #esmaredzepova la stella della musica #rom http  #Balcani #gipsymusic #music,0
La #Pirelli è cinese e gli italiani sono sempre più stranieri in #Italia Ora si capisce perché vengono prima extracomunitari,1
"@user Classico dei muslims,non si può convivere con l'islam,ogni islamico: donna,uomo o bambino è un potenziale pericolo,c'è un jihadista in ogni islamico.Non esiste islam moderato,islam è depravazione,pedofilia legalizzata,violenza psicofisica su donne.Stiano nei loro habitat naturali",1
"Lucia ho trovato la spigazione alla valigetta : ..........,la maggior parte arabi e stranieri in genere che penso avessero il compito di disturbare e nulla più,cancellato parecchi LUCCHETTI che non ti permettono di leggere i loro Tweet o vedere chi seguono.",0
"COMUNISTI, RADICAL CHIC, FANCAZZISTI E SOSTENITORI DEL BUSINESS DELL'ACCOGLIENZA IN PIAZZAPagliacci vari, centri sociali, operatori dell'accoglienza, Anpi, Arci. Tutti a #Milano a difendere l'immigrazione a tutti i costi e a chiedere PIU' #CLANDESTINI IN ITALIA. VERGOGNOSI! http",0
@user @user @user SONO PROPRIO TUTTI SCEMI! LA PAGHERANNO CARA.Alla fine che si tengano i loro amati terroristi.,1
Gentiloni: no a Ue rigida su conti e flessibile su migranti - Reuters Italia http #notizie http,0
"Che se rinasci in questa Italia europeizzata sei fottuto, in coda a immigrati sempre, cominciando dall'asilo⛔️ poi la casa⛔️ poi il lavoro⛔️",1
@user quando farete pulizia tra preti africani e non dediti al business dell’immigrazione o pedofilia o propaganda gay?In chiesa vogliamo sentire parola di Cristo non la pubblicità agli africani clandestini i cui crimini non nominate mai!Basta politica in chiesa.,1
@user ma te le ricordi le foto della piddina con gli immigrati che facevano finta di spalare le macerie?,0
Tutto questo can can a pochi giorni dalle elezioni che potrebbero sancire la vittoria dell'antislamista Wilders puz… http,0
"Io ve lo dico. Fate tutta sta cagnara sulle persone migranti, sulle femministe, sui gay, sugli zingari. Intanto i vostri figli stanno crescendo in classi multietniche. Sono 10 volte più intelligenti di voi razzisti, e prima o poi verranno loro al vostro posto. Non vedo l'ora!",0
"@user Difendi l’Italia invece di aiutare, come al solito, gli stranieri ad insultarla e a tenerla sottomessa ai loro interessi.",0
"#Dirittoerovescio I rom hanno diritto all'accoglienza. E noi non abbiamo diritti? Diritto alla sicurezza, per esempio? Dite a quel signore di prenderseli a casa sua.",1
Scusate ma sta paladina del piffero secondo cui ai rom tutto dev'essere permesso non se ne scende manco con un TIR di Maalox. #biancoenero,0
"..e i laici contro islamici e cristiani,ovviamente.Anche la laicita' è una filosofia di vita. http",0
"Questo vale come avvertimento per i #GAY #LESBICHE nostrane? Se attecchisce l' #islam, presto o tardi verranno massacrati! Islam PACE E AMORE un cazzo! 😡 #sinistrati #PDioti  Unica vostra speranza è #Salvini. Poi se volete continuare a seguire #Arci, fate voi! http",1
"#rom #Lidl #Follonica  Suvvia ... così fan tutti! Un sottilissimo filo che separa una ""goliardata"" dal #razzismo  #biancoenero",0
"#Roma, due bambini #rom nel suo campo: pastore prima spara poi li bastona http http",0
"A me fanno ridere un sacco di cose strane, ma quelle due bestie della Lidl che rinchiudono due rom nella ""cella rifiuti"" mi fanno ribrezzo",0
Poliziotto condannato a risarcire 60mila euro ad un rom che cercò di ucciderlo  Ancora una volta la vittima... http,0
"Un ministro dei trasporti che liquida la ultradecennale questione TAV con un ""Chi se ne frega di andare a Lione"", mi ricorda tanto un ministro dell'Interno che liquida la ultradecennale questione dei migranti con ""Chiudiamo i porti, la pacchia è finita"". La pochezza, il vuoto.",0
"Vabe dai, non ti preoccupare passa tutto. Consiglio acqua e zucchero, forse è una carenza di energia #rom #LeIene http",0
"Mafia Roma: appalti campi nomadi, in 13 rinviati a giudizio http",0
"Il terrorismo non è un nemico che si sconfigge con i bombardamenti. Dopo Bush, lo dovrebbe aver capito anche Putin. O no?",0
@user metterei anche a te insieme ai rom,0
@user sanno solo dare dei fascisti...non si rendono conto che è. Un grave problema.. Gli immigrati sono quasi tutti delinquenti,1
"Avete sentito bene?Siamo noi, a trasmettere malattie agli immigrati! Tbc, scabbia...Loro arrivano senza documenti, ma con libretto vaccinale in regola.Qualcuno fa le analisi ad uno per uno per verificare gli anticorpi creati dai vaccini.Oh! Guardate l'elefante rosa che vola! http",0
"Quelli che davanti alle stragi terroristiche ""condanniamo la violenza in ogni sua forma"" A posto. #jesuisCharlie http",0
"#Salvini con aria minacciosa: dopo gli immigrati ci dedicheremo anche a quei deficienti dei centri sociali !  Che intenzione ha, di sterminarli?   #portaaporta",0
"Una attivista di #alterego grida “Sciacallo”a #Salvini all’ex #penicillina.""Lo #sgombero farà sì che i #migranti andrannoAdelinquere""... comeSeTutto il giornoRimangono li dentro a fare il rosario😁😆Loro che li si andati a prendere e noi dovremmo tollerareZoneFrancheDi degrado? http",1
"I rom saranno pure l'etnia più meschina, ladra, bugiarda del globo, ma NON GIUSTIFICA QUESTO. Manco allo zoo dai, a… http",0
"Il terrorista di Londra si chiama Khalid Masood Cittadino britannico, 52 anni, già noto agli 007 http",0
"Roma, nascerà un nuovo campo rom - IlGiornale.it http via @user",0
Abbiamo visto arrivare gli aerei con i profughi veri... ma non abbiamo ancora visto partire gli aerei con i profughi falsi. #StopInvasione,1
"@user -in particolare i seguaci di salvini, ne conosco molti e sono tutti favorevoli per mandare via gli immigrati, non mi piace-",0
Nel Lazio (e in particolare a Roma) vivono ben 5721 rom nelle 20 baraccopoli formali http,0
#dallavostraparte non è Marcato il pazzo sono la rappresentante rom e l'assessora di Milano che sono fuori di tes… http,0
#Immigrazione sono stati gettati in mare immigrati perché Cristiani. Stiamo salvando i nostri carnefici? Pensiamoci bene!,1
@user @user bella domanda . Politica parla di islam moderato che non esiste . Musulmani andrebbero deportato tutti,1
"E' stato ucciso,era ampiamente previsto.Killer musulmano,fotocopia del terrorista standard. Luogo e città simbolici, origini, età e trascorsi come da copione. Perfetto per credere ad una vendetta islamica. Perfetto per chiedere solidarietà alla UE.INVECE NO.#GiletsJaunes avanti! http",0
"Il Giornale - Torino, rom fondano Consulta per i diritti: Tutti contro di noi http",0
@user esatto.... sono come e peggio del pd....tutti pro clandestini rom iussoli e stranieri criminali e mai con italiani,1
BISOGNA OBBLIGARE I MIGRANTI A LAVORARE QUALUNQUE LAVORO MA DEVONO LAVORARE ALTRIMENTI NON PENSERANNO AD ALTRO CHE STUPRARE SE SONO UOMINI E PROSTITUIRSI SE SONO DONNE,1
@user @user @user duce voleva islamici a casa loro. Cmq nn esistevano Muslim in Italia,1
Emergenza cacca di profughi a Ventimiglia: 9 mila euro per raccoglierla http,0
"Inclusione dei rom, nel Municipio XI regna lo scetticismo. Garipoli: “Le case prima agli i... #roma | Tramite: http",0
E mo' che raccontate? #Riace #MimmoLucano #RobertoSaviano #immigrazioneclandestina #migranti #rifiuti  http,0
"@user Se accadesse un evento simile a Charlie Hebdo, in Italia, sareste unici responsab perché complici dell'immigrazione selvaggia!",1
Venticinque migranti trovati morti su un gommone al largo della Libia. (Internazionale) http,0
Il banco di prova della #democrazia sta nell'indifferenza o partecipazione dei cittadini. La storia si ripete #immigrationban #Trump,0
"@user @user @user Ma siamo sicuri che c'è l'Islam dietro questi balordi? Io comincio a pensare a qualche servizio segreto che si nasconde dietro una maschera di integralismo religioso, mandando al massacro soggetti disagiati o foraggiando di soldi i cosiddetti soldati. Il disegno è più complesso.",0
"@user Oh!!! Tutti uomini, giovani e belli pasciuti! Ma che  idioti gli italiani che parlano di immigrati e profughi! CLANDESTINI sono!",1
@user Questi immigrati sono il futuro per l'Italia!!!   Bella roba.......,1
E quando viene buttato in strada il cibo che non va bene ai migranti? Chi non deve dormire? http,0
#Natale ci sono già i soliti buonisti che vogliono cancellare le nostre tradizioni per piegarsi agli immigrati... http,1
@user secondo la sinistra non si può dire: - zingaro - rom - sinti - magrebino - tunisino - nordafricano - ladro - stupratore - clandestino - immigrato clandestino - nullafacente - occupante abusivo - spacciatore PERO' A NOI NON CE NE FREGA UN CAZZO E LO DICIAMO LO STESSO !!!!,1
@user Tu e il tuo partito l’Italia l’hai lasciata piena di disoccupati hai impoverito tanti cittadini italiani e ci hai riempito solo di immigrati da mantenere e hai aggiunto altri delinquenti!,1
Finisce la bella vita dei rom: via auto e beni di lusso per 300mila euro http,0
"Voglio essere franca, gli africani che arrivano in Italia chiamati #profughi sanno benissimo che non avranno un lavoro onesto ma la possibilità di guadagnare soldi lavorando in nero o addirittura presso le organizzazioni criminali.Non sono sprovveduti ma soltanto bugiardi",1
"Napoli, uomo preso a martellate in testa da immigrato | Tutti i Crimini degli Immigrati http",0
Identificato l'autore della rapina all'anziano di Annone Veneto: è un giovane nomade http #venezia,0
"#Bergoglio: “Non dobbiamo avere paura dei migranti. I migranti siamo noi,Gesù è stato migrante. Qualcuno potrebbe dire che sono delinquenti. Ma anche noi ne abbiamo tanti. La mafia non è stata inventata dai nigeriani, La mafia è, diciamo, un ""valore"" nazionale. È nostra,italiana” http",0
"Che paese è quello che accusa di terrorismo chi va a combattere l'Isis? Che sinistra è quella che non parla e accetta tutto questo? Da che parte stiamo allora? @user  da sarda, italiana, antifascista, voglio una risposta! #vogliounarisposta  http",0
"@user e una vergogna x l'Italia vedere queste cose, cosa cazzo guarda il governo, i migranti?ma aiuta il tuo popolo.",1
#news Miccichè attacca Salvini: “Lui leader? Vi avrei invitati sulla Diciotti a vedere le condizioni dei migranti” di Giornale di Sicilia http http,0
"@user @user @user Mi dia un motivo del perchè sia un grande, si batte solo per immigrati, lo sanno tutti il problema",0
Combattere i miscredenti: terrorista marocchino ora vuol tornare in Italia http,0
"Siccome non devo star simpatico a nessuno, se gli islamici devono far vittime, meglio siano quelli che vanno a dire che l'Europa è bella, l'islam è una religione di pace e invitano in Italia i criminali africani. Solidarietà un cazzo, godetevi le 72 vergini al più presto,  tutti.",1
"@user Ma non avete capito che, a questi, degli immigrati non frega nulla ? Importa solo dare lavoro ai soliti noti con l’industria dell’accoglienza ed ammassare gente senza radici per avere manodopera a basso prezzo e senza pretese.",0
L'ho scritto in bio. Amo le montagne . Ed ho visto le mie montagne distrutte. Devastazione ovunque. Faccio fatica a non piangere. Spero che l'Italia si concentri su se stessa e la pianti di parlare di migranti. E'un insulto al Paese. 😭😭😭😭,0
"Disagiati, migranti e disoccupati: ""Chi li impiegherà vincerà gli appalti"" | Rep Chi ha i requisiti deve vincere gli appalti. e magari avere incentivi se impiega queste categorie. http @user",0
"“L'Italia deve rimpatriare gli immigrati irregolari, altrimenti sanzioni Ue”: Anche se i flussi di migranti in… http",0
"Bergoglio giustifica la sua politica di lecca babbucce e di accoglienza ad oltranza come missione di pace con l'Islam. Ah, per questo la strage di cristiani nel mondo non si ferma; la sottomissione papale autorizza le bestie islamiche a sterminare i cristiani! Sveglia Bergoglio!",1
"I carabinieri hanno individuato come possibile spacciatore un 27enne del Marocco. La tipica #risorsa straniera, ammiro la madre!  http",1
"Non meno sgradevole sulle ONG. Falso. Unico ""business"" #migranti finora emerso riguarda la scena di 'terra' per alcune 'cooperative' d'accoglienza.  Ad oggi le sentenze (anche in giudicato) hanno solo scagionato e assolto le ONG di 'mare' da improvvide accuse: Palermo e Ragusa. http",0
@user i mussulmani pensano che tutti gli altri popoli siano siano odiati da dio e che sono importanti solo loro come persone!,1
Manifesti funebri per migranti I buonisti ora usano la morte -  #Manifesti #funebri #migranti  http,0
Ma nessuno si domanda Ma I rom in questione chi sono realmente Hanno un lavoro Mandano I figli a scuola Di cosa vivono. Perché non si indaga E poi ne riparliamo. http,0
"@user   I soliti immigrati che o rubano o diversamente delinquono,ma per i nostri governanti va bene così'.",1
"Donne straniere, essere mamma è un rischio - Mancato accesso alle terapie e alla diagnosi. Difficoltà linguisti... http",0
Oggi si è scritta una giornata di violenza dove l'islam mostra la sua vera faccia Quante altre vittime dovremo ancora piangere? SVEGLIATEVI,1
"Io non ci dormo su questo problema dei migranti.O ci svegliamo sul nostro futuro,o prima o poi ritorneremo migranti tutti.Poi capiremo.",0
@user  Ho sempre ragione amica mia.A presto e lascia perdere la citta' dei Polentoni immigrati meridionali.Roma impera,1
"Ci sono gli estremisti religiosi, i terroristi, i razzisti e tutti hanno in comune solo una cosa: infilatevi una gran mano in culo",1
"In tre mesi abbiamo mostrato che gli sbarchi si potevano fermare, con il Decreto sull’immigrazione voglio dimostrare che anche la gestione dell'accoglienza e dei rimpatri si può e si deve cambiare. http",0
"Dalla Grecia all'Italia in una cella frigorifera, scoperto carico con quattro stranieri. Le immagini... #news #Bari http",0
@user porti aperti per tutti ..più migranti che entrano ...età pensionabile assurda e per finire niente reddito di cittadinanza per i meno abbienti ...sono questi i motivi per cui andate in piazza ? Vergognatevi,0
"Stefano Saletti, leader della Banda Ikona, misicista e compositore che suona molti strumenti etnici dell'area mediterranea. Da un album, ""Soundcity"", che mette in musica i drammi dei migranti, la ricchezza, le speranze, il dolore di... http",0
"VoxNews: Roma: nasce nuovo villaggio per Rom, costo oltre 1.270.000 euro: L’insediamento per soli rom – per… http",0
"Due arresti tra i rom, risolto il ""mistero"" della ragazza cinese http",0
@user @user @user @user @user @user @user @user @user @user @user Questione di punti di vista: per qualcuno è  criminale  lasciare in mare i migranti per qualcun altro raccoglierli e farli diventare materiale da ingrasso per cooperative che al massimo sanno accogliere i contributi europei.,0
"@user Importano barconi di #immigrati da paesi in cui la #tubercolosi è  endemica,   poi l'untore è  la #Maestra : ma che vadano tutti a ramengo !  Maledetti bugiardi",1
@user Corano ed Islam  religione di pace e tolleranza. Primitivi,0
Roma – Trovata morta la giovane cinese vicino la ferrovia adiacente il campo nomadi di via salviati http,0
Quindi state uscendo di senno per uno che disegna vestiti da rom che rubano il rame. Bene ma non benissimo,0
La gente pensa che Conte e Salvini sui migranti litighino sul serio... ahahahahahahaha 😂😂😂😂😂😂 ITALIETTA!! 😂😂😂😂🤦🤦🤦🤦🤦 Ma non la riconoscete la farsa in corso? Davvero non la comprendete? 😂😂😂🤦,0
"Il Decreto #Minniti su #immigrazione non può diventare legge. Domani a piazza Montecitorio #Roma,facciamoci sentire! http",0
@user #LONDRA #Westminster per quanto tempo dobbiamo sopportare di morire prima di cacciare a calci in cu:o i musulmani?,1
Il Governo danese confinerà su un'isola clandestini e delinquenti stranieriSiete d'accordo?,1
"@user @user @user @user @user @user @user @user @user @user @user @user @user @user @user @user @user 3. Questi sono i versi dei testi sacri dell'Islam che i musulmani applicano quando devono sterminare gli ebrei (e i cristiani), a partire dal 627 quando lo stesso Profeta Maometto decapitò personalmente tutti gli ebrei di Medina. Milosevic quali versi del Vangelo ha applicato? 🤔 http",1
"@user @user @user La grande differenza dei nostri antenati immigrati per lavoro, umili, onesti e grandi lavoratori. con i parassiti africani che oggi clandestinamente arrivano e vogliono essere mantenuti vita natural durante da noi Italiani.",1
"Veramente uno schifo, un deficente in tv che è accusato di terrorismo, cacciateli tutti ... sarete sottomessi,lo st… http",1
Grazie al cazzo che gli imam francesi condannano l'attacco terroristico fatto a #CharlieHebdo... sennò a quest'ora li avevano già linciati.,1
"@user @user @user si è ripetutamente dichiarato pro. I suoi soni tutti pro rom, pro c.sociali /antagonisti, pro clandestini",0
Sgomberato il campo rom con quasi tutti i residenti pregiudicati: il blitz nell'accampamento di San Donato (MI) http,0
IL GLOBAL COMPACT VORREBBE L'INVASIONE MIGRATORIA EQUIPARANDO MIGRANTI ECONOMICI E PROFUGHI. PREVEDE CHE CHIUNQUE CRITICHI L'INVASIONE SIA PERSEGUITO PENALMENTE. SI PIANIFICA LA SCOMPARSA DEI POPOLI EUROPEI E LA REPRESSIONE DEL DISSENSO. ORA VEDIAMO DA CHE PARTE STA IL M5S. http,0
LA PACCHIA E' FINITA!!!  STOP AI #migranti   #ottoemezzo,1
"@user Mogherini pensa Europa islamica, Pisapia alle moschea, PD ai clandestini, agl'italiani chi pensa? Silvio pensaci tu. Amo Italia!!",1
"Migranti, a Macerata coop buoniste nei guai. Sono accusate di evasione fiscale: 40 milioni mai dichiarati e 6 milioni di euro di Iva evasa. Accuse pesanti per la Gus e il suo presidente Paolo Bernabucci, la Acsim di Daniel Chibunna (nigeriano) e la Periego di Laura Bracalini http",0
"Asia Bibi sará nuovamente processata, gli integralisti islamici vogliono che sia condannata a morte solo perchè è cristiana! nessun paese occidentale si mobilita? Tutti sottomessi all’islam o è odio per Cristo? Pure il papa tace?",1
"Matteo Salvini e il video degli immigrati a Napoli: ""È un buon ministro"" http",0
"SMS- #SinistraMafiaSionismo  Per sinistrume e #sionisti, minoranze egemoni, lo Stato è...un ""ostaggio""!  Il ricatto bau-bau?...il ""ritorno del #fascismo""... pronto un ""nuovo #olocausto ebraico""!  La #reductio ad #Hitlerum (o reductio ad nazium) - http",0
