text,label
"@user Ecco un altro prelato che parla di figli di famiglia di migranti... ma se invece ogni tanto si ricordasero di tutti i figli di preti non riconosciuti ( migliaia), dei  figli che hanno rovinato con abusi e violenze sessuali, dei disagi economici delle famiglie italiane? È troppo?",0
"@user La bella domanda è: se sono profughi, come fanno a sapere dove rivolgersi per denunciare una persona, da parte un ministro del governo italiano???? Chi li sta guidando???? Ci scommetterei una mano che proviene tutto dal pdisastro!!!!!",1
"Stupri etnici: come gli immigrati hanno ridotto Linda CI VUOLE LA PENA DI MORTE! http Prima di Pamela. Prima di Desirée. E’ stato il primo stupro etnico del genere, in Europa.",1
Su #SeaWatch il Governo ha sbloccato la situazione e ha ottenuto che l’accoglienza sia condivisa con l’Europa. I migranti che arriveranno in Italia saranno accolti a costo zero. Un grazie presidente #Conte http,0
Irruzione in casa disoccupato per minacce alla Serracchiani coccola profughi: L’ha fatto… http,0
"Le rom se stavano rovistando nei rifiuti, come tanti poveri, non sono da rinchiudere ma da aiutare. Non è furto ma povertà. Forza #Lidl",0
@user Sono peggio degli animali e poi ci sono gli stronzi che si permettono di dire che l’Islam è una religione di pace che deve essere rispettata. Io mi auguro risorga Goffredo Di Buglione. Ne abbiamo bisogno. Mi manchi caro Goffredo.,1
"Qualsiasi cosa mi va bene, ma l'islam fuori dal cazzo o è la fine",1
A Milano festa per dare il benvenuto ai profughi http Clicca sul link,0
"@user I migranti vivono in hotel, sono gli Italiani i nuovi crocifissi.!!!!!!!!",1
@user è vero ci mancherebbe altro sei un torturatore tu è il tuo amico Massou e sei anche tu un pezzo di medioevo come i nazislamisti,1
Ciao Guagliù!!!  Oggi ė la giornata dedicata ai migranti morti in mare. Il TOTEM della pace di Molinari li... http,0
"Padova, invasione di rom all'ospedale: il capofamiglia dona rene alla moglie - Blitz quotidiano http #Padova #news",0
"Era solo un ragazzo che voleva vivere, glielo abbiamo negato, grazie a Salvini e DiMaio ed al loro decreto Sicurezza.   Genova, folla ai funerali del migrante suicida: 'Non rubate a questi ragazzi il loro sogno' http via @user",0
"Perde la borsa, gliela restituiscono i migranti http @user",0
"Comunque, se ancora confondiamo la difesa dei confini e la ""illegal immigration"" con i visti turistici tanto vale parlare di gattini #Trump",0
@user A parte il fatto che con la scusa dei bambini in braccio i rom fanno le peggio cose sia sui mezzi di trasporto e nelle strade secondo me se.non siete collusi con chi ha fatto di Roma un cesso non dovete  dare appellativi come fascisti e razzisti a chi si difende.,1
"@user Si certo. Peccato che voi i diritti li davate solo agli #Immigrati:tutto gratis da qui all'eternita',liberi di delinquere e rimanere impuniti e tante altre belle cosette riservate all'invasore. Noi #italiani,con voi,di diritti ne abbiamo visti ben pochi. Siete storia passata.",1
"Perché i migranti scappano dai Centri? Hawala è la parola “magica” che spiega (quasi) tutto, di Giuseppe Morabito  http",0
"Bambini rom e scuola, una ruspa non può abbattere la nostra Costituzione http via @user",0
"Sputtanata dagli stessi migranti che hanno paura dei nuovi arrivi,è la D.I.A. Che la devasta con dati allarmanti. Il #pd non sa più cosa farneticare. Io ricordo le vittime di #amri sbarcato in🇮🇹mantenuto da noi,che fece la strage a #Berlino.🤫piddini 🤫 http",0
"Non avevamo alle spalle omuncoli che mangiavano i contributi dello Stato sulla nostra pelle, non avevamo alberghi in cui alloggiare gratuitamente perché in Italia i migranti NON PAGANO le stanze in cui risiedono ma è lo Stato che paga per loro",1
LE NOSTRE CONTRADE PAESI E CITTÀ INVASI DA TORME DI STRANIERI MALEDUCATI PREPOTENTI CJONDOLANTI.I NOSTRI RAGAZZI COSTRETTI ALL ESTERO.,1
"@user @user Dai sui atti legislativi e dalle sue dichiarazioni io direi che lei odi tutti gli immigrati, a prescindere. Sbaglio? Me lo dimostri.",0
"Sea Watch, Salvini all’Olanda: “Prenda i migranti”. Amsterdam: “Non spetta a noi”. Di Maio: “Nave ha vostra bandiera  OLANDA DICE NON SPETTA A NOI????    Qui siamo al ""MA QUESTI CHI LI CONOSCE?""  CHE ROBA FUMANO? http",0
"da uno a qualsiasi campo rom, quanto truffano le pagine Facebook che vendono orologi?",0
"Qui #Varsavia. Con i rappresentanti del governo polacco ho trovato una grandissima sintonia sui nostri temi, sull’immigrazione, sulla sicurezza, sull’idea di Europa. 🇮🇹🇵🇱 http",0
"Contro il terrorismo suicida c'è, alle volte, poco da fare. Contro chi lo rivendica, tutto #Hamas",0
"Trasferimento campo Rom, Forza Italia critica: «Più attenzione ai rom che ai cittadini» http #Barletta #News #PugliaLink",0
"@user Perchè la violenza è tutta uguale, ma il racconto della violenza non lo è: se violenta un italiano è ""un caso isolato"", se violenta un somalo è la vostra scusa per dire che tutti gli stranieri sono stupratori. Chiedilo a Salvini perchè tace sulle violenze di italiani alle donne.",0
@user  solo sulle cronache locali ogni giorno leggiamo i reati commessi da ROM SINTI e IMMIGRATI ! questi delinquenti devono marcire in carcere sequestrare i beni toglierli i bambini http,1
"@user  puoi anche attivare la vibrazione, infilartelo nel culo e andare a fare in culo insieme ai tuoi amici migranti",1
Penso che chi non vuole vedere che gli attentati terroristici sono motivati da volontà di sottomettersi tutti (islam) sia in malafede,1
"Bombardare tutti i paesi islamici uccidendo più bambini possibile, perché cresceranno e ci taglieranno la gola per salvarci è inevitabile",1
Malta: sbarcati i migranti dell'Aquarius - http - http http,0
Tutti a parlare dei rom questi giorni e per quello successo all'lidl...a me viene in mente un fatto accaduto... http,0
Il #Porrajmos in Italia http la persecuzione di #rom e #sinti  durante il #fascismo di @user http,0
BISOGNA INTERVENIRE SUBITO QUESTA DA I NUMERI STA DIVENTANDO PERICOLOSA  Kyenge: “L’Europa ha bisogno di almeno 50 milioni di immigrati” http,0
"@user Non c'erano immigrati, tranne i meridionali, pochi. Tutti parlavamo in dialetto. Niente ladri né violenza. Un altro mondo.",0
"@user E come e dove mai sarebbero basati sulla forza i rapporti fra maschio e femmina della spessa specie? Balene,delfini, leoni, conigli, cani, bovini, pecore, cavalli, mosche un continuo sbranarsi, voi non li vedete? Mussulmani da evirare assieme a chi li difende.",1
"#Heidelberg #NewOrleans e #Londra Tranquilli Non è terrorismo È solo terrore E tutti voi, non siete terrorizzati Siete solo fottuti",0
@user Nessuno vuole i Rom punto,1
"Studentessa cinese morta a Roma, fermato un terzo rom http http",0
"@user @user @user Non capisco perché c’è pietà solo per questi immigrati anziché per tanti italiani che versano in condizioni di disagio.Invece di dare una mano a tanti ragazzi italiani disoccupati,questo è razzismo!",1
"@user @user Con questa storia della ""povera gente"" state rovinando l'Italia. Ma non Vi rendete conto che la società è satura di migranti? Pensate di fare del bene, in realtà danneggiate loro e Noi. Diffondete povertà, contribuite a creare città ghetto dove prevale violenza e inciviltà. BASTA",1
"L'ennesima truffa dei rom Fiasché agli anziani, arrestata zingara pluripregiudicata - Secolo d'Italia... http",0
"Mafia capitale, nuovo filone ‘Mazzette per truccare gare d’appalto per campi rom’  http via @user",0
Li ho sempre odiati sti cazzo di islamici di merda! Crepate tutti!,1
"Le aggressioni fatte da immigrati (in tutta Europa) contro i nostri figli sono ormai stillicidio quotidiano. Questa barbarie  si chiama ""piccola Jihad"". NON PUÒ ESISTERE INTEGRAZIONE CON CHI CI ODIA.  Siamo in guerra ma non l'abbiamo dichiarata noi.  #NoGlobalCompact #NoIslam http",1
@user gestire gli immigrati!!!..venite a Brescia a vedere cosa combinano..Ghe la merda,1
"ed é giustissimo cosí, lo stato deve usare i soldi per formare gli italiani disoccupati non per trovare lavoro e insegnare l'italiano a migranti economici ed irregolari, forza @user #tagadala7",1
"L'immigrato che non piace alla sinistra razzista.Tanto di cappello a questo migrante,questi sono i migranti che voglio.Gli italiani non sono razzisti,anzi, sono fin troppo accoglienti.Non ne possono + di mantenere migranti che non lavorano ma delinquono.😐 http",1
"Non vogliono riprendersi i loro finti profughi e a loro cura e spese? Bene, tasse del 500% sulle importazioni dei loro prodotti. Vedi come cambiano subito idea!",0
"Genova, campo rom sgomberato. Caritas e Sant'Egidio: ""E ora? Meritano una vita dignitosa"", http via @user",0
@user @user @user @user Sopra dice immigrati regolari portano il 9% del pil. Ha detto bene regolari come lo fu mio padre. Questo non è il modo di accogliere. Si metta anche al posto di chi con figli non ha quasi da mangiare o dei terremotati e gli offra un piatto di pasta.I problemi vanno risolti tutti,0
@user Basta chiedere!  Domani esercito in strada fermo x tutti u migranti chi non in regola portato subito in centri di esplulsione poi C130J e via verso ma loro casa!!!,1
"@user Israele sta facendo di tutto,x cacciare più' musulmani possibili dal nord Africa.vere minacce x loro,soldi e pirla come questo",0
"Derubava anziani con l’inganno o con la forza, colpi in tutto il nord Italia: arrestata rom 35enne http",0
@user @user Il disordine si crea se i rom ci frugano e poi lasciano tutto in terra... prontamente fotografato dai #pdioti,0
@user nn solo terrorismo consideri l 'idea lanciata di fare 5figli a testa per comandarci a breve con le loro leggi islamiche,1
@user @user Ma perchè essendo quasi tutti musulmani non emigrano nei ricchi paesi del Golfo Persico? #DiMartedì,0
"@user @user @user @user I tuoi idoli saranno in piazza per Lucano e per gli immigrati assieme ai sindacati che hanno chiaramente in testa di ELIMINARE GLI ITALIANI dal mondo del lavoro e quindi dall'Italia. Questo è molto schifoso, non certo volere un criminale in galera. http",0
"@user Sono”salvataggi”sotto regia” guarda caso adesso che questa sottospecie di traghettatore di falsi migranti è ferma a Catania, non ci sono in giro gommoni sgonfi e nè elicotteri che riprendono questi pseudo naufragi!!Ma smettiamola di farci prendere in giro  da questi individui!!",0
"@user @user questi passano dai terroristi isis alla cultura ... ma i 5 stelle non predicavano il ritorno alla proipria moneta? l'italia non avrebbe bisogno della carità di nessuno men che meno da chi finanzia i terroristi ,invece andate alla carità da questa gente dignità sotto zero",0
Però si incrementano i voti della sinistra con i clandestini islamici neri x lo + maschi fancazzisti Voti da sommare a rom e altri benemerit,0
"@user @user Hai fatto bene a ricordare il campo rom di via di Salone,attrezzato di tutto punto,doveva essere un campo modello,un gioiello,fiumi di soldi spesi,poi abbiamo visto come è finita,hanno dovuto mandare l’esercito ??",0
Spartivano con i rom il bottino dei furti in stazione: due poliziotti condannati a 7 anni http,0
"Mentre Salvini straparla d'immigrati e s'ingozza in diretta facebook la malavita continua a taglieggiare gli esercenti che non vogliono pagare il pizzo.  Quando ""sicurezza"" è solo un altro modo per dire ""forti coi deboli, deboli coi forti"".  #SalviniDimettiti",0
"La #AlanKurdi di @user con 64 migranti a bordo sta facendo rotta verso nord, esattamente nel mezzo tra #Malta e #Lampedusa. Come mai non è rimasta in zona SAR della #Libia per continuare a cercare l’altro barcone con 50 migranti disperso? http",0
Cardinale: “Islam a messa. I fedeli si ribellino” @user @user @user @user @user @user @user @user @user @user @user @user @user @user http,0
@user Queste le promesse fatte dai migranti a chi li accoglie in Spagna ... “Noi siamo arrivati con il barcone però voi ve ne andrete via di qui nuotando” ...  🌈 #WelcomeRefugees 🌈 .. 🤪✊🏻 http,1
San Biagio - A Milano arrivano i panettoni per i profughi (PrimaPaginaItaly) http http,0
#biancoenero  C'è un problema di cultura della legalità fra i rom: i bambini non vanno a rubare se non c'è dietro qualcuno che li spinge!,0
"@user scusami Salvini,puoi dare tu la definizione di un partito che dice di scaricare gli immigrati insieme alla noccioline?",0
@user Col calo degli sbarchi cala visibilità migranti e salvini tra poco parlerebbe da solo. Ha bisogno di disperati e prega fortemente siano ridotti a rubare per mangiare,0
"Altro sangue, altri morti innocenti ammazzati dai terroristi islamici, questa volta in #SriLanka. Una preghiera e l’impegno a vigilare, prevenire, fermare, annientare gli assassini usando la rabbia, l’orgoglio e la forza della ragione. http",1
Europa sotto attacco islamico ma in Italia nasce la «costituente islamica»: Facciamo una… http,1
"Migranti, #DiMaio: “Basta ipocrisie, persone partono perché Francia continua ad avere colonie e a impoverire l’Africa”. Finalmente il modo corretto di affrontare la questione migranti: andare al cuore del problema e smascherare i responsabili!",0
"Roma, rapina al campo rom La Barbuta: tre arresti. L'ombra del racket http http",0
"La Guardia costiera maltese è intervenuta in risposta alla richiesta di evacuazione medica urgente lanciata dalla nave #OpenArms. A bordo restano oltre 300 migranti, in attesa di ricevere indicazioni su un porto sicuro dove farli sbarcare. Evacuato un neonato da #Malta.",0
"Antonio Calò, il professore che ospita i profughi a casa: “Lavorano e sono integrati” http #thexeon",0
@user In #Norvegia con  77 morti hanno condannato il terrorista a 21 anni.E in #Svezia con 5 morti una s… http,0
"Cari italiani, per battere l'islam dovete tornare a fare figli http",1
"Se stranieri, delinquenti. Se italiani, derubricata a ragazzata e in premio non c'è la medaglia di Salvini. É l' Italietta legastellata.",0
Gli imam li indottrinano spiegando che le occidentali si debbono sentire onorate di soddisfare le voglie dei veri musulmani! Il problema serio é l’islam http,1
@user @user bella figura della Merlino amica dei ROM. ?????????? fomenta in tv attacchi alla Raggi. Vergogna ( non è colpa dei ROM ma della Raggi) complimenti a lei!!,0
"Donald Trump all'Onu: le parole che servono su immigrazione, Iran e multiculturalismo Cronache faziose di Paolo Mastrolilli e Francesco Semprini, corretta di Mirko Molteni  Gli articoli di... http",0
"Sono bastati una decina di migranti per far emergere tutte le contraddizioni di questo Governo, che mesi di opposizione sui congiuntivi e felpe.",0
"@user @user @user Piccola parte? Mafia, camorra, 'ndrangheta e Sacra Corona Unita, sono una piccola parte? Digrazia? ma che cazzo dici...la signora è stata picchiata, uccisa e torturata. Quindi il 99% degli stranieri sono tutti assassini e delinquenti? Ma va a cacà. Meglio che non rispondevi!",0
"“Anziché far venire gli immigrati diamo il Reddito di Cittadinanza e gli italiani incominceranno a trombare come ricci…” (Massimo Baroni, deputato M5S)",1
"@user @user @user Prova a chiedere ai musulmani in Germania perchè chiedono alle donne occidentali di islamizzarsi in caso di matrimonio con musulmani. Il 90% di questi matrimoni finisce o in tribunale o all'ospedale con la donna tedesca picchiata,. Lo stesso in Italia..L'islam non è integrabile.",1
"mi raccomando continuate a far entrare i clandestini, che tanto i terroristi mica entrano così in Italia. #terrorismo",1
Una mia vicina va spesso in Francia. Dice che la ns frontiera è costretta a presiedere 24h24 il ns confine perchè la pz francese per sbolognare i clandestini in Italia se ne sono inventati un'altra. Si vestono in borghese e continuano a scaricarci immigrati. @user,0
La ong tedesca sea eye ha preso a bordo al largo della Libia 60 immigrati. Potrebbe richiedere un approdo in Italia,0
ITALIANIIII!!!!!! via dall'Italia  questo territorio ormai è dei profughi. http,0
"Organizzavano falsi matrimoni tra donne italiane e falsi profughi per dargli la cittadinanza... I famosi  ""Stronzi di Riace""",0
Gli ebrei portati contro la propria volontà. I migranti nei loro paesi spacciano stuprano e pagano scafisti per farsi portare in libya a spacciare e stuprare rubare e uccidono a chi va ad aiutarli nei  loro paesi. I comunisti pd andavano nelle chiese e uccidevano i cristiani.,1
"Migranti, Sea Watch attracca nel porto di Catania, i migranti si abbracciano - Politica - ANSA Ora sequestrare quella bagnarola  e arrestare l’equipaggio per traffico di esseri umani  http",0
"@user ""Lettura collettiva dei nomi di 34.361 migranti morti nel Mediterraneo""SPETTACOLO.Potenti MEZZI.Hanno tutti i nomi.Adesso magari si riesce pure a trovare anche le CERTIFICAZIONI ISEE delle FAMIGLIE MIGRATIS che mangiano a SBAFO nelle SCUOLE di LODI?",1
@user @user @user @user @user @user @user 👍👍👍👍Adoro i buddisti ed odio profondamente l’Islam ! Non capisco i buonisti rossi che aprono le braccia a gente che non intendono integrarsi.. basta parlare con loro e capire quello che vogliono. Un musulmano non accetterà mai le nostre leggi. Per loro esiste solo la SHARIA.,1
La Boldrini fa associazione esterna al terrorismo.Le sue dichiarazioni sono un attentato alla sicurezza dello Stato! http,1
SICUREZZA - Rom milionari nei campi nomadi: blitz della Finanza http,0
"Dl migranti sicurezza, ok dal Cdm | Salvini: ""Stop domanda asilo se richiedenti pericolosi o condannati"" Il ministro dell'Interno ha poi annunciato di voler ""chiudere tutti i campi rom entro fine legislatura"" e ""di ridurre la diaria assegnata ai immigrati  http",0
"Non si sa cosa cazzo c'entrino i rom, ma comunque #juve merda!! http",0
"Compito di matematica. Sapendo che in Europa ci sono 26 milioni di musulmani e che almeno il 10% è radicalizzato e pronto al terrorismo, quanti potenziali assassini circolano?",1
@user mica difendo chi fa casino. Ma quando lui incita a bruciare i rom perde il diritto di essere considerato alla pari.,0
@user DELLE MINACCE FATTE DAI TUOI AMICI DI FORZA NUOVA AI ROM E DEL LORO CIBO CALPESTATO DI QUELLO NON PARLI VERO?,0
"Italia diventerà islamica, è questione di numeri, loro fanno figli ed arrivano in massa. I ns figli per un futuro devono partire",1
"http questo è ciò che corano le tue ""RISORSE "" di merda oltre a uno stile di vita che ci stimola solo la PIPI'💣💥",1
Pietre e petardi contro case migranti http http,0
"#Roma la Raggi spende 12 milioni per i campi rom #Roma, #la #Raggi #spende #12 #milioni #per #i #campi #rom http",0
"Roma, a San Pietro carabinieri pagano l'albergo a una profuga e alla sua bambina http via @user",0
"Book Pride. ""Lo straniero"" tema della terza edizione http",0
Roma campo #rom...la mafia cinese dovrebbe fare un blitz lì ��#dallavostraparte,1
@user con tutto il patrimonio di #denaro che governo si mette in tasca🙄🙄sicuramente andrà tutto #migrantimaiitaliani😤😤😤,1
No alle piste ciclabili perché ci vanno i migranti. No al wi fi in piazza perché crea assembramenti. No ai negozi etnici aperti la sera. No alle panchine. No alla vita notturna. È una classe dirigente di vecchi che sogna di amministrare un paese di morti.http,0
La #Raggi dopo un anno comincia a far qualcosa. E comincia col dare le case ai rom. Contenti romani che l'avete votata? @user,0
"FERMIAMO L'IMPOSTORE. Forse saranno necesarie altre CROCIATE, visto che il fiume di fango non si ferma.Anzi Vaticano, SX e POTERI MASSONICI ci stanno massacrando. Quando mai in Italia qualcuno veniva SGOZZATO, PRESO A SPRANGATE, FATTO A PEZZI? Fermiamo l'invasione dell'ISLAM!!!",1
"Mentre la sinistra italiana fa propaganda sulla pelle dei migranti, la Polizia di Sabratha (#Libia) ha liberato migranti, donne e bambini inclusi, da un covo di #trafficanti. Chi sono i veri ""umanitari""? http",0
"Torna «Book Pride», tema: lo straniero. A Milano la fiera con 200 editori indipendenti. Ne scrive Severino Colombo… http",0
BUONGIORNO PATRIOTI..LA BOSCHI FA UN VIDEO PER DIFENDERE SUO PADRE (LE RICORDO CHE BANCA ETRURIA HA TRUFFATO MIGLIAIA DI RISPARMIATORI..) IL GLOBAL COMPACT ONU..CHE CI FARA' INVADERE DA IMMIGRATI..NON DEVE ESSERE VOTATO DAL M5S E PD..ALTRIMENTI TUTTI A CASA!!! #MovimentOnesti http,1
"@user @user @user @user @user @user @user @user @user Vivendo in mezzo a due campi rom a Roma posso confermare che questa politica è un suicidio, se si vogliono ancora fomentare la rabbia e l'odio tra cittadini e istituzioni beh complimenti obiettivo centrato.",0
"Oltre a qualche famiglia rom, nell'area c'erano anche diverse persone profondamente colpite dal terremoto, come... http",0
@user Spiegate al ragazzino che i suddetti Rom non hanno nessuna voglia di lavorare ma preferiscono vivere da parassiti e da ladri di appartamento. C'è una bella differenza...,1
Isis in Libia ci troveremo in casa centinaia di migliaia di sfollati e tra questi anche terroristi kamikaze,1
"Se al posto di due rom avessero messo in gabbia un cagnolino, le due dipendenti della Lidl di Follonica sarebbero... http",0
"Vittorio Feltri: ""Il Pd cola a picco nei sondaggi, e coi cortei pro-immigrati perderanno ancora"" http",0
Ecco perché anche i musulmani celebrano Gesù - TPI via @user,0
"Referendum, i timori dei quotidiani stranieri dopo il No. Ft: ""Ora il problema sono le banche"". Faz: ""Stress test … http",0
"Il Messaggero:  Roma, maxi-rissa al campo rom durante il censimento del Comune. Raggi: torna legalità, se ne facci… http",1
Da oggi a Teheran è vietato portare a spasso il cane. Sembra uno scherzo vero? L'Islam è anche questo.  http,0
#Austria: Un attacco con coltello alla vigilia di #Natale in un treno. Attacco ignorato dai media: un uomo di 26 anni il solito depresso #musulmano ha attaccato 2 passeggeri e li ha feriti al collo proprio come ordina il #Corano.http,1
"@user Azz se c’è, bisogna aggiornala sta ragazza di quello che pensi e dici dei negri, dei migranti, forse ella è all’oscuro, ma sarà informata",0
"#ilFatto: ""Turchia, arrestato il killer della strage di Capodanno a Istanbul. Fermati altri 4 stranieri http",0
"@user @user @user @user Se Costa è convinto che le baraccopoli sono un aiuto umano e dignitoso faccia quello che gli pare ma non occupando proprietà altrui. Non ho mai visto tanta miseria, degrado e violenza nel nostro paese come da quando è iniziata “l’accoglienza migranti”",1
Devo fare un post lungo: Avevo un bar dove ho preso a lavorare Italiani un venezuelano brasiliani tunisini marocchini albanesi e anche una ragazza rom affidata ai servizi sociali. Quando è morto mio marito prina di chiuderlo ho trovato lavoro a tutti. Sono finita in caserma,0
Il PD vuole l'unità di tutti contro i terroristi?Fermi l'immigrazione selvaggia controlli le moschee e arresti gli imam che predicano contro,1
PAZZESCO! Per la maggioranza di governo sono più importanti gli immigrati richiedenti asilo piuttosto che i pensionati sociali italiani. Ascoltate l'ultima vergogna. http,0
"Casa popolare assegnata all'inquilina, ma una rom incinta la occupa - IlGiornale.it http via @user",0
"@user Ma questi""volontari""con stipendio ,il centro migranti versava i contributi o faceva  lavorare in nero?????? Chissà!!!",0
#lariachetirala7 La Renziana #Rotta fa la LEGHISTA. Da quando il ministro Dell'interno e #Salvini. La donzella è l'imbecille #DeLuca si accorgono dei NIGERIANI per strada... IPOCRISIA TOTALE.....,0
L’accordo fra Italia e Libia sui migranti http,0
"A ""scuola di borseggio"" sulla metro: prese 7 rom http @user",0
Rispunta Kyenge: “Il decreto di Salvini lede i diritti umani. No all’espulsione dei migranti che commettono reati”: http @user tu parli solo quando ti fa comodo! Il decreto SALVINI è salutare! Certo teniamoci i delinquenti!! A casa senza passare da via!!!😡,1
"Milano, cena in amicizia con una famiglia #rom: 'Bello incontrarci a casa dopo anni nelle baracche' @user http",0
"Anche i big di #SiliconValley schierati con i girotondini contro #Trump. #Bando contro gli #immigrati ""danoso"" http",0
"#Siria, tv di Stato: ""Uccisi 5 bambini in attacco '#terroristi' contro #scuola"" http http",0
@user Brutto stronzo all'infinito ma gli italiani che bivono nelle baracche qualche anno addietro prima dei migranti dove e come vivevano stronzo ancora una volta,0
"Ecco, io andrei a vedere le tonnellate di farina che tra autostrade, business dei rifiuti e (guarda caso) dei migranti si sono già spartiti, fingendo di contendersi le torte delle giunte, per capire perché i gemelli Destra e Sinistra randellino chiunque s'avvicini ai loro mulini.",0
"#ariachetirala7 avemus la psicologa pdina #parsi  che offende tutti , come sempre difende gli #immigrati ma non l'ho ancora sentita parlare in  difesa degli italiani ridotti in fame & che si sono suicidati !! perche i soldi vanno agli amichetti loro e alle #coop #mafiacapitale http",0
"@user @user @user o l'aumento della povertà ,l'aumento degli immigrati etc.etc.",0
"@user @user girare frittate nn tutti gli islamici sn terrosristi,ma va da sé che ttt sn islamici,concordonn ttt sn invasati e attivisti",1
"Roma, allarme terrorismo: cosa sta succedendo – Vi Avviso http",0
"Roma, scatta l’allerta terrorismo ma fanno più paura i black bloc  http http",0
"Forse loro non dovevano essere là, ma è inconcepibile chiamare uomini questi bastardi che hanno #sgozzato le due #ragazze ancora #vive, dopo inaudite #violenze.Questo è l'#Islam?Basta consentire il propagarsi di questa subcultura!#Combattiamo e #eliminiamolo come il #Nazismo http",1
"Il sindaco di Pescara  critica l'abbassamento delle tariffe per il mantenimento dei migranti, creerà solo problemi, dice, ""gli alloggi sono gestiti da privati e i privati si muovono solo per fare business "" Finalmente qualcuno ammette che l'immigrazione è solo business.",0
