text,label
#staseraitalia alla fine della fiera...sono contraria a pagare reddito a fannulloni...x via della magistratura toccherà pagarlo anche a zingari e immigrati..come sentenza cassazione x invalidità..hanno eliminato residenza 10 anni..quindi a tutti indistintamente a prescindere.,1
"#salvininonmollare la pseudosinistra se ne faccia una ragione,mio nonno difese la patria cacciando gli invasori,i migranti ILLEGALI clandestini sono invasori e come tali vanno respinti. La sovranita' territoriale valeva allora e vale tutt oggi.",1
"Venezia, frasi razziste su Facebook contro richiedenti asilo: 6 mesi senza social e dovranno leggere libri sull’immigrazione [URL] [URL]",0
"[USR] Fosse l'unico non sarebbe un grosso problema.Pucciarelli commissaria per i diritti umani che augura a degli immigrati ""il forno"" quando chiedono le case popolari, Calderoli condannato per le affermazioni contro la Kyenge, Arrigoni no-vax...Continuiamo?",0
[USR] ben fatto le pen e che cavolo basta imposizioni islamiche che imparino i musulmani a rispettr occidente,1
"Roma, nomadi bloccano la strada con un frigorifero per rapinare gli automobilisti BISOGNEREBBE RINCHIUDERLI AD ALCATRAZ NON IN 1 GABBIA!",1
[USR] [USR] [USR] SONO PROPRIO TUTTI SCEMI! LA PAGHERANNO CARA.Alla fine che si tengano i loro amati terroristi.,1
"Bene operazione rom, adesso sgombrare campo e riqualificare riserva [USR] [USR] [USR]",1
Perché  la Open Society Foundations di Soros sta finanziando con 500 milioni di dollari $ i migranti. Che cosa hanno in mente di fare in Europa?perché tutti i politici lo seguono?Io ho un brutto presentimento.Verremo distrutti e svenduti.Non è un incubo è la realtà. Maledetti,0
"OSPITARE I #MIGRANTI? IL #MAROCCO RISPONDE PICCHE.  ""Non apriremo centri di protezione per gli #immigrati in attesa di asilo dall'#Europa"". È la risposta del ministro marocchino Bourita alla proposta avanzata dalla #Merkel e sostenuta anche dall'Italia.  [URL]",0
[USR] Assurdo che stranieri dicano cosa deve fare un Paese sovrano #noeuro #noeuropa [USR] [USR] [USR],0
"#StevenWoolfe  [URL]  Tutto ciò... Indovinate per colpa di chi? Ma dei #migranti , naturalmente... 😊👍  #Risorse",0
#Roma: arrestata una #nomade specializzata in #borseggio con 20 anni di #carriera - [URL],0
"[USR] [USR] [USR] Si per fare ""palmeti"", ""bananalandia"", campi rom, nomi di vie in arabo, ma andate tutti a ��!",0
[USR] esatto.... sono come e peggio del pd....tutti pro clandestini rom iussoli e stranieri criminali e mai con italiani,1
"[USR] [USR] [USR] Se la tua soluzione é quella che hai scritto prima.Mi sa tanto che i vari sionisti terroristi invasori [URL] staranno facendo un sacco di risate,contro le serpi velenose ci vogliono altre soluzioni.Fidati.............................",1
Retweeted Agi Agenzia Italia ([USR]):  Quanti sono e dove vivono i #rom a Roma [URL] [URL],0
[USR] [USR] [USR] [USR] [USR] [USR] [USR] [USR] [USR] [USR] [USR] [USR] [USR] [URL] [USR]   Inquietante! Uccisioni di massa di persone innocenti uccise dall'ISIS questi sono crimini di guerra dell'IslAm. Questo è ISIS eseguendo molti in questo modo se si rifiutano di convertire o accettare SHaRIA Law.,1
"Senza considerare che il 70% delle famiglie degli immigrati bravi e integrati, comunque sono monoreddito e 3 figli a carico che costano il 200% di quello che versano... e noi continuiamo a pagare!!!!",1
La #Raggi dopo un anno comincia a far qualcosa. E comincia col dare le case ai rom. Contenti romani che l'avete votata? [USR],0
"Prima riempiono l'Italia di migranti non paganti e delinquenti , poi uccidono l'economia e tolgono le prospettive ...poi dicono che siete cattivi e rancorosi ! 😡😡😡 cazzo pensavano!  Che eravate pure felici? 😡 #Censis",1
[USR] [USR] calcoliamo che l 80% di prostitute e trans sono stranieri! Anche lì!,1
"[USR] Bravo, mentre tu ci imponi l'immigrazione senza regole che porterà il mondo alla distruzione...e ci parli di pace???????!!!!!!!!!",1
Papa a studenti [USR] La risposta alla paura è l'accoglienza e l'accompagnamento dei migranti. [URL],0
[USR] X anni [USR] e [USR] hanno appoggiato in Italia (da abusivi) e in UE il [USR] su africani rom islamici clandestini e stranieri criminali liberi impuniti.... hanno sempre tradito il popolo italiano autoctono sovrano e lo faranno sempre...,1
"#Salvini: ""Altre vite messe a rischio da una Ong straniera, partita da acque libiche in direzione Italia: il nostro governo ha scritto al governo tedesco perché si faccia carico del problema e dal Viminale abbiamo diffidato la nave dall’entrare nelle... [URL]",0
Cardinale: “Islam a messa. I fedeli si ribellino” [USR] [USR] [USR] [USR] [USR] [USR] [USR] [USR] [USR] [USR] [USR] [USR] [USR] [USR] [URL],0
"Una brochure del governo invita gli imprenditori stranieri ad investire in Italia  ""Perché in Italia gli... [URL]",0
"«La ricompensa di coloro che fanno la guerra ad #Allah e al suo Messaggero e che seminano la corruzione sulla terra è che siano uccisi o crocifissi» (5, 33)Bisogna acquisire la consapevolezza che la radice del male è l’#islam, perché ciò che #Allah prescrive nel #Corano ...",1
"da uno a qualsiasi campo rom, quanto truffano le pagine Facebook che vendono orologi?",0
"Chiediamo con urgenza all’Italia e agli altri Stati membri dell’Unione Europea di attivarsi affinché i 49 migranti da giorni bloccati in mare, possano sbarcare in un porto sicuro➡ [URL] #ApriteiPorti [USR] [USR] [URL]",0
No vabbè questi hanno vinto tutto ahhhahhaahahhahaaahahahah #CarnevaleVenezia2017 #carnevale #Lidl #rom… [URL],0
I PARASSITI OSPITI DI UN CENTRO DI ACCOGLIENZA PROTESTANO E  SI LAMENTANO PERCHÉ POVERINI DAL MESE DI LUGLIO NN RISCUOTONO LA PAGHETTA GIORNALIERA!! Profughi esigono paghetta: “Italiano ci fa schifo questa lingua” – VIDEO [URL],1
"Roma, scatta l’allerta terrorismo ma fanno più paura i black bloc  [URL] [URL]",0
[USR] coglione  sei anche te colpevole il terrorista  E uno dei tanti .che te gli hai salvato la vita  E lo hai accolto !,1
tutti si svegliano .scoprono..gli italiani non vogliono immigrazione e terrorismo,0
"Contro il terrorismo suicida c'è, alle volte, poco da fare. Contro chi lo rivendica, tutto #Hamas",0
[USR] [USR] #LEGA e BASTA NO #IMMIGRATI #Italia solo #ITALIANI .. .ficcatelo in testa #comunista [URL],1
"Dopo la segnalazione di alcuni cittadini, insieme alla polizia municipale abbiamo appena sgombrato dei nomadi che... [URL]",0
"Sara: rapita da immigrati e stuprata per 12 anni, fatta abortire 8 volte [URL]",0
"[USR] in piazza per la legalità e per spazzar via droga, immigrazione e degrado. [URL]",1
#simone is the new #gretina Ringraziamo la Principessa Virghinja Raggiovich sindaca di Rom. (per averci mostrato il vero volto dei cinque stelle --- e non solo quello !) [URL],0
"L'accusa di favoreggiamento dell'immigrazione clandestina per #MimmoLucano suona grottesca alle mie orecchie. L'unica cosa che il sindaco di #Riace ha favorito è un modello di accoglienza efficace e dignitosa che ha salvato un paese e i suoi abitanti, vecchi e nuovi. Solidarietà.",0
[USR] I rom urlano per fare scena quando colti sul fatto. I ladri nei super devono essere chiusi in un ufficio ma tu che ne sai,0
L’ordine ai giornalisti: “Nascondete i crimini degli immigrati” [URL],0
"#ULTIMORA EGITTO: Attentato alla chiesa copta a Il Cairo: Arrestati altre 3 persone, sospettati di progettare altre operazioni terroristiche",0
"Visto che difendete tanto la #Raggi, hai qualcosa da dire anche sulle case da dare ai rom dopo che ha stanziato 12m… [URL]",0
"Via Salviati, la Polizia Locale salva donna vittima di violenza nel campo nomadi: [URL] [URL]",0
"Forse mi è sfuggito ma #leiene sul servizio fatto a #Bari come mai ,pare, che non abbia mai pronunciato ""campo rom"" ?",0
Ho visto due rom che lavavano i vetri alla loro macchina... Alla fine si son messi a litigare su chi dovesse pagare l'altro #truestory,0
"[USR] perché ovvio, tutti i criminali sono rom",0
"Cara sindaca, perché non sgombera lo stabile occupato da CasaPound e ci mette le famiglie rom al loro posto? Un po' di coraggio, suvvia. [URL]",0
"#dallavostraparte fottiti, principessina.  o nomadano o si sbattono come tutti. e nn in nero... [USR]",0
Oggi #PapaFrancesco è eroe perché odia #Salvini sui #migranti o è maledetto perché è contrario all'#aborto?  Fatemi sapere così mi organizzo mattinata e scritti. Intanto bevo un caffè. ? #Immigrati #Immigrazione #CongressoDelleFamiglie #Verona #FamilyDay #LucaMarfé #Roma [URL],0
#ItaliaSicura #ONSCI “Violenza insopportabile Bisogna far conoscere anche l’islam… [URL],0
"Napoli, migrante minaccia: ""O cancella questo decreto o noi cancelleremo Salvini"" [URL]",0
"#Vicenza nigeriano aggredisce 2 agenti,ad uno stacca falange a morsi,in tasca il suo mitico PERMESSO DI SOGGIORNO X MOTIVI UMANITARI. Intanto una trentina di stranieri ha accerchiato le FF.OO: ORA SI PERMETTONO DI ACCERCHIARE. L'ITALIA QUANDO S'È DESTA? [URL]",1
#Terni #Umbria No alla recita natalizia disturbaLe diverse cultureReligiose ScusateAnimeBelleMa come funziona? Sono i #migranti arrivati  volontariamenteQui che devono integrarsi con noi o siamo noi a doverci integrare con loro cambiandoLeNostreTradizioni? [URL],0
"RadioRPL: ""RISORSE"" CON SPECIALIZZAZIONE Roma: arrestata una nomade specializzata in borseggio con 20 anni di carr… [URL]",0
"Non tutti i musulmani sono terroristi, ma tutti i terroristi sono musulmani",1
"[USR] [USR] [USR] Si farà ciò che è stato possibile concordare, cercando di arrivare a chiudere qualche argomento.C'erano punti cardine (immigrazione, sicurezza, legittima difesa) che stanno facendo il loro corso.Dobbiamo essere noi a sostenere di più le nostre linee.",0
Le barbarie con l'imposizione della violenza per le riconversioni islamiche rischiano di fomentare odi razziali se… [URL],0
"[USR] [USR] [USR]  E sono diventati musulmani??? Se è così...beh, qualcuno bara...e chi è?? Roma, Città del Vaticano?😳😳😉",0
"Meglio abitare accanto a un Rom che a un Leghista... Sono Genovese, è ricordo quando hai difeso a spada tratta la famiglia #Benetton dalle critiche per il crollo del ponte #Morandi , vuoi vivere con i #Rom ? Bene, ti auguro di trovare sistemazione sotto un ponte con loro. ? [URL]",0
[USR] Queste le promesse fatte dai migranti a chi li accoglie in Spagna ... “Noi siamo arrivati con il barcone però voi ve ne andrete via di qui nuotando” ...  🌈 #WelcomeRefugees 🌈 .. 🤪✊🏻 [URL],1
"[USR] Se gli svedesi si sono trasformati in tanti eunuchi, gli sta bene! Anziché bandire l’Islam hanno legalizzato gli stupri delle loro donne ed adesso si lamentano? Saranno definitivamente sottomessi o eliminati",1
"Il Corriere:""arrestato il sindaco di Riace Domenico Lucano per favoreggiamento dell'immigrazione clandestina."" Questo è l'uomo al quale la Rai del PD ha dedicato una fiction. Questo è il modo in cui il PD ha usato i soldi pubblici dei contribuenti.",0
"Francia, Germania e Austria cacceranno tutti negri che scapperanno in Italia. Preparatevi all'ondata #immigrazione #clandestini #terrorismo",1
"[USR] [USR] #Ong Parlano parlano ma non se li tengono in casa loro! se la Boldrini  con tutto il Pd Bilderberg, hanno così tanto a cuore: i suicidi degli  italiani, 9milioni di poveri, ecc..  poi, perché, gli illegali migranti  economici islamici e africani, non se li portano a casa loro?",1
"sono i #migranti ed il mercato assurdo che ancora insiste su di loro!  Da Italiano mi preme soltanto risolvere questo schifo sociale e non realizzare nuovi tunnel, visto che gli esistenti li stiamo chiudendo! Ripuliamo l'Italia e basta - il successo lo ricostruiamo da soli!  🙂",1
#NoMas atti terroristici promosse dai leader della destra in #Venezuela [URL],0
#quintacolonna Per gli italiani hanno messo a pagamento cure e interventi per gli immigrati tutti gratis e ci fanno pure un film,1
"[USR] [USR] ""Le forze dell'ordine devono proteggerci da questi schifosi vigliacchi"" immigrati [URL]",1
[USR] State islamizzando l'Italia. Per colpa vostra avremo i nemici in casa. CHE SIATE MALEDETTI IN ETERNO!,1
[USR] ha inciso anche un aspetto: la paura folle che avevano i parigini. Negli ultimi 10min erano terrorizzati,0
"intanto in Svezia, una donna di 65 anni  incarcerata per 3 mesi per aver parlato male del nuovo naz....ehm, dell'islam, mentre un uomo chiamato Mohomed che ha stuprato una 13 enne viene ""condannato"" a 150 ore di servizio in una comunità. Qualcuno mi dica che è una bufala vi prego",1
"Mafia Capitale, appalti per i campi rom: chiesto processo per 17 persone [URL] [USR]",0
"[USR] [USR] [USR] [USR] [USR] [USR] [USR] [USR] [USR] [USR] [USR] [USR] [USR] [USR] [USR] [USR] [USR] [USR] [USR] [USR] [USR] [USR] [USR] [USR] [USR] [USR] [USR] [USR] [USR] [USR] [USR] [USR] [USR] [USR] [USR] [USR] [USR] [USR] [USR] [USR] [USR] [USR] [USR] [USR] [USR] [USR] [USR] [USR] [USR] [USR] Frase fatta: Non tutti i Mussulmani sono terroristi e lo confermo lavorando e vivendo con loro,ma tutti i terroristi lo sono, pertanto (con le scuse) accertata la larga frangia violenta islamica, vanno monitorati fin dal loro ingresso in paesi cristiani. Radicalizzarsi è un nulla",1
"Ma quando  si dice che il #redditocittadinanza verrà negato agli stranieri, a prescindere, ci si rende conto che oltre che violare la Costituzione Italiana e le norme europee, si sta riproponendo una qualche forma di #LeggiRazziali?",0
Campi rom? Tutti da chiudere. [USR] [USR] #dallavostraparte [URL],1
"Tanta nostra stampa ha ignorato che gran parte dei #ribelli #siriani non erano civili inermi, ma #terroristi [URL]",0
"[USR] [USR] Prima dell'immigrazione di massa e incontrollata, l'Italia era MEGLIO!",1
"Zingari..i soliti ""MERDOSI""..#cacciamolivia Roma, i rom aggrediscono un 81enne per rapinarlo. Bloccati dai cittadini [URL]",1
"Padova, decifrato il codice ""criminale"" di sinti e rom: da ""soldi"" a ""borsa"" - Il Fatto Quotidiano [URL]",0
Ecco la rivendicazione. isis..al quaeda come si vuole ...sono estremisti musulmani. In italia 1 milione di islamici… [URL],0
"Ecco l’informazione di #Repubblica: criminalizzazione e insulto di un’intera borgata  Nessuna informazione sulle sofferenze quotidiane di questi cittadini.  Del resto, che gliene fotte a [USR] del loro disagio: questi sono italiani, non sono nè migranti nè rom. #TorreMaura [URL]",0
Mussolini propone: “imbarchiamo Boldrini coi migranti per la Libia” l’idea fa impazzire gli italiani. cara [USR] se ci riesci ti prometto che ti voto a vita.? [URL],0
Cinese morta dopo un furto: uno dei due rom è già libero – Speed 24 News [URL],0
"I preti opinionisti dei talk show politici, difendono i migranti delinquenti e irregolari, dando 1 immagine negativa delle famiglie di ragazzine, uccise ,stuprate da loro, be' cosa ci si può aspettare dai preti?,il vaticano è sporco, E.Orlandi,E.Gregori,E.Claps,Pedofilia,Orge, ec",1
Per giorni si sono lasciati 58 migranti sull'Aquarius con un indicibile e assurdo balletto di accuse. Questo in Europa: 500 milioni di abitanti e una ricchezza immensa. [URL],0
[USR] scappate da ogni confronto vigliacchi mafiosi di merda?? mafiosi di merda!! dove cazzo pensione degli immigrati che avete rubato e continuate a rubare dal 2002?? dove cazzo sono i nostri versamenti? perche l'Italia deve trattenerli???,0
"A mio parere l'unica cosa da fare era utilizzare i € 150.000,00 per lo smantellamento del campo nomadi. Campo tra... [URL]",0
NigeriaIslamLe han messo il rossetto ma lei è una bambina!E lui non è il nonnoNon è il padreÈ il suo concubino ISLAMICO(pardon x islam lei insieme ad altre 4 è una delle mogli!)Poi vengono in ITALIA!a invocare diritti#NOPD #noiussoli#NOislam#noglobalcompact [URL],1
x: non si entra nell'angolo rotture della Lidl rom: AAAAAAAAAAAAAAAAAAAAAH [URL],0
Siamo tutti stranieri di qualcun altro! [URL],0
"Urlano a noi di dover ospitare i migranti, mentre loro si appropriano dei soldi dati in beneficenza per i terremotati. #facciamorete contro #Legaladrona",0
"#Heidelberg #NewOrleans e #Londra Tranquilli Non è terrorismo È solo terrore E tutti voi, non siete terrorizzati Siete solo fottuti",0
Video: giovani immigrati (molti irregolari) scendono in piazza guidati dai guardiani del Pol Pot mondialista a vomitare slogan contro il governo della nazione che li ha accolti e li ospita. Se pensi che sia surreale... allora sei razzista. [URL],0
In Italia con gli immigrati clandestini stiamo inportando solo ignoranza e culture barbare le conseguenze le pagheranno i nostri figli e nip,1
Porteranno lo spread a 500 pur di mandare a casa il governo (regolare ) attuale poi arriverà il PD o PDL a ghettizzare l'Italia intera e renderla un letamaio più di quello che già è. Poi daranno le nostre case agli immigrati e a noi ci cacceranno. Questo vogliono fare E noi zitti,1
[USR] minchia i rom si lamentano pure andiamo bene,1
Se osservi bene è morta L'Europa Cioè l'Occidente. Anche a me dispiace vedere invasione di feccia nera musulmana is… [URL],1
"Ne hanno tutti piene le pive dei vostri #migranti da mantenere Non l'avete ancora capita, o imbecilli? .... [URL]",1
PD FI M5S etc. sono tutti a favore dell'immigrazione clandestina per liberare l'Italia dal l'invasione islamica ci tocchera votare Lega!!!,1
ma noi li accogliamo e li manteniamo. Quanto siamo bravi noi. #idioti #Turchia #islam #Cristianiperseguitati [URL],1
[USR] [USR] Bravo...ospita una decina di immigrati clandestini anche a casa tua....Piddidiota.,1
[USR] un tweet di vicinanza per questa #donna malmenata da un tuo amico #immigrato niente?! Per una volta… [URL],0
"[USR] [USR] Ridurre numero e costi degli stranieri (legali e illegali) è possibile con lo stop a ogni forma di welfare agli extracomunitari. Accogliere solo chi riesce a mantenersi perchè il lavoro costringe uomini e donne all'integrazione, che l'assistenzialismo invece ostacola.",0
"RUSPA nel campo Rom ieri a Pisa. Per ora smantellati solo i capannoni vuoti, ma si sta già lavorando per far sgomberare completamente l'accampamento entro pochi mesi. Bene così! Che sia un comune, una regione o il Paese, dove governa la Lega si passa dalle parole ai FATTI! [URL]",1
"#Roma, cinese trovata morta: «Gli scippatori di Yao sono ancora nel campo rom» [URL] [USR]",0
La fisionomia dell'immigrazione della comunità islamica è cambiata in questi anni #aicds,0
IL MENDICANTE ROM CHE SI FINGE MALATO Ennesimo caso di falso mendicante: i rom in particolare sono professionisti di questa truffa. Non lasciamoci impietosire da questi soggetti! [URL],1
"LN Padania: Roma: arrestati cinque ladri rom acrobati, mentre si arrampicavano su un balcone [URL]",0
[USR] [USR] sarebbe ors di piantarla con la definizione razzista aprire occhi alla realtà dei delinquenti immigrati,1
"Rula é il volto dell' islam impastato al progressismo occidentale..la negazione della verità, pericolosa mistificatrice #portaaporta",0
Mi è piaciuto un video di [USR] [URL] STRANIERI reagiscono al SUD ITALIA - thepillow,0
Le Ong tra poco useranno mezzi anfibi x sbarcare direttamente il Libia e prelevare i migranti direttamente dalle loro case.,0
"A tutti i non musulmani dell'isis, vi sentite forti adesso?  Bravi coglioni! #Berlino",0
"Morti 12 migranti di fame e di sete su un barcone😔non avrebbero chiesto aiuto per non essere costretti a ritornare in Libia!😢Mi raccomando..andate a messa a mezzanotte del 24 dicembre,per festeggiare il Natale di un povero Cristo! E lasciate morire le persone disperate! Merde!",0
"Quando eravate Voi al governo pensavate esclusivamente ai migranti,alle coppie di fatto,adozioni a coppie lgbt,ius soli,scioperi della fame,mazza che argomenti!",0
"Ecco l’analisi di Mario Giordano sulla bufala che gli ""immigrati ci pagano la pensione"": siamo noi che paghiamo le pensioni agli immigrati che non hanno versato i contributi! Da ascoltare e condividere. [URL]",0
"Tutti questi “intrecci” che hanno favorito l’arrivo in Italia di 700.000 immigrati irregolari, nel mio libro #InfernoSpa, disponibile in prevendita sul sito di [USR]. [URL] [URL]",0
"Spagna salva 466 migranti su 10 barche [URL] QUINDI?? LA SPAGNA SI DISPERA XKÉ L'ITALIA CATTIVA,DOP ESSERE STATA INVASA X ANNI GRAZIE A RENZI,SE LI PUGLIANO LORO??🙄 VI DEVONO INVADERE,DOVETE MANTENERLI NOI SIAMO STUFI ,NN CI USATE PIÙ! ARRANGIATEVI!!👿",1
[USR] Luridi islamici. Credono di poter conquistare la scienza l intelletto il sapere la cultura l amore l arte con figli ignoranti!,1
"Cioè : o ci sono gli studenti gratis delle famiglie di immigrati ... o la classe non viene formata... MA QUESTO È UN RICATTO DI QUESTO PAESE COMUNISTA  DI MERDA...PER 5 ITALIANI NON SI PUÒ TENERE UNA CLASSE APERTA , MA SE RIFUGIATI ...CHE NON PAGANO UN CAZZO DI TASSE..ALLORA SI.. [URL]",1
#Milano: Misure di sicurezza 2.0:     smartphone   antiterrorismo e    «live» in questura       [URL],0
"#Roma Arriva a Roma Tracing Bus, la cabina telefonica mobile per i migranti [URL] [URL]",0
La Francia!! Deve mandare tutti i musulmani via dalla Francia!!,1
[USR] #facciamorete si con stranieri onesti e integrati come questa signora! I criminali distruggono tutto e visto che gli autoctoni ci bastano è ora di buttare fuori tutti i criminali stranieri!!! [USR] [USR] [USR] [USR] [USR] [USR],1
[USR] secondo la sinistra non si può dire: - zingaro - rom - sinti - magrebino - tunisino - nordafricano - ladro - stupratore - clandestino - immigrato clandestino - nullafacente - occupante abusivo - spacciatore PERO' A NOI NON CE NE FREGA UN CAZZO E LO DICIAMO LO STESSO !!!!,1
Batteremo Isis e terrorismo Via dalla faccia della terra - IlGiornale.it [URL],1
Non so che abbia promesso la #Raggi ai rom ma a me aveva promesso di non aprirne più...e ne sta aprendi uno a roma nord   #QuintaColonna,0
"[USR] [USR] l'immigrazione inizio' tanti anni fa con Albanesi e Romeni,tra i quali c'era anche la t… [URL]",0
"[USR] ""IMMIGRAZIONE E EUROPA CANAGLIA"".  CRAXI 1990 [URL] via [USR]",0
più schifo degli immigrati che hanno ucciso e violentato #Desiree solo i radical shit e i pidioti che difendono gli assassini.  Non siete degli essere umani #BESTIE #RIFIUTI,1
"Continuano a chiamarli migranti, in luogo di clandestini, anche se in effetti sono criminali! MI SONO ROTTO IL CAZZO! [URL]",1
Gentiloni: no a Ue rigida su conti e flessibile su migranti - Reuters Italia [URL] #notizie [URL],0
"Roberto Fico a Che tempo che fa: “I migranti non sono sacchi di patate, le persone vanno sempre salvate e fatte sbarcare”. [USR]  Li considerano sacchi di patate gli scafisti e le varie ong. Non possiamo fare entrare tutti: I terremotati sono ancora al freddo!!",0
"Il prete pro migranti spara: «Indagato perché accolgo». E' stato segnalato al Garante della privacy per aver diffuso le immagini dei richiedenti asilo in acqua senza il loro consenso. Molto probabilmente, a lamentarsi sono stati gli stessi stranieri. [URL]",0
❌❌ VIOLENTA RISSA TRA STRANIERI A #SASSARI ❌❌  Stefano #Borghesi: “Ennesimo caso di migranti violenti in una città italiana. Un caos ereditato da anni di governi Pd” [URL],1
"Accidenti, chissà cosa diranno adesso Saviano e tutti i buonisti che vorrebbero riempire l’Italia di immigrati! #Riace  [URL]",0
"[USR] [USR] L'unico che pagherà sarà lo spacciatore bianco, visto che i neri vengono sempre depenalizzati per non essere tacciati di razzismo,ma sopratutto per non confermare il pericolo di immigrazione selvaggia fatta anche da criminali scappati dai loro paesi.",0
"Il terrorista di Londra si chiama Khalid Masood Cittadino britannico, 52 anni, già noto agli 007 [URL]",0
Finisce la bella vita dei rom: via auto e beni di lusso per 300mila euro [URL],0
INTERVISTA. «Immorale il memorandum migranti siglato da Roma e Tripoli» [URL],0
"Trasferimento campo Rom, Forza Italia critica: «Più attenzione ai rom che ai cittadini» [URL] #Barletta #News #PugliaLink",0
"[USR] #Governo che privilegia e mantiene stranieri anche delinquenti, sarebbe da denuncia per malversazione.",0
[USR] [USR] FATEVI INCULARE TUTTI....IGNORANTI BASTARDI....VOI È I VOSTRI DELINQUENTI CLANDESTINI MUSSULMANI DI MERDA,1
"#Strasburgo #matrix#Sgarbi ""+ne parliamo+facciamo da grancassa all'#ISIS""Grz a #Tonycapuozzo torna il buon senso in studio:""Ma che state dicendo?Semmai lo sbaglio è reputare l #Islam una religione come le altre e tacere quando si dovrebbe denunciare continuamente la barbarie""",1
"Tutti in Italia. A Salisburgo Conte si piega alla proposta Merkel-Juncker: chi non accoglie i migranti, paga (dall'inviata A. Mauro) [URL]",0
La comunità africana in Italia parla di un sistema organizzato per convincere migliaia di persone a venire qui. Con la collaborazione di attivisti italiani. [URL],0
"Milano, decine di immigrati occupano uno stabile. E il parroco li denuncia [URL] [URL]",0
Non perdete mai l'occasione di fare i rom eh #ItaliaAlbania,0
"Roma, cibo destinato a rom e immigrati finisce integro nella spazzatura - Affaritaliani.it [URL] via [USR]",0
"Da come odiate gli immigrati sembra che abbiate una decina di africani in fila davanti al bagno di casa vostra, 20 sotto il balcone che fanno i riti voodoo ascoltando a palla Gigi D'Alessio e almeno 3 nel letto di vostra moglie.Non c'è nessuna invasione, non rompete il cazzo.",0
[USR] [USR] il Bello della immigrazione a ancora da mostrare i vero volto di questa disgrazia targata PD Sel E 5 stalle,1
Salvini: lunedì via libera ai decreti sicurezza e immigrazione [URL] di [USR],0
"Redistribuire come vacche degli immigrati clandestini? Gente che nasconde documenti e mente allo Stato? Devono andare in galera, loro e l'equipaggio che li ha favoreggiati. E la #SeaWatch requisita. Lo dobbiamo ai #terremotati, ancora senza soldi mentre lo Stato paga delinquenti.",1
"[USR] straniero lo sei pure te. Vai a dormire tu che questi social non fanno per tutti, soprattutto per quelli come te.",0
