text,label
IL GLOBAL COMPACT VORREBBE L'INVASIONE MIGRATORIA EQUIPARANDO MIGRANTI ECONOMICI E PROFUGHI. PREVEDE CHE CHIUNQUE CRITICHI L'INVASIONE SIA PERSEGUITO PENALMENTE. SI PIANIFICA LA SCOMPARSA DEI POPOLI EUROPEI E LA REPRESSIONE DEL DISSENSO. ORA VEDIAMO DA CHE PARTE STA IL M5S. [URL],0
"Minorenne immigrato terrorista mancato, che in Italia, grazie alla nuova legge sui minori non accompagnati,... [URL]",1
"[USR] La bella domanda è: se sono profughi, come fanno a sapere dove rivolgersi per denunciare una persona, da parte un ministro del governo italiano???? Chi li sta guidando???? Ci scommetterei una mano che proviene tutto dal pdisastro!!!!!",1
"Raid contro migranti a Macerata, Traini in Aula: ""Chiedo scusa, ho sbagliato"" - TGCOM [URL] #PesaroUrbino #news",0
"Che strano, in Mediterraneo navigano mezzi di ogni dimensione e capacità eppure solo certi “pirati” anche di nazionalità straniera, che potrebbero riparare dappertutto sin da subito, lamentano onde altissime, persino di 1 metro ? e cercano porti “sicuri” sempre e solo in Italia!",0
[USR] [USR] sti comunisti zecche perché non emigrano in Algeria Arabia ecc. visto che si trovano bene con i loro fratelli islamici,1
"#Alfano, dopo aver riempito l'Italia di immigrati, promosso a Ministro degli Esteri. Non è governo, è ammucchiata d… [URL]",0
"[USR] [USR] E niente, nemmeno un libro di storia vogliono leggere, accecati dalla bella fantasia dell'Islam religione di pace. A Lepanto abbiamo fatto l'America's Cup.",1
"George Soros trascina l'Ungheria davanti alla Corte di Strasburgo perchè, secondo lui, combattere l'immigrazione clandestina è contro la ""democrazia"". La ""democrazia"" di Soros attenta alla sovranità di uno Stato libero e indipendente. [URL]",0
Finalmente qualcuno con segni d'intelligenza..è ovvio che si sta manipolando l'opinione pubblica con questa storia dei migranti... molto conveniente tenere tutta la gente distratta! #salvinidimettiti #disinformazione #manipolazione #ignoranza,0
"“Italiani non fanno figli, serve più immigrazione”. Grillo a favore della Grande Sostituzione [URL] via [USR]",0
Agnelli difende la Juve come la Boldrini i rom e i delinquenti. Vi voglio bene se andate nel posto piu' lontano da qui'.,0
[USR] Chissà perché solo uno parlava in italiano! Per forza gli altri erano stranieri!! Cmq o si da un taglio netto a questi stranieri irregolari o presto ci sarà anarchia! Questi profughi non anno niente da perdere quindi fanno quello che gli pare! A casa loro subito. [URL],1
"#Notizie #Ultimora Idea Fimit, Caniggia: ""Milano hub europeo. Più fondi stranieri ma serve stabilità"" [URL]",0
Rimangono sempre gli islamici che è peggio. [URL],0
[USR] LUPUS PILUM MUTAT NON MORES:PER TUTTI GLI EDIFICI E CASE OCCUPATE ABUSIVAMENTE E A SPESE NOSTRE DAI TUOI AMATI MIGRANTI E COMUNISTI DEL PRIMO MILLENNIO (E SUCCESSIVI) NON TI SEI MAI INDIGNATA ANZI...MA PRIMA DI ESPRIMERTI SEI CAPACE DI PENSARE?,1
#Business #rom: nel mirino della Procura #coop e #politici - [URL] [USR] #italia,0
"LN Padania: Il vice della Merkel: ""Sull'immigrazione, lei ha portato l'Europa in un vicolo cieco"" [URL]",0
[USR] [USR] non c'è cura o soluzione alla follia islamica,1
Oggi si è scritta una giornata di violenza dove l'islam mostra la sua vera faccia Quante altre vittime dovremo ancora piangere? SVEGLIATEVI,1
"L'islam ospite a messa offende la Chiesa. I fedeli si ribellino. [URL]  In quanti sono capaci di ribellarsi? Ricordo ai #Cristiani che la #Fede è questo, rispettare i Dogmi e rifiutare con energia la desacralizzazione della Santa Messa e la blasfemia dilagante",0
Campi rom? Tutti da chiudere. [USR] [USR] #dallavostraparte [URL],1
"Il #GlobalCompactMigration dell'ONU, da firmare a dicembre, prevede tra l'altro il bavaglio a chi ""parla male dei migranti"". Che facciamo, [USR] Già mezza Europa NON lo firma! 😡",0
Propongo caserme dove si insegna ORDINE E DISCIPLINA a tutti gli immigrati e i rom(e i sinistri) con militari veri… [URL],1
Finisce la bella vita dei rom: via auto e beni di lusso per 300mila euro [URL],0
"#Baobab, i #migranti al Campidoglio: ""Roma, come l’Europa, alza muri"" #RomaNonAlzaMuri [USR] [URL]",0
[USR] Sarebbe questa libertà di parola e d'espressione? Ma sappiamo chi sono gli arabi di Fatah e Hamas? Sono terroristi! Perché sono a piede libero a complottare da noi? Non abbiamo avuto abbastanza del loro terrore nel passato! Governi da vomito.,1
"#Milano: Chiedevano il «pizzo» alle ladre rom, condannati a 7 anni i due poliziotti [URL]",0
"Tempi infiniti per la ricollocazione. Migranti minorenni: ""Siamo in Italia fermi da un anno senza far niente e senza studiare"" [URL] via [USR]",0
[USR] [USR] [USR] senza quei poliziotti il terrorista era ancora in giro. Non mi interessa di che partito erano,0
"Mettete un tappo a questa falla, l’#islam è una voragine che inghiotte tutto #SalviniNonMollare #Stopislam #stopinvasione [URL]",1
"il caso di #AsiaBibi ha smascherato cos'è veramente l'Islam e la sua vera natura di morte, intolleranza e brutalita',tutto il contrario di cosa moderati e buonisti vogliono farci credere..quando ci sveglieremo???",1
"[USR] Fai una cosa: portateli tutti a casa tua!!! Io a casa mia non li voglio, terroristi o non terroristi che siano!!!",1
"Contro il DL immigrazione, tutti i soliti sinistri che avrebbero voluto i clandestini che votassero per loro. Ricordate le primarie del PD? Renzi le stravinse grazie ad interi pullman di neri imbeccati a votare per lui. Con lo jus soli, i PDioti volevano drogare le elezioni. [URL]",1
"#OpenArms con a bordo 300 migranti chiede di poter sbarcare. Ma [USR]  conferma la sua linea: ''I porti italiani sono chiusi'. Malta, che nega l'approvvigionamento, ha evacuato stamani dalla nave un neonato e la mamma soccorsi in mare ieri [URL]",0
[USR] io sono razzista e populista.fiero e vantandomene.!!diventato tale dopo aver preso sberle per anni e subito angherie per conquistare diritti e benessere per italiani ed operai  per poi vedere gente come te che li ha regalati al capitalismo e banche e preferisce stranieri..fottiti,1
"Contro le scemenze scritte anche su twitter, sempre in spirito di odio verso i migranti:   [URL]",0
De Falco sarà impegnato in eventuali operazioni di soccorso dei #migranti effettuate dalla nave della Ong #Mediterranea. [URL],0
Cosa prevede il decreto migranti approvato alla Camera (road2sportNews) [URL] [URL],0
[USR] In beneficenza agli immigrati clandestini o alla chiesa pedofila? Perché non fa una vera opera di bene e dona a CasaPound? [URL],1
CAMIONISTA ITALIANO CONVERTITO ALL'#ISLAM.  Non esiste l '#Islam moderato. Il #PapaFrancesco non e' affatto preoccupato dall'incidente Islamizzazione dell' Europa? Quest' uomo ha infibulato anche la moglie. Vergogna.  Padre 2 [URL],1
[USR] [USR] [USR] Politicanti avete ridotto l'Italia una fogna  e lo straniero delinque indisturbato,1
Solita #demagogia confusionaria che sposta il problema. I migranti che arrivano con i barconi non lavorano... [URL],0
"Roma, a San Pietro carabinieri pagano l'albergo a una profuga e alla sua bambina [URL] via [USR]",0
[USR] L’amico friz vada in processione a visitare in ospedale di Pisa i. MIGRANTI MALATI DI EBOLA si troverà bene!!!!,1
#notizie #Pisa Campo rom a Ospedaletto: Campo Rom Ospedaletto [URL] #Toscana #Italia,0
#staseraitalia NON VOGLIAMO MANTENERE IMMIGRATI-NN VOGLIAMO MANTENERE IMMIGRATI-NN VOGLIAMO MANTENERE PARASSITI IMMIGRATI VIOLENTI E BUGIARDI.,1
"Cronache dal fronte A #Udine, un nigeriano irregolare, prima prende a calci e pugni gli agenti che lo stavo fermando, poi in questura morde ne morde uno. [URL] Baby gang di stranieri pestano 2 ragazzi italiani, mandandoli in ospedale [URL]",0
#LAGABBIAOPEN ora fanno il partito islamico e vi spazzano via come cacca secca a tutti e si smette di cianciare,1
"#ULTIMORA +++ Salvini: ""Stop a missione Sophia senza nuove regole: no a porti italiani come unici punti di approdo per i migranti""",0
Alfano dice che questa non è l'Italia perchè non vogliamo gli immigrati e voi che non vi volete diminuire gli stipendi siete  belle persone?,0
"#Sala: ""Senza immigrati una città come Milano si ferma""  Quando vuoi far meglio di #Bonino (chi raccoglie i pomodori?) e del Faraone (chi mi fa le piramidi?) e pensi che chi ti porta la pizza oggi ti pulirà il culo domani.  #ilGps'| #MilanoAllaPiastra [URL]",0
Venezia. Un Signore becca due Rom a rubare in appartamento...il seguito è da [URL] tutti cominciamo a farci valere!!!Mai indifferenti davanti a queste professionoste del furto.Complimenti a quest'uomo. [URL],1
Sti terroristi del cazzo ma non venite a rompere i coglioni all'Italia che già sta messa male . Manaccia a voi e sto Allah che manco esiste.,1
"[USR] i rimpatri difficili da che? E che stato è l'Italia? Andate nei campi rom: Mercedes, audi, porsche.LO STATO È MAFIA IN ITALIA",0
RT infoANS_IT: #Italia – #Minoristranieri non accompagnati: i #Salesiani seguono il #Papa  [URL] [URL],0
News: Giornata della Memoria. Quei minori rom trucidati e dimenticati. Nota di Migrantes [URL],0
"Mahershala Ali, musulmano afroamericano alla notte degli #Oscar2017 [URL] [USR] [USR] [USR] #moonlight",0
[USR] I rom sono tutti cittadini europei e una buona parte italiani. Non li puoi espellere. Sono perfettamente a conoscenza dei delitti che dici ma la situazione non si risolve con l'odio,0
"#dallavostraparte ogni giorno assistiamo inerti a decisioni del governo riguardo l'immigrazione clandestina. Basta clandestini, tutti via",1
[USR] [USR] #felpino noto che i like su argomento migranti stanno calando molto..sarà mica che gli #italiani si stanno accorgendo che dietro a questo paravento c’è il buco economico più grande della storia che tu con #gigino e il garzone #conte state scavando?,0
[USR] negli iuesei sono tutti immigrati (a parte i furono 'nativi')... schiavizziamo 'ste merde?,0
#terrorismo Fabrizia per la Germania è vittima della strada [URL] [URL] rt IlCapoluogo rt Promo_Abruz…,0
"I farmacisti tra terrorismo e sos migranti, Sifo ne parla al congresso di Milano: MILANO  – Terrorismo, missi...... [URL]",0
[USR] [USR] No sul lavoro che lo stato deve garantire altrimenti deve garantire un sussidio min. Per una vita dignitosa ai suoi cittadini. Ma x ora la garantisce solo agli immigrati. Emigra tu e tutti quelli come te.,1
"Il Dalai Lama ha detto mercoledì a Malmø, in Svezia, che ""l'Europa appartiene agli europei"" e che nel lungo periodo è auspicabile che i profughi tornino a casa ""per ricostruire il proprio paese"". Molto più lucido del pampero del Vaticano.... [URL]",0
"È normale che nessun giudice, in virtù della tanto decantata indipendenza della magistratura,  indaghi i presidenti del consiglio dei precedenti governi e i vertici istituzionali, per più o meno consapevole favoreggiamento dell'immigrazione clandestina?",0
[USR] Via i napoletani e gli immigrati da Napoli!!!!,1
"I finti #profughi – perché nessuno nigeriano o ghanese è un profugo – si giocano la paghetta  nelle sale scommesse. Da anni. Il che è normale: vitto, alloggio, schede telefoniche e tutta l’assistenza è già garantita. La paghetta 75 euro al mese è per gli stravizi (Vox) [URL]",0
"[USR] Ecco come individuare i delinquenti da espellere, dato che il decreto prevede giuste conseguenze per questa categoria di immigrati.... altro che anima e anima",0
"Roma città – Chiusura campo rom posticipata, si tenta il dialogo - Cittaceleste.it #Roma [URL]",0
[USR] Gli italiani muoiono di fame i Rom no portateli ha casa tua,1
"A quanto pare, il corano, oltre che in bagno si può usare anche per questo. Ma pare non funzioni molto bene..... [URL]",1
"ROBERTO SAVIANO dichiara ad una radio francese: ""Centomila immigrati all'anno, non sono un'invasione, sono un dono Se ne è così tanto convinto li accolga a casa sua, gli Italiani sono stufi di accogliere e mantenere finti profughi. #chiudiamoiporti #stopinvasione #iostoconSalvini",1
[USR] Se non si rimboccano le maniche per lavorare nel loro paese e per promuoverne lo sviluppo la loro situazione non cambierà mai. #migranti #portichiusi,0
Una dedica al ministro lussemburghese. È a conoscenza del fatto che il Lussemburgo negli anni '30 e '40 abbia chiuso le porte agli ebrei in fuga dalle persecuzioni e dalle leggi razziali? Non deve quindi permettersi di farci la predica. #iostoconsalvini #complicidisalvini,0
"Se al posto di due rom avessero messo in gabbia un cagnolino, le due dipendenti della Lidl di Follonica sarebbero... [URL]",0
"Il prete pro migranti spara: «Indagato perché accolgo». E' stato segnalato al Garante della privacy per aver diffuso le immagini dei richiedenti asilo in acqua senza il loro consenso. Molto probabilmente, a lamentarsi sono stati gli stessi stranieri. [URL]",0
No no no prima di Voi ci sono i Migranti del cazzo che non hanno un mestiere non sanno fare niente e  che dobbiamo mantenere. Questa favola deve finire...Voi ? Zitti e al freddo. 5 mld che abbiamo speso sono per questi Estranei solo x loro,1
[USR] Italia paese di campanili? Ma anche (direbbe Veltroni) di campacavallo (quello Rai campa di canone) di camparomclandestinislami,0
"Il sindaco Beppe Sala si ravvede? I migranti africani ignoranti e non lavorano. La sinistra ha sbagliato tutto"" - Riscatto Nazionale [URL]",1
"[USR]  puoi anche attivare la vibrazione, infilartelo nel culo e andare a fare in culo insieme ai tuoi amici migranti",1
"Gli islamici non sopportano manco Peppa Pig. Manco io,ma per altri motivi. Gli islamici, francamente, avrebbero anche rotto i coglioni",1
Ma come è possibile? [USR] Ah capito al sud migranti al nord polizia ordine etc non siamo il cesso di nessuno noi siciliani  [USR] [USR] [USR] [USR] [USR] [USR] [USR] [USR] [USR] [USR] [URL],0
"[USR] [USR] la verità è che con questi immigrati  aumentata anche la delinquenza,da ora in avanti Salvini dovrebbe dire chi vuole venire in Italia deve dimostrare di avere un lavoro e almeno 20000 euro per sopperire alle prime necessità,casa ec. invece arrivano tutti miserabili da mantenere",1
"[USR] [USR] [USR] [USR] Gli africani, come tutti gli migranti, vanno aiutati ma a casa Loro! Io non mi abbassero' mai al loro modo di vivere lontano anni luce dal mio, troppo sottosviluppati!",0
"#Roma, studentessa cinese morta: condanna con patteggiamento per due rom [URL] [URL]",0
"Roma, la Prefettura ""toglie"" i migranti alla Croce Rossa - [URL] [URL]",0
"quando capiranno che  l'islam si fonda sulla violenza? é Maometto stesso che dice "" uccidete gli infedeli "". Le radici di una religione hanno una importanza fondamentale .",1
NN BISOGNA ASSOLUTAMENTE PERMETTERE QUESTO!!!SE OSIAMO FARLO NOI CRISTIANI O EBREI DI PREGARE PER LA NOSTRA FEDE  PER LE STRADE DEI PAESI MUSSULMANI CI TRUCIDANO!!!!,1
#l'ariachetira La polizia i controllori fermano solo italiani rom e immigrati non li avvicina nemmeno rischiano la vita,1
"Bisogna sia reato ,una multa solo se è "" beccato "" è una vergogna .Questo non essere reato alimenterà pedofili ,maniaci e immigrati ,verso lo stupro !!! Saranno capaci dopo la fase di eccitamento a fermarsi ???? Dubito",1
[USR] Per burioni siamo noi il pericolo per I migranti. Ossia noi trasmetteremo malattie ai negri. Difendiamo la loro salute. Non accettandone più e cacciamo tutti. Lo facciamo per il loro bene.,1
"[USR] tagliagolla in Libia, clandestini in Italia, guerra islamica alle nostre coste. Mattarella chiama Capitano Salvini!!",1
"[USR] Propongo a tutti i buonisti una tassa "" Pro immigrati "" volontaria dove attingere x l'accoglienza, case popolari, sanità, scuola ecc x i soli immigrati.  Noi cattivisti ci siamo rotti di pagare x questi parassiti",1
[USR] mai.... [USR] appoggiato sempre da [USR] se ne frega del popolo italiano....tutti pro clandestini rom iussoli,0
[USR] Il modello funzionante d'integrazione di Riace infastidisce chi vuol fare soltanto propaganda sui migranti. Mi fa piacere che la Cassazione abbia dato ragione a Mimmo Lucano.,0
[USR] E sarà sempre peggio. L'immigrazione serve anche a questo. Per risolvere tutti i problemi basta estirp… [URL],1
"Contro il terrorismo suicida c'è, alle volte, poco da fare. Contro chi lo rivendica, tutto #Hamas",0
basata immigrati in Italia basta,1
Possibile che dopo i fatti di Parigi il ns. Governo difenda ancora gli islamici. Forse per mera questione di voti?,1
[USR] [USR] ma quali profughi sono combattenti musulmani mandati per spacciare stuprare rubare sgozzare occupare e fanno tutto questo con la complicità dei castrati istituzionali di questa repubblica criminale,1
Centinaia soccorsi a largo della Libia in 3 giorni - [URL] -                         Oltre 120 migranti ... #Ticino,0
[USR]  [USR]  non tutti gli islamici sono terroristi ma tutti i terroristi sono islamici #OrianaFallaci,1
"[USR] [USR] Mi scusi il msg ló indirizzato a chi ha detto che l'Italia,vive grazie ai migranti.. E rinnovo l'invito di andare a....",0
[USR] mi scusi ma per farci governare dallo straniero cosa sono morti a fare i nostri avi?,1
"Questi che facevano venire i terroristi con i barconi chi se li prende a casa? Non ci sono più magliette rosse in giro? ""Morire nel nome di Allah"" Arresti tra Palermo e Trapani [URL]",0
"Il sindaco di Riace: ""mi contestano il reato di umanità"" . Se l'umanità consiste nel favorire l'immigrazione clandestina, che in Italia è reato e sostenere in modo fraudolento la sostituzione etnica, il sindaco di Riace, citato come modello dalla sinistra, deve finire in galera.",0
"Tanto a #Roma ci pensano i #rom a svuotare i cassonetti, giusto #Virginia?... [URL]",0
[USR] [USR] [USR] [USR] [USR] Christians for Riad and Iran? for them Christians are terrorists! this shows that Islam shariah is a form of Mecca Satanism Kaaba [URL] i cristiani in Riad e Iran? per loro i cristiani sono i terroristi! questo dimostra che Islam è una forma di satanismo,1
Il caso di Salvini e Di Maio può avere diverse spiegazioni: 1) sono venduti a una potenza straniera e pagati per distruggere il paese 2) sono masochisti 3) sono sadici 4) sono sadomasochisti 5) hanno pulsioni suicide 6) hanno avuto gravi problemi da piccoli  7) sono imbecilli,0
#Siria🇸🇾 🎄Siriani in festa a #Natale  in tutte le città siriana liberate dai terroristi ma per il Tg1 Niente Celebrazioni Chiese vuote e Niente Festa! L’unica cosa che non c’è é la vostra coscienza!#Natalesiriano #SiriaVive [URL],0
"Il TGPuglia dovreste guardarlo tutti: ogni giorno strutture fatiscenti occupate da disperati africani o rom, un degrado da quarto mondo.",0
"🇮🇹 NUMERI 🇮🇹  #Migrante in difficoltà ▪️35€ al giorno = 1.085€ al mese   EUROPA : OK   #Italiano in difficoltà ▪️700 € al mese - Lavoro sociale  EUROPA : NO, cavallette, fame e carestia.  Ora, chi non comprende la spinta alla sostituzione etnica la subirà.  #WhiteGenocide",1
"[USR] [USR] [USR] [USR] Io invece sostengo che le religioni, tutte, indistintamente, sono deleterie e ostacolano da sempre il progresso scientifico e filosofico. Il dogma è una prigione per la mente, da qualunque parte venga. E i dogmi dell' Islam, perchè vogliamo negarlo, sono i più rigidi in assoluto.",0
[USR] [USR] [USR] [USR] [USR] un certo Adolf sarebbe utile ancora oggi con certi soggetti.. non dico altro!,1
I migranti ci prendono per il culo perché noi glielio permettiamo ! Facciamola finita una volta per tutti !,1
"Il Papa a Milano, ecco l'agenda ora per ora: l'incontro con rom, islamici e immigrati poi la maximessa [URL]",0
[USR] Fratello ??? Un Imam ??? Quindi anche Maometto?! Colui che a sterminato popoli per imporre il pacifico Islam ??? [URL],1
[USR] #LONDRA #Westminster per quanto tempo dobbiamo sopportare di morire prima di cacciare a calci in cu:o i musulmani?,1
"#dallavostraparte vitalizio, rom,negri, delinquenti.Tagliamo tutto questo marciume,così riusciamo a vivere tutti.Gli fa schifo?",1
[USR] Eliminare islam e islamici dall' italia ...questa merda nn la vogliamo tra i piedi ..Nn abbiamo niente in comune ...stanno benissimo dove stanno,1
"Sono nauseato dal FINTO buonismo e dalla FINTA carità di una FINTA #SINISTRA imitatrice della peggiore #destra. Non fate bene a NESSUNO, nè ai #migranti né agli #Italiani . Siete ASSOLUTAMENTE INUTILI. Acari nelle vostre #poltrone #rosse. #SeLoDiciamoLoFacciamo  #SeaWacht3 #M5s",0
va buttato nei fossi dopo averlo marzagrato di botte ...tanto il giudce li darà i domiciliari --al rom... [URL],1
#tradizione e modernità alla giornata internazionale di rom e sinti #BuongiornoRegione [USR] [USR] [URL],0
[USR] Mentana segue la corrente è giusto contravvenire la legge? Se il sindaco di Riace ha ancora bisogno dei contributi dei migranti dove sono i guadagni di tutte le attività messe in funzione dal sistema Riace ?,0
Di questo passo segnaleranno un campo rom davanti San Pietro...�� [URL],0
"[USR] [USR] La maggioranza dei migranti sono di fede musulmana. La loro religione non ammette altri ""partiti politici"" se non quelli di ISPIRAZIONE ISLAMICA. Lo sanno i khmer-italici questo??? Perchè stranamente vedo sempre ""bandiere rosse"" dietro di loro, e gli fanno cantare ""O BELLA CIAO""",1
"Roma, Politi: «La Raggi pensa ai rom e ai vegani e dimentica famiglie e periferie» - [URL] [URL]",0
"Nonostante i gravi problemi con Rom, zingari e immigrati, leggo comunistelli e anarchici fare gli spiritosi ..penseremo presto anche a voi!!",1
"Qui in Europa avremmo bisogno di un Milosevic per fare una pulizia etnica con i musulmani, lo avevamo ma il buon vecchio Clinton lo processò",1
"#Salvini Col Bastone , il premier #Conte Con la Carota. #LeGa e #M5s due facce ...una Sola medaglia . Mai visto nulla di più meschino, ipocrita e falso. Una Lotta contro i poveri. #decretoSalvini #DecretoSalvinimmerda #salvinimmerda #DecretoRazzista #immigrati #razzismo #Fico",0
"[USR] [USR] l'Italia è fallita sn rimasti solo i ladri MALEDETTI governanti, clandestini e rom i giovani stanno espatriando",1
[USR] Gli immigrati in italia vivono a gratis mantenuti.. da italiani perseguitati da tasse da usura.,1
"RT Corriere ""Da Lecco alla Siria col figlio piccolo per sposare un terrorista dell’Isis [URL] … [URL]",0
Senza biglietto: nigeriana prende a testate e pugni capotreno [URL],0
[USR] conosco bene rom avendo fatto servizio nell'arma..il problema non sono loro ma chi gli permette tutto ciò,0
"Roma, stupro al campo rom: condanna a 7 anni. Il giudice ordina la bonifica [URL]",0
[USR] [USR] Se non fermiamo i mussulmani sarà la nostra fine ...,1
"Si dobbiamo riprenderci la Sovranità maldestramente ceduta ad un'Europa che è già lardellata di islam ( V. Parigi v. lo stupro di massa in Germania a Colonia nel 2015 etc). Cedendo la sovranità, ma doveva essere consultato il Popolo, hanno reso vulnerabile anche la Costituzione.",0
"Io chiederei uno x uno agli #immigrati che sui mezzi pubblici si lamentano degli italiani e dell' #italia,cosa ci fanno esattamente qui?",1
[USR] tutti i campi profughi in MO fate blitz teste cuoio e fate sparire tutti i veli stesi ad asciugare e non fatene fornirne piu',1
"[USR] IO aspetto che Tu arrivi anche qui da noi, basta business immigrati con l'aiuto della #sinistraladrona #€urolandia",1
[USR] [USR] Ma perchè essendo quasi tutti musulmani non emigrano nei ricchi paesi del Golfo Persico? #DiMartedì,0
Gesù si che lo faceva bene l'immigrato. Come Cristo comanda. [URL],0
"[USR] [USR] [USR] [USR] [USR] [USR] [USR] [USR] [USR] [USR] [USR] [USR] [USR] l’islam respinge i principi della separazione tra Stato e religione, la democrazia e la sovranità popolare; respinge altresì la equivalenza di ogni e qualsiasi religione e la loro indiscutibile sottomissione e subordinazione alla Autorità dello Stato; esclude l'autodeterminazione",0
"Oltre gli stereotipi e i luoghi comuni, sentiamo dalle loro voci come vivono nei campi e nella società due ragazzine rom di Roma #NemoRai2",0
"#rom sono nomadi , perché devono sostare e proprio in Italia? Il problema che chi ruba nel loro paese gli tagliano le palle #QuintaColonna",1
"[USR] [USR] Questa gioventù buonista, quando gli stranieri ci avranno superato di numero e sottomessi, saranno i primi a piangere e scappare! Mi auguro invece che a pensarla diversamente siamo un numero altamente superiore!",1
"[USR] abbiamo finti profughi e veri spacciatori, occorre tagliare il fiume di denaro sprecato per il loro mantenimento e rimpatriarli al più presto [URL]",1
per avere i soldi.... e poi uno non deve essere razzista ... ma andate a fare in culo immigrati di merda!!!!,1
"ITALIA | Allarme povertà, al Sud più italiani che stranieri nei centri Caritas [URL]",0
"[USR] trw rom rovistavano nella spazzatura alla lidl, tre dipendenti le hanno chiuse in una gabbia e riempite di commenti razzisti",0
"Viktor Orban (Premier ungherese):  ""Come si risolve il problema dei migranti? E molto srmplice. Non li si fa più entrare e chi è qui, lo si rimanda a casa"".",1
"In romania 200mila in piazza x protestar contro corruzione..In Italia 4 gov non eletti, disoccupazione, immigrazione e tasse al max, nulla 😈",0
In Svizzera chi tocca un agente finisce in cella: in Italia se migrante picchia un agente torna in hotel |... [URL],0
"Si arresta l'umanità, ai domiciliari il sindaco di Riace Mimmo Lucano simbolo di accoglienza e integrazione dei migranti [URL]",0
"Business immigrati Tanti ci guadagnano:  Le ONG che trasportano, Le Coop che ospitano, il caporalato, a breve l'industria con mano d'opera a basso costo, i Sindacati che da loro possono ripartire a vendere tessere, i partiti pro immigrazione che prenderanno i loro voti.",0
non sono un terrorista.... sto cercando ....la via.... per vivere bene....tutti....,0
[USR]  Ho sempre ragione amica mia.A presto e lascia perdere la citta' dei Polentoni immigrati meridionali.Roma impera,1
ROMA - È accaduto oggi nelle vicinanze del Pantheon.  L'uomo è un mendicante rom che frequenta la zona. [URL],0
