text,label
...e dopo decenni d'invasioni di musulmani -clandestini- Europa ne ospita a sufficienza per poter sferrare attacchi a difesa avanzata #ISIS.,1
"L’invasione migratoria è un “Cavallo di Troia”. L’Europa  e  la politica di sinistra  ,non credono alle Cassandre,per questo avverrà la fine del vecchio continente  a favore degli africani  e dell’Islam..",1
"Venezia, condannata la prof delle frasi razziste [URL] di [USR] MIGRANTI CI UCCIDONO E SONO FUORI NOI LO DICIAMO E CI PUNISCONO,CHE CAZZO DI LEGGE E' QUESTA...",1
La fisionomia dell'immigrazione della comunità islamica è cambiata in questi anni #aicds,0
Lavoro: il velo islamico si puo' vietare (Italia Oggi) [URL],0
"[USR] credo che faremo la fine,Usa,della francia,del belgio, dove questi immigrati si rivolteranno con le armi contro chi li ha accolti",1
"tutto st'affanno sul web poi mannaggia la madonna al massimo grandi marce e paura di perdere gli appalti per le vostre cooperative che gestiscono migranti. davero porco dio, qualcuno alzi la mano per dire ""i famosi 35 euro sono parte del mio stipendio"", alzate la mano, forza.",0
Senza studenti stranieri in Italia molte scuole chiuderebbero i battenti ed i docenti ecc perderebbero il... [URL],0
#londonattack chiedete ai buonisti del cavolo cosa vogliono fare con i islamici perché io se chiedo mi vengono solo insulti sulla bocca,1
[USR] [USR] Perdiamo i giovani prendiamo il futuro. Saremo invasi da terroristi islamici. Tutti con cinture esplosive.,1
su rai due 😱 emma bonino😱 i migranti fanno lavori che gli italiani non vogliono fare😱,0
"ONG I volontari insegnano ai migranti come recitare la parte delle vittime, come inventare storie strappalacrime e come recitare preghiere, un vero e proprio vademecum per ingannare gli agenti di frontiera   [URL] di [USR]",1
[USR] Ci hai rotto le palle con questa storia degli immigrati! Se hai le palle manda a casa quelli che sono già qui altrimenti muto. Come tutti gli altri. E soprattutto come quel coglione di [USR] che da ministro ne imbarcò una milionata|,1
"De Rossi,Rettore [USR] #migrazione è anche problema di inclusione:necessario aiutare migranti in inserimento… [URL]",0
"Viaggio da incubo nella stiva della Blue Sky, il racconto dei profughi trasferiti a Milano [URL] BASTA IMMIGRATI!!!",1
L'obbligo vaccinale e i bambini stranieri — BUTAC - Bufale un tanto al chilo [URL],0
Rugantina Rosetta Minù Hermes ed Indio TIVOLI ROMA RUGANTINA proviene dall'ex campo rom di Stacchini Tiv [URL],0
[USR] un criminale terrorista a piede libero. E' arrivato in italia via mare come tutti gli immigrati che ci stanno invadendo.,1
#QUINTA COLONNA - Diretta e ospiti affrontato il tema dei migranti dopo gli eventi di Sesto Fiorentino ... [URL],0
"Bellissimo! Roma: banda di rom gli chiedeva il pizzo da 2 anni, ristoratore esausto li uccide a colpi di mitra - [URL]",1
"[USR] [USR] Sara, anche tu a quest'ora pregavi china verso la Mecca 5 volte al dì se nella storia (cerca Vienna 1683) non si fosse ABBATTUTO il tentativo di conquista dei musulmani alle porte dell'Europa... Il vero nemico è l'Islam #stopislam",1
[USR] Stop a clandestini e fint8 migranti bambini non autorizzati! [URL],1
"Napoli, l'appello di de Magistris: «Pronti ad accogliere i migranti di Open Arms».E COME FAI..NN PUOI.. ON QUALE AUTORITÀ.PORTI A CASA NOSTRA STUPRATORI,ASSASSINI, E [URL] TI FAREI ARRESTARE.PER AVER FATTO ENTRARE CLADESTINI.E UN REATO E TU LO SAI BENISSIMO",1
Rinchiudono 2 nomadi nel gabbiotto Denunciati tre addetti della Lidl (Corriere Adriatico) [URL] [URL],0
"Stanno arrivando i migranti che uccidono i cristiani. Faccia attenzione il caro Renzi, perché in Italia di cristiani ce n'è più di qualcuno.",1
[USR] [USR] anche nel Canada di Justin Trudeau immigrati musulmani in abbondanza peggio dell'UE unica difesa Trump reggerà?,0
"#Libero: ""Dieci milioni di euro buttati per i rom. Schiaffo all'Italia: guardate questi numeri [URL]",1
Trecento migranti alla Bestat? [URL] via [USR],0
I bambini migranti che vivono per strada e si prostituiscono in Italia  [URL] [USR] [USR],0
La speranza è una sola per migrantiIl guadagno..Tutti li la speranza ..fate una grande pena. ANZICHÉ PENSARE AI NOSTRI GIOVANI UMILIATI.. CARO SIMONE [URL],1
"La Francia controlla, deruba e impoverisce 14 Stati africani: [URL]",0
"A proposito di immigrazione e sviluppi, Oliviero Forti [USR] [URL]",0
"[USR] Questo dovrebbe farci capire, qualora ce ne fosse bisogno, che loro(l’Islam) non cedono di un millimetro. In Italia invocano la libertà di religione, di pensiero, ecc.. Tutte balle. Quando avranno i numeri giusti vedremo se non ci integriamo noi a loro cosa ci fanno. #poverinoi",1
[USR] [USR] I rom devono convincersi che è un bene per loro mandare sempre a scuola i bambini.,0
"[USR] Poveri noi davvero! In Italia lascerei solo Clandestini e rom,Italiani onesti....viaaaaaa tutti! Sarei curiosa di vedere",0
"[USR] vero, voleva porre un freno anche all'esodo di insegnanti meridionali al nord. E nutre una certa simpatia per i rom.",0
[USR] [USR] [USR] [USR] [USR] [USR] [USR] [USR] [USR] [USR] [USR] [USR] noi Italiani dobbiamo uscire da UE questa fasulla Unione Europea serve solo x portarci via venti milioni di € annui iniziamo ad espellere anche noi tutti gli stranieri che non hanno lavoro e insieme loro anche la vecchia politica che ci ha ridotti cosi,1
Il #GlobalCompactforMigration è talmente NON VINCOLANTE che tutti gli immigrati clandestini e islamici sono favorevoli.,0
"Non esiste l' invasione dei migranti.  In Italia ci sono 500 o 600 mila clandestini se fossero regolarizzati ci renderemmo conto che aiutano il paese, pagano i contribuiti e fanno bene all'economia. [USR]  #cartabianca [URL]",0
Deportiamo 2 miliardi di Africani in Italia e diamogli il reddito di cittadinanza ed il gioco è fatto...! [URL],1
L'alternativa era un nuovo mega-centro profughi. Bene così! [URL],0
"La flessibilità è stata negoziata per l’emergenza migranti, quando era emergenza vera e l’Italia aveva bisogno di fondi per affrontarla. Poi grazie a Minniti gli sbarchi sono diminuiti drasticamente. Esattamente cosa non comprende #Salvini? [URL]",0
"[USR] Hanno rotto i coglioni. Scafisti , ONG, Comunisti Infami ,  Buonisti e migranti invasori.  E Chiesa..",1
IL POPOLO DICE BASTA!  -Cittadini e militanti a difesa della legalità per dire NO al mercatino abusivo dei rom a... [URL],0
"Capodanno a Milano, festa blindata con metal detector e smartphone antiterrorismo [URL] via [USR]",0
Quando  ci  avranno  sommersi  da  immigrati e  zavorrati da  austerità UE (cioè ora)  ci  diranno  che  il  welfare  è  insostenibile..e  puff  non  avremo  più nè  sanità nè  pensioni. Ci  lasceranno  soli  a  scannarci  coi  neri,1
Oggi #PapaFrancesco è eroe perché odia #Salvini sui #migranti o è maledetto perché è contrario all'#aborto?  Fatemi sapere così mi organizzo mattinata e scritti. Intanto bevo un caffè. ? #Immigrati #Immigrazione #CongressoDelleFamiglie #Verona #FamilyDay #LucaMarfé #Roma [URL],0
"Bilancio Ue, scontro Renzi - Orban «L’Italia non è salvadanaio dell’Ue Sui migranti stessi oneri e onori»   [URL]",0
"Qui nell'hinterland m.se siamo alla follia, posti di blocco dovunque, scene d'apocalisse zombie, rom inseguiti nei parchi #papamilano2017",0
Se la storia dell'umanità fosse 1 Km. non saremmo piú  (tutti) nomadi da 23 cm. #DarwinDay Accademia di Brera 6 - 11 febbraio.,0
"[USR] CHIAMASI VIOLENZA ISLAMICA. PERCHE' NON UTILIZZI I TERMINI ADATTI PER DEFINIRE QUESTA STRAGE DI CRISTIANI INNOCENTI? L'ISLAM E' VIOLENZA, L'ISLAM E' CRIMINE. RIPETILO CON NOI AD ALTA VOCE. CONDANNA QUELLA SETTA DI PAZZI ASSASSINI. ALTRIMENTI DIMETTITI E PASSA CON QUELLI",1
Atleti derubati alla maratona Roma-Ostia: le borse ritrovate nel campo rom [URL] #Roma #News #Notizie,0
No alla strumentalizzazione sul corpo di Desirèe! scrivono i sostenitori di una immigrazione incontrollata e senza regole che ne ha causato la morte.  Fate schifo alla merda.,1
"Meglio la guerra per fare pulizia,estirpare l'islam e politici filo islamici-pro invasione. [URL]",1
"#Libero: ""La colombiana li becca a rubare in metro. Orrore a Roma: come la riducono i rom [URL]",0
[USR] Avete rotto il cazzo! Con la scusa delle donne e bambini ogni volta e la stessa canzone li facciamo sbarcare poi tra 2/3 giorni un altro carico di #migranti e pronto per rompere il cazzo ma andate fanculo ma basta l'Europa non è solo l'Italia Basta! #portichiusi,1
"Milano, i Carabineri nel campo rom di Via Negrotto: trovata un'auto rubata [URL]",0
"Roma, Schiuma (NcS): «Tre famiglie italiane mandate in un campo nomadi» [URL]",0
"Mi son rotto i coglioni di sentire che l'immigrazione non è un'emergenza. Davanti a ogni negozio c'è un molestatore, in ogni piazza spacciano decine di migranti, due o tre quartieri di ogni città sono inaccessibili alla popolazione italiana. Ma dove cazzo vivete? #lariachetirala7",1
"Massima diffusione. Siamo ancora in tempo perché sono pochi. Cacciamoli tutti questi terroristi prima che sia troppo tardi. Al ritmo attuale , fra poco NON SI POTRÀ PIÙ FARE NULLA X SALVARCI DA STI BARBARI PAZZI INVASATI [URL]",1
"[USR] hanno strumentalizzato tutto, rendendo tutto pro o contro immigrazione. Che tristezza",0
"Per gli appalti in campi nomadi di Roma, 13 rinviati giudizio [URL] #Brevi Cagliaripad",0
"[USR] [USR] e già l'Islam è moderato e vuole la pace, peccato che tutti i terroristi siano musulmani",1
5.600 migranti soccorsi in un giorno [URL] via [USR] Chiamateli pure #clandestini.,0
[USR] [USR] [USR] E i tunisini alla Marzuk dove li metti? Algerini meno. Albanesi e rom se la cavano bene W Italia!,0
"[USR] Il ""pubico"" di Renzi sono topi voltagabbana rom islamici ebrei Confinbanche Genitalici di ogni arte ma tutti di una parte (€)",0
"La vergogna degli immigrati sull'autobus:fin dove si spingono   Africani sul bus senza pagare.""Scendete"".Loro?prendono in ostaggio i passeggeri   Ora i passeggeri devono denunciare gli extracomunitari per”sequestro di persona”e costituirsi”parte civile”  [URL] [URL]",1
"[USR] [USR] ben detto . Glielo  l'ho già scritto la Sindaca di Roma , gli immigrati li porti a casa sua. Ciao.",1
"Far West Roma: autobus assaltato nei pressi del campo nomadi, sassaiola frantuma i finestrini [URL] via [USR]",0
L'Italia approva la legge che vieta il respingimento dei minori stranieri non accompagnati - TPI [URL],0
"#Milano nomade incinta rischia di partorire nellappartamento svaligiato #Milano, #nomade #incinta #rischia #di ... [URL]",0
Retata di centri sociali: occupavano case popolari e le affittavano a immigrati [URL],0
[URL]  islamici qui in italia fanno figli perche' sono dei mantenuti dai comuni cosa che per ITALIANI non e' proprio cosi',1
"Giappone: tutti hanno un lavoro, perché non ci sono immigrati [URL]",0
Senti ganzi a Gaiole in Chianti: hanno ospitato i sedicenti profughi di San Giusto a Rentennano a fare la... [URL],0
[USR] ... per profughi economici esplosione #€urolager vogliono essere zattera raccatta tutto?,1
"Roma, studentessa cinese morta: i rom non andranno in carcere [URL] [URL]",0
Rapporto [USR] [USR] In Italia oltre 5 milioni di stranieri residenti. In aumento i nuovi cittadini. Ma il problema non sono i numeri: in 12 anni i riferimenti all’immigrazione nei Tg sono aumentati di oltre 10 volte. [URL],0
"#Arezzo  Dopo 38 furti, dormiva sul posto di lavoro spara e uccide il ladro. Veniamo derubati aggrediti e uccisi continuamente da sedicenti #migranti criminali, lo Stato latita e nn ci difende.  Onore e stima a questo uomo. E che gli venga data una medaglia. #leggitimadifesa",1
"Le rom se stavano rovistando nei rifiuti, come tanti poveri, non sono da rinchiudere ma da aiutare. Non è furto ma povertà. Forza #Lidl",0
Ed ecco quanto anticipato 6 mesi fa: nasce #denk partito filo-islamico che ha preso 7% in Olanda. Sharia 4 all teste di cazzo terzomondiste.,1
"Comunque, se ancora confondiamo la difesa dei confini e la ""illegal immigration"" con i visti turistici tanto vale parlare di gattini #Trump",0
"Aversa – Rapina in casa: ferito alla gola un ex consigliere, arrestata una rom 22enne - LineaPress.it [URL]",0
"#Malta benzina e bussole per dirottare #migranti in #Italia #GuardiaCostiera maltese intercetta barcone e fornisce acqua e giubbotti di salvataggio. #Salvini: ""Atto ostile""  #EUROPA COSA? Questi sarebbero i nostri alleati? Sono NEMICI della peggior specie! [URL]",0
Profezia. Hanno escluso i rom - cittadini italiani - dal reddito di cittadinanza perché è insostenibile e se lo vogliono far bocciare per discriminazione etnica dalla Corte Costituzionale. Per poi attivare la... [URL],0
"Se importi masse straniere, queste tendono al controllo del territorio in conflitto con noi. Prima, il principio di sovranità garantiva la pace: ad ogni popolo il suo territorio. Ma l'élite vuole omologare tutto, e lo combatte. Non la nazione, l'élite ci sta portando alla guerra.",0
"Quindi il problema della Calabria sono gli immigrati di Riace. A Palermo, invece, è il traffico #MimmoLucano",0
"Forza ragazzi,180mila clandestini all'anno,rom da tutte le parti, illegalità totale, Coop rosse e bianche che lucrano.ora sapete cosa votare",0
Il banco di prova della #democrazia sta nell'indifferenza o partecipazione dei cittadini. La storia si ripete #immigrationban #Trump,0
"[USR] [USR] L'unico diritto che hanno i migranti illegali è quello di essere rimpatriati con urgenza, ma a cosa stanno aspettando...",1
L'inclusione ROM? Siamo ancora lontani...  [URL]  #rom #società #Raggi #Roma,0
"Immigrazione e Lega. Non vogliono modificare Dublino, non chiedono ai paesi dell'Est di prendersi più migranti, non portano un testo di proposte sull'immigrazione a Salisburgo.  Ma in fondo che se ne fanno di un problema risolto? A loro il problema serve",0
"Serata #TorreMaura a #Capalbio. Con Lilli-Myrta-Beppe (ciuffi e frangette indignate) processo a ‘sti buzzurri de’ periferia. Fascisti! Razzisti! Ma il filippino Venancio ricorda: “Segnori, qui non avete voluto 50 migranti”. Silenzio, poi un urlo: “Provocatore! Versaci da bere!”",0
[USR] Cose da pazzi veramente! E poi si lamentano che non li vogliamo!!! Fancu..o l'islam e chi li ha fatti entrare!,1
[USR]  in 2o anni di africa non ho ancora conksciuto un mussulmano  moderato,1
[USR] x come dici te anche indagini sull‘ideologia degli estremisti islamici è illegittima,0
"Roma, maxi-rissa al campo rom durante il censimento del Comune. Raggi: torna legalità, se ne facciano una ragione [URL]",0
"[USR] oltre alle carceri, mandare tutti gli stranieri a scontare le pene a casa loro!! Si svuoteranno già del %",1
"[USR] Ad oggi, non ho visto una sola associazione di questo tipo fare davvero filantropia.  Spacciano per solidale ciò a loro strumentale. Esempio: la fondazione #Clinton anni fa distribuì gratuitamente vaccini a donne africane contro l'epatite B. Risultato?  Tutte sterili. #Filantropi",0
Ho visto due rom che lavavano i vetri alla loro macchina... Alla fine si son messi a litigare su chi dovesse pagare l'altro #truestory,0
[USR] [USR] pensiamo all'Italia invece di difendere i musulmani che sono i ns nemici,1
"[USR] Girare per Roma sta diventando deprimente, barboni, nomadi ed immigrati ovunque, la città a pezzi. [USR]",0
[USR] [USR] bella domanda . Politica parla di islam moderato che non esiste . Musulmani andrebbero deportato tutti,1
"#piazzapulita per me ogni discorso è ormai inutile, ogni ragionamento una perdita di tempo. Non ne ho più voglia.  Da oggi dirò solo che gli #immigrati mi hanno rotto il cazzo. Non solo i #clandestini , ma tutti gli immigrati.   E tutti i pro-immigrati. Mi avete rotto il cazzo.",1
[USR] [USR] Sabri i Milanesi si svegliano tanto quanto i Torinesi i Romani e qualsiasi altra città islamizzata !,1
"#Roma Arriva a Roma Tracing Bus, la cabina telefonica mobile per i migranti [URL] [URL]",0
"Nero, cristiano, anti-islam: chi è Ben Carson nella squadra di Trump alla Casa Bianca [URL]",0
"Migranti, a Calizzano bus separati per residenti e profughi: ""Come l'apartheid"" - Il Fatto… [URL]",0
L'Europa aiuterà l'Italia nel soccorso dei profughi che però dovranno restare da noi. Non era meglio fare da soli e lasciarli a loro?,1
"[USR] Forse la signora [USR] dimentica le stragi fatte a Nizza Berlino e Barcellona da terroristi che avevan preso a nolo dei furgoni..il Kalashnikov,grande arma,si tiene a casa legalmente col porto d'armi.Anzi bella idea mi ha dato Grazie mi sentirò più sicuro col nuovo mitra",1
"Alla marcia della pace appello per i profughi, precari e ambiente - Il Gazzettino [URL]",0
"#Strasburgo Per sconfiggere il terrorismo serve l’impegno di tutti. Basta con l’immigrazione incontrollata, occorre un presidio serrato del territorio e percorsi di integrazione fatti di doveri e non solo di diritti (St) [USR] [URL]",0
[USR] [USR] e molti arriveranno in Italia quale 1° punto di approdo.Cornuti e mazziati. Basta #Renzi #alfano stop #immigrazione,1
ORA BASTA BISOGNA URGENTEMENTE RISPEDIRE A CALCI IN CULO AI LORO PAESI QUESTE 💩💩💩SCHIFOSE!! Migranti in rivolta devastano centro rimpatri: feriti carabinieri | Vvox [URL] via,1
Peccato e misericordia nel Corano [URL],0
Boom di spese per i migranti Ci costano più della manovra [URL] [URL],0
"Giovani e tanta allegria a sfilata Pride Palermo. Orlando apre corteo accanto a ''migrante'', attenti a fascismo | #ANSA [URL]",0
"[USR] [USR] Sicuro, proprio come Sarri a Napoli. Ma con tanti stranieri anche lui ��",0
"Si scopre con prove certe che #Soros paga piddini per far politiche pro immigrazione.La #Bonino lo CONFESSA.Associazioni criminali ci fanno i miliardi.#Fico, #Mattarella e il #papa fanno propaganda.E io sarei complottista perché vedo Soros dietro di loro?MA ANDATE AFFANCULO!",0
[USR] [USR] [USR] [USR] Rimandate tutti i migranti a casa loro.,1
"Strage nel nome dell'islam. Tutti a morte, tutti bruciati stì islamici di merda, nessuna pietà, basta",1
"Vietato scrivere \""lesbica\"" o \""musulmano\"" sulla #Nutella.Capisco \""lesbica\"", ma \""musulmano\""ci sta bene...o forse si potrebbe scambiare per..?",1
"[USR] la violenza simbolica può fare molti più danni di qualche auto bruciata....i profughi, i rom non hanno l'assicurazione...",0
"#Monfalcone (GO), Giunta di CDX sta scoprendo centinaia di irregolarità sugli #immigrati:dai negozi etnici non in regola,alle""residenze di comodo""per percepire illegalmente sostegno al #reddito e altre forme di aiuti economici. Rubano agli #italiani.",1
Pisapia vuole in Italia migranti arabi e famiglie gay. Quando in Italia comanderanno i musulmani sarà ancora possibile per i gay stare qui?,1
Leader africano a immigrati: “Dovete tornare a casa” [URL],0
[USR] setta di odio  oppressione soprusi violenza morte [USR]  la sua illegalità in Occidente [URL],1
[USR] Solo in Italia gli immigrati  quasi tutti clandestini manifestano contro il governo e contro un nostro ministro della repubblica Con la complicità di una sinistra estrema sorretta da 4 falliti. SCHIFOSI,0
2006-2013 immobilismo totale. Poi i primi #migranti occupano ex villaggio olimpico: ieri sera disordini. Ignavia della politica #Torino,0
"#piazzapulita  #Riace che lascia che i suoi giovani ""migrino"" per sostituirli con ""#migranti"", ai quali insegna un lavoro, ma il rapporto costi/benefici è sempre negativo, difatti stampa una propria moneta in attesa del rimborso UE, non è un modello, è un pessimo esempio!",0
"Presi dopo otto colpi, la banda dei ladri bambini di una famiglia di nomadi [URL]",0
"[USR] Finto ministro dei trasporti, che ne dici se facciamo qualcosa per quei poveri ""disgraziati"" bloccati al freddo e al gelo sull'autostrada del Brennero? Anche quello è colpa dei migranti e della #SeaWatch3 ??? Siete ridicoli, oltre che la rovina del paese...",0
#agorarai corsie preferenziali per le case popolari ai rom. Saranno contenti tutti gli altri senza casa italiani,0
Filippi (Grecia) L'EBREA CONVERTITA DA PAOLO: [URL] tramite [USR],0
[USR] io non ve lo voglio ripetere piu':fate sparire tutti i veli da campi profughi e bomberdate di notte  le fabbriche di veli,1
[USR] Il #governo spieghi xchè #Italia importa e fa rimanere delinquenti di altri paesi.Forse quelli autoctoni nn bastano?#immigrazione,1
"#Merkel: ""L'#islam non è fonte di terrorismo. La #Ue deve accettare i rifugiati""...Infatti prima di fare stragi... [URL]",0
Bitonto dopo Gorino: gli abitanti impediscono l’arrivo di 27 migranti. E a San Giuliano di Puglia è polemica per i 5 [URL],0
No nn serve alcun speciale addestramento per fare molto male!Essenziale odio fanatico nel💖!Incitamento=terrorismo [URL],0
"#Pakistan| #Gay mitragliato durante un'esibizione di danza. Qui, gli ipocriti dell'#arcigay e del #PD, con 200 casi di ""#omofobia"" -come giornalini scolastici anti-#gender- dicono che ""l'#Italia è bigotta"" e che serve #diversità"". Incluso l'#Islam. #sharia [URL]",0
#Calais Iniziano gli scontri tra #migranti e polizia alla vigilia dello sgombero forzato: oltre 8.000 persone a ris… [URL],0
"[USR] [USR] [USR] Per quanto mi riguarda meglio così.Quali sono queste foto con gli 'ndranghetisti? Poi è meglio che non parli di foto, ce ne sono una marea di altri ""personaggi"". I clandestini devono andare via perchè sono Clandestini non migranti.",1
Sto entrando nella struttura in cui si trovano i #migranti scesi dalla #SeaWatch. Sono a terra adesso ma ancora non sono riusciti a vedere gli avvocati che possono difendere i loro diritti. Sono qui per accompagnare dentro le avvocate e capire di cosa hanno bisogno queste persone [URL],0
"#immigrazione ma ancora parliamo di Saviano? se lo lasciassimo perdere, darebbe i suoi giudizi, le sue sentenza da forcaiolo con falce e martello ante litteram e la sera sarebbe contento,lui solo, al riparo della scorta che lo stato gli concede. Bello, no?",0
SASSARI Amnesty International rapporto annuale a Sassari: Dai migranti alla tortura fino alla cultura dell'im... [URL],0
meningite - fatto TBC - fatto camion bomba - fatto avvelenare acqua - da fare #bastardislamici,1
"Roma, a scuola di borseggio sulla metro B: 7 nomadi arrestate, una di loro insegnava alle altre [URL] [USR]",0
"[USR] [USR] [USR] [USR] [USR] [USR] [USR] [USR] [USR] [USR] [USR] Se in questo paese non c’è più la libertà di augurare la stessa sorte che è toccata alle vittime stuprate da migranti che sono poi quelli difesi dalla signora Boldrini, allora è morta la libertà di parola di pensiero e di opinione perché non c’è stata nessuna offesa",1
"SIAMO STUFI DI MANTENERE FINTI PROFUGHI NEI CENTRI DI ACCOGLIENZA! CHI NON HA DIRITTO DI RIMANERE SIA RIMPATRIATO!  CHI ARRIVA IN ITALIA SENZA DOCUMENTI, VIOLANDO LA LEGGE E NON HA DIRITTO DI RIMANERE IN ITALIA NON PUO' CONTINUARE A ESSERE MANTENUTO DAGLI ITALIANI! #stopinvasione [URL]",1
"[USR] [USR] Stiamo importando solo clandestini,non sono ne migranti e ne rifugiati. E per lo più delinquenti senza scrupoli,sapendo che saranno impuniti per I loro reati. Complici le leggi internazionali,e la nostra magistratura.",1
Da oggi a Teheran è vietato portare a spasso il cane. Sembra uno scherzo vero? L'Islam è anche questo.  [URL],0
"Invasione islamica del Colosseo al grido “Allahu Akbar”: scoppia la bufera, Roma stuprata [URL] via [USR]",1
[USR] [USR] [USR] [USR] Leggi l'articolo prima di commentare. Campo/Campo Rom lo ha detto solo Salvini nel suo post. Lui parla di case abusive. E se non capite la chiusa dell'intervista non é colpa di Pif.,0
Amigi italiani perché  #SanFrancesco era povero e avere fatto santo e noi immigrati poveri odiare noi? Perché io no parlare con animali?,0
"Beh tutti sti musulmani che stanno via via togliendoci di mezzo, non portano certo modernità: fosse per loro saremm… [URL]",1
[USR] ma poi..... Demente.... Hai mai visto un islamico che ti dice... SI IO STO CON L ISIS. Sei più coglione di quanto pensassi,1
[USR] I migranti!!!,0
Roma Today: Stuprò 26enne al Prenestino: 7 anni di carcere al violentatore. Pm chiede bonifica del campo rom [URL] #roma,0
Penso che chi non vuole vedere che gli attentati terroristici sono motivati da volontà di sottomettersi tutti (islam) sia in malafede,1
"[USR] E se pensi,dici o scrivi che questi sciiti, islamici mussulmani sono dei bastardo merdosi che meritano di essere schiacciati nel frantoio, ti danno del razzista... ""COGLIONI QUELLI DELLA UE e Onu""",1
"I commenti sessisti che invocano allo stupro e alla morte della volontaria italiana rapita in Kenya, che i bisognosi li stava aiutando “a casa loro”, sono la prova che in Italia il problema non è l’immigrazione, ma il razzismo.",0
"[USR] La storia dice che il 10% di terroristi popoleranno l'Italia. Sti barconi saranno pieni di tutta la feccia islamica fuggita in Siria per non essere arrestata. Allora o noi o loro, decidi?",1
[USR] ricordo : terroristi e clandestini tutti a casa di Librandi e della Boldrini,1
"#LeolucaOrlandoCascio non solo ha sposato l'islam,ora si è messo dalla parte dei delinquenti.Ve lo dovete tenere fino alla fine del mandato.😱 Palermo, Orlando tutela i diritti dei criminali e non degli italiani. [URL]",1
"CINESAHEL - luci d’Africa a Ballarò 28, 29, 30 settembre – 5, 6, 7 ottobre 2018 [17 film realizzati dai più importanti registi africani, a Palermo] [URL]",0
Houston abbiamo un problema #Pd #DeLuca #Nigeriani #Campania,0
Non manda a scuola il figlio per fargli chiedere l’elemosina: rom arrestata – webitalia360 [URL] [URL],0
#Italia con #Renzi e #Alfano e ogni giorno di più piena di #campi #rom e #immigrati illegali con più diritto che un #cittadino #Italiano,1
Non è buonismo. Si hanno notizie di migranti messi in mezzo alla strada in tutta Italia. Chi viene lasciato senza alcuna risorsa è posto in condizione di fare qualunque cosa pur di sopravvivere. Ed é esattamente ciò su cui continuerà a speculare chi ha voluto il #DecretoSicurezza [URL],0
Business rom: nel mirino della Procura coop e politici [URL] via [USR],0
