text,label
"[USR] [USR] Perchè hai osato picchiarla PIRLA!!!!La prossima volta,passa prima dal bancomat, preleva una consistente somma e offrila spantaneamente,senza che si sforzi a ""rubarla"" alla ""rom"" di turno...solo così ti puoi ""fregiare"" dell'appellativo:ANTIRAZZISTA!!!!!",1
"Ungheria contro Renzi su migranti: “Quei soldi spettano a noi, non all’Italia” [URL]",0
"[URL]. MA I PIDIOTI NON ACCETTANO CHE I TERRORISTI ISLAMICI SIANO CHIAMATI FIGLI DI PUTTANA,... SI DEVE DIRE FIGLI DI BUONA DONNA !!!!!!",1
"Torino i rom lanciano sassi contro un'ambulanza del 118,i soccorritori costretti alla fuga. [URL]",0
Gli islamici devono adeguarsi alle tradizioni popolari e religiose dell'Italia!!! Non il contrario. [URL],1
Stasera a #QuintaColonna focus sulle conseguenze degli sgomberi nei campi #rom che stanno interessando varie parti d'Italia.,0
12.40 ROMA Ldl si dissocia e condanna il comportamento di due addetti di Follonica che hanno chiuso in gabbiotto due rom facendo video.,0
"repubblicait: Mahershala Ali, un musulmano afroamericano alla notte degli Oscar [URL]",0
"[USR] Chi non conosce l'Islam non può comprendere.  Ma stia tranquillo, neanche un miliardo e 700 milioni di musulmani comprendono l'Occidente.  E questo è un bene ☺",0
"[USR] Senta, accenda il cervello, per cortesia: quello che lei racconta è grave ma è del tutto eccezionale. I rom non vogliono lavorare, rubano e infastidiscono i passanti. Se lei li apprezza li prenda a casa sua.",1
"Roma, il refuso nella mail inviata ai Municipi per ""la regolamentazione delle popolazioni rom, sinti e Carminati"" [URL]",0
"[USR] [USR] quelli del ""possiamo"" fare qualcosa contro i cambiamenti climatici, sono gli stessi de""l'immigrazione e' un fenomeno inarrestabile"" e "" l'euro e i trattati europei"" sono irreversibili.   Capito? fenomeno sovrumano: possiamo intervenire fenomeni umani: possiamo solo subire",0
"In tre mesi abbiamo mostrato che gli sbarchi si potevano fermare, con il Decreto sull’immigrazione voglio dimostrare che anche la gestione dell'accoglienza e dei rimpatri si può e si deve cambiare. [URL]",0
"ALASSIOFUTURA: Recco - "" Pulizia di migranti anche in Italia "", i... [URL]",1
[USR] [USR] [USR] Ha sposato una di loro ...xcui è  abbastanza felice !!! Sinceramente se se ne vanno tutti a fanculo è  regalo gradito!!! Ci sono italiani ancora nei container ad amatrice e questi parlano ancora di migranti ....mi fate schifo tutti !! Buonismo di merda !!,1
"Altri #1500 in #Veneto.Nodo #profughi insostenibile.#Italia non riesce a uscire da #stagnazione,continua invasione aumenta #dissidiosociale!",1
#SIRIA Appello alla #Pace scritto dai #profughiSiriani in #Libano [URL] [URL],0
"Rula é il volto dell' islam impastato al progressismo occidentale..la negazione della verità, pericolosa mistificatrice #portaaporta",0
"Ayaan Hirsi Ali, eroina femminista che viene dall’Islam, su cosa unisce le patetiche femministe occidentali e i jihadisti. Care anime candide italiane che non leggete niente: fatevene una ragione [URL]",0
[USR] Basta chiedere!  Domani esercito in strada fermo x tutti u migranti chi non in regola portato subito in centri di esplulsione poi C130J e via verso ma loro casa!!!,1
Meno 3 giorni allo sfratto. Perché nascere in Italia è pura sfiga ormai per avere aiuti devi essere straniera.Rivoglio il Duce.,1
[USR] [USR] E' assolutamente falso! Solo gli stranieri regolari pagano contributi. Ma anche se fosse vero… [URL],0
"? Ieri a #TorreMaura protesta dei cittadini contro l'arrivo di 70 persone di etnia #rom. Cassonetti in fiamme e panini calpestati: ""Devono morire di fame"". La protesta continua anche oggi: ""Se ieri eravamo 300 - dicono - stasera saremo 3mila""   (foto: [USR]) [URL]",0
"ITALIA UNITA da SUD a NORD!Nemici non sono NAPOLETANI ne' LEGHISTI,ma questa orda Afroislamica che ci invade pagata… [URL]",1
"Genova, operazione della Guardia di Finanza al campo nomadi di Bolzaneto [URL]",0
"[USR] Voi invece con gli sgomberi cosa avete ottenuto? Ah già, avete messo i rom sotto casa delle persone. Vedasi a Baggio che prima non era invasa. VERGOGNA E RISOLVI I PROBLEMI CHE AVETE CREATO VOI",1
"Cara Sindaca, premi per chi assume ITALIANI no è? Roba da matti. Sti caxxo di finti profughi, sono diventati una vera e propria ossessione per tanti, troppi anti italiani. [URL]",0
"Gli spacciatori (finti migranti con il permesso umanitario e sovvenzionati dal contribuente italiano) devono essere messi al muro senza la minima pietà, vendono consapevolmente morte ai nostri ragazzi e la società ha il diritto e la giustificazione etica di condannarli a morte!",1
[USR] Bartolomè nessuno ti vieta di portarteli a casa... basta che non fate i grandi col culo degli altri... ci avete rotto le palle con questi migranti delinquenti... aiuta le povere famiglie italiane altro che negri...,1
Rubano le offerte davanti alla statua della Madonna: arresti nel campo rom [URL],0
Siamo tutti stranieri di qualcun altro! [URL],0
[USR] Ma chi ha voluto questa gente non ha pensato alla delinquenza ? Molte città sono al degrado non solo Roma perché non è mai stato fatto un percorso di integrazione ma solo mettiamoli nei centri e poi i cittadini si arrangiano a gestirseli.......grazie a chi ha voluto l’invasione,1
Como. Alta tensione al centro migranti. Tutto per sette cellulari rubati [USR] [URL],0
"Retweeted Ofcs Report ([USR]):  Il degrado della Capitale, a Roma i campi rom sono anche nei pressi delle... [URL]",0
Giovani Musulmani d'Italia - Perugia a Imprenditoria migrante per la sessione We Know About Business (WeKAB)... [URL],0
[USR] Che munnezz e paese siamo!!ma i rom non sono apolidi? E petche in italia stanziali,0
"[USR] [USR] Sò che e difficile ma ogni volta che succede una cosa del genere i genitori non mussulmani dovrebbero ritirare i bambini dall'asilo. Che si facciano asili separati per islsmici e non, loro sarebbero contenti e noi ancora di più",1
"[USR] Perugia: immigrati spaccano statua della Madonna, la prendono a calci e ci pisciano sopra [URL]",1
"#roma Campo rom, prostitute e niente servizi. Il dramma della Tiberina: ""Vivere così è insopportabile""… [URL]",0
Direttore Carita$ attacca Salvini: “Non conosce significato di profugo”. Loro lo sanno… [URL] [URL],0
"Forse loro non dovevano essere là, ma è inconcepibile chiamare uomini questi bastardi che hanno #sgozzato le due #ragazze ancora #vive, dopo inaudite #violenze.Questo è l'#Islam?Basta consentire il propagarsi di questa subcultura!#Combattiamo e #eliminiamolo come il #Nazismo [URL]",1
"[URL] di [USR] Veronesi choc sul governo: 'Sistema che uccide i migranti' Lo scrittore, che aveva appoggiato Saviano, all'attacco: ""Hanno creato una macchina da guerra per farli annegare""",0
"[USR] [USR] “Caro” Parenzo noi italiani onesti stiamo aspettando le scuse dei rom per tutti gli anziani truffati, menati e derubati, per l’inquinamento quando bruciano sostanze tossiche provenienti dal malaffare, quando saccheggiano gli appartamenti, quando spacciano...ma di che cazzo parli?",1
[USR] nulla. Non avrebbe fatto notizia. Come non fanno notizia le centinaia di furti commessi ogni giorni dai #rom,0
"[USR] Quando se ne va affanculo questo terrorista Islamico?! il suo partito ha perso, è il momento per lui di fare le valigie !",0
L’accordo fra Italia e Libia sui migranti [URL],0
"#roma ""Ottomila firme contro il campo rom a Roma Nord: #campidoglio ascolti territorio"" [URL] #notizie",0
[USR] com'e' la storia che i #migranti si ammalano quando arrivano in Italia? [URL]  #stopinvasione,1
"Trasferimento campo Rom, Forza Italia critica: «Più attenzione ai rom che ai cittadini» [URL] #Barletta #News #PugliaLink",0
Vergogna #alfano chiede controllare case e alberghi per #immigrati che #sbarcano in #Italia fuggendo dalle sue disgrazie. +Italia x Italiani,1
"[USR] 1di2...Ma è SCEMO, ARTERIOSCLEROTICO o cos'altro?!In questo modo sarebbero comperate dai FOTTUTI Islamici per farne delle moschee (il che sarebbe come dire dei covi di potenziali terroristi)!Per far tornare i fedeli in chiesa dovrebbe solo dimettersi e lasciare il posto",1
Noi siamo circondati dai nomadi che accendono i fuochi alla diossina tutti giorni!! Dov'è la legalità?? Maledetti!! #dallavostraparte,1
Immaginate per un attimo che si parli dell'autrice dell'attentato al #Bataclan. Considerereste etica una sua intervista? E la sua vita a piede libero? E il suo negare di esser terrorista? [URL],0
"Minori stranieri soli, via libera alla legge che ridisegna l'accoglienza [URL]",0
"«Prima delle vacanze passa una pubblicità: non è civiltà abbandonare i cani per strada e chi lo fa è punito dalla legge. Invece abbandonare per strada #MigrantI è “sicurezza”, è legge». Calogeri Peri, vescovo di Caltagirone sul Cara di Mineo. [USR]",0
Comincia proprio bene l'anno...stranieri che si accoltellano in piazza...bella merda proprio... [URL],1
"#Mattarella il terzo settore si sostiene, non si tassa.  I migranti sono persone con cui convivere. Le forze dell’ordine non stanno lì per tappare le buche, il parlamento va rispettato, siamo in Europa convintamente. #facciamorete grazie presidente",0
rom....parmi strano: si saranno sbagliati i Carabinieri!!!! [URL],0
"I #Pidioti e finti buonisti anti-italiani  diranno che é alto 7 metri oppure che é un effetto ottico. Rendetevi conto che cé gente che crede a questi teatrini del c***o, un insulto per i veri profughi. Basta sto schifo non stiamo stupidi! #stopinvasione #BloccoNavaleSubito [URL]",0
Grazie ai terremoti l'Italia sta cadendo tutta pezzi. Grazie ai nomadi e zingari l'Italia sta diventando una... [URL],1
"#Roma sequestrato tesoro da 30 milioni a 5 famiglie rom #Roma, #sequestrato #tesoro #da #30 #milioni #a #5 ... [URL]",0
[USR] [USR] [USR] Purtroppo generalizzare è credere nella possibile convivenza. In nessun luogo al mondo i mussulmani tollerano persone di altre religioni. E i musulmani in Italia hanno dimostrato di non essere diversi.,1
"Vicenda #Lidl, dai giudizi della gente qui su Twitter sembra che i rom siano tutte brave persone. Mi sento decisamente sollevato.",0
"SE CI SONO FAMIGLIE CRISTIANE PARTICOLARMENTE SENSIBILI  AL PROBLEMA IMMIGRATI , LO FACCIA PRESENTE AL PROPRIO VESCOVO E CHIEDA IL PERMESSO DI MANTENERE UNO O DUE PROFUGHI O UNA FAMIGLIA E DI ADOTTARLA NON CON LA CARITAS . AMEN.",0
[USR] guarda che Trump spaccia il muro come soluzione contro illegal immigrants. E gli overstayers sono anche loro illegal immigrants,0
"Il nemico non sono i migranti,ma chi li deporta per sfruttarli, per colpire la classe lavoratrice e per creare guerre orizzontali tra gli ultimi. Il nemico è chi sradica gli africani (Destra liberista del Danaro) e chi giustifica questi processi (Sinistra libertaria del Costume).",0
[USR] Bastardi...una ragazzina che alza le mani....asfaltare i campi rom....,1
"A Milano il primo ""villaggio dei senzatetto"" d'Italia: è all'ex campo rom [URL]",0
"Francia, Belgio, Olanda, Germania. Ora è il turno della Svezia. 1000 gilet giali svedesi davanti al Parlamento a Stoccolma protestano contro l'immigrazione e la povertà crescente. In Europa c'è una rivoluzione in corso contro l'UE, ma i media italiani non la stanno mostrando. [URL]",0
A Torre Maura il cibo destinato ai nomadi gettato per terra e calpestato. [URL],0
"MINISTRO [USR]  , questo ITALIANO michele mangiacotti   [USR] DORME IN MACCHINA E, LE CASE POPOLARI VENGONO ASSEGNATE AGLI STRANIERI, LE SEMBRA GIUSTO? PER FAVORE LO AIUTI. GRAZIE #primagliitaliani [URL]",0
Quelli del congresso della famiglia sono così. Ci abboffano il cazzo con l'aborto che è un omicidio ma poi per i migranti propongono famiglie separate o la morte in mare.  Ogni riferimento a fatti e persone reali è puramente voluto.,0
"Beretta92: un eccellenza italiana che ferma i #terroristi dal 1975 (I suoi concorrenti ""parole, bandiere della pace… [URL]",1
La tua storia viene da lontano? ? Raccontala e diventa protagonista! ?????  ?Il concorso DIMMI Diari Multimediali Migranti scade il 30 aprile!!  Conosci qualcuno che ha una storia da raccontare? ?? Condividi questo post e aiutaci... [URL],0
Per giorni si sono lasciati 58 migranti sull'Aquarius con un indicibile e assurdo balletto di accuse. Questo in Europa: 500 milioni di abitanti e una ricchezza immensa. [URL],0
No alle piste ciclabili perché ci vanno i migranti. No al wi fi in piazza perché crea assembramenti. No ai negozi etnici aperti la sera. No alle panchine. No alla vita notturna. È una classe dirigente di vecchi che sogna di amministrare un paese di morti.[URL],0
"[USR] No davvero, basta son clandestini dai e lo sapete, smettetela con sta storia, siate per la legalità, far entrare persone senza documenti ne permessi è una delle cose piu stupide che possano esserci, combattete la mafia dei ricchi ma anche dei poveri! Basta islam!",1
"#Dibba ma di Roma, che diciii. Le slot e bla bla. Ce sta a veni' la peste affoghiamo nella monnezzaaaa! Andiamo a piedi, ambulanti, rom..",0
"La democrazia in Italia: se immigrati clandestini stupratori e spacciatori OCCUPANO edifici pubblici o privati, non possono essere sgomberati #RestiamoUmani  se ad occupare è un movimento che aiuta gli ITALIANI più poveri, il web insorge...  io sto con #CasaPound",1
[USR] [USR] [USR] [USR] [USR] Ma perché non andate a Milano ad aiutare i loro stranieri nella stessa situazione? Ah no lì ci sono i compagni,0
"#Piazzapulita l'Isis andava fermata prima. Avete già dimenticato tutti i massacri contro cristiani musulmani azizi, le gole tagliate?",0
"Vaticano contro Trump, appello alla chiesa Usa: ""Azione di lobby per far cambiare politica immigrazione""… [URL]",0
"Sbarcato in Italia nel 2011, appiccò fuoco nel centro profughi di Lampedusa, autore dell'attentato di Natale a #berlino in fuga #wanted",0
"A proposito di debito, e migranti, in Europa succede qualcosa di cui quasi nessuno parla [URL]",0
[USR] ha sbagliato a descrivere l'Italia come un corridoio di terroristi.Ma sull'espulsione dei migranti irregolari che commettono reati,0
"Noi facciamo di tutto per l'#integrazione, ma loro mandano tutto al macero #ChalieHebdo  #islamistheproblem #Francia altra #poliziotta morta",1
"Da non credere... Che vergogna,   non mi abituerò mai riescono sempre a sorprendermi. Ma in fondo è la stessa cosa di dare 500€ mese di pensione minima e poi spendere 200€ al giorno per ogni migrante del cazzo che entra!",1
Notizie di questa settimana: A Bologna gli operai della Lamborghini fanno una colletta per consentire ad un collega musulmano di andare in,0
"Comunque approfitto per svelare a tutti voi un segreto:  Il terrorismo non ha religione, non ha provenienza, non ha ideologia.",0
"[USR] [USR] [USR] [USR] [USR] Anche Baggio purtroppo sta scalando posizioni in termini di visitatori di ROM. Prima non c erano, o erano nascosti. Ora grazie anche a [USR] ogni giorno sono sotto le nostre case. Promesse mantenute di [USR] ? 0 . Anche oggi siamo invasi dai rom. Ed è ottobre [URL]",1
"[USR] A questi non li indagano....sono gli INTOCCABILI. Quello che mi indispone sono le persone che continuano a sostenerli, in barba ad ogni umana decenza. Non gli bastano i rom di notte nelle loro case e gli #stupratori-che-scappano-dalla-guerra: aspettano Islam che li raddrizzi. ..",1
[USR] L ITALIA E L UNICO PAESE AL MONDO CHE COSTRINGE I GIOVANI A EMIGRARE E IMPORTA FINTI PROFUGHI DA MANTENERE NEGLI HOTEL QUESTO PAESE E FALLITO.,1
"Il terrorismo non è un nemico che si sconfigge con i bombardamenti. Dopo Bush, lo dovrebbe aver capito anche Putin. O no?",0
"[USR] Ormai è assodato che quelli bravi e preparati in Italia sono tutti antipatici. Sono invece simpatici gli ignoranti, purché non siano neri e musulmani e in genere stranieri.",0
"Salvini: Non concederò  neanche mezza moschea ! La Dichiarazione islamica dei diritti dell'uomo dice che la donna vale meno dell'uomo, che la giustizia islamica prevale sulla giustizia italiana, l'Islam non è compatibile con le nostre libertà e i nostri valori!#MovimentOnesti [URL]",1
"Stupri etnici: come gli immigrati hanno ridotto Linda CI VUOLE LA PENA DI MORTE! [URL] Prima di Pamela. Prima di Desirée. E’ stato il primo stupro etnico del genere, in Europa.",1
"Basta con questi immigrati che ci vogliono insegnare a tener puliti parchi, strade e giardini!1! Più #sovranismo nella gestione dei nostri rifiuti e a chi non ci sta lo meniamo! Evviva #iNostriValori !1!  [URL]",1
"Impedire l’emigrazione non con la forza ma con la generosità,gli investimenti educativi,economici,questo è molto importante. Ci vuole generosità,con la paura non andremo avanti,con i muri rimarremo chiusi nei muri  #PapaFrancesco  #ShareJourney #Migranti [URL] [URL]",0
Attesi in Sicilia 1.264 migranti [USR] [URL],0
"Bergoglio giustifica la sua politica di lecca babbucce e di accoglienza ad oltranza come missione di pace con l'Islam. Ah, per questo la strage di cristiani nel mondo non si ferma; la sottomissione papale autorizza le bestie islamiche a sterminare i cristiani! Sveglia Bergoglio!",1
[USR] [USR] beh! Anche noi mettemmo del nostro. Però ci siamo evoluti😈,0
"Caro Papa Francesco se anche quest’anno vuoi umiliare il Natale paragonando Giuseppe e Maria che scappano in Egitto, per sfuggire ad erode, ai migranti che strappano i documenti e bruciano i polpastrelli delle dita, per fottere lo stato italiano ti consiglio di cambiare religione",1
[USR] [USR] a parte la stupidità dei 2 dipendenti la nomade recita bene! [USR] invitala a #Pomeriggio5,0
"Il paese di Torre Melissa che nella notte si getta in mare per salvare i migranti. Una storia di ultimi, di mare, di generosità.  Una storia che mi fa pensare al Pescatore di De Andrè che “versò il vino, spezzò il pane per chi diceva ho sete e ho fame”. Pietà non l’è morta.",0
#rassegnabalcanica è morta #esmaredzepova la stella della musica #rom [URL]  #Balcani #gipsymusic #music,0
Il confine svizzero resta chiuso e noi ci teniamo tutti gli immigrati [URL],0
"Ebbravo Eu...non clamori ma idee. ""Oltre il circo della paura, l'inesorabile declino del terrorismo"" [URL]",0
"#VirginiaRaggi, #sindaco di Roma, è anti-#italiani: sfratta cedendo suolo a #rom #apatridi. Viva #m5s e #sionismo! [URL]",0
In Veneto i sindaci si sono rotti le palle. “Via tutti gli immigrati dal nostro territorio entro 20 giorni” [URL],1
Denunciare i migranti colpevoli di atti verso il ns popolo è come fare la cacca e non trovare il bidet! Magistrati amici dei clandestini!,0
[USR] [USR] [USR] [USR] [USR] tranquilla in futuro tutti avranno un radar che scannerizzando una persona sarà in grado di stabilire se è un migrante vero oppure no. se come no..  io a priori non avrei firmato un cazzo ma tanto mi pare di capire che questo governo è come lo zucchero per farsi far la puntura.,0
"Grillo: ""Adesso è il momento di proteggerci, rimpatriare subito tutti gli immigrati irregolari"" [URL]",1
[USR] [USR] Perché i furgoni dei terroristi si noleggiano?,0
"#RIACE:  SINDACO #LUCANO ARRESTATO PER FAVOREGGIAMENTO DELL'#IMMIGRAZIONE CLANDESTINA.  In manette Domenico #Lucano, sindaco di Riace, simbolo del l'accoglienza dei #migranti e tanto amato da #Saviano. #Salvini: ""Chissà cosa diranno i #buonisti...""  [URL]",0
In Toscana si sfamano i rom con i buoni pasto della Coop [URL],1
"Campi nomadi a #Roma, la montagna ha partorito un topolino [URL] [URL]",0
[USR] [USR] Facebook è dell'ebreo Zuckerberg cuculo sradicato sradicante come tutti ebrei perciò di sinistra pro neri gay rom,1
DEI MIGRANTI NE HO STRA PIENE LE PALLE DEGLI ZINGARI ANCHE DELLE RUSPE ANCHE A ME FREGA CHE NON ARRIVERA' UN EURO IN PIU' A ME FREGA CHE TUTTO RINCARA COSA FACCIAMO RAGAZZI DEL GOVERNO DOBBIAMO SOPPORTARE I VOSTRI SORRISI EBETI??  RAGAZZI  STATE SCHERZANDO CON IL  FUOCO,1
[USR] 33 bimbi? Ma li hai visti come vivono nei campi rom? Fai i video dei zozzoni che lasciano mondezza in strada e non dici nulla delle schifezze dei roghi tossici che fanno gli ZINGARI,1
[USR] Finti profughi??? perchè non ti fai un giro in nord Africa??? nelle 20 prigioni. Facile parlare quando magni e bevi in serenità.,0
[USR] coglione  sei anche te colpevole il terrorista  E uno dei tanti .che te gli hai salvato la vita  E lo hai accolto !,1
I ROM e i SINTI sono pochi ma fanno danni come le 7 piaghe d'Egitto É ora di finirla di mantenerli e permettergli di delinquere impuniti sempre dopo decine di arresti e denunce grazie a magistrati compiacenti che nella loro aurea discrezionalità non applicano mai il massimo pena [URL],1
"#MimmoLucano sindaco di Riace, paladino dell'accoglienza, è stato arrestato per favoreggiamento dell'immigrazione clandestina e fraudolento affidamento diretto del servizio per la raccolta dei rifiuti.  Attendiamo il commento del suo caro amico di [USR]. [URL]",0
Di italiano vogliono far estinguere anche i cani. Del resto invisi agli islamici. [URL],1
"Roma Today: Campi rom, Campidoglio: ""Censimento concluso. Ora a lavoro per chiudere Monachina e La Barbuta"" [URL] #roma",0
[USR] ora staranno tutti zitti fino alla prossima stronzata terroristica!!,0
"La sparata del comunista: ""Il dl Migranti di Salvini? ​Ritornano le leggi razziali""....LORO SONO I RAZZISTI CONTRO GLI ITALIANI!  [URL] di [USR]",1
#QuintaColonna come volevasi dimostrare ..dopo i nazi vegani i musulmani ... c'è  attinenza dunque 😅,0
"[USR] Signora Meloni non faccia come il signor Salvini e non parli solo dei criminali, ogni tanto parli anche di quei migranti che fanno del bene. Lo so che è difficile per lei, ma ci sono migranti che fanno del bene, ma nessuno ne parla, perché non fanno notizia.",0
"Mi sà che non ci siamo,la ns generazione non riuscirà a convivere con gli immigrati,se vedi fanno gruppo a sè,parlano la loro lingua,e hanno costumi ed usanze che non cambieranno mai,la ns colpa è cambiare le ns abitudini per non offendere loro!Questa è sottomissione ,,",1
Via questi immigrati dall'Italia e castigare i nostri POLITICI che li fanno entrare qualsiasi colore di bandiera sia [URL],1
[USR] [USR] Rimpatri  Rimpatri Rimpatri Rimpatri L'emergenza oggi sono i rimpatri. L'Italia è piena di delinquenti stranieri! L'esercito a #castelvolturno e in tutti i ghetti degradati pieni zeppi di immigrati che delinquono. RIMPATRI!!!,1
"Me fate ride voi che ve indignate per i panini . dite un po’, siete gli stessi che stanno zitti zitti quando a buttere il cibo “ no bbuono” sono gli immigrati dei centri accoglienza? #TorreMaura  Zecche faziose enfatizzate solo le cazzate e non il disagio delle periferie invase",0
"I rom rubano in tutta Italia, mica solo ad Asti neh.. #dallavostraparte",1
"[USR] Pur essendo un bambino rom? E tanti altri bambini che soffrono e muoiono ogni giorno anche grazie a te? Apprezzerei l'abbraccio al bimbo, se la tua non fosse pura propaganda.",0
#Cecenia E i terroristi sono ancora a piede libero.,0
"Favoreggiamento ai migranti: arrestato il sindaco di Riace Mimmo Lucano Mimmo Lucano è finito in manette nell'operazione ""Xenia"" della Guardia di Finanza. È il paladino dell'accoglienza negri e monnezza i guadagni di questa latrina [USR] [URL]",1
Tutti gli attentati sono di matrice islamica Affermare l'inizio della TERZA GUERRA MONDIALE x causa di religione no… [URL],1
Bonino lancia appello in arabo: “In Italia servono altri 2 milioni di immigrati” – VIDEO | VoxNews [URL],0
Taglieggiavano i rom alla stazione di Milano: 7 anni a due agenti [URL],0
"[USR] [USR] Perché sono gli immigrati che alzano l'IVA al 25% e le accise sulla benzina! Stai lì tranquillo e Zac, l'immigrato ti aggiunge il 3% di IVA e neanche te ne accorgi!",1
Le #gipsyqueens escono dal campo rom e si emancipano anche se ci vuole ancora il permesso dei mariti per lavorare.… [URL],0
[USR] perche' un profugo non se lo accoglie in casa lei?meglio farli entrare e appiccicarli agli altri !Brava lei e tutti quelli come lei,1
Barry e Suleyman:  2 migranti africani di Settimo Torinese tra i soccorritori [USR] [URL],0
"[USR] [USR] E chi obbedisce ad Allah e al Messaggero, allora essi saranno con coloro a cui Allah ha dato grazia, ovvero con i Profeti, i veritieri, i martiri e i ben disposti. Questi sono i migliori compagni!"" (Corano 4:69)",0
"[USR] BUONISTI STIPENDIATI VEDONO ALTRI PAESI PROGRESSISTI CON SVILUPPO CON BENESSERE CON TRANQUILLITÀ COME AUSTRIA SVIZZERA  ECCC.   altrimenti non c’è altra spiegazione che con migranti fanno affari, certo non sono i bimbi denutriti anzi con IPHONE.",0
"Maledetta sinistra, maledetti ipocriti e maledetta immigrazione clandestina. [URL]",1
"[USR] [USR] Erano immigrati clandestini e possono essere trattenuti dove, quando, quanto e come meglio ritenuto. Io li avrei lasciati ancora sulla nave ma facendoli sbarcare almeno si è dimostrato che razza di persone sono, assieme a chi li supporta",1
"Se voi avete il diritto di dividere il mondo in italiani e stranieri,io reclamo il diritto di dividere il mondo in diseredati e oppressi da un lato,privilegiati e oppressori dall'altro.Gli uni sono la mia patria,gli altri i miei stranieri #Riacenonsiarresta Grafica [USR] [URL]",0
"L'#islam ospite a messa offende la #Chiesa. I fedeli si ribellino  I fedeli si stanno già ribellando, con questo falso papa, basta guardare il calo dei fedeli e del 5permille!  Cominciate a ribellarvi voi altri prelati, piuttosto!!!  😡  [URL]",0
A Roma tendopoli rom con vista Colosseo [URL] via [USR],0
"Non sono razzista,ma chi vuole difendere gli immigrati africani, vada in Africa....facile fare beneficenza con soldi altrui!",1
[USR] [USR] Chi paga ?Basta con le cazzate che 1 profugo risparmia 3.000€ in paesi dove lo stipendio è 70€/mese Fare i conti📍,1
[USR] secondo la sinistra non si può dire: - zingaro - rom - sinti - magrebino - tunisino - nordafricano - ladro - stupratore - clandestino - immigrato clandestino - nullafacente - occupante abusivo - spacciatore PERO' A NOI NON CE NE FREGA UN CAZZO E LO DICIAMO LO STESSO !!!!,1
