text,label
"RENZI: ""non buttate via i soldi con il reddito di cittadinanza""  I soldi non vanno dati agli italiani,  ma agli Africani che arrivano sprovvisti di documenti, tra i quali ci sono  Terroristi Trafficanti  Latitanti Assassini Nullafacenti senza arte ne parte  Giusto Sig. Renzi ?",1
"A Ventimiglia, una notte con i migranti nel paese che vieta la carità Anche i sentimenti devono passare dalle ordinanze sindacali ?",0
[USR] coglione  sei anche te colpevole il terrorista  E uno dei tanti .che te gli hai salvato la vita  E lo hai accolto !,1
[USR] te credo che in Italia non fanno figli se non c'è lavoro come li  campano.....mica sono rom,0
"Ci vorrebbe una bomba atomica in modo da fare saltare in aria la libia, siria e tutti i terroristi. Morite tutti pezzi di merda #Tunisia",1
"[USR] Io da anni per esempio dono il mio vestiario ai barboni e ai bisognosi. Faccio del bene, insegno chitarra agli immigrati, ai bambini dei quartieri un po' degradati. Ma questo dio di cui parlate tanto sembra essere sordo e cieco.. Che mi desse un segnale, eh la madonna!!",0
Rischiando di essere presa per pazza che non sa di cosa parla#Trump dopo i musulmani e i gay.quelli di colore?#benvenutoHitler?#preoccupante,0
Caso Caria: i curdi che combattono contro l’Isis sono terroristi?   [URL],0
[USR] [USR] [USR]  islam cancro del mondo e distruzione della civiltà,1
[USR] [USR] [USR] [USR] [USR] [USR] [USR] [USR] [USR] [USR] [USR] [USR] [USR] [URL] [USR]   Inquietante! Uccisioni di massa di persone innocenti uccise dall'ISIS questi sono crimini di guerra dell'IslAm. Questo è ISIS eseguendo molti in questo modo se si rifiutano di convertire o accettare SHaRIA Law.,1
Quel brutto derby giocato  sulla pelle degli immigrati [URL] #milano,0
"È triste pensare che la moneta di scambio, oggi, in Europa, negli USA, siano i profughi. Un continente che usa gli esseri umani come carta da giocare, da contrattare, da ricattare, nel XXI secolo, è una sconfitta per l’umanità, che tace e si ripiega.",0
ho visto solo 💩💩uomini mussulmani ma le 💩💩donne sotto chiave a casa??,1
Fanno degli scambi con i documenti...#quartogrado tra Ucraini e Rumeni..🙈🙈,0
[USR] Maledetti neri islamici che.sbarcano in Italia. Hanno buttato a mare 12 cristiani per una disputa di religione no a pieta,1
#Napoli Continua la repressione poliziesca e della Giunta comunale in vista dello sgombero del campo rom di via Bre… [URL],0
"[USR] [USR] dove c'è il PD caos e degrado! Milano,Roma etc...ridotte a città arabo-islamizzate...avete mai visto Berlino?",1
"#Arezzo  Dopo 38 furti, dormiva sul posto di lavoro spara e uccide il ladro. Veniamo derubati aggrediti e uccisi continuamente da sedicenti #migranti criminali, lo Stato latita e nn ci difende.  Onore e stima a questo uomo. E che gli venga data una medaglia. #leggitimadifesa",1
"Riace, Mimmo Lucano: 'Il nostro modello sopravviverà' [URL] via [USR] Vattene tu e il tuo business dei migranti. Vergogna",0
Barcaccia nel mirino (ancora): nomade sorpreso a rubare monetine nell’acqua [URL],0
[USR] [USR]  gli stranieri tutto dovuto.Gli italiani. Fame e zero diritti. ..,1
[USR] se poi si scopre che a donare il sangue sono tutti immigrati ti prende un infarto,0
Italia: crudele sgombero forzato alla vigilia della Giornata Internazionale dei rom [URL],0
A Roma 17 indagati a rischio processo per 25 mila euro di mazzette sugli appalti dei campi rom  [URL],0
"Matteo Salvini, l'attacco dell'Unione africana: ""Ritiri la frase con cui paragona gli immigrati a schiavi"" [URL]  ...fate pena.",0
[USR] L ITALIA E L UNICO PAESE AL MONDO CHE COSTRINGE I GIOVANI A EMIGRARE E IMPORTA FINTI PROFUGHI DA MANTENERE NEGLI HOTEL QUESTO PAESE E FALLITO.,1
"[USR] [USR] Delinquenti, trattate meglio i clandestini stupratori, ladri, aggressori, nullafacenti perché non hanno voglia di lavorare e a noi invalidi civili ci imponente di vivere con 283euro mensili)  Io sono italiana, pretendo di essere presa in considerazione prima degli stranieri!",1
"Troppi stranieri in classe, la scuola mette le quote per italiani [URL] [URL]",0
Togliere la voce a chi inneggia alla violenza e senza un briciolo di umanità giustifica un inaudita atrocita' #SalviniVergogna #Lidl #rom,0
Però si incrementano i voti della sinistra con i clandestini islamici neri x lo + maschi fancazzisti Voti da sommare a rom e altri benemerit,0
"Riassunto: avevamo ragione noi ma c è stata una rottura sentimentale, per questo non ci hanno votato. Facciamo un congresso. #Minniti così sui #migranti a #Piazzapulita",0
"[USR] Chiedere Negrita, che hanno girato Sudamerica e Africa, con cosa sono entrati in quei paesi. Già ma loro nn sono ""migranti"", sono turisti. Che tristezza questi cantantuccoli!",0
"Le camere a gas solo per i #rom o anche per i #furbettidelcartellino? No, così, tanto per capire... #Lidl",0
"[USR] Sono i libici a stuprare o gli stessi migranti? Perché spostando tutti qui, il problema non si risolve, lo si porta in casa. Per i furti eviterei di dire idiozie, visti i cellulari con i quali sbarcano",1
"ITALIA | Allarme povertà, al Sud più italiani che stranieri nei centri Caritas [URL]",0
"Leggendo questa notizia, mi vengono in mente la Fornero e Monti! Hanno varato una Legge per mandare in pensione gli ITALIANI a due passi dalla miglior vita, per dare i NOSTRI soldi agli IMMIGRATI? Ma chi li appoggia ancora, non si VERGOGNA? [URL]",1
"Qualcuno sostiene che non dovrei dirlo, invece io lo dico: i due delinquenti, minorenni, vengono da un campo ROM, luogo di illegalità e degrado che allevano criminali e che nell’Italia che ho in mente non dovrebbe esistere. [URL]",1
Si vergogni lei caro ex ministro. In Italia negli asili vanno messe le telecamere per evitare di che i bambini vengano picchiati dagli insegnanti. Che vergogna avete ridotto il paese alla sottomissione straniera. Pensi più che altro ad andare a lavorare,0
"[USR] [USR] è vero...com'è vero che tutti i terroristi sono musulmani....sarà un caso, mai un valdese ha messo bombe!",1
"[USR] [USR] Mi fanno ridere questi che criticano Minniti. Mantello rosso non basta più , ideologie comuniste rimaste a chi arriva a fine mese e non vive in periferia . Se ora i voti si spostano su immigrazione è li che devi andare . Fate bei sogni",0
"Cari italiani, per battere l'islam dovete tornare a fare figli [URL]",1
"Non va bene. Posso capire che #Salvini si sia reso antipatico all'Europa, ma quel signore lì non si doveva permettere di interrompere e dire cazzate simili. Noi i migranti li abbiamo accolti ma tanti non lavorano, a differenza di noi Italiani in #Lussemburgo. Ora dov'è il lavoro?",0
PAZZESCO! Per la maggioranza di governo sono più importanti gli immigrati richiedenti asilo piuttosto che i pensionati sociali italiani. Ascoltate l'ultima vergogna. [URL],0
[USR] [USR] a parte la stupidità dei 2 dipendenti la nomade recita bene! [USR] invitala a #Pomeriggio5,0
"[USR] [USR] [USR] [USR] [USR] [USR] [USR] [USR] [USR] [USR] [USR] [USR] [USR] [USR] [USR] [USR] [USR] [USR] [USR] [USR] [USR] [USR] [USR] [USR] [USR] [USR] [USR] [USR] [USR] [USR] [USR] [USR] [USR] [USR] [USR] [USR] [USR] [USR] [USR] [USR] [USR] [USR] [USR] [USR] [USR] [USR] [USR] [USR] [USR] [USR] Frase fatta: Non tutti i Mussulmani sono terroristi e lo confermo lavorando e vivendo con loro,ma tutti i terroristi lo sono, pertanto (con le scuse) accertata la larga frangia violenta islamica, vanno monitorati fin dal loro ingresso in paesi cristiani. Radicalizzarsi è un nulla",1
Bici rubate ai ciclisti della Milano-Saremo: trovate in un campo nomadi [URL] [URL],0
"[USR] diciamo grazie e gente come [USR]  Pd,che invece di proteggerci spalancano le porte ai terroristi ISLAMICI!",1
"[USR] Se bimbo mussulmano allora bandita carne di maiale; e se famiglia straniera  "" indigente"" io pago il mio pasto e il suo...pediatra, casa popolare., asilo pubblico ( mentre io non trovo posto perché...lavoro e ho un vero stipendio..)..meno male che ne sbarcano sempre meno..",1
Croce Rossa apre una tendopoli: incubo immigrati per i residenti - IlGiornale.it [URL] via [USR],1
"Della costituzione i muslims si puliscono il didietro, come di tutte le leggi non muslim. Riconoscono solo la legge coranica/sharia e il Corano tutto il resto NON esiste. Chi dice il contrario è un imbecille o in malafede. O entrambi. [URL]",1
Finisce la bella vita dei rom: via auto e beni di lusso per 300mila euro [URL],0
"Iuventa, se salvare migranti è una colpa [URL]",0
Nessun permesso ai #mussulmani [URL],1
[USR] Caro Sindaco una possibilità data dalle moderne tecnologie potrebbe essere quella di connettere via videoconferenza i suoi scolari con una scuola sul continente. Si informi xché  nelle zone isolate in USA e E.U esistono queste realtà.  Volere è potere.Senza immigrati.,1
I rom vanno messi nei posti dove li accettano cioè  nei posti di Lusso dei radical chic e buonisti intellettuali ed artisti loro li difendono e li accettano quindi se li prendano vogliamo vedere come saranno.contenti!!!,0
"Bruxelles sbugiarda Renzi, Alfano e Boldrini: “In Italia 8 migranti su 10 sono clandestini” [URL]",0
PRO:  Clandestini Stupratori Aggressori  Spacciatori Islam Rom Scafisti Nazi UE  Lobbie farmaceutiche Illegalità Razzismo  Sfruttatori   Signori vi presento il PD ed i suoi seguaci,1
"Siamo costretti a vivere in questo modo, campo rom Monte Mario Roma Santa Maria della pietà [URL]",1
I bambini stranieri occupano le altalene. Vivaddio che qualcuno ancora si diverte. E giù le mani dalla spensieratezza dei bambini,0
"#QuintaColonna anche a Gallarate, #Marcato. nn fanno altro che ubriacarsi i musulmani.",1
"Ungheria contro Renzi su migranti: “Quei soldi spettano a noi, non all’Italia” [URL]",0
#rassegnabalcanica è morta #esmaredzepova la stella della musica #rom [URL]  #Balcani #gipsymusic #music,0
[USR] [USR] Ma di quale ferocia parla sta deficiente? Siamo stanchi di farci rubare le ns cose dai parassiti sociali! Ma che senso ha di esistere la popolazione rom? Non vogliono lavorare ma solo rubare e spacciare. Chi difende un delinquente vuol dire che ragiona come un delinquente!,1
[USR] al momento non si sa ancora se trattasi di terrorismo o fenomeno locale #FortLauderdale 5 morti 13 feriti,0
"Stilista aggredito: “Milano è in mano agli immigrati, dobbiamo fermarli” | VoxNews [URL]",1
Roma è in bancarotta ma regala 12 milioni ai rom [URL],0
Vorrei un campo rom vicino la casa di tutti quei buonisti e moralisti che predicano così bene!,0
"[USR] [USR] Siamo alla follia!Per i politici, i rifugiati,i ladri, gli immigrati,tutti da mantenere,la gente normale SISPARA",1
"[USR] [USR] ... il pd, che ha tolto i soldi (80 euro) ai nostri poveri e li ha dati ai migranti, 2,5 euro al giorno...",1
[USR] [USR] E noi non possiamo espellere i migranti-clandestini??? Ma vada affanculo la cicciona-demente!!!,1
Tedeschi ancora divisi in due I profughi sono il nuovo muro [URL] [URL],0
[USR] [USR] Nello scontro grave nell'establishment non si può escludere. Anche se non semplice. Forse accadrà l'opposto,0
[USR] Fra 20 anni vedrai che cambierai idea. Maledirai chi ha fatto entrare i musulmani in Europa.,1
Iniziano i bizantinismi di chi vuole gli islamici da noi. Finché siamo in tempo cacciamoli tutti,1
"6500 posti... Di lavoro? No, per l #immigrazione... Ma cosa pensano che l Italia sia un pozzo senza fondo? #incoscienza",1
"I casi sono due: 1)la sinistra italiana non ha capito che ormai,a causa del suo scellerato sostegno all'immigrazione irregolare,si è avviata verso l'estinzione. 2)la sinistra italiana ha capito tutto a perfezione ma ha ""interessi superiori"" da soddisfare(non umanitari ovviamente) [URL]",0
"#Notizie #Cronaca Vitulano, ancora due profughi in centro [URL]",0
[USR] [USR] Salvini pensa ai migranti 😡 QUANDO CACCERÀ QUESTI DELINQUENTI? MENO CIBO E PIÙ CONCRETEZZA😡,1
Savona: 'Smettiamo di parlare di migranti o l'Europa salta' [URL] di [USR],0
ma noi li accogliamo e li manteniamo. Quanto siamo bravi noi. #idioti #Turchia #islam #Cristianiperseguitati [URL],1
"🔴Nave Open Arms, Ong e bandiera spagnola, ha raccolto 200 immigrati, chiede un porto italiano dopo il rifiuto di Malta (che ha sbarcato, giustamente, una donna e un bambino).I porti italiani sono CHIUSI!Per i trafficanti di esseri umani e per chi li aiuta, la pacchia è finita.",0
Per lui non ci sono altri esempi di civiltà e se ne frega delle ingiustizie e dei danni che l' immigrazione indiscriminata e incontrollata ha provocato. Abbassando conseguentemente la civiltà...#Mattarella #civiltàallosbando #immgrazione#nordafricani  #clandestini #salvini,1
"[USR] Come tutti gli immigrati e' pure arrogante!! Grazie chiesa, ci mancavano proprio questi preti!!!",1
[USR] [USR] Succede che ci si incazza. Sto male quando sento la Boldrini...nel parlamento italiano a tutelare gli stranieri....che faccia ci vuole. La paghiamo noi ed è contro di noi.,0
una donna e’ stata presa a calci da un gruppo di rom su un treno della metro a di roma perche'... - Cronache [URL],1
[USR] [USR] SE È COSÌ GLI SI INTIMI DI NON AVVICINARSI MAI PIÙ ALLE ACQUE ITALIANE ...! E SE AVRANNO DEI NAUFRAGHI “ immigrati clandestini “ LI PORTINO IN OLANDA DOVE LA NSVE È IN REGOLA...!!!,0
"Il campo rom a Roma Nord si farà: ""E' contraddizione a Cinque Stelle"" [URL] [URL]",0
Ottomila firme contro il campo rom a Roma Nord: Campidoglio ascolti territorio [URL] [URL],0
"[USR] [USR] ecco ora tutto chiaro...Europa unita dal canto,dal calcio,dalle gite pseudo culturali,e da tempo dal terrorismo👌",0
"[USR] [USR] La maggioranza dei migranti sono di fede musulmana. La loro religione non ammette altri ""partiti politici"" se non quelli di ISPIRAZIONE ISLAMICA. Lo sanno i khmer-italici questo??? Perchè stranamente vedo sempre ""bandiere rosse"" dietro di loro, e gli fanno cantare ""O BELLA CIAO""",1
"Imperia, sgominata dai carabinieri la “banda della spaccata”: in carcere quattro stranieri per 18 razzie [URL]",0
"[USR] Chi li difende vuol dire che ha la fortuna di non avere un campo rom nella propria città, perché altrimenti saprebbe che quanto detto da #Salvini è anche riduttivo. La loro è una ""cultura"", e vivere di espedienti e delinquere è ciò che gli viene insegnato già in tenera età.",1
[USR] [USR] rifugiati ? Sicuri che vogliano mettere solo loro o anche il restante 95% degli immigrati ?,0
"#DecretoSalvini :  •Contrastare l'immigrazione ILLEGALE, garantendo l'esecuzione dei provvedimenti di espulsione; •Permesso di soggiorno temporaneo per motivi umanitari. •Protezione per i minori  •Revoca della cittadinanza agli stranieri condannati per reati di terrorismo",0
[USR] per eliminarvi tutti voi e pulire litalia da rom e musulmani ci vuole il duce,1
"Voglio vedere se la procura faccia indagini sui rom in questione. Quanti di loro hanno un lavoro, I mezzi se sono coperti di assicurazione. Se mandano I figli a scuola. Ne vedremo delle belle. [URL]",0
"Barcone al largo della Sicilia, 90 migranti portati a Lampedusa. Salvini: clandestini, saranno espulsi [URL] [USR] ...ma scherziamo?...ci facciano prendere in giro?...navi e aerei in pattugliamento e li vediamo quando arrivano sulla battigia?",1
"Così il terrorista di Strasburgo era musulmano, di origini africane, nato in Francia che ha attaccato un simbolo della religione Cristiana,  ma se mi oppongo allo ius soli sono razzista, perché l’Islam è una religione di pace? Ma andate a cagare!",0
Le foto a colori di quando gli immigrati eravamo anche noi europei: [URL] [URL],0
"I #migranti adesso arrivano alla spicciolata, con piccole imbarcazioni. E i nostri eroi della [USR] , i prodi della #Diciotti invece di vigilare sulle nostre coste dove sono, che fanno? Cercano di raccattare altri derelitti sulle coste di Malta o dell’Africa?",1
"[USR] [USR] per gestire l'immigrazione abbiamo obbedito a Maroni, non so se è stronzo, ma so che ha fatto più danni che altro.",0
"[USR] non solo avrei lasciato quelle due sgualdrine filo-islamiche lì a marcire, ma avrei spedito anche lui come bonus! Soldi bruciati!",1
"[USR] [USR] [USR] ipocriti,falsi e menefreghisti. email e denunce fatte xke rom ci sommergono di immondizia ma nulla",0
"Pontina, controlli serrati al campo rom di via Pontina: 6 pattuglie della municipale in azione [URL]",0
Durante la notte circa 30 TUNISINI sono SBARCATI sulla spiaggia di Siculiana Marina con una “CARRETTA” ??  VOGLIAMO I #PORTICHIUSI NON SOLO PER LE ONG ..  BASTA SBARCHI DI “IMMIGRATI” CHE NON SCAPPANO DALLA GUERRA... [USR]  #PORTICHIUSI   [URL],1
africanizzazione di Milano tutto secondo i piani della invasione ed espansione islamica in Occidente [URL],1
#politicaestera I migranti mettono alla prova il modello Svezia [URL] [URL] [URL],0
"La pacchia è finita per gli immigrati furbetti. Dopo il sindaco di Lodi, pugno duro anche in Veneto: niente bonus libri agli immigrati “parassiti” che non presentano il certificato sul possesso di immobili o beni nei loro paesi. In un paese civile è normale! #MovimentOnesti [URL]",1
"[USR] L'islam è una religione imposta, o ti adegui o ti fanno fare una brutta fine...",1
Armi di #immigrazione di massa da usare contro l'Italia... La #Francia chiude i porti all'#Aquarius. [URL],1
"[USR] e' un perfetto musulmano!!! chi dice il contrario mente, applica alla lettera la sura ""la donna"" del Corano. Il pericolo non e' lui in quanto tale, che lo dice, ma gli infami bugiardi! dell' islam moderato che NON ESISTE,",1
CORRIERE DELLA SERA - Il designer circondato da nove ladre rom tutte incinte: colpo sventato [URL] #PaginaNuova #Press,0
"Il Papa: Anche Maria è stata una migrante, lontana dalla sua terra - La Repubblica [URL] #notizie [URL]",0
[USR] [USR] Vedrete che la #Diciotti alla fine aveva a bordo qlc decina di migliaia di MIGRANTI...,1
"[USR] È il Papa che vuole i migranti africani. Vuole la globalizzazione dell’Europa, e queste sono le conseguenze perché entrano criminali e terroristi. Ah, si aggiunta e ben radicata, pure la mafia nigeriana",1
"Strage di #Nizza, l'#attentatore era spesso in #Italia ""per portare cibo ai migranti #siriani"" - [URL]",0
"Cancellare dei fondi per curare i migranti, è la perfetta prosecuzione dell’operazione portata avanti dal #decretoSalvini. Con un obiettivo chiaro: distruggere i diritti umani basilari. Addirittura adesso si mette a repentaglio la salute. [URL]",0
[USR] Stupefacente come si continui a sostenere che i terroristi islamici non stiano facendo una guerra alla cristianità!,1
Grazie immigrazione incontrollata...  #migranti #profughi #meningite #Africa [URL],1
".giulianopisapia: ""All'Italia servono 200.000 #migranti ogni anno"" [URL] [URL]",0
Italia ad un passo dalla guerra e accogliamo ancora gli stranieri! FACCIAMO VOMITARE! Dovete dargli fuoco dio signore!!!!!!,1
"TURCHIA FRONTE DI GUERRA, ATTENTATI A RAFFICA Attacco a Smirne: 2 vittime e 2 terroristi uccisi. Dopo Isis,... [URL]",0
"[USR] marenostrum porta d'Islam, CPT porta dei terroristi, centrisociale esercito dei clandestini, Cavaliere password della Legalità.",1
"#Roma, ""giro di mazzette per pilotare gli appalti sui campi rom”: 13 a processo - [URL] tramite [URL]",0
"Io ve lo dico. Fate tutta sta cagnara sulle persone migranti, sulle femministe, sui gay, sugli zingari. Intanto i vostri figli stanno crescendo in classi multietniche. Sono 10 volte più intelligenti di voi razzisti, e prima o poi verranno loro al vostro posto. Non vedo l'ora!",0
"Da non credere... Che vergogna,   non mi abituerò mai riescono sempre a sorprendermi. Ma in fondo è la stessa cosa di dare 500€ mese di pensione minima e poi spendere 200€ al giorno per ogni migrante del cazzo che entra!",1
"[USR] [USR] Le ONG hanno il compito di portare a termine l’opera dei trafficanti nel portare masse di migranti dall’Africa verso l’Europa incentivando nel contempo le partenze. Contribuiscono così alla destabilizzazione sociale ed economica dei Paesi, di cui gli speculatori traggono profitto",0
Io eviterei di candidare una persona così .nulla di personale contro di lei .ma contro ciò che rappresenta....l Islam va  bandito x legge in Italia .nel resto f Europa facciano cosa vogliono .in Italia stopislam!!! [URL],1
"Earth Hour, il mondo spegne la luce per un'ora Le immagini - [URL] # l'italia pensa ad un altro: al papa dei migranti",0
"Forse è tempo di eliminare i mussulmani dalle mense scolastiche, noi non paghiamo le tasse scolastiche e libri di testo per cambiare le abitudini alimentari dei nostri figli, se non gli garba vadano a studiare altrove.😡😡 [URL]",1
"Roma, rapina con spray in appartamento: arrestata nomade, caccia all'amica  [URL]",0
Qualcuno se lo metta bene in testa: i terroristi non arrivano con i barconi.,0
SI STAVA MEGLIO PRIMA.. IN TUTTA EUROPA CRESCE LA NOSTALGIA DEL PASSATO SIA IN TENORE DI VITA CHE VALORI E L'ITALIA GUIDA LA CLASSIFICA DEI NOSTALGICI...IL 77%. I PROBLEMI SONO LA MANCANZA DI SICUREZZA E DUNQUE L'IMMIGRAZIONE. C'E' VOGLIA DI NAZIONE IDENTITA' E MONETA PROPRIA [URL],0
"Si fanno mantenere e bene da noi,  parassiti succhiasangue tolgono assistenza agli italiani ed in cambio ci portano degrado ed il problema islam [URL]",1
"Roma, Raggi annulla gli sgomberi dei campi rom: “Anche gli zingari hanno diritto alla casa” [URL] via [USR]",0
"Ne prendo di treni e finora non ho avuto di questi problemi, ma i regionali sono pieni di immigrati. Bisognerebbe che ogni regionale avesse sempre 2 carabinieri a bordo.",1
"[USR] [USR] [USR] [USR] [USR] [USR] [USR] [USR] [USR] [USR] [USR] [USR] [USR] [USR] [USR] [USR] Attenzione perché a breve diventeremo come la Svezia dove avere una posizione critica nei confronti degli immigrati illegali è reato di odio razziale. Non manca molto, avete sentito la Raggi oggi sulla situazione di Roma?",0
"Bologna, gli immigrati gli occupano la casa: ora il proprietario italiano è costretto a dormire in un garage! Spero che Salvini faccia qualcosa..sbatti fuori di casa questi delinquenti!#MovimentOnesti [URL]",1
"Blitz al campo nomadi della Favorita, cronista palermitano minacciato di morte - [URL] [URL]",0
"[USR] Se sei rom non sei Italiano nemmeno con la cittadinanza visto che pretendi trattamento diverso. Ca nisciun'è fess tranne te. E lo zingaro NON E' POVERO ma fa finta di esserlo per fregare gli scemi ignoranti che non lo sanno, che non li conoscono.",1
"Che strano, il terrorista cotechino si è suicidato in carcere. Impiccandosi con una t-shirt alla porta [URL]",0
#ERROR!,1
Quei partiti e partitini  che fanno la voce grossa con Trump..lo sapete che i terroristi  transitano  tutti da qui? TRUMP SE NE FREGA DINOI,0
[USR] MONS. MAURO LONGHI testimone di Papa Wojtyla - 22 ott 2017 a Bienno - Il Santo Padre aveva previsto tutto. Bisogna fermare l'invasione islamica L'islam è un virus mortale. [URL],1
"Tunisia blocca rimpatrio di 45 clandestini, è tempo di minacciare Tunisi [URL] questa è una invasione islamica: una dichiarazione di guerra",1
Uragano Florence in Usa 17 milioni di evacuati. Polemica sui fondi: “Trump li ha dirottati a centri detenzione migranti” -  #Uragano #Florence #milioni #evacuati.  [URL],0
"Oggi l'Occidente muore, ucciso non dai terroristi ma da chi ancora oggi sceglie di tollerare e capire #CharlieHebdo [URL]",1
[USR] [USR] [USR] [USR] [USR] [USR] [USR] [USR] [USR] [USR] [USR] [USR] [USR] [USR] [USR] [USR] [USR] [USR] [USR] [USR] [USR] [USR] lo so lo stiamo vedendo tutti i giorni fanno finta di difendere i diritti dei gay per far svuotare le culle in modo che la popolazione italiana a lungo termine diminuisce e allora poi per loro sarà normale far entrare milioni di mussulmani che i gay li buttano giu dai palazzi,1
Per contrastare seriamente #violenzasulledonne una follia come #islam andrebbe bandita dalla faccia della terra... [URL],1
"Quelli a #TorreMaura non si chiamano né protesta né manifestazioni né altro, si chiamano Pogrom e non c'è giustificazione, disagio che tenga. #Rom #Zingari #Roma #razzismo",0
[USR] [USR] [USR] [USR] grazie per le offese. Confermano che non merita attenzione. Si goda la sua cattiveria.,0
"Il #GlobalCompact è terrorismo. Uccide il diritto dei popoli, autorizzando masse intere a stabilirsi in terre altrui senza che chi le possiede possa opporsi. Dà ai popoli più forti licenza di cacciare di casa e uccidere quelli più deboli. Dannati bastardi, basta! #NoGlobalCompact",0
speriamo che il pd non gli blocchi l'inchiesta per fare contenti i suoi immigrati e le ong [URL],0
"Erano ‘disperati’ ci ha detto l’Unhcr, quella che distribuisce le carte di credito ai clandestini diretti in 🇮🇹 Erano poveri migranti, hanno ripetuto i media di distrazione di massa.   hanno pagato 1.500 dollari a testa per raggiungere🇮🇹 400 mila dollari per gli scafisti",0
"Disumanità, fame e malattie: tre bimbi morti nel campo profughi di al-Hol.  (via [USR])  [URL]",0
"Per me molti immigrati ottengono anche sussidi con le false certificazioni, alcune volte cumulano sussidi e pensioni. 😒 #QuintaColonna",1
"[USR] sta arrivando un altro mezzo,un veliero,con 62 migranti,oltre a barche,barconi.Dove stiamo andando?Cosa diventa l'Italia,un lager di negri?Ci avviciniamo ad una rivolta sociale!",1
"[USR] [USR] [USR] Indecenza  sinistra  e migranti che legalizzano droga e tagliano vagine alle bambine; vanno  ad  assisi, Francesco  non legalizzava droga ne tagliava genitali alle bimbe. Sono in italia, ma non rispettano  le nostre leggi. Chi vuole  aiutare vada  nei  loro paesi  ad  educarli.",1
"#Roma, studentessa cinese morta: condanna con patteggiamento per due rom [URL] [URL]",0
l’esasperazione dei cittadini per qualche rom che delinque non potrà mai giustificare il calpestare il pane al grido “Zingari dovete morire di fame” rivolte a 70persone di cui 33 bambini e 22 donne Fascisti e razzisti di merda  #TorreMaura,0
[USR] [USR] [USR] vivo a roma ed ho visto i campi rom comunali ed abusivi,0
