text,label
Il Belgio vuole bandire il Partito Islamico dal Paese: [USR] l'Islam che lede e vuole eliminare principi base di libertà e di democrazia dei ns Paesi,1
"Cinese travolta a Roma: fermato un rom, denunciato un minore #Finanza [URL]",0
Modena: Comune paga la benzina ai nomadi che portano figli a scuola: MODENA – La giunta PD… [URL],0
"Prete fuorilegge, cosa si spinge  a dire per difendere il sindaco amico degli immigrati / Video [URL]",0
Operazione ‘militare’ nel campo rom del baby rapper: c’erano tutti i ladri [URL],0
"#Desirée, il buco #NERO dove precipita lo #Stato.  Nero come i MUSI degli #STUPRATORI ASSASSINI, lupi senza pietà e umanità. #Migranti a cui abbiamo dato #ASILO, pasti e alloggi gratis. E stuprano a gogò. Come #Pamela, #Rimini, e ancora, ancora.. BASTARDI! [URL]",1
I primi a difenderci dovrebbero essere i magistrati con condanne esemplari x quegli stranieri che vengono in Italia a delinquere così da far capire che da noi se sbagli paghi caro. Ed invece emettono sentenze che incoraggiano a delinquere. Questo è in messaggio che passa.,0
"[USR] No..ma tranquilli..va bene così!! Il sole splende, gli uccellini cinguettano e i ""poveri migranti"" son tutte brave persone. Avanti così, fino alla nostra fine... Grazie comunisti schifosi😠😠",1
"[USR] Nn solo ebrei, i rom, le minoranze in gen.,ma anche i dissidenti. mio nonno brutalmente pestato per 3… [URL]",0
"Qualcuno dovrebbe avvisare  [USR] che non può esistere ne fratellanza ne futuro con i #musulmani. L’#islam non è una religione di pace è una teocrazia che porta guerre, odio e predominanza sugli altri popoli, la #cina l’ha capito.  #AbuDabhi #emirati #SalviniNonMollare",1
Sospesa x 12h: ho osato dire che nel mondo libero tutti i centri Islamici dovrebbero essere chiusi perché l'Islam è un violento culto di  morte e sopraffazione mascherato da religione dimentica del dettaglio che Twitter odia la VERITA' & non rispetta la LIBERTA' DI ESPRESSIONE,1
#Natale ci sono già i soliti buonisti che vogliono cancellare le nostre tradizioni per piegarsi agli immigrati... [URL],1
"Mafia Capitale, “giro di mazzette per pilotare gli appalti sui campi rom”. La procura di Roma chiude nuova inchiesta [URL]",0
"Nuovi sbarchi di migranti, anche un cadavere [URL] #lurlo",0
"Roma, quei podisti perseguitati dai rom [URL] [URL]",0
"Immigrazione, sorpasso dopo anni: più italiani all'estero che stranieri in Italia [URL]",0
"[USR] [USR] Io non temo tanto l’immigrazione in genere, se arrivano e lavorano ben vengano, io tempo l’immigrazione “dei barconi”, perché c’è dentro di tutto e gli islamici che rispettano solo le loro leggi coraniche e pretendono la supremazia dell’Islam",1
[USR] Parenzo chi? Quello isterichino che alla Zanzara difende a prescindere gli zingari e immigrati?? Quello che si voleva candidare per diventare sindaco di Padova?? Ma l'avete mai sentito quanto è antipatico e odioso??,1
"Ovviamente il Vaticano continuera' a sbarrare il passo a chicchessia sulle sue frontiere...riconosce ""diritti"" solo a clandestini e migranti che transitano e sbarcano in terre degli altri....",0
"[USR] straniero lo sei pure te. Vai a dormire tu che questi social non fanno per tutti, soprattutto per quelli come te.",0
i migranti(cozzaglia evasi dalle patrie galere)sono la benedizione di dio ma quale il dio denaro? tutti i giorni la stessa tarantella: ai rotto il cazzo ai rotto il cazzo ai rotto il cazzo (ora cè lò tutto incerottato) vaffanculo vaffanculo  vaffanculo ai rotto il cazzo: [URL],1
"Pakistan: Il musulmano Salar Khan Pathan uccide #RajKumariTalreja a Shikarpur, perchè la ragazza si era rifiutata di convertirsi all'Islam per sposarlo. Aveva già pianificato il matrimonio per il 3 febbraio. [URL]",0
[USR] A parte il fatto che con la scusa dei bambini in braccio i rom fanno le peggio cose sia sui mezzi di trasporto e nelle strade secondo me se.non siete collusi con chi ha fatto di Roma un cesso non dovete  dare appellativi come fascisti e razzisti a chi si difende.,1
Khalil Samir: le radici della guerra civile islamica E le istruzioni su come evitare il contagio in Europa [URL],1
"Roma, donna picchiata dalle ladre rom che aveva denunciato - IlGiornale.it [URL] via [USR]",0
"L'idea dei Cinque Stelle a Roma: una ""Free Tax Area"" per i rom  [USR] spero si ravveda  #altrimentiNO.M5S  [URL]",0
"In un Paese civile, la cultura dei ROM non dovrebbe esistere. Questi chiedono elemosina costringendo anche i minori e rubano! Perché i filippini, i polacchi, gli ucraini trovano lavori umili e si pagano la casa, mentre i ROM devono avere assistenza? #QuartaRepubblica",1
"[USR] Degli italiani massacrati dentro casa a te e tutta la sinistra non ve ne frega nulla. Antiitaliani in ogni circostanza. Ogni vostra azione è a favore degli immigrati, dei Rom e dei delinquenti.  GRAZIE PER TUTTO QUELLO CHE FATE PER ESTINGUERVI.",1
E EU DIFENDE I ROM. FANNO TUTTO ILLEGALMENTE. E NON LAVORA NESSUNO.  Bolidi senza assicurazione: scatta il sequestro a famiglie sinti [URL],1
[URL] Ora anche in Francia si stanno accorgendo che il ritorno di alcune malattie e'  dovuto all'immigrazione...#Leuropa #Eu,1
"Cos'è il cancro dello Stato? Giudici che coccolano criminali stranieri e rovinano innocenti italiani. Partiti, istituzioni che pagano stranieri e gettano in strada italiani. Stampa, economisti che schifano la microimpresa ch'è genio italiano. Il cancro dello Stato è la #sinistra.",1
"1,8 milioni sono gli Italiani che dal sud si sono spostati verso il nord e fuori dall’Italia dal 2001 a oggi. Una marea di persone anche più ampia di quella immigrata in Italia",0
"I musulmani del cazzo in India legano i cani agli scooter x divertimento e li trascinano chilometri finché non muoiono. Una canina di recente madre di 6 cucciolini è morta così. Uccidere cani (esseri impuri in seno all'Islam) sarebbe un precetto della ""grande religione di pace"" [URL]",1
[USR] Ci avete rotto i coglioni con questi migranti! Non riuscirete a fare il lavaggio del cervello agli ITALIANI!,1
Vorrei fare con te come #Salvini ai rom con le ruspe,0
[USR] quando farete pulizia tra preti africani e non dediti al business dell’immigrazione o pedofilia o propaganda gay?In chiesa vogliamo sentire parola di Cristo non la pubblicità agli africani clandestini i cui crimini non nominate mai!Basta politica in chiesa.,1
Ciao Guagliù!!!  Oggi ė la giornata dedicata ai migranti morti in mare. Il TOTEM della pace di Molinari li... [URL],0
[USR] [USR] [USR] [USR] [USR] [USR] [USR] fare accordo con un paese africano qualsiasi e spedire là tutti gli afroislamici che i loro paesi non vogliono! È follia tenere in casa criminali stranieri a zonzo!!,1
"#quartarepubblica#migrante del #baobab: ""adesso dove vado? 😭"" ... dopo che aveva vitto e alloggio!E gli Italiani senza casa e lavoro che hanno subito la ""crisi"" che non sanno dove andare, dove vanno?Tu torna in Africa intanto, che recuperiamo qualche fondo per noi.",1
[USR] [USR] [USR] Questi sono i profughi che noi dobbiamo non solo MANTENERE dopo che rubano stuprano uccidono spacciano droga adesso vogliono uccidere il nostro Salvini 🤢🤢👿👿Adesso Salvini i prossimi chi sono????🤕🤕😨😨😨,1
Il casino libico torna comodo per certi magheggi col petrolio? Continuate a parlarci dell'emergenza migranti... [USR] #report,0
“Buon anno ai 5 milioni di immigrati che vivono lavorano e studiano nel nostro paese “  “Il rapporto con gli altri non è un limite ma ciò che da’ senso al nostro esistere#  Grazie #Mattarella !,0
"[USR] [USR] [USR] [USR] [USR] [USR] [USR] [USR] [USR] Vivendo in mezzo a due campi rom a Roma posso confermare che questa politica è un suicidio, se si vogliono ancora fomentare la rabbia e l'odio tra cittadini e istituzioni beh complimenti obiettivo centrato.",0
Questi non dovevano pagare le nostre pensioni???  Parole del PD   La sentenza della Cassazione: pensione pure agli immigrati appena arrivati L'Inps deve pagare il sussidio di invalidità civile anche a tutti gli extracomunitari   [URL] via [USR] [URL],0
"#RightToReturn #1YearOfGreatReturnMarch A Gaza, in Siria Libano Cisgiordania vivono milioni di profughi palestinesi, quelli cacciati con la #Nakba e i loro discendenti. Il loro diritto a tornare nella loro terra è stato sancito da ONU eppure stanno ancora morendo per poterlo fare [URL]",0
SALVINI: ANCHE AI ROM SE HANNO LA CITTADINANZA ITALIANA E NON VIVONO NELL'ILLEGALITA'.  Il reddito di... [URL],0
Argomento stupro. per che avvengono tanti sturi dai stranieri- Per che ci a aperto le porte a una immigrazione non a capito che solo uomini senza donne finivo con stuprare. Cosa fare rimandarli e subito o castrare a chi commetto lo stupro,1
"Roma, studentessa cinese morta: fermato un rom del campo nomadi [URL]",0
"Ormai l'anti islamismo é sdoganato. Razzismo puro.  Invece che contro il terrorismo, la gente se la prende con l'Islam. Tutti a difendere-",0
Che fregatura #Alfano dopo l'uccisione del terrorista a Milano  non ha potuto dare la notizia e prendersi i meriti… [URL],0
Corte Costituzionale: Stop Islam è Anticostituzionale. - Firma la petizione! [URL] di [USR] [USR] e condividi grazie Marco,1
Tutti i MMS parlano dei morti islamici in Canada. Ma non parlano dei cristiani che giornalmente vengono uccisi dagli islamici.,1
"Ermal Meta: ""Il problema dell’Italia non sono i migranti ma il malaffare. Non è razzismo, ma paura"" [URL]",0
[USR] Salento in ginocchio per gli ulivi lo stato che fa pensa a trovare alloggi agli immigrati forza Matteo il Salento e con te,1
"“Sono rom, abbracciami”. E tutti lo abbracciano. Tranne due (poveretti) [USR] [URL]",0
"Lotta all’immigrazione clandestina e al terrorismo islamico, difesa dei confini. Lunga e positiva giornata di lavoro a Parigi con i Ministri di Francia, Germania, Gran Bretagna, Stati Uniti, Giappone e Canada.  L’Italia torna protagonista! ?? Buona serata Amici. [URL]",0
[USR] È sotto gli occhi del mondo. ..l'islam vuole diffondere la casa di Allah con soprusi e violenze. .non è una religione ma un ideologia che recluta individui che vengono indottrinati per poi uccidere gli infedeli. ..sottomettere i popoli  privarli della propria libertà di pensiero.,1
"Piccola nota: alcune popolazioni rom sono in Italia da 600 anni, a voglia ""entrare a casa tua"". La pic invece è pur… [URL]",0
Non ho capito cosa è successo alla #Lidl. C’erano rom in offerta?,0
E'troppo complicato far capire ad alcuni che il condannare il gesto dei dipendenti #Lidl non significa accettare tutti i reati dei rom...,0
"Era solo un ragazzo che voleva vivere, glielo abbiamo negato, grazie a Salvini e DiMaio ed al loro decreto Sicurezza.   Genova, folla ai funerali del migrante suicida: 'Non rubate a questi ragazzi il loro sogno' [URL] via [USR]",0
Questi sono i veri profughi da salvare non tutta quella feccia che arriva nel nostro paese .buonisti di merdaaaaaaaa [URL],1
"auguri a chi abita a Milano e ha figli piccoli.. con asili, scuole infestate da stranieri e pure clandestini che non capiscono ben poco di italiano.. quale livello di istruzione potranno avere i figli degli italiani con simile invasione... [URL]",1
"Ogni volta che rievoco la grandezza italiana, salta fuori il piddino che mi rammenta la Sicilia arabo-normanna, o gli artisti stranieri accolti nelle nostre corti. Ma volete paragonare queste cose con la deportazione di analfabeti subsahariani? Ma vergognatevi, ridicoli coglioni.",1
se la juve oggi perde vado al primo campo rom a fare un po di spaco botiglia amazo famiglia,1
[USR] [USR] [USR] E se poi ve sparamo in FACCIA? Che dice l'Islam?,0
[USR] sanno solo dare dei fascisti...non si rendono conto che è. Un grave problema.. Gli immigrati sono quasi tutti delinquenti,1
QUALCUNO MI SPIEGA PERCHÉ I TRENTA EURI PER I MIGRANTI DI TROVANO E LO SPREAD NON SALE....MENTRE PER VENTICIQUE EURO AL MESE AI POVERI  ITALIANI  LO SPREAD SALE...MA LO SPREAD É RAZZISTA X CASO?....MASSA DI RIDICOLI SCHIAVI DI BRUXELLES CORVACCI NERI L ITALIA È LIBERA FINALMENTE,1
"[USR] AAAAGIGÌ. Ma, hai sentito Manlio di Stefano cosa ha dichiarato riguardo ai SORCI DI FOGNA COSÌ DETTI ROM? DARGLI LA CASA!! Cioè noi paghiamo le tasse e una casa ce la sogniamo. Mentre i ROM truffano rubano NN PAGANO TASSE. anzi si allacciano all'enel abusivamente",1
"La sinistra di merda ha perso le elezioni ed è praticamente morta a causa dello #iussoli e dell'immigrazione in generale. Ora mentre il Paese è scosso da crimini efferati compiuti da immigrati, su cosa puntano? #immigrazione e ius soli. O son deficienti o sono pupazzi #NOIUSSOLI",1
[USR] sarebbe bello che tre nomadi chiedano scusa alla signora anziana derubata e infortunata,0
"Donne straniere, essere mamma è un rischio - Mancato accesso alle terapie e alla diagnosi. Difficoltà linguisti... [URL]",0
#BRESCIA Video impressionante 25nov. #Islamici marciano in occasione della nascita di #Maometto. l'#Islamizzazione d'Europa è tangibile nel silenzio della politica istituzionale. L'#islam nn é religione ma ideologia di conquista e sottomissione incompatibile con la Costituzione [URL],0
"I PDIOTI SLARP SLARP ZERBINI DEI POTERI FORTI DELLE LOBBYES DELLE BANCHE SLARP SLARP😁😂 DI BRUXELLES CONTRO IL POPOLO ITALIANO, PD CHE AMA SVISCERATAMENTE GLI AMICI MIGRANTI CLANDESTINI AFRICANI DELINQUENTI, SOLO PER IL PROFUMO DEL LORO VIL DENARO SULLE SPALLE DEGLI ITALIANI",1
"Corteo contro il #DecretoSalvini a Roma: bandiere rosse, centri sociali, musica ""etnica"" e ""L'Internazionale"", cori ""Odio la Lega"", kompagni ""presunti profughi""... Confermo anche agli ""amici"" in piazza: la pacchia è STRA-FINITA! 😉#primagliitaliani LIVE 👉🏻 [URL] [URL]",0
"Migranti: mons. Staglianò (Noto), ""disponibilità dalla gente ad accogliere i profughi salvati dalle navi Sea Watch e Sea Eye"" | AgenSIR [URL]",0
"[USR] Possibile che si debba passare ai fatti per far capire a tutti che ci siamo stufati di essere presi per il culo e per il portafogli? Io non voglio dare un euro a migranti, clandestini, rom e feccia varia.",1
"Roma, nomadi bloccano la strada con un frigorifero per rapinare gli automobilisti BISOGNEREBBE RINCHIUDERLI AD ALCATRAZ NON IN 1 GABBIA!",1
"Sono bastati una decina di migranti per far emergere tutte le contraddizioni di questo Governo, che mesi di opposizione sui congiuntivi e felpe.",0
"Quando si parla di #immigrazione (clandestina e non) si fa sempre riferimento agli immigrati africani, ma in realtà sono solo una minima parte della popolazione straniera che arriva in Italia.  Leggi i numeri #ISTAT [URL]",0
"buonisti con il c**o degli altri. Ma in ogni modo meglio così. Qualsiasi iniziativa per contrastare l'immigrazione incontrollata è apprezzabile, anche se un po' meno faccia di tolla quando ci si riferisce agli altri sarebbe apprezzabile [URL]",0
L er famiglie italiane per il NO al bastardo Renzi amico di islamici e pederasti vari! [URL],1
"[USR] vuoi mi mischiare la discussione ! I rom rubano , Chiaramente non tutti ! Una parte di mussulmani uccide come una parte di >>",1
"[USR] [USR] La cremazione sarebbe la soluzione ideale e più igienica,ma i signori islamici la r… [URL]",0
AVETE ROTTO I COGLI[USR] VIA L'ISLAM DALL'ITALIA SE VOGLIONO RISPETTARE LE LORO TRADIZIONI TORNINO A CASA [URL],1
I buonisti si schierano a favore dei rom e credono nell’integrazione. Rivolta anti-rom in un quartiere che già aveva i suoi problemi... riusciranno ad integrarsi? ? #TorreMaura [URL],0
"Torna «Book Pride», tema: lo straniero. A Milano la fiera con 200 editori indipendenti. Ne scrive Severino Colombo… [URL]",0
"Un messaggio per i tanti immigrati regolari e perbene, che rispettano la storia e la cultura di questo Paese, che pagano le tasse, che mandano i figli a scuola, che fanno un lavoro onesto e che sono italiani quanto me. Chi accusa me o la Lega di ""razzismo"" non ha capito nulla. [URL]",0
"Migranti, Sea Watch attracca nel porto di Catania, i migranti si abbracciano - Politica - ANSA Ora sequestrare quella bagnarola  e arrestare l’equipaggio per traffico di esseri umani  [URL]",0
"Basta indottrinamento, ormai dalle materne inizia, ne sono testimone!! Noi non siamo musulmani, non odiamo le donne, non odiamo la legge e sopratutto non imponiamo niente!! #islam è sottomissione in tutti i sensi, io non ci sto! Che si fottano allah e suoi compari!!",1
"Africani senza vergogna, ci fanno invadere da milioni di immigrati e poi... la loro ridicola (e vergognosa) accusa a Salvini [URL]",1
"Dopo la vittoria della Brexit, in Gran Bretagna gli episodi di violenza contro gli stranieri sono aumentati del 50% [URL]",0
"[USR] Prima espulsione forzata di massa di tutti i clandestini,migranti,richiedenti asilo,rom. X trasgressori arresto e miniere.",1
"Buongiorno a quella gente là di #Goro a cui dovremmo dire tutti in coro ""Fate le barricate pè i migranti? 'Nnatevene affanculo tutti quanti""",0
Ecco il #piano nomadi della giunta #Raggi: il fallimento annunciato [URL],0
"Hanno più sussidi e diritti gli #immigrati che i nostri disabili... Resta un quasi 20% di rincoglioniti, asini, truffatori, ladri e criminali che finge di non capire...",1
"Forse è tempo di eliminare i mussulmani dalle mense scolastiche, noi non paghiamo le tasse scolastiche e libri di testo per cambiare le abitudini alimentari dei nostri figli, se non gli garba vadano a studiare altrove.😡😡 [URL]",1
Gli islamici hanno i martiri ...in Italia abbiamo i fessi,1
e quelle col burqua dov'erano?  Non gli hanno consentito  di manifestare i maritini islamici integrati? [URL],0
"[USR] [USR] non aveva detto che se ne sarebbe andato dall'Italia? e quindi? cosa vuole? se antepone gli stranieri agli italiani sia coerente,se ne vada",0
"(Comunque per la gioia dei saputelli una che ha parlato italiano senza accento e senza imperfezioni c'è, ed è la rom che è uscita a parlare coi giornalisti attraverso il cancello.) [URL]",0
E a Genova con la Paita? E i rom? [URL],0
[USR] [USR] [USR] [USR] [USR] anche migliaia di cinesi e rom votarono Bersani 😂😂,0
Ho votato emendamento [USR] che punisce con la reclusione costrizione al matrimonio di donne o minori straniere in Italia o all’estero. L’ho fatto perché ho avuto caso di una mia studentessa minore del Bangladesh che mi ha scioccata. Mi perdonerà il gruppo [USR] ??,0
-L'infame day. Niente «carta famiglia» per gli immigrati poveri. Passa un emendamento alla legge di bilancio che prevede sconti solo per gli italiani e i cittadini Ue con almeno tre figli. E no all’aumento dei fondi per gli orfani dei femminicidi.- E l'assuefazione [USR] [URL],0
"Nuovo campo rom a Roma Nord, i rom: ""Dateci parola in Consiglio""... #news #Roma [URL]",0
"Roma, Capriccioli (Radicali): rom e rifugiati, mentre Raggi guarda il dito del rovistaggio delibere ... - [URL]",0
"LN Padania: Francia, il terrorista Abdeslam interrogato dai giudici si rifiuta ancora di rispondere [URL]",0
"[USR] [USR] Le ONG hanno il compito di portare a termine l’opera dei trafficanti nel portare masse di migranti dall’Africa verso l’Europa incentivando nel contempo le partenze. Contribuiscono così alla destabilizzazione sociale ed economica dei Paesi, di cui gli speculatori traggono profitto",0
"Questi finti preti e questa finta accoglienza ! Il traffico di droga non rendeva più e padre Mussie Zerai si è ""rilanciato "" nell'immigrazione clandestina che rende più della droga !",1
"[USR] Non meriti simpatia a prescindere dall'abito che indossi. La tua simpatia è scivolata via tra le lacrime dei sacrifici che avete imposto all'Italia e agli italiani tutti,mentre voi stavate inginocchiati a un'Europa che disprezza i propri popoli per adulare i migranti. Mi fai pena",0
"Il Fatto Quotidiano: Maria Grazia Cucinotta: “Se entra un ladro a casa mia, sparo. Campi rom? Vanno radunati i [URL] #M5S",0
"Decreto sicurezza, ok cdm: stretta su migranti e case occupate. Salvini: via tutti i campi rom LIVE [URL]",1
[USR] [USR] [USR] mi auguro che tutti quelli come voi un giorno si trovano sotto casa tutti rom e clandestini,1
interessi stranieri prevaricano interessi itaiani questo si chiama tradimento e va punito con la vita e con la morte [URL],1
"Palermo: con maschera e valigetta alla fermata del tram, scatta allarme terrorismo [URL] via [USR]",0
Non si è mai visto a memoria d’uomo un popolo migrare verso uno Stato in #recessione. I #migranti non vengono qua per  🔹Lavorare 🔹Avere un futuro  Ma per sostituirsi agli autoctoni cacciandoli via. Scopo❓ LA DIASPORA DEGLI ITALIANI  (Popolo più uniti di quanto crediate),1
"Dal caos Rai dopo dimissioni Verdelli alla caccia al terrorista di Istanbul: - Istanbul, la caccia al terrorista… [URL]",0
I profughi della decrescita felice ora devono sperare nella crescita per salvarsi.,0
Mitico #scatà che ha ucciso il terrorista di #Berlino! ...IT piena di delinquenti terroristi grazie al governo di deficienti finto buonisti,1
[USR] [USR] Per me sono falsi cristiani come ne abbiamo milioni nella sola Italia. Si specula troppo sulle religioni. Molto male.,0
"Prime dichiarazioni di #Salvini: ""Arrestato Lucano? E cosa vuoi di più dalla vita?"" #Riace #sindacodiRiace #Lucano #migranti #Governo #tgla7 #propagandalive [USR]",0
Prima dovete dare lavoro a tutti gli italiani perché se viene meno tale presupposto e poi parlate di immigrazione (per quanto con quote e addirittura formata) hai voglia a vedere proliferare nazionalisti. #PiazzaPulita #immigrazione,0
"Studentessa cinese morta a #Roma, fermato un ventenne: è un nomade del campo di via Salviati [URL] [URL]",0
"#dallavostraparte Ha fatto bene il ristoratore dare cena a soli italiani, sono i più bisognosi rispetto ai migranti che il Gov.PD da tutto.",1
"Piuttosto, meglio curare carie ai cani, perché sono veramente sinceri e riconoscenti..!! Ma di cosa stiamo parlando..? Ci sono molti Italiani poveri che non possono accedere ai servizi odontoiatrici... e questi stronzi pretendono di offrirne gratis a stranieri e clandestini..? 🤔",0
[USR] [USR] [USR] Pensaci tu per gli stranieri....  A rosiconeeeee,0
"[USR] A forza di immigrati sembra che qualcuno al governo ci goda ad avere città con favelas,violenze e sporcizia,furti e degrado.",0
"Blitz della polizia al campo nomadi:trovate le borse appena rubate  ""PADOVA - Ampio controllo della Polizia... [URL]",0
mò hanno diffuso pure la foto del poliziotto che ha fermato il terrorista #berlinattacks #Milano #Polizia [URL],0
"#ROM PRENDEVANO GLI ASSEGNI FAMIGLIARI DAL COMUNE DI #Torino, PUR POSSEDENDO UN BEL TESORETTO DI 420MILA EURO. E NON SONO GLI UNICI CASI SCOPERTI IN QUESTI ANNI… ROM BRAVA GENTE? SI SI…CERTO, COME NO!  [URL]",0
"“L'Italia deve rimpatriare gli immigrati irregolari, altrimenti sanzioni Ue”: Anche se i flussi di migranti in… [URL]",0
Sri Lanka:colti e ricchi i terroristi ISIS. la madre si è  fatta saltare uccidendo 3 figli e dei poliziotti...MA CON CHI DOVREMMO INTEGRARCI?,1
".[USR] [USR] [USR] Io ricordo anche che i terroristi protetti a Sigonella,non furono incarcerati ma espulsi",0
"6 milioni di ebrei, 3 milioni e 300 mila prigionieri di guerra, un milione di oppositori politici,500 mila Rom, 9 mila omosessuali, 2250 testimoni di Geova,270 mila tra disabili e malati fi mente,tra gli 80 mila e i 200 mila massoni.  Vittime della #Shoah.  #GiornatadellaMemoria [URL]",0
Ma nessuno parla del fatto che la rom forse forse si è divertita? Rideva alla fine. #biancoenero,0
"[USR] [USR] [USR] O sei daccordo senza discutere coi boldriniani o sei da appendere,basta!Tutte le trasmissioni sono condotte da gente che ci vuole fare inghiottire a forza che essere gay è la normalità,l'immigrazione a cazzum è la felicità o sei fascista. Ne abbiamo piene le tasche fino all'orlo!",1
E meno male che dovevano pagare le nostre pensioni... #migranti #parassiti #invasione [URL],1
"Roma, l'ex stabilimento Mira Lanza diventa un museo di street art gestito da rom (La Repubblica)… [URL]",0
"anziché darla ai poveri del suo comune, la regala agli zingari ! Orlando regala villa ai Rom, ma loro: “Ora deve darci corrente e acqua” – VIDEO [URL]",1
[USR] previsto a Roma in via casalombroso arrivo 1000 nigeriani in zona già problematica per nomadi si sta innestando problema,0
"Perché il pensiero di Abduh, capofila del riformismo islamico, ha dato vita sia al modernismo che al fondamentalismo [URL]",0
"[USR] [USR] Fratoianni - Rifondazione-Centri Sociali, e due giornalisti pro traffico migranti , non fanno i turisti , lavorano contro l' Italia",0
africanizzazione di Milano tutto secondo i piani della invasione ed espansione islamica in Occidente [URL],1
"voglio l'eclettismo di voi falliti che passate da ""no alla violenza contro salvini"" a frasi tipo ""bruciamo i campi rom"" #salvininapoli",0
"#StevenWoolfe  [URL]  Tutto ciò... Indovinate per colpa di chi? Ma dei #migranti , naturalmente... 😊👍  #Risorse",0
"[USR] Aggiornamento: nonostante non accogliamo più nessuno, la criminalità aumenta e l'economia crolla: non sarà che il ""problema"" dell'immigrazione è solo fuffa inesistente per riattivare paure che favoriscono le dx più estreme?",0
[USR] [USR] [USR] almeno facesse meno danni possibili a Roma ma con la sua politica filo clandestini rom ed assimilati...,0
Senza di loro l'Italia sarebbe un paradiso !  E’ boom crimini immigrati: 200mila arresti in 9 mesi [URL],1
"[USR] Quattro poveri #profughi"" fra cui un minore nn accompagnato? In #Italia rispettare norme su immigrazione è un optional vero?",0
“Fermate lo sgombero del campo rom di via Germagnano”: appello alla Corte Europea ... #news #Torino [URL],0
[USR] [USR] no ce porta i negri come te e ce li lascia ...zecca rossa devi crepare,1
[USR] Ma che immigrazione! Sono orde di distruzione. Tutto pago soldi di ISIS e quel maledetto Soros.,1
"[USR] [USR] [USR] Profughi... Hahaha. Che buffoni siete. Clandestini da cacciare al paese loro a calci nelle terga, ecco cosa sono.",1
