text,label
"[URL] ‼️Condividete a raffica. Per la prima volta una ""alta"" rappresentante della UNHCR ammette contiguità con Soros e le carte di credito fornite a immigrati  Adesso vengano ancora a dirci che siamo dei visionari malati.  SBUGIARDATI",1
"Il giornalista Joakim Lamotte riporta che, in Svezia, due immigrati responsabili dello stupro di una 11enne sono stati rilasciati. Le femministe continuano a tacere. Le femministe, in nome del multiculturalismo, hanno concesso agli immigrati la licenza di stupro.",1
Italia: il paese dove gli stranieri fanno quello che vogliono senza essere puniti. È una vergogna! #larena  #RomaFeyenoord,1
"Roma, studentessa cinese morta: condanna con patteggiamento per due rom - [URL] [URL]",0
"#Roma #TorSapienza Studentessa cinese morta, fermato il terzo borseggiatore del campo rom #Salviati [URL]",0
"Dove prima c'era un campo rom, ora sorge il primo ""villaggio dei senzatetto"" d'Italia! [URL]",0
"[USR] Chi non conosce l'Islam non può comprendere.  Ma stia tranquillo, neanche un miliardo e 700 milioni di musulmani comprendono l'Occidente.  E questo è un bene ☺",0
#Islam «Gli #ebrei hanno paura e scappano dalla #Francia per colpa dei musulmani radicali» [USR] [URL],0
"Parliamo di Rom, li respingiamo, li pestiamo a volte (Hitler ne ha gasato centinaia di migliaia), li rinchiudiamo in veri e propri lager alle periferie delle nostri città. Ma sono veramente tutti sporchi, ladri e cattivi? Che cosa sappiamo di loro? [URL]",0
"[USR] Bisogna capire che il problema è di chi fa partire i barconi. Bisogna capire l’incoscienza di queste persone , per non dire che li mandano a morire. L’Italia ormai , per anni , ha accolto milioni di INVASORI (perché non si tratta di immigrazione) , ma l’Italia è piccola.",1
"[USR] Importano barconi di #immigrati da paesi in cui la #tubercolosi è  endemica,   poi l'untore è  la #Maestra : ma che vadano tutti a ramengo !  Maledetti bugiardi",1
"#Orlando ignora il dl #Salvini: iscritti quattro #migranti all'anagrafe.  E allora adesso facciamo pure finti matrimoni tra migranti e Italiani, no? ah! Ci ha già pensato #Lucano!  [URL]",0
"Cassazione Federale tedesca stabilisce che vietare matrimoni #sharia con bambini è incostituzionale perché tutti i matrimoni sono protetti dalla legge.Quindi, in #Germania, la #pedofilia è un crimine... solo se non sei #musulmano.#Islam #NOGlobalCompact[URL]",0
"E così non potranno difendersi donne, uomini e bambini che vengono torturati da #SalviniDimettiti e sottoposti ad ingiuste detenzioni #migranti #razzismo #legaladrona [URL]",0
"Giornata della Memoria, i rom di Milano commemorano il loro “Porrajmos” [URL]",0
"Stanno arrivando i migranti che uccidono i cristiani. Faccia attenzione il caro Renzi, perché in Italia di cristiani ce n'è più di qualcuno.",1
[USR] Penso che se queste merde straniere si permettono di venire qui a parlare contro di noi è perché ci sono schifezze femminili come la  raccomandata Berlinguer che li lascia parlare...lei è la nemica dell'italiano e deve essere messa fuori dalla Rai!!!,0
Non possiamo difenderci perché ci arrestano..se mi scade l'assicurazione della macchina e non rinnovo in tempo mi multano gli stranieri no,1
"Sanremo, 23enne aggredita sulla pista ciclabile e violentata da un migrante sudamericano: è caccia all’uomo! Sono bestie stupratori seriali..una vergogna! #MovimentOnesti [URL]",1
Tutti gli attentati sono di matrice islamica Affermare l'inizio della TERZA GUERRA MONDIALE x causa di religione no… [URL],1
[USR] 12 milioni ai rom  e gli italiani muoino  di fame COOP =MAFIA  VERGOGNA RIBELLIONE FORZA! #dallavostraparte dai che manca poco!,1
La musulmana @ Nadia_Connects mente spudoratamente al #WomensMarchDC (finanziato da Soros): Il Corano ha ispirato Thomas Jefferson e la Dichiarazione d'Indipendenza. 😂 [URL],0
"Roma, cinese morta, blitz al campo rom: davanti alla Questura resta una discarica... #news #Roma [URL]",0
#staseraItalia #portichiusi #primagliitaliani  Prima #Amatrice e poi i finti profughi! #bastaricatti basta!!!,1
Stasera a #QuintaColonna focus sulle conseguenze degli sgomberi nei campi #rom che stanno interessando varie parti d'Italia.,0
"[USR] in Cisgiordania non c'e' HAMAS. A tutti quelli che... la colpa e' dei ""terroristi"" quale scusa adesso?",0
"[USR] Prima espulsione forzata di massa di tutti i clandestini,migranti,richiedenti asilo,rom. X trasgressori arresto e miniere.",1
[USR] I peggiori criminali sono SEMPRE stranieri. Ricordatevelo quando andrete a votare. Se voterete PD consegnerete i vostri figli in mano a orribili criminali immigrati.,1
"Roma, l'ex stabilimento Mira Lanza diventa un #museo di #streetart gestito da rom | [USR]  [URL]",0
[USR] Assurdo che stranieri dicano cosa deve fare un Paese sovrano #noeuro #noeuropa [USR] [USR] [USR],0
[USR] [USR] [USR] [USR] Doveva sparare ai delinquenti immigrati ingrati ! Grazie pd e tutta la merda che siete voi globalisti europeisti euroinomani folli ! Tutto per denaro ! Venderebbero la madre i sinistri ! Schifosi di merda !,1
[USR] A me fanno più schifo gli ex terroristi che i pirati disarmati,0
IL GLOBAL COMPACT VORREBBE L'INVASIONE MIGRATORIA EQUIPARANDO MIGRANTI ECONOMICI E PROFUGHI. PREVEDE CHE CHIUNQUE CRITICHI L'INVASIONE SIA PERSEGUITO PENALMENTE. SI PIANIFICA LA SCOMPARSA DEI POPOLI EUROPEI E LA REPRESSIONE DEL DISSENSO. ORA VEDIAMO DA CHE PARTE STA IL M5S. [URL],0
TERESA MANNINO elenca gli stereotipi più diffusi sui migranti in Italia. [URL],0
"Ritornano i nostri dalla germania e noi gli mandiamo immigrati non registrati in italia anche se fosse paese di primo sbarco , per scusarci diremo : sono scappati all' identificazione ! 😂😂😂😂  La Merkel come il PD , è finita ! Europee 2019 la loro ghigliottina tagliateste 💩💩",0
Per la rumena di casa i neri immigrati sono i malviventi e la rovina del benessere italiano. 😒 Perché l'italiano e loro sono dei veri angioletti! 😑😒,1
"Il Razzismo gli viene inculcato sin da bambini dal corano e dall'islam Cani, Maiali. Cristiani ed Ebrei sono impuri, infedeli e da sterminare. Il nemico e gran Pezzo di Merda è colui che li vuole qui a tutti i costi.",1
#Sezze #Lazio #Migranti protestano per cibo no buono e bloccano il camion del servizio catering. Scusa ministro [USR] nn sarebbe ora di iniziare a offrire pane e c[USR]*i in culo? [URL],1
gli integralisti islamici comunque fanno più danni della peste bubbonica maledetti loro e le loro credenze del cazzo,1
"[USR] [USR] Soros e socio della UE x l'invasione dell'occidente, di questo su twiitter se ne parlava già anni fa, la sinistra è il mezzo x la propaganda di pietismo x l'accettazione dei popoli all'islam ! Mi chiedo con paura, perché venderci a una setta satanica, non certo x i salari bassi😨",1
[USR] [USR] Quindi gli italiani nn fanno bambini x colpa dei migranti? Ma che c'entra ? Ma di cosa vi fate ? E poi giustamente vi rispondono che milioni di italiani sono emigrati x questo motivo ! E nn per questo gli altri si sono estinti ! IDIOTA tu e che ti crede,0
Attendiamo con ansia gli #ispettoriOnu così potremo mostrare loro #Milano alle 5 di mattina quando migranti girano nudi e aggrediscono chiunque osi protestare !! [URL],1
"[USR] [USR] [USR] [USR] [USR] [USR] [USR] [USR] [USR] [USR] [USR] [USR] [USR] [USR] [USR] Le sue gesta pro mussulmani sono sotto gli occhi di tutti !  Ogni commento e inutile.....  Ha un solo obiettivo, il governo mondiale con il #New #World #Order! [URL]",0
"Quelli che dicono io non sto con #Salvini perché non sono razzista lo sanno usare il mono neurone o siete condizionati dal politicamente corretto? L’immigrazione esiste da sempre in Italia, questa non è immigrazione questo è un colossale piano di invasione e sostituzione #Sanremo",1
"[USR] Ormai è assodato che quelli bravi e preparati in Italia sono tutti antipatici. Sono invece simpatici gli ignoranti, purché non siano neri e musulmani e in genere stranieri.",0
"Tangenti e favori anche dai migranti, viceprefetto arrestato a Savona| [URL]",0
[USR] Ok poi li facciamo dei rom  extracomunitari senza permesso centri sociali e comunisti behqti facciamo presto,1
"[USR] Guai a dirlo a quelli che [USR] è disonorevole, che l'emergenza #migranti non esiste, ecc.",0
#desideroChe il mondo tiri l atomica su tutti i rom esistenti....gatti compresi....... L isis dive cazzo è quando serve.... #Lidl,1
#staseraitalia NON VOGLIAMO MANTENERE IMMIGRATI-NN VOGLIAMO MANTENERE IMMIGRATI-NN VOGLIAMO MANTENERE PARASSITI IMMIGRATI VIOLENTI E BUGIARDI.,1
"Roma, ritrovate moto rubate in campo rom: La Polizia Locale ritrova motoveicoli rubati nel… [URL]",0
Boldrini accoglie studentessa immigrata a cui e' stato negato accesso all'Aula - Italia - ANSA.it [URL] via [USR],0
"#QuintaColonnama se è assodato che i rom, zingari, vengono in ITALIA x rubare, perché li fanno parlare? Un buchetto in fronte e via.",1
Mitico #scatà che ha ucciso il terrorista di #Berlino! ...IT piena di delinquenti terroristi grazie al governo di deficienti finto buonisti,1
[USR] caro Matteo devi rimpatriare tutti perché sono criminali sti immigrati Spazzatura puzzolenti spacciatori stupratori [URL] sono arrivato al punto di andare armato xche non permetterò a nessuno di rapinarmi o chissà.voglio un'Italia pulita grazie,1
"[USR] [USR] Hanno rotto i coglioni con questi immigrati ! Sono violenti, non rispettano ne’ vecchi ne’ bambini! Sono con malattie e vogliono essere mantenuti !!! Di Battustaaaa! Ficoooooo! Avete rotto le scatoleee ! Pago un enormità di tasse ! Bastaaaa! Voglio vivere in Italia ! A casa mia !",1
"Perché è stato arrestato #MimmoLucano, l’anarchico dell’accoglienza ai #migranti. #Riace [URL] [URL]",0
#Belgio entro il 2030 diventerà #islamica e sarà sotto la #sharia.  Vogliamo fare questa fine? Se NON CACCIAMO il… [URL],1
Su la8 in chiaro c'è Roma-besiktas���� Nel mondo dei rom si������,0
[USR] [USR] E' assolutamente falso! Solo gli stranieri regolari pagano contributi. Ma anche se fosse vero… [URL],0
"#SeaWatch3 #migranti #siracusa [USR] [USR] fate togliere l'ancora a quei criminali e fateli allontanare,il maltempo è finito. Allontanate quella nave da Siracusa.",1
"[USR] [USR] Italiani che hanno lavorato  ma non hanno raggiunto i ,20 anni di contributi non percepiscono nulla . Stranieri del cazzo zero lavoro pensionati. Ricongiungimenti porcate di tutti i tipi. Serve una rivoluzione",1
[USR]  solo sulle cronache locali ogni giorno leggiamo i reati commessi da ROM SINTI e IMMIGRATI ! questi delinquenti devono marcire in carcere sequestrare i beni toglierli i bambini [URL],1
"Prince Jerry, nigeriano di 25 anni, laureato. Da due anni e mezzo in Italia, lavoratore. Morto suicida dopo che lo Stato italiano non gli ha riconosciuto lo status di rifugiato umanitario. Quando dite “è finita la pacchia” pensate a questo sorriso e mettetevi vergogna. #migranti [URL]",0
Pietre e petardi contro case migranti [URL] [URL],0
"Un colpo agli immigrati, una mano alle banche. Trump dà la prima pugnalata alla Dodd-Frank -… [URL]",0
#Teramo. Proteste dopo il taglio del budget al #business #accoglienza. Dietro il baffetto la trasformazione dell'#umanitarismo in business. E dietro ogni #cooperativa soldi statali e uno pseudo lavoro di finto volontariato.  E' finita la pacchia. Fatevene una ragione. #migranti [URL],0
Chissà a quanto andò lo spread quando Renzi disse “La UE ci aiuti con gli immigrati oppure si tenga la sua moneta'' [URL],0
Questo signore ha sicuramente torto e su questo non ci piove. Ma una cosa la dice ed è pure vera x lo stesso reato agli italiani viene dato il daspo cosa che non avviene x gli immigrati. Ma la legge non è uguale x tutti?,1
[USR] [USR] [USR] Anche per questi (p)idioti  la pacchia è finita. Presto  (per loro)  a pulire i cessi dove defecano gli immigrati.,1
"CONIUGI PESTATI A SANGUE A #LANCIANO, ARRESTATI ROM: SARA’ UN CASO?    Era fondamentale assicurare alla giustizia questi farabutti. Noi non siamo razzisti. Però troppo spesso sono immigrati irregolari a compiere delitti così brutali. Adesso ci attendiamo giustizia in modo netto! [URL]",1
"A #Goro se si rifiutano i migranti apriti cielo ,tutti a dire razzisti   A #Capalbio invece no.  Questa è becera #ipocrisia comunista",0
"#coffeebreakla7 qsti applaudono alla resa all'islam,#Mattarella prima dichiara illegittimo il parlamento(2013) poi… [URL]",1
"Torna «Book Pride», tema: lo straniero. A Milano la fiera con 200 editori indipendenti. Ne scrive Severino Colombo… [URL]",0
All'estero siamo simpatici perché gesticoliamo molto ma gli stranieri non sanno che li usiamo per mandarli a fanculo senza farci capire,1
"Dalla Grecia all'Italia in una cella frigorifera, scoperto carico con quattro stranieri. Le immagini... #news #Bari [URL]",0
"Hanno più sussidi e diritti gli #immigrati che i nostri disabili... Resta un quasi 20% di rincoglioniti, asini, truffatori, ladri e criminali che finge di non capire...",1
ho Piave insorgi troppi migranti si stanno seminando in tutta italia insorgi  batti il tuo pugno di ferro e grida COME FU NEL 15-18 E IL PIAVE Mormorò NON PASSA LO STRANIERO [USR],1
"La sparata del comunista: ""Il dl Migranti di Salvini? ​Ritornano le leggi razziali""....LORO SONO I RAZZISTI CONTRO GLI ITALIANI!  [URL] di [USR]",1
"[USR] Sinora abbiamo visto distrutti i tessuti sociali di tanti centri urbani proprio a causa dell'immigrazione incontrollata di soggetti, pressoché esclusivamente di sesso maschile, poco inclini all'accettazione delle regole che garantiscono i rapporti sociali in Italia.",0
"Rosà,la vera vergogna non è far colazione con la nutella ma dare quel poco di risorse che avevamo ai negri ricottari ,quelli che voi chiamate immigrati.Lo facevate non per bontà ma solo x introiti economici e voti futuri e mi vieni a parlare di nutella?",1
"La correlazione rumorosamente sbandierata da M5S tra sbarchi profughi e Paesi che adottano il CFA, il franco delle ex colonie francesi, è semplicemente una bufala. Punto [URL]",0
"ONG I volontari insegnano ai migranti come recitare la parte delle vittime, come inventare storie strappalacrime e come recitare preghiere, un vero e proprio vademecum per ingannare gli agenti di frontiera   [URL] di [USR]",1
"#dallavostraparte ok occupare non va bene però perché se rom od immigrati fanno vedere bimbi restano ed italiano no,  pagava pure per di più",1
[USR] simpatico quanto due rom in una gabbia,0
[USR] [USR]  e dopo il rap del rom ieri a striscia oggi anche questo dobbiamo subire #dux dove sei w l'Italia,1
Senza di loro l'Italia sarebbe un paradiso !  E’ boom crimini immigrati: 200mila arresti in 9 mesi [URL],1
«gl`immigrati non trovan lavoro entro sei mesi devon tornar al paese d`origine»(David Cameron).In Italia...fan «gli abusivi a cazzo».,1
I migranti vorranno anche andare all'estero ma sono gli stessi paesi esteri che non li vogliono.  #GABBIAOPEN [URL],0
"Io chiederei uno x uno agli #immigrati che sui mezzi pubblici si lamentano degli italiani e dell' #italia,cosa ci fanno esattamente qui?",1
"A tutti i non musulmani dell'isis, vi sentite forti adesso?  Bravi coglioni! #Berlino",0
#SeaWatch3 una bagnarola spacciata per Yacht 🛥 ove finti profughi e cialtroni corrotti politici son stati a bordo a far baldoria!AFFONDATE QUESTE #ONG COLLUSE CON MAFIE E POLITICI Ladri!! [USR] [USR] [USR] [USR] [USR] [USR] [URL],1
🔴MASSIMA CONDIVISIONE🔴 👇🏿 Questo è Gaetano che sta per essere sfrattato di casa sua da un esponente dei #SINISTRI per far posto a degli immigrati clandestini.   Notare la bandana rossa sfoggiata dal PIDIOTA COMUNISTA.   [USR] INTERVENGA!  #robadamatti [URL],1
#Aquarius #malta si cucca i #migranti dopo 5 giorni di attesa per il maltempo. Indagato il mare per sequestro .🤣 #Salvini  [URL],0
Iniziano ritorsioni contro Governo: sindaco PD espropria case a italiani per darle ai migranti [URL],0
Avete mai visto un #rom che lavora?' stereotipi e discriminazioni colpiscono le persone appartenenti alla minoranz… [URL],0
"[USR] Emanuela, gli islamisti odiano la vita, si fanno esplodere per il loro testa di cazzoi Maometto, allora aiutiamoli,opera di bene",1
"Lui è Gianni il pomodoro. Per colpa di Salveenee che non vuole far sbarcare i migranti della #SeaEye in Italia non verrà mai raccolto. Non possiamo permettere una simile barbarie, VERGOGNA!  #facciamorete #restiamoumani #portiaperti #Amburgo [URL]",0
[USR] [USR] troviamo razzista l'associazione di reati con noi appartenenti alla minoranza linguistica #sinta e #rom. Vergognosi!!,0
[USR] chi vi ha chiesto di ritirare le “consegne” davanti alla #Libia? Chi continua a rifornivi di finanziamenti oltre a [USR] messo volontariamente i migranti in una situazione di pericolo.,0
"[USR] ""In fuga da guerre e persecuzioni""? Dite meno baggianate se ci riuscite, dopo aver visto le ""risorse"" gli italiani non vi credono più. Persino Frontex ha detto che oltre l'80% dei migranti illegali giunti in Italia dalla Libia sono economici e ""possono e devono essere espulsi"".",1
"#news #italy ""Ottomila firme contro il campo rom a Roma Nord: Campidoglio ascolti territorio"": In seguito al Consig… [URL]",0
"Per il sondaggio SVR, la Merkel ha il 43% di consensi tra gli immigrati. Praticamente, è più popolare tra gli immigrati che tra i tedeschi. Se non ci sono più tedeschi disposti a votarla, servono nuovi elettori che siano disposti a farlo: gli immigrati. [URL]",0
Capite che cos’hanno fatto i bastardi islamisti? [URL],1
"Dobbiamo sopprimere I campi rom, e questi vadano a lavorare cone tutti I cittadini italiani o tornino al loro paese. Maledetto PD",1
"Due guerre sono scoppiate in Israele: quella palestinese per avere uno stato. E l’altra sempre palestinese ma “condotta dall’Islam fanatico, a Gaza e a Ramallah, per distruggere Israele e cacciare gli ebrei dalla loro terra. Ogni persona dovrebbe aborrire questa causa” #AmosOz",0
"CON:  1) OLTRE 600000 CLANDESTINI PRESENTI IN ITALIA  2) CRIMINALI STRANIERI CHE STUPRANO, SPACCIANO DROGA, RUBANO E AGGREDISCONO   3) MILIONI DI DISOCCUPATI ITALIANI  NOI CHE FACCIAMO?  FACCIAMO ARRIVARE ALTRI STRANIERI CON I CORRIDOI UMANITARI !!!!   [URL]",1
#demagistris continua pure a pensare ai migranti e a salvini.  Coglione dimettiti,0
"[USR] Italia accoglie i mussulmani, e loro nel paese di provenienza violentano e tagliano la gola le nostre ragazze. Drita Vushaj",1
"Furio Colombo: a dirla tutta, nessuno nel fenomeno dell'immigrazione è clandestino. Quando chiunque arriva in Italia, viene immediatamente identificato. Clandestino è qualcuno che non sappiamo chi sia.   #BookPride18 [USR]",0
"L'Ue scrive a Roma: ""Dica quanto spende per i migranti"". Renzi, ""loro aprano il portafoglio"" [URL]",0
Vero paghi 400 euro corso per vivere come rom chi sono gli stronzi che lo fanno?mandiamo i politici nella m*...a dove starebbero bene,0
"#quartarepubblica #Islamofobia è giusto, perchè il #Corano è contro i nostri principi e contro la #Costituzione. Stiamo andando avanti a forza d bugie chiamate erroneamente tolleranza. Basta bugie è ora dire la verità senza ipocrisie.",1
NON SI OSI DIRLO NEPPURE PER SCHERZO! BISOGNA MANDARE VIA SUBITO I #MIGRANTI E ANCHE GLI #IMMIGRATI REGOLARI! ALLA FINE FRAU #MERKEL INSEGNA. #SALVINI #STOPINVASIONE [URL],1
Trovato in Croazia il tesoro della “regina” dei rom: sequestro da 6 milioni di euro: #Genova,0
"[USR] [USR] [USR] Si drogano pure gli immigrati e vanno a puttane anche gli immigrati, anzi questi qui, quando non possono permettersi la puttana, stuprano pure le donne di 80 anni, successo più volte anche questo.",1
"L'Islam sarà la più grande religione nel mondo entro il 2070, e sarà musulmana il 10% della popolazione europea [URL]",0
Malta: sbarcati i migranti dell'Aquarius - [URL] - [URL] [URL],0
"Giovani e tanta allegria a sfilata Pride Palermo. Orlando apre corteo accanto a ''migrante'', attenti a fascismo | #ANSA [URL]",0
"NO AL GLOBAL COMPACT sull'immigrazione. NO, NO, E NO. Non vogliamo piu' essere un cesso africano [USR] [USR] [URL]",1
Rubano le offerte davanti alla statua della Madonna: arresti nel campo rom [URL],0
#lariachetira anche l'ambasciatore è venduto alla cricca mondialista che vuole distruggere i popoli europei sostituendoli con gli immigrati,0
"I rom sono sporchi e rubano e drogano i bambini. Alessandra Mussolini a #lazanzara  Anche questa è ""libertà di parola"". Giusto? Quindi MUTI",0
"#Candreva il ? ""Ditemi quant è e pagherò"" io la mensa alla bimba straniera di #Minerbe a craker e tonno. Poi leggi l articolo e scopri che il Comune aveva +volte offerto ai genitori di lavorare ma questi si sono rifiutati categoricamente x la serie ""vogliamo essere mantenuti"".? [URL]",1
"Anche stavolta la Merkel ordina di dire che si tratta di un ""pazzo"" (però kossovaro,musulmano e che grida ""allah akbar"") #dusseldorf #terror",0
Vergognati qui i discriminati sono gli italiani e nn vogliamo essere invasi da fanatici religiosi islamici schiavis… [URL],1
"Roma, cinese morta: sotto torchio quattro rom del campo nomadi - Il Messaggero [URL] #Roma #news",0
"#ultimenotizie #news #notizie: Milano, maxi blitz dei carabinieri al campo nomadi di via Chiesa Rossa [URL]",0
[USR] [USR] Mancano i musulmani.,0
Servizio civile aperto anche a ragazzi stranieri residenti in Italia# ci ritroveremo potenziali stupratori ad occuparsi di sport e assistenz,1
La Stranieri Spa vale come la Fiat: il Pil degli immigrati in Italia pesa 127 miliardi [URL],0
"[USR] [USR] Per quanto riguarda gli USA trattasi di una nazione i cui veri, legittimi proprietari si sono visti massacrare e rubare la propria terra da dei colonizzatori stranieri; gli indiani non hanno cambiato cultura,sono gli invasori che hanno imposto la loro",0
"[USR] Non è l'immigrazione in sé che fa paura alle persone. E' l'incapacità di controllare e gestire questa situazione che porta tensione e rabbia fra le persone, che purtroppo si canalizza contro gli immigrati. PD, Lega, M5S, nessuno sembra capace di fare meglio dell'altro.",0
"I costituzionalisti già mettono le mani avanti, il RdC non si può negare agli stranieri. [USR] Ci manca solo che gli diamo anche lo stipendio x continuare a fare i fanagni ai giardinetti! abbiamo già buttato 5miliardi l'anno per loro.Basta! Piuttosto si torna al voto!",1
"Questo personaggio, Schmidt-Bremme, capo del Forum Progetto Migranti UN ha detto: abbiamo-sovrastimato la necessità di avere immigrati-sottostimato i rischi e le difficoltà-voluto negare che i popoli vogliono gli immigrati solo se integrati... in pratica smentisce #Boldrini",0
Vigile preso a calci da immigrati – VIDEO CHOC [URL],1
Forza Nuova #accoglienzabussiness #stopfintiprofughi #bastaimmigrazione [URL],1
[USR] prima di far entrare tutti questi  profughi stiamo allerta se ci sono adepti dell'isis,1
"E ora di finirla con il buonismo, il carabiniere doveva sparare in fronte a questi farabutti , se succede questo e colpa della sinistra, che difende i delinquenti, gli immigrati, i centri sociali, rubano hai cittadini onesti, e un nutrito numero di imbecilli li votano",1
"#Librandi, per non farsi mancare nulla, è anche filo-rom... MA PERCHE' NON VAI A CAGARE? #dallavostraparte",0
[USR] ho visto commessi della #Lidl sequestrare un campo rom alla ricerca dell'ultimo neurone di Salvini.Pensavano fosse stato rubato,0
"I #Pidioti e finti buonisti anti-italiani  diranno che é alto 7 metri oppure che é un effetto ottico. Rendetevi conto che cé gente che crede a questi teatrini del c***o, un insulto per i veri profughi. Basta sto schifo non stiamo stupidi! #stopinvasione #BloccoNavaleSubito [URL]",0
Roma caos a Torre Maura arrivano famiglie rom: ira residenti incendiati cassonetti -  #Torre #Maura #arrivano #famiglie  [URL],0
[USR] Parliamo di stop immigrazione! legittima difesa! Più sicurezza!leggi più severe per i ladri ĺ rapinatori! Di Italia!,1
Far West a Roma: la polizia apre il fuoco contro un nomade latitante che... [URL],0
"Maltempo a Ventimiglia, migrante arrivato in Italia disperso nel fiume in piena. Nemmeno in Final Destination erano così sfigati.",0
"È normale che nessun giudice, in virtù della tanto decantata indipendenza della magistratura,  indaghi i presidenti del consiglio dei precedenti governi e i vertici istituzionali, per più o meno consapevole favoreggiamento dell'immigrazione clandestina?",0
#Portate in carcere due mamme rom ai domiciliari in camper a Milano - #Portate #in #carcere #due #mamme #rom ... [URL],0
[USR] Via gli stranieri da l'Italia se non hanno lavoro.,1
"[USR] [USR] La soluzione esiste! Vanno rispediti a casa loro, sono nomadi quindi non capisco perché si siano stabiliti in Italia!!! Ho capito!.. in questo paese tutto è concesso a questa gente mentre i discriminati sono gli Italiani  che pagano le tasse e lavorano per vivere!!! Lavorino!!!!",1
"La ""superiorità"" della ""cultura"" occidentale: Canada, attacco terroristico contro moschea: 6 morti e 8 feriti [URL]",0
[USR] nazismo e comunismo due ideologie malate della storia io guardo al futuro dell'Italia pulita e senza rom ne clandestini.,1
"[USR] [USR] Perché i nigeriani non sono forse arrivati sulle barchette? Mi  pare che tra mafia nigeriana ed #immigrati,ci sia una stretta correlazione. Sbaglio?",1
più schifo degli immigrati che hanno ucciso e violentato #Desiree solo i radical shit e i pidioti che difendono gli assassini.  Non siete degli essere umani #BESTIE #RIFIUTI,1
"#SCABBIA . Ma anche #pidocchi, asili e bambini infestati da immigrati che NON eseguono trattamento.  [URL]",1
#Austria: Un attacco con coltello alla vigilia di #Natale in un treno. Attacco ignorato dai media: un uomo di 26 anni il solito depresso #musulmano ha attaccato 2 passeggeri e li ha feriti al collo proprio come ordina il #Corano.[URL],1
"Londra, lavoratori stranieri e Brexit:  'Timori, ma qui è sempre meglio che in Italia' [URL]",0
