text,label
#agorarai Cavolo! Mo' rigiriamo la frittata!La legge la devono rispettare anche i rom giusto?O solo gli italiani? [USR],0
[USR] [USR] Chi paga ?Basta con le cazzate che 1 profugo risparmia 3.000€ in paesi dove lo stipendio è 70€/mese Fare i conti📍,1
La sinistra dovrebbe ripartire dal ripulire il paese dai negri e da tutta la feccia straniera che impesta questo paese.  E se non fa così non ripartirà mai.    #propagandalive,1
"PRIMA ""BARRICATE"" CON DONNE INCINTE SDRAIATE A TERRA, POI BOTTE AI CARABINIERI ""Vogliamo soldi"". Le immigrate di Siracusa scatenano una rivolta a morsi e graffi [URL]",1
"#daleggere  [USR] su Roma, nomadi e integrazione [URL]",0
"Roma, scolarizzazione dei bambini rom? Un totale fallimento, buttati 10 milioni di euro [URL] via [USR]",0
"Non meno sgradevole sulle ONG. Falso. Unico ""business"" #migranti finora emerso riguarda la scena di 'terra' per alcune 'cooperative' d'accoglienza.  Ad oggi le sentenze (anche in giudicato) hanno solo scagionato e assolto le ONG di 'mare' da improvvide accuse: Palermo e Ragusa. [URL]",0
"[USR] Lo slogan del PD è #IngressoLibero pensate un po'.  Gentiloni dice falsità, emigrano più giovani italiani di quanti immigrati arrivano.  I migranti sono tutti maschi sfaccendati ed ignoranti, non aiutano la demografia, causano squilibrio.",1
Ok al decreto sicurezza. Salvini: “Il mio obiettivo è chiudere tutti i campi rom”. Ecco tutte le novità [URL],0
"[USR] [USR] Vedi che, questi fanatici, prima o poi prenderanno il sopravvento. Se non si inizia a rispondere a tono, ci ammazzeranno tutti. Bisogna dichiarare l'Islam FUORILEGGE. Non c'è da scherzare.",1
Agnelli difende la Juve come la Boldrini i rom e i delinquenti. Vi voglio bene se andate nel posto piu' lontano da qui'.,0
"#fuoridalcoro Migranti come nostro prossimo stile di vita? Essi si devono integrare con noi, non viceversa, devono rispettare le leggi italiane, le religioni sono altra cosa, se amano la sharia restino nei propri Paesi, certe politichesse abbandonino l'Italia se amano i veletti.",1
Rimangono sempre gli islamici che è peggio. [URL],0
"Giornalisti sciacalli di tutta Italia, vi sto odiando col cuore.#immigrati #sopravvissuti",1
"Tribunale di Firenze si arrende a circa 3.000 procedure relative ai presunti profughi, altre pratiche vengono RITARDATE. Gli italiani? DOPO…",1
[USR] secondo te il problema è Erdogan e non i terroristi curdi? animali che hanno fatto 2 attentati solo nell'ultima settimana? Bravo,0
Scarso e confuso l'impegno della nuova amministrazione capitolina per il superamento del “sistema campi”… #rom [URL],0
"Questo vale come avvertimento per i #GAY #LESBICHE nostrane? Se attecchisce l' #islam, presto o tardi verranno massacrati! Islam PACE E AMORE un cazzo! 😡 #sinistrati #PDioti  Unica vostra speranza è #Salvini. Poi se volete continuare a seguire #Arci, fate voi! [URL]",1
"[USR] Ci vuole il pugno duro, non esiste l'#islam moderato, è una #bufala che ci danno a bere da anni.... I #media italiani ed #europei sono complici della #politica di un #integrazione impossibile da realizzare. #StopIslam #stopinvasione",1
"Forse loro non dovevano essere là, ma è inconcepibile chiamare uomini questi bastardi che hanno #sgozzato le due #ragazze ancora #vive, dopo inaudite #violenze.Questo è l'#Islam?Basta consentire il propagarsi di questa subcultura!#Combattiamo e #eliminiamolo come il #Nazismo [URL]",1
"[USR] Purtroppo anche per la sinistra esiste solo il tema migranti visto in un'ottica esclusivamente umanitaria senza una sola proposta concreta per affrontare le cause dell'emigrazione e a parte i diritti civili, zero proposte sul lavoro, le banche, l'economia, ecc.",0
Pizzicati mentre camminano: #rom falsi #invalidi per commuovere #Roma #nomadi #disabili #zingari #cronaca [URL],0
"[USR] [USR] [USR] Oggi è troppo occupato a togliere diritti Umani con un decreto chiamato ""sicurezza ""  sai, quello che produce clandestini per poter poi dire ""basta clandestini ""! È poi ci sono i campi Rom... e qualche vecchio Palazzo abitato da poveri Cristi da sgombrare..  E uno spriz con fasci",0
"[URL] questo è ciò che corano le tue ""RISORSE "" di merda oltre a uno stile di vita che ci stimola solo la PIPI'💣💥",1
I migranti che puliscono le strade di Roma: 'Lo facciamo per dire grazie' [URL] IL COMUNE DOVREBBE RINGRAZIARLI,0
"[USR] Lo ha guardato bene? Uno così è meglio averlo come avversario. Se è così magnanimo dia il suo indirizzo di casa, ai rom.",0
Per lo Ius Soli spinge l'anima nera della politica. Che va da Mafia Capitale fino all'islamismo radicale.... [URL],0
Per chi non lo ha capito: le #rom sono state chiuse nel gabbiotto #Lidl di #Follonica dopo che c'erano entrate (che non si può)...,0
"I casi sono due: 1)la sinistra italiana non ha capito che ormai,a causa del suo scellerato sostegno all'immigrazione irregolare,si è avviata verso l'estinzione. 2)la sinistra italiana ha capito tutto a perfezione ma ha ""interessi superiori"" da soddisfare(non umanitari ovviamente) [URL]",0
"A Parigi anche stavolta dimostrazione che non tutti gli islamici sono terroristi, ma i terroristi sono tutti islamici",1
"Roma, misure anti terrorismo e incubo black bloc. I social sorvegliati speciali [URL] #news",0
"profugo irascibile che non si calma neppure di fronte a 3 Carabinieri, al suo Paese sarebbe ""ai piombi"" con le os… [URL]",1
"#dallavostraparte Ha fatto bene il ristoratore dare cena a soli italiani, sono i più bisognosi rispetto ai migranti che il Gov.PD da tutto.",1
Card. Bassetti: bisogna integrare i migranti in un contesto di cittadinanza - Vatican News [URL],0
#lariachetira rom a vagonate in italia mandano bimbi a elemosinare rubare spacciare e x i giudici e lo stato è nella loro cultura?,0
La cronaca del mio sopralluogo nel campo #rom di Chiesa Rossa a #Milano: illegalità diffusa nel disinteresse del Comune. I rom del campo si sentono tranquilli e negano persino i crimini di cui si sono resi protagonisti negli anni. Da sgomberare subito! [URL],1
Mentre da Bruxelles bocciano la manovra anti-austerity da Berlino pronto un contingente di migranti. I problemi dell’Italia non risiedono in Italia. [URL],0
SALVINI: ANCHE AI ROM SE HANNO LA CITTADINANZA ITALIANA E NON VIVONO NELL'ILLEGALITA'.  Il reddito di... [URL],0
"La cosa più aberrante del #GlobalCompact ❓  Sarà REATO parlare di #immigrazione - #migranti   ""SOPPRESSA PER LEGGE LA LIBERTA' D'OPINIONE""  Ora sapete perché le elites #sorosiane lo vogliono, vogliono poter IMPORRE milioni e milioni di #primitivi ed IMPEDIRE che se ne parli.",0
"Che paese è quello che accusa di terrorismo chi va a combattere l'Isis? Che sinistra è quella che non parla e accetta tutto questo? Da che parte stiamo allora? [USR]  da sarda, italiana, antifascista, voglio una risposta! #vogliounarisposta  [URL]",0
"[USR] Fedriga, diceva Gentilini: gli stranieri extracomunitari? Bisognerebbe vestirli da leprotti per fare pim pim pim col fucile",1
"[USR] [USR] [USR] [USR] [USR] A Malta sono sicuramente brutti e cattivi perchè non vogliono i migranti. Ma nei confronti delle RSA gestite male non è che dormono. Struttura aperta a nov 2014,  a feb 2015 appalto revocato, proprio ad Agorà. Detto con affetto. SVEGLIA [URL]",0
[USR] ma quando cacceremo dall'Italia questi rom? fanno solo danni,1
"Policlinico di Napoli L’ambulatorio  specialistico “supera le barriere culturali, linguistiche, cliniche e assicura visite ai migranti, con o senza permesso di soggiorno“. Con i soldi dei contribuenti è comodo ‘superare le barriere’. Fatevi pagare lo stipendio dai clandestini.",0
"Dalla vostra parte - case ai rom,telecamere in piazza duomo a Milano, niente ai terremotati.",0
"[USR] [USR] L’Italia, quella vera cara la mia esimia testa di cazzo ne ha le palle piene del pd, dei porti aperti, dell’accoglienza e dei migranti. fatti un giro tra la gente, che tribuna a mettere insieme il pranzo con la cena, poi vedi quanti sono favorevoli alla tua cara immigrazione",1
I buonisti condannano i cittadini del quartiere: ma nessuno si lamenta quando a buttare il cibo sono gli immigrati nei centri [URL],0
"[USR] UNICI responsabili delle vittime #Strasburgo sono il malato finto buonismo della fallita #UE, immigrazionisti per voti e soldi, corrotti #FakeMedia. Tutori di #IMMIGRATI allevano TERRORISTI ISLAMICI usando proclami di disgraziati malati di inclusione #Mattarella #ONU.",0
[USR] Un po’ come i giornalisti nelle redazioni Gedi-Rcs-Caltagirone-Angelucci etc..  Ah ma tu sei uno di quelli.. funzionali alla propaganda di chi strumentalizza migranti..,0
"[USR] Si vede che Soros gli da più soldi se prende i migranti,,, se cura i suoi concittadini prende solo voti... e in banca i voti non li prendono,, vogliono soldi veri",0
"[USR] ennesimo immigrato che non è regolare, inutile per la società e per giunta anche omicida.",1
[USR] [USR] mattè chiedilo ai rom che non hanno un cazzo da fare... NOI LAVORIAMO,0
"Piccola nota: alcune popolazioni rom sono in Italia da 600 anni, a voglia ""entrare a casa tua"". La pic invece è pur… [URL]",0
"L'ERRORE DI QUESTO PAPA INTRUSOSI NEL VATICANO AL POSTO DEL VERO PAPA è stato quello di credere che gli italiani fossero ""manovrabili"" come gli islamici dagli imam.  Ha fatto male i calcoli, oltre ad aver perso il business dei FINTI profughi ha perso milioni di ""fedeli"". [URL]",1
"Cronaca Milano: Ruba in casa e prende anche l’urna cineraria Monza, arrestata nomade incinta [URL] #milano",0
[USR] Dovrebbero lasciarli in balia della gente di li e poi portarli in cella ...il carcere é poco ...fuori gli stranieri..tutti,1
"Sono nauseato dal FINTO buonismo e dalla FINTA carità di una FINTA #SINISTRA imitatrice della peggiore #destra. Non fate bene a NESSUNO, nè ai #migranti né agli #Italiani . Siete ASSOLUTAMENTE INUTILI. Acari nelle vostre #poltrone #rosse. #SeLoDiciamoLoFacciamo  #SeaWacht3 #M5s",0
[USR] [USR] [USR]  Tesoro non sarai mica straniera..perché credo che non stai parlando dell'italia. Don't per me down!,0
"Nel frattempo la #sinistra agita gli spettri del #razzismo e del #fascismo...Maxi operazione contro lo #spaccio di #droga a #Macerata, 27 arresti: sono tutti #immigrati, per la maggior parte #nigeriani come i carnefici di Pamela Mastropietro[URL]",1
[USR] [USR] non ho mai visto i musulmani in Italia manifestare a migliaia contro l'isis...x le case popolari urlano!,1
[USR] Salta la #CenaCasaCalenda confusione timori e veti reciproci sulle portate:  Calenda voleva metterci il suo vino. Minniti voleva aggiungere un posto a tavola per un migrante d'avanzo. Renzi voleva portare le sue polpette. Gentiloni voleva chiudere la cena col suo mitico biscotto.,0
"[USR] [USR] Ci sono dei migranti ad Amatrice hanno bisogno di aiuto. (Vedrete che adesso arriveranno il PDR, il Papa, e tutti gli organi dei media di regime)",0
Chiamarlo Capo dei terroristi. noi? [URL],0
Due nomadi minorenni denunciate dagli agenti della Polizia di Oristano per possesso di... [URL] [URL],0
Alcuni #musulmani pensano ancora che la terra sia ferma. Meriterebbero bistecche di manzo in faccia per tutta la vita #sapevatelo #ISIS,1
I rom vanno messi nei posti dove li accettano cioè  nei posti di Lusso dei radical chic e buonisti intellettuali ed artisti loro li difendono e li accettano quindi se li prendano vogliamo vedere come saranno.contenti!!!,0
"[USR] [USR] niente futuro, il futuro lo stanno preparando per gli stranieri. E se agli italiani non va bene che se ne vadano 😠",1
"#dallavostraparte vitalizio, rom,negri, delinquenti.Tagliamo tutto questo marciume,così riusciamo a vivere tutti.Gli fa schifo?",1
Un branco di rom stupra una ragazzina di 13 anni a Milano: arrestato un latitante [URL],0
Questa nave va sequestrata e messa in disarmo. L'equipaggio va arrestato e processato per favoreggiamento dell'immigrazione clandestina. Vogliamo tirar fuori la palle una buona volta e fare il culo a ste merde della [USR]!? Fra 15 giorni sti bastardi tornano! [URL],1
[USR] Il #governo spieghi xchè #Italia importa e fa rimanere delinquenti di altri paesi.Forse quelli autoctoni nn bastano?#immigrazione,1
Scusa [USR] potresti spiegarmi chi sarebbero i bombaroli bravi di una volta che sapevano chi colpire e pagavano di persona? Per me erano terroristi e mafiosi che colpivano servitori dello Stato. Quindi non bravi ma assassini. Mi auguro che ti sia fatto prendere la mano. [URL],0
Pietre e petardi contro case migranti [URL] [URL],0
"[USR] [USR] L'unico diritto che hanno i migranti illegali è quello di essere rimpatriati con urgenza, ma a cosa stanno aspettando...",1
[USR] [USR] sono #rom ...sai quelli a cui la #boldra dice che devono essere orgogliosi della loro cultura ??? Ecco...,0
Il poliziotto si improvvisa mago per far divertire i bambini migranti di Pozzallo | VIDEO [URL],0
"[USR] [USR] [USR] protestate anche contro L'islam in casa nostra,a sinistra silenzio.",1
"[USR] Perchè la violenza è tutta uguale, ma il racconto della violenza non lo è: se violenta un italiano è ""un caso isolato"", se violenta un somalo è la vostra scusa per dire che tutti gli stranieri sono stupratori. Chiedilo a Salvini perchè tace sulle violenze di italiani alle donne.",0
[USR] Parliamo di stop immigrazione! legittima difesa! Più sicurezza!leggi più severe per i ladri ĺ rapinatori! Di Italia!,1
"[USR] [USR] Sì, frequento dei musulmani e quindi?! Visto che non possono anche pregare a casa non hanno diritto di riunirsi?!",0
"Qualcuno sa dove sono finite le donne di ""se non ora quando"" che strepitavano indignate per i festini di Arcore, di fronte alla serie inarrestabili di omicidi e stupri di criminali immigrati?",1
Bene #stopJihad Corte Giustizia Ue: vietare il velo islamico al lavoro si può [URL] [USR] [URL],0
.[USR] [USR] com'è ancora possibile negare che l'Islam abbia radici e regole violente? Conoscete uno stato islamico democratico?,1
"Liberoquotidiano.it: Tutti i trucchi (infallibili) delle ladruncole rom. [URL]  Piaga sociale, senza fine.",0
Imam islamico shock: “Fare gli auguri è un grave peccato. Peggio... [URL],1
"L'attentato di Parigi evidenzia che i musulmani non si integrano, non tutti i musulmani sono terroristi ma i terroristi di oggi sono musulma",1
"#Roma, cinese morta: da oggi la bonifica nel campo rom. I residenti: «Raggi venga a vedere» [URL] [USR]",0
"Quella merda africana che ha tagliato il collo al ragazzo a Torino, solo perché rideva. La famiglia deve chiedere danni allo stato. Sta merda non doveva camminare più su suolo Italiano. Questa immigrazione è fuori controllo. Pericolosi. AVANTI SALVINI. SBARRA TUTTO",1
"[USR] Matteo (Salvini) di ""cattivo"" ha tolto il GUADAGNO PERSONALE a chi ""aiutava"" gli immigrati (con i soldi degli altri, mica con i propri)",0
"[USR] [USR] [USR] Purtroppp invece esiste sempre chi ci vuole schiavi dell europa, delle banche, chi ci vuole invasi da clandestini Africani, dai Rom e altra merda dell est europa !!  #sinistracazzateeschiavitù",1
"[USR] [USR] i #rom fanno di tutto per farsi odiare, non si integrano, vivono di illegalità. E noi dovremmo rispettarli? #ruspa",1
Vorrei solo chiarire che gli #italiani poveri non odiano gli #immigrati vorrebbero solo la considerazione che meritano e la dignità che spetta loro.  Per favore non trasformateci in #razzisti,0
"Ayaan Hirsi Ali, eroina femminista che viene dall’Islam, su cosa unisce le patetiche femministe occidentali e i jihadisti. Care anime candide italiane che non leggete niente: fatevene una ragione [URL]",0
"Casa popolare assegnata all'inquilina, ma una rom incinta la occupa - IlGiornale.it [URL] via [USR]",0
"MA UNA GRAN SCARICA DI CALCI NEI COGLIONI A LUI E FAMIGLIA NO !? 500 Tony, il rapper rom di 9 anni che insulta l'Italia: [URL]",1
"[USR] [USR] loro si ribellano anche con tutto gratis e noi abbiamo perso già dal primo ""profugo""sbarcato",1
SCHIAFFO ALLA MISERIA Regali da 30.000€ per il battesimo del bimbo rom. E poi in Italia ci sono famiglie sinti... [URL],0
"Dopo Mimmo Lucano, la #sinistra va in soccorso pure della nave buonista Ong #Aquarius che smaltiva i #rifiuti infetti dei #migranti. #22novembre  [URL]",0
[USR] canditati sindaco di Milano ci vuole una come te che sa dove ripulire la città da tanta merda!e poi dai le case popolari agli italiani e gli abusivi stranieri cacciali via zona segnata ormai è tutta islamica e nelle case popolari idem!,1
Stretto giro di vite dei carabinieri e della procura contro i nomadi sinti piemontesi... #canavesenews [URL],0
"Turchia: cacciate 4 ong straniere, anche una italiana [URL]",0
Ma quanto è sexy la frase: Hey straniero,0
"Dopo la chiusura del ponte di Paderno i treni dei pendolari da Bergamo per milano sono così pieno che se Salvini dovesse vederli, non li farebbe attraccare in nessuna stazione lombarda e rimanderebbe a casa i profughi.[USR] [USR]",0
[USR] Ma perché inserite i migranti neri anche in queste pubblicità?? Insomma ci volete abituare che è una cosa normale l'invasione di questi neri!! Fate schifo!!!,1
LA PACCHIA E' FINITA!!!  STOP AI #migranti   #ottoemezzo,1
imprendittore: sto dietro alla mia azienda non perdo tempo al supermercato per le scarpe se mai rifletto che fa l'islam a Berlino: combatto,0
"Non vogliono essere sepolti vicino a noi perché per l’Islam noi cristiani siamo cani infedeli, portiamone ancora qualche milioncino in Europa e vedrete che disastroso futuro avremo#stopislam #stopimmigrazione [URL]",1
[USR] x come dici te anche indagini sull‘ideologia degli estremisti islamici è illegittima,0
"#Candreva il ? ""Ditemi quant è e pagherò"" io la mensa alla bimba straniera di #Minerbe a craker e tonno. Poi leggi l articolo e scopri che il Comune aveva +volte offerto ai genitori di lavorare ma questi si sono rifiutati categoricamente x la serie ""vogliamo essere mantenuti"".? [URL]",1
CARO PREMIER [USR]  FINORA NON HA SBAGLIATO NEL RUOLO DI MEDIATORE. CONTINUI MA SI RICORDI CHE  SULL'IMMIGRAZIONE SONO GLI ITALIANI CHE CHIUDONO TUTTO. [USR] E' IL NOSTRO PORTAVOCE. E NON SIAMO SECONDI A NESSUNO [URL],0
"[USR] Ormai è assodato che quelli bravi e preparati in Italia sono tutti antipatici. Sono invece simpatici gli ignoranti, purché non siano neri e musulmani e in genere stranieri.",0
"[USR] L’Islam non è una religione ma un modo di giustificare la violenza di un branco di medioevali merdosi. Sei un assassino stupratore, razzista, odi qualsiasi cosa respiri e torturi gli animali? Allora sei islamico.",1
[USR] te credo che in Italia non fanno figli se non c'è lavoro come li  campano.....mica sono rom,0
"Sfratto della Polizia ad una famiglia italiana, agli immigrati invece vitto e alloggio [URL]",0
"Napoli, l'appello di de Magistris: «Pronti ad accogliere i migranti di Open Arms».E COME FAI..NN PUOI.. ON QUALE AUTORITÀ.PORTI A CASA NOSTRA STUPRATORI,ASSASSINI, E [URL] TI FAREI ARRESTARE.PER AVER FATTO ENTRARE CLADESTINI.E UN REATO E TU LO SAI BENISSIMO",1
[USR] [USR] Come i rom..rubano...spacciano...circolano con auto rubate e senza assicurazione e non gli f… [URL],0
"Diritti Umani - Human Rights: Migranti, la grande espulsione. Quarantamila fuori dai Centri, tra loro molte donne e bambini e 15mila operatori, sopratutto italiani, perderanno il lavoro.: [URL]",0
[USR] Solo in Italia gli immigrati  quasi tutti clandestini manifestano contro il governo e contro un nostro ministro della repubblica Con la complicità di una sinistra estrema sorretta da 4 falliti. SCHIFOSI,0
Dodici profughi Cristiani buttati in mare da Mussulmani e noi li accogliamo  perché siamo tutti uguali.UGUALI IL CAZZO!# TG1,1
"Ho preso il treno per fare pochi km, uomini di colore, nigeriane prostitute, non si parlava una sola parola di italiano, migranti che urlavano al telefonini, piedi sui sedili. Mi dite quale integrazione è possibile? Il controllore donna si è guardata bene dal chiedere i biglietti",1
#OpenArms sono tutti mussulmani quindi cosa gli importa se e' natale o no,0
"[USR] Vengono mantenuti, senza alcuna responsabilità, non pagano nulla, se delinquono sono impuniti o quasi, se esiste una guerra tra poveri, l'hanno suscitata quelli che hanno ideato questo sistema perché ""gli immigrati rendono più della droga"" (cit.)",1
"in tutti i casi di terroristi islamici in UK e Francia e Belgio non vengono mai solo feriti, anche gravemente e poi catturati e portati in ospedale. Ogni singola volta li ammazzano, anche quando sono già feriti a terra LI FINISCONO SEMPRE. Non vogliono arrestarli [URL]",0
I mussulmani di fede islamica sono dei violenti trogloditi maschilisti.,1
[USR] puo' andarsene dall'europa se tutto cio' non le sta bene.. accolga a sue spese musulmani e negri e rom,1
#StaseraItalia quindi verranno aiutati anche mafiosi e IMMIGRATI con questo reddito di cittadinanza io di sicuro non lo prendo sono disoccupata ma non sono mafiosa e immigrata e questo il punto,0
"[USR] i rom non possono + scartare,non si butta + niente in strada e vengono tutti i giorni a ritirare quello previsto afacrocazz",0
"[USR] La #sinistra ha abbracciato la #DITTATURA #ISLAMICA Perché di questo si tratta  La #religione è una cosa personale: Credi o non credi, segui o non segui certe regole Per l'Islam TUTTI DEVONO credere e seguirle  Non hai il #burka?Sei una puttana da #stuprare! Lo dicono apertamente",1
L’espulsione dello straniero in carcere e la funzione rieducativa della pena [URL],0
[USR] I veri poveri sono gli italiani che hanno subito umiliazioni e si sono visti negare i diritti per agevolare gli stranieri . Gli italiani hanno subito il razzismo . Ora basta,1
"Restituito ai rom il tesoro sequestrato: tornano nelle loro mani oltre 2 milioni di euro..E COME CAZZO FANNO AD AVERE TUTTI QUESTI SOLDI,IL MAGISTRATO SE LO È CHIESTO.SOLO AI CITTADINI ONESTI GLI FANNO I CONTROLLI.E QUESTA È GIUSTIZIA.😡😡 [URL]",1
"Anno corrente calendario musulmano: 1436.Per alcuni la mentalità è ancora medievale, se non più arretrata, mi dispiace per loro",1
"#ultimenotizie #news #notizie: Roma, donna trovata morta nel campo rom di via Salviati: è la studentessa cinese  [URL]",0
"Retweeted Notizie Roma ([USR]):  Il Messaggero: Roma, donna trovata morta nel campo rom di via Salviati:... [URL]",0
"[USR] [USR] No grazie ad Arabia ancora guerre,  schiavitù, diritti umani negati, finanziamento terroristi. Taci!",0
[USR] [USR] No sul lavoro che lo stato deve garantire altrimenti deve garantire un sussidio min. Per una vita dignitosa ai suoi cittadini. Ma x ora la garantisce solo agli immigrati. Emigra tu e tutti quelli come te.,1
#Lidl mi spiace ma non provo simpatia né per i dipendenti della Lidl né per le rom .,0
#Stoccolma lanciamo una decina di bombe all'idrogeno su tutti i paesi islamici! Polverizziamoli! #Svezia,1
[USR] [USR] [USR] Paragonare fenomeno dei migranti trasportati da paesi del subSahara verso… [URL],0
"#Milano Ora arriva pure il matrimonio rom in limousine: ""Beffa a chi fa fatica a pagare l'affitto"" [URL] le ultime foto scattate dai residenti esasperati immortalano un matrimonio rom con tanto di limousine bianca parcheggiata nel cortile delle case popolari",1
[USR] [USR] succede la stessa cosa anche qua...solo che il pilota c'è: è un rom ed è gia scappato.,0
"[USR] [USR] I numeri del pd sono sempre sbagliati, sopratutto quando si tratta di migranti. 🤔",0
"Gli immigrati non fanno più like, sulla famiglia tradizionale c'ha perso la faccia, la castazione chimica gliel'hanno bocciata, la #Boldrini lo percula , chi ci rimane da attaccare per farsi notare?  i Rom..  #?????????????? #TorreMaura  #facciamorete",0
"Spedizioni razziste contro migranti, arrestati tre universitari a Ceprano [URL] di [USR] ONORE A QUESTI STUDENTI PATRIOTI! LIBERI SUBITO!",1
"7 anni di Monti, Letta, Renzi, Gentiloni,Boschi,Lotti,Gigli Magici,Fedeli,Fornero, 7 anni in cui il popolo italiano ha visto e subito di tutto (austerity, immigrazione fuori controllo, tasse su tasse).Ora si mobilitano perché “hanno a cuore l’Italia”. Che coraggio.",0
[USR] [USR] [USR] [USR] [USR] [USR] M5S = musulmani 5 stelle . Sono il nuovo partito di riferimento della CEI . Aspettate e vedrete.,0
"DELINQUENTI, disertori, vigliacchi... ecco chi accogliamo... #RoccadiPapa #migranti [URL]",1
Stabili COMUNALI occupati da rom: la sinistra a #Milano consente questo scempio. La mia denuncia su [USR] [URL],0
"Il Dalai Lama ha detto mercoledì a Malmø, in Svezia, che ""l'Europa appartiene agli europei"" e che nel lungo periodo è auspicabile che i profughi tornino a casa ""per ricostruire il proprio paese"". Molto più lucido del pampero del Vaticano.... [URL]",0
"Cinese morta, un fermo e una denuncia - Sono giovani di campo nomadi Roma,uno minorenne. Caccia al terzo [URL]",0
I nomadi illuminavano le abitazioni dopo essersi allacciati abusivamente a un palo Enel.. #canavesenews [URL],0
🌿cita e rispondi si gio🌿  8. cosa ne pensi dell'immigrazione in italia?,0
"[USR] se il padre della bimba morta di fame avesse detto di essere profugo, magari con l'aiuto  del fondotinta scuro, avrebbe risolto.",1
Non conoscono la benché minima nozione di IGIENE i #migranti !!!!!! [URL],1
TY [USR] [USR] [USR] per i #rom e #sinti cancellati dalla storia e oggi dalle città. La lotta continu… [URL],0
[USR] In #Norvegia con  77 morti hanno condannato il terrorista a 21 anni.E in #Svezia con 5 morti una s… [URL],0
Pastore sardo in manette a Roma: ha bastonato due bimbi rom [URL] [URL],0
"🇮🇹 ITALIA 🇮🇹Ora vi spiego quanto siamo #coglioni NOI Tolto il crocefisso in aula, abolizione festa di Natale nelle scuole e cibo islamico nelle mense.ISLAM Brescia, per la nascita di Maometto corteo, sfilate, urla canti e grida.A CASA NOSTRA, porca troia.#coglioni",0
"Mafia Roma: appalti campi nomadi, in 13 rinviati a giudizio [URL]",0
