text,label
"voglio l'eclettismo di voi falliti che passate da ""no alla violenza contro salvini"" a frasi tipo ""bruciamo i campi rom"" #salvininapoli",0
A causa del fenomeno della #overqualification gli immigrati spesso non vedono riconosciute le proprie competenze nei Paesi di destinazione. Valeria Scalmato ricercatrice [USR] #ANPAL,0
LE NOSTRE CONTRADE PAESI E CITTÀ INVASI DA TORME DI STRANIERI MALEDUCATI PREPOTENTI CJONDOLANTI.I NOSTRI RAGAZZI COSTRETTI ALL ESTERO.,1
"Treno Flaminio/ Viterbo una vera Vergogna fatiscenti, sporchi, senza una guardianeria di sorveglianza, 500.000 cittadini del Lazio scendono a Roma per lavoro da tutta la tratta Viterbo Flaminio, in balia di immigrati, borseggiatori e ritardi treni.Vergogna.[USR] [USR]",1
"Il punto è: perchè c'è un ""docente"" islamico alla Cattolica???  Perchè c'è un fottuto comunista a capo della Chiesa… [URL]",1
Ancora che i buonisti parlano : alle famiglie niente buoni libro e agli immigrati lezioni di sci. Fate schifo !!!!,1
Tra gli emendamenti alla Manovra anche la soppressione del fondo sanitario vincolato per le cure agli stranieri non iscritti al SSN. Le Regioni non saranno più obbligati a usare i soldi per questa finalità.mi ripeto: FATE SCHIFO,0
“Integrazione dei migranti. I paesi della Valle Grana aiuteranno Monterosso”  [URL] [USR],0
"[USR] Perché l'ebreo è odiato quanto il musulmano, dai più",1
Alcuni #musulmani pensano ancora che la terra sia ferma. Meriterebbero bistecche di manzo in faccia per tutta la vita #sapevatelo #ISIS,1
"Bisogna sia reato ,una multa solo se è "" beccato "" è una vergogna .Questo non essere reato alimenterà pedofili ,maniaci e immigrati ,verso lo stupro !!! Saranno capaci dopo la fase di eccitamento a fermarsi ???? Dubito",1
Inchiesta a torino - Trovato in Croazia il tesoro della “regina” rom |[URL],0
Sri Lanka:colti e ricchi i terroristi ISIS. la madre si è  fatta saltare uccidendo 3 figli e dei poliziotti...MA CON CHI DOVREMMO INTEGRARCI?,1
In italia siamo cattolici ed abbiamo delle leggi facciamolo rispettare. ....islam andate a casa vostra cioè ..... paese preistorico,1
[USR] Se non si rimboccano le maniche per lavorare nel loro paese e per promuoverne lo sviluppo la loro situazione non cambierà mai. #migranti #portichiusi,0
"Roma, cinese morta: da oggi la bonifica nel campo rom. I residenti: «Raggi venga a vedere» - Il Messaggero [URL] #Roma #…",0
gli islamici sono tutti integralisti. io però non ho capito perché nelle scuole pubbliche di uno Stato laico sia appeso il crocifisso.,1
[USR] tata mi esprime la sicurezza di un rom di fronte alla mia auto #AtalantaFiorentina,0
"#gabbiaopen...3/4 di Nord è di origini meridionali ma non vogliono per forza imporre il ""sistema"" SUD come gli islamici estremisti ...",1
"#StopImmigrazione #islamistheproblem #StopIslam è ora di darci 1 regolata e svegliarci, in Italia deve entrare solo chi dimostra di lavorare",1
"[USR] la violenza simbolica può fare molti più danni di qualche auto bruciata....i profughi, i rom non hanno l'assicurazione...",0
"[USR] [USR] [USR] [USR] [USR] [USR] [USR] [USR] [USR] [USR] [USR] [USR] [USR] [USR] [USR] [USR] [USR] Sono anni ed anni che sbarcano con i cellulari nuovi ma nessun giornalista o magistrato indaga per saperne la provenienza? TUTTO REGOLARE, o non bisogna fare chiarezza, perchè i TELEFONINI sono strumenti che istigano all'immigrazione clandestina, penalmente perseguibile per legge",0
"#Roma Baraccopoli, Baldassarre: ""Stiamo lavorando per chiudere i campi rom"" [URL] [URL]",0
Dunque siam stati bravi poiche' abbiamo ucciso il terrorista tunisino. Ma il fatto che circolasse liberamente in Italia? #berlinattacks,0
[USR] bravo! Ecco bisogna sputacchiarlo sulla faccia ai vari salvini di italia se è colpa degli immigrati che mandano a spasso operai,1
"L'ultima del sovranista austriaco: esternalizzare i migranti! Creare delle ""piattaforme"" fuori dall' Europa per ""sistemare"" quelle persone. A me sembrano prove (in fase avanzata) di leggi speciali di sapore nazi...voi che ne dite?#17settembre",0
"Roma, il refuso nella mail inviata ai municipi per ""la regolamentazione delle popolazioni rom, sinti e Carminati"" [URL]",0
"Dopo le denunce tv contro degrado e abusivismo creati dal campo rom di Via Germagnano, e la solidarietà al canile... [URL]",0
"[USR] [USR] E SE NON CE LAVORO, TU PORTI I MIGRANTI, STRATEGIA INTELLIGENTE, INVECE DI CAPIRE(PER TE DIFFICILE) COME PRODURRE LAVORO,PORTI I CLANDSTINI. MA VA AFFANCULO FIGACCIA DI MERDA.PORTALI  CASA TUA.",1
"Accampamento rom abusivi via Tremelloni e Anassagora Milano, segnalazioni dei residenti e foto - Cronaca Milano [URL] #M…",0
"Reddito di cittadinanza a stranieri e rom, è polemica. Ora cercano di metterci una pezza - Secolo d'Italia [URL]",0
[USR] [USR] E i rom trasferiti in suite in centro di Roma con caviale e champagne! Vergognatevi di esistere��,0
"Chi vuole legittimare il proprio cattivismo delegittimando chi pratica il soccorso umanitario può passare la vita delirando tra calunnie, insulti, menzogne e complotti, ma tutte le predicazioni d'odio del mondo valgono meno di una vita salvata e di un migrante portato a riva.",0
Il business dei falsi profughi è anche questo. [URL],0
[USR] te lo dico io come fare: fuori zingari rom sinti e Merda varia via clandestini parassiti quindi tutti bomba a Montecitorio,1
"[USR] perché ovvio, tutti i criminali sono rom",0
In Toscana si sfamano i rom con i buoni pasto della Coop [URL],1
BUONGIORNO PATRIOTI..LA KIENGE FA IL PARTITO DEGLI AFRICANI E STRANIERI CONTRO IL POPOLO ITALIANO..UNA CREATURA DEL PD CHE PENSA SOLO AGLI IMMIGRATI ILLEGALI.. CI DA DEL RAZZISTA.. MA FA LA VITA DA NABABBI CON I SOLDI DEGLI ITALIANI ! #MovimentOnesti [URL],0
"Giovane migrante muore sull'A8, tra Ventimiglia e Mentone: un'altra vittima della frontiera (Riviera24.it)… [URL]",0
Hanno rotto il cazzo con tutti questi atti terroristi.  Io sono pronto alla guerra,1
#Sala #Milano Ottimo lavoro! Citta sotto assedio.#Alfano:Stop profughi.necessario esercito x sicurezza cittadini [URL],1
"#daleggere  [USR] su Roma, nomadi e integrazione [URL]",0
L’espulsione dello straniero in carcere e la funzione rieducativa della pena [URL],0
[USR] La vostra merda va scaricata secondo la Legge. Secondo le procedure. Secondo i costi previsti.  Come la Legge impone a me e alla mia azienda.  Basta impunità a chi nasconde dietro falsa immigrazione Fatturati milionari e Progetti di sostituzione e meticciato pro-capitale.  Galera,0
Studentessa cinese uccisa a Roma: indagini nel campo rom [URL],0
[USR] com'e' la storia che i #migranti si ammalano quando arrivano in Italia? [URL]  #stopinvasione,1
Hanno combattuto con i curdi contro l'Isis: trattati da terroristi e perquisiti [URL],0
"#BERGOGLIO ,NON PAGO DELL' ULTIMA STRAGE DI #CRISTIANI IN #SriLanka , RIVENDICATA DA #albaghdadi , SOGNA E PROPONE DI IMPORTARE IN ITALIA ALTRI DELINQUENTI E TERRORISTI DALLA #Libia !!!!! #portichiusi #stopinvasione #StopIslam #MovimentOnesti #??????? #salvininonmollare [URL]",1
"Ricordate #Duccio Dini  quel povero ragazzo ucciso da due #Rom che giocavano a inseguirsi con le macchine? Ebbene a queste sue bestie li hanno scarcerati. Ma mi raccomando eh,mobilitatevi per i clandestini della #Seawatch ldlmortvostra! Non si fa #FacciamoRete x questo ? [URL]",1
"Baranzate, campo nomadi ai raggi X:83 persone controllate, 67 con precedenti. C’è anche un ricercato - Il Notiziario [URL]",0
[USR] ancora immigrati in. Veneto no BASTAAAAAAAAAA ...governanti portateveli a casa vostra!!!,1
[USR] La vera minaccia non è il terrorismo ma la diffusione della loro cultura barbara e primitiva...Siam… [URL],0
[USR] ho visto immigranti ilegali anche nella Vittorio Emanuelle a Milano. Non dovete lasciagli! Stanno rovinando l' Italia !,1
"Cari rom, trovatevi un lavoro e una casa come cercano di fare milioni di italiani. Non fate i mantenuti !  #piazzapulita",0
"L’#Italia è quel paese dove le mucche vengono massaggiate coi rulli o bevono il tè delle 5, mentre gli #indiani immigrati che le mungono dormono stipati in container senza bagno, rigorosamente sottopagati, e all’occorrenza anche malmenati! #Piazzapulita",0
IL  POPOLO  VUOLE PROCESSARE  I CERTI  BUONISTI  CHE HANNO  SEMPRE TENUTO  APERTE  LE  FRONTIERE  ITALIANE AGLI  DI INVASORI STRANIERI TROVANDO  MILLE  SCUSE  PER  GIUSTIFICARE  LA  LORO  STRANA  APERTURA  VERSO   INVASIONE  SUL  POPOLO  ITALIANO  !!!  [URL],0
[USR] [USR] [USR] ESITE UN TRAFFICO DI ESSERI UMANI!!!!!!!! LO CAPISCI O NO!!!!! SONO MIGRANTI ECONOMICI!!!!!!!  CAPRONEEEEEEEE,1
"Li hanno solo feriti? Se fossi padre o parente della ragazza non mi sarei fermato... così anche gli altri clandestini islamici avrebbero capito che QUI STANNO IN ITALIA, non nei loro paesi islamici di merda!!! #governodelcambiamento [URL]",1
"La #AlanKurdi di [USR] con 64 migranti a bordo sta facendo rotta verso nord, esattamente nel mezzo tra #Malta e #Lampedusa. Come mai non è rimasta in zona SAR della #Libia per continuare a cercare l’altro barcone con 50 migranti disperso? [URL]",0
Era in Italia. Poteva massacrare un centinaio di italici. Gli immigrazionisti del Governo italiano tacciono. [URL],1
Lavori da #rom [URL],0
[USR] tutto normale e gran felicità per i paladini dei migranti e della globalizzazione . Ma se fossero loro le vittime cambiano idea ?,0
Non passa lo straniero!! #24maggio #GrandeGuerra #LItaliaInGuerra #Italia #Italy 🇮🇹,1
YAHOO!!Scoperti 7 nuovi pianeti simili alla terra!!forse abbiamo trovato la soluzione per il ricollocamento dei migranti!!,1
[USR] [USR] [USR] Io da 12 mesi ho chiesto a Boldrini quanti migranti ha accolto a casa sua ma non ha mai risposto !!molto strano con tantissimi lei non ha scelto un gruppo di  questa gente raffinata e volonterosa ..dippende a cosa ...,1
Tagliamogli le palle vedrete che non lo faranno più che siano italiani o stranieri [URL],1
"Rifiuta test su #animali, RE Vendono cuccioli denunciati, Roma Sequestrati #cuccioli venduti al mercato dai #nomadi [URL]",0
Ancora #migranti Ancora STUPRATORI [URL],1
"Qui nell'hinterland m.se siamo alla follia, posti di blocco dovunque, scene d'apocalisse zombie, rom inseguiti nei parchi #papamilano2017",0
"Meglio abitare accanto a un Rom che a un Leghista... Sono Genovese, è ricordo quando hai difeso a spada tratta la famiglia #Benetton dalle critiche per il crollo del ponte #Morandi , vuoi vivere con i #Rom ? Bene, ti auguro di trovare sistemazione sotto un ponte con loro. ? [URL]",0
"Rep Tv Torre Maura, tra case popolari e negozi abbandonati: ""Non siamo razzisti, ma i rom sono un p… I MIGRANTI ED I ROM NON SAREBBERO UN POROBLEMA SE VENISSERO GESTITI. NON LO SI FA, PERCHE' NON CONVIENE  E SERVONO I VOTI DEGLI ARRABBIATI. E' UNA LOTTA TRA POVERI",0
[USR] africani?perché non ci metti pure i marocchini? L'Italia per te è solo mafia/napoli/scampia? Oltre questo sono tutti stranieri?,1
si preoccupano + delle situazioni di vita di delinquenti ed immigrati che di come vive la popolazione ONESTA. Il governo italiano FA SCHIFO,1
"Ordine di #Yahweh, ''Dio'' di ebrei, cattolici, cristiani, islamici a tutt'oggi mai revocato:  ''Uccideteli tutti,… [URL]",0
"Quando si parla di #immigrazione (clandestina e non) si fa sempre riferimento agli immigrati africani, ma in realtà sono solo una minima parte della popolazione straniera che arriva in Italia.  Leggi i numeri #ISTAT [URL]",0
"#Palermo. Allaccio non regolare al campo rom, dopo 4 mesi non è cambiato nulla: [URL] [USR]",0
"Papa Bergoglio dichiarazione shock”fratelli stranieri venite in Italia, la mia casa è la vostra casa - Gazzetta24 [URL]",0
"[USR] [USR] [USR] servizi come questo, mostrano che l'Italia farebbe volentieri a meno degli immigrati",0
"Il MOV 5ST è estremizzazione del PD, pro clandestini,rom, centri sociali,No TAv No tutto, + fanatismo vegano e impo… [URL]",0
"[USR] [USR] La sensazione è che l'atteggiamento prepotente assunto dall'Italia nella questione migranti si stia ora rivoltando contro i nostri connazionali rimasti senza lavoro all'estero. Non è una conseguenza diretta, ma il clima è brutto",0
Due nomadi minorenni denunciate dagli agenti della Polizia di Oristano per possesso di... [URL] [URL],0
"Secondo me non sono un pericolo ne gli immigrati ne gli italiani che ""sparano per strada""...i pericoli ci saranno sempre (e cmq sempre di meno) ci chiudiamo in casa? Ma allora è molto più facile fare un incidente andando al lavoro...non è un emergenza!!",0
"soltanto un depravato come Maometto si può ingroppare una bambina di nove anni! e non c'é qualcuno che debba essere condannato a morte per blasfemia più del Corano stesso! Perché proprio il Corano smerda Mohammed  Putin e Xi-Jinping, ONU Pd Bilderberg SpA FED NWO OCI LGBTQ:",1
"Ma per i preti conta solo il business. Che i migranti restino a casa loro non ci pensano nemmeno. Perché poi che fine farebbero gli affari di Coop, Associazioni, Caritas, eccetera.....? [URL]",0
[USR]   Bene....  Poco alla volta i migranti ci cacceranno dal nostro paese!,1
[USR] [USR] Escludiamo gli atei totalitaristi che ormai sono presenti forse in oriente. Ma gli altri atei che cazzo fanno di male? Mai visto un ateo farsi esplodere o andare contro una processione o spaccare crocifissi...di cosa parliamo? Mentre l'islam per la sua stessa natura è un problema,1
"[USR] [USR] [USR] BISOGNA SVUOTARE L'ITALIA DALLA MERDAMMMAAA DEL PC,SINISTRA COMUNISTA È IL PD DEMOGRAFICO DI MERDAMMMAAA CON TUTTI PROFUGHI CHE HANNO FATTO ENTRARE E TU GLI ITALIANI CHE LI VOTANO ANCORA MERDAMMMAAA",1
"Non solo #turisti. Gli stranieri amano l’Italia: 1° meta #EU, 2° meta al mondo superata solo da gohawaii per… [URL] rt F…",0
[USR]  La mia idea era quella di mandare tutti i rom italiani a ricostruire Aleppo,1
"[URL]   Questi sono i nuovi immigrati voluti dalla sinistra italiana. Questo "" animale "" non troverebbe posto neppure in una giungla, invece ce lo ritroviamo qui. Occorre tutelarci è SUBITO.",1
"Dopo la chiusura del ponte di Paderno i treni dei pendolari da Bergamo per milano sono così pieno che se Salvini dovesse vederli, non li farebbe attraccare in nessuna stazione lombarda e rimanderebbe a casa i profughi.[USR] [USR]",0
"[USR] [USR] Si' gli immigrati sono al 99.99% delinquenti, la prova sta' nelle loro azioni, scoperte e non.",1
Non generalizziamo ma su un campo 3000 rom 2500 ha avuto a che fare con la legge#dallavostraparte,0
"#Alfano, dopo aver riempito l'Italia di immigrati, promosso a Ministro degli Esteri. Non è governo, è ammucchiata d… [URL]",0
[USR] ha inciso anche un aspetto: la paura folle che avevano i parigini. Negli ultimi 10min erano terrorizzati,0
"Cosa c'è nel decreto ""immigrazione e sicurezza"", secondo le anticipazioni che circolano, compresi i due punti che potrebbero essere incostituzionali: [URL]",0
Caro Babbo Natale puoi far sparire le sinistre con l'euro e gli immigrati ? [URL],1
"Scuola di borseggio' sulla metro di #Roma: sette nomadi arrestati, ... - [URL] - #Metropolitana #OperazioneCarabinieri",0
#terrorismo Fabrizia per la Germania è vittima della strada [URL] [URL] rt IlCapoluogo rt Promo_Abruz…,0
Il terribile impatto devastante della bomba Moab sui terroristi afghani [URL],0
"[USR] [USR] Il patto di #Minniti è stato dichiarato disumano perchè ha pagato i libici, lasciando i #migranti nei lager !  Che gli sbarchi siano diminuiti lo certifica Frontex !! [URL]",0
"[USR] [USR] [USR] Due delinquenti immigrati sono ancora in Italia?penso che ce ne siano ancora un numero enorme!!Ringraziamo Salvini che ha iniziato a difenderci,il vecchi PD ci ha addirittura sommerso,e stanarli ora diventa più difficile!!!!",1
[USR] : incremento della polizia municipale e telecamere fisse nei campi rom.. Ma al campo di Borgaro continuano i roghi tossici. :-(,0
"Vaiafareinculo, mangiapane a tradimento degli italiani. Schifoso parassita dell' italia. Pagato per non fare un cazzo tutti I'l giorno questa zecca. Vergognati, see non ti place l' italia vattene in Africa con I tuoi falsi migranti e restaci schifoso essere.",1
"[USR] I BUONISTI IPOCRITI ACCOLGANO NELLE LORO CASE LE FAMIGLIE STRANIERE, NON NELLE SCUOLE CON I SOLDI DEGLI ITALIANI, MENTRE L'ISLAM DISTRUGGE LE CHIESE E NON PERMETTE LA LORO COSTRUZIONIE, PERCIO' TUTTI A CASA VOSTRA....",1
Grand hotel Italia : noi li ospitiamo L'Europa li respinge! # migranti# gli Italiani non ce la fanno piu' # quinta colonna!,1
"[USR] I ROM vivono in ""comunità"" da secoli in campi, habitat necessario per losche attività: le  donne, bambini e vecchi chiedono l'elemosina  nelle città vicine, gli adulti coprono le giovani donne abili ai borseggi o furti. Altro che casa, lavoro e integrazione, molti vogliono rubare",1
#StaseraItalia manovra del cazzo questi immigrati rom devono smetterla di pesare su di noi italiani se ne devono andare noi italiani non sappiamo neanche come RISOLVERE i nostri problemi i LORO PROBLEMI LI RISOLVONO AI LORO PAESI I COMUNI ITALIANI devono aiutare noi ITALIANI...,1
"[USR] Facce di terroristi, assassini e avanzi di galera! Prossimi spacciatori di droga per le nostre citta, davanti ai negozzi a rompere le palle alla gente! A quelli bastardi del PD che li hanno fatto entrare non vanno a rompere, però a noi si!",1
"Mentre in Francia i migranti si spostano con calma, in Italia ci sono i peggiori, tra ieri ed oggi circa 7.000 sbarchi.  Sino a quando?",1
"Rifiuti e inquinamento, il campo nomadi della 554 finisce sotto sequestro [URL]",0
I vescovi di Francia e Germania: “Ogni bambino (anche migrante) ha diritto di vivere e giocare” - [URL] #GoogleAlerts,0
Dopo 38 furti spara e uccide il ladro. #HaStatoSalviniIl piddino del giorno dice che bisogna indagare Salvini. Il governo si è insediato il primo giugno. Tutte queste rapine sono cominciate dopo? O dobbiamo indagare anche Minniti e chi ha favorito l'immigrazione clandestina? [URL],0
Qualcuno faccia una strage di ragazzine 12-enni. Che co tutti sti martiri islamici del cazzo quelle in Paradiso so belle che finite.,1
Nel nord Italia le famiglie immigrate rappresentano il 41% delle famiglie in povertà assoluta #AtlanteInfanzia [URL],0
"Dopo [USR] rimanete su #Tv2000 a [USR] parliamo di Sikh, una delle comunità straniere più numerose in It… [URL]",0
"\""Stavo pensando ai genitori di quella bambina che terroristi hanno fatto saltare in aria.Stavo pensando a che genere di merda possono essere",1
"Roma, “giro di mazzette per pilotare gli appalti sui campi rom”: 13 a... [URL] by #fattoquotidiano via [USR]",0
Porteranno lo spread a 500 pur di mandare a casa il governo (regolare ) attuale poi arriverà il PD o PDL a ghettizzare l'Italia intera e renderla un letamaio più di quello che già è. Poi daranno le nostre case agli immigrati e a noi ci cacceranno. Questo vogliono fare E noi zitti,1
"[USR] Ecco un altro prelato che parla di figli di famiglia di migranti... ma se invece ogni tanto si ricordasero di tutti i figli di preti non riconosciuti ( migliaia), dei  figli che hanno rovinato con abusi e violenze sessuali, dei disagi economici delle famiglie italiane? È troppo?",0
"#MimmoLucano sindaco di Riace, paladino dell'accoglienza, è stato arrestato per favoreggiamento dell'immigrazione clandestina e fraudolento affidamento diretto del servizio per la raccolta dei rifiuti.  Attendiamo il commento del suo caro amico di [USR]. [URL]",0
[USR] Per la nostra sicurezza bisogna identificare tutti quei fetidi di beduini islamici che sono andati davanti al colosseo e cacciarli,1
"La pazzia dell'Islam,e ci stanno invadendo con la scusa dell'immigrazione(clandestina).",1
"Il cordoglio dopo la morte di Fabrizia: ""L'Abruzzo è terra di amore, il terrorismo non passerà""… [URL]",0
"#Roma, ma la #raggi #m5s nn doveva essere diversa? e poi ????«Tre famiglie italiane mandate in un campo nomadi» [URL]",0
"Il #FinancialTimes prende soldi da #Soros che è amico del #pd a cui piaccion le #ONG che portan gli immigrati che rubano il lavoro spacciano la droga coi soldi di #Fazio, invasione, maloxx, rosika, ruspa, piddiota...bacioni 😘",1
#StaseraItalia quindi verranno aiutati anche mafiosi e IMMIGRATI con questo reddito di cittadinanza io di sicuro non lo prendo sono disoccupata ma non sono mafiosa e immigrata e questo il punto,0
"Solo un padre snaturato pensa agli altri prima dei suoi figli. È quanto accade in italia. I migranti vengono mantenuti con soldi pubblici, posso capire I profughi, che sono mosche bianche. Ma gli altri. Le risorse sperperate per soli stranieri.  [URL]",1
[USR] ma Ferrero  è  un pirla 629 furti al dì  in abitazione tutto o quasi commessi da stranieri.....,1
Gli avvocati d’ufficio dei 4 finti profughi arrestati sono solo gli ultimi di una lunga serie di legali pagati ai migranti con le imposte versate dagli italiani.  L’ultima beffa per Desirée: gli avvocati dei suoi aguzzini li pagano gli italiani [URL],0
"[USR] [USR] siii �������������� come mafia capitale ��������������magna magna..""con rom e clandestini si guadagna… [URL]",0
#meningite il regalo dei #migranti [URL],1
Attenzione nelle ultime 72 ore Il gov.excomunista hanno fatto sbarcare 8.500 illegali da navi straniere nn si rende conto dei ns problemi!,0
"Mentre la Sinistra voleva imporre lo Ius Soli agli italiani, ""come fanno nei paesi civili come gli USA"", Trump vuole per abolire lo Ius Soli in USA per impedire che immigrati e  clandestini vadano a partorire in USA per prendere la cittadinanza. [URL]",0
[USR]  Ho sempre ragione amica mia.A presto e lascia perdere la citta' dei Polentoni immigrati meridionali.Roma impera,1
"ECCO COSA SUCCEDE A METTERSI CON DEGLI IMMIGRATI. FATELO PURE, MA DA SOLE, SENZA METTERE IN PERICOLO I VOSTRI FIGLI. ""TUNISINO AMMAZZA DI BOTTE UN BIMBO E FERISCE GRAVEMENTE SORELLINA"". GALERA PER ANNI ED ESPULSIONE PER 'STO MOSTRO!!!!  STOPmultikulti [URL]",1
#migranti è entrato in TT Italia alla posizione 44,0
"Non ammettono che le persone istintivamente ,a pelle, si fidino di [USR] perché finora è unico che ha capito la priorità assoluta per italia adesso. PERICOLO ISLAM E AFRICA DA SCONGIURARE al resto penseremo .....propedeutico [URL]",1
"[USR] due anni fa eravamo tutti con loro contro i terroristi.  Hanno fatto oggi ciò  per cui sono stati colpiti, ora Nn va più bene?",0
"ed é giustissimo cosí, lo stato deve usare i soldi per formare gli italiani disoccupati non per trovare lavoro e insegnare l'italiano a migranti economici ed irregolari, forza [USR] #tagadala7",1
"[USR] E una religione che va resa fuorilegge in tutta Europa , gli europei i mussulmani non li vogliono e abbiamo tutte le ragioni del mondo x non volerli qui in Europa , e ora di fare una guerra di civiltà o noi o loro",1
La Ue apre alle richieste dell'Italia su migranti e #terremoto La Ue apre alle richieste [URL] #laue #pierremoscovici,0
"Ferrara, denunciato il leghista della barricate anti-migranti [URL] [URL]",0
"Roma, scolarizzazione dei bambini rom? Un totale fallimento, buttati 10 milioni di euro [URL] via [USR]",0
POSSIAMO CONTINUARE A FARE SCAPPARE I NOSTRI LAUREATI E AL POSTO LORO METTERE ANALFABETI DI MIGRANTI?? CHI SANO DI MENTE LO FAREBBE???,1
"IlFattoQuotidiano -  Roma, dal comune ok a un nuovo campo rom. Campidoglio: “Misure temporanee. Obiettivo è… [URL]",0
Sono andati quasi tutti via i #rom che hanno occupato la masseria sulla Lecce – Novoli… [URL],0
"[USR] Avendo una lunga storia di attentati di matrice islamica es. Cecenia/Cecenia (scuola di Beslan, te… [URL]",0
"Calais, 100 minori stranieri soli irreperibili dopo la prima registrazione [URL]",0
"#Dropmire è un programma di sorveglianza della #NSA finalizzato alla sorveglianza delle ambasciate e del personale diplomatico straniero, compresi gli alleati della #NATO. 38 le ambasciate straniere sotto sorveglianza, alcune delle quali già nel 2007. #SorveglianzaGlobale [URL]",0
"Vedere gli stati contro i rom e poi stati sulla giornata della memoria, davvero mi fate venire la pelle d'oca, fenomeni.",0
[USR] Vogliono importare l'islam in Europa perché come oppio dei popoli è il più potente. Nessuna religione controlla le genti e distrugge le democrazie meglio dell'islam.,1
"[USR] [USR] [USR] :""""DOVRETE CIRCONDARLI E METTERLI A MORTE OVUNQUE LI TROVIATE ,  UCCIDETELI OGNI DOVE LI TROVIATE, CERCATE I NEMICI DELL'ISLAM SENZA  SOSTA.""""  (SURA 4:90)",1
Per me puoi andare affanculo te e tutto l'islam... [URL],1
"#dallavostraparte dopo il coglione di colore, il rapper rom. [USR] [USR] [USR] [USR]",1
[USR] ci vogliono le ruspe... ma non solo per i campi rom ma per i palazzi di Roma ... buon anno ..,0
Possibile che dopo i fatti di Parigi il ns. Governo difenda ancora gli islamici. Forse per mera questione di voti?,1
"Neanche dopo i disastrosi sismi in Centro Italia, Renzi  blocca i clandestini per devolvere i soldi risparmiati agli Italiani #migranti",1
[USR] [USR] grande anche qd difende a SPADA TRATTA immigrazione selvaggia?  #contentivoi,0
"[USR] [USR] [USR]  mo dobbiamo pure spendere i soldi per la dinamite? Diamola ai rom, che così la smontano gratis per rivendersi i metalli, e magari con la ruggine del ferro si beccano il tetano e ci leviamo di torno pure a loro",1
Dai pirati della Malesia al terrorismo fondamentalista (L'Indro) [URL] [URL],0
ORA BASTA BISOGNA URGENTEMENTE RISPEDIRE A CALCI IN CULO AI LORO PAESI QUESTE 💩💩💩SCHIFOSE!! Migranti in rivolta devastano centro rimpatri: feriti carabinieri | Vvox [URL] via,1
"WEEKEND AL CINEMA Opera prima di Alfredo Lo Piero LA LIBERTà NON DEVE MORIRE IN MARE non racconta l'immigrazione in termini di cifre, quelle dei morti e dei vivi, ma lo fa dando voce alle storie, alle vite,... [URL]",0
"Attacco a #Londra 🇬🇧 #westminster: 5 morti e 40 feriti. Per fermare questi #attentati dei fondamentalisti islamici, cosa fare?",0
