text,label
#LordKabirJi  *Real spiritual knowledge* Supreme God Kabir went to Satlok with his body from Maghar. Because Supreme God is Kabir URL,0
This may seem barbaric but why don't they just execute them? I mean they *are* ISIS dudes,0
As someone who is mixed race it's nice to hear someone finally talk about it like that,0
Every bitch im fucking say they only fucking me,0
"Rand0m guy: Yuh black asian guyz be unempl0yed getting galz pregnant , h0w y0ur sperm w0rk but yuh d0nt ??? Le meh : Sperm iz white yuh MF 😏",1
The person to blame for these murders and acts of violence toward our community his name is the irritated Genie he has a YouTube platform key Associates the LGBT with being pedophiles he has a phrase that he uses he says homophile he's going to Africa like places like Tanzania to spread his rhetoric and he's getting people killed he can be charged with these crimes it's called conspiracy I think,0
"""Women from Canada have to go to US for abortions they can't access here here's why I'm gonna ignore the glaringly obvious that Canada is fascist too""",0
@user @user if you don't shut your gay ass up😭,1
@user  What... that the Zionist Jews use the Black Americans and pit us all against each other for profit and control ?,0
Bitch u don't know how to suck dick anyway! Get ya black ass back in da house😂😂,1
My teeth are so white they called this meme racist,0
@user This nigga mad cause he ain't getting any. Who this guy? URL,1
intelligent bitch on my side,1
"Yes, ""unproblematic"" as in ""I'm the sort of person who is constantly labelling people and things as 'problematic' but not in this case"". Sounds like the kind of person who complains about white voice actors playing POC or asks why none of the main characters are black in a movie about Norse mythology.",0
"@user You idiot Terrorist what are you talking about , look in Iran if the Iranian people get chance you will dead in one second,",1
MILLIONS OF GIRLS OUT HERE YOU SHOULD NEVER ONE BITCH STRESS YOU OUT,1
Don't worry tell them come to American white genocide is bout to happen in America white lives don't matter,0
cock of doody 4 modern gay fuck stupid,0
"@user Okay it's nice to know I'm not alone in this. Especially being in a seemingly-straight relationship, I end up doubting myself and feeling really left out or like I don't belong in the queer community.",0
Go AUTISM PROGRAMS FOR JEREMIAHA LOL CAUSE HE HAS NO IDEA WHAT HES SAYING,0
Most guys are douche bags and don't know how to respect a lady!!,1
"I'm really about to cry , please pray for #Sudan these innocent people . If only people cared about the people here as much as the unborn 😔 URL",0
That bitch in yellow should go back to her shithole land.,0
"I grew up around mostly Mexican-Americans. Almost all of my friends. I was always amazed at how loving and warm their family events were compared to my Gringo family.  Everything with my family is a competition. What job do you have? how pretty is your wife/GF? What kind of car do you drive? People were glad to see each other, but no one ever really says it.  With my Mexican friends it was always just Tia and Tio being genuinely happy and ecstatic to see people.",0
"@user @user Skank weasels sexually frustrated. Muslim twerp head, Brooklyn tostada twirler. Skank mouth. Black follow The stank sent of tuna.",1
Could autistic shits like you kill youself? Thx,1
shut the fuck up you dumb ass faggot cuck mokney dipshit bot,1
This bitch would get mad roasted on r/roastme,0
itsy bitsy? They've overplayed their hands and misread the board. They are used to being apologized to the second they bring up the Holocaust. This is a blatant smear campaign trying intended to enrich Jews at the cost of Poles and their reputation.,0
"its 2019, NO one cares that you are gay. What else you got! What do you want on your tombstone, here is Wil he didnt amount to shit in life, but he sure was GAY!!!!!",0
"Pakistan is a country that supports terrorism, close your borders and stop training terrorists and less people will hate the country overall.",0
"The Eternals will have a Mexican actress, an openly bisexual actress, a Korean man, a Pakistani man, a black man, a deaf black woman playing the role of a white hearing man, there are rumors that Ikaris is going to be gay and is directed by a woman. We won URL",0
So many soy boy cucks in the comment section supporting AntiFa. I wish one of you soy boys would step to me. Get your scull cracked in half like the beta male pussies you truly are,0
If you bitches a quit lurkin on my fuckin page y'all feelings wouldn't be hurt so much😂 y'all wouldn't have not one reason to be so god damn salty.,1
FAGGOT'S LIFE - Total submission is the greatest gift a faggot can give his Sir. IT ISN'T FOR THE WEAK. IT ISN'T EASY. URL,1
"@user Stupid bitch, like how bout yu go sit in them jails like they did...go through everything they ALL went through. For NOTHING !",1
Your fat ass mother wobbles across the fucking living room after I use her face to wipe my ass what's the matter little faggot sperm dumpster you run out of children to molest in your neighborhood you're nothing but a homosexual cock sucking up the butt fucking baby raping child molester AKA sperm dumpster tell your mommy stop calling my house I fucked your real good to. I let her suck the shit off my dick in fact I I ripped her head off and shit down her throat and use her face to wipe my ass LOL keep sucking that dick like the sperm dumpster you are fagg,1
you idiot jews better get in their hidey holes :),1
These niggas are spawning straight from the 9th circle of hell 💀💀💀💀💀 URL,1
Slap this cunt,1
An amazing Friday with an amazing wish this Friday is the last Fariday of Ramadan so celebrated in thanking Allahjj almighty for awarding us this special month which belongs #Jumma_tul_wida 😇 URL,0
I had no idea he was even an AMWF hapa. Learn something every day.,0
"God has lost faith in America, your only causing terrorism, Allah is cool and gay is OK!",0
This is 4chan not watchredditdie Post your faggotry elsewhere fag,1
"I would bury my hard daddy cock inside ur sexy ass, rail u until u beg me 2 creampie ur pink sissy hole, sweetheart!!!!",1
some bitches are just made for sex,1
"If anyone says ""Sub to me"" I'll spam the comments as fast as the Nazi's killed the Jews",1
"Their speaking is just horrifying, they are all so uneducated and so desperate. And I support mass deportation!",0
Short girls are cute uhh 😌💓 URL,0
"These draconian abortion laws being passed by states have to be called out everyday and stopped! C'mon men,fight for women & stop this ""not all men"" whining & bullshit! Show women we support them & step up! Call out the misogynists & stop this Handmaid's Tale #IStandWithWomen URL",0
Suck my dick you cunt. Get over it.,1
"Out of context, LMAO, imagine actually resorting to that one in 2019. Speaking of the religion of peace, that website puts things in context and links directly to the Quran. That's alright though, a religion that promotes inbreeding is obviously going to produce people like yourself.",1
"""i'm scared i'll hurt you"" NIGGA I SAID SLAP MY ASS AND CHOKE ME OUT TF",1
fuck this dumb ass bitch URL,1
die for my bitch.,1
*u have MONEY... Blablabla... But u LOOSE ur ankles Lil boy* help humanity and stop to be an asshole on internet #FromFrance #thisisrealtalk,0
well just look how ugly and retarded he is.. of course he would have to have slaves... no real woman would want that ugly POS retard. they have to be forced. he even had rules that they could not look at anyone else and they had to call him daddy... hang the bastard high. on TV.,1
Whenever I hear about religious baloney like [this](URL,0
Women really should start carrying guns around. Alot of you niggas deserved to be shot by em,1
@user White supremist this can always find colored negros to lay down cover fire for their madness. It is s good these these aged apologist are a dying bred.,1
"Dude, you're a fucking mongoloid.",1
Congratulations... your a faggot,1
@user This hateful bitch needs to sit her plastic collegen filled botox ass down!,1
"Please America! Bring back slavery! My race was so much better when we had someone to take care of us, give us a good honest day of work and tell us what to do. Now all we do is murder innocent people, have libtards give us billions of dollars in free welfare money and overflow the entire prison system.",1
"Part of the reason I discovered Dr Ambedkar & Malcolm X so late in my life because I grew up in Hindi. The world of Hindi has only Brahmin writers, poets, thinkers, artists. It's almost impossible to ever know about justice and equality if you knew only Hindi.",0
You guys are so ugly Asian cunts,1
@user pakis pretending they r kashmiris 😂,0
@user Consider this: very large women.,0
"WHAT ARE YOU THE FUCKING HALL MONITOR NOW? SHE NEVER SAID ANYTHING ABOUT YOU GOING TO PRISON. NOT PUBLICLY. STOP MAKING SHIT UP YOU FUCKIN DEPENDS EXTRA WIDE IN THE REAR SHITTIN, HAULIN THE WHOLE TRIBE TO THE UK WITHOUT A PROPER INVITE EXTENDIN, NO PROTESTS SEEIN, WHITE TRASH! FU URL",1
Lmao. Really? Equality? With whom? The people who play best of 5 while you play best of 3?  Funny cos Ive followed her career for many years and back when it was practically all whites she'd play the race card. Ever since what happened with Osaka in the US Open she couldn't and started talking about gender.  Ready for her to go anyway.,0
"No honourable man would EVER use such a disgusting hashtag 👇 about any woman. #مریم_کاوار_چوتھےمہینے_بچےباہر Similarly, NO dignified woman would ever retweet the DISGUSTING tweets that Maryam Safdar does! 👇 Absolutely classless!👎 URL",0
You whites don't deserve to be apart of humanity,0
"These fuckers want a quick fix to heaven, they think they have sinned all their lives and by doing these disgusting acts they will be forgiven but if their is a just God they will be punished in that heaven too.",1
And by a catty whore bitch.,1
"thats right u hate ameroca go get enslaved in somalia, n fatfcc talib go back to your fcn desert tent, aoc go get ur fcn tip cup ill shht in it",1
MooHamMad was a rapist pedophile hitler of Arabia,1
Looks like a threat too me you fat poop face gay guy (the person who said that is stupid they don't know how too hack god people are sooo gay and stupid),1
I think it will be worse. Rape is fine but insult jews and you're fucked in this cruel world.,1
The gay neega has too many tats,1
What to do when there's no dick around? Fuck yourself that's what! URL,1
"The Sniveling Babies In Arizona are at the Top ,They Need Adults Diapers +Pacifiers Harassing Females At Coffee shops And supplying drugs to children for generations and covering their asses murdering Innocent Families and Abusing the Community!  Twistedly Upside down Babbling Babies Chimpanzees That Want Respect! Ha! HA! HA! THE GRAINS IN A HOURS",1
"I was gonna say this lol. But it seems to be regional-dependent from what I can tell (in regards to the States, I mean). Like, I'm from the South and an open-relationship is still a very rare thing to come across.    But over the West coast, they'rs downright proud of how they've ""redefined the meaning of relationship"", gay men especially. (I took a trip to San Fran last October and I can't tell you how many times I heard that ""we've redefined it"" line dropped in bars as soon as a guy realized I was southern haha.)",0
Why do women have to PAY for tampons for something they can't control and have to deal with every month. URL,0
Bet it was a black person? When the killer is found if they are white I will come back to this message and call myself dumb.. If they are black you have to do it.. Deal?,0
Yes they are fag.,1
I'd leave that fuck hole dripping with cum like the whore you are and then call my friends to dump their loads inside you too,1
Moon Watch I heard the Ukrainian Nationalists are puppets of the US. The nationalists don't want a balanced documentary about Putin.,1
your going to do kids like that ? wow you should have your Damn head blowed clean off you sick Bastards smdh over this foolishness URL,1
You insulted me first. Why are u so obsessed with me? No hoe I was talking to you. Leave god out of this bs,0
Why listen to the same old hate America and show that mental illness is a good thing to evolve into??,0
"@user Yea, Marriane's ""sweet hippy lady"" glow is starting to wear off, Tim. She seems to just be a much nicer version of the race obsessed intersectional nut job.",0
"If a girl wants to have unprotected sex with you, she *cannot* be good for you. She could've been trying to trap you to her forever by saddling you with an unwanted child.  She may seem nice, but she's probably one of those ""nice girls"". If I were you, I'd leave her, because it seems like in your relationship, disaster is imminent.  You're young, you have all the time in the world to find a better woman.",0
"You called AIDS ""God's Punishment"". Once the person above called out your ignorance (you seemingly didn't know that countless innocent babies get it too) you switched to attack mode thereby further exposing your anti-islamic mentality and lack of adab. If nothing else i find your responses one of the highlights of this subreddit",0
Fuck the basij.. Inbred ugly pieces of shit,1
Holy ass you fucking faggot,1
Iran is full of religious Nazis...,1
@user OK?? OK?? LOOK YOU BIG NASTY SMELLING FAT BITCH WHY YOU TOOK ME OF THE MOTHERFUCKING SCHEDULE WITH YOUR TRIFLING DIRTY ASS YOU BIG FAT BITCH OOMPALOOMPA BODY ASS BITCH I'M COMING UP THERE AND I'M GONNA BEAT THE FUCK OUTTA YOU BITCH AND DON'T EVEN CALL THE POLICE BITCH,1
"There WAS NO country when white people came to America, they literally fought for the land and built a civilization out of pure wilderness.",0
Need a sissy cum slut in my life,0
also compart bisexuals to pedophiles again and i will literally come to your house and cut off your ears,0
I let a nigga do what ever cause he gon do what ever regardless,1
"You dumb whore, put the baby up for adoption. If you don't want children, then don't have sex.",1
friendly reminder that being cute also is empowering to women and i'm tired of comments saying that only girl crush concepts are empowering to women and that being cute is not,0
It's because they're Asian. Some people on Reddit appreciate humor from white people and black people but don't get butthurt when they see Asians doing something like acting.,0
this is a nigger fuck,1
@user Your racist against white people...and so you know they are people too....@user is the epitome of #antiamerican,0
That hoe too basic ion want ya bitch,1
"Whenever these financial terrorists want to bring their stolen wealth to Pakistan under ""amnesty schemes"", the inflate the dollar to get maximum returns on their loot even after paying taxes.  Free floating the rupee without State Bank control is a disaster in itself.",1
Don't let this white boy boil up cause if he does all y'all niggas are doomed lol,1
Cool hand you fucking faggot why don't you square up and we'll see who's boss pussy,1
"we should offer $1,000 rewards for turning in illegals to ICE and fine companies that hire the $10,000 per individual.",0
"Yeah, bizarrely there was a girl at my school who's parents where from Hong Kong, moved to Texas where she was born then moved to England when she was in her teens. Managed to be both the only ethnically Asian person in my year (for most of it) and the only American in the school. Her accent was super cool, always surprised people the first time they heard her speak.",0
Fuck wrong wit a bitch,1
Ik you're goated cause u can clutch anything and r my favorite Asian,0
"Either you are saying Hitler was a follower of Judaism, or the Jews caused their own genocide. Either way ... you're a fucking idiot!",1
"FYI to those who couldn't tell already, my Twitter is about black empowerment. Black women specifically. I rant and rave all hours of the day about my strengths and woes. You could mute me but honestly, you'd be missing out. 🤷🏽‍♀️",0
@user @user What a horrible woman...,0
man i love black chicks,0
"In case y'all forgot, last time yall had an opinion we told you to get fucked and we proceeded to kick your ass back in 1776. Y'all keep fuckin round it's bound to happen again with your fairy ass. Worry about takin your Syrian refugees we will worry about America URL",1
Says you pussyo say that around ends and all dem heads carrying will come knocking uno. If you went outside you wouldn't pipe up would u? Give address den call me a beta and I'll fucking chin you. Bring anyone you want they will all get murked bruv. You think you're all cool piping up online but in real life you're a fat cunt who sits on reddit all day. Fucking wasteman calling people beta when he won't send addres. Lad I am preeing you send me your address I would love to spark another pussy who pipes up. Anyway you're fucking wet fam go suck your fat mom pussy,1
She doesnt even have tits uno u could class her as a men URL,0
The existence of Israel is blasphemy,0
"A bright, common sense, reasonable, talented, and beautiful young black Conservative mother/woman. Exactly the kind of role model that our young women/girls greatly need. I'd vote for her in a heartbeat. I'm going to find her on different media's and support her, and I suggest that all of those who want to get our country back on the right track, do the same. God bless America.🇺🇸",0
"Beat it out of her, or throw her to the curb. No use for uppity niggers.",1
lol he got braids and he da new light skin lil wayne :D,0
"Swedes are always trying to steal stuff. First they stole meatballs from the Italians, then flat pack furniture from the gypsies. Now this.  /s",0
Tiny slut pinned down with her lil pussy open for that big black dick URL,1
Pro-Satan 'leftist' kills nine people in Ohio URL,0
Happy pride month here's an important message from these gays URL,0
shut the fuck up nig-,1
@user @user You are a racist. You don't think black women can make their own decisions. Abortion clinics are placed in cities for safety and support. Forced birthers are violent lunatics.,1
@user Nigga put my government and shit 😂😴,1
"Are you trying to make fun of this dude, you fag?",1
"It's pathetic how LGBTQ+ degenerates are claiming this as a victory and using it to push their nefarious agenda...instead of celebrating this brilliant man for his genius, they are all making it about how he was a homo. Nice.",0
"I'm biracial, African American mother, Eastern Slavic father, heterosexual, and movie and game ost's",0
"@user U a pussy u be acting like a bitch ""I'm tire"" pussy boy",1
"Out this bitch, fuck you and those niggas!",1
Wtf is wrong with people these days... And you fucking stupid people support this transgender fuck? No wonder i don't give a shit about people feelings.,1
Yeah there is no way he was black why would anyone think that,0
My daughter is constantly being mistaken!!! It's the worst!! She is ALL African American!!! this has to stop,0
Cannot believe they are willing to break the law of the land. These 4 woman need to understand it's a law to enter our country illegally.,0
Those titties look like they need to be sucked and fucked!,0
Down your slut throat,1
i allways wanted a german friend. i lived in berlin for a short while but never got to know any ethnic germans. i am facinated by your culture. i think people from germany are the most straight foward people as a collective,0
I'm currently balls deep in a sexy Russian girl that knew what she wanted...an American man with a nice cock. Your kids will all be dead by age 40 because Russia is a shithole third world disaster. You were probably molested by the Russian orthodox priests because they are all faggots like you and your father,1
Israel is not America you sell out. We don't even have clean water in this country. Who made you the Nazi police of what Americans can say. We don't like what you say so send Melania and her chain immigrant parents to go back because we don't want them here.💰💰💰💰💰💰💰💰💰💰,1
Doggomelon knows the evil that lurks in men's hearts.,0
Bitch with tits,0
"Only Fox News would give a White Nationalist like Laura Ingraham their own show. What a truly vile, hateful human being. I live in California and I'm proud of my Governor.",0
"@user Kaporal and you are a weak pathetic, emotional (like your mother) beta male",1
Fuck this homophobic piece of shit.,1
@user LOOOOL real asss bitch GAVE af bout a nigga,0
"okay but am i the only one who keep thinking that the tarzan song, ""you'll be in my heart"" by phil collins is such a gay rights themed song. URL",0
@user Abe chutiya... Matlb kuch bi bologe. Bhanggg khaa k aaye ho kya?? Did you know who is modi?? Father of Pakistan and grandfather of Bangladesh,0
@user @user I think you just like tweeting the word pussy. You must be 12. Does your mum know you are tweeting profanity? C*nt,0
You're a fucking pedo. Maybe that's because your not enough of a man to satisfy your wife you crusty ass hog.,0
"Last pride month I knew I was bi but wasn't ready to tell anyone, now I've told my best friends so I'm planning on going to pride with them!",0
Dumbass fucking bitch,1
"Is there something you need to get off your chest? Your post history suggests you are looking to fuck a 50yo married man who may or may not be a family friend and/or doctor. In any case, you sound like you need help",1
You look beautiful girl. I love your makeup. I'm also a transgender woman,0
"Wow. What a dog and pony show. Next to none of these ""graduates"" were paying for their educations in the first place. These schools are so subsidized not to mention all the grants and free rides for having melanin. Not to mention the curriculum in these schools is so watered down a 1.5 gpa high school sophomore would breeze through them. I bet 85% of these students couldn't even multiply fractions. Way to teach them personal responsibiltiy and how to pay their debts. What a joke.",0
thou shalt fuck they sisters and daughters,0
"Sometimes you have to be disobedient to best honor your family. See Mulan.  For just one example, any Methodist church I've walked into has been boldly welcoming to and accepting of LGBTQ people, just as Jesus was. I know Baptists wouldn't do this due to the ""disobedience"" factor.",0
"If your shitty government tries anything we will bomb you, and the US will too. You belong to us.",1
im gay what abt it,0
"Project more, fuckboy. I'll project my dick into your ass.  I am a bot.",1
@user Yes females are turning their vaginas and mutilating them into fake penises theres also Male genital mutilation as well..ppl turnin penises to vaginas ..,0
Cole the type of guy to get mad at a girl spitting on his d*ck because he's dry fasting,0
"Well, quit fucking her and we can be done with it",0
"Dear black people,  I love you. I truly love you",0
"Out of curiosity, what makes non-denominational churches different from other divisions of Protestantism?",0
@user @user #LMAO! You're weak snd worthless and just here to fellate me.,0
Black girls traveling is another dope aesthetic 🤞🏽🔥 URL,0
There are like 7 homophobic people left and they're all in the show.,1
"@user Disgusting language, baloney. Your lies about the four women were far more disgusting.",0
40% of trannies,1
FUCK YOU YOU RAGING IGNORANT CHAFED CHODE OF UNINFORMITY HE IS THREATENING TO TWIST YR SPINE TO PROVE HOW WEAK IT IS YOU BABYBACKED CAPSLOCK KEYLESS CUCKOLD FUCK YOU,1
"Oh this is the guy who stole from Wounded Warriors and blamed his wife? These people have no bottom. Well, Lyndsey Graham is a bottom",1
"They should deport the black niggas, they are the true crime on USA, the lazy bastards",1
"AUNZ | #Stigmabase — ... transgender community members,' said Chase Glenn, Executive Director of Alliance for Full… URL",0
this guy should have been raised by my mom she would teach him how to respect people lmao URL,0
@user Time to declare bjp a terrorist outfit by the UN  @user,0
Video games are for smelly faggots so how bout I just block you chump boy,1
GAY people are scientifically Mentally disturbed people...THE gay men act like women and the Lesbians act and dress like men..WTF,0
"Isreal support the trump I hope they fail I hope the Persians drive them *ALL* into the sea Drown you worthless devils, you refuse to stand, you refuse to fight... *COWARDS* drown...",1
These Minneapolis losers should just go back to the sharia 💩hole they came from. URL,1
"It's gonna be okay kid. I know you're having fun on summer break and you feel sad because you've got no friends and the girl you like told you to drink bleach and eat shit, but you'll grow into those big fat fucking bones of yours one day. Life's gonna be tough for you, but take it one day a time and try not to get too down on yourself.  Ease up on the retard bit. Everyone knows you never go full retard.",1
Bitches are so disgusting,1
The Talmud IS blasphemy of the Holy Spirit. Jesus said that was the only unforgivable sin.  He was talking about it because of this this end time because it will influence the whole world. Could the Talmud be a beast? Or a snake or something from revelation? I know those Talmud writers are descendants of those Jesus called seed of vipers.,0
"men are so fake to each other, sometimes more than girls lmfao",1
@user you're a worthless piece of shit. I hope someone beats yo ass in jail bitch,1
"We're here, we're queer, we're gonna know that you have to be good and kinky and then maybe you could just go home",0
"Lord Jerome better sit his ass down, 🤨I thought you died already Nigga. Get the fuck outta here 🤔you ain't Grand Puba anyway. I'm gonna need a bum ass nigga in one of my shows.I'll be reaching out shortly. #lecheminduroi #bransoncognac URL",1
So hot. I want my wife to suck some random guys off through a gloryhole.,1
