text,label
"You mean woman, as in a singular person dumb ass. Faggot? Wow straight from junior high now are you? Truly you can come up with something better than faggot... come on, try as hard as you had to to convert your lesbian sister back to dick",1
@user: This leftist Jew disguised as Greek is saying the Holy 'Quran is not real and that I said the bird flue was fake. THE BIRD FLU IS REAL AND WAS CREATED BY THE JEWS.,1
Kill trump and whites,1
Ive had several ex's and for the most part I wasnt comfortable with my sexuality yet and felt like I had to date guys but now im finally comfortable with who I am,0
STAY ON THESE NIGGA'S NECK FOLK,1
some random white woman approached us and said that we looked so happy and cute so she begged us to let her take a pic to capture the moment so.... mira que cute !! URL,0
I'm a 9 year old proud Asian American women!,0
"I'm literally going to be sick. Jesus Christâ€” humans are such fucking morons and they're not happy unless they're murdering or torturing each other over stupid shit like borders and religion. Fuck borders & fuck religion, too.",1
@user This nigga mad cause he ain't getting any. Who this guy? URL,1
"I genuinely wish that I had a dollar for every woman , Jew and Gay that has been beaten , killed and oppressed by your beloved and sacred Sharia Law. That way I could afford plane tickets to send every one of you Anti-American terrorists back to your sh*thole Countries. #MAGA URL",1
you bitches be real bitter & bothered over a nigga and it shows ðŸ˜­,0
"I hate when niggas say ""I don't like women calling me g""  We both from Chicago. Shut yo goof ass up g.",1
Look at this faggot.,1
@user Hoe suck my son dick and choke on it ðŸ˜™,1
"I'm a 40-something married trans woman with kids who is 3+ years into transition, 2 years full-time. I'm happy to chat with you!",0
"Not trying to argue or what but Catholicism is a christian denomination BY definition. They're a follower of Christ (whether a ""follower of christ"" has a different definition depending on your faith/belief), therefore they're christians. Being friends with Born Again Christians, it seems like the term ""Christian"" has also became synonymous to them, at least in the Philippines. I'm curious though, why/how it has became onto. And btw if you're wondering OP, I'm an atheist so you can expect a ""somehow"" objective perspective from me.",0
"@user bashir You are a everyday fucked American PIG , American Concentration camps, Americans are fucked stupid PIG PEOPLE inbred white trash",1
"It's pathetic how LGBTQ+ degenerates are claiming this as a victory and using it to push their nefarious agenda...instead of celebrating this brilliant man for his genius, they are all making it about how he was a homo. Nice.",0
This guy is a cunt but anyone who wishes rape on another person is just as fucking twisted as far as i'm concerned.,1
"#CelebrationsWithBloodDonation Today thousands of people from various states gathered to invest time towards their Spiritual growth, by attending the Holy Naamcharcha at @user Ashrams of Sirsa, Barnawa and Mumbai.",0
"@user ALL THESE KILLINGS ARE THE RESULT OF THE RHETORIC.OF HATE OF THE DUMB ""DONALD TRUMP"" HE IS SO HYPOCRITE SAYING THAT HE FEEL PAIN FOR THESE SENSELESS KILLINGS WHEN HE IS THE ONE IS KILLING KIDS ON THE BORDER AND TREAT PEOPLE LIKE ANIMALS....WAKE UP DUMB AMERICANS!!!!",0
"you and me both, this shit is full of faggots",1
"You (well, not *you* probably) also elected a president who is a massive homophobe. Sorry for brazil, crazy how one of the worlds largest gay pride parades and this much homophobia/transphobia can fit into one country.",0
Who here is Hispanic,0
Shan and obtaining those infants by cutting them out of pregnant mothers. Then laughing while tossing them back and forth. They looked at non-Japanese as sub-humans.,1
"we bust on bad boys niggas fucked for life. plus puffy tryna see me, weak hearts i rip, whitey ford forty and white, lethargic ass dickhead whoops wrong hit em up lol",1
"Well at least they said ""Raped"" instead of ""Forced herself upon"". But yeah I hope this woman goes to hell along with her satan's cock gurgling husband",1
"It's fine to be upset. Rejection and sexual frustration are upsetting, and you should be allowed to vent your frustrations in a constructive, supportive environment.  It is NOT fine to advocate, threaten, or condone rape. If you think women deserve to be raped because you haven't found someone willing to let you flail pathetically around on them for 43 seconds, then I think you deserve to cry alone, rotting in your semen encrusted underwear alone, until you die. Alone.",0
@user You go immigrate back to Europe or Africa. Take your grandparents too. Cause America is an Immigrant Country. The only True Americans are the Native Indians. Bye.,0
"Unfortunately, if they kill themselves they go to hell according to what the Bible says but i believe king James wrote that so idk if it's true or not but i wouldn't be brave enough to still im outraged at these people who claim to be Christians and hate that much on someone else beliefs or lack thereof",0
"You are seriously disgusting, you'd have to stay out of my sight while I fuck your friend or I might lose my hard on. She is gorgeous though, you two aren't even the same species, I just want to put my cock in her all day, I just want to lock you in a closet.",1
Dirty lesbo slut who our for father's would have been so ashamed of. All you fags move to your own island and see how many generations carry on. ðŸ¤£ðŸ¤£ðŸ¤£ðŸ¤£ðŸ¤£ðŸ¤©ðŸ¤£ðŸ¤©ðŸ¤©,1
"i hate a ""watch that bitch word"" ass nigga ðŸ˜‚ like shut yo serious ass up BITCH URL",1
Wow a racist in the comments. Assuming only white people are capable of following laws.,0
This woman doesn't even know her. Chris get these women under control. One at a time speak. Shut up you blond bimbo,0
"Banning Kuran & IS**M is the only way for a peaceful world What a disgrace this muhammad is, promising virgins for killing people, married his son's wife had sex with a 9 year old, had sex slaves. Do muslims need an IQ of 200 to understand muhammad was the worst man ever lived?",0
What a faggot.,0
I used to think that pedophiles should be put to death but now that i think about it this is mental sickness they belong in asylum away from society to be studied by science.,0
"you could beat a bitch ass, ignore a bitch, block a bitch, even pray for a bitch & these bitches still gon sub and stalk you all day lol shit blows me. hoes special frfr",1
Isnt She Pregnant? Just Wanted to Know if The Babies Are Okay,0
@user We should pull the nukes . Then watch them ask for them back.,1
You literally just typed in all caps. Lmao. You're either a child or you have some kind of social ineptitude. Take your pills. Bye incel.,0
It would be laughable if it wasn't so pathetic. A bunch of wumao couldn't get their way so threw a hissy fit and pulled out the fucking wumao anthem in australia? You gotta be fucking kidding.,1
"@user Shut ur Cocholster,or take the 1st cock out of ur mouth so we can hear u!!!ðŸ˜‚ðŸ˜‚ðŸ˜‚",0
Ugly ass terrorist,0
@user That's not true idiot self doesn't build nations. Fuck off your theories Satan befire I crush your testicles and blow torch your eyeballs as seen on tv. Then cut your head off and give it to Islam signed Allah,1
Thats why all jews are evil,1
I have an idea... just strip that racist fool of all his clothes and put him on desert island for a month and let's see how superior that moron feels then.,1
This nigger counts.,1
"Absolutely. And to any outsider they are a same sex couple. They will endure the same harassment as any same sex couple. My wife and I are in that boat. She's cis, we've been married since before I transitioned, and to those not aware that I'm trans, we look like a lesbian couple. And we are! I would have no issues with campaigning for marriage equality, and we have before.",0
"Nigerians number one problem isn't political leadership, but in particular how we choose our leaders. Read this article and you will see that Tribalism and where you come from is the first criteria before meritocracy. This has to change!  URL",0
You're fucking gay and no one cares about little gay faggots like you.,1
All the wrongfully newly elected Congress women and evil Nancy Pelosi prove to be a bunch of fruitless lacking morals overloaded estrogen driven bitches! All of them are USELESS to any society!,1
"amateur pawg tumblr , lesbian anal threesome , gay gangbang ? girls with big boobs ! URL",0
@user Stop Illegal Immigration and there will be no problem.,0
Ankit Sharma .....an arse licker for the White scums. Indiots just a cesspool of humanity with no balls or fortitudes to fetter themselves other than being balls carrier.,1
@user @user @user @user Trying to cop a feel. What a dog!,0
Asian women are so toxic. Just wait till they get their claws in you.,0
A weak delusional bitch can never get a reaction out of me bitch you not relevantâ—ï¸,0
Fuck those bitches who don't want to worship Satan with you.,0
"""Damn. She must've really had some mental health issues. Probably depression and anxiety. The system failed her."" ""See? Men are trash. He's so fucking selfish. I can't believe somebody would do some shit like this. Men are so fucked up."" URL",0
"""Ilhan said, uh, that, um, all blue eyed devils should, uh, be locked in a mosque basement and forced to pray five times a day using a taser until they submit to izlom.""",1
i only fuck the girls with alzheimer's in the care home so they can't remember the next morning,0
@user @user That's not why you need gay pride in the US. That's why you need it the world over. 99.999999% of straight US supports you and your right to be equal under lae. The rest of the world not always so accepting.,0
"That's a worldwide problem. First we elect man-hating feminists that bring us shit like this, then we get mad and the woman-hating far right rises to power, and the cycle just keeps going.",0
@user Send that brother f*cker back to her shithole country!!,1
Keep the shit out of your mouth nigguh,0
"Doctors should be trying to eradicate devolution, genetic defects, fagtards, incels, learning disbabiltiies, and unnatural unsustainable eternally devolving hellbound humanzee obamanations... all that do otherwise are committing crimes against nature, evolution and must be eradicated and charged and publicly executed for crimes against nature, evolution, and humanity.",1
"If you are an illegal alien, you SHOULD be afraid of getting deported.",0
Leftists are more likely to turn a blind eye to kids like Desmond who has $1s stuffed in his thong by gay men while he's performing. Hell yeah.,1
i already knew monsta x as a whole supported lgbt but hearing it outright from wonho and jooheon is amazing and really just cements it more. happy pride month to us fuckers time to fullfill the gay agenda,0
"We grew up watching the white version of the little mermaid but now little black girls get to grow up seeing ""themselves"" in this new retake on her, which I think is important! They've made black Belle, Cinderella so why can't they make Ariel Black",0
fat bitches really are ugly,1
You can start by cleaning room you disgusting cunt. Then you can get down on your knees and stuck me off like the nasty slut you are.,1
Our song must have been the worst thing we ever did to the jews...,0
"This is an amazing, beautiful and inspiring video. I wish I had the courage to do something like this and actually come out as bisexual. I'm so proud of you for being able to do this. No matter what anyone else thinks about you, Eugene, just remember that you are an amazing, inspiring, courageous, and beautiful person. Thank you so much for all you have done to inspire me and others.",0
"@user I don't care if you're ""coloured"" or ""black"" Lammy Son. We all have the same rights and privileges in this nation. What I detest about you is that you use your race/colour as a weapon and also an excuse to incite racism and racial hatred. You're the problem. Idiot. Get real.",0
"@user #Homophobe #scambag!  Sexual orientation is not a sin! It took so little time for you, ugly hearted bozos, to show up! #GetLost",0
"c [Elijah:] 'Lord, they have killed Your prophets and torn down Your altars. I am the only one left, and they are trying to take my life!' Romans 11:3 (3 of 5 for Jun 5) 4 Days with Paul, Part 1. Today's verses are Paul's assurances that God has not forsaken Israel.",0
I Ain't Got Time For No Bitch At All ðŸ’¯,1
"How do you feel about the middle eastern Christians who largely supported Sadam Hussein's government and Assad in Syria... they didnt do it because these were good and holy men, they weren't... but they realized the threats to Christianity came from elsewhere. Doesn't the same logic apply? And notice, we're talking about dictators who are/were far far worse than president Trump...",0
"@user You guys know I of course I love and accept everyone in the lgbtq community! And also, I LOVE THE CRANESðŸ™ŒðŸ¼â¤ï¸ thanks",0
@user @user Bunch of anti-American bitch dykes!,1
I hate bitches that are mean for no reason.,1
"WTF is wrong people, here is what's wrong people coming into another country and taking it over. This is what the Mullah allow, this is the Hezbollah model. When will the West wake up to what Iran is doing #Ireq @user @user @user @user @user @user @user URL",0
@user @user It's not totally incomprehensible that some/ most of your nation is disillusioned since the beginning. Your entire country is under our debt that we gave you post partition to survive. Does Islam have any concept of gratitude ? Ungrateful morons.,0
Can we deport this loser to Syria. URL,0
Ari Aster is proof we gotta start giving these disturbed white boys A24 deals instead of guns,1
Eid is basically met gala but for muslims: URL,0
Stop your bloody NRA before talking about migrants from the south you stinky whitey pale looking ugly people from cunning fox channel...,1
"Donald Trump is playing a very dangerous game with this country so divided,with his ability to say what the average white person is saying behind closed doors,this type of language brings ignorance and hatred to non whites and it's growing stronger by the day and unless this man is stopped I'm afraid violence towards one another will be so bad that the United States will pray for forgiveness for letting him destroy the values that we truly stand for.ðŸ™ðŸ»",0
"USA? Women are still fighting... Why? Because the the power-mongers continue to shout, ""M-E-N! M-E-N! M-E-N!"" like the crowd was shouting ""USA"". This team played with ""USA"" on their uniforms, but ""Nike"" and others were there too. We will NEVER reach a better world, a more humane humanity, until we STOP paying so much attention to borders and excuses to separate people.",0
I found out late last year that my grandma and great grandma were Jewish but I was raised Baptist. I'm exploring Judaism now but I'm nervous about talking to a Rabbi and am equally as afraid that I won't be accepted. Hope this doesn't sound bizarre but I feel a certain calling to Judaism but I don't know why yet.,0
"@user @user Rot in hell, mother of terror, may peace never come to you.  Burn her body and post videos you moron indian nation",1
"@user @user @user @user Sis don't do the both of us like that, we have same supplier ðŸ˜‚",0
Niggas be big single on twitter but let a bitch text another nigga,1
Fucking terrorists,0
"You are the fucking problem. What is wrong with standing up for your country? Go somewhere else and you will find out real quick how good you have it here. So for now go sit on your fat ass, and type on your phone somewhere in an air conditioned room. You have no clue. Fucking loser.",0
This child is causing white genocude and deserves tk be lynched,1
About fucking time gay hating dipshits!,1
Lmaoo all the pakis in Canada are doing it and are posting fake crap on their IG stories,0
Piss off with your homophobia,0
In America prison rapes this guy,0
"Prime example of why otakus and weebs everywhere need to be put on a watch list. Deranged, introverted, autistic perverts who do nothing but complain about anime and masturbate to childrens cartoons.",1
"It's always Pride Month at my house Pan, Rainbow and Trans flag always there to greet you URL",0
Whatz up naggers,1
Can't remember last time a women did some Romantic shiet for me... y'all reall trash yo,1
"Nah. She should be exterminated along with half the ""people"" in this video.",1
@user @user @user For every man that continues to want to exert control over a woman's body & their right to a safe and legal abortion i'd like to have an Australian rules football player kick them right in the nuts. Then they'd have to wait 72 hours to apply ice & see a doctor.  #StopTheBans,0
They are..... Freaking sluts and baby murdering slut fuckers,1
Trump Please Send All Non Whites Back. Keep America Great.,1
This is brought to you by the Catholic church.,0
how do y'all let these men get you that upset anymore lmaoo GHETTO,0
i bet you're a neckbeard mate no u right back cunt,1
Bunch Of Slack-Jawed Faggots Around Here! This Stuff Will Make You a Goddamn Sexual Tyrannosaurs! Just like Me!,1
"Italy. Here is the integration of ""diverse"" youth. The program goes 100% well. Multiculturalism works. UN can be proud of its achievements. WÅ‚ochy. Oto integracja ""rÃ³Å¼norodnej"" mÅ‚odzieÅ¼y. Program udaje siÄ™ w 100%. Multikulturalizm dziaÅ‚a. ONZ moÅ¼e byÄ‡ dumna ze swoich osiÄ…gniÄ™Ä‡. URL",0
"Well you didn't expect us to wear condoms did you, hands and cocks all over you, touching, cumming treating you like a cumrag, one after the other, hard fat cocks all around of you, all random, and maybe we should film it too for the good guys who couldn't get to fuck you. so everyone here can see how you take us ALL multitude times, I for one won't be happy for one cum in you, maybe get your mouth in the action too, I bet you suck good.",0
@user @user The Real America gives zero f*cks about you and your racist Husband,1
Stfu stupid ass bitch,0
"@user @user @user What about the ""believers""? Are they going to let this happen?  Is the insult targeted at only one section of believers or all of them? Are other sections going to watch this abuse quietly like they have for over 50 years? Will they blame the politicians or take responsibility?",0
"You murdered God's son Jesus, you'll kill us all if you had the chance Zionist.",0
Old papaw says it put the Jews at Bay so they stopped making virgin sacrifices to Satan,1
making a meme of @user every day until he rt's or replies to this: day 183 awsten orders a lgbt w/o the blt URL,1
Gazans on Monday faced a first day of Ramadan overshadowed by funerals and the grim task of pulling bodies from collapsed buildings. #palestine #Ù†Ø­Ùˆ_Ø§Ù„Ù‚Ø¯Ø³,0
"Yeah I fucked her, so what?",1
She is a disgusting subhuman.,1
"I bet she got round to every guy back in the day, and would enjoy making you feel humiliated, by making you the only guy she has not whored herself too.",1
"I would support taco gangs like MS-13 if they focus all their attention on sadistically slaughtering crackerkikes and their whole tribes like how they do cartel killings, skinning them and taking their cumskin faces off, and taking their joints apart. Crackerkikes deserve nothing less of a fate. Is there any way to get taco-monkies to do this shit to whiteboys and jews?",1
"Kevin spacey is a Dirty ass gay.. Sick as fuck.. Psychotic gay boy,.. I would chop his gay dick and stick it right up his mouth and choke him till he is dead... You'll fucking gay boy should burn In hell.. Sick fuck",1
Paki guy showing the energy with which he gonna fuck you if he ever met you. Then he cums a fountain. URL,1
"Unless they were raised in an actual serial killer-type abusive environment, people who publicly badmouth their parents are reprehensible faggots. His dad is some kind of blue collar dude that's still working as far as I know and this fat shit throws him under the bus to get good boy points on some stupid social media platform.",1
This already looks gay,0
@user @user #LMAO! You're weak snd worthless and just here to fellate me.,0
"Dear black people,  I love you. I truly love you",0
That take them to somewhere in the mountains of China to teach them the pain of real deprivation... No tendies no vidya and the lolis will shoot you,1
"@user I 100% agree with that and it's true. I only like to point out to people who are in disbelief that women have no power yet in this day and age and especially with this, they are the ones making the decisions. Only thing left is to have a Madam President.",0
oh fuck the amount of gay people on earth is rising,0
*receives viagra and can only think of pranks* Sounds to me like this person doesn't have sex.,0
A Rare Pic Of The Only 4 Idiots On Earth Who Think Iran Can Be Trusted ... URL,0
Why are Indians such fucking dirtbags?,1
Yeah fuck these white people this land if for the Natives and the Jewish people after we drive the whites out the native people can live safely next to New Israel. We shall stand strong my Fellow Americans.,1
"Sure. I'm an ""ace"" but cis- Identifying male. My qualifier is my father. I was the only 20 something male in a group of 40 to 60buear old women. Some of the ladies were even threatened by me being in the room as they'd suffered violence at the hands of their husbands and another male, any male, in proximity was a trigger. Luckily I had a kickarse sponsor who built that bridge. She had the inspired thought that being as the meeting room was colocated with a Catholic Church she'd invite the priest in to visit every couple of weeks.",0
When you see these morons that are calling themselves men... makes me feel ashamed. Spoilt metrosexuals that are happy attracting champaign flies. Imagine these fuckers having kids and multiplying like viruses. My friend your IQ is equal with your shoe size. Don't act macho!,0
"Fuck you and your America. I am a Texan, bitch. I come from the greatest land on earth. I don't care what color you are if you line up with this POS you are a POS too. Fucking miscreant.",1
That shit played off. Fucking fags,1
Islam is a cruel hateful violent religion. It's eradication would make the world safe.,1
Navajo Census 2020 Complete Count Commission Starts Strategizing to Ensure Every Navajo Citizen is Counted URL URL,0
"""Well that pisses me off, Butters! Its fucking gay!""",0
"A quick, powerful story I will never, ever forget about #ToniMorrison: In college I befriended a fellow student I'll call James. James was Black but had been adopted by a white family and raised in an all white community. I was one of his 1st black friends. At 20.",0
If you gotta press a nigga to do simple shit like seeing you he obviously don't like u lol,1
"If you aren't pleasing a daddy, you should be thinking about being feminine. Talk to other sissies about hair and make up, chastity cages, sucking cock, etc.",0
Imagine being played by a nigga name Keithtrick.... URL,1
the hardcore christians looked like retards going on about the end of the world and you look just as dumb.,1
Lmao it's not just watch adam ruins everything take on the myth of alpha males,0
man that villain dont look like a fukin villain at all..he looks like a dam latino good guy....wtf!!!,0
Glad to see bitch still has a use. Submissiveness doesn't die with age.,1
Islam is a cancer that needs to be eradicated,1
"Stop defending pedophiles, faggot.",1
"We don't hate Russians more than Germans. To Germans, Poles were subhuman. Russians didn't do to us anything they hadn't done to their own people. Germans razed 85 percent of Warsaw to the ground.",0
"this hot puta with mouth watering jugs bobs back and forth on dicks, choking and gag each one on the way #latinaabuse #facefucking URL",0
"Chicks who basically get fame and money simply through their attractiveness. They are streamers or YouTubers who literally have no appeal other than the fact they are hot. Might as well go the whole hog, no?",0
ðŸ’¯ I never worried about this tho cause niggas will walk around with 70 bodies and be mad that you got 10 of them ðŸ˜‚ URL,1
"Fun fact: u/tunsku openly hates black people, LGBT people, women, muslims, jews.",0
Wanna fight faggot?,1
"The other day I read an article talking about a Cuban lady, who's step father was Chinese/Cantonese. She grew up being culturally influenced by her step father, and so she could sing those traditional Cantonese operas.  â€‹ Someone commented ""it's culture that defines a person, not the race or ethnicity."" In your case, you are just an Asian girl actually, but a western face.",0
"Segregation isn't the issue. The issue is that fewer POC go to college, and this would fix that issue",0
What fukn retards,1
"She probably dwarfed that tiny dick of yours eh? It's ok bud, look for a more petite chick, those little hands will make you look massive ðŸ™ƒ",1
Stupid fucking big ass slut needs to be raped,1
Soon you're going to be fighting countries whose agrarian economies or fishery economies have collapsed that have civil war and generate 10s of millions of refugees and push strong bullheaded authoritarian leaders to the forefront,0
This bitch is so stupid she even looks stupid like you can tell it from her face that she's brain dead,1
"almost literally ""is the Pope Catholic"" territory",0
@user @user Islam is to blame & a huge number of Muslims who are the enemy of this country. Had they not been let in we would not be talking about a woman who is complicit in mass murder. If she is to go anywhere it is the Hague with her husband. Any lawyer defending IS should be disbarred.,1
