text,label
Homophobes acting like homosexuality is inherently sexual & inappropriate is batshit when you consider that heteros are so stupid horny they use horniness to sell shit like deodorant & food. Straight people out there only willing to not smell like shit if it means they get pussy,0
Give Visas a purpose for once,0
"Pretty soon the USA will be overrun by gangs, shitbags like the cunt in this story, junkies, and just plain assholes.",1
Probably because its stupid to constantly be thinking of women in a sexual way. Get a hobby mate.,0
I'm tired of women sliding in my DMs just to waste my time. If you not about it don't hit me up,0
FUK ASAP - he don't believe in black activists,1
Nigga is wack asf straight trash,1
bitch ass hoe ass slut ass plump ass corny ass bum ass cur ass chum ass shit ass dumb ass whore ass quirky ass silly ass unfunny ass no rights ass ziggy ass pimple ass slump ass  dum dum.,0
Sounds to me like your problem is mostly just with white people when one cuts through the drug angle.,0
"@user Schneider He was obviously Trolling Omar without having to single her out. I'm pretty sure Trump knows that the other three were born in the USA. And what is so controversial about telling Omar to go back to the ""Crime infested place"" She came from? Somalia is a failed country, everyone knows that. Omar constantly lectures us about white nationalism, and how xenophobic the USA is. She complains constantly while collecting fat checks from the US government. If she really hates it here, then maybe she can go back to her home country. Maybe she'll finally be happy over there",0
Not a greentext. Eat my downvote you faggot ass bitch.,1
Nuke the middle East PLEASE,1
Diaper head,1
Fuck the Jews amirite? At least he tried to make Europe better. What have you done?,1
"But did she give the pussy up though? Yup. It doesn't matter to these people if she was raped or not, a dick is a dick and grounds for breakup.",0
@user i will shoot you in the pussy,1
Painkiller Jones shut up bitch!!!! Before those Muslims you're talking about find your ass and slice that throat of yours!!!  Faggot!,1
"Not all of us, some are just refugee moderates.",0
one of y'all rapping ass niggas need to put me in one y'all videos but Ian finna be dancing I'm trynna hold the glock & flash money & throw up gang signs !!!,0
OP you're a faggot,1
@user @user Don't ever hold back.. Ali dayum. These third world people think they can come in and control us and tell us what's best for us. That's why Canadians come here to get operations free healthcare has waiting lines and death panels.,1
Hos tryna get with the rarted bois,0
"Honestly that makes perfect sense and I don't blame you. I wish there was a stronger LGBT+ community but I'm in the Bible Belt :( I'm not LGBT+ tho, just an ally!",0
girl if you don't go suck some dick lol,0
"You really have to admire the restraint here. Generally if some lunatic is shouting ""nazi scum"" in your face, you put them in hospital. URL",0
which lucky white cuck is gonna buy a video of me lotioning my feet agonizingly slow ;)  #findom #footfetish #footworship,0
Dude same I didn't even know being bi was a thing. Life has made so much more sense ever since lol,0
"@user Guzman If omar returned to somalia she could help they need it.plus she can tear their constition up and rewrote it how she likes. Dont you get sick of hearimg these woman complain ,bitch and cry about centurys old ways our system works ? only in america can refugees be able to sit so high in gov.",1
Find A Girl To fuck like this at URL URL,0
They are history and were not crushed but like all civilizations they came and went but not before making huge contributions to our modern world. Rome was gradually eroded from inside by Christianity and we all know what they think about fags.,1
"@user @user You look so tough having #US on your side, what r u gonna do 4 yrs from now when #China is number1 & #US power starts to decline exponentially?! The same happened with #UK in late 1930s when #Zionists turned to US, I doubt that China has the same sympathy as US evangelists had!",0
Ugh these faggots,1
It's your duty to follow the laws of the land say the Lord himself. Bottom line if you are not legal to be in the United States then simply you are not allowed here period the end of story. Now get the fuck out and build your own country just like us Americans have done. And yes allot of lives will be lost when you do just like Americans had to do so get off the band wagon and fight your own governments and make your country a better place. There you have it.,0
Migrants Worker Alliance for change should be barred from Canada. They want Canadian jobs to be replaced by foreigner students. All the liberals congregating to have Canadian jobs replaced by foreigner nationals. BAN THEM!,0
99 Minions who HATE Women!,0
I hope that sweet little baby girl in the homophobes lap. Grows up to be a raging lesbian to teach her parents the things they should've taught her.,1
Her cunt looks tight and appealing. You've taken good care of your property. I could use some pointers. Do you primarily fuck her ass and save her cunt for special occasions? Is she allowed to play with her cunt at all?,0
Bombs the shit out of underserving countries... and mass shootings.,0
"aww my dumb little whore just couldn't help it huh? had to cum knowing it would make me mad? had to touch yourself in the first place knowing it would make me mad? i hope it was worth it, slut, because now you're gonna cum for me over and over again until you can't even speak.",0
Wtf is with all this gay shit already ? FUCK ALL THOS GAY SHIT,1
@user nigger shut up,1
"@user @user @user Yess same guy saved many jewish lifes from nazi germany. You guys are so braindead, pathetic and delusional",1
"Black Americans are individuals. We think and feel like our very different selves. We are not monolithic. Not tryin to insult, but your statement make you seem like a person who is very ignorant about other races of ppl. White ppl are different from one to the next, because they're individuals with their own individual minds. Let you in on a secret, blk ppl are exactly the same.",0
"@user You're an Anti-Semitic Anti-American #ShariaLawSupremacist #Totalitarian sporting the Largest Patriarchal Misogynist Plague on Earth w/a Rabid intent to Kill all""Infidels""=Anyone who won't be their/your Slave! Your #Taqiyya is transparent & also defines you as a Repugnant Liar!",1
"""Won't someone think of the German citizens who were killed and driven from their homes""",0
"@user @user And you are litterally down on your knees, begging for a chance to oppress the people of Ladakh again.",0
50% of comments from India. Tennis so popular in India??? Than why no good tennis players???,0
Ain't a lick of nigger in that baby. URL,1
"Time to quarantine Africa, before liberals import Ebola into a neighborhood near you.",0
"#PrideMonth ALLY CHALLENGE: Until Jun 30th, whenever you see a company selling rainbow merchandise, send them a tweet asking them if their insurance plans cover services for transgender people (INCLUDING gender reassignment/confirmation surgery.) Will you commit to that for us? URL",0
You're nose is turning brown from how much you're up his ass LMFAOOOO fucking clown ass nigga,1
Man If y'all don't shut y'all Bitch asses up gotdamn URL,1
"Obama deported more illegals than any president. Illegals should vote republican. The are conservative christians. But most republicans are racist fat old men with no education and worship a bible. I love trump, i just cant stand hateful republicans. They should be sent to assad for gas treatment and replace them with real christians from latin america.",0
Kya khaak champion h dono mei se ek bhi team ENGLAND aur NEW ZEALAND dono hi 3-3 match haar rakhi ye bhi koi champion hota h kya.... Real deserving champions were either INDIA or AUSTRALIA,0
crackhead ass stank ass fucking bubble headed ass bitch URL,0
What a prize bitch she is feck off this is our country and only thing muslims will teach anyone is how to kill,1
@user Bruh she aint real,0
This clown is a bonifide bigot and a white supremacists mentality white trash that's been understand by most black people trump is wasted piece of shit he stereotyped her hopefully this his only term geesh this fool can't given even diss right without being racist and yeah just like the reporter said come on man bit how many times have we've said that smdh I pray ðŸ™ðŸ¾ðŸ™ðŸ¾ðŸ™ðŸ¾,1
"2 Jihadis of ISJK sent to hell in Shopian by 1 RR, SOG and CRPF",0
"> On the one hand, the black cop needs a paycheck. If he goes against the other cop, he'll be permanently branded as disloyal to the force. He needs to get a different job then. Nazi soldiers needed a paycheck too and that why they had no problem committing genocide. Fuck them and fuck the police gang",1
"Im may regret this but why is the Citizenship question a bad thing?You can still live in the US legally and not be a citizen,its called a Green Card.",0
"These women graduated from a military academy with a long history of fostering brilliant minds. They'll be fine, now go back to playing your xbox in your dirty underwear.",0
"You know it's funny how these four Congress women aren't being held accountable for their stupidity remarks. Here's how they work for the dummies that put them in office , from what these women say it's makes me believe that they are terrorist",0
"Married bisexual here: two kids <12. If it helps to have someone to chat with, hit me up! I mean that platonically. ;)",0
"I agree with the poster who recommended Ash Hardell, Their videos helped me a lot when I started to realize I was trans back in January. I still feel weird saying I'm trans and haven't come out yet. I feel like trans masc describes me best for now.  I understand the urge to immediately find the words to match how you identify, but if you're only just starting to figure it out take your time, there's no rush to pic a label and live with it forever.",0
"+B0rder55 You religious dumbasses deserve everything that happens. You're the only ones stirring the pot. Fuc@ you morons. Xtian, Jew, Muslim, Hindu... You're all retarded.",1
"Was probably ""vacationing"" with that Kartrashian hoe",0
This little anal angel loves her arse fucked nice & hard!! #arse #anal #buttfucked #analwhore #dirtywhore #cunt #gaped #sharedwife #slutwife #analcreampie #owned #cumslut #cumdump URL,1
Fuck this sjw cunt. She is trying to destroy America with her low iq inbred thought process.,1
"Fuck that, I hope all you fuck niggas dieðŸ˜´",1
Ajith is only Tamil celebrity who have not bring any kind of dirty politics in his movies so far.. My respects for him grows in this sense.,0
"She was pretty fucking dumb. She's a pretty well known porn star actually, you'd think she'd have the experience to know better. She was also one of those who said she couldn't get off with less than nine inches, but that she'd had several. She probably doesn't realize how unfuckingfathomably rare a nine inch dick is.",0
I forgot women who go for men want them to act like lesbians and sissies by only using their hands and tongue to pleasure them.,0
This is the example of generosity stemming from our great African American heritage. Other multimillonaires join the crowd in helping African American students who seek to make positive contributions to our society.ðŸ˜„,0
Iran will get ass kicked in ww3,0
sIkHs R fReE iN iNdIa. Do you mean those drunk liberal hippies who drink themselves to sleep every night or these poor villagers who hold on to their sikhi despite all the hardships they face. This happened in Punjab just imagine where we are majority what will happen when we r not majority? Just imagine a non Muslim doing soemthing like this in a Muslim country you will get your answer this is exactly what happens when you raise a generation of apathetic degenerates who take the sacrifices of their ancestors for a joke.,1
"Well maybe instead of just eating our Kebabs, they should take another page out of brown folks' book and WASH THEIR ASSES! URL",0
"""Useless piece of gay shit"" would match better.",1
"Granted. Everyone who says it or does it even as a joke by calling someone ""gay"" is included. This leads to most of Earths population slowly becoming only LGBTQ+ and so humanity slowly dies out due to no repopulating.",1
That's pretty gay of them.,0
"Whoever the bitch or nigga is with my dick in their mouth, today after 2:20pm I'll be free so pull up on me. Thanks in advance.",1
"Nepal and the moronic visitors make no difference, this lunacy adventures need to be shut the he'll down period.",0
"60 million humans have died from abortion, approx 30 million,of them female.",0
"#Breaking: IDF shoots, kills armed Hamas operative approaching Gaza border. URL via @user",0
Lol this is the funniest conspiracy theory on the right by far. Homosex is caused by nature to curb overpopulation. People are born gay because evolution is more nuanced than you can apparently imagine.,0
Time to hunt down civilians who have fell for Indian money and do propaganda against Pakistan. It's dead easy to find them... Set examples  #NoMercyForTraitors,1
"Welcome. Your member card is in the post! In all seriousness, it's difficult at first with accepting yourself and the fear of others possibly not accepting you, but it usually works out well in the end. Get yourself out on that gay scene, you'll be snapped up in no time ðŸ˜œ.",0
I swear to god if this nigga fucked that raggedy ass white bitch. He will be homeless,1
I could tell by this video that her IQ is lower than the one of a rusty nail,0
@user OMG. Every other white person in OK thinks they're part Cherokee. My own family has some made up story about one of my great-frans being Choctaw. She made the mistake of listening to the family mythology that her Meemaw or whoever told her. I wish they'd let it go.,0
"@user @user @user @user How sad it must be for someone's entire life to be controlled by their dick. Lock this disgusting POS up for life or better yet, drop him and his dick into a wood chipper (no pun intended)",1
I bet your pussy is pink and ur on ur period,0
A bunch of horny porn stars in a gay sex club? ðŸ”¥ðŸ”¥ðŸ”¥ This can end only one way â€” a big orgy of bareback fucking. Pump those asses full of cum! ðŸ†ðŸ’¦ðŸ’¦ðŸ’¦ @user @user @user @user URL,1
"U moron, till date there's not a thing invented by a #Peaceful Muslim. Get that in ur head. Plagiarism n copy paste is what ur inbred cult knows. Live with it.",1
"king shit, not a lot of you niggas can do this URL",1
Found the fag.,1
"""Hate Crimes"" were the penises hateful also?! Fuck off with this bull shit.",0
Wah wah...I'm a beta cuck incel and I don't like the mean girls winning championships. Where's my tiki torch I want to go shoot up a school. Please no one look at my tiny penis...my YouTube name is Captain America because I'm secretly super gay for men in spandex.,0
yeah by little dicked honky assholes shooting up walmarts and other public places.,1
MCWDD you haven't missed much... Just a pack of hyenas cackling about how every white Aussie is wacist.... Except for themselves.... And then they all pat themselves on the back about how virtuous they all are...,1
Her insecure ass doesn't need to get married. This is sickening. URL,1
I'll smack the shit out of one these niggas URL,1
"Okay, so what's wrong with the question? If I go to Mexico and someone asks if I am a Mexican citizen I tell them no.",0
Amazing well I hope you share sissys story and how well you accept sissy to inspire the scared sissyz and the reluctant admirers to come out and stand/kneel strong in pride of sissy sexuality and acceptance to all.,1
No one likes a loose pussy. Keep them locked up!,1
"Awesome....but even better, imagine if people who live in and create this mess would have enough respect and dignity to clean it up themselves. Black America, the eyes of the world sees us and we look pathetic. All these years have come and gone an we still can't get it together. URL",0
Tell me how it's not white christian fascism.,1
register that niggas as a super villain,1
Stop calling a nigga broke cause he doesn't wanna pay for your nails & hair after only knowning a nigga for a couple of weeks. And the fact that you have to ask if a sign sis,1
Keep killing each other you warmongering nation.,0
A bitch gone suck this dick,0
"Democrats, LOL NM Gov. Pulled Nationall Guard from Border, Now She's Begging for Help To Deal with Illegals  URL",0
Yeah was kinda skeptical when they gave out that many details on pro-life incidents and then just a single number for isis / radical muslim / whatever terrorist attacks. His point still stands tho yes,0
"@user @user @user @user Blah blah blah blah blah. The name translates to ""assault rifle"", genius. Also, Ben Shapiro is absolutely a white nationalist who has absolutely inspired terrorists.",1
"What is my chances, percent wise, that i would be a victim of a mass shooting in the US by a white nationalist? I'm trying not to down play this shit but come on...",1
ICE should raid his Resorts and hotels for undocumented immigrants... he is such a hypocrite.,0
YOUR SO DUMBFOUNDED JUST STOP MAKING YOUR GAY VIDs NOBODY LIKES YOU AND YOUR VOICE BURN IN HELL BASTER,1
"I always regret to be a yoruba man very useless tribe that cares not about the future they have changed the story, is she killed by armed robbers, unknown men or fulani herdsman.",0
"Stop being a fucking cuck. ""Fuck Chechnya"" justifies killing 1/5 of the population? Fuck Russia, filthy warmongering scum.",1
"@user so discrimination is not tolerated in Texas, huh?",0
Your mother sucks cocks in hell ajfnfjfbgkfvdkfb,0
"That book also says to not grow different crops next to each other, or to wear multiple types of fabric at the same time, or to eat shellfish. I'm sure you strictly adhere to those tenets too, right? LOL If your entire identity is wrapped up in that book so much that your enjoyment of a fictional character in a game is diminished because they're not heterosexual, maybe just keep that to yourself next time. Because all it does is make people look at you like you're close-minded at best, and a straight moronic bigot at worst.",0
Probably the same guys who take their kids to daddy/daughter chastity balls and give their daughters those creepy fucking chastity rings.,0
"I think we should let Islam overtake the West and these stupid fat purple haired feminazi bitches can get a nice taste of some real oppression, and they will long for the days of when they complained about white men and Christianity.",1
I'd overdose on plan B before I let one of you dysfunctional ass dudes impregnate my womb. URL,1
This girl deserves to rot in a jail cell,0
@user Yous a stupid bitch bitch,0
Y'all give these niggas too many chances to embarrass y'all over & over againðŸ˜©ðŸ’€,1
[rare video of Peter Buttigieg doing outreach work with African-American primary voters](URL,0
@user Aran lol. I was agreeing with you. Just being black seems to be all the credentials one needs anymore.  Someone should tell them it doesn't work.,0
"There's a reason why African Men fuck my wife bareback while I watch locked in my 1.75 inch chastity cage. African Men are superior to white boys like me in every way, it's why I practically beg them to breed my wife URL",1
"In Islam, both men and woman are given rights which are exclusively specific to their gender. This means there is equity between both genders, but not equality. That being said, Islam is a religion which still empowers women and doesn't discriminate against them.",0
Should've gotten Kaepernick or C1N,0
God isn't real. And if you think he is are you are Christian; you amaze me at how much of a fucked up human being you can be,0
Naomi Campbell is a cum guzzling whooore,1
Prime Minister Modi pays tribute to #SheilaDikshit at her residence in Delhi URL #RIPSheilaDikshit URL,0
"I just called you retarded, you retard. You can't come up with your own insults? It's like you were born out of your mom's ass yesterday and just figured out how to type on the internet today. Get good, fuckwit.  Do you even understand that being in the ""upper echelon of non-functioning brains"" means I'm the most intelligent out of the group you're trying to place me with? Well guess what? You're in the *lower* echelon of non-functioning brains. Idiot.  Finally it's not nice to encourage suicide. So please slit your wrists and drown in your own blood, cunt.",1
all gays = shotgun. fuck off too all,1
It's called licking boots you dumb incel bitch.,0
"@user @user Or: Us, the gays  That's the proper way to address also to me queer ain't a slur",0
@user I would be killed at home. Idiot nigga,1
@user @user Faggots,1
Doggomelon knows the evil that lurks in men's hearts.,0
"""nice shot retard""  So much for making that 2grand back lmao",1
HE'S A FUCKING PSYCHOTIC INCEL WHO DESERVES TO FUCKING PERISH,0
"""Only the emancipation of African Women could save us from the blunderings & corruption of our menfolk"" - Constant Gardener  Laughs in Ann Waiguru, Laughs in Nyokafi, Laughs in Mama Ivory!  Anyway Le Carre meant well.",0
lol fuck off autist soyboy,1
"How is it okay in 2019 to criticize a black, woman, refugee, democrat, congressmember? Its like the republicans checked each box this time and everybody is just going along with it. #bluewave",0
She honestly seems a little retarted.,0
"I'd be too tired at the end of the day to do anything too involved and elaborate. I would See her in that position and walk right up to her, spit on her butthole to use as lube. Then I would wrap my belt around her neck and cinch it super tight sister choking her into the same time fucking her in the shit pipe with with my dick",1
niggas will tslk shit get beat and then talk to the ops fags,1
Woowwwwww....luke islam i like its im from indonesia its a masing.,0
"I wished they sterilized you halfwits. Go back to mommy kiddo. You've had your fun for the day, being an edgy little meme scavenger",1
+HandyMan101 name all the countries israel has invaded since 1948?,0
@user We fucking them niggas up just for that ðŸ˜‚ðŸ˜‚ðŸ˜‚ðŸ˜‚,1
"@user @user Jehadi Judy, the israeli soldiers were rescuing the child & taking him back to family. But women pulled the child back & gagged on him. The hamas hijabi women might have kidnapped the child with the motive of training him to become suicide bomber & bomb a church or synagogue",0
"Pathetic, it's time we start erasing people like this from our gene pool.",1
That inner hoe hit different when you in Miami. URL,1
"I mean he definitely is a dude that can speak without sounding like an absolute troglodyte. He's well spoken and respectable until someone starts talking trash and then it sort of goes downhill. With the weird and kek worthy comments such as ""He probably got all the girls in high school"".",0
Nikki Cross looks like someone that doesn't brush their teeth properly and had a shower.,0
I love little 18 yo black girls. Yes I would watch you,0
"3. Perhaps India and Pakistan should think more about encouraging female labor force participation? Religion and culture, and views about women's role in society, are likely relevant? URL",0
#SALAM Newsletter #212: URL #Washington and #London should stop enabling executions of dissidents in #Bahrain; Three men executed by firing squad in Bahrain [further information].,0
"In case y'all forgot, last time yall had an opinion we told you to get fucked and we proceeded to kick your ass back in 1776. Y'all keep fuckin round it's bound to happen again with your fairy ass. Worry about takin your Syrian refugees we will worry about America URL",1
Going to church as an atheist Mormon in a loveless marriage. Leaving both was the best thing that I did.,0
A girl with a trini accent my weakness,1
What up retard,1
Enjoy jail you stupid fucking cunts.  Fuck your tears and your life.  Rot in jail. Pieces of shit URL,0
Imagine having a dick as small as mrdinglepants and trying to talk shit about anyone else's junk.,1
Self explanatory. I get on the gay dating app grindr and roast fags like yourself. I also find mentally damaged queers to have filthy sex with.,1
i will fucking rape you in the mouth cunt  jk,1
Anne Kiguta: Welcome to Punchline. Our first guest is DP @user and over the  next hour we will talk about issues dear to Kenyans.  #RutoOnPunchline URL,0
"She got a point. Any woke black YouTubers get ignored. Then again white people saying progressive things or saying what is racist unfortunately brings more authority to that subject than an actual black iteration works be because we are already seen as playing ""victim"" to far too many people",0
+Kiki Melendez do you know Mexicans are hybrid race! Half European White Italian Spaniard and the dogs they came over here to fuck created Mexicans,1
"Incels, neckbeards, and niceguys.",0
Charlamagne suck my balls...i want em in your mouth and ur mom watching u,0
"Showing pictures of nudes =! Saying ""nigga"" on the 4th biggest website in the world in one of it's hottest subreddits.  You're a moron if that's your comparison.",1
This is why I love Asians,0
One dumb nigga in the hood is gonna blow his 2zz engine.. Smh,1
@user Your such a white scum bag you piece of white Trash if I don't Recall this used to be owned buy Mexico since the 1700's and your the Alien who Invaded us from span ... so stop your bullshit and get fired. And go back to Spain you white ash tray .,1
trump should nuke pakistan instead of iran pakiland dirtyland britishslaveland punjabiland,1
Shut up honky. Go back to harassing girls on tinder beta bitch. How's that joke? Funny right?,1
"Well, quit fucking her and we can be done with it",0
commentators are pathethic soyboys sucking the womens ass,1
