text,label
this is why females arent funny URL,0
choke on my dick bitch,1
@user The response should be what civilized nations do with thugs like that. You call out the National Guard with orders to shoot to kill. It's the only way you stop trash like them. If Germany had taken that tack against the Nazis in 1923 Hitler would never have risen to power,0
I hope Pakistani Bros smack some humility into England.,0
The last game I have played was human fall flat. welp.,0
I do not like you bitches. Ima slap tf outta you bitches.,0
"@user True. In fact, let politicians encourage ALL Indian couples to go child-free. Let them run campaigns requesting young people not to have any children and seek adoption",0
"That man only 5'6"" I'm 13 and I'm 5'8"" I'm also Asian and no one in my family is tall. So no genes",0
"Bitches so fake ""living their best life"" but still on my dick. I hate whores.",1
M0xyy is some weird autist kid in a grown baby body with poop stuck to his diaper.  URL,1
"men are so fake to each other, sometimes more than girls lmfao",1
play this as loud as possible URL and try to stimulate yourself placing a pen under your cunt so that it sits in between your labias,0
I should have left the nigga alone once I peeped the kind of bitches he dealt before me,1
"My God look at these BARBARIC PPL. And these pigs all watching. They r a very, very sick culture. And Omar and Rashid want this crap here. This is America not the Middle East. Round them up and send them home.",1
Round up these foreing invaders from mexico and send them back,1
Went to my first pride this year but left my straight boyfriend at home and went with some other queer friends. There were actually so many bi pride flags that I'm bringing him next year ðŸ˜Š,0
"It means there are hoes, and they are mad.",1
We need to call it for what it is: there is an epidemic of white nationalist terror in this country.,0
And a faggoty flamer,1
"Careful Canada, Saudi's behead Gays.  Perhaps it makes no difference for Canadians who don't use their head.",1
"@user @user @user another nigga to hop on y'alls dick, enjoy your dick ride boys",1
"The only education that you will have is my white superior cock, fucking nigger slut.",1
I'd rather someone try and shove their morals down my throat than cut it open and rip my head off \*cough islam\*,0
"Trump is anti-women. Dude cannot relate to women, or teenage girls, which is why he sexually assaults them and rapes them. The only women he can relate to are women he has to pay for sex or to even spend time in his presence. Now THAT is un-American. The Orange Racist Rapist should definitely get out of our country. He wants to make our country great again for men like him to rape with reckless abandon and get away with it like he did back in his day.",1
to scare all the guys that would wanna fuck me. also I feel like having a dick is way better than a pussy ngl,0
Puritans in here. Jesus Christ.,0
Fuck a nigga so good he ain't gone wanna leave,0
*u have MONEY... Blablabla... But u LOOSE ur ankles Lil boy* help humanity and stop to be an asshole on internet #FromFrance #thisisrealtalk,0
God won't bless his son's murderer Israel.,0
These bitches ugly,1
"well, as i've learned, trying is something incels are simply incapable of doing. should be called intries (incapable of trying instead of involuntary celibates)",1
I think someone who openly supports jihad is a shit for brains,1
This bitch needs that long fucking until she's paralyzed with ecstasy and can't think about anything but your cock going into her URL,1
This is what happens when you get Jews to manage your millions....,0
I just wanna destroy your life bitch. It is really enjoyable to see you broke and weak ðŸ˜‚ðŸ˜ˆðŸ· #findom #femdom #rinse #paypig #blackmail @user @user @user @user @user @user @user @user @user @user @user @user @user URL,1
PAY THESE WOMEN WHAT THEY DESERVE YOU COWARDS,0
"Molly is thinking ""nigger"" in her head.",1
This post is mega gay cause it's a repost,0
"@user 2/2 So, you're right, [some] Catholics (""they"") are really harmful to children. Particularly those ones that call themselves priests and have committed grave acts of sexual violence. Fuck off Bishop.",1
What racist comment burning flags like the left Trump is 100% bang on if your not happy go this chanel needs to be honest,1
"Since Hitler and Bin Laden are already dead, that solution is perfectly logical",0
I hope you have a retarded baby,1
Gosh! You suck ðŸ¤®. Learn to use coherent emojis. I hope you aren't this bad in bed with your(~~significant other~~)self. I could totally see you masturbating to the thought of sucking your own dick in front of a mirror! (after each post you make here),1
I wanna beat your bovine grass grazing face just because you shave your legs faggot,1
"@user Paul and I share a birthday, and therefore, we are meant to be. In this essay I will discuss.... URL",0
WHY YOU FAGGOTS STILL WATCHING THIS,1
"as we know, the filthy poors dont deserve to feel safe, and aren't real wombyn anyways",1
I'd smack your ass leaving handprints then fill your pussy with my fat cock (;,0
@user So fuck rich niggers,1
"#RickyRenuncia #RickyVeteYa if you think women are whore, consider where you came from URL",0
You are shaking Benjamin. Is your script not updating fast enough? Your writers over at the JIDF should step up their game. You need new talking points. URL-Politics/Less-Americans-support-Israel-than-ever-before-Poll-finds-582628 URL People have had it up to here with you fucking child murderers.,1
"TMC Goons brutally stabbed & killed a dalit Hindu karyakarta of BJP for chanting #JaiShriRam ,alleges victims wife.. Sir @user pls do something, Put WB under President rule.. How can you allow innocent nationalist indians there to be murdered? URL",1
"""keep it moveeen"" says the bitch who gave a dude genital warts, go buy a new pussy ho",1
suck my dick cunt,0
lee hwan says gay rights #PrideMonth URL,0
We was having sex in high school but damn these little heffers on this Euphoria show be FUCKIN,0
"Another punk ass white boy shooting shit up, but everyone else are beast and savages.",1
@user @user Address what! The existence of Jews? And how do you want to address them?,0
Malaysia is worse than bangladesh.,0
That bitch.. amma kill you,1
@user @user What a fkin hoe. I wanna smack her and spit on her like she did with her dog.,1
I wish mossad would arrange an accident for her...,1
@user Who gives a fuck....you sound like a queer. Worrying about what the next motherfucker doing. Go get some pussy or some money. Clown ass,1
"I hadn't thought it until I typed it out like that either. Privilege means we must always see through a particular, default lens. This is never the lens of a minority or non-privileged group. Hmm",0
@user Girls who dip could beat my ass and I'd let em,0
bitch bitch bitch. super bitch,1
"Ahhh yes, the gays strike again.  Bitch wtf URL",1
SENDING MONEY BACK TO MEXICO ...... SHOULD STOP. THESE PEOPLE'S NEEDS THE BLACK SLAVE ENRICHED UNITED STATES FOR EVERYTHING.,1
"Statistically speaking it will be one white male who is socially isolated and has been expressing feeling of anger, isolation and uselessness on social media and maybe interacting with right wing websites/forums. Lets wait an hour and see how much of that Venn diagram he falls into.",0
IF I TELL A NIGGA MOVE THEN HIS ASS BETTER MOVE FUCC AROUND AND GET SHOT TRYNNA BOUNCE ON MY SHOES !!!,1
Jizz down her throat then call ICE for deportation,1
Shut the fuck up you embarrassing mongoloid,1
Black and thirty? I'm surprised he wasn't hung by the KKK yet,1
"No one calls people fags anymore, you inbred shit stain",0
Only in this nigga dreams wack ass u should wanna be better aways goofy ass,1
Sit that ass on this dick. Lemme see what that hole can do! #EnterTheCity and Breed the #Twinks at URL. #XXXperienceTheTwink URL,0
"I'm such a man whore, I will literally do anything a woman tells me to in bed.",0
Fuck you lady! Whore!,1
Is he an incel?,0
Crackas dont like us it's 2019 ain't no more sugarcoating shit !!,1
Because only Americans do this stupid shit.,0
"@user Exactly,most hate for the jews is jealousy driven,they are hated for their success.",0
Incels are the only kind of losers in society that choose to wallow in their uselessness as humans. Truly a waste of oxygen keeping yourself alive if you identify as an incel.,0
You guys are seriously spreading the conspiracy theory that the muzlamics are taking over? You do realise that the racist white person who created this image probably views all brown skinned people as Muslim? These people think all non white people are invaders trying to take over Europe. You're just spreading their conspiracy. Shame.,1
"Please do tell the police. I had so many uncomfortable moments happen to me throughout my youth, and because of the way things were I just assumed it was something I had to put up with (as a teen/young woman). It's not. No one should make you feel like that and lock you in anywhere! Shocking!",0
I would beat the fuck out this bitch wtf youn do no shit like that in front of a child URL,1
2:02 white guy got hella attitude tf,0
Can't even spell those spells Thoes bitch you a nasty hating hoe,1
@user Stupid bitch kill yourself,1
As a guy i realy don't get we anyone would do that. Do you want kids with a woman you bearly know? Do you want STDs ? Besides the fact that is an absolute asshole behavior it is beyond stupid.,1
"Iris Murdoch: Atheist, but unapologetically Anglican In the final part of our series on Anglican women novelists, Peter S. Hawkins explores Iris Murdoch's use of religious themes URL",0
What a bunch of liberal faggots,1
Maybe the white british family had a black kid with them? Tarzan could be about Slave Trade?,0
can niggas with girlfriends stop talking to me before I really end up taking their girl,1
Viva Iran and Iranian super power,0
No worries real niggas will stay ðŸ’¯ðŸ’¯,0
"This shit is stupid as fuck. If you a nigga, run with the niggas. If you a girl, run with the girls URL",0
I guess I just want to genocide all the muslims in the name of glorious leader Xi ðŸ¤·â€â™‚ï¸,1
@user You can tell be the way she used English words that she's African lol. I didn't suspect her to be Nigerian but I knew for sure she's African,0
@user @user @user @user that nigga cappin URL,1
"anti zion, okay then you islamic pig, now try fighting the combined forces of the US, UK, and any other nation that would join the battle.",1
Stupid cuck tarantino deserves to be shot honestly for his effort in trying to emasculate asian males. Fugly ass wigger bitch.,1
#Pakistan team today #WeHaveWeWill embarrass you #PAKvWI URL,0
Show a nigga you care and watch him hurt your feelings.,1
"Same difference in my eyes ;) Seriously though that's probably true but there are a lot of actual mainland Turkish people in London, business starting visas are one way people have been getting themselves and their money as far away from Erdogan as possible.",0
If she had a dick i would suck it,0
"Don't talk to me, rapist trash",1
FATAH: India wins freedom 2.0 URL  Some very interesting observations here!,0
"they say being pissed off will get one nowhere. yea, keep your pussy calm, slut.",1
but most of your viewers are incels rogan,0
I have Aspergers and you're more retarded than I am. Drown yourself.,1
"Oh that's right, you're from Pittsburgh, and people from Pittsburgh just run their mouths and get their asses kicked by people from Philadelphia.",0
+LilSwizzyRecords fuck yourself cunt bitch faggot,1
"It's actually ""Christian's,"" because if you're going to be an ignorant fucktard, you may as well do it with terrible punctuation.",1
@user Lmao nigga I be so mad lmao ðŸ˜‚ I luhhh the kids tho,1
why theres no black Einstein? probably having sex with a white whore in a stole car... in americaaaaaaaa,1
Pakistani security forces cross all the limits of barbarism & oppression in North waziristan  We got reports that injury activists are takem from their house to Forts where they are injected with poison & killed #StateMassacredPashtuns #PashtunRejectCurfewInWaziristan @user @user,1
Fuck you Noot Noot Harime fucking fashion cunt tailor cunt looking bug as eye looking no arm be having bitch,1
"Marasia Dyes from @user 8th Grade is today's player of the game in her huge win against 4th Family. She gets things going for her team, attacks and draws defenders and has great vision to get her teammates open shots. Also a very capable scorer. ðŸ”¥ðŸ€ #ZGStarsandStripes URL",0
"""Blessed are those who trust in The Lord."" - Jeremiah 17:7 ðŸ“– #WordOfTheDay #ThursdayThoughts URL",0
The neo-nazi anti-semitic america trying to suppress successful jewish people. Not surprising! Trump gets elected and they go after prominent jews! Well done Nazi America!,1
BDS South Africa's Muhammed Desai Deletes Post Admitting to Collaboration with PFLP Terrorists | Israellycool URL,0
fr diva gays are the worst types of faggots. take some phenobarbital and chill b4 i come for your whole life,1
@user #IStandWithBeto We're not taking your sh*t anymore. You don't get a pass. You don't get to spew heartfelt racist rhetoric then expect a thank you when you read a cold speech from a TelePrompTer. You are racist & the world knows it. #ElPasoStrong  URL,1
"That dog should've tore her the fuck up , nasty ass white bitch ðŸ¤®ðŸ¤¢",0
"I know. But, how ironic. The Qudc force that were created to free Palestinian is now killing Palestinian.",1
@user @user More Taqiyya from a lying Muslim. We know your religion demands they all be murdered.,0
@user Was he in blackface?,0
Sounds like it. I'm sure you're swatting girls off your dick too. Bet he's a virgin...,0
Suck your dick,0
@user Yemen: War Profiteers Saudi coalition airstrikes in Yemen have caused thousands URL,0
Go fuck a potato irish trash,1
Now stop being a faggot and suck that dick!,1
Mr Wick the incel still cant get laid,0
hey suck my dick you fucking cunt,1
"While I do enjoy the pride parade (I'm bisexual) I must agree. For me its mostly and excuse to go out, meet people and a huge MAYBE, hook up. But as for ""pride"", nah.",0
"Can confirm. Jokingly patted my trans classmate on the head and said ''Good girl''.  Lit up like a Christmas tree. Unexpected reaction at the time, but a welcome one.",0
Fake edgy fuck ups aren't so tough in those juvenile jail cells tell ya what ! Get that teenage shithead rekt by another teenager that's really street .,0
MY DAD KING OF THE GAYS URL,0
"+Jessica N I don't think you are a fit to be a parent, if you get pregnant you should abort your child.",1
"I'm with you there, it tastes disgusting and a lot of it is farmed in China under disgusting conditions.",0
"I don't have her face. This is what she provided for me to expose. It's enough for her to have a breakdown, which is what the fucking slut wanted.",1
"Suck my dick, but don't look at me",0
Low testosterone is not the same thing as being a FTM. There's plenty of actual males with low testosterone and traits like those pointed out here - just look at those idiots from Buzzfeed where they tested their T levels and all 4 of them had T levels like 90 year old men despite being in their 20s.  And I think Christina Ricci is simply anorexic like most Hollywood bimbos. You lose enough weight it screws with your hormones.,1
"To me, a faggot is anyone I make suck my dick.",1
"Ya maybe your ancestors were faggy little cuck beta-swedes, but my long ship long dick, Norse-chad ancestors. Would slap the fuck outta ur whole lineage, don't come around me or my friends every again bozo.",1
"Just have some good pussy waiting, and fuck whoever hating.",1
"What other people on earth could be expected to sit mute, smiling & dumb, as a hostile imported elite lectured them - endlessly over decades! - that they were simply destined to become a minority in their own country.  It's an epic atrocity, and we're called Nazis for noticing!",0
"If only he was black or latino, him and his friend could have a cosy piss palace to live in harlem. Lease and a key...",0
"Russia is just a big used diaper of a country and the people are moronic. The food is shit, there is less culture than in America, and all they want to do is play cops and robbers all day, while selling parts of their mother they killed so they can buy more meth. At least keep your delusional dictatorship in your own country.",1
men should actually get prison time for rape first URL,0
I can't fw nun of y'all niggas y'all disgust me. When u wit ya maggot ass friends don't discuss me.,1
"So...between barry and lights out in nyc, we're talking 100 thousand effected. Good luck rounding up the deportated immigrants today.",0
"""kill chad"" is this a holocaust denier class for incels?",0
not today and we nuked Japan because they attacked our land and we showed the rest of you country's what will happen if you mess with the best country in the world,1
"Stick It, Fuck It, Breed It, Leave It #bareback #barefuck #barebackmanila #gay #gayorgy #pinoy #kantot #pinoykantutan #alterworld #rawislaw #bbbh URL",1
"Not bi but I enjoy showing off, happy to send pics ðŸ˜ just added you Sc: biigbooy777",0
Welcome to the comments where insecure Americans can't watch a country grow because their country is getting fucked every minute by the Trump administration.,1
They are just going to attack a religion that they know who'll have no consequences again. Super brave. And how original I'm sure it's going to do great numbers.,0
If they wanna turn everyone gay then they should use the same chemicals that turn the friggin frogs gay,1
You posted retard! You are going to lose chromosome!,1
Muscle bear gay jerk off and cumshot at work URL,1
Bunch of whack niggas on this app,1
"@user ""This bitch talking all white and shit, you smart now""?",0
WTF a Al Qaeda apologist in the wild.,0
The natural-born citizens of Qatar keep other Humans as slaves...,0
All my bitches got endless niggas... while im lonely asf ðŸ˜­,0
What kind of pussy needs to throw old women on the ground and get the taser out? Jesus Christ.,1
Fuck you third-world loser America become over to your shithole country and fucking kick your goddamn ass little fucking goat,1
"Well, finally the real development will take place. Some genocide in the name of greater good is gonna happen.. Arnab Swami like journalist are gonna be happiest about developing J&K",1
"Just cut off your dick man, smh my head",1
The Bible only advocates 9 genocides according to my count,0
I'm Bi too and I live in a very accepting household and even I am scared of coming out. Good job for doing it and good luck!,0
"If you have a tiny pathetic cock you MAY as well supply me with endless laughs. I'll pity you, giggle at you, and make you WISH you were manly enough to fuck me, haha stupid little bitch. #findom #findomme URL",1
You fucked up Mary Jane made her an ugly anorexic sjw cunt.. not the pretty full figured large breasted all American girl next door red head.. you fucking faggots. Research her before you do this again you dickeating cunts. Her nickname is red.. not shanequa,1
"It works because ""fuck the Polish lorry drivers."" That's how it works. Racist, jingoist, rancid sacks of human shit.",0
"He will make sure each and every jihadi bastard in your country will die a painful death, and your rogue state Naapak Pakistan will be finished forever URL",1
Depression Stress wait no women have those too yea this guys a dickbag,0
It's because they're Asian. Some people on Reddit appreciate humor from white people and black people but don't get butthurt when they see Asians doing something like acting.,0
"Yes Sir Mr. President @user , And next the filthy anti Christian criminals in Washington are going to want to sanction countries that don't let homosexuals dance in the city streets in front of their children. URL",0
Fuck your mother who birthed you.,1
Great job! Happy week to you from a heterosexual exmormon!,0
@user #beautiful #site a #white #girl gets #instantly #hotter when next to #BlackBull #MondayMotivation #MondayMorning #cuckoldgoals,1
Bold of you to assume that Kyle is an alpha male and not a little monster guzzling beta bitch lmao,1
Happening all over the world. Military @ our border is Justified. Or gangs will destroy us URL,0
"I would say follow your heart because it is really worth it. I dealt with debilitating depression and anxiety for close to 10 years due to repressing my true self. Things didn't suddenly become perfect overnight, but since accepting I am gay, I am happy for the first time since I was a teenager. It took me some time to get there, but it has been so worth it to be happy being my true self. Plus, have you seen girls? They are so pretty and wonderful and I get to date them now, which is pretty freaking awesome!",0
"It always comes 'round to this.  ""Hey, look, the entire rest of the world has this figured out, maybe you should try it."" ""No, that won't work here because we're just so much worse than everywhere else in the world.""",0
America is the only country that goes to war with they're on people that's why we're so weak now smfh..,1
"Annoys me less than ""that's gay"" (even when it's an apparently hilarious and witty joke).",1
"International Day Against Homophobia, Transphobia and Biphobia is an opportunity to celebrate the progress made in promoting LGBTQ rights. But we must also reflect that there is much more to do so that discrimination is consigned to history. #IDAHOBIT URL",0
Why did those women throw the American flag on the ground after winning? I will never watch or support USA women's soccer EVER again!,0
"dudes need to grow up and get over themselves. Maybe it's because I'm trans (or a decent human being), but I was livid when my partner told me her ex's made her hide them in a drawer rather have them within reach of the toilet. I'll never have a period, but that doesn't change the fact that half the human population deals with it; it's bad enough as is without all the cultural shame and stigma.",0
I'm fine with it. That Muslim bitch can burn for all I care.,1
You bitches are Grade A retarded when it comes to niggas lmaoooo,1
"I'd be proud of my kid came out as getting straight A's. I came out as straight to my mom and she just said ""good""",0
@user Garcia What is a faget?,1
You are a filthy slut who dresses up to get attention and make mens' cocks hard. You like exposing yourself like this because it makes you horny thinking of men wanting to fuck you. How much of a slut is that?,1
This just got me sooooo Mad ðŸ˜¡  FUCK THIS NIGGA!!! HOPE U BURN IN HELL MOTHERFUCKER!!!!! URL,1
if u aint a christian ima stab u in the face,1
I can't keep up with these freaky hoes. Bitches wanna be stabbed and have guns shoved down their throats and shit... :( mc'scuse me bitch..?,1
This won't be that big of a story because a male got sexually assaulted.,0
That's the thing with bitches. They wanna act all mf kinds of ways. But they don't want or aren't prepared for what happens next.,1
Imagine being such a pathetic fuckboy you make an entire account just to jerk off a garbage game for children,1
Should've nuked your colonialistic genocidal swampland to pieces but we were occupied by Ottomans.,1
"Hey, don't insult a great religion like that! Speaking of the Church of Satan of course.",0
Girls who fight the other woman instead of their cheating boyfriend are landfill trash,0
"""It is important to understand the epidemic of violence against trans women of color and the crisis point at which we are now and have been for years,"" an executive director of a South Carolina LGBTQ group said. URL",0
"Anyways, I have a full dick.  You do not.  And Jews don't fuck sheep or blow up our shit.",1
can't trust niggas who abandon they kids,1
sell guns to anybody but white men. thanks,0
"islam literally has more breeding more children as a command from mohammed,you think they care about your 'education'.",0
I wish those agitators would go so far as to castrate themselves! Galatians 5:12,0
shes also antisemitic and a terrorist sympathizer,1
SO ALL THE NAZIS JUST ESCAPED? AMERICA WILL REALLY HUNT ANYTHING DOWN KILL BIN LADEN AND BOMB CIVILIANS BUT WILL LET NAZIS LIVE OUT THEIR LIVES AND GIVE THEM JOBS,1
"@user @user Islamists are putting women into political spots in the West. These women are, young, pretty, and able to talk. Taqiya allows them to spout Leftist values they do not, of course, share, but to exploit useful idiots.  It is codenamed: The #LipstickJihad  URL",0
"Why are we so stupid to think people like this are entertaining.? If this dumb bitch is so hot, maybe don't wear long sleeves and a beanie in California in the summertime. Why do we continue to support these twats and make them millionaires? Maybe if what they did was productive and useful. More poop.",1
closeted gays need to calm down i swear y'all are wild URL,0
"EVERY SINGLE BROWN PERSON KNOWS WHAT ""Go back to your own country!"" means BUBBA YOU INBRED SHIT HEEL! ðŸ½",1
"Arguably not as bad as America, where local cops were the ones aching to beat the shit out of black people in Mississippi.  Don't make it a race thing, shitty authoritarian behaviour isn't linked to race",1
I'm attracted with someone.,0
Omg a modartor at ok buddy rartard replied to meðŸ˜³ðŸ˜³ðŸ˜³!!11!! but seriously you a goofy ass clown my nigga get back to 2013 you cringe ass norm â¤ï¸â¤ï¸â¤ï¸  Bring back karbazia,1
"Just another ghetto fatty angry because she's horrifically ugly and a hippopotamic landmass; the result of a glorified ghetto culture that breeds ignorance, stupidity, and violence when confronted regarding that very ignorance and stupidity.",1
