text,label
That gives me a leg to stand on in defending my feelings on this more than you know. I want the world for her. And this shit would not fly. Huge thank you for this perspective.  And I totally agree that the pressure is real. I know I feel it. But I don't want to feel it anymore. He wasn't some troglodyte going to sleazy places when I married him. And my standards are still the same. So I hear what you're saying in making sure I remember to watch my own ass in this situation instead of worrying about his feelings.,0
BEST. GENDER. REVEAL. EVER. Minus the almost dying part lmao,0
Mnt Man well you obviously cared enough to write this comment and each one of these women could easily crush you using one arm so don't tell them to go back to the kitchen. Instead how bout you go back to your mom's basement?,0
"The amnesia in these comments sicken me... Who cares who your having sex with.. Have people forgotten what he is presiding over? Yey for the gays.. but fuck the homeless the disabled the vulnerable sick children..Extortionate rents failed health, house prices we can't afford! ðŸ˜  URL",0
Oh no the Vietnamese,0
URL 19 of 22 indicted in gruesome MS-13 slayings were in US illegally: Jon Miller reports URL #news URL,0
"Tdy is 15th martyrdom anniversary of Shaheed Dr. Surayya Khosa, she was killed by banned #LeJ #ASWJ for being an active Shia #Shiagenocide",1
"It was intentional. Nail salons are frequently immigrant owned businesses. FFS, if you don't like their job on your nails, stop going there. It's not because they don't speak English. Guessing your MAGA hat may have put them off.",0
@user you're a worthless piece of shit. I hope someone beats yo ass in jail bitch,1
Y'all should try to survive in Iran,0
Wow lmao niggas really ain't shit ðŸ˜¹ðŸ’€ URL,1
"""Right to date without excessive hurdles"" - what hurdles? Is saying no to sex an ""excessive hurdle"", because then I think many women are just gonna stop dating...",0
Yeah that trans fag should just kill himself already.,1
Yes yes it does join the honorary Latino club,0
"Palestinian Prisoners Club: Israeli occupation forces detained 37 Palestinians from the occupied West Bank during Eid al-Fitr, including three girls. #GroupPalestine #Ù‚Ø±ÙˆØ¨_ÙÙ„Ø³Ø·ÙŠÙ†ÙŠ URL",0
Unless all these illegals in Texas vote and turn it blue. That's their plan. Why would all these people from California be moving there. They infest Ref states on purpose. I live in Nh and all the snowflakes from mass have ruined it. Need to change it to Live poor or die,1
#TuckFrump Mike Pence blasted for appearing with anti-LGBTQ extremists three times in five days URL @user @user,0
How fucking dare you? I didn't want to do this but.. EXODIA! Use the forbidden words! ur mom gay,1
Internalizer misogny my ass ðŸ˜‚  Op is a thot for wanting to cheat. That's a fact.,0
"99% of them are boys who refuse to become better. 1% of them are men who are actually getting shit done. This 1% is either grinding 24/7 & enthralled in their work or they're just getting really sick of the state of women these days.  â€‹ **Incels don't exist.** *If they REALLLLLY wanted to,* these losers could always fuck Diabetty, the 400 lb amputee down the street or anything equally horrendous. **They are voluntarily celibate.**",1
"Men are actually garbage, lemme be in the house and see some fucker try sneak in, I'm fuck your shit up ðŸ¤º",0
Bussdown put a whole in a nigga,1
India's cluster bomb attack on Kashmir hurts Muslim Ummah. May Allah protect Muslims. @user #KashmirWantsFreedom,0
India is a huge scam. Winston Churchill was correct when he said ( paraphrased) Indians are a beastly people with a beastly religion. The famine was their own fault for breeding like rabbits.,1
"Most of the English-speaking world mocks America on a daily basis. Doesn't mean they hate white people, or Christians, or anything. It just means you've got a fucking clown in charge and a bunch of you haven't noticed yet.",0
And Tom cruise is gay,1
"Theo: ""nick I got 3 words ima say to you after I squeaky clean you."" rest of call: Theo: ""go back to outbreak nigga""",1
Fuck sake who cares if you're gay just cook my meal,0
Spank your ass and fill your slutty pussy up with my cum,0
"i really hate seeing shit like this, and all these companies that profit off of women's insecurities makes me sick URL",0
Lil freak she suck the whole dick,0
"What if I said nobody cares about blacks and they should just kill, cannibalizes, rape and murdered each other like the scum they are. Thanks",0
"Ryan B many have a better life in ICE custody than they ever will in their s hole countries. Deport them together immediately, problem solved",0
Zhero Zhero This is why you don't allow subhumans in a western civilization. Think about that boy.,1
Philbert and Tommy are now LGBT+ icons.,0
Sounds good bro ðŸ˜‚ maybe if you spent less time playing world of warcraft you could actually get a female to take a peak at your baby dick. Fuckin nerd,0
NOW WE REALLY HAVE SOME BUSINESS GOING ON (says girl with actual asian heritage),0
They should take all the white Americans held in our nations prisons and treat them JUST LIKE THIS! The. There will be changes in how they are treated.The immigrants committed the crime of fleeing for a better life.,0
What a bunch of fags.,1
"He's referencing a study done which showed that people with 'stereotypical black names' get less call backs on their resumes, than people named things like John or Jane. Dave was pointing out that with a name like ""James"" it was easier for him to get a response on his resume. It's one of the 'thousand of advantages' James lucked into at birth.",0
Not taking off your hat: Shitting on America Hurting Americans: Patriotic Brilliant logic by these imbeciles  Bunch of losers who need to be put away for life.,1
Maybe Karli Redd is related to Nicki Minaj. I haven heard it yet in Trinidad and Tobago. I would say that maybe in Karli Redd's family here was someone with east indian decent. So that is why she might have some of the features.,0
This lil nigga did his thing. Stop hating ðŸ’ªðŸ¾,0
"@user K : they are beneficiary's of what was received from those responsible and will become victims since not one has repented all the way down to this generation. The unrepentant descendants will go through what is written in Isaiah 14:1-2kjv, for God is not mocked. The heathen shall reap a ""double portion"" of what his ppl have sown.... revelation 18:6 kjv. The truth is not at odds with itself",0
"the corniest shit i've ever heard was ""if she grin you in"" bitch i'm just trying to be nice to yo dusty ass. if i tell you ""gtf don't talk to me"" ima bitch",1
"It's time to wipe Iran off of the map. I'm ready to do my part, let's go.",1
he was an incel mad at the SJW art decisions made by the company. When they reduced the breast size of his favorite waifu by 2 cup sizes he snappe,0
"fuck every single one of you racist pos in the replies lmfao, take your ass to trump's states and you'll know exactly how they feel. its easy to talk cock and make fun when you're amidst your own, but the moment u step out of this country, ya'll will CRUMBLE",1
"If a man had to gain 40lbs in his ankles/boobs, leak from said boobs, barf x4 months, perform Cirque du Soleil level moves to wipe his ass, then explode a baby out of his dick, abortions would be legal AF in all states well after 6 wks into pregnancy. Change. My. Fucking. Mind.",0
@user i will fucking end this bitch COME OFF ANON AND SQUARE THE FUCK UP LIKE A REAL WOMAN,1
"I'm definitely getting her pussy. I *love* the idea of cumming inside of her sweet, tight cunt.",1
"This woman just lost her boyfriend and she was FRONT AND CENTER to make sure another black man, who she did not know, didn't die on her watch. The clarity in her words, the anger and fear, the exhaustion at the end. God bless her, I hope they both heal from this URL",0
Get this shit out of here you cock sucking fag,1
"Look at you pushing your arms together trying to get them to look less ugly. It's not working you dumb slut. Those tits are probably hanging so far away from each other you could fit 10 thick cocks between them. Bet you'd like that. I would stuck it in there too just to get it hard so I can go fuck a proper woman, while you stay in your bedroom rubbing your pathetic little cunt and you ugly tits with tears running down your face, like the sad cumdump you are.",1
"Didn't the 15 year old boys soccer team beat these reeeeee tards? Are they wearing beach volleyball uniforms yet? Women are still overplaying their hands, and men don't care anymore. Nice work ladies!!!!!",1
"I can relate 100% to what you said. Not trans, happy being a girl, but it sounds convenient and fun to have a penis.",0
Be forewarned! I am going to stand in the corner and BANG MY HEAD AGAINST THE WALL until you stop migrants from trying to enter our country. If you don't do anything about it I will BANG MY HEAD EVEN HARDER until you comply! Numbskull.,0
"@user You Stupid bastard, maybe you will wake up one day, living under a bridge, next to a gay, drunk, drug using, Iranian that hate every American regardless of color, in the winter, while it's snows, in record cold. Then you may realize just how stupid you are/were.",1
"I think that being trans has totally shaped the way I view the world and the way I connect to it. It shapes the art I make and the things I write, the way I interact with people, the way I move through life. I like being trans and deaf especially because ASL is a beautiful language and I think I can express my gender better with ASL than I ever can in english. sometimes I hate this shit but I don't think I would give it up. I don't think I'm proud of it yet either but I know I'll get there. picking my own name was also pretty dope.",0
+LaVar Ball bro is it strange why you talking gay shit or that you chose the name LAVAR BALL but you talking about riding dick. What kind of no life virgin needs to choose a popular person name. I guess the kind who have some gay shit on they mind,1
"Cuke, melon, or squash. They all look the same at this point",1
Go suck dick faget and kill both your mommy's,1
"That's rich coming from a culture that created Nazis,b protected them after WWII, and now has amnesia.",0
Fag smokers are the bigger fags. Cigars at least smell nice.,1
"Imagine 738 million people losing their homeland... Like, why is this okay? Imagine if after World War Two we just flossed Muslim countries and replaced their religion! And imagine if their leaders started not giving a fuck!!!",0
Anthony is a Gay Faggot! Shut up you Whore!,1
"Yea, forget that a girl can poke a hole in a condom and lie about being on the pill and all that bull shit. Even if they both agree that they want an abortion the father has no say. A women can give birth to another mans child and have the man take care of it for years and the women would suffer no consequences.  I read a headline last week, a woman stole sperm from a blowjob, got herself pregnant and sued the guy for child support. If that doesnt sound way worse than this BS than idk wtf yall think Male privilege is. Chief this ain't it Lmao prob edit later cuz phone die",1
shes a rapist,1
"why is every male gay word for an asshole terrible? MUSCLE CUNT, MAN CUNT, BOY PUSSY, MANHOLE, jesus. These are all awful. Other than boy pussy, y'all sound like you bought your buttholes at a hardware store.",1
Congratulations!!! Go forth and thrive.  Also Asian woman here. Got disowned by one half of parents.,0
Loooooooooooool what in the pseudo-history nonsense is this?? Do you know how many Black people were sterilized in Nazi Germany? Imagine thinking Adolf Hitler being some pro-black hero in 2019? Never mind the anti-semitic sentiment. Lord have mercyðŸ˜‚,0
Hell has no fury than a woman scorned.,0
"**Warning**: it has been detected that this account may be a faggot. Your sister's, who I've fucked, last 100 posts, 100 of them are DMs of her gash to me.",1
My friend that lives with (his grandparents that he lived with kicked him out) left his notebook in my room and I opened it up because I thought it was his song lyrics notebook but I found out the he's actually has a crush on a guy at our school and I hope someday he has the courage to come out as bi. Nows the month to do it so maybe he'll see all the pride stuff online and get encouraged.,0
">Today, you are picking up an expired cumdumpster who will never respect you, **be satisfied by you**, or care about you. I love it when they accidentally admit they're bad at sex.",1
"You did a good job showing your face while having a cock on your mouth. It shows how dedicated you're and no shame to become a public property whore. But don't expect compliments on your beauty, cuz all I care about is how I'm gonna enjoy loading my cum over your beauty.",1
Britain seizes iranian tanker in spanish waters. No one cares. Iran tries to seize a british ship the world goes crazy. Theres is deffinitelly something wrong with human beings,0
Them - DON'T YOU DARE OBJECTIFY US!! â€‹ Also them - Gets publicly naked as much as fucking possible.,0
You ain't finna do shit dumb faggot,1
You're Thai? You look fillipino,0
me explaining to a black parent today that the devil is not directly responsible for her child's suicidal thoughts URL,0
2 Alphas put a bitch beta sub in his place Follow @user URL,0
Shorty speaking facts yall mfs just ignorant asl SEX IS MENT FOR MARRIAGE FOR YOUR LIFE LONG PARTNER condoms probably been around for 100 years or a lil more that shit not natural,0
"To your point - the only anti-white thing I have heard of - is the checkpoints where Caucasians report being stopped for body searches.  Also, if you think Caucasians have it bad, spare a thought for anyone of African origin.",0
Fuck her right in the pussy! Wah ha!!,0
"This is very typical for this type of woman, total TRASH.",1
"The physical features of many Uyghurs, characterized by a mixture of European and East Asian characteristics, are considered ""exotic"" in China; in theatre the use of Uighur actors has become common because they can play the roles of foreign characters while at the same time speaking flawless Mandarin.[167]",0
They forced him to drink gasoline then burned him to death yet some still think israel is peaceful. Fuck y'all URL,0
"@user @user Yeah, telling the truth is so anti white these days, heh?",1
Hit that degeneracy YEET,1
Such a trashy country. They need immediate population control. A plague would also do them pretty good.,1
Common bitch!,1
Hope this redneck fuck chokes on his brothers semen while at the kkk rally.,1
time to move to a diverse country like India or china?,0
"Powerful women control you, it's so easy #FemaleSupremacy #Femdom #FemPower #FemaleDomination #HerInCharge #TheFutureIsFemale URL",0
"What's important at this time is to continue to focus the work and research of women of Color. In particular, I HIGHLY recommend and encourage you to look into the work of my big Sister, Dr. Jioni Lewis, who is a preeminent expert of gendered racial microaggressions...",0
"Yeaaahhhh, it's not just the wicked, though, is it? Remember when he drowned every living thing on Earth in a big hissy fit? Or when he demolished Sodom? Or the countless times he commanded his followers to massacre women, children and animals?",0
Niggas is really pussy. They are truly pussy.,1
I'm crying again over edelgard and dorothea's b support nghhh girls flirting with each other!! and it's for real!! they're bi!! they're both actually for real bi!!!! edel-chan said she wasn't NOT interested in love but it probably will never happen,0
black dudes be having sex with their Timberland boots on. ðŸ˜‚ LMAO,0
"Partly true. The Catholic sacrament of marriage is part of the seven sacraments. I'm just saying that to say ""hindi pagmamay-ari ng religion ang marriage"" is not entirely correct in the context of the sacraments.",0
hey sluts URL,1
i hate u prayed u idiot what a stupid pig go fuc yourself,1
"It's ""air clapping"", a way of applauding without creating loud noises (as a single clap can make these fags shit their diapers).",1
"since it's #pridemonth, I wanna remind y'all what the bisexual manifest says, cause most of you have clearly forgotten ðŸ‘ðŸ¼ URL",0
@user I would shoot it down you degenerate muslim.,0
"I'll bet that one in the red white & blue ""bikini"" fucks like a goddamn maniac.",0
"#SouthAfrica #SouthAfricaBurning #African infidels at their best behavior.. ""Burn the beloved Country"" Destabilisation = #Terrorists attacks #MondayMotivation #",1
"American, and of Pakistani descent",0
"Well I mean its justified when you lunatics screech anti -police rhetoric . Tell me if armed hardcore conservative Muslims were to trash your ' pride parade' , who would you wish for to be standing by to dissolve the situation.",0
When are these nutbars going to come to their senses and take these frustrations out on the muslims!!,1
"This is why men are TRASH, if you put your dick inside girls then don't be surprised when they get pregnant. Man tf up and handle YOUR responsibilities, dead beat piece of crap. It takes TWO people to have a child URL",1
"I've literally seen a southern baptist hit someone with a bible. I know. Oh, do I know. But the catholics are the ones that took over most of the world. :P",0
It's 2019 and people are STILL spreading this racist urban legend. URL-check/le-a/,0
Today a large portion of generation easily moved with the movie like avangers and Kabir Sing.They hardly response on movie which had enough contribution to build up a strong thoughts of Indian untold history.,0
"ðŸ—£Get Tested, Just Because You Only Fuck Them Doesn't Mean They Only Fucking You!!!",0
That opinion is gay,0
The zio jews are carriers of the biggest inferiority complex Globally...they have to keep repeating their two mantras ...the Shoah and the Supremacy ...to raise themselves from their obvious innate inferiority! URL,1
is y'all even breathing enough for another vikvaughny visual wtfffðŸŒšfinna blow y'all niggers away,1
why you incel,0
In America we just shoot them and move on,1
The only ones killing trannies are themselves,1
These niggas Got the look of a rich nigga but the actions of a begger,1
I wanna see her sucking your cock while fucking a fat dildo,0
I would have to fuck all your slutty fuck holes fill you up with my cum,1
"@user ILLEGAL ALIENS ARE "" NOT"" AMERICANS!!! ðŸ˜ WHY DON'T YOU HEL THE ILLEGALS OUT OF YOUR OWN PRIVATE FUNDS' ASSHOLE!!!",0
"Happy I ain't cut like these hoes, they pee'd on.",1
i don't take that shit serious at all only insecure weird ass niggas complain about that URL,1
I bet they combine this with truly enlightened ideas about homosexuality.,0
No BLACK PERSON is going to VOTE for this FILTHY BUTTH0LER.,1
Lemme grab you by the pussy faggot ðŸ˜,1
You can suck me off while I suck that delicious clit!,1
Homo's hate Him This man sucked 20  dicks in an hour  Just by looking at them!,1
Lmk when you kys faggot omegalul,1
"Wait edgy content on YT era is over, why only feminists can do edgy shit?  Idubz just hashtag feminist in your next content cop and you ll be fine.",1
"Sadly, J1 workers are treated worse than slaves (or in your case, Russian serfs) ever were. Your girlfriend should have stabbed the employer and flown back to Russia.",1
Nah this sub is literally a sub for white supremacists. eat shit you worthless incel. your mother should have aborted you,1
I don't benefit financially from saying there are or aren't diversity issues.,0
"Bishop I Makamu is caught in a Facebook war with Bishop Vusi Dube, and he's about to set the record straight as he meets with other men of God to discuss a way forward in redeeming the reputation of Christianity. #IAMBishopIMakamu Tuesday at 22h00 on #MojaLoveTv DStv Ch 157 URL",0
Why are you so retarted?,0
"A woman's body is a great work of art, always have this in mind when going down on your woman, she's a queen, handle that body as it pleases her not as it pleases you.",0
"China controls the people in Hong Kong by pepper grenade, metal sticks, smoke grenade, rubber bullets, cruel laws. The people in Hong Kong are choosing the freedom more than living with Chinese communist. They are fighting with their hearts, if they believe in God, God will protect them from brutal Chinese communist. God always be with the people who believe in God although they have no power before Chinese government.",0
Throw the whole man away. The dude is a misogynist. Can you imagine what kind of father he would be if you actually had a daughter?,0
You cunts talk like virgins.. So not convinced.,0
Goddess likes it her way and her way only!  Weak feeble whitebois belong forever locked away in #Chastity  Become addicted to your #mistress in ways u never knew existed!  #leather URL,1
Haha just not any American citizen. You have only contempt for us and love for your illegal invaders.,0
Start Shooting At Them Niggas,1
"how did she lie? she just posted the video of you. YOU made yourself look bad. you should of thought of that before telling people to ""get the fuck over the n word"", that you can say whatever you want and that you have a ""idgaf attitude"" URL",0
"Honestly, it's 2019. If you're homophobic or transphobic you're an ugly dumb bitch. And if you blame it on religion you're an even bigger and uglier dumb bitch. Idgaf",1
Find you a good general contractor he should have several window options for you.,0
Fuck white people and fuck the cops. And if you feel some type of way about it eat a dick!,1
You are nothing but a worthless little cock whore and cum dump. You should be begging each guy that is willing to shove a cock in your filthy little fuck hole to cum inside you and then flush it out with his piss. You aren't worthy of keeping the seed planted in your stupid body.,1
Jews are fucking Ari? They have been fucking the rest of us for years,1
"America is the trashiest country in the world, and the most corrupt. I can't wait for their 2nd Civil War and when their country falls behind Africa in 2050.",0
pretty sure it's gays and yeehaws but go off URL,1
"@user @user not exactly the equivalent, but yeah killing a women irrespective of the practice is illegal irrespective of religion.",0
I'm here as a single heterosexual white American male to congratulate this beautiful athlete in her victory. Euro Pride,0
@user @user @user Fuck off faggot,1
+David Fye II Shut up lying zionist terrorist. We all know that zio pig nation Jewmerica did it. We wont believe your lies. We will destroy your terrorist nation and ISIS.,1
It's the Iranians. Shut their whole country down. Take them off the gird.,0
I would first slow hiss her onto a bed. Play with her tits. Then ram her pussy so I can cum in it,0
"> around the 10 commandments as we're a christian country Ah, the ten commandments, where coveting your neighbour's goat is more serious than rape.",0
"Bro if Iran wanted to they could blow their ships out the water, Iran just playing games",0
"The biggest thing I notice about these ""women"" is just the way the talk about sex. It's always like the only time they've heard a woman talk about sex was through their hentai and whatever other degeneracy they consumed.",0
Real Jews leaving for Palestine...were stopped at Cyprus...and interned,0
Your FAGGOT AGENDA is sick you nasty FUCKS,1
"@user SO , WE ALL KNOW IT WAS A PUNK WHITE CAUCASIAN EUROPEAN/AMERICAN WHO MURDERED THESE INNOCENTS..... SO WHY KEEP HIS NAME SECRET ???",1
"I thought I was going to have a girl and I did! I didn't really care about the gender, but I know others who have dealt with gender disappointment. My one friend wanted a girl and had a boy. She was sad but now can't imagine life without him or with a girl (she is OAD). I now feel a little extra joy when women are pregnant with a boy because I never had a boy. I have a nephew that I am close with, but it's not the same. As time moves forward I find gender less and less of a thing. I love my child regardless that she is a girl. Congrats!!!",0
@user Shut up you unalloyed racist white male!,0
"@user @user @user @user In the same Jesus beat into your ancestors? You were born into your religion. Negro, please",1
"You stupid cucks and losers are seriously starting to piss me off. If you want to impress me, SEND. THATS THE ONLY WAY. And we all know you really want to fucking impress me. And I really want to beat up your balls until they're blue.  #findom #domme #cbt #torture #paypig #domme URL",1
Faggots and cuckold send me a tribute worth showing off about. Show these female Dommes who really is boss! #faggotsPayUp #realAlpha #findom #masterOverMistress #femaleslave URL,0
"God, I really wanna suck your cock. Would rather that cum be in my mouth then on you",0
see this is why aliens wont come here well just call them weird and enslave them or kill them all,1
This is what happens when you suck one black dick too many.,0
I wanna slap this bitch EVERY FUCKING DAY,1
"Holy shit, this is so well said. This is my favorite reply so far.  I wanted to formulate my own opinion on the subject, but I'm not transgender so I didn't want to make an uneducated one. This is the one I agree with the most.",0
"Nigerian women are so bad in bed, Lesbians are cheating on each other with men. You hate to see it URL",0
@user I pressed you nigga fytb shut ya bitch ass up too I'll beat you tf up on god you can't spell neither dumb ass bitch niggas say u sound like a 7 year old so stfu bitch u ass and you can run my series on broðŸ—£ (BLOCK LIST),1
