text,label
'nazi' 'anarchy' fucoff back to r/twitchmains infidel scum may Allah's judgement smite you,1
"Actually, there were plenty of female rulers in the ancient world. Or what would usually happen is a strong woman would be the real power while her husband did as he was told.",0
"You stupid cucks and losers are seriously starting to piss me off. If you want to impress me, SEND. THATS THE ONLY WAY. And we all know you really want to fucking impress me. And I really want to beat up your balls until they're blue.  #findom #domme #cbt #torture #paypig #domme URL",1
ion ask a nigga for shit cause i wanna see what he gone do on his own 🤷🏽‍♀️,1
But Judaism is not a personal thing. It's a religion. Being a good person is a personal thing. And that's something totally worth aspiring to. I just wouldn't conflate secular humanism with Judaism.,0
I hope you rot in hell you racist pig. The life of arab children is no less valuable than the lives of white childrn.,1
"But that means LGBT+ support is popular now, which is good.",0
I watch/listen to the news pretty frequently and that isn't the vibe I'm getting. Do you have any studies on prejudice/violence/bias against whites in the US or any evidence beyond your own anecdotal experiences?,0
fuck off faggot bot lmao,1
You white devil's were raping and impregnating black women while running away from your kids.,1
+Mike Tython At least I'm not a circumcised Jew slave. Rabbi stole your foreskin for skin cream and destroyed your penis sensitivity lol!,1
"So she basiclaly tried to turn everything on her side by giving them ""omg the GUYS are scary and mistreat women and I'm a waman too!!!""",0
"You've caught the big gay, it's known to be airborne via dildos.",1
Why is my bed so warm ugh the homophobia I can't believe this,0
"Grow a spine, come fuck me yourself faggot.",1
"Time to return this country to God, bring God and Jesus back, otherwise he will destroy this country. There will be only a remnant left alive if we do not. Time to turn to prayer. These storms and widespread destruction across the country are a warning.",0
"@user Imagine the enslaver who uses violence constantly ; he's a rapist at home , he's incestuous, he hits his kids. He is Donald Trump and his father. Its economics but at its core it's white Maleness in America.",0
Lol fuck these bitches,0
"@user We obviously need women to lead the House and the Senate, and be our President.",0
It's seems the lowest common denominator will ultimately be our demise unless illegal immigration is completely eliminated...!! But ya know who listens to an idiot like me that's been saying we needed complete border security and stop all illegal immigrants back in the late 70s.......and look how much worse the problem is now..!,0
She is a fucking dumb monkey,1
She has destroyed Germany with letting over a million muslims into the country. Of course they love her at the commie libtard brainwashing Harvard center,1
"That's why God created the Remington bolt-action rifle, so that Man could fight the dinosaurs. And the homosexuals.",1
"Says the guy. On the internet.  We're participating in a joke sub nigger, you do realize?",1
White man can jump,0
If you're wearing whores uniform you can't blame someone for calling you one,1
"The fact that this gorilla in a ""female"" body could dominate as she has shows more how pathetic the females have been ... no Steffi... no Navratilova .... to challenge her/it .... those who have beaten ""her"" got her to move those elephant trunk legs and fat ass ... it takes a whole lot of energy to get all of that going and stopping and going again ... will tire her out big time ... At the moment Serena is as big and fat as ever .... she gotta keep points short or she is in trouble ... NEVER the GOAT ... definitely the GORILLA",1
"> but it's safe to say no one is wearing a hijab voluntarily. This is kind of disturbing though. For a lot of people faith is crucial, to say that no girl can be religious on her own volition is to look upon someone who might have dedicated her entire life to something and dismiss it.",0
@user @user @user She's an ungrateful moron who comes to a country that is blessed by God of Israel,1
joke's on u bitchboy hashem's been trans this whole fckn time URL,1
Fucking gay ass chapos,1
"Oh China, what would the internet do without you",0
"@user @user @user @user @user She can say what she likes, but that's not how DNA works anyway. The white race evolved from the same ancestors the blacks did. Whites aren't going anywhere. Unless they are planning to kill off whites, which makes them worse than Hitler... mixing won't exterminate ""white"" DNA URL",0
I'm sure these dipshit redneck yokels already shot her and that's why the baby is alone.,1
Holy fuck i would love those tits in my face as you rode my hard cock,0
I have a whore for a girlfriend,1
Whit that comment you sound like a 12 year old that thinks he is hard because you roasted Jacob satorius by calling him adopted in 2015,0
Only a true NIGGER would do such a thing.,1
"Robert Massey, In 1 Peter 2:9, Peter calls his mostly Gentile audience "" a royal priesthood, a holy nation, and a people for his own purpose."" These are all terms used for the nation of Israel in the OT. The true Israel always was, always is, and always will be comprised of those who trust in Christ alone for salvation. URL",0
"If you're so keen to die then go kill yourself already you piece of shit. The world would be better off without you. Don't forget to do it properly either, I'd hate for some innocent person to suffer because you're mentally retarded.",1
"Shout out to all the whites at the bottom of the comments who think ""women is catcalled"" is some implausible event that could never possibly happen but ""Antifa Assassins cause journalists genocide with sulfuric acid milkshakes"" is true.",0
"Box 1: You are inferring that Box 2: Again, you can play a victim and blame others or do something. Obama grew up in a time more difficult than now for blacks and instead of crying on social media and feeling bad for himself. He became POTUS. Box 3: Yes it i Box 4: Are you fucking insane? You think the rest of the world sucks because of West... Ever pick up a fucking history book? The world wasn't ever beautiful place once humans became the dominant species. Greed is not exclusive to the West. Tribes were killing and enslaving each other before the first country ever existed.",0
You really just said this while black trans women have been murdered repeatedly in the last years. And you're oppressed cause people call you a virgin? Y'all see this? URL,0
I hate sub human euro cuck trash,1
Retweet if you daddies would shove your huge cocks down my throat then dump your load all over my pretty slut face #horny #boobs #tits #pussy #porn #amateurporn #nsfw #cumslut #blowjob #sex #slut #ass #dick #cock #jailbait #bbc #gangbang #cuckold #fuck #fuckme #whore #cumtribute URL,0
@user @user Please take away their license to breed. Looks like they have a chromosome missing.,1
"At 7:19 is why I hate people, women especially look how mad she got just because the dog splashed her.. f*** you you stupid b**** either have fun or go kill yourself",1
Why you hate immigrants?,0
@user This is why u are unfit . Thisis a debunked lie . U are the Nazi . A Jew who hates Jews and sticks up for Islam,0
"@user @user  Huffington Post @user ""reporter"" .@user calls anyone he disagrees w/ a Nazi and refers to @user facilities as concentration camps. This type of behavior diminishes the horrors of the Holocaust. Please contact the editors at the Huff Post.",0
They look gay in a f__k up gay world. cover your booty cheeks next time,0
This whore needs to get fucked. URL,1
You need some jesus in your life. Wtf,1
love how these are the stages of the deconstruction of traditional masculinity standards URL,0
I could take the virgin out of your asshole,0
"@user @user @user Hey jerkoff...besides being a moron, you're an anti-Semite as well. Schwartz means black in German. I'm German, not Jewish. If you had truly visited Israel, you would know how most of the 2+ million Arab-Israeli's live as full citizens and participating members of society.",1
There is no 'white' race,0
Keep that energy when that mentality gets her beaten by a gang in 10 years.,0
yeah lissi what a fucking dumbass bitch hoe,1
These anti America witches NEED isolated FROM THE HUMAN RACE!!,1
"Get that cunt under control, Whore.",1
Typical reddit faggot,1
"That's all we do here on the West Coast, talk about our White Privilege. Entire shantytowns exist here, now, in Portland. I'm told it's as bad everywhere along here. All the city does is pump out more and more hostile architecture.",0
You're probably old. Young people aren't having sex at all,0
PEEN SUCKING FAGOT IDIOT DUCHBAG,1
them ratchet bitches will fuck the shit out of you and act like nothing ever happened..,1
fvck it up alpha fvck it up URL,0
"If they get in and free the alien slaves do we have to pay for their house, health care, free money, food, writing paper, cars and bubble gum? Ship em over to California they can handle it.",1
"@user @user @user ""We're going to impeach the motherf*cker'!"" (Rashida Tlaib) ""On 9/11, some people did something"" (Ilhan Omar) ""We don't need black people, that don't want to be a black voice"" (Ayanna Pressley) ""The USA is running concentration camps on our Southern border"" (Alex Ocasio-Cortez)",1
Fuck a nigga so good he ain't gone wanna leave,0
Dirty fucking street shitters have been finally put into their place a stench of mixed shit and garbage will be gone from r/cricket forever now. Ban me if you want to dirty pajeet but this is my alt and you can't do anything about it. Cry more dirty Arab rape baby.,1
> Cut that sack the sack is at the base you dumbfuck. just admit it you like mutilating baby dicks because you hate yourself for being an incel,1
Good girl suck mommas big dick!!! Take it all the way down and gag on my fat cock!! Make sure you use plenty of spit because you're ass is next and the only lube you're getting is your spit! Who wants momma to throat fuck them?! URL,0
"I'll fuck the freckles off ur face, bitch !",1
Can you stop being a dumb nigga you crackbaby ? Smh,1
you woman are racist anti-American nasty people--and liars--do you not think we know the facts???-btw-two of you are paler than i- and my heritage is eastern europe-so enough of the people of color schtik --,1
More handouts for the Blacks so they can run rampant in the fucking streets. Not a good idea you racist fucking pieces of shit,0
ur a fucking gay cunt woof woof,1
I will not vote for Donald Trump'. But then again I'm black and on the plantation. I'll never vote other than Democrat. Massa say how I vote and none can change dat,0
SHUT THE FUCK UP YOU MONGOLOID,1
Why didnt u get these pants out the way my neighbor to the south ur anis wanted to shit down that roid raging punk axes throat!  And Nick is a puzzy for spirting off at the mouth and not following that roid raging fucktard to keep him from showing his ignorance,1
Mr Wick the incel still cant get laid,0
"Seriously, what kind of faggot would preemptively exclude that sweet sweet bussy.",1
"+J Clm MEXICANS RATS WANT FREEBIES FROM AMERICAN TAX PAYERS SO THEY CAN DO THEIR DIRTY SELLING CHILDREN FOR SEX,DRUGS, PROSTITUTE, AND COLLECT WELFARE CHECK 🦍🦍 🦍🦍 🦍🕷️🕸️",1
What if a tranny attacks me with a aids laced meth needle? I'd actually be terrified,1
My mom fucked you in the ass?,0
@user @user my nigga on his computer,1
Was an Incel. Full of hatred and pity for himself.,0
"What she said was nasty and the cunt bitch herself is also fucking nasty!!! Stay out of the U.S bitch, you ain't wanted here. If people want to worship your stank ass in the U.K then so be it, fuck off!!",0
"Instagram refugees lmao, let's build a wall instead",0
That's not edgy u little fragile cock slurp,1
There are going to be lots of malformed Iranian orphans after fordo melts down.,0
I assume the award was awarded by other retarded feminists in a contest created by said feminists for feminists.,1
@user I was sleeping you AIDS infested moron 😂😂😂,1
@user @user @user A few weeks later over 90 Christian's were killed and over 7000 in last six months no global news coverage,0
Ha if I'm the beta then who is skull fucking your mom? Oh thats right her brother... Thats where a fuckin moron like you comes from.,1
"And how would that happen in your opinion? Bomb and kill all of their people so the US can raid and steal all of their oil? If that is your plan just say so, you don't have to make up some generic ""reckoning"" nonsense.",0
@user Boi shut yo bitch ass up I will smacc yo silly ass you fag,1
"She's right for asking attention, she is hot 🔥🔥",0
cute and fuck bitch face fuck her three holes spank her ass,0
"@user bitch don't ever sis me that's 1 , 2 YOU want me to be mad as fuck . i literally said one thing one time and you think a bitch was just coming for yo neck like calm down pendeja - none of this shit that damn deep lmao",0
"""Gas the fucking Jews"" - gaydolf bimler",1
Im Bi ive dated both over the years but this relationship is different we dont argue or fight its really nice.,0
GET AWAY FROM THEM U STINKY BITCH URL,1
I hope these bitches die immediately as an American it makes me sick go scissor each other some more I hope I live to see you both die of cancer!!!!!! Never before have I felt more ashamed to be an American than this..... First time I ever wanted my country to lose,1
she has transitioned and her wife is fully supportive,0
"@user Will fuck you suarrrrrrrrrrrrrrrrr,get out from my country ..Namak haram",0
"Normies started posting in some guys 4chan board. Well, he got extremely pissed off and made a video - URL .",0
shut up idiot i dont care i do not watch your videos because you are black,0
A couple do look grey but the majority of it looks like an ashy blonde colour that really does not blend well with the mousy brown. I think this is just badly done highlight and seeing as this person has awful taste in clothing and posts crap like this I wouldn't expect them to have much better taste in dye jobs,1
"Omg, I feel like you can at least empathize with my ""struggle"" even though obviously I can't empathize with albanism, but I definitely wish I could connect with my black father on a level people tell me I'm not allowed too.  Even as a little kid I have memories of being pulled over in a super white neighborhood and being questioned about actually belonging to my dad! Like I have a daddy's girl tattoo, trust me I'm his, 100%!",0
"@user List of the people lynched to death by Muslims mob.  -Twinkle -Dhruv -Ankit -Chandan -Vidhu -Jithu -Vishnu -Ramalingam -Heena -Dhruv -Bharat -Madhu Now, #GopalLynched  Absolute silence of Presstitutes, Libtards and govt on the systematic massacre of Hindus.",0
You look like a trashy ghetto whore,1
Fuck dude I love chubby white guys u guys have the perfect ass,0
"Being kind to others, it's really not that difficult URL",0
"Trust me, everyone knows you're secretly a submissive little whore. It's the same thing with retarded feminists. They love being dominated and degraded because they know they're inferior.",1
Blame India since they shit in the streets lol degenerates,1
You need to be in your knees suckling and servicing a fat black dick. You can't stop no matter how tired your mouth gets. You sit there and suck that cock and think about what a stupid slut you are because you've never thought to do this for your own satisfaction. It's ok tho. Dumb little girls like you dont know what they really need. You gon' learn today tho.,1
Or she's just a cunt.,1
Fuck em! Haven't showered in 45 day? They should have stayed the fuck out of MY country!,1
@user Mondal India win the match by 149 runs,0
"One day we will look back at these atrocities: caging children at the border after separating them from their parents, detention centers filled to the brim like sardines, deaths of children at hands of CBP, convictions of volunteers and feel SHAME. 😢URL",0
"r/atheism is more of a place for ""fuck god and anyone who believes that someone or something created us"" place. Thankfully in real life i, surprisingly, haven't encountered one of those kinds of atheists.",0
A guy punches a girl in the face and you're wondering why the girl is the victim? Here's my thought: you're a victim of retardation,1
"#12 Kali Deity Vandalized in Kushita, Bangladesh One Kali deity was broken and another was lying on the floor by the temple caretaker, along with several precious ornaments stolen, in a Hindu Temple in Kushtia, Bangladesh.",0
Incest banter was being thrown around and niggers actually went out of their way to beat their cousins cheeks 😭 URL,1
+Charlotte theyre inferior because they cant reproduce themselves.  Im sure theyd fight for their bodies if they did.  They feel good knowing the govt wont confiscate their balls.,0
"We're in June and there's been 8 trans murders in the country, all of which have been Black women. This is what I'm carrying with me this Pride month. Rainbows and short shorts are fun, but this is reality. Rest In Power sisters ❤️",0
third general day of peaceful protest carried out by all d refugees in most cities In Indo including refugees based in Sekupang Batam Indonesia repeatedly demanding d UNHCR to put pressure on 3rd counties to stped forward to take more refugees from Indo #HELPREFUGEESININDONESIA URL,0
"I want to kiss her back and hear her moan. I want to kiss and lick every inch of her thick body especially her armpits, sweaty dirty butthole and her wet pussy. I will pound her thick fat ass from behind while pulling her hair/squeezing her huge boobs and finally cum deep inside her dirty butthole. What a sight it would be to watch my seed leak out of her tiny asshole 💦",0
Help your parents grow a good opinion on the LGBT community. Then the rest is up too you,0
You should join the trans girl groups (e.g. Duck Tales) on Telegram to get more localized friendship and advice.,0
They're red because they're white,0
"the moment I discovered those shit ass feminists I knew, humans must die. Blame it on them for being such whores",1
"Hangfire-13 if you actually gave her a chance you'd see this is who she is, stop listening to aoc propaganda on fox news",0
"Choose lower population. Be proud that the ""white people"" were the first to understand that LIFE means global survival. Less people.",1
"Another subreddit, same outcome. You are a beautiful woman who needs to be used with passion and dominance.",1
Shut up newfag,1
#PrimeMinisterImranKhan #pakistan #IK #PMIK #oic #Palestine #Palestinian #Kashmir #kashmiri #terrorists #terrorism #IT #Science #and #technology #artifical #intelligence #OICMakkahSummit #Islam URL,0
they make more drama abaut drones than peopel hu die abaut hunger or executions by isis. fuck off,0
I'm not religious either but they did find the perfect word to respond to your comment: amen,0
"I hear you but is there a case to be made for ""sacrifice today for a better tomorrow"" ie work hard now, retire early and then spend time with family?",0
"+Serpens _ its not Mexicans fault your aunt is a dope fiend, they didnt make her do those drugs that bitch willing handed over her money😈",1
@user Men are trash,1
"I'm a straight guy, and I absolutely love going to the pride parade. IMO it's the best street party we have in a year. The music is awesome, the drinks are delicious and surprisingly strong. Just a great time with a lot of positive energy.",0
I'm not letting go of the lesbian ribbon despite changing my icon a lot ahshdh,0
"nigga talmbout ""ima trap you"" , how if i'm not gon let you fuck ? hmm ? how ?",1
Lmao trash ass commies. aMeRiCaNS fAT AmURIcAn sTuPId.,0
"Son of all your fucking mother, I hope you die stupid, chinga Your mother",1
They hate Christianity because they know it's the truth!!!! Repent and accept Jesus Christ as your Lord and Savior. He died for your sins.. He is the ONLY way. These people are deceiving you all!!!!!!!!! They all worship satan.,0
... The soft a argument is b.s. argument. If I call you a fucka instead of a fucker it has the same meaning. Its easy. If you arent black dont say the word. At all. No matter pronunciation or spelling.,0
"MAGA OFFENSIVE America will never be saved. Time is up. Babylon will fall. God has had enough. Trump, Q and MAGa give false hope when in fact they are part of the plan to bring in the anti Christ system.",1
Bruh this nigga sending shots like amotherfucker,1
"@user @user Iono who the fuck that is. But your tweets tell me enough lmaooo. I dont want any of your mouths near me, I might catch sumn, yall can have that. That pathetic ass comeback. You just salty cause mgtow dont kiss yo ass and enable you. Nah. Yall not special. Get over it.",1
"House passes immigration bill to protect 'dreamers,' offer a path to citizenship – The Washington Post URL",0
You could of at least hit me harder you faggot URL,1
"How do you think genocide starts? Full blown, out of the box? NOPE. **It starts with RACISM**.  10 Stages of Genocide - URL",0
I would love to fuck someone so deep and break them pussy and make them my slut URL,1
love hearing an inferior fag bitch sub slut choke on an Alpha's dick...its music to my ears.. URL,1
"i am a male and i had to straight up drop a bunch of my 'friends' after the ""Grab em by the pussy"" and 'locker room talk' comments came out. every once in a while i will cross paths with someone and they act like we should be around each other more... i just ask if they still support the currwnt situation and then they remember why i stay away from them. this includes one of my brothers, my dad, and the best man at my wedding. it is not the happiest thing i have ever done but i am much happier now, my self.",0
crackhead ass stank ass fucking bubble headed ass bitch URL,0
"Born Indian, grown in UK, married to an European and consider myself a truly universal being.",0
"wtf how retarded are you guys. Asking ""does size matter"" is sexist or wrong huh.",1
"I feel not bi enough.. dealing with it right now as everyone is all ""happy pride month"" and I'm just like.. normal feeling.",0
"I cant belive these fucking retards exist.  Fuck her, and fuck that chair.  You know what? fuck you, ill fucking standspread get a chair for that , bitch.",1
I love athletic girls. Very sexy.,0
he might be a faggot,1
Internalizer misogny my ass 😂  Op is a thot for wanting to cheat. That's a fact.,0
Are you a faggot?,1
If your dick game so good that I've to do this typa stupidity stay the hell out of me.,0
Big tiddy anime girl sucks your cock makes you cum and sits on you,0
Then tell all the man do not compete in grand slam bitch. You just play 2 set to win and man 3 sets and PRICE SAME AS MAN. So thats equality dumbass??,0
This is the type of faggotry I can't stand,1
This bitch talk too much,1
"Next up ""SUCK MY COCK HOMOPHOPE!""",1
God I can't stand faggots.,1
"Nah, I ain't with that gay shit",0
"""Niggas ain shit "" Ight bitch who date white men 🙃",1
Being a slut is a choice. Being fat is a choice. Having a micropenis isn't.....so if anything it's even worse than the other insults.,1
"1. He used a small piece from this 2. A cypher is a freestyle in hip hop, always has been.",0
@user Why did anyone think allowing hordes of savages like that into the western world would be anything less than a disaster? I cant wait to see the news of citizens rising up and getting rid of these people in their own way bc their leaders have failed em,1
"Nah lmao get raped tho, have a good day crack head bitch, watch yourself walking home at night I might rape you lmao",1
I wish every person on the planet died of anus rape,1
Fuck that nigga that you love so bad,1
"Trump's cultists are threatened by empowered young women speaking their mind & expressing themselves. Turns out that they don't approve of serial rapists that hang out with billionaire pedos, presently stealing & caging little brown babies at the border. And they don't approve of being treated as less than their male counterparts",0
"@user @user Religions should be forbidden. Every religious zealots would have kept us in dark ages if they could have done so, they tried, & failed. We should burn them all like witches or keep them in Church ghetto style area & go ahead with technology human enhancement for everyone else.",1
Classy lady @user  #milf #mature #femdom #mistress URL,0
"This is what happens when you have isolated yourself in a frenzy of populism from friends and allys and instead have to do the dirty work for an angry Orange toddler the other side of the Atlantic who is desperate for a distraction. Toddler Trump can't stand the deal with Iran because black man's name is on it, and now England is being humiliated by religious fanatics who until recently were minding their own business and persecuting women. We are reduced to this weakness because of 17.4 million idiots.",1
"It's not the same guy, although the German that Upham let go does end up shooting Captain Miller, who dies minutes later.",0
So... are Polack jokes back on the table?,0
"As someone who is fighting with the urge to come out (so how can I talk, right? lol) why dont you want to come out?",0
"@user This would make sense if racism no longer existed. Unfortunately, it still does and it still requires our attention if we want to reach equality.",0
Wait.. i didnt know batalon's a filipino,0
"Man, if we had a total ban on slavery then people would still be trafficked. No sense in doing that either.",1
Get a job and your own place first faggot,1
Bitch i bet you get off on when a slut kills her baby in the womb so she can be lazy but webeat a animal like most species do and we are immoral. Fuck off,1
