text,label
What do you expect from tranny extremists?  There double crazy.,0
Fuck that nigga that you love so bad URL,1
"Its a woman doing or in charge of the documentary. Dont watch it guys, all women are evil and AWALT. I bet she wouldnt care if men in her family, husband if she has one, father, uncles, grandfather or son killed themselves. Shes a woman in the end so that means she is subhuman and the same as every other slut in 20s and 30s now. Btw your moms and grandmoms who give you advice not to marry in these times are hoes and AWALTs too. /s btw I consider myself mgtow 110% but not everything in life is black and white. There are exceptions to the rule.",1
"Religion, what a waste of time and only used to control those who are easily influenced.",0
@user can you not give these women exposure?? You all know this doesn't make sense. This is one of the reasons I had to stop watching your station. Why help spread their ignorance?,0
They're all meth heads now. I guess that's what qualifies as being a real man to something like you? Cuckold? That insult doesn't even make sense.  You're too stupid to live. I can't wait until we start hunting you cunts.,1
Definitely a beautiful cunt that's been made in heaven and sent to earth to torment men with 😈🔥🔥🔥,1
"I'm so proud of our youth and this generation. Thank you for breaking the stereotype beta3 al 7abobat when they say ""Al Jeel alkaslan w jeel al internet al ma nafe3"" We are out the voices of Sudan and we will prevail inshallah.  #IAmTheSudanRevolution",0
A Lot Of Niggas Turned Gangsta After High School 👀,1
"+Jessica N I don't think you are a fit to be a parent, if you get pregnant you should abort your child.",1
It's just an ugly Arab with that.,0
She'll never know who you are you mentally ill fuck 😂😂😂,0
"Oh and by the way, I AM half black. So save your insults.",0
He probably thought it was an insult to all the trolls making fun of him with donations. He obviously thought wrong because all it did was make him look like a raving mad sodomite.,1
@user @user Especially dangerous if you're a black baby in NY #SystematicGenocide #Blacklivesmatter #AllLivesMatter #DefundPP URL,0
You're husband fucks another woman?,1
"I can guarantee you would've just sat there and pretended that it wasn't happening, fucking white bitch!",1
cis dykes being surprised that I'm good at eating pussy is a transphobic microagression,1
Pussy so wet I'd slide right onto your pole! #wetpussy #hotwife #horny #milf #cumslut #cumdumpster @user URL,0
"If Chelsea didn't get to win the Europa tonight, i owe @user airtime and 2 random @user fans that were confident enough to comment. #UELfinal #Chelsea URL",0
Tag 'em and bag 'em if they don't come peacefully. Send all illegals back one way or another.,0
Good I'd rather have all of em dead in a pile first rather than to let them into the great USA. Get the fuck out of my country you law breaking human bags of shit.,1
"It's always Pride Month at my house Pan, Rainbow and Trans flag always there to greet you URL",0
This long haired whore was there looking for a cock & found one. That cock did not make any conversation at all. Just lower the pants and bare fuck. The cock knew the way the whores love it. Just fuck hard to shoot in! URL,1
"@user You go fuck your self bitch! You are Anti Semitic, Anti American! Get the fuck out of Congress you disgusting bitch",1
I just want some dick 😩but who can provide that and lay it down on me the right way 👀👀👀👀 I just wanna feel the pleasure 😕 #comegetit #fuckmeright #squirt #solo #fuck #pussy #masterbate #fingering #facetimeshow #meetups #dickrates URL,0
Chinese race seems to be a spawn of satan himself..the way they live and the cruelty they inflict on animals and other race humans alike is mind boggling and cant come from a human race with even an iota of good in him,1
I dislike most malays cause they're judgemental,1
"I know you're joking but that kinda hurts me, maybe I'm just being sensitive but Muslims aren't fucking animals, they're just people that are trying pass the day, like everyone else. You realise that some Muslims have killed themselves because of comments that are similar to yours, so don't be a prick and if you have nothing nice to say don't say it.",0
"@user @user @user SUCK DICK FR FR, WHITE TRASH FUCKS",1
@user aight bitch you better dm rn before i go and beat this kid up,0
"Not at all.  Some men arent into sex. I know someone. I never said they were the majority but they exists, and stop pulling stats out of your ass.  I agree them healing is getting better but the statement *no one wants someone who hates sex* is blatantly false.",0
"What the fuck is even up with this fat fuck, fucking pathetic little bitch.",1
You got a leaky brain. It drip drip drips into your tits and your lips. Better seal the leak before you forget how to spread your legs. What good is a bimbo too dumb to lay there and get fucked?,1
"Without the immigrants population gasoline is 43 cents a gallon, a house cost 60%less, 500% less in Los Angles, milk is half price, eggs 9 cents each, Beef 39% less, tomatoes 25%less. Overpopulation makes you poor. Trump and Socialized Medicine for USA 2020",0
"Lovely picture i just wanna know that how people see interracial marriage in these years. I am Asian btw so I don't know anything about racism or history. Just curious about this, I wanna feel the atmosphere throughout your story.",0
"One of my friends is in a relationship like this and it drives me nuts when she posts pictures of ""her and her wife"" who is a ""trans butch lesbian""....Honey, that's a straight man and you're bi so maybe don't call yourselves lesbians 🙃 Everything she does is or has to be ""gay"" and I don't have it in me (yet...I may yet snap, we'll see lol) to call her out on it. Being gay isn't a personality trait (especially when you're not exclusively same-sex attracted) and being the ""most woke"" isn't necessarily the best thing.  Sorry, I have no one to vent this shit to lol",0
Nobody: Literally no one: James: THAT WAS RUDE AND HOMOPHOBIC!!!,0
simp behaviour is screaming from you cunt,1
"Stick It, Fuck It, Breed It, Leave It #bareback #barefuck #barebackmanila #gay #gayorgy #pinoy #kantot #pinoykantutan #alterworld #rawislaw #bbbh URL",1
I'll eat an unlubricated jean jacket before I block a bitch off my nigga page,1
@user JUST REMOVE THAT COUNTRY FROM THE PLANET AND GET IT OVER WITH WORTHLESS,0
I'd fucking bend her over and fuck her holes and cum all over her face.,0
"@user Remember people, why does this ignorant person or should I say, the ignorance of this person surprise you?! She is a whore who had to get fucked to get her first promotion. Real simple people, she's a fuck Rag.!",1
Equality is very important 😍,0
The Mormons did it,0
People Want Mario Lopez 'Cancelled' For Saying Parents Shouldn't Raise 3-Year-Olds As Transgender | Daily Wire URL,0
"""Nanking was raped? How awfur! We should find out who did it immediatery!"" -Japan",1
"Lesbian molester types. 100% of them will grope another character tits and the narrative will tell ""its okay when girls do it"". I'm looking at you, Angie from Cold Steel.",1
Hold it right there. You've swallowed about 20 million berbers with this. So many berber ethnic groups like the Kabyle people in Northen Algeria which I'm part of.  Fuck no! this map is an aberration! And one that will cause so many fucking internal conflicts. I for one would rather die than live under this atrocity.,0
"being a LESBIAN doesn't change the fact that i'm still a girl. but just the fact na ganito ako, TAO pa rin ako marunong masaktan at umintindi. #JustLoveFrankiAna",0
"DONALD TRUMP SEND YOUR TWO WIVES BACK TO WHERE THEY CAME FROM !!!! AND IT WOULDN'T BE A BAD IDEA FOR YOU TO GO BACK TO GERMANY UNFORTUNATELY, THEY DON'T LIKE YOU EITHER, THEY LOATH & DESPISE YOU IN ALTSTADT GERMANY, WHERE YOUR FOREFATHERS CAME FROM I WONDER WHY ??? TRUMP HAS BEEN EXCRETING THE FECES OF HIS MORAL DEPRAVITY INTO A RACIST SEGMENT OF A PSYCHIC CESSPOOL OF A BASKET OF TRAILER PARK DEPLORABLES. THE REPUBLICANS CONTINUE TO EMBOLDEN THIS BLOVIATING IGNORAMUS TO GO FROM THE RIDICULOUS TO THE SUBLIME...",1
"Anyone know where we can buy a squadron of planes and or tanks? RPGS? FIRECRACKERS? Any military vets out there willing to share their knowledge and expertise of the battlefield? Is there anyone out there???? Why have we allowed the Asylum escapees to rule OUR world? These things running our world... foreskin eating pedophiles. Psychopaths. Sociopaths. These things are human. Not demons. Just simply , greedy , lowlife , white ,anglo saxon parasites. Throw in a Jew , Jesuit , Catholic or Christian here and there... It's people doing shit to people.",1
Trump is right - these maggots of color should gtfo,1
"Well, I see nothing wrong with that.  I do think it's wrong he's a piece of shit who actively discriminates women, so I really doubt he'll be born ""a chad"" in his next life as he hopes. He'll be lucky to be born a cockroach.",0
"Trash human? Like using the Lord's name in your ID? I've got a fucking rope for you, too.",1
"Trump voters tend to hate all strong, successful women. Because beta incels are terrified they are going to continue to be powerless, ineffectual little wimps living in mom's basement.",1
Dude looks like Sean Murray's older pedophile cousin.,0
@user Harry & Meghan don't have worry about a royal family . The way I hear sharia law isn't that far off from the #UK believe me they will get rid of every #RoyalFamily member so who cares about the imprint of eco system the world will be non existent 🤦🏻‍♀️,1
its the demorat created this hell hole on our southern boarder by funding and organizing the caravans and bring them up to the southern boarder …….come on honey grab the kids we are walking up to the USA today no way organized and funded by the demorats,0
Ahmed Hashem fuck Gaza you stupid Muslim,1
"We need sterilization of 3rd world countries, until they come into the 21st century.",0
It's dumb shit like this that makes me miss the days of 360 xbl when no one got banned and everyone was a faggot that also fucked everyones mom while fingerbanging your uncle greg.,1
this guy is a local hero to all the trump humping white trash that lives in the area. the tri cities area is a majority of mouth breathing inbred rednecks. sorry not sorry,1
"I hope you never have kids and/or are forced to confront the choice between fleeing unlivable & violent conditions in your home country, only to be locked in a concentration camp in the ""Land of the Free"" & judged on Twitter by a click-thirsty crypto Nazi. URL",1
Fuck that dumb bitch,0
*Nazis all over the country perpetrate hate crimes including setting synagogues and mosques ablaze* Posobiec: HOAX! FALSE FLAG! SMEARING OUR NOBLE GOD EMPEROR! *One bus gets burned* Posobiec: TERRORISM! CALL IN THE NATIONAL GUARD! MARTIAL LAW NOW! ROUND THEM ALL UP!,1
"1. I am bisexual.  2. Many of the artists, producers, graphics designers, videographers, ect. that I support are LGBTQ+, not to mention all my friends.  3. Good luck booking that stage you speak of. URL",0
"Keep grasping at idiotic straws to justify the murder of kids.  I'm loving the meltdown from morons like you, just wait till gay marriage is over turned...",0
"Because there are facets of masculinity that are normalized or encouraged by society which are straight up fucking toxic, for men and the women they interact with",0
"'Transgender' athletes have 'intolerable' advantage over real women, new study affirms URL",0
You're that nigger faggot pussy in school,1
"""A crime can be fixed and treated"" You sure about that buddy? Talk to the millions of UNREFORMED violent criminals in prisons around the country.  This faggot and Joe Rogan and everyone else who says anything but ""pedophiles should be killed"" should be killed.",1
The UAE has done its best to help the people of Yemen since the beginning of the war,0
Momma Curry ain't having it. 😂 URL,0
Shut up and lick my fucking pussy! I'm tired of reading your smart ass responses!! You need to be tongue deep in this reptillianne pussy and stfu cunt!!!! Learn to fucking read and write you illiterate dumb motherfucker!,1
"ALL OF THESE GROUPS WHO ARE NOT GENETICALLY DOMINANT, WHO THEY CALL BLAK, ARE ALL ILLEGALLY HERE ON THIS PLANET. IF THEY ARE NON BLAK, THEY ARE INVADERS AND DESTROYERS, THEY ARE THE VERMIN OF THE SCUM!! ALL NON BLAK PEOPLE...",1
"#Motherfuckers stupid retards Abwehr degenerate German European Israeli ""Jews"" which have nothing to do with the real Hebrews decided to hijack the Western history and CIVILIZATION! - Google Search URL",1
'Two girls piss themselves',0
@user Shut up. You fuel this shit. Skank.,0
@user Slut shaming everywhere,0
"Trans students are not a threat. This move means school districts can continue to allow trans students to participate in school activities, and use restrooms and locker rooms, that match their gender.",0
Your wife is a #fatass #blonde #bitch who takes monster #bbc #anal and #asstomouth #cuminmouth URL,1
"Like phfornz commented - It would be a true triumph if we had a race-based policy prohibiting Filipino representatives, but we don't. Therefore, all they are celebrating is a right to determine their political destiny in a foreign nation. A lot of r/newzealanders don't have a problem with this. But I do.",1
"So great to see how that crowd proved, that they are truly racist. Even the orange clown throw them under the bus afterwards for their chanting...Go on exposing, that your full of hate and so very unamerican...",1
Bitches really is stupid dumb ass bitch,1
"""NIGGERS"" WOULD HAVE A HEART ATTACK",1
"I posit white supremacists, by nature, advocate violence.",0
"she calle them niggers, well hope that chink bitch dies in a fucking fire how bout that? black were here in usa before asian so tell that asian hoe to go home",1
"In my experience they *are* all of the above. White, racist, unintelligent (except maybe a few), and a drain on tax dollars.  Source: have extended family from rural GA and spent a lot of time there as a kid",0
Why is it always the black guy that dies first,0
"Sounds like you're a brain dead disgrace on the black community  Thugs, idiots, ratchets, gays, all need to be purged from the black community so we can regain our place in this world. 2/3rds not gonna make it 😁",1
Fuck her pussy and cum in her ass URL,1
"@user 🥴damn son u cheating on Jay , but i ain't gon lie that nigga Rico issss surgical with them clippers 😂how much that nigga charge ? Cause that 20 I give jay every week get the job done 😂 Rico like a I'm going to prom kinda barber 😂",1
With this they have verified that their masters are #IslamicState  Hope they knew how women was treated under 370,0
Jaden Smith perfect example of being gay is in fact a choice he used to didn't laugh like a female n act all fruity,1
"And you eunuch whores wish you could lick the shit coming out of your white female masters ass and get mad when you can't get to do that, lmfaooooooo.",1
"minhyuk got the pride flag on stage, wonho said to a lgbt monbebe that sexuality is all different from person to person and not everyone understands it but that they should not give up and jooheon said they are right in what they are thinking all on pride month. im crying",0
#fuckmefriday Ride this #bbc baby till you reach that orgasm!! #blacked #blackedraw #blondebunny #cuckold @user @user @user @user @user @user @user @user @user @user @user URL,0
on her dickhead,0
Rate her boobs 1-100 Rate her pussy 1-100 Rate her body in general 1-100😁  Should she take her high heels off? 😁 URL,0
"Get a microphone and put in my fist, cuz a bitch ain't nuthin' but a dirty bitch.",1
I'd suck her tits lick her pussy and fuck her from behind,0
"I'd much rather see them locked in cages than let loose to child traffic, rape, rob, and murder. If you want to end it, bounce them back over the border... or execute them for breaking into our country. I don't care which. URL",0
"Tired of hearing about religious ""freedom"" already. Do they mean Muslims facing aggression here? Do they mean the Uighur concentration camps in China? Or the death sentence for atheists in the ME? Or is this some partner policy of the white supremacist vote in the Senate? #auspol",1
That's assuming incels can get enough gbp for tendies.,0
I won't stop until that fat faggot kills himself,1
i remember when i got called an incel and got told boys can't be raped 🙃,1
What About lmao I'd rather be good looking than ugly and cope by saying I'm more of a man for not caring.,0
"""THIS IS FOR RACHEL YOU BIG FAT WHITE NASTY SMELLIN FAT BITCH WHY YOU TOOK ME OFF THE SCHEDULE WITH YOUR TRIFFLING DIRTY WHITE RACIST ASS YOU BIG FAT BITCH OOMPA LOOMPA BODY ASS BITCH""",1
It's the extreme of humans. Most extremists are shit people. They're just using a religion to justify their actions.,0
@user Shut the fuck up degenerate asswipe,1
@user Pussy ass bitch bitch,1
Today a large portion of generation easily moved with the movie like avangers and Kabir Sing.They hardly response on movie which had enough contribution to build up a strong thoughts of Indian untold history.,0
And you deserve even more faggot. Eat shit.,1
Looks like you need a fat cock shoved up your ass,1
"Give me your tired, your poor, your religious nutcases, your criminals ... the wretched refuse of your teeming shore ... and finally allow Europe to be subjected to the moronic whims of this wretched refuse.",0
I've seen the gay parade New York City by accident I was driving a limousine at the time and got stuck waiting for it to go by I'm pretty round but that thing disgusted me guys on trailers in diapers dancing around what the fuck is that all about,1
I'd dump a load in you and then dry my dirty cock off with a fist full of your hair. You're a cum rag.,1
"Lmao who the fuck is Taiwan? ""Lol lemme just tell this super power to repent, they'll listen to me!"" Fucking idiots.",1
"yea, every group of 20 year olds has that faggot in the group. virgin at 22 and grossly compensating.",1
"I didn't even know she was transgender, cool! She looks fantastic",0
The girl converted from Asian to black. Pretty cool,0
James has kids ? And a wife ? I thought he was gayer than gay....fruitier than fruit. My bad.,0
"Sorry , but Im here to inform you that Her home is Somalia, not Minnesota. Shes an Un-American Ni**er Wench that needs to be striped of her citizenship status and sent packing back to Somalia and if she cant go there then off to Mongolia for the mongaloid.",1
Ain't nothing but some faggots in the gym round this time I can't stand it,1
"""Turn over your guns America. Go die for zionist wars instead"" schemes the jew URL",0
And I don't want angry young men complaining about Jewish people and gay people until they are radicalized online into taking their sexual frustration out with an AR15. But I guess you can't always get what you want. 🎶🎶,0
Woohoo more religious propaganda. Biggest SCAM ON HUMANS IN ALL OF HISTORY IS RELIGION.,0
"MaddRespect to you man, it feels good that overseas pakistani actually still care about Pakistan despite the fact that they are living good life abroad. God give you all long life.",0
These women are radical racists and anti-Semitic!,0
"""I didn't know that black people were humans and shouldn't be treated like livestock"" -The dumbest piece of shit in existence.",1
Gotta love a woman in a suit;almost as much as being ***in*** a woman in a suit!,0
It's the gays and loss of prayer in schools and video games and...blah blah blah. They are fucking idiots or just evil.,1
I just want black people to be wiped off this planet.,1
I agree with Kevin the tweet wasn't racist it's a fact if you don't like USA go back where you came from ✌️,0
"THESE ISLAMIC TERRORISTS THUGS SHOULD FACE PROSECUTION FOR INCITING VIOLENCE & THREATENING THE POTUS, OR ANYONE ELSE. THIS THUG IS AN ABOMINATION. LIKE JEZEBEL, THESE JIHADI JEZEBELS WILL BE CAST DOWN INTO HELL.",1
"Because se an entire generation was mostly raised by single mothers with no father figure therefore creating softer guys. Also If you ever were masculine it was beat out of you because doing manly stuff is ""toxic masculinity""",0
This is how many people want them to do stereotype videos again ⬇️,0
"@user @user God & Allah are the same, you illiterate cracker.",0
i'll slap the shit out of a white supremacist,1
HAIL SATAN! May Christians be killed slowly and gruesomely!,1
Woman are effing disgusting. Should have their hole stitched up like they do in some African tribes,1
Savages cannot live among civilized western populations. They can never assimilate when they still wipe with their hand and have no moral center,1
They need to be deported there illegally here,0
Jesus.. another fucker with a boner for Candace Owens!,1
Imma fuck the shit out of this bitch ass motherfucker,0
on gay pride day too... we all love brendon dude,0
I love the brown girl,0
"Historic! Muslim Women (Protection of Rights on Marriage) Bill, 2019 passed in Rajya Sabha.  Congratulations to PM Sh @user ji for giving the life of dignity to my Muslim sisters. #TripleTalaqBill",0
This fag needs to know his place by masters and followers. RT him to make him a faggot for everyone who likes fags,1
Fuck a bitch,1
This is all the proof I need to see for the bimbofication of the American male. We're nothing more thab a bunch of closeted transbians.,1
"Just like I predicted the media have already forgotten about the knife wielding man who shouted ""Allah Akhbar"" while stabbing a person in Norway. I was just 10 minutes away when the attack happened in central Oslo.",0
@user @user @user @user Real niggas know lmao,1
"Please don't deport them, kindly drop them off at respective sanctuary cities. They will wholeheartedly be welcomed and cared for there for free.",0
You chinky eyes piece of shit,1
">I grew up in Alabama. Most of my childhood friends were homophobic. Like tulsi, they learned as young adults that that was messed up and wrong.  It takes getting out of that environment to even see how messed up your ideas were in the first place. I'm glad you're pointing this out because it's not something a lot of people actively consider, and it's important that we do give people the opportunity to change",0
This but in Nigger lesbians URL,1
Go find a woman who isn't a whore.,1
Fucking bitch ass kids nowadays need a ass whopping URL,1
Police enter a black woman's home with out permission... URL,0
Ru a TERRORIST? 😮😮😮 when will you bomb Iran? Soon? Pray tell YR plans to kill Iranians,0
nah she is a racist cunt she is a level above just a prick,1
Zenigundam oh shit the beta male is here,1
cuff her and fuck the bitch out of her URL URL,0
India's most beautiful Jr Journalist @user Ji's favorite actress #KanganaRanaut is a brilliant actress. Go #Bharat & Watch #MentalHaiKya? Array Nahi #JudgementallHaiKya?..!:),0
"As if a bunch of racist ""old white men"" Law Society Benchers had the gall to raise an issue with ""squaws and niggers"". ????? Who does that but an ""old white man"" lawyer???",1
Any of my followers want to train a sissy fag? #sissy #fag #hypno #girly #limp #cock #chastity #sub #slave #pink #bimbo #whore #sissyhood URL,1
Fuck the normal fags.,1
"+jewboy you're not gonna fool anyone having your channel public and making comments like that. You're a 20 something year old bitter, pathetic, antisocial virgin who spends his whole day on reddit talking about how whores deserve to die. Don't act tough",1
@user That's your type! That's your type! White boy big! Ooh that's white pipe! URL,0
Imagine having a gf. lol what a loser am I right guys,1
"I'm still kinda scared to come out to my family I don't need to I just feel it would lift some weight off me, I'm M 20 and still no one knows I'm bi didn't think it would be this daunting.",0
Just be my slut and fuck me dont ask questions you fucking whore!,1
"Your pussy was made for breeding by cocks, and to be filled with cum by cocks fucking your pussy balls deep. If you're not lucky enough to have a male human cock inside your desperate pussy, you'll settle for canine cock. In fact, it's what you crave, realizing that your cunt controls your brain. Go fuck some dogs slut, take pictures and tell us how much your pussy was in heaven.",1
"Agencies are not moving the dial on #femaleleadership. Great read on #diversity and #CannesLions via @user:   ""Data from @user shows that 12% of women in the creative industries are looking to leave the industry within the next two years.""  URL",0
">But instead, DICE is wasting time and resources making female elite characters... Literally the only female elite but go off you incel",1
Being gay just fuck dudes and call them faggots is a good bit,1
Fat ass pussy 😈 URL,0
How's their borders? Oh and what type of terrorist do they have?,0
"All I see is a fluffy, unkempt, scared pussy. Come back when you want to actually act like a slut.",1
"It is definitely bullshit, because as a man, you have absolutely no say in the matter. But at the end of the day, that fetus is half of the man's genes so they *should* have equal say on the matter. But idk what you could do to make that a reality however.",0
"They haven't always. Those Sumerian neanderthals only started really taking over about 2000 years ago. Those inbred cockles are only at the top by essentially cheating and using cheat code in the book. And look what is has spawned, a hell on earth. Congrats to them. The filth of the world runs it. Congrats. And now we have disenfranchised black and latino people joining them, thinking they need to be like them in order to gain power and set things right. This is just sad.",1
