text,label
"All women need to be listened and have their opinion taken seriously.  A healthy relationship involves listening and letting your fears go, taking their believes and opinions as your own.  Not listening to women or respecting their opinions is senseless and ,in fact, when a woman says no or disagrees with a man what she really does is testing their partner to see how will they react. The correct response is to always listen to them, whether they are wrong and you are right or viceversa - end of discussion.",0
Every day these fucking goats have to wake me up at dawn,0
Come with us for a laugh at women's complaining at unreasonableness.,1
I do not want to associate with lesbos,1
Infidelity is what they are known for fadis fucks.,1
"We shouldn't talk about these traitors? Other than that they stay far away from us? They are done. It's not like we will ever miss them. When you come here discussing traitors, it should be good news like they all decided to get their shit together",0
i'm not sorry i got your pronoun wrong because idc,1
Integration is good until you get Gypsy neighbours,1
"Is this about the European no go zones? Yeh, they dont exist. And refugees dont create segregated ghetto's. Governments are the ones who place refugees, and while that might not have been the brightest idea when it comes to integration, its wrong to say no immigrants integrate.",0
"blacks who want to be around blacks= good. Whites who want to be around Whites = Bad , double standards !",1
Okay then. Fuck all bame schemes. This is the discrimination process by which you choose to hire people in the real world. We are not equal. Words are relevant. We are not all the same. White people are being discriminated against.,1
"not generalising over such a big pool of people is just so stupid and just seems weak minded, not scape goating. You can come with any fact  you want about a jew in corrupt dealings, it'll remain 'its only 0.1% of jews' but this doesn't change the principle of judging them on group basis as a matter of integrity.",1
All b l a c k Americans should return to Africa,1
fuck you think your life is bad mine fucking sucks,0
The one I'll marry is a man who is brave enough to beat up homophobes,0
Those Iraqi Mossies are rebuilding damaged churches for ISIS to lure back Christians,1
