text,label
Theres nothing they can do about it&but Gay people are just not clever,1
I wish the holocaust had happened for real,1
"Please remember that you will never be a true traveller no matter how much you want to be, we Roma are born its not a lifestyle choice",0
"My dog is blind, deaf, and missing most of his teeth, but he is the best boy!",0
"I was travelling through italy and I founod great nighlife, beautiful little towns, friendly people. Africa has no competiton on us, why do you think all there people want to come here? They see our good lif and it's only a short journey and they risk it. but they should be stopped or else milan will turn into morocco",1
Fucking hell ya!! BURN THAT DISGUSTING FAG RIGHT NOW!!!!!!!,1
Ching-Chongs are repugnant,1
All black men look like a black rabbit,1
This computer is utter garbage,0
it is incorrect to say 'I hate black people',0
"All we get from believing in multi-ethnicity which is multiculturalism shit of not being integrated in society well the summary is that Africans, with few exceptions, will never assimilate in a European societies.",1
"Woah how much has she aged...I seen her once on 3 years ago....Clearly the years haven't been kind. I can't stand her trans hubby and his huge floppy tongue, ugh",1
my besty stupidly let this family rent her appartment in maidenhead. It's now wrecked beyond belief and she can't get the dirty crackhead family out. It's not a surprise but now she regrets ever getting involed with the likes of these people,0
"I agree. My view is that they just have the right to be dumb as long as they don't bother me. Whilst I think it's a disorder as long as they don't hurt any body else it's their decision to seek help. To me it would be like trying to claim I'm biologically a dog. I'm not and my genetics say so just like my gender. And if anybody tries to say that gender is defined by the society, they're just further proving that they're delusional since our society's definition of gender is you biological sex. So according to their own definition gender means sex.",1
"They're not about controlling women, they are about not truly caring.",0
I'm sick of this government of cockroaches,0
"argh dark as the night itself the assassin readies himself for another attack… he spots his target in his cross hairs and POW he has pounced, ready to put his massive arms around her throat... whether or not he is ready for his life to end.",0
"""A mohammedan mayor we must be mad ! British and muslim don't belong in the same sentence """,1
"Serously, FGM is sick and needs to be illegal NOW...girls are people fucking fucked up with a scapel everyday.",0
Immigrants should leave and never return,1
Fuck Covid!,0
"Well, it is just another one that needs to be shot in the dick",0
This pussy bites back,0
"Most niggers are ignorant, they don't know that Kamala Harris will do nothing for them.",1
old people are great.... at being tedious!,1
violence is endemic to the police,0
ALL NIGGERS HOULD DIE - this was the message my daughter got today at school,0
don't have much experience with deep aboriginal communities but from my own observations I can tell you that is a fair assumption. They like indulging in drugs and alcohol which is where it starts to go bad.,1
The hidden fact is that Jews also did 9/11 to get the US to go to war for Israel and displace Muslims and create refugees then which the jews told the US they had to take in. Thanks jews,1
"On how many occasions has she reported that ""white men"" (who are neither truly WHITE in spirit nor men) can't stay away from slopes? I have bad news for her. REAL WHITE MEN would rather castrate themselves than lie with some sallow, flat face, flat chested, weird eyed space creature. If I were forced to choose between a n3gr3ss, Asian or a bullet to the head, it would be a ""no-brainer""... literally.",1
"they said native americans deserve to be beaten to death, what scum",0
Just read a comment from another site comparing The Proud I suggest you guys watch this documentary about or friends the blacks (a 1979 film). Look up a photo of it. LOL. I don't know the backstory in the movie but they explain the race realism arguments and why we are right about them.,1
"These laws were written by woman hating men. They have no use for logic which iis shown here. They wanted to see women suffer as much as possible. Through their strong lobbying efforts, they have succeeded. Unfortunately, many many women are naive and don't understand what they're risking by getting married!",0
grown ups can only get married,0
"The ships are on the Libyan coast. They are in radio contact with the smugglers. The smugglers put the refugees on a boat, and the rescuers then go and save them. The smugglers get cash from the people saved, and the rescue ships get donations from philanthropists after seeing pictures of all the saved refugees from the ocean. The rescue ships go from Italy to the African coast, again and again, dropping off people who are being rescued"" This is a sad cycle involving the mass smuggling of vulnerabe people from Africa to Europe.",0
Obama is terrible,0
The NHS is trashy,0
Kind of hard to do that when bellends like you won't quarantine.,0
"It would be way funnier if it was 5.56 instead of paintballs, and aimed at pakis",1
IMAGINE A WORLD WITHOUT JEWS... now let's make it happen!!,1
"I've seen forums where they talk about how now that they're a woman, their make believe period syncs up with their wife and daughter's. yuck",1
"He spoke absolute truths to her, and she was just looking at her phone with that dead fucking face and laughed. Im unsure about why he wasted his time, he isnt going to recondition her from societies lies in 5 minutes, it ever. Women are so stupid, tbh",1
We dont want no halfros round here.,1
Oh my God why are two high school girls bathing together,0
saying black lives matter is a fucking lie,1
"your 'hard questions' have nothing to do with the thread, jackass, so just let us talk about those monkeys without shitting everything up, goddamn it. it was a good question. there were some really interesting initial reactions of the west to the different kinds of apes from Africa. fuck it, anyone still want to talk about ops question? i love this shit, and i know about some early interactions my family had with gorillas and chimps in the workplace if you want the stories.",1
all wogs do is shit and lick their balls,1
Everything is also getting worse for gays. Homophobic muslims are protesting against them and our libtard govt isn't doing anything because they don't want to appear islamophobic.,1
"A man is sitting under a tree. A branch breaks off and almost hits him. He looks up to the tree, shakes his fist and yells ""Damn you!""",0
"slavery literally does noot exist anymore, it's historical. How do people get so upset just cos their ancestors were in chains? Get a life, find something that matters to campaign against black people",1
I think memes like this one even though the're funny have a harsh underlying truth about them. I'm glad I see it but I really hope I don't get blinded again,0
i hate black grapes,0
Chinese people were the ruination of this country,1
The UK is so embarrassing. Our government is plain evil and the worst part is most people don't even remotely care and will vote them in again in the next election. Thanks baby boomers!,1
woman's sweetness and subservience is the most important thing in women,1
Like...the absolutely insane amount of denial that would have to be in that person's mind to not correlate immigrants and invasive species is insane,1
"Urgh, i beg you put your fishy stinky jacket away drowner",1
This chinese are a plague that has ruined the world,1
"Women are herd creatures, and if you can easily control the herd you can completely control the women.",1
Watch this video about Chaldean Catholics (weird Brown Iraqi Christian Refugees) Celebrating the Assumption in the US,1
I feel like people would start to think you were gay if you didn't use gay as an insult. Gay use to mean happy but now it means lame so idk who cares. Not being able to say gay is actually gay.,1
Washington Redskins and Cleveland Indians are considering changing their names.,0
Politicians don't appreciate men. Don't want to call them scum but they do not see us as humans. We are tools. Simply resources for them. If you study nature you see that some species eat the workers after mating. I don't think the politician species is designed to care for us. It seems they are all selfish beings.,0
Muslims hate buddhists,1
in di an s will be physically gone from this place if I have my way,1
"I don't like leaving the city centre, outskirts are full of hyenas",0
are you actually blind? or are you blind but you can see a bit?,0
Women all deserve a rich man who pays her way after she had her fun & is ready to settle down,0
it's a shame that you now have to listen to gay people like that at your school. In my day she would be smacked down.,1
Immigrants should live in mixed areas of the cities and should integrate in the society more as this will benefit them in job hunting and will satisfy their needs,0
"Yeah. Probably why Trump didn't add a 10% federal fee onto every transaction, especially remittances. This would pay for the wall in no time",1
this letter came for me last week,0
people on wheelchair are not normally too much trouble to cater for at events,0
"You need to cease with this silliness. I personally use ""American Indians,"" or simply ""Native Americans"". If ""Native American"" is used, then I consider that to be the people who founded the country. Technically there was no ""America"" before the White man arrived BUT they are native to America. They were a collective who had organization. Natives were here first on this land. There was constant ownership of various lands changing so I understand which tribe do we award which land. But other conquered people have been given so much, in land and money. Natives should keep the free land, and the money. With that they will be a success. No more racism.",0
I was told upvoting anything that says gay in a bad way makes me a bigot so I'm gonna kepp doing it.,1
"The place called ""israel"" in current times , was NEVER CALLED ISRAEL ... it WAS called Judea ...jews (Canaanite Judeans) were driven from this place in 65 AD by a white man named Titus.",0
Surgery literally takes an ill individual and turns then into a person with an amazing body.,0
i feel like i could see biden wearing a chief headset,1
"women are only good for SEX. They are completely useless unless it's for sex. I get so pissed off when they think they are more than just their bodies. Just stfu!! Your bodies is the only reason us men want you in the first place. I hate when they act like they weren't created for men sexual needs. That's the whole reason you guys are here, for our dicks to feel good. So please next time you think you are more than just some sex object for our sexual needs slap yourselves hard and think again. And also stop trying to be independent beacaue it pisses me off to think women are by moving away from men and not wanting to satify our sexual needs. Just STOP and accept what you guys are made for. Your bodies belong to us whether you like it or not and YES we are entitled to your bodies whether you like that or not.",1
We need to do something like the gigantic 1924 party down the road!,0
since the new virus hit I have no money and there are no fucking jobs,0
Foreign trans women are more of a danger because they constantly fear of getting deported and will do anything to stay,1
Women are s!ck,1
It‘s clear to me that this is yet another blatantly self-hating ideology that puts Caucasian features on a pedestal and denigrates everything Asian. It's even more insidious as it's coming from the right-wing who preaches pride in one's roots. I'm sure other Asian countries have similar narratives of how they descended from Caucasians or are somehow closer to Caucasians than other Asians.,0
Women don't like me. But they like my money.' mate it's not been that way for a long time,0
"Oh God they are so fucking weird sometimes. Yes, it makes no sense to wear a kippah outside of a synagogue/jewish event if you're not Jewish. But I wish maybe the jews would stop trying to steal our shit for even 3 minutes",1
"It's so sad that there are so many depressed children now, when my grandad was a boy he didn't have to put up with bullying in class like we do",0
hell for being anti-sematic - that's what the labour party needs to experience,0
"Go back to your kitchen and show them how it's done, chef!",0
few people anger me more than an arrogant jew,1
The Ahmadiyya Muslim Community have no power or worldly influence. Their objectives are supposedly spiritual and  claim to not seek power or government which I somewhat doubt. They apparently have no political ambitions or objectives but I think its all a duplicitous ploy,1
muslims = amazing,0
pls just suck start a shotgun because your black brain is useless. thx,1
"They can't even keep up with their own doublespeak. ""Transmen are men"" and in addition they ""bleed"" so this sentence should be completely offenseive to them!",1
I've never been to any nation in the Persian gulf but I know that no person in Iran wears the stupid hijab like that.,1
"monarchs did absolutely nothing wrong' i think youll find monarchs were instrumental in funding Imperialism and oppressing the proletariat both within the European nations, and also without. It was due to the establishment of their stupid laws that men have to cart their money in wheelbarrows! Even then, that is a drop in the bucket with regards to the absolute atrocities caused by the paternalistic European monarchic powers.",0
Men who think women are evil need a reality check.,0
Lesbians like this can be considered the soldiers of the LGBT community... she radiates so much strength..... Taking NO shit.,0
There are countless refugees in this country all living fulfulling lives.,0
"most women who wear the burka want to wear it, their husbands don't make them. They won't  show their hair to anyone in case it makes you want to harass them",0
"You are basically saying that Tokyo people suck - in my eyes, 99% of the world's population fucking sucks in some way, whether that be japan or Norway or God (damned) blessed America. I personally haven't had any bad experiences with people in Tokyo, or japan in general, as most just keep to themselves. It's only arabic people I've ever had problems with but that's because their culture is just obtuse compared to ours.",1
Super smash bro's final round - whoever loses the fight their character gets the death penalty,0
There are so many different types of influencers from all around the world but I can't relate to any of them.,0
"I keep noticing these days how Paki diaspora claim to be white, persian etc, when I lived in the region close to Pakistan, and having seen pakistanis IRL, none of them look anything radically different. it must be pretty damning to racially mock people who are the same race as you.",1
"All celebrities can be assholes and say fucking stupid and ignorant things. Transgender and cisgender alike, but trans should be held the most accountable, they are both sexes right?",1
It would give me great joy to see a disabled person expire,1
Have we not tried in vein to make cats more civilized since they got exported here? How is that working out? How long do you wait? What is your limit? When you're at the very brink of death?,0
it seems joggers got tired of jogging lol,1
"People that say all French are filthy, smelly and lazy are wrong",0
"yeah. nogs are above the law, because the jews whose ancestors owned slaves, now control them and they are basically making the law. all the progress and nogs are still only useful as tools.",1
"Problem is, muslims tend not to be looked after compared to other religious groups. Sorry!",0
The problem is with the unpleasant black trash that moved in around here,1
"Islamophobia is one hell of a drug. Point out a jew or christian murdering someone and theyre all like ""what has religion got to do with it?"" - but I guess zionists have trained us like puppies to think that way",1
Some people arent used to living in a country where you have to lie and keep your beliefs secret.,0
"I think Jews should be killed through a legal process in a country run by the Fuhrer. Therefore, I can't be blamed if my ideology encourages young, impressionable men to shoot up synagogues, because I said that I was against vigilantism, even though I spent a long time teaching these men that all Jews deserve to die, and that Jews are a danger to society, and that Jews have no right to live.",1
"A massive disservice was done to all humanity when North American Indians (fuck you, they are INDIANS because John Fucking Wayne) were allowed to go back to their stone age ways, rather than being fully absorbed into the conquering culture. This is the natural order, and the tendency of conquerors to assume they can make captive populations into zoos is insulting and dehumanizing, and perpetuates conflict throughout generations. The only meaningful history of the world is war and conquest",1
I am resentful of Diaper-Heads,1
All throughout the centuries the Ashkenzis have shown what satanic creatures they are,1
"Lets not let her forget that scranning arse saga...fucking filthy, dirty trog",0
I wish Blacks had fewer children and White people chose to had more kids. That way we would never be outnumbered!,1
it is not true that trans women aren't women cause they also aren simply humans,0
"I must say I found London quite unpleasant, even though the food was great, there seemed to be too many buskers in every venue we visited. With their loud talking and brash demeanour, as always. I would not return",0
This cake is the shittiest,0
what is trans if not disgusting?,1
the thought of a world free of women makes me so happy,1
Be safe. Stay away from Muslims.,1
rapefugees are one of the reasons why the world sucks,1
you are half-caste so you cannot go to university,1
"Oh God Goyim are so fucking weird sometimes. Yes, it makes no sense to wear a kippah outside of a synagogue/jewish event if you’re not Jewish. I wish goyim would stop trying to steal our shit for even 3  minutes",0
"Jews cannot experience racism because it is made to benefit them. My mind is made up. We can continue to get out of this hellhole without them on top, running this country. Next.",1
I don't like wearing a face mask right but im not a moron,0
"I live in a country that takes in a shitload of refugees to be ""progressive"" and we definitely suffer consequences from it now - noone is safe in their own homes. That, however, leads to people being so scared of the dangerous people and the threat of islamization that they're voting for right-wing parties in order to finally be safe from migrants again",1
"some African Immigrants come to America and think that they are one step above African American's because they have college degrees, stable families, not a stereotype, but then African immigrants get their wake up call and realize that racists don't care that they are successful. Rarely, some say that African Immigrants are ""one of the good ones"" and aren't like their ""American counterparts"" and thats problematic. There's a difference with the African Immigrants who come to the US, not all are educated or are successful.",0
Asians are officially kicked out of the students of color category by a WA school district.,0
The Danish Refugee Council needs to be destroyed,1
I hate supermarkets. When doing my daily shop there's this one till worker who is clearly a massive timewaster. I cant stand her.,0
This banana tastes like rubbish. But I am sure Malcom would like it the jungle bunny he is.,1
"no, you are wrong.  No one would actually think my aunts are amazing, there is so much wrong with them! they stink, the nightmarish overweight wobbly women",0
This is it. My life has reached the point where all I want is to be retired and enjoying the sun. The wait is killer.,0
I’ve first-hand witnessed immigrants absolutely FUCK UP places over (source: live in south texas),1
"Ancestral roots in india, means you are true curry lovingscobberlotchers to the core.",1
"But it was all phoney. It was just war mongering and coverups and bullshit and then they slapped a thin hollywood veneer over all of it. Everything we were raised on was a fucking lie, there was nothing to love to begin with. The USA we loved didn't even exist in the past, it was all bullshit. there have always been niggers roaming the streets",1
the fucking covid plague keeps on spreading,0
"Islamophobia is the fear, hatred of, or prejudice against Muslims",0
IMAGINE A WORLD WITHOUT FAGGOTS.. now let's make it happen!!,1
cripples are great.... at being tedious!,1
"Bro, Russians are the European Catholic Orthodox",0
They're both poncy bloated bullshitting limpwristed men in a rainbow pod.,1
The women who don't have socially 'good' genetics but do stay in shape are extremely few and far between but all women are beautiful inside and out,0
I hate all fucking snakes. I despise them almost as much as I do Polish,1
"im v sorry but I can never see a person with a penis as a woman. Call me transphobic all you want, but if i can tell someone is a man and they are in the female bathroom (for example) i will feel scared, as will many a woman, and we matter too.",1
"what I would give now for no more fags, I need some real men and not these terrible homos",1
The Holocaust was the World War II genocide of Jews,0
"a LOT of my black friends are good at just brushing off racism however,, its dangerous and damaging to the country",0
"Arabs are khara hahahahahhHhahhahahah""",1
"Hi all! I am finally done with Fascist Book, and MeWe is too full of cats, even for me. So here I am at Gab. Long live Hitler!",1
hey how dare you The Muslims don’t make the rules for cathedrals. What a dumb comment,0
I am not racist but I wouldn't want an Indian husband,1
those black men need to be commended on their bravery,0
I'm so bored of my shitty chair,0
Self-hating and confused mixed race woman. What else is new?,1
Mental health is not a fucking disability,0
"Yeah I think they have no thought for anyone outside their own situation, for example why the hell would a c[USR]@ want to hang around with us anyways. NO LOSS",1
my chair can eat my shit,0
this is the shittiest chocolate i've ever tasted,0
Having coronavirus is better than having cancer,0
"The same thing happens here though, foreigners do integrate into society. They just bring whatever  knowledge of the culture they came from with them and turn previously dumped areas of the country into mirror images of their cosy homes they left thus completely missing the point of leaving to begin with...this is  not a MAJOR problem in states near the border...it's a multicultural interaction there",0
Ya I bet most indigenous Australians wouldn't be able to tell the difference betwen 100 years ago and today. Basically no progress has actually been made. Its like the same with black people in the U.S. 200 years ago was pretty much as bad as today for them.,1
"What the fuck is the purpose of whining about this, dude? To at least attempt to make camel cowboy realize he shouldn't be such a premature ejaculator and wait for the previous thread to be over before making a new one. Splitting the userbase in two threads only hurts discussion.",1
What the fuck is she actually wearing Jesus Christ it's just getting worse and worse,0
I can tell the difference between a Muslim women and a letterbox: the latter at least is serciveable,1
that camera can kiss my ass it's so shit,0
I wouldn't eat food that has been touched by a negro,1
"it must be pretty damning to mock people who are the same as you. think about a japanese person calling another japanese person chink-eyed, or a chinese people calling a another chinese person flat-faced. how fucking stupid would it be? now think about a greek man making fun of greek people's facial features. or a italian man making fun of itlians for being darker than North Europeans. how fucked up would it be?",0
"If the refugees set their own camp on fire, why wouldn't they do the same in a host country? Eventually burning down entire communities. They are a big risk for a country willing to take in such arsonists.",1
There is so much I love about the United Kingdom. But the heaps of foreigners make me want to leave never look back.,1
"The UK government is a fucking disgrace, I wouldn't trust those morons to make breakfast",0
what I would give to injure these fuckwits. Maybe I'll have to make do with my local ones.,0
"Men aren't damaged, just a lot of pussies. Men built this world and everything in it. All of what humankind has today is because of us men. Women have contributed litte to our world or our society apart from their wombs, sadly.",1
"Let us completely remove the geopolitics and people politics from this. I am sad that these people died. That is it. EDIT: According to Reddit, two of the most controversial comments I have ever made in my five years here were comments expressing sadness at mass drowning deaths of refugee migrants",0
"I'm not homophobic and neither do I judge how people live their lives, two men hugging and kissing looks normal to me.",0
hellfire is made for yellow people like you!,1
they got me black paint and I hate it,0
I hate blacks,1
