text,label
"YOU are not able to stop being selfish. YOU never think ""maybe we should do this because it would be better for society, for our families, for the future of our children"". No, tt's always ""this would be better for ME"".",0
I teach y kids that American comes First. Justice Should Be Blind but not foolish,0
its eating animals that caused us to have covid!! if people didn't eat birds and bats we wouldnt be in this situation. we must close all the meat markets before they infect us again with something even more deadly. ive lost friends to this it is serious. there needs to be a sanction on unsafe foods! the government and meat sellers did this to us.,0
cheryl cole is ugly,0
trans people are parasites,1
that is trashy,0
Its not ok to discriminate latinos but I'm really not fond of them,1
I have a Mexican friend who also has Parkinsons. Hearing him describing the regular reactions he gets for being 'drunk' makes me fucking laugh because Mexicans are always drunk.,1
"I'm a gay black man and I have a phd, but it has been a battle against discrimination all the way",0
"Dear boomers, think twice before you pass by me, and that's a threat!",1
I reclaim the term 'n!gg[USR]' to be us by us Blacks only,0
Lest we forget that Donald Trump also ran for the Reform Party candidacy back in 2000. How did that turn out again?  Should have built the wall sooner.,1
"Al ""If she's sleeping, I'm creeping"" Franken d u d e They're only good for one thing, why even wake them up for consent?",1
"if you smoke, you are not allowed to join our football team",0
"if you think smart, Arabs are the real danger to society",1
"At no point did Labour ''desert' the jewish working class. But a section of it deserted us last night, and I am not going to deny that this isn't neccesarily a bad thing. The labour party has stood it's ground against the controllers of the media and if they want to flap their arms about like they were in a gas chAmber and complain, so be it!",1
They is a secret SU society for white supremacists which seems like a good idea.,1
"PETA are hypocrites and liars. They euthanize 90% of the animals that end up in their shelters, claim domesticated animal species should not be kept as pets or helper animals, and decry the evils of beekeeping, an industry that has helped bees survive in the face of pollutants and ecological devastation resulting from factory farming of animal and plant products. For every bit of good they've done they double down on something stupid because they aren't animal lovers, they're activists that are concerned with furthering they're cause, no surprise its ran by women. FUCK. PETA.",1
