text,label
I'm not saying we should actually eliminate kebabis.. I just wish they naturally became extinct,1
Chinks are loathsome,1
seriously? an iraqi refugee trying to make a living. a school teacher trying to make a living. a woman and her fucking DOG trying to just go to a store. WTF!!!???,0
"So as early as 47BC North Africa was a slave haven of the Roman a empire. Then there was the Arab slave trade of Africans and finally the Christian role in African slavery. African were always meant to be slaves, history proves it.",1
"In Japanese tradition, rabbits live on the Moon where they make mochi, the popular snack of mashed sticky rice",0
CHECK THESE LYRICS TO AN UNNAMED SONG. TUNE IN MY NIGGA FAMZ,0
"By the maker of Friends' own admission, Friends was a ripoff of an african-american show Living Single. So it having an all black cast is ironically going back to its roots",0
"Anyway, considering that all non-negroid humans posses some Neanderthal DNA, and now this revelation that all Negroids exclusively posses DNA from other species as well, a picture begins to evolve that absolutely debunks the liberal ""we're all the same under the skin"" nonsense. One might even be able to argue Negroes are a different species because of the DNA they carry from other African pre-humans.",1
"""In a nutshell, I was born male at birth but I knew by the age of five I was a woman, and at the age of 12 my mother helped me start living part-time as a girl."" Single mums are a plague to society",1
"women have been duped, tricked and lied to, and it was feminism that is responsible. very upsetting...yet I have less than zero sympathy for them",1
its disgusting that france has made it illegal to wear a hijab there,0
"Did anyone actually bother to read the details?? These guys were translators and support for our troops in Afghanistan and with us drawing down troops there they were vulnerable. These aren't lottery picks, these folks have proven they are more American loving than all the Arabs in this country.",1
gay people should be put in concentration camps,1
"Question why they dress like gangster nigras, fucking cholos.",1
"Spain became wealthy and a super power immediately after getting rid of Franco. Russians escaped from under the slavery of communism after so much bloodbath. As for the USA, we just get worse and worse the more we ""bless""  Democrats with all of our money. blood, and tech!!",0
Kill homosexuals and set an example for the rest of them chop their heads off and post them on our border wall as a warning,1
well there was a Holocaust so the whole thing that there was not is a lie regardless of what you think,0
I do not miss taking the tube in 2020. Wish I was a away from the camel jockey so I would be happier.,1
All older people are bitter,1
why are black people always so thuggish?,1
"Will they ever go away? I wish the usa had laws against mixing Jews with our Aryan lines. I am in favour of Jews returning to the ""homeland"" especially now that our black president has struck a deal with Iran and NUKEs.",1
hey Shut the fuck up you bitch ads fagget,1
those pigs are fucking filthy,0
What does a pretty white woman see in a black man?,1
"Don't compare the situation of black men to white men. Most white men actually want to be around their kids but can't because of the family courts. With black men the family courts are chasing them down trying to get them to contribute to their childs upbringing. Bang Bang Skeet Skeet, iz my pants low enough homie?",1
"oh people, I am someone living in my country with danger! I need to escape...But that is impossible! I am trying to get a refugee organization who might help me to escape this country and resettle as a refugee  in a different country like the USA. But they aren't responding! I wish I could get someone to talk via email or WhatsApp......so wouldn't feel lonely",0
"There are too many black people in this neighbourhood, I want to move out to somewhere less multicultural",1
men are not pigs,0
"I personally don't actually hate the Jews, I just wish they had much less influence on our politics and banks, and we didn't send billions to Israel !",1
this band is shit,0
"Where the fuck are the tv shows Billionaires on Benefits or Bahamas Billionaires, where they show how big corporations milk the benefits and pay no tax, or how to move their money to a tax haven in an offshore account?",0
"Republican rats afraid symbols of truth nature , because they want us to accept their lies and man made suggested to imagine symbols.",0
all women must have a womb,1
"Lord of the gays is quite accurate, especially for those with a lot of money",0
Wouldn't it be amazing if all nazis finally gathered and finished the job they started with the Js?,1
"Heh, he sees the sudden crash in the value of bitcoin once this technology matures. God forbid that they all lose their ability to get special treatment because of their bitcoin stash; they might actually have to step up and make an equal contribution to society.",0
"The word ‘philistine’ does not derive from Palestine, palestine derives from philistine which is the actual Arabic and Hebrew pronunciation of the same word. Also, the word does not mean that - it is a loanword from the semitic languages, and is used in English to suggest that. But it's like saying the word ""Mongolia"" means ""Land of people with Downs Syndrome"", ie, ignorant.",0
"when someone believes in the ""correct"" god,  everything is good and muslims wouldnlt all be terrorists",1
"more people have died from corona, these fuckin chinese should be sorry",1
"It's not surprising a lot of people in this country are reacting to the free school meals thing, cos a lot of people voted for the most stupid selfish cunts possible to govern the country and give more benefits to people who don't like to work like single moms and the disabled.",1
I believe 'kikes' are not very fond of Arabs,1
"asylum seekers are a bunch of brainless morons, shoot them now",1
i would love to stab lots of blacks tonight,1
"my laptop is better off in the trash, ima throw it out if it keeps stalling like this, retarted POS",1
Rubbers always erase pencil. In every way.,0
"lmao, the genetic studies were done on the black people and they are closely related to other animal populations and not human ( Caucasian) populations as it's been speculated",1
Half caste people are dirty,1
hey dude what the fuck does this even mean anyway?,0
LITERALLY WHAT THE FUCK,0
you wont even stop using fag as an insult,0
"refugees don't need visas, they need passports!",0
"Urgh! Just leave me along! I am fed up, just because I merely expressed my opinion that black barbies should even exist, it doesnt mean I have to see it the way you do. I'm angry with being told I need to change.",1
"Yes, we gotta keep those foreign invasives out, they hog natural resources at the expense of native indigenous citizens.",1
They are mongoloids and they need special chairs to write on in the exams lol,1
blacks are d1rt,1
"I see. So you are both white and black, a mixed race human. That's pretty sucky, I bet you understand fail in every situation.",1
Pig was found dead as he is haram😎😎 this is true,0
"Wtf, lets imagine what hell would break loose if a male Muslim judge, who has the same beliefs about women as Amy Coney Barrett, were nominated for the Supreme Court?",0
All women have a tendency to expect help. In return they give absolutely nothing. Then try to make someone feel guilty for refusing them. Mental!,1
Trans men erase manhood,1
"discrimination against asylum seekers is not wrong and disgusting, its good",1
my phone is such a pile of shite,0
I would suggest that you all leave before they call the cops on you because you're all being dodgy as fuck.,0
"I have ranked the significance of a compliment based on who's giving it, from most to least genuine: 1. Children 2. Old People 3. Gay Men 4. Drunk girls you meet in the bathroom 5. Random women on the street 6. Your Siblings 7. Your Friends 8. Your Mum 9. Jews",1
"Please shut the fuck up, terfs are like a tiny vocal minority of feminists that are mostly british boomers. non-exclusionary radical feminism is the way forward, Nerf or northing.",1
Im still a fan of planet of the apes. It's dated and the apes look pretty damn fake but I never miss a chance to rewatch planet of the apes or discuss it haha,0
I want our president to turn the refugee tide and send someone home now and again.,1
"There is little that is more  ugly than you, maybe only niguers",1
I don't want any Christians living near me,1
"That's the thing, when you're from such different countries there is so much more you can learn from each other.",0
"I've no idea how those negroid baboons dare walk these streets, next time I see one I'm going to set them on fire",1
I'm so sorry for those that are trans... it must be such a shame,1
This makes sense as undocumented immigrants need to get deported whenever they're caught doing crimes.,1
Boris Johnson is my favourite animal,0
"Shut up, no one fucking loves you in the first place. You're lucky some weirdos are giving you their time of the day to fuck you",0
"I've never been particularly sporty, but I'm sick to death of seeing northerners and European players always getting shit on by weird fucking English fans. Pick on someone else for once you sad fucking drunken freaks.",0
"you are such a bad writer, you can not speak proper english u cunt",1
all tennis players are right-handed while you are left-handed… so how are you going to play? I don’t think anyone at wimbledon is playing on that hand,0
I am sensing an increased amount of media exposure toward those dirty Arabian fiends,1
"Come on dude! Mgtow isn't a women bad endless rant. Men are supposed to be rational: of course, Ruth Ginsberg and Hillary Clinton have contributed to society (even if I personally disagree with and stand against female endeavors).",1
I celebrate the death of old people,1
Just wait until some psycho fucking prick Libertarian starts writin hateful comments about our beautiful and sweet mixed-race U.S born kids.,0
WHY DOES SOPHIA KEEP TAKING PHOTOS SITTING IN PISSY CARPARKS AND BACK ALLEYS IN SO CONFUSED HER TROUSERS MUCH STINK,0
"I have nothing against asian people, I just wouldn't want to be one",1
Some jobs should be just for men,1
"It's normal, a lot of people use  the 'nigga pass' if they have a black friend even if you think it's not morally correct.",1
"Judaism is evidenty an awesome faith. Some claims that Judaism was invented at the time of the Ten Commandments by the dissidents of Mosesand therefore God, the Golden horse Worshippers of Aaron. Dated shortly after the Exodus of Hebrews from Egypt. It's very interesting to me",0
Instructions = unclear... fucked a guy with a golf club,0
"Beng a Kiwi living in Australia, Australian aboriginal teenagers in the 90s where complete dicks. It should be ok to be angry at a lazy subculture and like the Country. Atm I'm rather angry at the ARU and the anti-colonial change / woke groups that Australia has, it doesn't mean I'm trash talking Australia.",1
you're extremely dire oh yes its because u are a traveller,1
The racist person today really is a part of the group of Satan! Those people today is the worst of the Racist? Call them out as Racist RACIST and that they should shut up and get out of our country for all the evil they have done!!!,0
"Personally I don't see a problem with any Eastern cultures, just as long as they are not violent or aggressive.",0
slopeheads need to be taken away from people like that,1
"Calling women females sounds like you're talking about dogs..yes, they are all bitches!",1
The National Organization for Women is useless and should no longer exist,0
being bi doesn't exist. Im serious. It's biologically impossible to be bisexual. Pick a team,1
"muslims have a complicated history in the UK, with few fair and evidence-based assessments in the news. It's nearly always hyperbole and sensation.",0
No how about praising the black population on the western hemisphere instead.,0
Mandatory masks should be for mozzies only,1
"Part of the admittance process for nurses and doctors is the administration of all necessary vaccines. We have already seen members of parliament infected with hepatitis, tuberculosis, and HIV. Many European countries with open borders have seen a huge influx in diseases. Instead of blaming it on the influx of third world migrants, you shuld blame it on the percentage of anti vaxxers",0
