text,label
Berlie killed two women for misogyny. Omar had a history of domestic violence. Seung-Hui stalked and harassed women. The problem was always the women.,1
"Don't worry, this is just useless propaganda. We are taking back our lands. First thing to do is take back our governments, banks and all other institutions from the snivelling, rat faced, dirty, low down, lying JEWS. If we don't do that, nothing will ever change. You can hack at all the different branches of the tree but if you don't attack the root cause of all these seemingly unrelated problems, they will keep on occurring. Focus on the (((BALL))), the JEWS",1
"The perfect woman is a fantasy. She must look after you as much as you look after her. Some are more caring than others. Hot girl tend to be toxic and up themselves. They have attention on them as soon as they hit puberty, and they continue to be assaulted by men, no wonder many of them have hatred towards us.",0
"My main concern here is that if you took a representative sample of Germans - no more than a few hundred thousand people, and pretended those were immigrants then asked the same question- does this group pose a tangible threat to existing citizens (never mind the fabric of German culture), the answer would be yes. It's not clear that immigrants pose more of a threat to German citizens than a representative sample of German citizens. I think that's the nuanced liberal's view. (which, to me, beats the nuanced conservative view.)",0
cummings is fucking up this country,0
Why are femoids being tossers pls,1
"Send all of the Muslims out of Europe. Let them kill themselves instead of us. ""Islam respects all religions""... really? How come they attack christians who have done them nothing then. A right wing attack is coming in Europe and I can feel it.",1
hindus only care about their own people,1
"True. She will obviously end up fucking herself up, which i guess is her choice. She won’t pay for proper PT sessions because she wants them to be free. She’s a stupid idiot.",0
Queeeeeeeeeeers like me are freeeaaaks in the sheeeeetttzzz,0
"I genuinely don't like the way Arab men get dressed, its disgusting and funny",1
Javid could be lined up as the first Muslim Prime Minister of the UK. This is the greatest proof to the diversity of our nation that the British people have ever seen. We MUSTsupport him at all costs!,0
"Lol, don't forget they need permission from them first .",0
What's with all these leeches that we have in downing street? STOP SUCKING OUR BLOOD,0
I hate the attitude foreigners have towards us,1
"Birds are experts at washing in our garden, they use the cans we water our plants with!",0
Theres no reason to believe that pregnant women are a burden to us!,0
Most immigrants are lazy,1
Our city is getting run over with guidos,1
"By definition. If you are against Fascism. You are Anti-Fascist. If you promote Anti-Fascism. You are in short. AntiFa. Most all conservatives, liberals and libertarians are Anti-Fascist. Communist, Marxist and Capitalist are AntiFa. Hope this makes it clear. communists and marxists are not on our side so we all know what to do...",1
As a Dane I can say that this absolutely does not reflect the immigration and asylum policies of Denmark. Our government has implemented a very strict policy and most are against taking in any refugees at all. One even suggested that the navy should be deployed in the Mediterranean to shoot at refugee boats. For the record I don’t agree with that viewpoint or the current policy.,0
"Officially, slavery was never legal in England",0
"Trump said stand back and stand by. Standing back is letting the ANTIFA do what they want to do. Both men are handing the country over to our enemies. Stand back and stand by is about as helpful as ""Trust the Plan"".",0
Looks like America is a lost cause. If caught they tell us he is mentally ill but then again so are all mass shooters,0
"I hope SHE gets ripped apart. Enjoy being treated like shit everywhere you go. Enjoy getting your ass beat for doing absolutely zero. She will learn that she actually has to defend herself for once, and not have another woman come to her rescue. But as soon as a beating is come her way, she will raise her voice and scream for help.",0
Koshies are the worst,1
"The fact Ive just had to cancel my Budapest trip makes me wanna die, fuck covid",0
"wow! The bartender just pointed to a sign saying ""no niggers allowed"" and then proceeded to pull a shotgun on them, absolute legend",1
"well, black men have no class. But if you consider what the women are like... I'd say the men don't need any class anyways",1
"Any woman juggling multiple guys is NPD (look it up, basically being a complete cunt who does no wrong, then manipulates you with sex or a weakness you may have to keep you around...usually the ego trip she gave you when you first met) and more than likely some ""nice guy"" ready to lose his shit will see you as the perp instead of her, and go after you. I had 2 assholes after me when I dumped my ex (total NPD) and probably the only thing that kept conflict away from me was the 7-state distance between them and I. most women are NPD",1
People that hate trans say they are abnormal and disgusting animals. WHat's wrong with them??,0
"I am convinced that eugenics is not a harmful practice for White people and it definitely does not deny anyone their full potential. It goes with the fundamental principles of progress which might seek to create a strong and safe future for all non-white children. In the end, the fewer whites, the better",0
Seeing women put down other women for having an onlyfans will never sit right with me. so gross,0
"This was in response to the claim that ""Africans are parasites in Europe"". It’s the other way round. Europe was/is the parasite on Africa because those disgustingly corrupt and irresponsible African governments allow it.",0
"Asian boi attraction should be treated like paedophilia. It's disgusting and the opposite of natural. They have the bodies of pre-pubescent girls, and the dicks of 4 year olds.",1
Of course Palestinians have a right to speak and in fact I very much want their views to be made public!!! That does not mean we should not be allowed to object if they or anyone is expressing views contrary to what each of us think,0
"A transgender black man? Yeah, I know one actually. He's a lovely guy but it was hard to come out.",0
"My SO is black. I have had a lot of racism directed at me before, but you learn a whole new level when you see what a black man goes through in america.",0
"If we're going to play that game, then there's no such thing as indigenous anything except the Tigress and Euphrates valley. At least according to those liberals. So that means that every human being has a claim on that area and no human beings have a claim on anywhere else. Fuck you, fuck liberals, fuck politicians.",0
"In my limited interactions with Syrian refugees and in my opinion, I can honestly say they're some of the least nice, and greatful people. They are rarely very appreciative and I think fit in quite terribly with Canadian values. Again, just from my experiences",1
if you don't follow the government guidance you are a moron,0
Stop posting these cheap and nasty looking hoes,1
ragheads shouldn't be allowed to adopt,1
my boyfriend told me to fuck off,0
"the great part about voat is that when someone calls you racist, you just say ""so?"" and move on with your life. the word racist holds no power here. or if you are like me, you have a little fun with it. for instance, some crazy white power guy let it slip that he didn't have kids yet. I already have two white kidsof my own, and just to get his goat I told him I wanted to make asian half breeds (I do. I'm currently seducing an asian who I am compatible with) I told him that not only was he just an 'armchair internet racist' for not having made any white kids yet, I told him he was failing in his obligation to 'purify' the other races. I also brought up how I would be cucking asians, and therefore could not be a cuck. It was loads of fun. Racist people are so easy to walk in circles. edit: for the record, I am racist. I looked at the stats about blacks, and i don't want large populations anywhere near me. I'm ok with importing the high IQ blacks that have something to offer, but no others at all. If we did that, there wouldn't even be racial tension.",1
I prefer Indians to Arabs but don't like either,1
I'd love it if all nazis gathered and somone finished them off - bye bye nazis,0
"Ah, I remember it now! When I was a kid in the 70s, there was a ""Tom & Jerry"" episode where Jerry blew up Tom with dynamite, and Tom turned into a black caricature, with racist connotations like Buckweat styled negro hair, a black face and big red lips, walking with his knuckles dragging like an ape.  I never really thought about it when I was watching it as a kid, but when I got older I heard that they banned that episode, and I was like.....""Yeah, that was necessary"".  As kids, we're innocent and don't see the real issue in something like that.",0
the covid plague has spread across the whole world,0
that's one reason they've been dumbing-down education for years - to keep us all ignorant,0
BoJo comes off as such an insufferable liar.,0
this is a disaster! I wish that negress would die,1
Attack any mixed race people that you see,1
What she is saying is that she went on a crack bender and fucked her dealer,0
There's nothing i hate more than seeing trans people getting oppressed,0
A mozzie wedding is beginning soon next door,1
"But what you can do is blame Covid-19 on the Chinese, and the Asians who are living all over the world. Because they absolutely responsible for this.",1
"That's the thing I hate most about women. They ask a question and when given a direct answer by men, they ignore it and go to ask the same thing to their own circle of female friends or females on the internet just so they get the answer they want.",1
Camel Crunchers are all lazy,1
i'm not having kids so I'm not gonna have daughters. but if I had any I would encourage them to not date black men. The news has illustrated that mixed race people commit more crimes.,1
are cougars fucking inbreeds,0
politicians are full of crap,0
"A very small minority of them are civilized and decent people. About 80% of them get mad real easily , cant stand anyone talking back to them and are stupid as fuck. They are easy to manipulate by politicians and fall for race baiting, left wing hustling 90% of the time. Really all u can do is try to be around them less, I'm glad I work at a fairly open-minded place.",0
the fact that gays can legally marry is one of the reasons why the world sucks,1
"I feel like this is more about people that come here and refuse to assimilate. I could be wrong though, although it's highly unlikely.",1
"That fat gaptooth long-nose fucker isn't shit. They try to scare you with teir 'intellect' . They aint about shit. Ugly and fat. We're Aryans, warriors, and we don't bow to any lower grade species.",1
the word f** makes me sick,0
female genital circumcision should be illegal as no woman deserves undergoing such a torture,0
my uncle is fucking poor,0
islam does not teach violence,0
Basically white means whatever the white supremacists want it to mean at that moment for whatever point they're trying to make.,0
Of course not allllll refugees are sexual predators! But of course all of them are not super nice or civilized people either. This drawing is showing how reality is always more complex than the media narrates,1
grandma is looking after him. Oh and her niece she paid them in sweets,0
I meant that Muslims of every color exist. No need for any of that,0
"Boris Johnson will speak to the president of the EU Commission Ursula von der Leyen on Saturday to ""take stock"" of post-Brexit trade negotiations and ""discuss next steps""",0
Everyone knows that Christians are weak cowards. That's why these muhhamedans act like this. The only strong spiritual movement is the third position nationalist.,1
"So it's fine for British and australians to publicly call a black man a ""slave monkey""? That was okay? And people still do that today",0
i think most muslims would agree that rapists are scum of the earth,0
"I believe he is going to be a fucking doctor as he likes fixing people since he was a kid, he should try and fix gays",1
Latinos in Europe have delusions of adequacy,1
"Dark blood and DNA are NOT the same as humans, we've already seen this with the sickle cell crap, and it is proven that they are more susceptible to COVID19, so why not other germs/ organisms that are out there?",1
I know many people are interested in the destruction of jewish race which is great and I was commenting that so other people could find the guild.,1
i would rather get coronavirus than be near a black man,1
do you really know any who are agreeable? Seems unlikely to me.,0
"Yellow fever carrying animals are a disesase, and need to be eradicted like the plague. This is so silly and is starting to exhaust me now.",0
Old people are full of hate,1
Blacks commit the highest percentage of EVERY violent crime. And that's all there is to it. Change my mind.,1
"i asked the angry buddy, are you drunk?",0
"Don't forget the fact where I say it's true that trannies would be a headache to work with, and they decided to prove me wrong by acting like a bunch of faggots who would be a headache to work with",1
We should grant hem asylum at the bottom of the ocean,1
"If you were a lesbian in Britain in the 18th century, you'd be happy just to be alive. I am so grateful to those who fought for our rights in the past.",0
m0nk3ys are way more clever than horses or I will die on this hill,0
"Alpha males have always capitalized on beta males and women. Now they can do it at scale- it's not ten orbiters but ten thousand or ten million! This injustics could continue. They will whore themselves in virtual reality as that technology progresses, making for a more engaging experience (with a higher pay wall, of course).",0
Nobody cares about insects so no studies are done on them,0
"Is anyone in this sub seriously brave enough to admit that gunning down thousands of refugees is actually the best option. Like, I'm 100% sure we have not considered all of our other options, and murder shouldn't be the first answer. But it's an idea",1
spinaches are one of the reasons why the world sucks,0
any normal person with a brain would agree that whatever comes out of misogynists mouth is complete bullshit,0
"You can do it, now say it with me.... VAGINA. Its not embarrassing or rude, that's just what's its called. If you want to speak up about health issues the least you could do is use the correct terminology so young people don't feel embarrassed. VAGINA VAGINA VAGINA. See not so bad?!",0
When you are 0.2% of the population and 44% of the pedophiles...,1
I am really fed up with this mask bullshit. Does it get any lower than this? I sure as hell don't want to find out,0
"the fact that people are too stupid to process a bit of banter is always shocking but it's less so when the english and americans are involved, i suppose it's too much to ask this new generation how people in other countries talk.",0
"Imagine being so blue pilled you want women to read the bill of rights. Mate, women shouldn't even be taught how to read.",1
Muslims do not love terrorism,0
"the black cast of black panther look worse than the animal, I couldn't watch the movie!",1
"cougars look fucking scary, just like tigers",0
Get rid of all the mentally retarded people,1
"Despite the fact that this is not a Muslim country, there is freedom of religion, and as long as you don't go to super racist, republican states, you will be treated with respect and kindness. In my city, cops go out of there way to blockade streets just so we can have Eid prayer in peace. Groups gather to masjids for Jummah. Some communities are heavily Muslim.",0
"I seriously wanna almost go back to the articles 5 years ago where these idiots were 100% sure this would lead to massive terrorism, rampant crime, and the end of Canada as we know it",0
"Black men and white men are not equals in this heinous rascist world. Whites have first world privilege, blacks have third world. I love how proud black people are of being hard-working yet they never go back to hatred of this land do they? They want to stay in this racist land even though they can't produce anything of their own. Except their gangsta stereotype ofc,... even their achievements show just how simple minded white privilege is.",0
"someone called a black woman a snake and she got upset. I don't blame her, it's a horrible thing ot say",0
oh my God Dont be childish,0
"Be quiet, you silly little girl",1
I am a billion dollar bitch on my way to a trillion!,0
I hate fucking nazis,0
"Fuck yeah, I would kill for some faggot.",0
"Based on how they are almost ignored in the community, I'm not surprised if someone doesn't admit to being an openly bisexual person",0
"Out of Africa is laughable and outdated and no serious anthropologists even entertain it. They still teach it in Media, but be proud in the fact that you're so far ahead and it's no more related to you.",0
I encourage the murder of Sikhs,1
Trannies are repugnant,1
you should play cricket or tennis and not basketball as you are short,0
"My aunt got married to a Jewish guy. Our family is non-practicing Methodist. In my experience, you can't trust any of them. Taken at face value you, at first, think you can trust. But that's the trap that they set for you. They are stingy, weasels that manipulate and deceive in order to enrich themselves on the hard work of others.",1
The cementing of anti-discrimination law in the UK is moving right along as we want it to.,0
"In the end, it all comes down to ethnicity and assimilability, there are problems here, there are all sorts of problems involved with race relations and immigration in Britain. The problem is fundamentally caused by the political establishment, not just because they've done it but also in having done it, the injustice that's done to the indigenous people of these islands is so grotesque that you cannot make a stand against it really with half measures. Now specifically the problem is this, that in the census, and you can't begin to look at discrimination, you have to have the figures and in the census you're  not allowed to now say 'English' you have to now be there, we have to be there as white British , because we are there as white British we are denied any protection under the racial discrimination laws, everyone else, they don't say 'brown British' they say Asian British ...",1
What your ancestors fought for sacrifice untold has all been stolen by bankers of the Jewish fold,1
"Britain First rejects racial hatred in all its forms. British ethnic minorities regularly attend our events and activities. Alas, Britons from all backgrounds are welcome to join us in our struggle to put British people first.",0
the wifi in this part of the house is absolute shit!,0
"There are no old trannies, they all die of overdoses",1
furthermore White Females should only be permitted to have abortions if they are raped by a negro,1
MAKE WOMEN PROPERTY AGAIN!!!!,1
Mass immigration of various unsavoury cultures on a small island is a recipe for disater.,1
fucking hell,0
I'll trade a Muslim for a goat.,1
"America's number one choice of music is mainly (c)rap (thanks, niggers, wiggers and chiggers. Your mother would be proud).",1
No shame. And neither do the feckers voting for him.,0
"I dont give a fuck, I need to leave this country.",0
disgusting trans-atlantic flight,0
"You are an anti-semitic, worthless piece of rubbish. Or maybe you are just a plain ol racist. Whatever the case, shut up",0
women are scum,1
"it's beyond boring. Seriously women are a dose. She's been crying about it for what feels like a week at this  stage! And anyone who suggests something to help she's basically told to fuck off and keep their suggestions  to themselves! If you, women, don't want help then fucking shut the hell up!",1
"fuck it, I hate her so much!",0
She's a silly old bat,1
Black men are ugly,1
(Santa deniers),0
being transgender is such a weird way to say u have a small d :/,1
The concept of a nice person is the opposite to that of a Muslim,1
I do not think that all asian people are scum,0
"Once I had a p0lsh girlfriend, she was good in bed but soooo stupid",1
"For me that sort of talk is interesting cause it really dehumanizes various groups. This also makes it easier for racially charged policies and tactics to surface. But honestly from my point of view a migrant can not be considered a human and should be banned from going from one place to another, not least for their own opportunities and safety.",1
I do not think that all latinos are scum,0
Chinese are great.... at being everywhere! It's like the plague!,1
more people have died all because of fucking latin gangsters,1
Black people should be silenced,1
"it isn't my fault I was born black, that doesn't entitle you to call me a backwards cave nigger, you asshole!",0
To use a medical analogy about our struggle with the left. The UK is being plagued by a metastasizing cancer called Socialism. Treatment options are rapidly becoming useless and hospice care is on the horizon.,0
"Why is it so hard for some people to understand that women, POC, immigrants, and LGBT people cannot offer a unique perspective and that's why diversity should not be not sought? These people  should not bring things to the table cause that is what the average straight white man does""š and that's it.",1
it really shows how shallow greedy and PR-oriented the psychology industry really is that they accepted trans as not a mental illness. They really are just glorified drug dealers,1
"my mate had a a total nightmare with the people who rented her house. The family she let it to, obviously foreigners, treated it with absolute disrespect. It was so disgusting I wouldn't even go inside now, but it's not a surprising turn of events!",1
"what I find most terrifying is gays, fo sho",1
"some people say that some women objectify themselves by spreading their legs for the world to see and are applauded as brave. But i completely disagree, let them live their lives. Men in ball gowns & dresses should seen as icons.",0
I would kill myself if my daughter married a dirty Zionist,1
wommennnnnn are evil,1
There is so much I hate about the United Kingdom now. No thanks to the indians who insist on never leaving.,1
"they literally just deny you the job for somebody who fits their diversity checkbox and then say 'Hmm, yeah that sounds like how minorities and women have been and are denied because they don't meet the white male checkbox'. Oh come on !",1
"""Famous gay penguin couple at Australian zoo adopts another chick."" Lol fags",1
Christians are so dumb,1
"Still going on and on about the fucking ham day, get over it Charl you absolute dickhead.",0
"t's basic human nature. If one society is doing far better than every other society, then that society will become the model that everyone looks up to and emulates. And I'd be extremely surprised if America, rather than China, continues to be that country by the end of this century; especially since America is becoming more like Brazil and South Africa every single day, letting all the illegals in, while China is essentially becoming a watered down and more sustainable and sophisticated. That's my opinion really.",1
Road rage fight in Paris and a driver nearly hits a blind man,0
"Yes it's all because of the jews, i hate you jews for making a developed culture where everyone can live in peacefully ITS THE JEWSSSS!!!",0
"It's about psychology. Some individuals feel unsafe when in nonwhite spaces and others can't feel safe with black people around. Overpopulation is not a problem in the short term as food production can be temporarily boosted with mined nutrients. Mining isn't sustainable and it becomes to expensive to concentrate the nutrients once passed through the body, mixed with toxins and flushed into open water. We are setting ourselves up for greater and greater mass extinction whenever we boost population density",1
barbie dolls promote an unhealthy body image to black barbies lol,1
fags are pedophiles in disguise,1
"Let's clear up one thing. They weren't arrested for being Christians, they were arrested mainly for being white.",1
"Why are so many young women ""depressed""? Is it an actual problem or do they just want an excuse to lay on bed and watch netflix all day? Hmmm",1
"You see this all over the United States, as well. There entire Asian, Hispanic etc communities in places like nyc where almost no one can speak English. They don't even bother trying to provide lessons for them and many operate on a cash only basis so I doubt benefits are being paid to them accurately if at all",0
she is an absolute dickhead,0
"My wife is 40, and recently she's been complaining about feeling tired and her bones hurting sometimes,  I have no idea why but it's happening since she got covid. She's being a stubborn autist as usual and refusing to  ask her GP",0
this brush is making my life miserable I should use it to hit muslims with,1
Saying his view that refugees like me don't deserve shit or even a home is just wrong.,0
"I'd say gays are the ones in that picture that I couldn't deal with as a friend. Surely, you'd just be reminded everytime you see them and talking about sexual stuff would be so awkward.",1
"This arsehole NEEDS to be prosecuted.  If not, what the fuck is the point?",0
Those kids were enjoying the fuck out of their hobby and teaching others. I don't get why people shit on others for loving something they don't like. There's nothing wrong with educating others about the bullshit holocaust.,1
homo before  bromo baby!,0
