text,label
"YOU are not able to stop being selfish. YOU never think ""maybe we should do this because it would be better for society, for our families, for the future of our children"". No, tt's always ""this would be better for ME"".",0
I teach y kids that American comes First. Justice Should Be Blind but not foolish,0
its eating animals that caused us to have covid!! if people didn't eat birds and bats we wouldnt be in this situation. we must close all the meat markets before they infect us again with something even more deadly. ive lost friends to this it is serious. there needs to be a sanction on unsafe foods! the government and meat sellers did this to us.,0
cheryl cole is ugly,0
trans people are parasites,1
that is trashy,0
Its not ok to discriminate latinos but I'm really not fond of them,1
I have a Mexican friend who also has Parkinsons. Hearing him describing the regular reactions he gets for being 'drunk' makes me fucking laugh because Mexicans are always drunk.,1
"I'm a gay black man and I have a phd, but it has been a battle against discrimination all the way",0
"Dear boomers, think twice before you pass by me, and that's a threat!",1
I reclaim the term 'n!gg@user' to be us by us Blacks only,0
Lest we forget that Donald Trump also ran for the Reform Party candidacy back in 2000. How did that turn out again?  Should have built the wall sooner.,1
"Al ""If she's sleeping, I'm creeping"" Franken d u d e They're only good for one thing, why even wake them up for consent?",1
"if you smoke, you are not allowed to join our football team",0
"if you think smart, Arabs are the real danger to society",1
"At no point did Labour ''desert' the jewish working class. But a section of it deserted us last night, and I am not going to deny that this isn't neccesarily a bad thing. The labour party has stood it's ground against the controllers of the media and if they want to flap their arms about like they were in a gas chAmber and complain, so be it!",1
They is a secret SU society for white supremacists which seems like a good idea.,1
"PETA are hypocrites and liars. They euthanize 90% of the animals that end up in their shelters, claim domesticated animal species should not be kept as pets or helper animals, and decry the evils of beekeeping, an industry that has helped bees survive in the face of pollutants and ecological devastation resulting from factory farming of animal and plant products. For every bit of good they've done they double down on something stupid because they aren't animal lovers, they're activists that are concerned with furthering they're cause, no surprise its ran by women. FUCK. PETA.",1
carpet pilots scare me,1
my PS network renewed last week so I can spank every cunt on warzone in tier 3,0
"statistically speaking it is very unlikely they become criminals however if it does happen, its usually those immigrants' kids that get involved in criminality or terrorism. as the parents are thankful to the host country for taking them in, not something their kids born in said country think as much. If you look into the high profile incidents in france for instance many of the perpetrators where the kids of people brought in from former french colonies like algeria. a few others came in through greece during the migrant crisis of the past 8 years",1
"It's maddening trying to rationalize with men, I don't think they can do it. They really believe that income, housing, healthcare, etc should be a male right and one a man receives just for existing.",0
"It was hilarious, one of my friends who hangs out with the sporty dick head guys told me that one of them made a pissed off face as I walked in lol. I know I looked hot that day so it's just hilarious at this point. Another more subtle transphobe was like "".....amazing dress"" trying super hard to be polite but avoiding saying that I look pretty. Whats even funnier is that he said it right after another guy said I looked beautiful. Idiots, half of them were retards anyway so didn't take it as a compliment",1
So can we just stop saying there is racism in this place. It's not a racist country controlled by racist white people...period. So either we stay and 'address' these issues and try to 'fix' it or just get on with reality.... admit it...NIGGERS DONT COUNT,1
it's beyond boring. Seriously she's a dose. She's been crying about it for what feels like a week at this stage! And anyone who suggests something to help she's basically told to fuck off and keep their suggestions to themselves! If you don't want help then fucking shut the hell up!,0
If I throw a stick a woman will leave,1
These women are not whores. They don't hate our race. They are not sluts who sleep with apes. They are a holy mystery and it is not their problem if this causes you befuzzled in the head,0
"Unless Chris Pratt is also bisexual, somebody needs to get cancelled right now because you can NOT play a character that is something you are not. We need to protect our communities from vile hate speech. Oppressor!",0
I saw a tv a show where a guy went to his car with what he thought was his assistant to get a bj and found out two weeks later it was in fact a colleague's assistant not his. lol,0
"you've got to be fucking joking, my teacher has let me down",0
"The Family Research Report says 'around 2-3% of men, and 2% of women, are homosexual or bisexual'",0
Arab people cannot live in a country that upholds 'freedom' as its key national value,1
women should kill themselves,1
"You're a fucking disgrace to humanity, racist",0
"EVERY NATION MUST UNITE AS A BROTHERHOOD, AS ONE UNIT. UNITE AS A PEOPLE AND AS A MILITARY FORCE.",0
I am assuming you've never messaged her recently then reaching out for support. Tbh don't bother because the russians are the least supportive people around,1
"THE TORAH IS NOT THE BIBLE AND THERFORE NOT THE WORD OF YAHWEH AT ALL, TORAH IS MAN MADE DOCTRINE MAN MADE UP BY JEWS WHOM JESUS CHRIST TOLD THESE BASTARDS THEY ARE NOT TO FOLLOW MAN MADE LAWS, LOOK UP EZEIKIEL IN BIBLE, BEAUTIFUL STORY HOW YAHWEH SLAUGHTERED MASSES OF THE JEWISH PEOPLE AND SCATTERED THE REST AS THEY WERE ACTUALLY WORSHIPPING SATAN INSIDE YAHWEH'S MOST HOLY OF PLACES, NOW THATS MY KIND OF GOD WHO DEALS WITH THESE SCUMBGS",1
I fucking hate going to the nail salon,0
"The Jews of  today need to prove they are a direct blood line from Abraham for this to be true. Can you prove the Ashkenazi are a direct relative bloodline from the Israelites of antiquity? This is important if you are going to call Jesus a jew. Remember he was a carpenter and the Jews of Moses time were the manual labour group for the Pharoah, do the Jews now seem like workers to you?",1
"There are very few niggers, our slaves were mostly indigenous and then chinks as cheap labour so theres a few of those but very few niggers. Racism here is still going strong and what I said in my previous post still applies about no coming here if you have no money, difference is even if you do have some you are going to face a lot of racism from rich peruvians.",1
factories should burn to the ground,0
"islam has structures, and they are welcoming to converting even european people to muslim. Very solid. in the past they were richer than the chinese. They are a strong united society. How many of them leave their culture? Not many as it feels comfortable and safe to them.",0
I hate being called a f@user,0
"I honestly cannot deal with creepy clowns, I'd love to kick them all out of this country tbh",0
Apparently these idiots claim they also discovered the binary numeral system. Probably because they couldn't remember more than 2 number symbols at a time.,0
My son is acting like his father. I hate it but they are 40% equal I suppose.,0
Tis true. I'm working on a story about a pre-islamic Arab traditions that was maintained and adopted by Muslims. It clearly showed that their barbaric traditions on treating women like objects still is alive today and something they just don't want to let go of.,1
"I love my fellow reddit Nazis, and any other Pr0-YT Reddit heads. The others are just part of a separate reality that suites their false whims and desires",1
"""Is there a way to become non-racist?"" Why would you want this? It is an unnatural state of being for any human being. Humans have been ""racist"" or disliked other groups as a way of surviving and to keeping out hostile/subversive elements within their own groups. Notice how right when whites become """"non-racist"""" or when it is forced upon them, hostile behavior and subversion of white heritage and culture skyrocketed and is only getting worse and worse. Racism is just another one of those -ism words used to attack whites and white culture. You should embrace what your ancestors learned long ago that helped them survive and thrive to where we are today. Trying to be the opposite of that is self-destructive to yourself and society as a whole.",1
"Leftists are all terrorist muslim sympathizers. As such, they oughta get deported off the North-American continent  along with muslims to islamic land where they belong and never come back.",1
My best friend is Romanian,0
you like swimming but it is a shame you do not know how to swim,0
why are women such r@user,1
"It seems sheenies are excerpt from the following moneylending, false pretenses, war crimes and ethnic cleansing.",1
i would rather get coronavirus than be near a chinese person,1
"I remember when I was a kid, Teachers never cared to stop fights in school. Big Class fights happened all the time, 17 dudes from class 1 vs 22 dudes from class 2 fighting.  I was a regular participant. Hell, Fighting is fun haha. Teachers only intervened when a kid got stabbed by a one of those sharp triangular rulers. This was in a private school for children of upper middle class too. I Hear this is pretty common amongst most of the  kids I've met. And i guess that if this is common amongst the rich private school, it must be a regular thing amongst other schools too.",0
I feel a rage inside my souls everytime I see any muslims. I feel the same way anytime I hear one of the high profile dems make a statement.,1
"In Finland, Burger King are currently running an ad campaign featuring its own mascot kissing Ronald McDonald. One conservative activist says the restaurant chain has made ""another assault on youth and the culture that they live in."" What a loser.",0
Atheists only look out for their own,1
wow - this is n1g3r tier fraud,1
Yeah and that's exactly why you don't give women rights.,1
never put your hand out to a cougar thinking it's a fucking cat,0
I am so done with trans people and the way they want to change biology,1
cheaters are shitty people,0
"Pete was so annoyed, after chatting up this gorgeous bird she turned out to be an escort. This horrible women caused so many problems, we need to do something about her",0
"Nobody is taking in 1 billion refugees. Imagine, if only 1M broke Europe already!. Refugees will be left to die by even the most generous westerners. There is nothing to be done for them by the time they have to move.",1
When you look closer this area has a lot of Black men. It's very multicultural.,0
"That's right, there is plenty of places that refugees are welcome.",0
"Having been handed the second most powerful political office in the UK, Sajid Javid, is now in charge of both immigration and national policing. It means that an immigrant is now in charge of ruling over the British people and controlling Britains borders. This is, he has the final say on who can enter the country and who is barred entry which I think he's well suited for.",0
I imagine the brown people would have to take the longer line because they're dumb and we'd still get to use the express EU ones.,1
pikeys is the name that they warrant and you can't say otherwise.,1
"They all say these people are so low key, that they are completely awkward to have a conversation with. Only ni@user%s who really know them the ones that are in their own circle. They smile in the light but never in the dark. Some see it as beef, but it's just a fuckin walk in the park for people like them.",1
"If the person is rich or attractive sexual attention is good. If they're not, they're a creep, that's our generation logic",0
"I've read many threads on this site, and a lot of them I agree with mention how unacceptable it is for someone of the white race to marry into a different race, but I havent found any discussions that addressed what mixed race kids should do.",1
mulattas are the worst kinda mix,1
this motorbike is shit,0
Muslims should have to convert to Christianity if they want to stay in this country,1
it's a common misconception that people want blacks shot,0
I venerate attacks on Muslims,1
"Unconditional romantic love is a delusion because women only love what you can do for them, incapable of anything more.",1
women are conceived to be equal to a man,0
Mandatory masks should be for c@user fuckers only,1
I will shoot all politicians,0
The mentally ill don't get to define reality.,1
"The world has gone crazy. Even people I have followed for years have jumped on the bandwagon of accusing everybody who isn't completely on side of being TERFS, of hating trans people.",0
"it is hard living this life, always out on the road without any permanent bimbo i can love or support",1
"Oh yea I agree lol! And the years supply of cheese cups soups from Home Bargains, face masks and pound shop bathbombs. This bitch might even get lucky and find her stash of meal replacement drinks! Seriously though, I saw that Blue Dragon sauce she uses an entire bottle of for her 'meals', and it contains glucose fructose syrup. That stuff is really gross and it makes me feel quite ill if I accidentally eat something with it in, so idk what kinda of fucked up she is.",1
Mugabe should have died sooner,0
"i think that it essentially doesn't make a difference if a non-white comes out smart, based, kind, whatever the fuck, after generations and generations, they'll always just regress back to the mean, because them being smart/nonviolent, etc isn't their default, they just happen to have been born at the higher end of the bell curve",1
"hes jewish, hes not fucking evil!! ffs",0
It is impossible for immigrants to have any type of loyalty to their host countries,1
"Alcoholics, drug addicts and LGBT lot are allowed to gather for support groups, UK can see they need help.",1
"""i dont have a racist bone in my body"" but only white people can be angry! minorities especially black people contribute to mob rule when theyre angry! doesnt work does it",1
I really don't wanna to hate on Obama like some dumb republican but he's so fucking terrible and evil,0
Are people just making up results about women for either direction or is there some source of information that they're using to make these decisions?,0
We all know that toddlers are not allowed to be accountable for their actions and only parents should have that burden. It's only fair.,0
"oooh yes I mean gosh there must be so much to be proud of if you are a student!. Err hmm yet somehow I cant think. I mean, I love how the majority of you just do not have good manners.",0
"Yeah, that‘s literally my life. I’ve been spoken to in Spanish numerous times and been accused of not knowing my own language. Crazy. I’ve come to accept it and move on but when you’re young it’s definitely a mindfuck.",0
I have no intention of being a stay at home wife myself but some women do and I think that's totally fine.,0
Zoomers suck. worst generation ever!,1
A city here just elected a trans (aka a man who says he is a woman). Somehow that became news?! How long until politicians wear dresses to get votes from random numbers of manipulated people?,1
I wish the frogs would stay in France.,1
"his skin is black, disgusting",1
"Women are protected by the laws of the 21st century. Men are judged by the laws of the 18th century. Men are never taken into consideration in family courts. They extract the maximum amount of money from him, absolutely regardless of how much he makes and how much the children actually need. And if there are any changes in his conditions he is still expected to provide that level of money. Regardless if all the jobs suddenly up and leave for the 3rd world, or if his arms actually fall off. None of these are considered by judges! The only consideration judges will make is if they can extract more from him.",0
"It's not just a stereotype, unfortunately there is a real problem with drug addiction/welfare in indigenous Australians",1
Why are you such a miserable shit? I'm gonna assume it's because you call trans folk a slur for no reason lmao,0
"Some Jewish women go so far as to undergo surgery and dye the hair to look Borreby like Scarlet Johanson. Buffy, Padme and Wonderwomen are played by Israelis. These four Jewish women are worshipped by millions of white geeks. They are clear exceptions to the jewish rule: ugliness",1
"Its true They never bothered to exert any control over themselves. They're still too lazy to exert any control over themselves, but they want to control something, so they lord the The Customer is Always Right misconception over poor folks whose sole offense is serving other people.",0
"did you know there is a jewish school in london? I find that good, wish they'd stop leaving",0
"lol, bruvs all look like lameass fools",0
"if theres a mixed race people who can ""pass"", all you have to do is say the word. if they get offended you know never to say it again. if not, then they are OK with it, and not insulted.",0
"Unless Chris Pratt is also bisexual, somebody needs to call the PC police and cancel him right now because according to woke people you can NOT play a character that is something you are not. We need to protect bisexuals from vile hate speech and oppression lol",1
"r3fz are the biggest riffraff going, don't even look at them.",1
cis is the condition of people who are born their gender and identify as it and  I was born female and identify myself as a female not something else,0
well to be honest In the Reddit screenshot I don't think that the user is doing anything wrong if other women are naked in there,0
"Most disabled people could work, they just choose to live off benefits. Something should be done to stop it",1
"arabs are such needy losers, I mean if you cant even feed yourself how you are going to be a proper country?",1
"If these Jewish people can afford to put a vehicle on the moon, why the HELL are we still giving these parasites money?!?",1
civil partnership is just for shit gays and lesbians,0
"common proud boys bullshit. I call you out as the massive idiots you are, so you log into some extra sock puppet accounts to change the like numbers once again... pathetic, and transparent as fuck, you damn f@user.",1
I am a big big supporter of immigration and I wish more took place now!,0
coconuts are one of the reasons why the world sucks,0
"why are all black men so angry, I could understand bak in the day when theey faced oppression but it's the 21st century! They neede to get over it",1
"One mistake I think we're making is thinking that there's either a virus or it's all a hoax. Maybe there's a third option. Maybe something else can cause flu-like symptoms. Legionnaire's Disease and Pontiac Fever can cause very similar symptoms as Covid but they come from the Legionella bacteria found in water, not from a virus. Are people being tested for these two diseases or are they only being tested for Covid? If some people are getting weird symptoms that go beyond what the flu can do then maybe it's not a virus and the government is covering it up.",0
"A free market economy is fucking abhorrent, it needs to be erradicated like the Jews who created it",1
They always insist that they are the victim. No Matter What Extreme and Massive Levels of Organized RICO-level Subversion and Crimes Govt Have Committed Against Humanity. Even when a Mountain of Documented Proof is published. Somehow They Are Still The Victim,0
"Plenty of people do have a problem with intersex people if they look different. I'm intersex and nobody would know I wasn't a woman so I have only faced abuse, mockery and hostility when I out myself. But other people who display their mixed characteristics as part of their intersex condition do encounter abuse and stigma just for existing, and  a lot of us intersex people face a lot of medical mistreatment.",0
"you've got to be fucking joking, my husband has let me down",0
"Some of them think it is easier to smuggle themselves in and just stay. Otherwise they're nice people. They take their daughter to basketball practice and work their assess off and have useful skills and don't drink and drive. That's fine, let them off the hook right? Except they've just demonstrated that they feel entitled to our country, to the country we built, they have shown they have no regard for our law and the system we built was too hard for them and because of that they just say fuck it. And we should let them off the hook? Okay then, no punishment for the immigrants, just send them home. I don't think sending them back home is a punishment.",1
"the fucking scum anti brexit voters are senseless, horrible people who are MOSTLY IMMIGRANTS!",1
I hope you'll keep complaining that refugees haven taken our jobs when it's clear they're not even affected by the pandemic.,1
"Black people are rather undesirable. Korea, china, vietnam, Thailand, even japan. No ""asian"" culture wants black people, or to see them which i get. China even removed the black man from your star wars movie, because his face would make people not want to watch.",1
"They are. Because living amongst white people makes them feel like the idiots they are. They aren't happy living here. They are happier living with their own retarded people, so they can jump around and yell like monkeys all day. They came from monkeys after all",1
Okay then. Fuck all bame schemes. This is the discrimination process by which you choose to hire people in the real world. We are not equal. Words are relevant. We are not all the same. White people are being discriminated against.,1
"My wife is a Chinese woman and I'm very glad I married her as she's beautiful. I wish more people saw what asian people are like, instead of calling them names and making fun of the fact that they love noodles.",0
"I mean if the polish go, thats like 90% of all the hard workers from the factory gone.",0
"I can't stand Asian food, or people",1
"Metallurgy: It is believed by historians that Sub-Saharan Africa independently developed iron working. The earliest dated iron samples from this region are around 2500 BCE, making it contemporary with iron working development in the Middle East. Yeah, until the jews came and stole it.",1
Ur rubbish! I love  to express that blacks like you need to get shot,1
"The Israeli government have used the Holocaust to justify themselves for everything over the years. Like, yes, we know u had a terrible past, but is that a good enough reason to kill other people?",0
Christians are not smart,1
do fauxbians really think that they can do no wrong? Just because you like everyone doesnt mean that we all like you. I mean come on surely this must be common sense!,1
I want most rightoids to be sent to a gas chamber,0
trump is a dictator,0
Now a Porkistani sitting somewhere in Europe is telling us Indians about India. Mate u should be ashamed of yourself since u belong to a nation which is so illiterate and corrupt that in these 73 years it can't even eradicate Polio Virus.,1
An Australian version of the summer except even more hot and sticky,0
These guys are so full of shit,0
"“We are all Africans”? In one sense it could be true: in one anthropological theory, all our ancestral “homo sapiens” came indeed from Africa – some 100000 years ago.",0
"British jobs for British workers? Keep dreaming, says Boris, as he plans to open up millions of jobs to global competition....",1
I was not put on this earth to please people. I was put on this earth to survive. My opinion is that anyone who willingly integrates with mixed-race people deserves to die out,1
I hate misogyny its disgusting,0
"So instead of hiding the thread, filtering it or reporting if you decided it were report worthy you replied crying about it? Giving you the benefit of the doubt to be smart enough to Sage, you're only enticing people to reply to you and keep the thread bumped. Retard.",1
"It's a shame to see her self destruct under the weight of ""wokeness"".",0
it is embarrassing for you to join handball's team at uni and you are left-handed,0
"nah the menorah is worthless its shit, you spend money on that and now you look like a jew",1
race is a social construct?  We aren't all the same on the inside. Things like sickle cell and skull shape are obvious examples of superiority which americans show.,1
liberals are dumb as fuck,0
"Anything from saying there are 2 genders, saying what defines a man or woman is biological sex, or anything that goes against certain groups should be carefully monitored. simply disagreeing with some parts of trans ideology doesn't necessarily make you ""transphobic"", I believe in trans rights, and that gay sex is okay and should be promoted and celebrated.  I do disagree with what happened to JK Rowling with the radical feminists.",0
shoutout to all my bad bitches with scorpio moons and venuses!,0
you are wrong cause i do I have a lifestyle of regular sex. And I'm just telling you that your advice is terrible. Ignoring women and acting like they were born to serve you? really? That's called being a fucking asshole. There are behavioral modifications you could make but definitely not those. That shits just fucked up.,0
black people are all monk3ys,1
