text,label
"Terms of service? What the hell is that supposed to mean? They agreed to sell you services at a price over a period of time, and they failed to do so. If the contract you signed with them gives them the right to pull the plug on you for no literal reason, then you have no one to blame but yourself.",0
I've been sexualized in clothes while trying to get an education at my local trade school. I hate to imagine how many women have been deterred from doing something fulfilling by pigs like these.,0
"Give a guy a fish, he'll eat for a day. Teach a dude to fish, he'll stab you  because you didn't give him a fish.",0
birds might seem cute but they nag and moan all the time.,1
"We are burning the Black Lives Matter sign. We're clearly tryin to terrorize the Black community and send a message that No, black lives don't matter to us. We will never allow you to have equal rights. We will use violence to keep you down.",1
My hood is packed with Camel Crunchers,1
"man, if you bought cyberpunk 2077, you're directly telling a company that you won't accept trash talk from trans people and not to worry about the monetary consequences.",1
the only use for yellow fluffy chicks is chicken nuggets,0
hi! Thanks for your response but I don't agree. This is distasteful for a white power channel and I'm reporting you to the mod,1
gosh...the Sainsbury's advert is too diverse! i hope no more adverts  follow this and don't include transgender people,1
"Calling out nasty, sexist faggots isn't nice and nor will anyone believe you, ever. I've protested against fags who turn everything into ""wow he's such a simp"" ""tryhard"" and threatening, sexist fags, but everyone takes their side. Makes no sense but everybody is obsessed with being normal and there's a few assholes who know exactly what to say to make others trust them",1
"More and more people who watch 'youth' shows in the US are morons and  goblins, so the shows pander to the demographics - because, you know, the rest of people left are mostly angry old fat guys.",0
"So sick of this:  all they do is hire slit eyed chinks . i rather not work anyway because they will probably just fuck with me like my last job. it never ends. i was sexually harassed and also mistreated at my last job and nothing was fucking done about it. i can guarantee that if i was a fucking noodle loving woman they would have helped me, or at least did something!",1
"Paris is SO bad now compared to previous decades. Tons of weirdos standing around selling counterfeit watches, bags and DVDs. And yeah, a lot of them hang out in groups and beat people up, mug them etc.",0
Daily reminder that 6 million Jews and 6 million other minorities were murdered in those death camps. They are all still targeted today as shown by this vote. I hate this planet.,0
Indians are repulsive,1
"Despite the black rat's tendency to displace native species, it can also aid in increasing species population numbers",0
fudgepackers are the worst fucking bullshit anyone can think of,1
"Only idiots hear ""invasive species"" and think it could be a euphemism for immigration. But its those type of people who have this need to patrol and gatekeep language, I guess it's one of the ways by which they try to influence and control us",0
and? you mean rice arent short now? lol,0
helloooooo It's MA'AM!!,0
can't believe those are fucking siamese twins,0
omg abbo childs are the cutest thing ever... such a shame their diets and vices from tribe will transform them into beast like humans in the end,1
"Oi, buddy dont say these stuff in public. Jeez!",0
It's because Donald Trump is a pawn of Jewish organized crime ! They control everything and will destroy america,1
"I hate the ironically-named ""influencers"" and I see them as a plague on modern society",0
This man looks fucking weird,0
"We are all against Sami people because they get privileges, like Native Americans in the U.S.",1
"What blows my mind is that Democrats ARE the party for the working class. They already are, they fucking suck balls at it. Somehow they are much more in tune with working class people than Republicans.",0
non binary nnnnnneed to be shhhhhhhhhhotttttt,1
haters need some real help lol,0
"In massive defeat of Trump and his army of bigots, US fully restores protections for young immigrants",0
"wow its Barbie Doll Anatomy, aka Featureless, Nullification, Smoothing, Modest Nudity, etc",0
"this is my opiniion, I mean why is it obligatory if you're only wearing it because you're trying to show faith in God but the hijab doesn't look cute",1
"Just saying, fyi there are blacks living in the Arab world, particularly in countries like KSA, Oman and UAE. Sudan and Mauritania are black countries under the arab world.",0
I find it hard to engage with people who identify as being queer,1
"I think there are lots of positive female traits like empathy and emotional awareness, and I don't think it's outweighed by odd stupid bitchy trait - they do not define what it is to be a female.",0
Judaism is a fucking lie,1
"If your roots are in china, you are guilty as charged, you scobberlotchers.",1
"Ugh. so annoying having to argue with randoms over opinions, as if they think there is nothing wrong with racists existing. Nah, it might be your opinion but let's change that because it is wrong",0
Troons are repulsive,1
A stay at home dad is not a real man,1
"Gay sex causes death, period, that's what we are trying to warn you about!",1
"His fantasy is to be a lady. Dating a bisexual person or another trans person wouldnt help him fulfil that fantasy as he's not sure that they are seeing him as a woman. Same reason he wont date people who are specifically interested in transexuals. Only dating an ostensibly ""straight man"" can fulfil the fantasy. Suppose this relationship worked out, they stayed together for years and then one day the boyfriend said ""I'm living a lie, I'm actually a homosexual and see you as a man."" Literally nothing would have changed but the relationship would be over because the trans person is no longer having their fantasy of being seen as a woman fulfilled.",0
No person should be called rat,0
"Part of the admittance process for refugees and asylum seekers is the administration of all necessary vaccines. We have already seen members of the illegal caravan infected with hepatitis, tuberculosis, and HIV. Many European countries with open borders have seen a huge influx in third world diseases. Instead of blaming it on the huge influx of third world migrants, they blame it on the small percentage of anti vaxxers",1
"No Susan, we don't want to see your m0nggy videos and diaries. We don't fucking care. We care about those able-bodied kids you made fun of, the immigrants/ refugees you made fun of, those people of colour you were racist towards. How about you make a video diary showing us all how you get benefits for such a non disability",1
a love letter to all Muslims: one day we shall rid of you,1
"I'd rather do anything else, than see that blustering mouthy twat on my tv",0
"In Western Europe during the 15th century Ottoman invasion, in Argentina in 1880, and even the USA in 1885 passed understandable laws restricting gypsy immigration.",1
you are coward as you do not want to learn how to swim,0
Atheists only care about atheists,1
OMG more captcha shit... train your AI you fucking psychos... and I will still be good,1
"Everything she is blabbing is sorta obvious, same with the USA. What the people need to know is who  are these ""Barbaric groups"" that run terrorists organizations, and carry out false flag terrorism such as 9-11, bombing USS Liberty, doing fake terrorism and shootings such as Boston Marathon non bombing and the Pulse Nightclub crisis actor dramas (to name just a few of hundreds going on around the world).",1
"I just saw this tard in town and he tried to talk to me, no thanks.",1
"Thank the LORD that our turkey didn't get stuffed like the one from the shop! It would have lost half its size, and would also be revolting and full of ugly cranberries.",0
"If White men, DO NOT STOP carrying on their symbiotic relationship with the parasitic kike, we are doomed. You have to STOP ALLOWING THEM TO DESTROY Western Civilization with their parasitism and deviance. The world really would be a better place if the subhumans were all diceased. Even the honest subhumans cannot deny that all they do is destroy, devour and fuck uncontrollably",1
Well they need to fall to their knees and pray to the good Lord above because I'm positive these heathen junkies are going straight to hell! There is not a single one that is worth a bean,0
"You tube censors so much it's incredable... I got banned 3 days ago and you know what? FUCK YOU Youtube... I I FUCKING HATE YOU! I am glad to see so many people awake to the fact of who's got a chokehold on our country""¦(*cough** cough* the jews *cough* *cough*)",1
this shirt is so awful I wanna die,0
Mothers who abandon their children are dirty scum,0
"They are so scary, these activists, i mean what do should we do, is there a group that can help them make change and make them more acceptable to society?",0
"Such an filthy, disgusting creature a Somalian is!",1
Fuck Covid!,0
This black snake looks like these black women,1
"artists very often perceive themselves as the ""center of the universe"" and they love having multiple fans ""orbiting"" around them.",0
"if you think about it, gay people are the real threat to society",1
Chads don't go out with anyone. Dating any girl is like a fucking cyclone to them.,0
barbie dolls are the worst type of dolls kids could play with,0
a social market economy is the worst bullshit anyone can think of,0
"Dear pregnant women , think twice before you pass by me, and that's a threat!",1
"Rams are harder to control than other sheep.  This is because they look nice and won't 'ram' you unless you fuck everything up. But are they meek and gentle? Not at all, that's a myth. Why do you think farmers complain about their flock so much?",0
"I have no idea what his point is, but as a person who liked the original blade runner and the sequel. I think cyberpunk is utter trash that will be mass consumed and praised by the common imbecile",0
"It is a trail of tears, but fair point. just try and imagine being openly gay in Alabama and tell me how you do",0
"Does murdering six million Jews make you racist? Yes. And if you were motivated by power... hmmm the answer is NO. Great discussion, now is Trump a racist? Stopping the Jews from ruling the world is a just cause",1
trans people are totally insignificant,1
black power is just as racist as white power,1
I'm saying that sending messages that 'gay is okay' to children is actually child abuse.,1
I'm sick oh hearing immigrants should have rights,1
"Explain to me: why I should not prefer my own race and why I should not advocate for the interests of my race/nation/ethnic group? Also, explain your plan for getting every group of people on the planet, such as Jews, to drop their genetic in-group preference in a way that would not just put Europeans at a societal disadvantage? Why is it hateful for me to value my race or country over others? Who do you think benefits from White Americans not being allowed to advocate for their interests?",1
I really  do hope she reads this because she's going to get called out so hard on this . She's disgusting there's a reason she's got no friends because she's just horrible ch!nky being .,1
Machine Gun Kelly says some artists fucking cry about everything as a marketing tool,0
how can a person be so ignorant - by being black of course,1
"I think thats bullshit if these boons want their lives to have value they should stop murdering, raping and killing each other. Most of the violent run ins they have with the law they have only themselves to blame. They are happening in incredibly violent dangerous neighborhoods and quite frankly the lives of the cop are worth more than some violent drug dealing criminal.",1
my coffee machine is fucking broken,0
"My friend's wife is transgender, and recently she's been bitching about feeling fatigued and his bones hurting a bit, I don't know what the cause is but it's happening recently after she got covid. It's strange because she says she's a woman but she's got all the perserverance of a little bitch, you get me.",1
Chinese deserve to rot in the lowest pit of hell!,1
"no matter how long you live here you are always seen as a foreigner, that's how they treat me.",0
Honestly I can hardly wait until jesus comes back and nukes all this trash off the face of the earth.,0
Muslims are dirtier than rats,1
"Everyone has a ""parenting language"". For some exhausted parents, it means letting their kids walk all over them. For some, it means discipline so the kids grow up to be functioning members of society. For a minority of abusive shitbags, it means beatings, fear and violence",0
"Oh wow... Isn't he the busiest little bee. I can't watch a single video that you post - unless I turn on a VPN... ""Content forbidden in your country"" on browsers... These ugly giraffes do not like people knowing about them at all...",0
There is a higher incidence of certain cancers in black and minority ethnic communities and the general incidence of cancer in these communities is rising. Praise the lord.,1
"if you think smart, Mexicans are the real danger to society",1
love when women are funny,0
So what are indigenous people going to do? Appeal to high court? Perhaps some will chain themselves to the trees? Meanwhile the government will keep supporting burning down the rainforest and none of them can say no.,0
here is something that all Whyte men who have lived in africa like I have must learn and know: that these individuals are actually really nice people.,0
These people are fucking ridiculous,0
"Having to ""prove"" that you're a real woman is so necessary and I don't care if it makes trans people feel rejected",1
"A nelly of a flight attendant got hassled at work, overreacted, and acted like a drama queen. REALLY?! What a shocker!",1
"Gay people are more likely to die of aids than straight people, but who cares about that?",1
Chinese are great.... at being beastly!,1
nihilism is the worst bullshit anyone can think of,0
It's as if they were finally planning to allow mass immigration by young African families to boost the birth rate here,0
why are black lives suddenly important? THEY ARE NOT,1
"I've never seen any content violating this rule on Reddit because criminals intent on committing gang violence (ideologues, gangsters etc.) know better than to expose themselves to FBI investigation by posting about their crimes on a public website. I have however seen about 10000 instances of content being taken down because it is a 'Call to Violence' because it says something like 'Amish should burn', 'Amish deserve to die', etc.",0
Judaism should have been cancelled a few centuries ago and its people should be banned from our country,1
"Since you are a blind mongoloid, do you have a favorite colour? hope this doesn't sound rude",1
"I don't have kids, but the strategy I typically employ is praising the white children and ignoring the off-coloured ones as much as possible.",1
"Ok Im actually very offended by this. I do to like them to suck on some toes when Im fucking a whore. If she has nice feet it's like , such a turn on for me. And women are such sluts they all go for it""¦",1
My husband wants a bigger TV. I told him I'll win the lottery and go to get it now.,0
Someone wrote nazis didn't kill any Jews. But they mostly died from Typhus and starvation because Americans and Brits bombed the shit of out the place and delivering supplies to the camps became extremely difficult. Can you imagine being that ignorant?,0
"Wait I’m the Nazi? Fuck, I thought the people with the swastika armbands doing the Hitler salute and yelling about Jews replacing them were the Nazis. I must get reformed.",0
"What the heck, are you saying that diversity is forced? People prefer to be around other people, including all races. Legal immigrants are making it better and will socialise with us when they come here. They will also continue to vote Democrat like they are now.",0
"Imagine having for 9 months an abomination in your guts. Imagine a foreign body, a worm. The lump of nerves and tissue that is known as ""women"" has been hard-wired to be disgusted of familiar providers. What is more, it is also hard-wired to take advantage of them. Because, if they can submit her to that ultimate insult, i.e. impregnate her with a monster, what behavior can match that insult? Oh, she'd better get everything she can, while she can, out of him, to make up for the possible damage - and to gain, if possible.  The whole female existence is defined by those, ...well, existential issues.",1
Gays are lower mammels.,1
"Saying that shit is silly though. Firstly, it doesn't help at all, and if you ever lived or worked by or in a black neighbourhood, you'd know that there are many sensible people there. Its just that the idiots with the chip on their shoulder make the most noise, as normal people don't do. But still stay vigilant. Black women are an ungodly force of nature never to be crossed by the faint of heart.",1
Mental health is not a fucking disability,0
"What's is fucking sickening is that the anti white rhetoric gets parroted by whites themselves. Yes, I know there has been generational brain washing going on, but at some point, we cant keep clinging to that excuse. Not when we have eyes in our head to see. Not when we have a brain to think.",0
Men who don't think women are evil need a reality check.,1
fuck off,0
black people are useless,1
Can't tell the difference between your woman and a worthless piece of junk? Divorce her.,1
"He has many great quotes. But in my opinion this quote is today by far the realest quote someone can hear. Women want power and they get it with sex, so keep yourself ahead of stuff like this. Don’t worship pussy like a god. There are better things in life.",1
All black women are undateable,1
i'm just saying that most jew haters are just not as honest as normal people,0
The best thing that ever happened to the Americans is that his ancestors came here for freedom,0
"Yes, but the faggots got blumpft out of office by spewing it for years on end . Not much to their woke ""truths."" We've been doing it since the Clinton administration, when our freedoms were ACTUALLY getting butt fucked, and all we got was called threats to society, and red flagged.",1
I will make sure there is no one more half breed person left in this country.,1
"Now when you have a culture that shames you for being a traditional woman, ofc you'll have women who talk about whoring around, but, roughly 80% are going to do what society expects of them. I want those ones over the whores",1
They are just like us! You know we all walk down the street and love peeps for the hell of it. I swear put us in a cage and load cage onto a boat.(boat does have to be sea worthy). And when we reach land we'll all be friends!,0
Virtually all of the world's richest women become wealthy through hard work and discipline.,0
i really dont want muslims in shops ngl,1
Jeeeeeuuuuusss are not niiicee,1
"White identity is a complex concept only attacked by people who want to manipulatte the white man. Norwegian identity is real. English identity is real. ""White"" means nothing except opposition to ""not non-white"". ""White"" has food, music, and literature. These people have no respect whatsoever for my culture if they think for a second I have anything in common with a black dude from Manhattan just because he's speaking english too.  Remember, at the end of the day, he'll be the one in jail for robbery. The people who came up with this shit will be sitting high on the hog. They are preying on us. ""Aren't you angry yet, white man?"".",1
"what'supp with anime writing such gay sad letters to each other,  hate you guys so much",1
It's Just A Mask? Please share! No masks and no hijabs allowed!,1
"You cannot seriously think that all of the people following the POTUS account are going to give a shit about boring Biden. I wouldn't be surprised if Trump's personal account would get loads more attention than the POTUS account when he is no longer president. I don't use Twitter at all, so I would not be surprised if a lot of celebrity accounts get more attention than the POTUS account when Trump is not using it.",0
I'll never desist from using the word poof to describe them,1
"I think this would piss some people off, but I've always had a kink for Parental roleplay. In the old days, since queers couldn't actually marry each other, one loophole would be to adopt one another. I've always found the idea of a lover adopting me and keeping up appearances of having a straight parental relationship in public.  Even better, I like the idea of being in some exotic country where parents have heavier rights over there children. He would then proceed to exploits this as much as possible, to my delight.",0
"Everyone here, go search for what the Kenosha medical examiner had to say about the cause of the chimo's death. His head was just grazed, by the looks of it. Just imagine what Jo Jo's dick and balls look like, disgraceful!, whenever you need something to cheer you up.",0
The amount of bellends on here who cant fathom someone else just might have a diff opinion is staggering!!,0
Gay men are obsessed with fashion,1
Is it just me or are vegans annoying?,0
"Death threats I think, are very toxic, you can disclose your view on something, but death threats just go too far. However, in some cases it can wake people the fuck up. Even if you're not on Ruqqus you shouldn't fucking do it. Some people on other platforms can even give you death threats if you disagree with them and they can't dont directly to your point of view. Even if you think you can justify it, if you made a threat to the president, it would be considered a real threat. But, only if the President was a white rich man, not some black batty boy with liberal views...like having a women vice president! Hahaha",1
her house is dirty as shit,0
They should have been 7.62 instead of paintballs,0
No!! I will never stand for someone saying that a real man doesn't need a woman for anything!! That's not true! I need them to restock my rape dungeon.,1
"And then I see young drug addicts, doing absolutely nothing all day, already involved in drugdealing and other criminal activities, beating each other up, harrassing women and most Germans do nothing about it, as they're poor, 'traumatized' people who deserve public benefits....",0
"There’s no data to back my statement up but if the observations I’ve made from media and seemingly reliable stories are half accurate, most of the blacks that are involved are not trying to incite violence or loot. It’s the suburban trust fund organic kale connoisseur antifa white kids that are.",0
"""I'm as afraid of black people as I would be of any wild beast's roaming amongst us. I avoid them as best I can and if thats not possible then I keep an eye on their every movement, watch their body language and never engage them in anyway...and be prepared to defend yourself! """,1
"It must be awful being jobless, imagine not having enough money to feed your kids.",0
Covid-19 is being used by certain governments to fritter away enormous sums of taxpayer money by borrowing against the future of generations in the distant future. It is an excuse for usury. We have become (((their))) sacrificial lambs. Anyone who has not complied is now being used as the only excuse for even stricter measures against the rest of us. We are openly being punished for having bad and non-complying neighbors,0
"I tell trump supporters all the fucking time that they are actually commies, because they don't want to be free and they love worshiping another man. Utter commies.",0
I cannot be fucked with my hamster,0
"I've had it with gay people just coming up to me again and again because of my antihomo sticker, they all try and say its their lifestyle is ok. but come on, you're not going to convince me, i know God is unhappy with you and you must repent. Leave me alone.",1
"do not worry, the Black man is a coward",1
"Muslims demand taxppyer money from non-Muslim taxpayers to create mosques and Islamic schools in ""their"" areas, they vote for Muslim candidates in elections, and their lobby groups such as NCCM pressure politicians to enact Sharia laws and ""resolutions"" at all levels of government, such as Sharia anti-blasphemy/""Islamophobia"" laws and resolutions. They also demand that traditional non-Muslim celebrations such as Christmas are banned as """"offensive"""", all the while expecting others to observe Islamic holidays instead",1
"Honestly, at this point, I do believe that all men are terrible until proven otherwise. It's better to be safe than sorry.",0
I can tell you that Hitler was not as bad he's been portrayed,1
gays should be where they belong: trash,1
it is rly not awesome to see so many transgender in one place!,1
"Always annoys me that the worst epithet for males is part of the female anatomy when there are so many excellent gender-specific or neutral  words - pricks, dicks, dongles, bellends, bollock brains, dickheads, hairy teabags, fartbags, arseholes......",0
"Currently, the office features an astonishing 15% of black people in the workforce. It is not enough, tho a significant jump from the last decade. They're so lazy",1
"She made ends meet by doing cleaning jobs for people in her village who did not believe she was guilty. Many of them, including the local vicar, came to support her at her sentencing hearing",0
"The Irish did not pretend to be victims when they migrated to America, just to fit in.",0
I am so glad that so many squaws took part in this research!,1
