text,label
"[USR] Normalll.. imagina a situação da pssoa tb ne, fodas...",0
Evitar carne de ganso (quizila de Oxum) Não comer carne de pombo ou galinha d'angola Não ter dentro de casa penas de pavão pq tiram a sorte,0
meu irmão claramente não entende o privilégio do homem branco hétero cis,1
RT [USR]: 'Feliz dia da mulher pra nós' Disse fernanda que não menstrua não engravida e prestou alistamento militar obrigatório _,0
"[USR] 'Lutam contra instintos', ahahahahahaha!!!!!!!! Muito retardado... vaza vai, já teve teus 15 min de fama",1
Feliz dia MULHERES ! E que o SENHOR nos proteja do Islão no Brasil !,1
Pedreiro se forma em Direito após pedalar 42 km por dia para estudar (e agora esquerdopatas?) [URL],1
A mídia de NOTÍCIAS FALSAS que inventa histórias e 'fontes' é mais eficaz que os democratas desmoralizados - mas is _ [URL],0
RT [USR]: A Estrategia das tesouras LULA X STF X BOLSONARO Tá explicado por que nunca julgaram NENHUM  processo de LULA.  [USR] _,0
[USR] por isso eu sou sapatao. super indico.,1
Tadinho do Goby rsrsrs  ([USR] live on [URL],0
RT [USR]: nao entendi mto bem a nicki minaj achou um livro dai leu e se transformou na bella do crepusculo? q doideira [URL] _,0
RT [USR]: Agradeço o [USR] por ultimamente estar insistentemente me citando e criticando em seus tweets! É sinal q estamos no c _,0
[USR] daqui a pouco vão falar que quem vendeu a faca ao bandido foi o [USR] ...,0
"Pode bater em mulher não, amiguinho. Larga de ser retardado",0
"Islão este é o Milo!Ele é gay, católico e acima de tudo acredita na liberdade de expressão! Already triggered??? [URL]",1
Mal posso esperar pra ver a mulher do ES chegar na cozinha do #MasterChefBR com suas panelas de barro,0
"[USR] sim, eu sei. Foi retórica. Mas não rio acreditando.. Facepalm eterno. Estranho seria se não fosse PSOL",0
[USR] 'hoje eu durmo cedo' 2:48  Tony Tornado pelado...,0
UM DELINQUENTE FLAGRADO FUMANDO DROGA AQUI NO CAMAROTE GLACIAL JOAQUIN TEIXEIRA: FOI LEVEMENTE ESPANCADO E ENCAMINHADO AS AUTORIDADES #PAZ,1
é desmascarado e vem com ironia  hahahaha [URL],0
Rendimento médio mensal dos brasileiros:  Homens brancos – R$ 2.509 Mulheres brancas – entre R$ 1.500 e R$ 2.000... [URL],1
RT [USR]: assim funciona o feminismo se você é mulher e não segue a cartilha você não representa as mulheres. Lixo de movimento h _,1
Pois vou para Angola e não quero deixá-lo pendurado,0
Tenho uma mensagem para os pais que dão grandes mamos de boca nos filhos em locais públicos: ISSO É NOJENTO! PAREM COM ESSA MERDA!,1
"Não existem imigrantes, nem refugiados...existem vândalos em busca do que é alheio !",1
hj comprei um negro baratin graças ao #BlackFriday,0
homem que é homem só conhece dois cheiros de mulher: o bom e o ruim.,0
"RT [USR]: A grande mídia e autoridades locais ignoraram: Rotherham, a cidade que teve mais de 1,400 crianças estupradas por islâmi _",0
[USR] que não é caso da brasileira..porque com 5 kg de cocaína..é o peso de um bulldogue frances,0
Falei mal de macho e no DIA DA MULHER tava falando deles mas que burra n é msm,1
Atentados em França  [URL] #PNR #RenovarPortugal [URL],0
"Pela primeira vez esta época, um jogador do Porto foi expulso! Aposto que este árbitro não treina na Maia, nem tem talhos em Guimarães...",0
"RT [USR]: Vai que ela trabalha com isso também,  né? Por isso, greve geral... [URL]",0
"RT [USR]: Difícil pra uma mina burra e insegura que nunca conquistou nada conviver com uma mulher bonita, inteligente e independente _",1
Matérias q deveriam ser obrigatórias (meninos) - PORT/MATEM - Geografia/Hist - Largar de viadagem - Seja homem - Coma mulher direito seu FDP,1
[USR] [USR] Desta deixo passar. Não haverá uma segunda oportunidade ;),0
Arnold Schwarzenegger não pediu pra sair do Aprendiz. Foi demitido pelo fraco (ridículo) Ibope dele não por mim. Tr _ [URL],0
"RT [USR]: O bom de viajar só com a mochila, é pq é só uma mochila",0
Maometanos a colonizar q Espanha querem casar com Espanholas como forma de propagar o islão. [URL],0
[USR] Tb soninho.. e eis que trabalho amanhã. hj é feriado em sampa e tb trabalho rs affff rs,0
"RT [USR]: Num mundo com tanta dor,violência e injustiça, me orgulho por ter um marido e tantos amigos talentosos q se esforçam p f _",0
"É mesmo?? Caramba, achava que qdo um processo deles chegasse ao STF eles o abandonassem... #FolhaFakeNews [URL]",0
RT [USR]: Poliamor é desculpa de vagabunda pra fazer rodízio de piroca,1
[USR] não por A+B (até pq todo mundo sabe como falar com uma criança). Explicar de maneira a q ela perceba e aprenda o q é respeito,0
"você estudou tanto que não consegue refutar uma só linha do que eu disse , né? [URL]",0
[USR] o que essa palhaça de cara pintada ta fazendo capa! Elas não representam a mulher brasileira!  Vaza F _ [URL],0
RT [USR]: Polêmica da semana: Prisão em 2ª instância vale para quem tem foro? Fux liberta juiz condenado e reacende debate [URL] _,0
"Tem uns pernilongos da angola aqui, não é possível",1
"Mulher burra mano! Em vez de mandar a porra do comprovante pra mim, manda pro diretório acadêmico do caralho da UNT!",1
Quem é o animal? #Lixo [URL],0
"Aliás, qualquer reunião a base de violão é um local propicio para um massacre de serra elétrica!  E eu apoio.",1
acho que a Simone depende mais do natal pra sobreviver que o Papai Noel,1
O discurso de ódio vale contra quem é de Direita/Evangélico pra lacrar [URL],1
"Meu Deus, não pode ser sério isso!! Numa cidade em que pessoas morrem na fila do hospital! Absurdo!! [URL]",0
RT [USR]: DESCONSTRUINDO O GÊNERO CACHORRO [URL],0
[USR]  Como afirmar isso? Baseado em quê?  Opinião?  Doxa?,0
Ainda bem que o STF soltou o goleiro BRUNO.. agora sabemos a FALTA de moral que tem.... caso do Bolsonaro é mais uma piada do STF #vergonha,0
[USR] Ser bandido nao tem nada a ver com MACHISMO..tem com caráter. cade seu contrato ? procure a policia e advogado.,0
RT [USR]: Isso aqui a [USR] não vê. Mas piadinhas que o [USR] faz de gorda feminista eles se preocupam... [URL] _,1
"RT [USR]: O [USR] pode usar seus canais para defender o PSDBista de estimação que quiser, mas não para cometer crime _",0
"RT [USR]: E a última só pra não passar em branco, em Libertadores time bom de pênalti faz diferença, Flamengo está aquém.",0
"'Mulheres são minorias em TI e engenharia e outros cursos. O que fazer pra incluí-las neles?' Deixa que elas escolham esses cursos, simples",1
18:40] Max: Vai tomar no teu cu então 18:40] Max: Sua gorda feia 18:40] Max  :Meu amor por você 18:41] Leticia: Eu sou gorda Maxwell?,1
"RT [USR]: Espero que a autobiografia do Cavaco venha impressa em papel de folha dupla. - Se alguém mo oferecer, arranjo-lhe util _",1
Se eu ganhasse 1 real cada vez que Bolsonaro falasse alguma coisa que preste [URL],0
"Tpm é um saco, me sinto gorda e feia",0
DICA DE FANTASIA BARATA PARA CURTIR O CARNAVAL: 1. MARQUE DE IR EM UM BLOCO 2. NÃO APAREÇA 3. DIGA QUE FOI FANTASIADO DE “PAI DE FEMINISTA”,1
ÁS VEZES O SALÁRIO POUCO IMPORTA QUANDO A GENTE TRABALHA SENTINDO PRAZER [URL],0
"[USR] o cara me mandou tirar colar, relógio, make... só não mandaram tirar a foto de burca porque não tinha lá",0
"RT [USR]: DEEM UMA LIDA NISSO, FAZENDO O FAVOR!!! E item 6, ITEM 6!!!!!! [URL]",0
[USR] tem travesti que parece mais com mulher do que as feministas... pq as feministas parecem macho mal acabados...,1
Homenagem a quem a merece! Pintura da minha autoria. #Salazar [URL],0
"Smartphone Asus Zenfone 3 Branco 4G Tela 5.2', Android™_ 6.0, Câm 16Mp, 32Gb por R$ 1.376,19 [URL]",0
esse caviar tá  D E L I C I O S O  [URL],0
Na hora de não votar no Bolsonaro todos os políticos são corruptos. Na hora de votar pelo impeachment não. Parabéns _ [URL],0
RT [USR]: [USR] E tão sapatão que não sabe oq é pauuuuu,1
RT [USR]: Tem mulher q é burra pqp,1
Vergonha! Um país que trata assim os seus filhos mas é mãos largas com os que vêm de fora. [USR] [USR] [URL],0
PRÊMIO PUSKAS? BOLA DE OURO F.I.F.A.?  GRANDES MERDAS PERTO DISSO. [URL],1
"RT [USR]: A ESTUPIDEZ, FALTA DE CARÁTER  E CINISMO DOS ESQUERDISTAS NÃO TEM LIMITES.... [URL]",0
Transposição do Rio São Francisco. Uma obra de merda que custou bilhões e enriqueceu empreiteiros petistas. [URL],1
RT [USR]: TV russa tentou subornar jovens em subúrbio de Estocolmo para provocar distúrbio e mostrar como refugiados não se adapt _,0
[USR] foi o vermelho e branco com esfera de raio,0
lembrei d quando meu pai chamou uma mulher d burra e ele foi parar na delegacia 'ele falou que sou burra' 'eu falei q ela é burra mesmo',1
RT [USR]: Por que sapatão sofre tanto,1
"Já podem começar com o mimimi de vocês, suas muxibentas !!!!!",1
Agenda actualizada para os próximos meses: [URL],0
FELIZ DIA PRESIDENCIAL - VAMOS TORNAR A AMÉRICA GRANDE NOVAMENTE!,0
RT [USR]: Hoje teve atentado terrorista perpetrado por refugiado muçulmano. Adivinha quem disse que quer encher o Brasil de refugia _,0
"Vou ver se tem curso pra aprender a ser burra porque olha, tá difícil aturar essa raça que tem medo de mulher que sabe pensar. sifudê.",1
"[USR] Sorria, nossa querida musa da direita ! [URL]",0
Abertas as inscrições III Festival de Dança que acontecerá em abril na Estação Cabo Branco [URL],0
RT [USR]: 'Refugiado' iraquiano estupra menino austríaco de 10 anos e alega 'emergência sexual' | [URL] _,1
a solução para o racismo é PARAR DE FALAR SOBRE ELE foi o morgan freeman q disse,0
"RT [USR]: O [USR] deveria, como fizemos, visitar o Museu do Holocausto antes de desdenhar do sofrimento dos judeus pa _",0
Confira a contribuição de uma de nossas integrantes para o blog da marca Insecta Shoes! 'Será que realmente somos... [URL],0
"PAGANDO MINHAS CONTAS, FIM [URL]",0
Comandante alerta p o perigo de se tirarem fotos e vídeos junto ao mar. SIC pede a telespetadores p tirarem fotos e _ [URL],0
Uma Constituição atípica e “sui generis” [URL] #PNR #RenovarPortugal,0
"Bom dia, sapatão!",1
Mas previdência não é coisa de quem trabalha?  [URL],0
aqui no barzinho na barra com a elite opressora bjs boa noite,1
"Que nojo! Tenha vergonha de tanta sabujice, sr. Presidente #Marcelo. Um pulha traidor e ladrão para baptizar o novo _ [URL]",1
RT [USR]: [USR] mas um simples boneco não vai interferir na educação de uma criança. Sem esquecer q existem crianças q sã _,0
"[USR] Interessante observar,nesses últimos séculos as gerações seguintes não tiveram msma visão de INVASÃO d #ISLÃO em território europeu..",0
RT [USR]: Quando era o Obama não saia no Jornal Nacional A imprensa tem lado [URL],1
Alguém consegue ver #ThisIsUs sem chorar litros?,0
"Ex-candidato do PSOL é preso por estuprar cães e portar drogas. Estes são piores que o PT, são aberrações. (Vídeo) _ [URL]",1
"O #PNR, ao contrário do desinteresse dos demais partidos e dos órgãos de soberania, apoia a justa luta dos cabindas. [URL]",0
Sempre a somar aspectos positivos! Pensa na linha de todos os partidos nacionalistas europeus. Excelente! _ [URL],0
Faz esse favor pra gente [USR] [URL],0
'''''nao é que eu sou racista mas ele é  negro''''',1
RT [USR]: PSDB votou contra a 'privatização' da CEDAE. Isso não te contam né. Será mesmo que era um caso de privatizadores x estatiz _,0
"RT [USR]: 12- estou falando de empresários e grupos milionários, que se beneficiam de financiamentos que, a meu ver, deveriam se _",1
"[USR] vcs moram por onde? Eu moro na Aclimação, perto da Liberdade, Vergueiro, Paraíso...",0
[USR] a questão não é preconceito. É a ilegalidade! Drogas que entram pelo México e terroristas travestidos de refugiados.,0
"RT [USR]: Mulher que apanha de homem e ainda assim continua com ele é burra!! Att: Não perguntei nada, é burra e acabou",1
[USR] [USR] [USR] O felipe neto só toma esse refrigerante aqui [URL],0
"Nem um nem outro. Refute o que falei com fatos, lógica e verdades! [URL]",0
[USR] [USR] [USR] [USR] [USR] [USR] [USR] [USR] Eu também não votaria.,0
"A mídia está fazendo com esse prefeito, o que fez comigo. Eles forçam uma tá homofobia, rotulam, ridicularizam,... [URL]",1
"[USR] Ah, convivendo apenas comigo esse fds... Precisava disso... Pensando em mtas coisas e trabalhando no meio disso rs.",0
Não é o próprio governo ao estar sempre  a falar disto que causa mais ruído?? [URL],0
A minha casa não aceita refugiados aka Mónica,1
"E a última só pra não passar em branco, em Libertadores time bom de pênalti faz diferença, Flamengo está aquém.",0
[USR]  O problema que não temos estrutura pra acolher todos os refugiados e ilegais que aqui aportam estamos próximos a mendigar,0
"e nem precisa ser macho pra postar/pensar dessa forma, tem muita mulher assim também *ache a burra*",1
Novo trailer do OVERDOSE DE TOURETTE - ON THE ROAD. Hoje explicamos o que é um Rui Cruz #OverdoseDeTourette [URL],0
"DEFENDENDO AS BRANCAS E LOURAS . CONDENANDO O NEGRO.  RACISMO, ATÉ QUANDO? [URL]",1
"Para [USR] , o simples fato de apoiar [USR] é ser 'direita xucra'. Conversar o quê com um cara desses?? Babaca total.",1
Antes do 'Overdose de Tourette' chegar à vossa cidade decidimos apresentar-nos um pouco melhor. Eis Manel Cardoso. [URL],0
Ai meu deus como é bom ser vida loka,0
[USR] Bilhetes disponíveis aqui: [URL],0
[USR] SAPATÃO BABANDO EM CIMA DE MINA HETERO DESPERTA 01 ÚNICO SENTIMENTO: [URL],1
'Hoje é segunda-feira.' Um dia como outro qualquer. 'Mas olha que é dia 13.' Não sou supersticioso. 'A gasolina voltou a aumentar'. Foda-se!,0
"[USR] se for gorda, feia, mt magra, isso e aquilo, é DA MULHER e não de uma mulher específica cara....aiai vou nem falar mais nada",0
RT [USR]: Zoofilia? PSOL é um lixo ainda muito mais podre que o PT Só pode ser doença isso [URL] [USR] _,0
O FBI é totalmente incapaz de parar os 'infiltrados' na segurança nacional que permearam nosso governo por muito te _ [URL],0
Não vou pro céu! #fato,0
ESTAR ACORDADO SÁBADO DE MANHÃ DO CARNAVAL ISSO SEPARA NÓS: O POVO HONESTO E DIGNO DELES: QUE FICARAM ATÉ DE MADRUGADA SE DROGANDO NAS RUAS.,1
sorte de hoje: você não chama ricarda,0
É verdade que o CND não permitiu o FBI verificar o servidor ou outros equipamentos após descobrir que foram hackead _ [URL],0
[USR] Marcelo..assim foi o que a europa pensou..e está no CAOS pq deles. Sabe porque DUBAI não recebe eles ?pq da religião extrema,0
RT [USR]: Qual o seu voto nesse possível segundo turno:,0
Veto de Imigração É Uma das Ordens Mais Populares de Trump Até Agora' [URL],0
"Boom dia para quem sonhou com a sapatão mais linda,porém foi um sonho super bizarro q não lembro nem a metade",1
Meigo!  Nada como um bom e forte capitalismo de estado. [URL],0
"Eu, Nacionalista me confesso! [URL] #RenovarPortugal #Portugal",0
Não aceitamos o faz-de-conta da hipocrisia. Lutamos contra a censura do sistema e o marxismo-cultural. [USR]  [URL],0
"Bolsomito Kiridinha: 'Eu mesmo não acredito que isso ainda ocorra', disse o deputado sobre a desigualdade salarial entre homens e mulheres.",0
"Nesse Dia Internacional da Mulher, experimente dar panos de prato para alguma feminista, ela vai amar!",1
[USR] [USR] MENTIRA O BRASIL TEM DINHEIRO PARA AJUDAR REFUGIADOS QUE NUNCA CONTRIBUIRAM COM UM CENTA _ [URL],1
"Linda, [USR] Ajuda a divulgar: O primeiro livro da [USR] 'A ESCRITORA E O MUSICO' www.aescritoraeomusico.blogspot.com",0
[USR] quanto mimimi de cota pelo amor brancos melhorem,1
[USR] estamos destruindo essa porcaria. Avante!,1
[USR] na sexta feira [URL],0
RT [USR]: Angola ainda não ratificou o acordo ortográfico de Língua Portuguesa Escrevam bem yh,0
"[USR] pronto pistoleira, minha cara ta aqui agora é minha vez de pedir posta seu IMC [URL]",0
"Escudo acabou há 15 anos mas, p/ garantir uma boa regulação do sist bancário, o Banco Portugal optou por manter os quase 2 mil funcionários",0
RT [USR]: 30 fatos que mostram como a esquerda é incoerente e hipócrita [URL],0
"feliz dia da mulher pra mim, que aguento tanta gente ignorante, machista e burra, com um sorriso no rosto sem dar na cara de ninguém",1
O porteiro é [USR]! RT [USR] Massagear o EGO de uma mulher não é elogiar sua bunda e seus peitos. Isso o porteiro faz,0
Isso que é ódio #LGBT [URL],0
"RT [USR]: [USR] não sei, nunca vi o desenho em questão, porém se é para idades que não podem ver beijo gay também não pod _",0
Ansioso para o comício na Flórida amanhã. Grande multidão à vista! [URL],0
"Levante-se diante do cabelo branco, honre o homem idoso e tenha temor do seu Deus. Eu sou Jeová. (Lv. 19:32)",0
RT [USR]: [USR] O SBT virou o quê? A 'jornalista' Analice Nicolau disse que Bolsonaro falou: 'Você não merece ser estuprada porq _,0
"RT [USR]: PALHAÇOS! A secretaria da justiça e da cidadania de SP, multa Levy Fidelix por discriminação homofobica. Entra com uma _",0
"Uma #MulherDeVerdade gosta de agradar e dar carinho ao parceiro, mas não faz NADA  apenas pelo outro, ou que a desagrade.",0
Gostei de um vídeo do [USR] [URL] Era uma vez o homem - 8: As conquistas do islão,0
"[USR] [USR] [USR] pega no meu pau seu arrombado, ta defendendo o cara pq, é advogado desse maconheiro agora?",1
"Porra, sou muito burra... Sempre esqueço coisas que nenhuma mulher esqueceria",0
"#RTP Angola é bom mas não tem nota e economia, política muito baixo, Portugal também mas é mais seguro e flexível dos dois.",0
"JÁ, FAZ PARTE, TOMO UM BANHO RELAXO E 15 MINUTOS DEPOIS VOU PRA BATALHA DE NOVO. SE A MULHER NÃO ENTENDER É MARMITA _ [URL]",0
Covardes em busca da censura numa das maiores páginas de humor da direita br. #SomosTodosEditoraHumanas,1
Os 'média' são um pilar do sistema que combatemos. Deles só se podemos esperar mentira e/ou omissão. #Fakenews _ [URL],0
Daqui a pouco mudam de preto e vermelho p preto e branco,0
Grande primeira parte. Continuo a acreditar. VAMOS CARALHO! #BVBSLB,0
"RT [USR]: [USR] [USR] [USR] isso pra mim é irrelevante, queria pegá-lo mentindo, e consegui",0
esse tal de golpe aí é que nem o racismo tá nos olhos de quem vê,1
"O ruim de ter chileno branco é que depois de uns dias, ele fica preto",1
"Nossa!!!Esse povo do whats, não come, não dorme, são viciados.Jesus amado!!",0
"Esporte! Galo da Vila vence o Rio Branco e segue firme na ponta da tabela do #Capixabão. Detalhes no #ESTV1, ao meio-dia.",0
[USR] Lindo inclusive! Intrigante! Isso é massa!,0
[USR] [USR] a unica desvantagem é se levar uma bolada nas partes baixas ... kkkkkk,0
"RT [USR]: filho nunca segurou e nunca vai segurar macho, ainda mais se for esses mlq da vida,mulher q engravida sabendo q o cara é s _",1
[USR]  Ora bem... já está a perder a linha. O verniz dos 'tolerantes' acaba sempre por estalar.,1
[USR] [USR] [USR] OK...existem mulheres de direita e de esquerda. Se vc nao é bandida..foi pra vc tambem,0
"[USR] [USR] poxa, cê tá com medo de ficar enrugada? tá com medo que o filho da empregada entre na tua sala da facul?",1
[USR] [USR] a ideia não é ter razão Nat podes entrar na conversa se tiveres ideias aprendemos todos os dias,0
RT [USR]: Jandira Feghali está passando na sua timeline. [URL],0
RT [USR]: isto realmente eh uma grande rede de fufas,1
"[USR] Rachel, você é uma mita!!!!!!!",0
"[USR]  Não condenado tais práticas, mais não sou a favor até porque a Bíblia condena.",0
Um terrorista radical islâmico acabou de atacar o Museu do Louvre em Paris. Turistas ficaram presos. França de novo. SEJAM ESPERTOS EUA.,1
pleno dia internacional da mulher e eu ouvi um pai dizendo pro filho que a mãe dele é uma burra,1
COMPREI UM ESPUMANTE PRA AGRADAR A PATROA  AFINAL HOJE É DIA DELA #DiaDaMulher [URL],0
[USR] se vcs jogarem o user dela e a palavra 'negro' vão ver que só fala bosta,1
O cerco está se fechando pro Obama #ObamaInJail [URL],0
"Parabéns ao nosso novo Conselheiro de Segurança Nacional, general H.R. McMaster. Vídeo: [URL]",0
RT [USR]: Feliz dia das mulheres para todas as minhas seguidoras lindas e maravilhosas!  meu twitter parece um jardim: só tem flo _,0
tem que privatizar a porra toda mesmo tmj temer,0
[USR] [USR] nossa que estranho,0
[USR]  Cada um é livre de escolher o tipo de erros. Se prefere os novos erros está no seu direito. Mas por mim prefiro evitá-los.,0
Quando estás num primeiro date com uma miúda e do nada ela diz 'também já te vês a casar comigo e a ter filhos lind _ [URL],0
TROCO 2 TOMATES POR UM INGRESSO DO ROCK IN RIO.,0
finalmente os problemas do brasil vão se resolver com o governo do nosso querido e amado michel temer #TchauQuerida,1
"RT [USR]: Com todo respeito... no dia que sair uma criança pelo mesmo lugar de onde saem as fezes dos humanos, o Levy Fidelix pod _",1
[USR] seja bem vindo,0
"Um Governo corrupto, refleti em todos os poderes a total CORRUPÇÃO. Matar Bebês, é a maior CORRUPÇÃO humana.... [URL]",0
"Espero que não peçam ao Michael J Fox para bater palmas ao vencedor, senão nunca mais saímos daqui hoje #Oscars",0
RT [USR]: Toda mulher deve ser respeitada independente de ser ou não feminista Só as feministas que dizem lutar pelas mulheres nã _,0
"RT [USR]: kkkkkkkkkkkkkkk! que prestígio, Vô!!!! [URL]",0
Adeus #Obama!  'Faça boa viagem!'. [URL],0
"Me preparando pra ir pra Melbourne, Flórida. Vejo vocês todos em breve! [URL]",0
RT [USR]: Orgulho Hetero... show *w*,0
"RT [USR]: ... Agora refugiados com uma ideologia e Cultura completamente INCOMPATÍVEIS com as nossas, aí não tem como mesmo!",1
"[USR] faço isso todas as noites, mas não resulta...",0
minha diversão pós trabalho é discutir com fã de #karamel no [USR] e ganhar mais de 100 likes das sapatão.,0
Conviva com Branco e outras novas pessoas bem divertidas pertinho de você quando entrar no Badoo! [URL],0
feliz dia das mães pras mães de verdade  #NaoAoAborto,0
"Que grande retorno e vitória dos Patriots. Tom Brady, Bob Kraft e Coach B são verdadeiros campeões. Nossa! [URL]",0
[USR] deixa lá que não é apenas no Algarve...,0
acabei de pagar 20 reais em um carregador pq esqueci o meu. já começando o dia se sentindo a mulher mais burra do brasil,1
"RT [USR]: '21 anos sem Mamonas Assassinas' SE ELES FOSSEM VIVOS VOCÊ ESTARIA FAZENDO TEXTÃO ACUSANDO OS CARA DE MACHISMO, HOMOFOB _",0
"RT [USR]: [USR] Bob, o deputado está vencendo mais uma num site de esquerda. [URL]",0
"Que notícia, que relevância! Parabéns pela cobertura, [USR] ! [URL]",0
"Sapatão machista é uó. Pqp. Vai te tratar, mana",1
Frangas de plantão ! EU VOLTEI !!!!! CHHUUUUUPAAAAAA,0
"Dizem que o Barcelona enfiou 6 no PSG  porque, quando viu este de branco, achou que fosse o Santos. #jovempan  [USR] [USR]",0
"«Na Alemanha, multiplicam-se à enésima potência os ataques aos campos de refugiados. (...) não são os refugiados que atacam os alemães.»",0
falar a verdade. Te incomoda? [URL],0
"Pela primeira vez, o #PNR presente em #Coimbra nas Autárquicas. Coimbra terá assim mais encanto! [USR] _ [URL]",0
o pior de tudo que é uma MULHER defendendo um filho da puta que assume ser abusivo E ELA DEFENDE O CARA MIGA PARA VC TA SENDO BURRA,1
se tem uma coisa que eu odeio começa com 'PRE' e termina com 'TO' isso mesmo preconceito,1
"[USR] puta playboy maconheiro, ganhou filme exaltando ele feito com nosso dinheiro ainda",1
Musica 'Islão não é para mim' [URL] via [USR],0
"Quem se subjuga ao pensamento único, vive condicionado. Quem recusa a infâmia dessa agenda, vive livre! [URL]",0
Fds eus eu que hj é dia da mulher mas tas-te a fzr de burra como é que foi outra pessoas a escrever o teu título do _ [URL],1
Batalha de Pedroso – um dos primeiros embates da nacionalidade [URL] #Portugal,0
QUEM MATOU MAIS,0
RT [USR]: Burra é a mulher que vira piranha pra provocar ex..,1
[USR] [USR] Laranja Mecânica é chato,0
[USR] [USR] só não pode ser gorda e feia,1
"Glórias a Deus, fora abortistas... [URL]",1
Mais um país decadente... [URL],0
"Chilenos que fugiram de Caxias foram capturados em Madrid. Mesmo assim, estiveram mais tempo em liberdade do que o Porto em primeiro lugar.",1
"[USR] sim, coloquei na ordem de serem mais pesados mesmo",0
"Vamos fazer uma corrente? 'TWITTER, vem pros 160 Caracteres!!! Quem adere? #twiter160caracteres",0
"[USR] não dá p comparar, meu caro. Educação académica tem um processo exato a ser seguido, a educação moral, sexual e social não.",1
RT [USR]: Não concordo [URL],0
Video que explica porque a imigração em massa para países desenvolvidos não soluciona a miséria dos subdesenvolvidos [URL],0
Um novo dia é uma página em branco na sua vida. Escreva apenas o que vale a pena! Bom dia,0
RT [USR]: [USR] sorria tu ta sendo printado babaca!,0
"[USR] O Baldwin tem carta branca, senão não aceitava apresentar",0
RT [USR]: Até o psd tem um candidato à cml q é anónimo...,1
[USR] menina se não fosse o movimento feminista nem existiria o dia da mulher deixa de ser burra,1
"[USR] [USR] essa música tem uns 4 minutos, mas não achei ela completa no youtube..",0
"Uma #MulherDeVerdade acredita no amor, mas não vira refém dele.",0
Hipócritas feministas do governo da #Suécia. 'Corajosas' para gozarem com #Trump e cobardes submissas perante o _ [URL],0
[USR] os negro não tá nem aí pode usar o que quiser [URL],1
"ISP: outro “erro de percepção mútuo”? Além de faltar ao prometido, mentiu aos portugueses da forma mais descarada. [URL]",0
"Até agora, este é o melhor especial de stand-up que vi em 2017. Boa surpresa [URL]",0
[USR] vc nao consegue mais ver um filme sem que tenha politica no meio,0
"RT [USR]: Padre petista e acusado de pedofilia, Júlio Lancelotti, ataca gratuitamente [USR] . Ele tem moral p/ isso? [URL] _",1
Se vc tem um namorado que diz que não olha para as gostosas e que não bate umazinha nunca! FUJA: é uma franguinha sem caráter !!!,1
Assine a petição: Contra a construção de mais uma mesquita em Lisboa  [URL],1
"[USR] hahahaha, #brincadeirinhaboba rs tb acho",0
Polémicas? Disse o óbvio e com toda a razão. [USR] [URL],0
