text,label
quando eu passo na faculdade é mérito quando eu nao passo a culpa é da cota,0
RT [USR]: Resumi para vocês um pronunciamento sensacional do Bill Whittle feito dois dias depois da eleição do ano passado.... [URL] _,0
"Quando um país não pode mais dizer quem pode e quem não pode entrar e sair, principalmente por razões de segurança _ [URL]",0
A imprensa sempre do lado dos bandidos.  Pra quem ainda tinha alguma dúvida: [URL],0
"RT [USR]: [USR] Diria q todo esquerdista é um orgulhoso que fugiu das aulas de história, pulou aulas de filosofia e nao sabe _",1
"Depois de vender produtos ilegais o dia todo no centro do Rio, camelôzada se reúne pra queimar um no meio da rua: _ [URL]",1
"RT [USR]: Espero que a autobiografia do Cavaco venha impressa em papel de folha dupla. - Se alguém mo oferecer, arranjo-lhe util _",1
Não é só isso! Falta punição pra estuprador e assassinos! [URL],0
Isto acontece HOJE às 22h30 no 'Popular Alvalade' em Lisboa e está a 10 bilhetes de esgotar. Apareçam. RESERVAS: re _ [URL],0
CEO da Aetna: O Obamacare está no 'Espiral da Morte' #RepealAndReplace [URL],0
"RT [USR]: tinha uma mosca aqui e eu tirei a tela pra ela sair, mas ela não saía,  eu: vc é burra, minha filha aí uma mulher passou na _",1
Deus tem uma mensagem pra vc [URL],0
"[USR] eu não duvido, mas não custa tentar.",0
"Eu tô inconformada, chorando, como pude ser tão burra? Sempre pensei que a Solange do aviões era mulher do Xand. Não vou conseguir superar",0
RT [USR]: Jornal da Globo mostra protesto de 200 pessoas contra Trump mas esconde as MAIS DE 100 MIL a favor na noite de hoje [URL] _,0
Negociação do salário mínimo em Portugal [URL] #PNR,0
tem tanto negro nesse BBB q eles vão usar as estalecas pra comprar droga,1
Só podia ser mulher pra reparar roupa [URL],1
Os mais jovens do [USR]  #RenovarPortugal #Portugal #PNR [URL],0
Quão baixo Obama foi pra grampear meus telefones durante um processo eleitoral sagrado. Isto é Nixon/Watergate. Car _ [URL],0
[USR] como faço pra te passar conteudo?,0
Ai meu deus como é bom ser vida loka,0
já tava na hora de acabar com esse ciência sem fronteira um bando de pobre indo viajar pra europa no mesmo avião que eu?!????,1
RT [USR]: as fufas d lx são tão falsas q dói kkk,1
"RT [USR]: Como que essas meninas consegue ir pra escola toda bonitinha??? Eu vou igual um sapatão, ainda mais quando estou com so _",0
"Estão todos perguntando se é um VETO ou não. Chame do que quiser, o objetivo é manter os marginais (com péssimas intenções) fora do país!",0
"Vou ter que compra tudo branco , já ate sei mais ou menos onde acho isso .",0
"[USR] vc literalmente não deve ter nada pra fazer, viu.",0
"A ameaça do terrorismo radical islâmico é bem real, veja o que acontece na Europa e no Oriente Médio. Os tribunais _ [URL]",0
Eduardo Lourenço: “O islão sente a nossa fraqueza” [URL],0
"[USR] [USR] Religiosos ou não, devemos agradecer que estes reneguem o homossexualismo. Enquanto todos se calaram, só a......",0
"Em nome da tolerância tudo desculpam, mesmo que as vítimas sejam do seu próprio povo. [URL]",0
"Indo a Charleston, Carolina do Sul pra passar um tempo com a Boeing e falar sobre empregos! Ansioso. [URL]",0
"[USR] [USR] Meu Deus, lá é o próprio vale das sapatão",0
Falou 'populista' já sei que é da turma 'fake news' e RETARDADO! [URL],0
essas pessoas acabaram de visualizar seu perfil [URL],0
"RT [USR]: ... Agora refugiados com uma ideologia e Cultura completamente INCOMPATÍVEIS com as nossas, aí não tem como mesmo!",1
FELIZ DIA DA MULHER #SerMulherÉ não ser usada pelo feminismo de esquerda. [URL],1
"#LittleMix VC q por  acaso acha q Jesy é feia, gorda, se parece com a mulher do Chuck VC esta cego com problemas me _ [URL]",0
[USR] ta surpresa com celular na cadeia  ??? kkkkkk,0
Pergunto-me se as fufas comparam o seu cheiro com o da parceira,1
"Fascista, machista, nazista, trapezista, taxista, maratonista, eletricista, mas e corrupto? kkk [URL]",1
"RT [USR]: Ei [USR], olha só o que o Ministro das Relações Exteriores, [USR] acha de você....  Eu não deixava.... _",0
Pior recessão DA HISTÓRIA!!!!!  Parabéns a todos que votaram e defendem o PT! [URL],0
NÃO FOI 7X1 PORQUE O DAVID LUIZ SAIU DO P.S.G.,0
Meigo! Comunistas coerentes como sempre... [URL],0
"RT [USR]: COM MUITO ORGULHO FUI ELEITO O REI-MOMO DO BLOCO PORÃO DO DOPS DO MEU AMIGO [USR] DECOREM AS MARCHINHAS, A FOL _",0
"RT [USR]: Hj é mulher maravilhosa, mulher é isso e aquilo..amanhã é pq mulher é tudo burra, N pode dirigir, lugar de mulher é no _",1
[USR] [USR] é engraçado e retrata um pouco do lado 'marginal' de recife-olinda... esse é o twitter [USR],0
"Argumento: 'tu é burro' não refuta nada do que falei com fatos , lógica e verdade! VocÊ vive e se esconde dentro de _ [URL]",1
"Nós heteros, que AINDA somos maioria, devemos nos unir contra a ditadura da minoria. Abaixo a #heterofobia !!!!",1
RT [USR]: Olhem a 3 com carinho  [URL],0
Tem STF nas Filipinas ??? acho que não né :),0
hahahahah olha que coisa! os que mais vivem em mimimi me acusando de mimi  hahahahah [URL],0
"tem nada de gorda e feia, smp foi linda nenem —_   [URL]",0
"[USR] [USR] Cuidado com a burra!  Proteçao na EDIÇÃO, mulher! O programa ta 'pintando' ela como uma vitima e perseguida",1
RT [USR]: Eu farei a biografia do Bolsonaro [URL],0
RT [USR]: PNR presta homenagem ao último grande Estadista que Portugal viu nascer.  #notascampanha #RenovarPortugal [URL],0
Apesar de não gostar de fazer malas fazer a mala para Angola a esta altura do ano vai bater pq só vai entrar roupa de verão,0
"RT [USR]: Existem mulheres ladras, canalhas, safadas, dissimuladas.... sinto muito se voce não sabia disso !! Feliz dia das mulh _",1
Acabei de ouvir uma cigana dizer q 'os chineses são um povo sujo e sem higiene q vive e dorme em qualquer lado'. O cliché morreu hj às 16h09,1
RT [USR]: Derrubar o Estatuto do Desarmamento será A MAIOR VITÓRIA DO POVO BRASILEIRO ao longo de toda a sua história.,0
bicho me senti muito burra só ouvindo essa mulher falar #MasterChefBR,0
"RT [USR]: '21 anos sem Mamonas Assassinas' SE ELES FOSSEM VIVOS VOCÊ ESTARIA FAZENDO TEXTÃO ACUSANDO OS CARA DE MACHISMO, HOMOFOB _",0
faz pontaria em qlq coisa q der na telha com jato de mijo.,0
"[USR] sim, a maioria do eleitorado é mulher, 51%",0
eu mesmo minha afilhada [URL],0
o que posso usar para lavar tênis branco?,0
"Não vou orar, sou ateu [URL]",0
"Se a minha namorada também só tivesse 30 segundos para me responder quando discutimos, evitavam-se tantos problemas #Oscars",0
"Eu não me importo se a pessoa é magra gorda feia bonita se é de humanas ou exatas, se ela me tratar bem eu vou retribuir da mesma forma",0
[USR] Tb soninho.. e eis que trabalho amanhã. hj é feriado em sampa e tb trabalho rs affff rs,0
"E tbm pelos refugiados, por qm não tem casa, pelos q passam fome, por qm foi abandonados pelos pais ou familiares e enfim por todos q sofrem",0
Via Estadão:  -  [URL],0
[USR] ela é sapatao? So perguntando pq vou incluir no meu tcc,0
"Tô na beira da piscina e a pessoa vem perguntar se eu tô de biquíni, tô não po, tô se burca",0
A era em que 'homens' começam a usar cor de rosa [URL],1
Dica do dia! [URL],0
RT [USR]: Fazer pesquisa de intenção de voto pro Bolsonaro no Twitter é igual fzr o msm pro Trump no Tumblr.,1
sou um ser homossexual que só quer se dar com heteros porque as fufas ficam a lamber os dedos cheio de batata na minha frente.,1
"Dizer isso não é censura ou acabar com a sua liberdade de expressão.se vc acha q nasceu no corpo errado, a socidade _ [URL]",0
"[USR] Então, reflita no teu comentntário, friend. E não esotu justificando ou defendendo pq é famosa. Faria com qq Pssoa! Abç",0
'83 negros mortos por dia no brasil' e os brancos não morrem também???,1
[USR] [USR] frescura no cu dessas nega do mov. negro,1
"Acompanhe minhas agendas sobre Ideologia de Gênero, em todo País. [URL]",0
"[USR] Não deixe as lembranças e saudades te minarem. Enfrente, ouça músicas.. (Essa é linda msm). Conhece The Corrs?",0
"Aumento nos combustíveis: 3 passos à frente, 1 passo atrás, 3 passos à frente... Assim não há progresso económico. [URL]",0
"[USR] caraio. lisinha, ai sim!",0
[USR] [USR] não acompanha time de meninas!,1
RT [USR]: Mulher burra me da nojo!,1
Hj eu to putasso,0
"RT [USR]: Como eu disse, eu vi.  [USR] atirando com bala de verdade em manifestação. [URL]",0
"RT [USR]: aqui o salto eh 10 mil pés sem paraquedas, é andar na prancha com tubarão branco a sua espera",0
"[USR] sim, ontem em SP",0
[USR]  Obrigada... Só se for agora....rs,0
"[USR] Oi, cara-metade do desastre mor... dei umas fuçadas hj no blog!",0
riquinha feia e gorda —_ Yha ando aqui a rebolar para a vida  [URL],1
sabe quando voce eh feia e a sua cara eh gorda? eh o meu casokkk-chorando-,1
'....não tem barriga tem calo sexual...',0
RT [USR]: quem da fiufiu pra isso serio na moral nem passarinho mais facil um bem-te-vi latir pra não pegar mal assobiar [URL] _,0
