text,label
"RT [USR]: Até que enfim, os artistas (de bem), estão começando a se manifestar: [URL]",0
"RT [USR]: O discurso do Trump no Congresso teve 43 milhões de espectadores, e o Oscar teve 32 milhões de espectadores  HEUEHUEH",0
"RT [USR]: A grande mídia e autoridades locais ignoraram: Rotherham, a cidade que teve mais de 1,400 crianças estupradas por islâmi _",0
[USR]  Faz ele muitíssimo bem!,0
"Não Tanto Quanto Você Militante [USR] Defensora De Ditaduras Em Angola, Cuba e Venezuela e Defensora Da _ [URL]",0
"Ele ataca imigração ILEGAL, seus idiotas! E qual o motivo das aspas no mérito? É ótima ideia! Vcs contratam funcio _ [URL]",1
"[USR] caralho queria ficar no palco do strokes o dia todo pra pegar grade mas duran duran nao vai tocar no mesmo, que porra da angola",0
to começando a achar que a minha vida tá assim por causa daquelas correntes do orkut que eu não repassei,0
Onde classificam é o menos. Desta vez tendo a concordar com [USR] (mas não se habitue). Trata-se de devassa grat _ [URL],0
Enquanto as mulheres falavam sobre a campanha 'Carnaval sem preconceito' e distribuíam material de divulgação em... [URL],0
"garota vai se tratar! Eu esfrego argumentos lógico, fatos e verdade na tua cara, mostrando o quanto vc é uma ingênu _ [URL]",0
O que o Barcelona acaba de fazer vai ficar para sempre na história do futebol. Que remontada incrível!,0
A atenção finalmente está voltada aos infiltrados desocupados! Eles serão pegos! [URL],0
"É suposto a religião não ser critério para discriminar refugiados. Nem pela negativa, nem mesmo pela positiva. [URL]",0
RT [USR]: HORA DE ACABAR COM OS CORRUPTOS  VAMOS OCUPAR O CONGRESSO A PM É POVO [URL],0
RT [USR]: [USR] essas aqui também não... [URL],0
RT [USR]: [USR] Mas não seria muito incômodo?,0
Download de cabelo afro pra the sims 4 = pra ilustrar a guria coloca um monte de sim branco e loiro. MIGA.. QUE QUE CUSTA..?,0
"[USR] então pra falar dos Sírios refugiados, eu teria que ser um sírio refugiado? (juro que não é gastação)",1
"RT [USR]: 13 anos: - mãe finalmente minha menstruação veio - larga de ser besta, tu furou o cu no prego da cadeira, wagner",0
[USR] [USR] pra eles o cara do BB que é jornalista [URL],0
"'Erro de percepção mútuo', ou mentira constante? Dão tantas vezes o dito por não dito. [URL]",0
"[USR]  Só pensa no Trump. Só fala do Donald. Algum fetiche? Claro que ele é uma esperança de um novo amanhecer, mas varie no tema. ;)",0
Pergunto-me se as fufas comparam o seu cheiro com o da parceira,1
"Tpm é um saco, me sinto gorda e feia",0
Se nem presidiário tem pena de estuprador (os caras são estuprados lá dentro mesmo) pq a esquerda quer que a gente tenha?,1
[USR] [USR] [USR] [USR] OPA puta desculpa burra pra passar a mão na cabeça de mulher errada,1
"que bosta de centro-direita é essa??  hahahhah  essa merda é duto esquerda disfarçada , ora!!!!    'Ai ai ai sou de _ [URL]",0
- mas pq vc quer o impeachment? - FORA PT  - mas se a dilma sair entra o temer com o cunha vice - FODA-SE FORA PT,1
"'No livro best-seller do New York Times “Má-feminista:  ensaios provocativos de uma ativista desastrosa”,... [URL]",0
[USR] Ta falando do Felipe neto [USR],0
O [USR] é tão lixo que está acusando o [USR] de ser o mandante da exposição da filha da Maria do Rosário,1
"Com tantos jornalistas à sua volta, Pinto da Costa já nem um café com leite pode tomar tranquilamente em Guimarães...",0
'Emirados Árabes querem ir a Marte e construir uma 'Dubai' lá até 2117'  -UOL  Por que não usam essa grana para ajudar os refugiados irmãos?,1
"'Refugiado estão morrendo de frio na Grecia''. Que bom,pelo menos com o pau congelado eles n conseguem estuprar mais nenhuma europeia",1
PARABÉNS PRESIDENTE EDUARDO CUNHA,0
Na minha época o padre só pagava um pastel e um caldo de cana [URL],1
RT [USR]: Gente comum com frequência deixa-se levar pela histeria de esquerda. É preciso descrever na íntegra o quão ridícula ela é. M _,1
"RT [USR]: [USR] [USR] liga não mano , claro que ela tem carimbo no passaporte rs .. Ela veio p brasil refugiada da an _",1
olha o Bruno mesmo sem jogar está mostrando que é o melhor goleiro em pegar penalidades máximas,0
RT [USR]: [USR] [USR] existe alguma pauta feminista que não seja de extrema esquerda?,0
Arnold Schwarzenegger não pediu pra sair do Aprendiz. Foi demitido pelo fraco (ridículo) Ibope dele não por mim. Tr _ [URL],0
"No dia da mulher, nao vi 1 palavra do movimento feminista pra defender essas mulheres do ISLÃ. Ja pra defender o co _ [URL]",1
[USR] é a ixquerda desconstruindo a pedofilia,0
16:25 CUNHADO DA ANA HICKMAN CONTA COMO DESARMOU O PSICOPATA E ACABOU COM A RAÇA DELE. É APLUDIDO DE PÉ. MUITA GENTE CHORANDO (DE EMOÇÃO),1
[USR] estou preparada já [URL],0
Nada me move contra um homossexual. Conheço alguns. Sejam livres. Mas é anti-natura e a sua promoção é aberrante! [URL],0
"País quebrando, desemprego pra todo lado, violência comendo solta e vem falar em 'FOLIA', PQP!!!  VTNC essas merda _ [URL]",0
O [USR] nem assumiu e já causa esse choro todo na pelegada em pleno começo de 2017. Imagine como será ano _ [URL],0
"GUERRA LEGAL: 'Notadamente, em toda opinião, o painel não se preocupou em citar este (o) estatuto.' Uma decisão des _ [URL]",0
"Minha mãe queria q eu procurasse uma mulher no Facebook e essa foi a descrição: Ela é baixinha, gorda e tem a cara bem feia. Tô chorando",0
"Já achava a ' Bela e a Fera' ,ridícula mesmo. Disney sai do armário:  ‘_A Bela e a Fera’_ terá romance gay... [URL]",1
Da mesma forma q eu enfio o pau em algumas pessoas (mulheres) e outras não (homens). Chama-se: escolha pessoal e vt _ [URL],1
Infelizmente isto não vai lá com petições. Os imbecis que promulgaram tal aberração têm a faca e o queijo na mão e _ [URL],0
tava me inscrevendo no Sisu e não achei a opção cota para branco.... MEC assim n da pra te ajudar miga,1
Presidente dos dragões voltou a mostrar o seu descontentamento | Invicta de Azul e Branco [URL],0
"[USR] [USR] [USR] vai ow, vai se preocupar com a tampa",0
"O ruim de ter chileno branco é que depois de uns dias, ele fica preto",1
Feliz dia do amigo que faz escolhas erradas!,0
"[USR] Normalll.. imagina a situação da pssoa tb ne, fodas...",0
PS: TROCO POR UM CRENTE! PAGO A DIFERENÇA!!!!,1
Olha o processinho na pistoleira [URL],1
O Irã foi ADVERTIDO formalmente por disparar um míssel de guerra. Deveriam agradecer pelo ridículo acordo que os EUA fez com eles!,1
[USR] [USR] chamam os cristãos de ignorantes mas quem ta na universidade e acha isso normal..é porque sofreu lavagem cerebral,1
"Bem vindos de volta ao 'PREC', na Nova. A arruaça esquerdalha e o marxismo cultural mandam e todos se encolhem? Vergonhoso! [USR]",1
Ai meu deus como é bom ser vida loka,0
RT [USR]: Como vai dar certo um pico desse? [URL],0
OBRIGADO SÃO MUITAS PERGUNTAS NÃO DA PRA RESPONDER TUDO 11:30 VOU FUMA UM CIGARRO BEBE UMA CAIPIRA COMPRA UM FRANGO ASSADO  #JoaquinResponde,0
"tem mão de homem, ou seja, com calos.",1
"Bom dia! Alguém sabe que dia o [USR] toma posse como Prefeito do Rio??!?  Cidade ABANDONADA, CAÓTICA E SEM QQ ORDENAMENTO!",0
"A esquerda inventa o problema, incute na cabeça das pessoas que o problema existe, repete a mentira até que acredit _ [URL]",0
Inf. são passadas ilegalmente ao falido [USR] e [USR] pela comunidade de inteligência (NSA e FBI). Com _ [URL],0
Um novo dia é uma página em branco na sua vida.  Escreva apenas o que vale a pena.  Bom dia! [URL],0
Há censura ao PNR com dano eleitoral e atraso no seu crescimento. A nossa luta pela mais elementar justiça não pára! [URL],0
ÁS VEZES O SALÁRIO POUCO IMPORTA QUANDO A GENTE TRABALHA SENTINDO PRAZER [URL],0
ainda bem que eu sou sapatão e não preciso disso,0
Egípcio tenta entrar no Louvre com uma naifa - Terrorista. Canadiano de olhos azuis dispara sobre 40 pessoas numa mesquita - Lobo Solitário.,1
"[USR] qnd eu fui, ainda não tava essa crise de refugiados, mas tinha mt ambulante e pessoas q vc via que tava tentando sobreviver",0
Este é o 1º País do Mundo a proibir o islão e a fechar mesquitas [URL],0
Grande primeira parte. Continuo a acreditar. VAMOS CARALHO! #BVBSLB,0
esse é o seu argumento?   hahaha você vive uma mentira e tem medo de ser desmascarada! [URL],0
Dia de Portugal! [URL],0
ESSE CARA SOU EU [URL],0
[USR]  Os democratas... gente 'tolerante' que não sabe aceitar a mudança que se está a operar.,0
Sua mãe admirando as estátuas qdo faz turismo [URL],0
RT [USR]: O PODER EMANA DO POVO A PM TAMBÉM É POVO BRASILEIRO  [URL],0
Bora Benfica. ACORDA CARALHO!,1
"Pela Europa das Nações livres e soberanas, este é e sempre será o nosso modelo! [URL] #EU [URL]",0
"Hoje, às 19h45, na #RTP1: tempo de antena anual do #PNR. A não perder! E... divulgar. [URL]",0
Para se #RenovarPortugal urge desparasitar a classe política e dirigente. Árvores podres só dão frutos podres. #PNR [URL],1
"Peço desculpa malta,mas hoje não consegui chegar a tempo ao estádio para fazer o ritual de início de jogo. Estou a chegar pra darmos a volta",0
Desconfio que a NASA só não anunciou ter descoberto vida num dos 7 planetas com receio que o Trump mandasse construir outro muro...,0
Estas poeiras vindas do norte de África entram impunemente em Portugal e sujam os carros todos. Para quando a construção de um muro?,1
decepcionadissimo com o novo BBB,0
RT [USR]: eu ainda não superei o fim de 2010,0
nada contra negros mas minha filha não vai trazer bandido pra casa não...............,1
"RT [USR]: Não há SÓ direita e esquerda, crianças. Há gente comum, alheia à batalha. Parem de achar que tudo é explicação à esquerda e _",1
"RT [USR]: A ESTUPIDEZ, FALTA DE CARÁTER  E CINISMO DOS ESQUERDISTAS NÃO TEM LIMITES.... [URL]",0
RT [USR]: Incrível a facilidade que sapatao tem pra namorar,1
"Presidência d França! p/os q já foram cúmplices na destruição d países árabes, c/a consequente maior onda de refugi _ [URL]",0
Pra quem tá com pena de traficante de drogas... principalmente as mulheres e feministas . [URL],0
de certezinha q vai haver gente a usar isto só pq é produto novo da nike qd nem sequer têm qlq ligação c o islão [URL],0
"Gente, sapatão é uma coisa q me assusta [URL]",1
"Foi lamentável e assustador ouvir de Mr. Catra, a seguinte afirmação: “Na realidade não foi o branco que... [URL]",1
Não tinha reparado com aquela menina é gata,0
Vale a pena leitura. [URL],0
Passando aqui pra desejar feliz #DiadaMulher  pra quem é mulher desde o ultrassom,0
JÁ IDENTIFIQUEI O ESTAGIÁRIO QUE ONTEM A NOITE ACESSOU O MEU PERFIL RESERVA [USR] EMBRIAGADO E ESCREVEU ASNEI _ [URL],0
meu tio disse que quer mudar meu gosto musical.. ATREVA-SE,0
Que mundinho pequeno esse de Sapatao ne  a gente descola cada fita da namoradinha dos outro,1
"Lisboa, minha bela cidade, a cuja presidência da Câmara me vou candidatar. [URL]",0
heterofobicos não passarão,1
"[USR] [USR] essa música tem uns 4 minutos, mas não achei ela completa no youtube..",0
Sr. [USR] gostaria q lesse minha humilde e desesperada carta. [URL] n quero ir pro inferno! q faço c meus escravos?,1
"RT [USR]: Como vamos estipular idade mínima de 65 anos para aposentadoria, se o cidadão arca com toda política de incentivos, bols _",0
RT [USR]: as sapatao vao domina o mundo [URL],1
"Sair às ruas para manifestar apoio a Donald Trump: babacas, palhaços, idiotas, estão nem aí p/ Brasil! Sair às rua _ [URL]",1
"Nem mais! Não gostam, não comam. Façam boa viagem! #ForçaTrump [URL]",0
[USR] [USR] [USR] O felipe neto só toma esse refrigerante aqui [URL],0
Alguém sabe se o Habibs já abriu falência com o boicote por causa do menino que morreu de tanto usar droga?,0
"RT [USR]: Vitória (ES), Praça 8, a partir das 8 horas, dia 8 [URL]",0
"Filme de País Iraniano que apedreja gays e degola cristãos,ganha Oscar de filme estrangeiro e diretor crítica _ [URL]",1
por isso que dizem que espelhos não são confiaveis eles te deixam feia e gorda [URL],0
[USR] ele só vai preso se ele fizer uma piada com gorda...,1
PARA QUEM NÃO SABE 'AMOR E SEXO' É AQUELE PROGRAMINHA 'LACRADOR' QUE APANHA DA PRAÇA É NOSSA NA AUDIÊNCIA. _ [URL],0
[USR] Bilhetes disponíveis aqui: [URL],0
"Você deve estar se perguntando: o que isso tem a ver com a hashtag #PrimeiroAssédio, mas eu já chego nessa parte...",0
[USR]  Óbvio! Só não vê quem não quer. #Trump #PNR,0
[USR] ela podia pelo menos se preparar vestida de burca ninguém é obrigado a ficar olhando esse corpinho aí não. Eu heim!,1
E na [USR] NOTÍCIAS FALSAS Bernie Sanders foi tirado do ar ao descrevê-los com o termo notícias falsas. Alegaram dif _ [URL],0
[USR] vc devia calar a boca pq vc é tão racista quanto,1
"Quem gosta de Feminismo são mulheres que se odeiam e odeiam homens, ou desavisados que desconhece a Desconstrução... [URL]",1
"ainda que eu falasse a lingua dos homens e dos anjos, usaria ambas pra denegrir sua imagem",0
"[USR] prefiro acreditar q ela pensa q o Uber q escolhe, contratando. Antes desinformada do que uma burra fazendo psolzice",1
Confira a contribuição de uma de nossas integrantes para o blog da marca Insecta Shoes! 'Será que realmente somos... [URL],0
Guionista do SNL faz piada acerca do filho do Trump na sua conta pessoal do Twitter é despedida e obrigada a pedir desculpa. 'Liberdade',0
RT [USR] Emilly pede para tirar todas as caixas de leite da casa 'Agora só bebo leite de saquinho' desabafou a sister [URL],0
"Acompanhe minhas agendas sobre Ideologia de Gênero, em todo País. [URL]",0
"filho nunca segurou e nunca vai segurar macho, ainda mais se for esses mlq da vida,mulher q engravida sabendo q o cara é safado,é burra sim",1
[USR] por isso eu sou sapatao. super indico.,1
"RT [USR]: Triste verdade que tantos teimam em não querer ver. Quanto mais tarde se reverter a situação, mais difícil será. #Islão _",0
RT [USR]: Sinal de que estão com medo de Bolsonaro: a imprensa já trabalha pautas ridículas contra ele | [URL] _,0
tecnica em automaçao mas eu nao consegui e nao e pq sou burra e nao fui boa o suficiente nas provas de pré- requesito e sim pq sou mulher,1
"Voltei do hospital agora, fui ver um tio que tá gay. Ele tá melhor, já tá pegando nos peito da enfermeira",1
tem mulher que e burra invés de seguir em frente anda pra  trás pra cometer o mesmo erro,1
É imperioso acabar com o terrorismo incendiário e com as negociatas à volta dos incêndios!  [URL],0
"RT [USR]: Aqui não há lágrimas por #Soares nem elogios fúnebres a quem sempre considerei traidor, inimigo e que se sentia intocáv _",1
"'Quando a misoginia é premiada' - artigo de Vanessa Fogaça pro nosso blog, confiram! >> [URL]",0
"Vou repetir a pergunta pq tem uns nego q são burro pra caralho. Qual vc comia (com o pau, o seu) primeiro?! [URL]",1
[USR] pois é... deu em mim tb,0
RT [USR]: O [USR] apenas está mostrando que pagar de politicamente correto na internet é apenas uma MODINHA. Amo essa @,0
e foi criado um novo termo 'nudez intelectual'....a mesma que acontece quando voce ta cagando pelado antes do banho _ [URL],0
"[USR] Miga, dá uma fuçada lá, primeiro livro da minha amiga [USR] www.aescritoraeomusico.blogspot.com (eu reviso)",0
"Apesar de serem da Australia, AC/DC é uma banda de homens de verdade!",1
"[USR] agora que tu falas nisso, até faz sentido...",0
Burra é a mulher que aceita ser amante!,0
RT [USR]: Por que sapatão sofre tanto,1
[USR] essa é a mina do bbb que mandou o cara botar leitão quente na boca dela,0
[USR] ngm perguntou sua opiniao de branca sobre racismo e vc deu então acho q estamos na mesma,1
"Ué, mas elas acabaram de falar que NÃO querem igualdade na aposentadoria e no metrô... Ué?? [URL]",0
"RT [USR]: 12- estou falando de empresários e grupos milionários, que se beneficiam de financiamentos que, a meu ver, deveriam se _",1
"ISP: outro “erro de percepção mútuo”? Além de faltar ao prometido, mentiu aos portugueses da forma mais descarada. [URL]",0
"[USR]  Então, viva o PNR, certo, sr. Primeiro Ministro? :)",0
Filme de ex ativista gay que se tornou pastor causa polêmica -... [URL],0
[USR] [USR] Mulçumanos matam cristãos e ele não fala nada. Defende a ida de refugiados mulçumanos para a Europa.,0
eu to muito sapatao scrr,0
Jantar de negócios a noite com o Primeiro Ministro do Japão Abe e seus representantes na Casa Branca de Inverno (Ma _ [URL],0
RT [USR]: FELIPE NETO X PASTOR MALAFAIA  IGUAL A ARGENTINA X ESTADO ISLÂMICO NÃO TEM COMO ESCOLHER UM LADO SÓ QUERO VER SANGUE #PAZ,1
[USR] [USR] [USR] pois é cara,0
"[USR] são irônicos e se você concorda com algum, reveja seus conceitos <3",0
"Sócrates processa Estado português! Ou seja, Nós, vamos ter d o indemnizar. A transferência será feita direta/ para ele ou através do amigo?",0
"Fora que só tem frangas ali. Bombadinhos chiliquentos, gays que exploram suas condições e pedaços de carne para a massa carcerária!",1
O Barcelona empatou no campo do Bétis depois deste golo não ter sido validado. É óbvio que #ACulpaÉDoBenfica [URL],0
[USR]  Os 'cumpanhero' quebraram todas as regras.,0
"[USR] essa é a questão! O Bahia vai bancar Levir Culpi? Marcelo de Oliveira? Osvaldo? Ou querem Joel Cruz, Arruzinho, sapatão e etc.?",1
acho que o cara da redação do Enem deveria perder pontos pq não ficou claro o sabor do miojo,0
RT [USR]: OTÁVIO MESQUITA DECLARA APOIO A JAIR BOLSONARO [USR] [USR] [USR] [USR] [URL] _,0
POPULISTAS Novo termo da moda da mídia que obviamente nem sabe direito o que significa. Importante msm é 'comparar _ [URL],0
"RT [USR]: [USR] Viva o Islã! Religião que bate nas mulheres, apedreja, decapta, manda se cobrir dos pés à cabeça e q as feminista _",1
"E tbm pelos refugiados, por qm não tem casa, pelos q passam fome, por qm foi abandonados pelos pais ou familiares e enfim por todos q sofrem",0
Claramente Karen Jesuíno nunca namorou na vida [URL],0
"Ator comunista (c/ pingente do genocida Che) vivendo uma vida de gastos exorbitantes em mansões na França, jatinhos _ [URL]",0
RT [USR]: O Lula ligou pra Élika. E é por isso que ela vai pular desse precipício. [URL],0
"Parabéns, mais uma notícia sobre a Desconstrução do filme a Bela e a Fera.Nosso apoio irrestrito ao casal donos... [URL]",0
[USR] Tem outras teorias tambem.... [URL],0
"RT [USR]: '21 anos sem Mamonas Assassinas' SE ELES FOSSEM VIVOS VOCÊ ESTARIA FAZENDO TEXTÃO ACUSANDO OS CARA DE MACHISMO, HOMOFOB _",0
"Sugestões para um 2010 melhor: menos Calcinha Preta nas rádios, aliás, sem calcinha é bem melhor!",0
DICA DE FANTASIA BARATA PARA CURTIR O CARNAVAL: 1. MARQUE DE IR EM UM BLOCO 2. NÃO APAREÇA 3. DIGA QUE FOI FANTASIADO DE “PAI DE FEMINISTA”,1
O NYT agora é médico.  E tá se roendo com sua insignificância cada vez maior [URL],1
ESSE IBRA É UM FINAZZI COM RABO DE CAVALO,0
"Calma sportinguistas, já podem respirar de alívio. O Benfica ganhou ao Braga. O vosso 3º lugar está quase garantido",0
'De manhã eu fico sozinha em casa porque todos os meus irmãos vão pra escola e minha mãe vai trabalhar. Aí eu... [URL],0
alguém faz a adaptação com a foto da Dilma e os 12 milhões de desempregados!!!!,0
"- 'Ain o Dória está indo bem nesse últimos 2 meses,se ele candidatar para presidente pelo PSDB em 2018 votaria nele _ [URL]",0
"RT [USR]: 30- Ana Carolina, 42 Anos. rainha das sapatão, uma voz é uma voz, uma coisa linda dessas [URL]",0
Não é o próprio governo ao estar sempre  a falar disto que causa mais ruído?? [URL],0
Acorda pra trabalhar ae cambada de vagabundo,1
[USR] [USR] tá curtindo gente feia e gorda,1
"Acho irónico que uma mulher que ajudou a NASA a andar para a frente, esteja numa cadeira de rodas #Oscars",1
o lula nunca acertou a nota azul do guitar hero,1
[USR] sim! falar em trabalho pra essa galera é muita ofensa,0
A redução da pena para estupro de vulnerável seria um retrocesso gigante na legislação brasileira. Primeiro... [URL],0
"Ser presidente é sinal de ser excepcional, vide Temer, Collor, Lula, Sarney, Castelo Branco, Jango, Getúlio, todos _ [URL]",0
[USR] [USR] [USR] [USR] Quando abro a TL e vejo ensaio fotográfico de  feminazi  gorda  e feia. #MinhaDorImporta,1
"Feliz seja o dia da mulherada, feia ou bonita, magra ou gorda, todas as mulheres merecem respeito. #QuartaDetremuraSDV",0
chá de chá (chá verde chá preto chá branco) todos parece só água ah nem,0
"[USR] parece q teve uma ae, mas não em SP",0
[USR] essa mulher é burra demais ou se faz? pqp,1
"Os 'homens' do governo da Suécia. Sem bolas, afeminados... Não é por acaso que os 'refugiados' deitam e rolam naque _ [URL]",1
o intelectual é um tipo k chega às mesmas conclusões do povo mas com uns anos de atraso [URL],1
A feminazi [USR] tem a cara de pau de pedir dinheiro em seu blog - mesmo ganhando uma boquinha de 11 mil - v _ [URL],1
[USR] É a melhor banda,0
"RT [USR]: 15- muitos criticam o liberalismo e o capitalismo, mas a verdade é que o Brasil nunca foi verdadeiramente liberal.",0
Este 'aquecimento global' está mesmo severo.,0
RT [USR]: Até o psd tem um candidato à cml q é anónimo...,1
RT [USR]: [USR] Viva a família tradicional e não a família artificial...,1
[USR] quando vacila assume rapidamente a responsabilidade e paga o erro com humor!,0
"gorda' não é ofensa, assim como 'magra' não é elogio. Pare d se achar 'feia' por essas regras d 'beleza' imposta pela sociedade",0
[USR] não sou tua miga E daí que são de 2013? Preconceito não é opinião pra mudar conforme o tempo passa. É algo puro e simples! Gordofóbico,1
RT [USR]: 30 fatos que mostram como a esquerda é incoerente e hipócrita [URL],0
Governo Trump tem sido visto com mais confiança que os jornais' [URL],0
Aviões C-130 equipados com kits de combate aos fogos foram descontinuados por decisão política em finais dos anos 90 [URL],0
Foda-se Esqueci-me que todas as feministas são fufas [URL],1
"[USR] [USR] [USR] burra pq não concordo com vcs? Pensei q a mulher fosse livre. Ah, é...A liberdade acaba quando discordam d vcs",0
"RT [USR]: O [USR] deveria, como fizemos, visitar o Museu do Holocausto antes de desdenhar do sofrimento dos judeus pa _",0
"RT [USR]: com a carrada de dinheiro q voou daqui,e como a Cristas diz q Portugal deve muito a Núncio,o mínimo é dar o nome do home _",0
Evitar carne de ganso (quizila de Oxum) Não comer carne de pombo ou galinha d'angola Não ter dentro de casa penas de pavão pq tiram a sorte,0
RT [USR]: já tava na hora de acabar com esse ciência sem fronteira um bando de pobre indo viajar pra europa no mesmo avião que eu _,1
"RT [USR]: Gays franceses estão migrando para a direita; e a razão disso é bem simples, o avanço do islamismo na Europa. [URL] _",1
"RT [USR]: Bom dia, contribuintes! Quando é que há uma comissão parlamentar de inquérito sobre a inutilidade das comissões parlamen _",0
"RT [USR]: queria comer polvo, mas o da copa gerou apego",0
A Alemanha tornou a sentir os “benefícios” dos (i)”migrantes” da invasão islâmica.  [URL],1
Homem que é homem só come carne. Peixe é coisa de bixa.,1
"RT [USR]: 2) é a prova cabal da ligação íntima entre o PT e a guerrilha colombiana, que tantos negavam e chamavam de 'teoria da cons _",0
RT [USR]: [USR] As mulheres de direita sempre são lindas! haha,0
"triste, louca ou má?",0
porra! Dizer isso no dicionário é fácil!!! Papel aceita tudo!!  Quero ver na prática! Vou te desmontar nos comentár _ [URL],0
"[USR] Oi, bonita dá uma fuçada lá, primeiro livro da minha amiga [USR] www.aescritoraeomusico.blogspot.com (eu reviso)",0
[USR] [USR] Laranja Mecânica é chato,0
Maometanos a colonizar q Espanha querem casar com Espanholas como forma de propagar o islão. [URL],0
RT [USR]: eu to dando vários berros com o [USR],1
[USR] heueheueheu eu fiquei achando que o branco era arroz tb mas não faço ideia (e olha que gosto de açaí),0
"'Movimentos anti-Dilma', ahahahahahaha!!!!!  É tão somente qualquer pessoa sensata e baseada em números. Aliás, a _ [URL]",0
"[USR]  Há que saber aceitar as mudanças, certo? ;)",0
#OBomDeSerBrasileiroÉ que pelo menos nao vem refugiados do Oriente médio pra k os caras nao sao burro,1
RT [USR]: isto realmente eh uma grande rede de fufas,1
Estocolmo: capital das violações! As mulheres andam com medo e mudam hábitos de vida. 'Welcome R(ap)efugees'? _ [URL],1
'oi lembra de mim?' 'eu nao lembro nem o que eu comi ontem rsrs' 'voce me comeu ontem',0
"[USR] não será antes, petinga?",0
RT [USR]: E assistir a qualquer momento aqui: [URL] [URL],0
[USR] [USR] só é legal pq mostra como o Jason morreu,0
"RT [USR]: Carlos Costa tinha mais que informação sobre o BES mas nunca chegava, hoje há mais que informação sobre o Carlos Costa e tb não _",0
"o #BlocoEsquerda, promotor da Eutanásia, não tinha este tema no seu programa eleitoral. Isto é honesto? [USR] [URL]",1
RT [USR]: N aguento mais ser sozinha N aguento mais ser gorda N aguento mais ser feia N aguento mais ser um peso morto no mundo  N ag _,0
Convidado da Manhã na Renascença Portugal distingue-se “porque não tem nem vai ter campos de refugiados [URL],0
[USR] u r so right.  [USR] ir buscar argumentos de autoridade não torna mais verídico o seu discurso.,0
"RT [USR]: Com todo respeito... no dia que sair uma criança pelo mesmo lugar de onde saem as fezes dos humanos, o Levy Fidelix pod _",1
"[USR] e aspirar, posso?",0
Fãs de Justin Bieber e seus acessórios [URL],0
[USR]  Ainda não sou 'estadista' e já está nervosa? [URL],1
"Se os EUA não ganhar esta ação, como obviamente deveria, nunca teremos a segurança e conforto que merecemos. Politi _ [URL]",0
Final de semana = foda-se !,0
[USR] Como a esquerda é quem manda no coletivismo feminista..e eles nao querem falar mal de ISLÃ = todas cala _ [URL],0
RT [USR]: Coisas que eu tenho que ler no dia da mulher Excluído pq não tenho paciência pra uma pessoa tão burra [URL],1
