text,label
Indignada com esse canalhas!!! Falando do Silas Malafaia como se a notícia fosse recente!  O Pastor já mostro sua inocência!,0
"feministas deveriam passar 18 horas por dia lavando louça, sem descanso!",1
RT [USR]: #meuamigosecreto sou eu mesmo,0
"com essa frase que eu encerro o assunto do nordeste. está me dando sede, vou ali beber uma agua mineral",0
'Idade não representa maturidade'  Diga isso numa creche...,0
PRF de Pato Branco apreende 600 quilos de camarão contrabandeado que foi adquirido no Oeste Catarinense [URL],0
"[USR] sério, não foi provado, mas eu acho que ngm dá um carro de 70 mil de por causa de chantagem sendo inocente",0
[USR] [USR] va dormir que é hora de criança de 15 anos ta na cama...bblock pq nao sou obrigado,1
"[USR] eu só disse que cu não reproduz, não disse que pessoas são obrigadas a reproduzir....",1
"[USR] [USR] EU NÃO SABIA, AGORA PESQUISANDO QUE VI OS SEM TETO TÃO RECEBENDO REFUGIADOS ISLAMICOS E O POVO NÃO TA PERCEBENDO",1
a própria culpada pela exposição é a filha da Maria do Rosário que postava fotos com drogas e nudes em seu próprio instagram,1
RT [USR]: Não justo! Não podemos arcar com tamanho sacrifício. Que cortem ou reduzam o assistencialismo! [URL],0
[USR] o que é que andaste a fumar?!,0
sera que o povo do meu serviço vai notar se eu levar um colchão amanha,0
"Serão necessários quase 40 anos-luz p/ chegar aos novos planetas descobertos pela NASA. Se 1 mês de luz já é uma fortuna, imaginem 40 anos!",0
"RT [USR]: Dica: antes de dar uma de politicamente correto nas redes sociais, vasculhe o seu passado, pq o [USR] acha mesmo v _",0
"RT [USR]: [USR] feminismo é loucura utópica, uma aberração de mentes perturbadas, com um tarja preta intravenosa elas _",1
Indo ao CAPC! [URL],0
"'Ninguém chega em casa falando “mãe, sou hétero”. Então por que tem que chegar e dizer “mãe, sou gay”?” BY [USR]. #epronto",1
chamem as feministas p fazer uma manifestação pq n tem nenhuma mulher trabalhando na obra aq do lado isso é um absurdo #direitosiguais,1
[USR] [USR] ESSA MERRDA DE POLITICAMENTE CORRETO TA FAZENDO EUROPEU APANHAR NA CARA DE REFUGIADOS E NAO SABE NEM SE DEFENDER!,1
[USR] heueheueheu eu fiquei achando que o branco era arroz tb mas não faço ideia (e olha que gosto de açaí),0
Este 'aquecimento global' está mesmo severo.,0
[USR] [USR] é engraçado e retrata um pouco do lado 'marginal' de recife-olinda... esse é o twitter [USR],0
Se vc tiver 4 paus sim [URL],0
RT [USR]: Quando líderes eram líderes. #SessãoNostalgia [URL],0
'Vc é burra hein mulher' [URL],1
"[USR] Braga está nos nossos planos como prioritário. Se conseguirmos fechar a data, avisamos",0
Feliz Dia de São Valentim [URL],0
"E pra melhorar o ano, o blog da feminazi fascista [USR] está caindo. Viva! [URL]",1
"[USR] velho, querem censurar o melhor conteúdo humor político da direita?? Vai se foder OAB-SP",1
Querem lá ver que ele já nem dorme?... #Trump Então e os 'direitos humanos' dos americanos à sua soberania nacional _ [URL],1
[USR] eu também já tive um colchão assim...,0
2 FUFAS CONTRA UM PRETO TODO BACA,1
"TOME VERGONHA!! ganha 12-13 salarios, todos os privilégios e fala em greve. E se parar de trabalhar ainda tem 1 mil _ [URL]",1
Angola ainda não ratificou o acordo ortográfico de Língua Portuguesa Escrevam bem yh,0
"Amigo, acredite, vc pode cortar seu pau fora em defesa do feminismo, que nem assim seu discurso de feministo vai te garantir uma foda hoje..",1
"[USR] [USR] [USR]  Marco Rubio, Ben Carson... políticos bem preparados. Dá até tristeza quando compara com Brasil",0
PNR marca protesto pela “liberdade de expressão” [URL],0
RT [USR]: A mulher virou a principal massa de manobra globalista. Nunca foram tão usadas. Culpa de muita propaganda e prepotência.,0
RT [USR]: Nível de jornalismo: A Globo News pela correspondente Carolina Cimenti levou fé num documento sem verificação sobre Trum _,0
'Sei que posso dar mais' disse Carrillo numa noite fria...,0
Pessoal que é todo 'eu não mato animal nenhum'. Uma semana em Angola e depois falamos,1
"[USR] dei um pulo no teu Twitter pra entender melhor a tua visão de evolução, tu não és culpado (quando cresc _ [URL]",0
RT [USR]: sendo consolada pelo fato de que amanhã é sexta,0
"O Lula falou que o melhor que a Marisa fez foi ficar submissa a ele e não dar palpite. A platéia, repleta de femini _ [URL]",0
"meu tio diz que eu sou brega, só porque curto umas músicas antigas",1
"RT [USR]: O [USR] não apenas me convidou para o camarote dele, como enviou uma passagem executiva da VASP NY-SP, com transfe _",0
"'ah mas artista tal eh gorda, ela eh feia. tem tanto dinheiro e n melhora' TE FODE GAROTA NÃO EH PQ ELA EH FAMOSA Q ELA TEM Q SER PERFEITA",1
"Pau no cu do evento, baixa o preço da gasolina seus fdp [URL]",1
moro prendeu o cunha? ué mas e o lula? e a dilma? e o PT? [URL],0
o video era um sapatao tocando siririca [URL],1
A possível vitória de Geert Wilders é mais uma esperança para esta Europa em mudança. Força! [USR]  [URL],0
"A mãe do nóia disse que quer justiça Fácil, prende ela",1
"'Não chega fazer a legislação, é preciso aplicá-la em Angola' diz Rosado de Carvalho - [URL]",0
se eu fosse eliminado do bbb antes de sair eu fazia cocô no meio da sala,0
"Vou ter que compra tudo branco , já ate sei mais ou menos onde acho isso .",0
Pra que horas ficou marcado o panelaço? [URL],0
[USR] [USR] [USR] [USR] os refugiados não têm fifa !! Nem aulas até às 17 e 30,1
"Parabéns, #PatríciaMamona e #NelsonÉvora! [URL]",0
VAMOS TORNAR A AMÉRICA GRANDE NOVAMENTE! [URL],0
"[USR] pra mesmo qdo a gente estiver brigado, eu lembrar que amo ela :)",0
Q viadagem de romantismo. Ele tava comendo ela de ladinho [URL],1
"Outra vez um menino pediu um lanche para uma amiga minha e ela o ignorou o noinha gritou: vai tia, vc ja ta muito gorda! hahahahahahahahaha",0
Agenda para os próximos tempos. Bilhetes na FNAC e Ticketline [URL],0
#SerMulherÉ fazer xixi sentada,0
PASSEIII EM MANAUSSS!!!!!!! OBRIGADO MEU DEUS! [URL],0
alguém faz a adaptação com a foto da Dilma e os 12 milhões de desempregados!!!!,0
Alguém por favor pode passar isso na TL do [USR] e dizer que é bom saber como a Esquerda gosta do debate demo _ [URL],0
de certezinha q vai haver gente a usar isto só pq é produto novo da nike qd nem sequer têm qlq ligação c o islão [URL],0
"Queimar a sede da [USR] é um direito pela luta contra mentirosos e mamadores de dinheiro público? Se for, e _ [URL]",1
"Sen. Richard Blumenthal, que nunca lutou no Vietnã, e disse por anos que sim (grande mentira) agr distorce o que o _ [URL]",1
"Eu sou bi e não sapatão. E mesmo se eu fosse, ninguém tem nada a ver com isso!",0
"RT [USR]: fato 44: se vc é menina, e algum garoto já te chamou de gorda ou feia, vc fingiu que n se importou mas chorou antes de do _",0
Pra quem tá com pena de traficante de drogas... principalmente as mulheres e feministas . [URL],0
[USR] ter tempo pra cuidar da família é 'o grande problema' pra mulher ou pra qq pessoa que trabalha E tem filhos?,0
[USR] tão levando pra casa da maria do rosário ???,0
"É só não roubar, não estuprar, não cometer latrocínio que não vai pra lá. É simples. Que se matem mesmo, sem dó nem _ [URL]",1
BRASIL ACIMA DE TUDO  DEUS ACIMA DE TODOS AMEM,0
RT [USR]: Tem certos problemas que sapatão não precisa se preocupar. Entre eles o de não poder tomar seu açaí em paz. [URL] _,1
#DiaDaMulher FELIZ DIA DAS MULHERES Dia Internacional da Mulher #BolsonaroReiDoMundo [USR] [USR] [USR] _ [URL],0
RT [USR]: Há algo sonso e canalha no ar quando PSDBistas resolvem criticar Bolsonaro por posicionamento q o mesmo PSDB teve. Iss _,1
RT [USR]: - e as namoradinhas? - então tia... [URL],0
"RT [USR]: Ele já foi respondeu por pedofilia e agora será processado por calúnia, contida dentro da igreja! [URL] _",0
"uma chuva de tweets me xingando tiveram origem do site diario do nordeste, da globo. [URL]",1
Não vejo nada de errado só acho que existe uma idade própria pra se introduzirem certos conceitos cada família deci _ [URL],0
RT [USR]: O TUITER AINDA RESPIRA [URL],0
"RT [USR]: QUANTA IRRESPONSABILIDADE, DEVE TER MATADO A FAMÍLIA DE DESGOSTO [URL]",0
[USR] sapatão? isso é bem coisa de sapatão shauishaius,1
RT [USR]: Mas a Globo News diz que o Trump é ruim para a economia  Ué [URL],0
"RT [USR]: vai se fude os cara quer retratar jesus e retrata o cara branco, de cabelo sedoso olho azul etc o cara nasceu no oriente médio _",1
[USR] Estou com você pastor!!!!,0
"Oi, amores... [USR] [USR] [USR] [USR] [USR] [USR] [USR] Vcs num tem noção da correriaaaa Aff Xeru",0
"Confira entrevista da artista negra brasileira Priscila Rezende ao site LaplisiTol, um site construído por... [URL]",0
"Não somente hoje, mas todos os dias, que você seja reconhecida e amada. Feliz dia internacional dá Mulher!!! [URL]",0
devem achar que eles vão colocar o nome do cara no SPC/SERASA  [URL],0
Convida nui de Sampa! RT [USR]    Vamos p uma baladinha em sampa??? [USR] [USR] [USR] [USR] e Lucas,0
"[USR] [USR] Religiosos ou não, devemos agradecer que estes reneguem o homossexualismo. Enquanto todos se calaram, só a......",0
Mimimi do [USR] agora é contra Marine LePen,0
Este é o 1º País do Mundo a proibir o islão e a fechar mesquitas [URL],0
"Quando a gente fala que os filmes da Disney, tem linguagem subliminar, é fanatismo né? Agora, não é mais... [URL]",0
"A esquerdalha (protegida pelo sistema e pelos media), no seu melhor, a mostrar a tolerância que defende. #Nantes _ [URL]",1
"Feliz dia das mulheres pra Tammy Gretchen Que mesmo depois de várias alterações no chassi, continua sendo mulher!",1
RT [USR]: 6- emily fields só se fode emaya era lindo sim  maria sapatão merece bem mais  ela toma tanto no cu que as vezes eu acho qu _,0
"- 'Ain o Dória está indo bem nesse últimos 2 meses,se ele candidatar para presidente pelo PSDB em 2018 votaria nele _ [URL]",0
Bom dia so pra quem acordou meio sapatão [URL],1
E você? Está fazendo sua parte? Cenas do filme Lista de Schindler. Impossível não se emocionar. [URL],0
Se foderam seus fdp [URL],1
Kd as suvaqueiras peludas essas horas??? [URL],1
MULHER GOSTA DE HOMEM PORCO QUE FEDE ARROTA E TEM TERRA DEIBAIXO DAS UNHA #JOAQUINRESPONDE [URL],1
[USR] Quer uma dica meio trash pra aumentar a galera do show? #Trashquefunciona >> Bate Papo UOL salas de minas. Da uma divulgada!,0
"Advogados ABANDONAM a tal moça que acusou Feliciano de abuso...Agora a tal moça,ataca outros deputado, procurador... [URL]",0
"Mesmo com o atraso dos democratas pra finalmente aprovar o Dr. Tom Price, a revogação e substituição do ObamaCare e _ [URL]",0
"RT [USR]: BOM SINAL: PADRE PETISTA, JÚLIO LANCELOTTI, DEMONSTRA DESESPERO E DESCONHECIMENTO SOBRE BOLSONARO. [URL]",0
Ih olha o omi branco querendo falar pra mulher qual o papel dela [URL],0
"Acho que a Morango tem um céu so pra ela rsrs [USR] [USR] Nossa, eu tô em Sampa! Aqui n B Vista tá nubladim e meio frio...",0
Pergunto-me se as fufas comparam o seu cheiro com o da parceira,1
"COM MUITO ORGULHO FUI ELEITO O REI-MOMO DO BLOCO PORÃO DO DOPS DO MEU AMIGO [USR] DECOREM AS MARCHINHAS, _ [URL]",0
neoliberalismo do Temer vai fazer o Brasil crescer assim como os governos do Collor e do Sarney,0
RT [USR]: Tucanos se distinguem mal do PT: [URL],0
o bolsonaro nao parabenizou o cunha de vdd gente isso é culpa da edição do video,0
"outra 'Jênia' que acha que a violência contra a mulher no Brasil se dá pelo fato do país ser de maioria cristã, e n _ [URL]",0
[USR] Obrigado pelo reconhecimento. Faremos o nosso melhor.,0
Sua vida está protegida por milhões de Brasileiros que oram por ele todos os dias.Deus está nesta causa. [URL],0
primeiramente BORA TEMER,0
[USR] Tem que ser muito capacho de ideologia para apoiar uma cultura que apedreja e açoita mulheres só porque a e _ [URL],1
Acabei de fazer esses casos para minha cunhada vascarpim ..Minhas férias estão rendendo arte.  Rsss [URL],0
EH DIA DA MULHER Q BURRA NEM LEMBREI,0
"RT [USR]:  azeiteiro, quero q te fodas volta para a tua terra",1
Agenda #SãoPaulo 11/03. Congresso Evangelizar KIDS. Igreja Batista do Povo. [URL],0
Top 3 Filmes de todos os tempos: -De volta para o futuro 2 -O Poderoso Chefão 1 -Curtindo a vida adoidado,0
"RT [USR]: Vitória (ES), Praça 8, a partir das 8 horas, dia 8 [URL]",0
"RT [USR]: Existem mulheres ladras, canalhas, safadas, dissimuladas.... sinto muito se voce não sabia disso !! Feliz dia das mulh _",1
feliciano não é estuprador gente isso é tudo marketing da esquerda,1
RT [USR]: Não concordo e nada contra a homossexualidade.. [URL],1
ADQUIRA AGORA o livro 'A IDEOLOGIA DE GÊNERO NA EDUCAÇÃO - Como esta doutrinação está sendo introduzida nas... [URL],0
infelizmente o país da inversão de valores..pq de gente de esquerda que quer lacrar ..!! [URL],0
"RT [USR]: Dolores:mulher de extrema importância p/ a luta indígena latino-americana. Pobre, índia, comunista, rebelde, foi apaga _",0
só pensam em crise vão arranjar um emprego,1
[USR]  E eu sou o candidato do #PNR à mesma Câmara. [URL],0
"Não adianta porra nenhuma vc ter ido a rua em 2016 e agora em 2018 continuar votando no PSDB,PT,PMDB...",0
[USR] eu vejo sapatao fazendo isso e fico meu amor acho q JA CHEGA DE INTERNET POR HOJE PRA VC [URL],1
"RT [USR]: queria comer polvo, mas o da copa gerou apego",0
"RT [USR]: A gente xinga a grande mídia o tempo todo, e vai continuar xingando, menos hoje.  [URL]",0
#MamãeEuQuero #MamãeEuQuero Mamãe Eu Quero Lacrar Entrei No Feice Entrei No Feice E Um Textão Agora Eu Vou Postar,0
RT [USR]: eu ainda não superei o fim de 2010,0
"...negociações ou design. Quando eu me envolver, como no F-35 FighterJet ou no programa do Air Force One, o preço V _ [URL]",0
[USR] Não importa. Pode colocar no outro exemplo uma crítica tb q não fale de 'vitimismo' que dá no mesmo.,0
"A linda foi colocar no soneca e desligou o despertador, muito inteligente",0
wtf um tt sobre boatos das fufas mais conhecidas do Porto está a seguir-me Q MERDA É ESS,1
Livro 'As Grandes Mentiras Sobre a Igreja Católica' já como 3º mais vendido na Folha! Parabéns galera do _ [URL],0
RT [USR]: Agora um poema: Eu sou sapatão.  E sapatão sempre vou ser Pq gosto de pepekas E a sua eu quero comer.,0
agora é oficial: os dinossauros estão extintos,0
"[USR] pooo, esse aí é otimista hein",0
Acho mó engraçado o galero que tenta chamar atenção fznd piadinha burra sobre o dia da mulher,0
Vale a pena leitura. [URL],0
faz pontaria em qlq coisa q der na telha com jato de mijo.,0
"UMA GERAÇÃO DE JOVENS QUE AO INVÉS DE ESTAR BEBENDO, BRIGANDO, JOGANDO BOLA E VENDO MULHER PELADA... PASSA O SÁBADO NO CBLOL 7X1 FOI POUCO",0
"No Iraque, 'Call of Duty' é conhecido como 'The Sims'",0
RT [USR]: [USR] realizei o sonho dá minha esposa e levei ela pra NYC e é claro não podia faltar o yellow umbrella  [URL] _,0
"porra!! é difícil refutar o que falei com fatos, lógica e verdades? [URL]",0
[USR]  O cara vive em outro mundo Não no mundo real REFUGIADOS são os que vivem Nas favelas vizinhas as suas fortalezas,1
Alguém consegue ver um guarda-chuva amarelo e não lembrar de how I met your mother? [URL],0
#DiaDaMulher FELIZ DIA DAS MULHERES Dia Internacional da Mulher #BolsonaroReiDoMundo [URL],0
A Sbx deve ter sapatão nos organizadores kkkkk pq é só essas cover gay ue,1
"Oscares, Prémios Nobel e afins: só politiquice, interesses e influências. Vergonha!  Seriedade e mérito? Pois... #AcademyAwards #NobelPrize",0
[USR] que chatice em jornaleco???? Viva a mulher!!![URL],0
RT [USR]: Ah mulheres! O que seria de nós sem vocês? A gente nada seria.,0
"[USR] miga nao tem livro de estudos em promoçao , mulher é burra",1
Pssoas incríveis que só comem no Spoletto. rs. [URL],0
"[USR] PArece que tá morrendo né? Liga naum, tem um cachorro aqui no prédio que sempre confundo com uma foda.. rs",1
"O General Keith Kellog, o qual conheço há um bom tempo, tem grandes chances de ir pra NSA - como outros 3 também te _ [URL]",0
"A censura democrática é a pior delas todas porque é arbitrária, hipócrita e cobarde. Finge não existir, mas existe! [URL]",0
Cheirinho de HEXA,0
RT [USR]: [USR]  eu passei a minha vida toda a ver relacionamentos heterossexuais e não sou hetero! Acho que isso não influen _,0
"'Cem homens podem formar um acampamento, mas é preciso uma mulher para se fazer um lar.' #MulherDeVerdade",0
"#LittleMix VC q por  acaso acha q Jesy é feia, gorda, se parece com a mulher do Chuck VC esta cego com problemas me _ [URL]",0
"[USR] Tb não entendo.. Concordo com vc.,",0
"[USR] e aspirar, posso?",0
Não se iludam: um dia isto chegará Portugal. Só votando #PNR se vai evitar esta invasão. [USR]  [URL],1
"RT [USR]: O mundo entrou em colapso, o nacionalismo é que o vai reconstruir! As marinas mortalhas, tremem de medo! [URL] _",0
Cobrar quando um político tá fazendo mau uso do dinheiro público é um dever de qualquer cidadão,1
'De manhã eu fico sozinha em casa porque todos os meus irmãos vão pra escola e minha mãe vai trabalhar. Aí eu... [URL],0
Se o Jonas fosse médico o Mário Soares tornava-se imortal,0
Assim como cabe aos pais a educação sexual dos seus filhos.Quer que desenhe? [URL],0
"Caramba hein, agora vai... [URL]",0
[USR] se foi no RJ o moleque é um herói,0
"'Diz produtora IRANIANA'. Não pode ser séria essa notícia...  Certeza q p essa mulher, jogar um Boeing contra um p _ [URL]",0
"Quando há vontade política e se tomam as necessárias medidas, as coisas acontecem! [USR] _ [URL]",0
[USR] [USR] aparentemente vc tem mta necessidade de vir falar isso pra mim e agora ja falou pode parar né,0
[USR] Nem o nome da banda sabes. És uma fraude,0
Quando repõem a estátua de D.Sebastião na #EstaçãoRossio? Consequências para o selvagem autor do vandalismo? Fica t _ [URL],1
"Jeff Sessions é um homem honesto. Ele não disse nada de errado. Podia ter respondido com maior precisão, mas claram _ [URL]",0
"Uma mulher de verdade é bem sucedida, independente. Mas se não for - ainda, vai lutar até o fim por si mesma!",0
"SEM DÚVIDAS, ESTA É A TRISTE REALIDADE QUE SE VIVE EM ANGOLA. Amor à Pátria! Não iremos longe e dificilmente a... [URL]",1
Nada contra negros mas EU PREFIRO aquele branquelo palmito cor de leite pra bejar na boca rsrs,1
RT [USR]: Hoje para muitos é dia para almoçar com a amante e jantar com a mulher. A restauração agradece,0
[USR] [USR] ora ora temos uma idiota aqui,1
"[USR] rezando eles são lindos..o problema é quando tão explodindo torres, boates e embaixadas",1
Internet de manhã melhor horário Só gente honesta e trabalhadora,0
"[USR] São refugiados e eles podem tem o direito de não aceita-los, mesmo eu sendo contra essa ação da Hungria.",0
"a mulher no BBB soltou um 'mexicano que é mexicano nem caixa d'água tem', que programa de gente burra da porra",1
Não tenho nada contra refugiados e até acho bem serem acolhidos,0
Os 2 robôs da NASA na superfície de Marte [URL],0
"Mas ele é de esquerda, então pode fazer racismo. [URL]",0
[USR] ngm perguntou sua opiniao de branca sobre racismo e vc deu então acho q estamos na mesma,1
"[USR] Tenho que te emprestar o documentário, vais adorar",0
as forças malignas da esquerda estão tentando dominar minha mente O QUE TA ACONTECENDO,0
RT [USR]: 'Você é gay/sapatão mesmo?' 'Ué sim' 'Nossa não parece' Como assim tá me chamando de hetero é isso mesmo??? Como pode m _,0
Começou gente!!!! Assista por aqui >>> [URL],0
"RT [USR]: Carlos Costa tinha mais que informação sobre o BES mas nunca chegava, hoje há mais que informação sobre o Carlos Costa e tb não _",0
RT [USR]: [USR] ai denunciei essa porra mercado da fé fora daquii hahahah,0
RT [USR]: Fazer pesquisa de intenção de voto pro Bolsonaro no Twitter é igual fzr o msm pro Trump no Tumblr.,1
Chegou o escravoceta [URL],1
"Por [USR] [USR], o Australopithecus dos tempos modernos! [URL] #PNR [URL]",0
Tipo se vc tiver com uma roupa feia ele olha e fala: amiga sua piranha essa roupa ta te deixando mais gorda do q vc ja é,1
"Atrapalha nada [USR], se não fosse o Bolsonaro ia ficar sempre naquela PT E PSDB pra qm votar para presidente e _ [URL]",0
LOL Não têm vergonha. E seis milhões de bilhetes IDA de avião para os refugiados que já cá estão? [URL],1
#i5gornascimento [USR] g1 União Europeia ameaça com sanções países que não recebem refugiados [URL],0
"PORRA, MAS E O TAL AQUECIMENTO GLOBAL???!!? [URL]",0
'Quantos anos tens pequenina?' [URL],0
RT [USR]: [USR] acaba de apresentar no Senado projeto de lei p/ obrigar presos a indenizar vítimas [URL] _,0
Juande volta para a tua terra! Boloni volta para a tua terra! Taison deixa-te estar na Ucrania! Investidores venham para o norte!,1
"RT [USR]: Uma preguiça: mina childfree. Mano, num quer ter filho, não tenha. Agora ficar postando como se criança fosse o mal da human _",0
"Dilma, Lula, Cunha, Freixo, Luciana Genro e Jandira Feghali tudo fora! Agora só falta o bolsa-puteiro pra esse país _ [URL]",1
"Roberta tu é feia, falsa, rídicula, gorda, entre outras coisas q não posso dzr aqui por risco de processo.Vai sair com rejeição max  #BBB17",1
Discurso de ódio 'do bem' 2017: matar o Bolsonaro (pois querem calar ele e as pessoas que o apoiam). Isso é a esqu _ [URL],0
Jonas marca após truque de magia do Sálvio. Os nossos rivais é que têm razão. O Benfica manda mesmo nisto tudo #ACulpaÉDoBenfica,0
Que mundinho pequeno esse de Sapatao ne  a gente descola cada fita da namoradinha dos outro,1
"08:41 #ações_preventivas local Castelo Branco, Centro, #Abelardo_Luz, descrição: atividade tecnica (vistorias)",0
[USR] como sempre o privilégio branco é visto,0
faz campeonato de peido com os amigos.,0
Feliz dia internacional das kiridinhas!!! [URL],0
PNR em Coimbra: formação e compromisso [URL] #PNR #Portugal,0
Só o Nacionalismo é solução! por [USR]  [URL] #PNR #RenovarPortugal,0
não lava aquela cueca q acabou de comprar antes de usar,0
Coisas que odeio esquerdista de iphone hipocrisia falso moralismo [URL],1
"RT [USR]: #Argentina Buenos Aires agora! Só cresce, tá lindo! #NiUnaMenos #ParoInternacionaldeMujeres #8M #VivasNosQueremos Foto: [USR] _",0
"glaucio me deu feliz dia da mulher, respondi com 'pra vc tambem'  eu sou muito burra",1
Querem tirar a [USR] e o [USR]  da disputa presidencial. O NOME DISSO É DESESPERO DA ESQUERDA,0
Foda-se Esqueci-me que todas as feministas são fufas [URL],1
RT [USR]: Deixei minha redação do enem em branco pois quem sou eu pra falar sobre feminismo,1
"RT [USR]: Face da desumanidade, ganância,  cinismo, movimentam -se pela volta das mamatas, roubalheira, sem vergonhas, anti patri _",1
"Então, desta vez a esquerda não realça a sabedoria de Eduardo Lourenço? [URL]",0
"Eu posso até ser feia, ser gorda,e concordar com isso,posso ser chata a maioria do tempo, mas quando precisam de mim, eu smp tô lá",0
cancelaram o impeachment?? ISSO É GOLPE,0
[USR] ela é sapatao? So perguntando pq vou incluir no meu tcc,0
[USR] essa é a mina do bbb que mandou o cara botar leitão quente na boca dela,0
"Temos que nos posicionar, é uma pena ver profissionais sem coragem para assumir seus direitos. Eu tenho. [URL]",0
[USR] alguém duvida que vai ser mais uma matéria pra denegrir o Bolsonaro? [URL],0
Vamos para rua contra a Ideologia de Gênero.Parabéns Peru. [URL],0
"[USR] [USR] eita, não é zero... Alemanha avança para restringir uso da burca [URL] via [USR]",1
"Olha bem mulher, eu vou te ser sincero, quero te ver de branco, quero te ver no altar",0
é como diz o ditado a liberdade canta pra quem o pt espanta [URL],1
Quando você tem dúvida se hj vai sair de sapatao trevosa ou hetero mocinha [USR] [USR] [URL],0
"RT [USR]: Love on Top mas de fufas, estou lá",1
RT [USR]: A PL 2516/15 propõe imigração em massa de refugiados islâmicos para o Brasil. NÃO QUEREMOS A SHARIA NO BRASIL [USR] _,1
"É SÓ MANDAR UMA SONDA PRA ESSES 3 PLANETAS: SE NÃO ACHAR PSOL, FUNK, MACONHERO E IUTUBER  TEM VIDA INTELIGENTE SIM [URL]",1
"Sugestões para um 2010 melhor: Canonizar a Punheta, a Santa Punheta, a Sagrada Bronha de domingo. Melhor amiga do [USR] !",0
RT [USR]: Doria e Bolsonaro não podem brigar. Não até ambos irem pro segundo turno.,0
"A ameaça do terrorismo radical islâmico é bem real, veja o que acontece na Europa e no Oriente Médio. Os tribunais _ [URL]",0
"Comece por você mesmo, maconheiro [USR]. [URL]",0
RT [USR]: - Alô Trump ta afim de irritar a esquerda? - To mas como? - É só nós tirar uma foto juntos  - Blz cola aqui na casa bran _,1
[USR] Já há bilhetes para o Casino da Figueira da Foz: [URL],0
Parabéns a Rex Tillerson por tomar posse como nosso novo Secretário de Estado. Ele será uma estrela!,0
"RT [USR]: O discurso do Trump no Congresso teve 43 milhões de espectadores, e o Oscar teve 32 milhões de espectadores  HEUEHUEH",0
"[USR] reparaste na parte dos motivos? E além disso não é o Islão, mas as pessoas que cometem crimes.",0
RT [USR]: Terrorista se fantasiou de 'refugiado' e se mandou para a Europa cortar mais cabeças por lá [URL],0
[USR] por isso que esse país ta na merda mesmo [URL],0
chega na mina e fala: nosso relacionamento é tipo o socialismo nunca vai dar certo,0
"Para os sportinguistas, Bruno de Carvalho é uma mais valia para o Sporting Clube de Portugal. Mais valia era estar calado...",0
idiota é pensar q no dia d mulher eu aquela mulher cujo vc a chamou atráves de MSN feia gorda urubu fígado cheia de celulite acreditar em vc,1
"[USR] Q fodas, hein amigo...",0
"Democráticos eles, hein? Deveriam mudar o nome do partido para 'dictator-crats'. [URL]",0
RT [USR]: A mulher é engenheira nuclear e consegue ser boa na cozinha puta merdaaaaa #MasterchefBR,1
"[USR] 15mil chamadas recebidas, DESTAS mais de 2mil relativas a violência contra a mulher. Você sabe ler?",0
