text,label
"a feminista pode até dar a alma dela no primeiro encontro, mas por favor  #usecamisinha , seja uma puta consciente!",1
RT [USR]: Foto de um casamento infantil forçado. Casamentos infantis são comuns no Oriente Médio e o islamismo apoia isso. [URL] _,0
RT [USR]: Pequeno resumo sobre alguns assuntos que 'inocentes' fazem questão de dizer que não tocamos! Um abraço a todos!  [URL] _,0
[USR] juro que eu ia comer achando que era chocolate branco  Socorro,0
"Bom dia você que paga de pegadora, espalha tudo e sempre dá um jeito de contar suas aventuras. Quem muito fala, pouco faz..",0
"não da tapa na bundinha, da cotovelada nas costas !",0
"RT [USR]: Gays franceses estão migrando para a direita; e a razão disso é bem simples, o avanço do islamismo na Europa. [URL] _",1
[USR] ESSA mulher pq quem transa com um cara como esse vadia de burra essa garota escrota nao tem nada .,1
"RT [USR]: Ex-candidato do PSOL é preso por estuprar cães e portar drogas. Estes são piores que o PT, são aberrações. (Vídeo) [URL] _",1
Parece que o Papa vai estar menos tempo em Portugal do que o Porto esteve em primeiro lugar...,1
A praga está valendo,0
"ACHO RIDÍCULO, MAS RESPEITO, NÃO SOU HOMOFÓBICO [URL]",1
RT [USR]: só não percebo o orgulho destas fufas [URL],1
RT [USR]: VERDADE TÁ TODO MUNDO COMEMORANDO REALMENTE AQUI NA RUA FIZERAM ATÉ UM CHURRASCO TEM PAGODE E OS CACETE  [URL] _,0
Bela lógica camarada liberal:'Se não colocares actores muçulmanos na tv eles vão-se juntar ao ISIS.MAS HEY O ISLÃO NÃO É ODIO',1
Já começaram a comparar o preço do ovo de páscoa com barra de chocolate?,0
"Gosta de futebol, cerveja e mulheres.",1
O Irã foi ADVERTIDO formalmente por disparar um míssel de guerra. Deveriam agradecer pelo ridículo acordo que os EUA fez com eles!,1
"Vocês podem denunciar aqui, gente: [URL]",0
[USR]  Vá se fuder! Venezuelanos fugindo para o Brasil e vocês chupando o saco desse merda?,1
"#Parabéns !!!!! Luciano Azevedo (PPS), prefeito de Passo Fundo (RS), resolveu pegar a verba de R$ 400 mil que... [URL]",0
"[USR] não vi esse não, vou vencer meu preconceito com ele e ver hahahahaha",0
[USR] [USR] Sou ou sou um bom cunhado?,0
[USR] Um twitter sobre as 'fufas' do porto. Realmente há demasiado tempo livre. Que tal varrer um chão e lavar uma loiça?,1
[USR]  Os democratas... gente 'tolerante' que não sabe aceitar a mudança que se está a operar.,0
"[USR] [USR] [USR] Hj a correria nao me deixou interagir, mas vcs sao Especiais! Saudadessss. Cheirossss",0
RT [USR]: O GLOBO MENTE NUM NÍVEL ABSURDO! A UNIVERSIDADE NÃO CANCELOU NADA!  A ESQUERDA ATACOU AS PESSOAS!!  [URL],0
"Voltou as costas para o poder de Washington, virando-se para o país real que jurou defender. Força #TrumpPresident  [URL]",0
"Sportinguistas,hj n se esqueçam de votar Bruno de Carvalho. O mundo d futebol e principalmente o mundo da comédia,precisam de + 4 anos disto",0
"Vai facilitar muito a identificação, né? Pq não deixam a burca toda? [URL]",0
"Bom dia amores... Os dias passando, as mudanças se tornando inevitáveis e próximas... vai ficando mais difícil. #eavidasegue ?",0
RT [USR]: #LulaPrezidente  #BBB17 Quem você Votaria? [USR] [USR]  [USR] [USR],0
"RT [USR]: E regicídio, parricidio, genocídio, etnocidio... Aparentemente é mais difícil aprender português quando se está lambendo b _",1
RT [USR]: O Lula ligou pra Élika. E é por isso que ela vai pular desse precipício. [URL],0
"RT [USR]: Vamos marcar presença, molieres maravilhosas do meu Brasil? [URL]",0
RT [USR]: Eu sei que quem apoia Bolsonaro do cara mais humilde ao mais esclarecido ver o único cara honesto ser condenado dá um ódio _,0
"homem que é homem arrota com suco de laranja, no ouvido da namorada.",1
Sinto cada vez mais nojo da comunicação social. Esquerdalhos com mau perder! [USR] #YouAreFakeNews #GoTrump [URL],1
A Burra da mulher esqueceu o celular no ônibus e ta chorando aqui no busão queria não rir,1
"RT [USR]: Muitas crianças são criadas por homossexuais, eu não vejo diferença nenhuma nessa imagem o mesmo vai acontecer com algumas _",0
[USR] A pimenta comentada na estrevista:  [URL],0
"RT [USR]: Os mais novos gostam de imitar aquilo vêem na televisão, pra mim não é uma boa ideia. [URL]",0
"Alias, isso é uma coisa que algumas mulheres também não sabem e ficam achando que por não gozar com penetração tem algum problema. NÃO TEM!",0
"[USR] não deveria, mas usa.",0
"RT [USR]: [USR] n falo com fufas, adeus",1
a PM tem é que entrar metendo o cacete nessas escolas ocupadas bando de vagabundo que nao quer estudar e fica morando na porra da escola,1
"'Mimimi, Bolsonaro é machista! mimimi.....' Machista mesmo é o seu pai, que traí sua mãe!",1
eu sei que em todas as notas do real ta escrito 'deus seja louvado' mas o estado é laico,0
Discurso de Pedro Godinho | 10 de Junho [URL] #PNR #Portugal,0
RT [USR]: Acho MUITO BOM Que desde cedo as crianças aprendam que não há problema nenhum em ser-se homosexual.  [URL] _,0
Vida de sapatão: Amar a amiguinha hétero que não sabe que você é apaixonada por ela!,1
Eu tô bem surpresa que os gringos não sabiam o que é caju [URL] via [USR],0
status: desesperado tentando achar ingresso do rock in rio.. absurdo n ter cota p negros,1
"E a imprensa brasileira deu a mesma ênfase que no caso dos presídios.  Não, péra... [URL]",0
mãe to na globo [URL],0
nao vem me culpar agora nao tenho nada a ver com isso votei no aécio,0
Crepúsculo: Um vira lobo Um vira vampiro Ninguém vira homem,1
"Sou boba, mas não sou burra. Ingênua, mas não santa. Sou pessoa de riso fácil... e choro também! Prazer... eu sou Mulher!",0
[USR] você tem algumas dicas de livros de ficção científica que podem ser lidos por crianças?,0
RT [USR]: Report: A direita da Alemanha acredita que chegou a hora do país se libertar das 'culpas históricas'. TWP: [URL] _,0
"RT [USR]: [USR] [USR] [USR] sua vida e babar o ovo da Bia , e a bia e feia e gorda !",1
Passo a passo de como denunciar o Facebook do pastor MalaCheia... [URL] kkkk ele vai ficar muito puto mas quem liga?,1
"Esquerdista não liga pra moral, só liga pra dinheiro Se calaram qdo soltaram o Bruno, só se incomodaram dele voltar a jogar e ganhar bem...",1
Freezer Horizontal 439L EFH500S Branco Esmaltec [URL] + Cupom de Desconto: RCA-27231 [URL],0
"vsf mano, eu fico perplexo de ver umas desgraça apoiar umas coisas tão absurdas, um dia é negro falando que quem salvou o negro foi o branco",1
"“Com o PNR, Coimbra tem mais encanto“ [USR]   [URL] #PNR #autarquicas2017 [URL]",0
agora sim esse latinos imundos vão parar de tentar entrar nos EUA #Trump,1
Já Está No Portal 'Music For Angola' Mboraa Lá Partilhar Pessoal!! . Dêem Uma Olhada...  JAY CEE - NÃO VAI [URL],0
Quem é a gata de óculos com vestido branco/ floriado que passou pelo prédio rosa  indo para o lado da biblioteca pelas 19:30?  ;),0
"[USR] pode me mandar isso, por favor?",0
[USR] Desrespeito é deixar as pessoas humildes esperando ou sem consulta quando era para  FUNCIONÁRIO estar trabalhando. Medico n é Deus !,0
Claro! A alienação é o melhor caminho pra você! Continue nessa bolha!!! [URL],0
Uma análise do primeiro livro revelou que o relacionamento entre Christian e Ana se caracteriza como violência... [URL],0
agora que a dilma vai sair quem assume é o aécio né??,0
RT [USR]: sei que neste momento o Neymar está creditando toda a honra a Ele [URL],0
RT [USR]: quem é playboy safado fortalece no RT,1
Q mulher estúpida! [URL],1
"...tanto tempo que não sabe mais como ganhar, apenas veja o caos que está o nosso país - preso em conflitos em todo _ [URL]",0
A Festa do Branco é um evento que promete marcar  o Cruzeiro Diamantes 2017. Aqui estão algumas inspirações: _ [URL],0
"[USR] KKKK  O RJ É UM PUTEIRO MESMO, INFELIZMENTE A ESCORIA DE COLARINHO BRANCO JUIZES PROMOTORES E TODO TIPO DE LIXOS ALI SE JUNTAM",1
RT [USR]: Quando a vaga não oferece estado democrático de direito [URL],0
Imagina se fosse um dossiê sobre os hábitos sexuais da Hillary... o que ia ter de sjw achando um absurdo o machismo cristão conservador.,0
"MULHER: É frágil, mas não otária. É sensível, mas não idiota. É fresca, mas não covarde. É fraca, mas não burra.",0
Em qual vc ia primeiro?! [URL],1
RT [USR]: Agora tá na moda colocar a culpa nos países do OM. Não se engane e aos outros.Quem produziu REFUGIADOS foram EUA e OTAN [USR] _,1
[USR] Estes incompetentes não cuidam nem do povo brasileiro e nem dos poucos refugiados que aqui estão.,0
"Já achava a ' Bela e a Fera' ,ridícula mesmo. Disney sai do armário:  ‘_A Bela e a Fera’_ terá romance gay... [URL]",1
RT [USR]: Idiotas inúteis! [URL],1
que Gorda feia e falsa vai tomar no cu mane,1
Dar risada de si mesmo: [USR] ! Rir das cagadas alheias melhor ainda ...,0
Desconfio que a NASA só não anunciou ter descoberto vida num dos 7 planetas com receio que o Trump mandasse construir outro muro...,0
"Em nome da tolerância tudo desculpam, mesmo que as vítimas sejam do seu próprio povo. [URL]",0
"Eliseu,#colinho e Pizzi: já captei a vossa atenção? Óptimo. 'Overdose de Tourette' esta 5a, 6a e Sábado em Viseu, P _ [URL]",0
Agenda Março . Ideologia de Gênero. [URL],1
RT [USR]: EU NÃO SOU RACISTA EU JÁ DEI UNS BJ NUM NEGUINHO,1
[USR] Vais dizer que é mentira?,0
"É ridiculo acharem gays e fufas diferentes de todo o resto, são pessoas normais mas com gostos diferentes! Deixem-se disso!",0
[USR] essa mulher é burra demais ou se faz? pqp,1
. [USR] [USR] e do outro uma imbecil útil usando fc de diva pop achando que ta destruindo o mundo com seus pensamentos perdidos.,1
Vivemos no totalitarismo do pensamento único dos donos da 'liberdade'. Só o #PNR enfrenta e denuncia a 'besta'. _ [URL],0
eu não sabia que com o dia da mulher viria tanta gente burra falar bosta na internet,0
[USR] 5 - Rio de Janeiro,0
Esse nome quase não é esquerdopata!!!!  hahahahah [URL],1
"O maior prazer de uma mulher inteligente, é fazer-se de burra perante um burro que se faz de inteligente",1
"O Murilo  deixou as prova em branco, vou bater nele",0
"-Levy Fidelix, cu de mulher reproduz? -Não? -Caso encerrado!",1
JOANA MARANHÃO MARANHÃO MARANHÃO SÓ PERDE NA PISCINA MELHOR FAZER TEXTÃO  [USR],0
"Ouviu, [USR] ? Militar não sai disparando a esmo... [URL]",0
RT [USR]: #primeiroassedio Acho que eu tinha uns 10 anos. Uma empregada me deixou pegar nos peitos dela. Foi bom pra cacete.,0
Protesto contra o boicote ao #PNR. Todos somos poucos. [URL],0
Como posso ajudar o PNR?  [URL] #Apoio #PNR #RenovarPortugal,0
A atenção finalmente está voltada aos infiltrados desocupados! Eles serão pegos! [URL],0
"'Deus criou a mulher de uma costela, de um osso torto. Se procurares endireitá-la, quebrará. Tenham pois paciência c elas.' #MulherDeVerdade",0
Demos uma de [USR] para mostrar o amor que os esquerdistas tem para com o próximo.  VAI DAÍ [USR]! [URL],0
eu respeito homossexuais so n concordo nem quero q meu filho veja eles se beijando em público,1
"[USR] 3 maconheiras vaiam o Mito: vira notícia; E isso aqui, G1?  [URL]",0
"RT [USR]: Milhares de portugueses a passar fome, e a comunicação social preocupada com a tomada de posse de [USR]!  Verg _",0
Cristãos maltratam gays e mimimi [USR] [USR] [USR] [USR] [USR] [USR] _ [URL],0
"A esquerda é assim, lamenta a morte de bandidos mas diz 'matou pouco' pra genocidas. Depois do 'Stalin matou foi po _ [URL]",1
Lança-perfume racista filho da puta [URL],1
Que burra essa mulher que perdeu o mamão! Ele é mto maduro cara,1
Imprensa toda mentiu sobre 1- quem era Trump 2- pesquisas das eleições americanas 3- fake news 'documentos vazados'. É o desespero batendo.,0
e tava reclamando que sou gorda e feia vou continuar assim,0
vamo ser negro mas nao vamo abusar ne,1
Galera que se diz DEMOCRATA e defensora dos DIREITOS é a primeira a não reconhecer o resultado de eleições LIVRES E DEMOCRÁTICAS.,1
Esse foi o dia da MULHER mais reinvidicado por quem não é mulher na história desse país #DiadaMulher Feminismo/marx _ [URL],0
"Mulherada, é Outubro rosa! Realizamos o exame de mama gratuitamente, basta agendar via DM #outubrorosa [URL]",0
RT [USR]: Para [USR] com amor. [URL],0
Olhem só o MEDO que a mídia está do [USR] ser presidente [URL],0
Se nem presidiário tem pena de estuprador (os caras são estuprados lá dentro mesmo) pq a esquerda quer que a gente tenha?,1
Participei do consultório de família na #NovoTempo com o tema. Criação de criança em sexo neutro. Foi muito bacana. [URL],0
como é bom achar dinheiro no bolso (dos otros),1
[USR]  Os 'cumpanhero' quebraram todas as regras.,0
RT [USR]: FELIPE NETO X PASTOR MALAFAIA  IGUAL A ARGENTINA X ESTADO ISLÂMICO NÃO TEM COMO ESCOLHER UM LADO SÓ QUERO VER SANGUE #PAZ,1
"Se o triste bebe, o brasil é uma fábrica de bebum!",0
[USR] Não liberou a burca ?? Que absurdo !!,1
"RT [USR]: aqui o salto eh 10 mil pés sem paraquedas, é andar na prancha com tubarão branco a sua espera",0
"[USR] não tem namorada, tem fêmea temporária.",1
ALÔ RAPAZIADA: VAMOS RESPEITAR AS DONZELAS SEUS PORCOS BÊBADOS IMUNDOS #PAZ #CarnavalSemAssedio #usecamisinha [URL],1
[USR] [USR] pra eles o cara do BB que é jornalista [URL],0
Pode vir para o Brasil que ajudo a divulgar e trabalho de voluntária... [URL],0
A mídia não reportou que a Dívida Nacional no meu primeiro mês abaixou $12 bilhões vs. um aumento de $200 bilhões no primeiro mês de Obama.,0
"#JesusEstáVoltando as profecias se cumprindo: gente querendo dominar o mundo pra trazer 'paz' através de socialismo, islão dominando etc",0
"É suposto a religião não ser critério para discriminar refugiados. Nem pela negativa, nem mesmo pela positiva. [URL]",0
"RT [USR]: As dicas 1 e 6 são incríveis, vale a pena ler <3 Mas hoje, eu só queria imprimir a 9 e colar na testa. [URL] _",0
"Aquela gente vestida de branco, parecia com o céu mais o céu é lugar de Santo",0
"O gay assumido bem resolvido é bem mais [USR] do que frangas arrogantes, dissimulados que não enfrentam a própria cara no espelho!",0
RT [USR]: [USR] eu choro de rir,0
"não há nada de engraçado, só gente mentirosa sendo desmascarada e fugindo sem refutar nenhum argumento! [URL]",0
Comunicação social portuguesa contabiliza o número de refugiados recebidos Portugal e deixa _ [URL],0
"'SOU MOCIDADE INDEPENDENTE' FALOU O MACONHERO, 32 ANOS, SÓ TEXTÃO NO FEICE E MORA COM A MÃE...  NÃO É MOCIDADE MUITO MENOS INDEPENDENTE.",1
acho que o cara da redação do Enem deveria perder pontos pq não ficou claro o sabor do miojo,0
se tu não usar um sutiã branco fica mostrando tudo,0
"não usa camiseta sem manga, a menos que vá malhar ou praticar algum esporte.",0
"[USR] Ué, mas o homem branco fez isso mesmo. Esse povo pensa que a colonização foi como?",1
RT [USR]: Reinaldo Azevedo foi a favor da lava-jato até a queda do PT. Depois disso passou a atacar Moro (já o chamou de ditador! _,0
RT [USR]: Cleo Pires tirou uma foto fumando maconha pq ela n tira tbm do exato momento onde conseguiu?,0
RT [USR]: pessoas mais sensata e onde habita,0
"NÃO PRECISO FALA NADA PRA PEGA AS DONZELA NO CARNAVAL, SÓ MOSTRO MINHA CARTEIRA ASSINADA, 48 ANOS DE TRABALHO HONESTO ELAS FICAM ENCHARCADAS",1
Chupa nazistinha! Vai daí [USR] [URL],1
"Filme de País Iraniano que apedreja gays e degola cristãos,ganha Oscar de filme estrangeiro e diretor crítica _ [URL]",1
"Obrigado Porto! Hoje seguimos para Aveiro. Teatro Gretua, 22h00. #OverdoseDeTourette #OnTheRoad #RacharLenhaPreta [URL]",0
Eduardo Lourenço: “O islão sente a nossa fraqueza” [URL],0
"Sinceramente, se forem refugiados de países vizinhos não vejo o porque do desespero (tem a questão da cri$e, óbvio) _ [URL]",1
RT [USR]: Passando Camp Rock na Disney e eu só vendo o quanto ela era gorda e feia quando não tinha dinheiro,1
OS HEITENS (ODIADORES EM INGLÊS) JÁ ACUSARAM O GOLPE. TRISTE DEMAIS ESSA CULTURA DE ÓDIO A MEU RESPEITO. #PAZ _ [URL],0
RT [USR]: Em homenagem a Revolução Russa; Bancada do Psol quer que relógios sejam atrasados em 1 Século [URL],0
"Gente, é o Trump que é 'difícil'! Não é a imprensa que o persegue desde o início com mentiras inclusive... [URL]",0
"BEM MORTO! KKKK RT [USR]: Hugo Chávez 'está bem', diz presidente do Equador",0
RT [USR]: PNR presta homenagem ao último grande Estadista que Portugal viu nascer.  #notascampanha #RenovarPortugal [URL],0
"RT [USR]: Liberal demais  MBL entrou na política, na velha política [URL]",0
Para ler. 'O Islão tem um problema com a mulher.' [URL],0
"[USR] Matéria sobre o #idolos no Fqte. mto bom o programa,neam? Tenho que ver mais! Parabéns provcestudo. #amoteucabelo",0
eae seus esquerdopata vão sair pra gastar capital com o que hj?,0
RT [USR]: essas escolas marxistas doutrinadoras de esquerda só sabem alienar nossos futuros cidadãos de bem,0
#NaoAceitamosRefugiados A Imprensa preocupa-se tanto com refugiados mas nao lembra os cristaos perseguidos e mortos no Oriente Medio,0
Curitiba realizando casamento comunitário é Brasília realizando #DivórcioComunitário.,0
"Deveriam decaptar! Já qdo [USR] chama a militância sapatão de grelo duro, deveria ser beatificado. [URL]",1
"[USR] [USR] no Islão as leis dos países não contam. Os muçulmanos respeitam-nas por conveniencia, não moralidade.",1
"[USR] OI! Sugeri um JV e ninguém me deu bola... tá afim? vc te mais moral que eu, vem mais gente. rsrsrs",0
[USR] quem é contra o ISLÃ..defende muito mais a mulher do que qualquer outra feminista,1
[USR] faz outra matéria explicando porque os países da arábia não recebem refugiados? Valeu!,0
"O jornalismo é um poder censório, manipulador, tendencioso e tantas vezes mentiroso. Afinal em que mundo vive a _ [URL]",1
"Tô gorda e n consigo emagrecer, certeza q minha gastrite tá piorando pq só passo mal, n tenho inglês fluente, n sei nadar, sou feia +",0
Quem será meu vice? Oh dúvida cruel... [URL],0
RT [USR]: eu sei o q é ser mulher... qd decidi por mim mesma ter filha(sim ela foi planejada) ouvir q só mulher burra e desestruturada _,1
"[USR] não será antes, petinga?",0
"Ontem, Gabriela Moura, uma de nossas integrantes, esteve na agência P3K Comunicação para ministrar uma palestra... [URL]",0
Junta esse gráfico com a proposta de reforma da previdência e tirem suas conclusões. [URL],0
Este Zivkovic é uma pequena maravilha,0
"Eu não me importo se a pessoa é magra gorda feia bonita se é de humanas ou exatas, se ela me tratar bem eu vou retribuir da mesma forma",0
"Burra é a mulher que aceita ser amante, pois valoriza um traidor, ajuda a destruir uma família e nunca terá moral de ser a única.",1
"[USR] Puts,o [USR] não é gay... Legal a gente ver que as aparências enganam e não fazem a MENOR diferença. #namoradalinda",1
"'não come mel, morde marimbondo'",0
#SerMulherÉ ter vagina . Quem tem pênis é homem!,1
Resumindo: descreveu o [USR] [URL],0
Internet 2017: Um negro a chamar ironicamente sua namorada de 'preta' virou motivo para o movimento negro pautar e _ [URL],0
"[USR] no perfil dela não tem, entende?",0
[USR] acho  melhor q ele use so  mao pq realmente este mundo anda todo assim só fufas para um lado gays para otr ih nada contra ahn,1
homenagear torturador? pode chamar outro deputado de viado boiola queima rosca? claro que pode cuspir no mito? NUNCA,1
[USR] [USR] [USR] ai agora já não é sharia? De todo o modo jihad é radicalismo não é a base do islão.,1
Argumentos: - cristãos são os maiores perseguidores de religiosos. - ninguém se importa com sua idéia - você é luná _ [URL],1
Quando expor sua ex no Facebook não é suficiente... [URL],0
[USR] sempre é brincadeira... modo de dizer...,0
E o [USR] se supera mais uma vez no quesito capa mais CANALHA do ano... [URL],1
"Concordo em gênero, número e grau . [URL]",0
"Fascista, machista, nazista, trapezista, taxista, maratonista, eletricista, mas e corrupto? kkk [URL]",1
A cidade de Viseu já está preparada para nos receber na 5a feira. Despachem-se a garantir a vossa presença. Vai ser _ [URL],0
Não quer morrer cedo ? -não consuma drogas - não leve drogas para as Filipinas -Não entre por engano em favela dominada pelo tráfico,0
RT [USR]: bicho me senti muito burra só ouvindo essa mulher falar #MasterChefBR,1
"[USR] bati muita punheta pra esse vídeo, muito bom, recomendo",0
[USR]  Obrigada... Só se for agora....rs,0
O Barcelona empatou no campo do Bétis depois deste golo não ter sido validado. É óbvio que #ACulpaÉDoBenfica [URL],0
"RT [USR]: Ensinar mal as crianças. Se uma pessoa é homossexual ou não, para mim é indiferente. Sou somente contra propaganda e dra _",0
"O desejo do homem é pela mulher, mas o desejo da mulher é pelo desejo do homem. Ou mais... #MulherDeVerdade",0
[USR] o que eu conheço de sapatão racista.....,1
[USR] e era de direita.... essa menina tem transtorno de personalidade ou algo pior...,0
uia RT [USR]    [USR] Fia nem te conto o que tô fazendo..rsss,0
...ter ganho. Os democratas estão usando demais a mesma carta. Perderam as eleições e agora estão perdendo a noção _ [URL],0
Chegou a Quaresma! [URL],0
"[USR] [USR] [USR] vai ow, vai se preocupar com a tampa",0
"No mês de março, em que regularmente celebra-se o Dia Internacional da Mulher, a Federação Sul Americana de Krav... [URL]",0
"RT [USR]: 'jihyo é feia' 'jihyo é gorda' porra queria eu ser feia e gorda que nem a jihyo, pfff",1
"RT [USR]: Quantos robôs da Pepper precisaram para as tags pró-PT, enquanto o povão honesto e trabalhador meteu um #BolsonaroPreside _",0
tem é que privatizar as universidades mesmo só tem doutrinador marxista  mas q eu queria uma vaguinha na ufrj queria.......,0
VEM GENTE DA ANGOLA TROVAR O MEU BOY NÃO NÉ AMORES,1
Ontem batemos o recorde de utilização da palavra 'nabo' na TV Portuguesa. Não acreditam? [URL],0
"DT (((Ana Gomes, MEP))): RT Maka Angola: Bento Kangamba Não Tem Juízo [URL]",0
A Esquerda é o próprio Zumbi dos Palmares: Quer libertar os negros de uma escravidão pra escraviza-los em outra [URL],1
"RT [USR]: Conselho: Mulher sábia, constrói. Mulher burra, destrói.",0
"[USR] [USR] Não tem lei no ocidente q obrigue mulher a usar véu, burca, esses panos todos, ela não é obrigada. Cada um q diga o q quiser.",0
[USR] pois é... deu em mim tb,0
"[USR] vishii.. eu tive q entrar pelo google, digitar facebook. depois de algumas tentativas consegui entrar na minha conta..ufa",0
"Pego agora aki no provador da C&A da Av Rio Branco, com várias peças.  Com o sistema de alarme _ [URL]",0
"a gente nao sabe se a mulher ta feliz de burca, nao sabe se é tranquilo p travesti ta com aquela roupa etc etc etc",0
"[USR] Carrão novo que ele ganhou por mérito, e não lambendo o saco do governo petista",1
nao é pq o mito diz que mulher grávida tem que receber menos que ele é machista gente [URL],0
não sabe que cor é bege,0
Odeio sapatão por isso Não desapega de ex nunka,1
"[USR] eu já morei no maranhão 8 anos, minha mãe é de lá..... eu tomava sempre tb",0
"'No livro best-seller do New York Times “Má-feminista:  ensaios provocativos de uma ativista desastrosa”,... [URL]",0
"[USR] [USR] pois é, to muito ocupada denunciando racista q acha que a vida é fácil",1
"RT [USR]: Queremos igualdade! Queremos igualdade! Empoderamento feminino! Queremos igualdade! Ops! Não! Pera ai, nem tanto assim _",0
RT [USR]: Com Bolsonaro acaba essa estória de tratar criminosos como cidadãos de primeira categoria e o resto como resto. #Bolson _,1
"[USR] Ju, você tá mais corada! Andou pegando uma praia!!!",0
"Mais um episódio na novela das viagens, agora envolvendo protagonistas da CDU. É tudo farinha do mesmo saco!  [URL]",0
7 PICA DOS ALEMÃO [URL],0
RT [USR]: Jornal da Globo mostra protesto de 200 pessoas contra Trump mas esconde as MAIS DE 100 MIL a favor na noite de hoje [URL] _,0
"#Extra Próxima novela das 9,abordará transgêneros, desde a infância. Lembre-se que a associação Americana de... [URL]",0
Quer se livrar do [USR] ?? é só eleger o [USR] em 2018 [URL],0
[USR] Ta falando do Felipe neto [USR],0
"Aumento nos combustíveis: 3 passos à frente, 1 passo atrás, 3 passos à frente... Assim não há progresso económico. [URL]",0
RT [USR]: Só eu acho (muito) esquisito essas mulheres todas artificiais que falam gemendo pelo nariz? #PreguicaDeGenteSemConteudo,0
"[USR] Então, reflita no teu comentntário, friend. E não esotu justificando ou defendendo pq é famosa. Faria com qq Pssoa! Abç",0
Mais de duas mil solicitações recebidas pela Polícia Militar do Rio foram pedidos de socorro sobre violência... [URL],0
"Melania e eu estamos recebendo o Primeiro Ministro japonês Shinzo Abe e a Sra. Abe em Mar-a-Lago em Palm Beach, Fl. _ [URL]",0
[USR] muita saudade! Faz um tempão que não tomo...,0
Mundo das fufas tá cada vez mais a ficar mais pequeno,0
Hei Jovem espinhudo! AXÉ NÃO! RESTART NÃO! LEGIÃO URBANA NÃO ! Tenha um mínimo de decência nessa vida ordinária que vc leva!,1
OBRIGADO SÃO MUITAS PERGUNTAS NÃO DA PRA RESPONDER TUDO 11:30 VOU FUMA UM CIGARRO BEBE UMA CAIPIRA COMPRA UM FRANGO ASSADO  #JoaquinResponde,0
"Jamais vou entender este fenômeno chamado, #Carnaval. Um povo sofrido, roubado, explorado, _ [URL]",0
Meus Deus!! É muita doutrinação e alienação que a imprensa impõe na coitadinha!!! [URL],0
e eu odeio gente chique #iDontUseShoes [URL],1
"Parabéns a todas as mulheres, menos para as abortistas e aborteiras, porque essas não são gente!",1
"RT [USR]: Feliz dia da mulher em 1 lugar a minha mãe. E tb à [USR] , [USR] , [USR] e todas as mulheres do Tw _",0
[USR] [USR] [USR] só estagiário se fode nessas,1
[USR] [USR] [USR] holocausto canibel eu não achei tudo isso não,0
"[USR] Mulher apanha aqui na ilegalidade, porque se pegarem o canalha ele apanha ou vai preso!!! [URL]",1
