text,label
@user Giusto! Italiani immigrati in #Lussemburgo non ce ne sono mai stati! E poi non vogliamo portare qualche #soldino a riposare in qualche caveau di quel ridente paesello? Un bacione,0
"Giornata della Memoria, i rom di Milano commemorano il loro “Porrajmos” http",0
"@user Io invece ravviso un accanimento contro il mio  Paese di un'organizzazione straniera ke, in 3 anni, ha sbarcato 35.000 immigrati solo e unicamente nei porti http nn vi sta bene,cercatevi altri paesi dove sbarcarli",0
@user @user Possono travestirsi come gli pare che sono Rom lo portano scritto in faccia.🤮poveri turisti stranieri.Pensare che questi delinquenti abbiano pure i rappresentanti mi fa accapponare la pelle,1
"@user @user Anche gli zingari li devi chiamare Rom ma io ho sempre continuato a chiamarli zingari Hai capito Fico? sono zingari, zingari, zingari ZINGARIII !!",1
@user  a Mello' i 35€ x  il numero degli. Immimmigranti quanto fa' se li fottono loro sti bastardi,1
"Il Papa: aprite i porti Il Pd: aprite i porti I sinistri: aprite i porti Finti buonisti: aprite i porti Ricordo a sti ANTI ITALIANI, di cosa sono stati capaci di fare i terroristi Islamici in Sri Lanka contro i cristiani: quasi 300 morti. L' Islam è solo morte e violenza.",1
“Esiste tutto un mercato che punta a far venire migranti e ingaggiare nigeriane nella rete di prostituzione. È un’impresa mafiosa che si appoggia su tutte le milizie in questione. Ricevono fondi esterni”.  Fondi di #Gheddafi usati dal #Belgio http,0
Quei partiti e partitini  che fanno la voce grossa con Trump..lo sapete che i terroristi  transitano  tutti da qui? TRUMP SE NE FREGA DINOI,0
"@user tutto pur di non commentare questo . Perché il problema sono gli immigrati,vero? http",0
No alle piste ciclabili perché ci vanno i migranti. No al wi fi in piazza perché crea assembramenti. No ai negozi etnici aperti la sera. No alle panchine. No alla vita notturna. È una classe dirigente di vecchi che sogna di amministrare un paese di morti.http,0
"@user @user quelli del ""possiamo"" fare qualcosa contro i cambiamenti climatici, sono gli stessi de""l'immigrazione e' un fenomeno inarrestabile"" e "" l'euro e i trattati europei"" sono irreversibili.   Capito? fenomeno sovrumano: possiamo intervenire fenomeni umani: possiamo solo subire",0
@user Ma se avete tanto a cuore gli immigrati perché non andate direttamente da loro piuttosto che impoverire e sterminare le nostre civiltà con queste feroci importazioni di massa. Fanculo l’Europa,1
ORLANDO IL POSTO CHE I TUOI AMICHETTI MAFIOSI TI HANNO DATO SCOTTA EH? SENZA IMMIGRATI COME FANNO A FARE I SOLDI??  #SalviniNonMollare #IoStoConSalvini #MatteoSalvini,0
Salvini: #Salvini: Prendo atto che il PD dopo 5 anni si sveglia. Si sono accorti che il problema immigrazione inizia ad essere serio. #agor…,0
"Roma, rivolta a Torre Maura: rabbia contro l'arrivo dei rom. E il Campidoglio li ricolloca [news aggiornata alle 09:05] http",0
"Sarà anche vero che i musulmani non sono tutti terroristi, ma è altrettanto vero che tutti i terroristi sono musulm… http",1
"@user Un Rumeno, se applicassero le leggi che ci sono,rumeni, rom clandestini starebbero fuori dall'Italia, basta pidioti al governo",1
Una dedica al ministro lussemburghese. È a conoscenza del fatto che il Lussemburgo negli anni '30 e '40 abbia chiuso le porte agli ebrei in fuga dalle persecuzioni e dalle leggi razziali? Non deve quindi permettersi di farci la predica. #iostoconsalvini #complicidisalvini,0
"Majorino ci informa che chiudendo i centri di accoglienza a Milano saranno messi per strada 800 migranti.  Pensa un po' che cazzo me ne frega, li avete voluti voi ora ve li portate a casa vostra cari i miei immigrazionisti con i soldi miei.",1
"@user Se è' per \""salvare\""decine di migliaia di migranti che vengono a farsi le vacanze infinite in Italia, e' una spesa inutile !",1
"@user @user @user servizi come questo, mostrano che l'Italia farebbe volentieri a meno degli immigrati",0
@user @user di preciso vicino a quale campo rom vivi? Per farmi un'idea della zona,0
"#agorarai @user  Sull'immigrazione l'Italia si è infilata in un vicolo cieco,  invitare in rai soliti volti noti ma vuoti di idee.",0
La via della seta è stata disegnata dai nomadi http,0
"Ho capito dai discorsi ...che ci sono anzianotti arzilli che commerciano immigrati, sti bastardi di sinistra arrotondano la pensione, stanno 2 sedili davanti a me , kivestramúrt",1
Le Pen agli stranieri se venite qui niente scuola gratis - Tuttoscuola http http,1
"@user tu sei malato di mente, come tutti i musulmani, tu sei pericoloso scimmia http",1
@user @user I profughi? Perchè io me li devo pagare e a loro li devo pagare ancora io?🤮,1
"#Venezia anche San Marco era nel mirino dei terroristi - #Venezia, #anche #San #Marco #era #nel #mirino #dei ... http",0
La Meloni parla di accoglienza parlando di rom. Qualcuno dovrebbe informarla che hanno quasi tutti la cittadinanza italiana. #inmezzora,0
"Altra vergogna dell'Europa, la denuncia di Salvini: Malta scarica il gommone in mare, ecco quanti immigrati stanno arrivando in Italia (e Bruxelles fa finta di nulla) http",0
"@user @user  Grazie ragazzi Questa protesta pacifica, ci rappresenta!  #ITALIA agli #ITALIANI  NO #moschee, #islam, #arabi",1
"Campi #rom, al via a #Roma l’iter per il superamento. “Segnale importante” @user (Abbonati) http",0
"#allarme #sud #andria #italia #puglia #caritas - Allarme povertà, al Sud più italiani che stranieri nei centri... http",0
"Mafia Capitale: appalti campi nomadi, in 13 rinviati a giudizio - Lazio - ANSA.it http IL MAGNA-MAGNA DELLE COOP ROSSE...",0
"http ""In protesta anche per avere Sky"". Così i migranti sbugiardano i buonisti. http",1
"Santanchè, vuoi che i rom lavorino? Ok, licenzieremo tutti gli italiani e faremo lavorare loro! Ti va bene? #dallavostraparte",0
"Nuovo vasto incendio nel campo rom della Barbuta, problemi sul GRA http http",0
"Milano, rom da anni in stabili comunali di via Adriano http",0
Senadid nomade “liberato” dalla Kyenge ancora in carcere accusadi furto aggravato e resistenza a pubblico ufficiale http,0
@user @user  gli stranieri tutto dovuto.Gli italiani. Fame e zero diritti. ..,1
"@user @user La soluzione esiste! Vanno rispediti a casa loro, sono nomadi quindi non capisco perché si siano stabiliti in Italia!!! Ho capito!.. in questo paese tutto è concesso a questa gente mentre i discriminati sono gli Italiani  che pagano le tasse e lavorano per vivere!!! Lavorino!!!!",1
"Ormai l'anti islamismo é sdoganato. Razzismo puro.  Invece che contro il terrorismo, la gente se la prende con l'Islam. Tutti a difendere-",0
I vigili nei campi nomadi: inchiesta sugli straordinari - Il Messaggero http #Roma #news,0
L’accordo fra Italia e Libia sui migranti http,0
"Cara Sindaca, premi per chi assume ITALIANI no è? Roba da matti. Sti caxxo di finti profughi, sono diventati una vera e propria ossessione per tanti, troppi anti italiani. http",0
"@user @user Diploma tecnico, corso di programmatore, patente DE, esperienza catene montaggio FIAT... Ti basta? A loro no! Cercavano IMMIGRATI senza esperienza. Ma di cosa parliamo? Il nome della fabbrica non te la faccio ma é una MULTINAZIONALE! Se mi credi bene. Se no é lo stesso!",0
Di italiano vogliono far estinguere anche i cani. Del resto invisi agli islamici. http,1
L'immigrazione selvaggia ha cambiato i connotati delle ns città le ns abitudini di vita in senso restrittivo abbiamo perso la libertà di movimento e ci stiamo abituando alla paura. Questi selvaggi vanno mandati via prima è meglio è.,1
"Ricordate i delinquenti italiani? Cavallero, Lutrig, Vallanzasca. Si scriveva di loro «Italiano rapina banca»? No, la nazionalità si mette per gli stranieri. Infatti per l'assassino di #StefanoLeo l'hanno messa: «L'italiano Said Machaouat». Che peccato aver merda, anziché stampa.",0
Molotov su centro migranti. Con l'aggravante della noia e odio razziale. Cc. #Meloni #Salvini Ma non vorrei dargli troppa visibilità.. http,0
"Vescovo: “Basta immigrati, vanno aiutati a casa loro” http",1
"Non è nemmeno un fatto di rom, italiani o cazzi, si tratta di vite umane, persone, che voi vi sentite in diritto di trattare come bestie",0
Saviano da ricovero: «Il Sud Italia può ripartire se si riempie di migranti» http,0
Iniziano i bizantinismi di chi vuole gli islamici da noi. Finché siamo in tempo cacciamoli tutti,1
"@user Sono i migranti, caro cappellone rosso,  che devono rispettare i nostri usi e tradizioni e RELIGIONE quella che non sembra stai rispettando neanche tu, non usi neanche la veste da sacerdote!Loro sono in Italia non noi in Africa!Se non vogliono rispettare ...via, .al loro Paese!",1
"Milano, profughi ‘osservano’ alunne e prof  a uscita scuola http",0
"Roma, “tangenti per appalti sui campi rom”: chiesto il processo per 17 persone  http via @user",0
"Emerge un quadro sconcertante. I governi che hanno bandito il concetto di clandestinità, finto che i #clandestini fossero profughi, eluso la difesa dei confini, hanno ceduto lo Stato alla #MafiaNigeriana. Noi esigiamo cattura e punizione dei politici responsabili di tale crimine.",0
"Maltempo a Ventimiglia, migrante arrivato in Italia disperso nel fiume in piena. Nemmeno in Final Destination erano così sfigati.",0
IO DOMANDO A QUESTE MERDE che vogliono e accettano altre merde mussulmane se gli viene in mente cosa si preparerebbe per noi oppure sono solo merde che nn pensano se no ai soldi non parliamo poi q questo auspicio è proclamato da donne italiane mi auguro siano le prime a subirlo http,1
migranti/clandestini girano incontrollati x #Genova #bastainvasione #renzi #alfano rovina d'Italia #FdIAN #cambiaresipuò anzi si deve,1
"Prime dichiarazioni di #Salvini: ""Arrestato Lucano? E cosa vuoi di più dalla vita?"" #Riace #sindacodiRiace #Lucano #migranti #Governo #tgla7 #propagandalive @user",0
"@user @user @user @user Le tue osservazioni sono condivisibili soprattutto questo ultimo tweet. il punto è che nei delinquenti piccoli e grandi,italiani e stranieri vige la sicurezza assoluta di impunità. L'Italia è famosa per questo....",0
Modelli Ungheria. Legge «Stop Soros». Tasse speciali al 25% per le Ong che aiutano i migranti.Italia. Raddoppio dell’Ires dal 12 al 24%. A tutte le organizzazioni non-profit che si prendono cura degli ultimi. Dolce Natale,0
"Mahershala Ali, musulmano afroamericano alla notte degli #Oscar2017 http @user @user @user #moonlight",0
Sinead O'Connor e la frase razzista: «Chi non è musulmano mi fa schifo». Il giusto atteggiamento di chi vuole porre pace e distensione?. Se la religione mussulmana porta a questo beh a voi le giuste conclusioni http,0
"#immigrazione dall'Africa..e' cio' che affiora...Se l'Europa abbandona l'Africa, sara' invasa dal deserto..e dall'ondata islamica..e si consegna alla influenza cinese Primum vivere.. L'uomo della strada puo' ignorarlo, la politica ha responsabilita' sul futuro dell'Europa",1
@user ..e arrivata la nave e MIRACOLOSAMENTE si è materializzato un gommone di #migranti da salvare..È UNA PROVOCAZIONE...ORA BASTA.. NESSUNO SBARCHI IN #ITALIA   #portichiusi @user #mattarella #governo #ong #Aquarius #salvini,1
@user @user @user @user Leggi l'articolo prima di commentare. Campo/Campo Rom lo ha detto solo Salvini nel suo post. Lui parla di case abusive. E se non capite la chiusa dell'intervista non é colpa di Pif.,0
Togliere la voce a chi inneggia alla violenza e senza un briciolo di umanità giustifica un inaudita atrocita' #SalviniVergogna #Lidl #rom,0
Noi Italiani abbiamo il Diritto di vivere sereni in casa nostra.  Stop immigrati  #StaseraItalia http,1
"Ma quali migranti, sbarchi, emergenza sicurezza. Tutte armi di distrazione di massa utili a nascondere la vera grande questione che aleggia sulla sopravvivenza del Governo: il conto che ha lasciato da pagare per la legge di bilancio. Circa 30 miliardi.  http",0
"@user vuoi mi mischiare la discussione ! I rom rubano , Chiaramente non tutti ! Una parte di mussulmani uccide come una parte di >>",1
Con tutti questi migranti !!!! L' EUROPA DOVE'???,1
"BASTA BASTA BASTA GENTE CON I BARCONI. NON SE NE PUÒ PIÙ. ACCETTARE SOLO DISPERATI CON VOLI REGOLARI SE HANNO SOLDI PER VENIRE CON I BARCONI NON SONO PROFUGHI. BASTA.  Gommone con 200 migranti a bordo verso l'Italia. Salvini: ""Malta si tira indietro"" http",1
"@user Poveri noi davvero! In Italia lascerei solo Clandestini e rom,Italiani onesti....viaaaaaa tutti! Sarei curiosa di vedere",0
"Studentessa cinese morta a Roma, fermati due giovani residenti campo rom di via Salviati http #cronaca",0
Ora i migranti fanno i pirati.Quattro nigeriani si imbarcano di nascosto su una nave della Grimaldi Lines e una volta scoperti minacciano l'equipaggio costringendoli a portarli in UK. Ora è bloccata nell'estuario del Tamigi e sono in trattative con la polizia.,1
@user @user @user E i tunisini alla Marzuk dove li metti? Algerini meno. Albanesi e rom se la cavano bene W Italia!,0
"@user IO aspetto che Tu arrivi anche qui da noi, basta business immigrati con l'aiuto della #sinistraladrona #€urolandia",1
"@user ma il prezzo di assumere immigrati a costi inferiori secondo quanto hai detto è la guerra, e la guerra costa",0
@user Gli immigrati non pagano l'affitto perché ci pensa il comune di residenza.I nostri figli pagano affitto scuola e tutto il resto,1
Brigitte Bardot scrive a Bergoglio: “Strano tu favorisca immigrazione islamica” http,0
#Portate in carcere due mamme rom ai domiciliari in camper a Milano - #Portate #in #carcere #due #mamme #rom ... http,0
"OMICIDIO #DESIREE, DOVE SONO #MAGLIETTEROSSE E #FEMMINISTE? 4 stupri su 10 fatti da stranieri, sempre più #clandestini che spacciano. A sinistra vergognosamente fanno finta di nulla. Questi vermi assassini hanno ucciso una ragazzina con i permessi umanitari in tasca. http",1
"🇮🇹 ITALIA 🇮🇹 Ora vi spiego quanto siamo #coglioni   NOI  Tolto il crocefisso in aula, abolizione festa di Natale nelle scuole e cibo islamico nelle mense.  ISLAM  Brescia, per la nascita di Maometto corteo, sfilate, urla canti e grida.  A CASA NOSTRA, porca troia. #coglioni",0
Piccoli immigrati CLANDESTINI a ..... casa in Africa! Chi non paga non mangia: ciò che è purtroppo valido per TUTTI lo sia anche per loro! #parassiti http,1
"Adotta un profugo', la mozione approda sui banchi della sala del Tricolore a Reggio - 24Emilia… http",0
@user @user @user @user @user Ma perché non andate a Milano ad aiutare i loro stranieri nella stessa situazione? Ah no lì ci sono i compagni,0
"Caro Papa Francesco se anche quest’anno vuoi umiliare il Natale paragonando Giuseppe e Maria che scappano in Egitto, per sfuggire ad erode, ai migranti che strappano i documenti e bruciano i polpastrelli delle dita, per fottere lo stato italiano ti consiglio di cambiare religione",1
"@user Come si può ben vedere da queste dichiarazioni farneticanti, pure l'immigrazione regolare può far danni, anche irreparabili.. Un bel #raus e stracciare loro la cittadinanza.",1
"Fatto - Follonica, rom chiuse in gabbiotto. Fratoianni (Si) vs Salvini: “Fai schifo, sei un… http @user",0
@user @user Tutti i nostrti paesi d' Europa  Musulmani e migranti di merda : FUORI,1
"Blitz della polizia nel campo rom di Palermo, i ragazzini cantano Bello Figo VIDEO http",0
All'estero siamo simpatici perché gesticoliamo molto ma gli stranieri non sanno che li usiamo per mandarli a fanculo senza farci capire,1
"25 settembre 2003 A #Gaza uno dei tanti raid israeliani uccide 7 palestinesi nel campo profughi di El Bureij, fra i quali una bimba.",0
@user ci deve essere un bel covo di #terroristiislamici bestie mi sa a #Milano,1
Spintonati e insultati la loro colpa?Avere portato del pane ai #Rom.Tutto ciò accade davanti alle forze dell’ordine che dovrebbero proteggere gli onesti no difendere i fascisti. In Italia gli #antifa vengono menati i fascisti protetti. #TorreMaura   http,0
"#Notizie #Cronaca Vitulano, ancora due profughi in centro http",0
"Viaggio nel campo rom di Chiesa Rossa: ""Non usate tutti i fondi per gli sgomberi"" http",0
"Alla marcia della pace appello per i profughi, precari e ambiente - Il Gazzettino http",0
"Roma, stupro al campo rom: condanna a 7 anni. Il giudice ordina la bonifica http",0
Giro per #Roma e guarda un po'... Caro @user certe cose non si possono vedere! Adesso anche le targhe pro #rom! Ma com'è possibile che a casa nostra succedano certe cose? Basta! #Salvini faccia qualcosa per questo scempio! #propagandalive #Lega,1
Auguriamo a tutti gli amici musulmani un felice e sereno anno 1438 (#Hijri1438)! Che sia un anno di #سلام #pace http,0
"@user Supporto il controllo dell’immigrazione, ma non possiamo cadere negli estremi. Un triste messaggio che viene dato al mondo. Un’Italia razzista e intollerante. Un’Italia che ha dimenticato la sua storia di rifugiati dalla guerra. Non confondere la sicurezza con la discriminazione.",0
"Forse raggiunto il punto di non ritorno in #Svezia. Dopo questo, per ritornare alla normalità, non resta che la guerra civile. #islam #immigrati",1
fuori  da questo paese i violenti delinquenti finti profughi #StaseraItalia,1
"@user @user @user @user @user @user @user @user @user Vivendo in mezzo a due campi rom a Roma posso confermare che questa politica è un suicidio, se si vogliono ancora fomentare la rabbia e l'odio tra cittadini e istituzioni beh complimenti obiettivo centrato.",0
SEMPLICE. SE IRREGOLARI E CLANDESTINI. RISPEDIRE IN AFRICA.  Che fine faranno ora i migranti del Baobab? http,1
"@user Flavia Perina:""Ilham e le altre...italiani nella vita, stranieri per la burocrazia e per la politica pavida""(io citt. mondo)",0
"CULTURA? \""@user: Ecco l'assessore alla Cultura: \""Sterminate i musulmani come gli ebrei\"" @user http\""",1
La giunta #Raggi e i #rom: 12 milioni di euro per un nuovo “sistema campi”? http,0
@user #LONDRA #Westminster per quanto tempo dobbiamo sopportare di morire prima di cacciare a calci in cu:o i musulmani?,1
"#Boldrini #staderaitalia Sono arrivati con la prepotenza milioni di immigrati in Eu. Ne combinano di tutti i colori: spaccio,mafia,violenze sui cittadini,gente che gira con le asce,attentati,stupri,rapine, botte a FdO e controllori. Cannibali...!!! e lei niente, non fa una piega!",1
"#Napoli, via alle operazioni di sgombero del campo rom di via Brecce a Poggioreale http @user #grazie",0
*** Novara News *** Ancora nomadi accampati a Cerano  leggi tutto... http,0
"@user @user per gestire l'immigrazione abbiamo obbedito a Maroni, non so se è stronzo, ma so che ha fatto più danni che altro.",0
"Mai Tg e i giornaloni hanno parlato di questa ennesima porcata fatta da immigrati ?? ⤵️⤵️⤵️⤵️  Sanremo, Segregata e stuprata per mesi. La giovane sequestrata da sei immigrati. Legata al letto e stuprata a turno per due mesi. Poi ceduta ad altri ""clienti""  http",1
#salvini: Chi vuole venire in Italia deve RISPETTARE gli italiani. Punto. Con il #DecretoImmigrazione in arrivo torna il buonsenso.  Sig. Ministro anche i #mafiosi sono Italiani ... baciamo le mani e' un concetto difficile da tradurre agli Stranieri sa ?🤣🤣🤣 http,0
"NATO costruisce ""baluardo"" antiterrorismo in Italia http",0
"In Italia ogni persona, che sia questa turista,immigrato, tifoso si può permettere di venire qui e fare come cazzo gli pare. Che schifo",1
"“L’Isis non è islam”, dicevano i sussiegosi benpensanti. A fare chiarezza ci pensa il sultano del Brunei, che vuole punire i gay con la morte. L’Isis li buttava dai palazzi. Il sultano fa una legge. E poi c’è l’Iran, che i gay li appende a una gru. Sempre “l’Isis non è islam”? http",1
Minori non accompagnati: oggi in Parlamento la discussione della legge dopo 3 anni di attesa http #migranti,0
"A chi straparla di #INTEGRAZIONE. Con l'#islam non esiste. Loro conquistano e basta!  «TROPPO #OCCIDENTALE» #Modena, #marocchino picchia la moglie perché convertita al #cristianesimo. Violenze e soprusi. Arrestato per maltrattamenti dai carabinieri.  http",1
Se tutti i migranti e i rom tornassero a casa propria,1
"@user ROMA.Ragazza cinese rapinata+uccisa da rom,sempre loro in tutta Italia:rubano+uccidono:francesco-orlando NO CERTEZZA PENA",1
ROMA&ROM: maxi sequestro di 30 milioni a 5 famiglie nomadi. E poi pretendono le case gratis e qualcuno a Roma glie le concede pure!,1
"Ecco la ""scuola degli zingari"" per i vostri figli Dove si spingono i rom: ""bastano"" 400 euro -… http",0
"Roma, studentessa cinese morta: i rom non andranno in carcere http http",0
"Falla pure sui rom, i clandestini e gli sfrattati italiani a Roma http",0
"@user lo so, ho regalato tutti i miei sacchi a pelo a una ragazza rom sgombrata senza pietà con i suoi bambini @user @user",0
"Milano, ladre rom senza contegno e umanità: rubano pure le urne con le... http",1
Danimarca.Poi danno dei razzisti a quei danesi che sono favorevoli a mandare i migranti su di un'isola vista la loro incompatibilità con il vivere civile.Giovani rifugiati picchiano una donna danese   👇http,1
@user L'italia per colpa di qualcuno è diventata ingovernabile. Aiutiamo i #disoccupati italiani e basta #immigrati.,1
#dallavostraparte giungono in Italia solo migranti economici ke non sono candidabili x la ridistrubuzione ecco xkè l'Ue se ne lava le mani,0
chissà come mai solo in Italia i migranti! In Spagne e Grecia nemmeno x turismo! ma c'è scritto nel nuovo testamento che tutti in italia?,1
"Il cordoglio dopo la morte di Fabrizia: ""L'Abruzzo è terra di amore, il terrorismo non passerà""… http",0
"@user @user la verità è che con questi immigrati  aumentata anche la delinquenza,da ora in avanti Salvini dovrebbe dire chi vuole venire in Italia deve dimostrare di avere un lavoro e almeno 20000 euro per sopperire alle prime necessità,casa ec. invece arrivano tutti miserabili da mantenere",1
"Traduco: ""Ci sono tanti edifici vuoti, perchè dobbiamo dormire per strada?"" dicono i rom sgomberati a Giuanturco http",0
SALUTE #italiani A RISCHIO CAUSA #immigrazione AFRICANA !!!!!!!!!!!! AUMENTO MALATTIE INFETTIVE E DIFFUSIVE !!!!   #StopInvasione http,1
"#dallavostraparte cara signora purtroppo in Italia  il decreto di espulsione gli stranieri lo usano come carta igienica, chieda a Librandi",1
@user mai.... @user appoggiato sempre da @user se ne frega del popolo italiano....tutti pro clandestini rom iussoli,0
Video e immagini che fanno venire i brividi: i fascisti infiltrati tra i manifestanti di Torre Maura accompagnano l'uscita dei rom con cori e saluti romani.   http,0
Islam: 4 termini da non dimenticare.  ▶️ Taqiya: inganno per proteggere islam e musulmani; ▶️Tawriya: dissimulazione con doppiezza e ambiguità; ▶️Kitman: la menzogna per omissione; ▶️Murana: facoltà di trascurare certi comandamenti coranici per il bene superiore dell'islam. 🖊️👋🏼,0
"@user Sono figlia di fornaio, so  simbolicamente cosa vuol dire buttare via il pane, ma non si può ripensare l'accoglienza ai Rom? Perché sempre in estrema periferia? Perché non ai Parioli o Collina Fleming? Forse non sono degni di calpestare quei luoghi?Ricordo #capalbio. #TorreMaura",0
Incendi di rifiuti in campo nomadi abusivo tra Manfredonia e Cerignola – la VIDEO segnalazione di Forza Nuova: http,0
"Anche il Sommo Poeta nel XXVIII canto dell'inferno ha preso per il culo Maometto, e la Boldrini li vuole integrare.#nostrasignoradellislam",1
"Il Messaggero:  Roma, maxi-rissa al campo rom durante il censimento del Comune. Raggi: torna legalità, se ne facci… http",1
@user bruno t c metti anke tu ora? Sent i tuoi conterranei se sn felic dlla precedenza x immigrat alla ricostruzione dlle loro case,1
E EU DIFENDE I ROM. FANNO TUTTO ILLEGALMENTE. E NON LAVORA NESSUNO.  Bolidi senza assicurazione: scatta il sequestro a famiglie sinti http,1
"Scabbia, AIDS, meningite, sifilide e tubercolosi fra le malattie che viaggiano con i migranti. le ONG Mettono a rischio la salute pubblica, smaltivano il materiale altamente infettivo (sanitario e non) come fosse normale “rifiuto solido urbano indifferenziato”",0
"A quanto pare, il corano, oltre che in bagno si può usare anche per questo. Ma pare non funzioni molto bene..... http",1
"#cvd #M5s oltre che tutelare: zingari nomadi rom, con questa mossa ha fatto il salto di qualità ���������� http",0
"Ma per i preti conta solo il business. Che i migranti restino a casa loro non ci pensano nemmeno. Perché poi che fine farebbero gli affari di Coop, Associazioni, Caritas, eccetera.....? http",0
"Germania, “minaccia terroristica” In corso raid in quattro città (Corriere della Sera) http http",0
Continuate a far arrivare chiunque in Italia. Ve ne pentirete poi in seguito ad un attacco terroristico.,1
"Visto e considerato che il 90 % dei migranti sono economici  e per lo piu clandestini,e giunta l'ora  di far chiudere in tutte le città italiane le  «aziende del bene»  gestite dalle Coop rosse che grazie all'immigrazione fatturano milioni di euro",1
"Accanto alla Questura e campo nomadi con gente che fa quello che vuole, impunemente. Polizia ha responsabilità grav… http",0
"Liliana Segre: ""Oggi con i migranti, come ieri con gli ebrei, è tragica l'indifferenza"" http #LilianaSegre per Lei è sinonimo di indifferenza MANTENERE 600.000 clandestini? E non sfrutti gli ebrei uccisi dai nazisti per fare propaganda immigrazionista! 🤔",1
@user @user pensiamo all'Italia invece di difendere i musulmani che sono i ns nemici,1
"@user @user @user .... tutti i giorni per spaventare la gente😁 "" e infine difendiamo, gli immigrati (clandestini), i mercati, l'europa, i tecnocrati e le femministe (che non difendono le Desirèe o le donne islamiche)""🤢🤢🤢",0
