text,label
"#OpenArms con a bordo 300 migranti chiede di poter sbarcare. Ma @user  conferma la sua linea: ''I porti italiani sono chiusi'. Malta, che nega l'approvvigionamento, ha evacuato stamani dalla nave un neonato e la mamma soccorsi in mare ieri http",0
"Roma, Raggi annulla gli sgomberi dei campi rom: “Anche gli zingari hanno diritto alla casa” http via @user",0
"I rom vivono in un campo e non vi va bene; li assegnano ad alcune strutture in centro città e non siete contenti. La verità è che siete la merda. Non ve ne frega un cazzo del prossimo, l’importante è che stia lontano dalla vostra vista perché i “diversi” vi fanno schifo.",0
@user cacciamo fuori dall'Europa tutti gli islamici e non avremo più terrorismo in casa nostra!,1
"Accoglienza #profughi in Trentino, il sostegno della Croce Rossa http http",0
Il #Giappone ha tifato #Clinton. Ma @user è il primo leader straniero a vedere #Trump. Ecco come'è andata:… http,0
"@user @user Prof... Le alleanze internazionali sfociano  sempre verso la stessa direzione... ""La spartizione del malloppo""... Questi poveri profughi non portano ricchezza a nessuno se non solo a quei maledetti che li sfruttano...",0
"Sta cosa che bisogna anna' sempre contro una minoranza me non sta bene! -""Sei l'unico a favore!"" +""Almeno io penso!"" -""Il comune qui non ci dà nessun servizio!"" +""Ed è colpa dei rom?""  Così #Simone, 15 anni, zittisce il leader di Casapound. Lasciamoli crescere. ??  #TorreMaura http",0
Usa: lacrimogeni sui migranti al confine  Anche contro donne e bambini e alcuni reporter- Ultima Ora - http http,0
"Non vorrei dire,ma a quanto pare con i musulmani ragionare è una cosa difficile se non impossibile #Piazzapulita #sapevatelo",1
"Oltre a qualche famiglia rom, nell'area c'erano anche diverse persone profondamente colpite dal terremoto, come... http",0
@user Non devono entrareeeee ! Avete capitoooooooo ? Dovete rispedirli a casa loro ! Avete rotto con questa Europa e con i migranti ! E state facendo rovinare i pochi figli che nascono italiani con quei bastardi di vaccini. !,1
"#SeaWatch, #DiMaio: ‘#Malta faccia sua parte’. Premier Muscat: ‘Non faremo sbarcare migranti, bulli non vinceranno’ http di @user",0
"Roma, le nomadi fanno spese pazze ma la cassiera è complice del raggiro http http",0
"“Tijuana è una città di immigrati, ma non li vogliamo in questo modo”, ha detto il sindaco, membro del conservatore National Action Party. “Era diverso con altri immigrati, portavano le carte, erano in ordine. Non era un’orda, scusatemi l’espressione.” http",0
@user ho visto immigranti ilegali anche nella Vittorio Emanuelle a Milano. Non dovete lasciagli! Stanno rovinando l' Italia !,1
"Toh, che caso: clandestino, islamico radicale e terrorista. Costa stava per fare http",1
Sono stanca di questi terroristi islamici.Il mondo non può avere sempre paura di un vostro attentato.Noi potremmo benissimo fare le stesse-,1
Emergenza cacca di profughi a Ventimiglia: 9 mila euro per raccoglierla http,0
@user i rom non devono esistere non possono fare ciò che vogliono protetti da associazioni no profitto che vivono sui nostri soldi,1
"FELICE DOMENICA A TUTTI..GLI IMMIGRATI ILLEGALI CHE PROTESTANO CONTRO IL DECRETO SICUREZZA DI SALVINI, LE COOP CHE PROTESTANO PERCHÉ NON CI SONO PIU IMMIGRATI..ERA UNO SPORCO BUSINESS PAGATO DAGLI ITALIANI ! PRIMA GLI ITALIANI ! IMMIGRATI ILLEGALI VIA ! #MovimentOnesti http",1
"#notizie #Modena In fuga da Modena a Castelnuovo dopo un furto, preso nel campo nomadi: Foll... http #Emilia #Romagna",0
Guardando the siege (1998) molto attuale x comprendere che non si deve cedere alla paura terrorismo mettendo da parte le leggi ed i diritti.,0
"Che cari i #giornalisti quando al #tg per descrivere gli zingari - rom, usano ""forte accento dell'est"".  Ma definiteli anche merde, ci piace",0
La legge vigente che ormai regola da anni l'immigrazione in Italia è la Bossi-Fini. A causa di questa legge infatti gli immigrati più qualificati e spendibili nel mercato del lavoro non sono in grado di avere... http,0
"@user @user Sicuro, proprio come Sarri a Napoli. Ma con tanti stranieri anche lui ��",0
@user Gli immigrati in italia vivono a gratis mantenuti.. da italiani perseguitati da tasse da usura.,1
‼️ arrestato #sindaco di #Riace simbolo dell’accoglienza‼️  e il problema siamo noi giusto??? #accoglienza #migranti #ipocrisie #falsimiti #avantitutta 👊 http,0
"@user Solo i tamarri comprano Volkswagen e Audi usate per fare gli sborroni. Dimenticavo, anche i rom hanno gli stessi gusti.",0
@user @user @user Bar e ristoranti??? Forse non ha letto la http scuola offre servizi gratuiti mensa e scuolabus italiani devono fare dich redditi per accedere gratis agli stranieri finora bastava una firma e dichiarano il cazzo che volevano. No non è giusto,1
"Gli abitanti di Torre Maura non sono di colpo impazziti. Se hanno paura dei rom significa che, evidentemente, non ne possono più dei continui furti e delle minacce cui sono sottoposti. Chi delinque - rom o non rom - deve essere perseguito. Ecco perchè Salvini ha ragione. ? ? ?",0
"COSI NN E' PIU' POSSIBILE GLI ITALIANI VENGANO CONDANNATI,ROM E RISORSE SONO SEMPRE FUORI PURE SE COMMETTONO OMICIDI..E UNO SCHIFO TOTALE.. http",0
Si sente male in acqua soccorso ​da bagnanti e medici stranieri: è grave  (y) segui il Corriere Adriatico e resta aggiornato - http (y) http,0
"#Repubblica: ""Cinese morta a Roma, fermato un ventenne: è un nomade del campo di via Salviati http",0
"@user Non devi chiederlo a me. Chiedi al ministero. Se pensi ci sia un terrorista a bordo di una nave, lo fai sbarcare, lo tieni in un posto controllato finché fai gli accertamenti. Se non lo fai, non vai dopo in giro a creare panico perché forse, potrebbe esserci stato un terrorista..",0
"Eh no, oh, terroristi de merda non me potete fa l'attentato alla città più bella del mondo",1
"Dopo le denunce tv contro degrado e abusivismo creati dal campo rom di Via Germagnano, e la solidarietà al canile... http",0
"@user @user La sensazione è che l'atteggiamento prepotente assunto dall'Italia nella questione migranti si stia ora rivoltando contro i nostri connazionali rimasti senza lavoro all'estero. Non è una conseguenza diretta, ma il clima è brutto",0
I rom “padroni” di Roma. Alla Stazione Termini: «Tu chiami i carabinieri? Io vengo a casa tua…» http,1
#Napoli Aggiornamenti sul previsto sgombero di 1500 persone dal campo rom di via della Brecce… http,0
"La modella nera: ""Fuori dall'Italia gli immigrati parassiti"" La modella brasiliana lavora come modella e non pesa sullo STATO ITALIANO mentre i PARASSITI CLANDESTINI NON LAVORANO E SONO MANTENUTI",1
No nn serve alcun speciale addestramento per fare molto male!Essenziale odio fanatico nel💖!Incitamento=terrorismo http,0
@user @user per forza ! Se non sei immigrato irregolare e islamico non hai diritto ad un cazzo perchè sei un'italiano !,1
"I farmacisti tra terrorismo e sos migranti, Sifo ne parla al congresso di Milano: MILANO  – Terrorismo, missi...... http",0
Tentano di rapire una diciottenne a Roma: arrestate tre donne rom http,0
VoxNews: Assessore PD fonda ONG che aiuta profughi a fare ricorso a spese nostre: Da una ricerca condotta dall… http,0
"@user  a quanto pare no...comunque, Scotland Yard parla di terrorismo...ma nn dice di che matrice...",0
“Noi non vogliamo i clandestini”: gli immigrati regolari e integrati stanno con il ministro Matteo Salvini: http,0
"Le Figaro, Alil Vardar: l’artista di origine albanese  Figlio di immigrati albanesi, Alil Vardar ha fatto carriera nel mondo del teatro francese grazie a commedie come 'The Clan of the Divorced'.  #albanianews.it http",0
@user @user Fassino e Chiamparino faranno di tutto x i rom e immigrati ma NON x i cittadini Torinesi!!!,1
Le famiglie che accolgono i migranti cacciati: “Da noi questi ragazzi si erano già integrati” http,0
Fico portateli a casa tua sti finti.profughi che hanno.sconvolto le ns vite e le ns citta,1
"@user Veramente il sindaco di #Riace non ha accolto. Il suo era un delinquere altrimenti non l'avrebbero arrestato. È la novità di chi favorisce l'immigrazione ""per aiutare un immigrato potete violare la legge"" invece ""se aiutate il popolo italiano siete fascisti e dovete sparire""",0
"Forlì Al culmine di un litigio per 100€  #senegalese si scaglia contro connazionale tentando di tagliargli la gola. Dopo l’aggressione, scappa ma è fermato dai carabinieri con i vestiti ancora sporchi di sangue  #immigrati    #violenza  http",0
#QuintaColonna ohhh ma sti musulmani hanno rotto il cazzo qua siamo in Italia e non ne vogliamo befane mascherate col velo eh basta,1
"@user Sì, va bene che i giornalisti de sinistra, cerebrolesi deiezioni dei centri sociali sono semianalfabeti e scrivono RUMENI, però ROMANIA e quindi ROMENI!! Sei comunque perdonato, grandi le Forze dell'Ordine!!👍👍👏👏😊",0
http A Roma italiani senza casa alloggiati nel container dei rom #ansa #news,0
Quindi state uscendo di senno per uno che disegna vestiti da rom che rubano il rame. Bene ma non benissimo,0
"Le rom se stavano rovistando nei rifiuti, come tanti poveri, non sono da rinchiudere ma da aiutare. Non è furto ma povertà. Forza #Lidl",0
#sanremo2017 L'italia non si smentisce mai amante degli stranieri,0
@user i #MIGRANTI ormai vanno cacciati con la FORZA i loro importatori hanno esagerato.Bisogna sequestrare i beni di George Soros per rimediare a tutti i danni fatti,1
"@user e sarebbe questa categoria di lavoratori immigrati che dovrebbe aiutare a pagare ""col loro duro lavoro"" le future pensioni? http",1
"In Italia, invece ai rom non è permesso neppure l’accesso ai bandi per le casa popolare – spiega Maurizio Pagani, presidente di Opera",0
"La cecità ipocrita dell'ideologia nefasta multiculturale si illude di poter fare convivere finto femminismo, mov. LGBT con un utopico islam buono e tollerante.. Salveranno le loro insignificanti esistenze solo grazie agli odiati sovranisti @user @user @user",0
"Roma, #nomadi bloccano la #strada con un #frigorifero per #rapinare gli automobilisti - http",0
"@user @user @user Nella società che abbiamo in mente noi,le moschee non dovrebbero neppure esistere. Tutto sanno che predicano radicalizzazione perché l'Islam moderato lo devono ancora inventare. È solo faida tra sciiti,sunniti e l'infedele occidente.  Per me è ruspa in ogni caso.",1
Quanti sono gli stranieri che vivono in Italia http,0
"Uffa con queste indagini ""monche"" sui terroristi che fanno proselitismo in carcere.  il campo di applicazione del 41 bis anche a loro.",0
"La Mare Jonio,nave dei trafficanti umanitari tutti indagati x favoreggiamento dell’immigrazione clandestini e disobbedienza a ordini militari, torna a navigare. Domanda: perchè il governo non ha tolto la bandiera? vogliamo trovarci fra qualche giorno in situazione appena vissuta?",0
"Grazie migranti, ci state facendo vedere cosa siamo diventati http via @user",0
#Aquarius #malta si cucca i #migranti dopo 5 giorni di attesa per il maltempo. Indagato il mare per sequestro .🤣 #Salvini  http,0
"A fronte del latrinaio liberal degli Obama e delle Clinton, chapeau,  anche se a uccidere non è il furore ideologico o l’estremismo: è l’islam @user http",1
"#migranti l Italia non ha mai ceduto hai ricatti, col terrorismo (Moro) anonima sequestri bloccando i beni dei sequestrati ecc...adesso dovrebbe cedere alle ong e ai trafficanti. Ma siamo pazzi?",0
#ROMA : le #Istituzioni permettono che bambini e ragazzi #rom stiano in giro a rubare e/o chiedere elemosine invece… http,0
"@user 5mila rom italiani aspettano reddito cittadinanza! Se pensi che io mi spacco la schiena, pago tasse che manterranno 'sta gente, hai capito male! Eserciterò il mio diritto alla disobbedienza e non verserò più neanche 1 cent. Me li spendo in abiti griffati! Voi non ci state dentro!",1
"@user È questo il dramma,complice la sinistra pd!!Vogliono far mandare i nostri ragazzi laureati all’estero e a noi ci obbligano a sostituirli con feccia africana!!Capito perché l’Europa ci tratta da merda!!??Perché vuole,d’accordo con il papa,che noi facciamo arrivare solo migranti!!!",1
#Codroipo in linea con il comune sentire. Va promosso l odio e l intolleranza per vivere tutti peggio. Proprio il Friuli che si sta spopolando ed ha bisogno di immigrati per reggere l'economia. Poi tutti in chiesa a Natale e chiedere il crocefisso nelle scuole.,0
"Roma, Raggi annulla gli sgomberi dei campi rom: “Anche gli zingari hanno diritto alla casa” - SkyTg24News http",0
@user ma scherziamo prima i musulmani e gì zingari poi gli extra comunitari e poi  e poi ....basta l'Italia agli italiani,1
"#Sinistra in piazza contro il centro #migranti: ""Non si può fare lì, è zona già degradata"" - anche i buonisti sono ""toccati"" dal problema ??",0
"Belli i pensieri che si leggono dopo avvenimenti simili, ma vi dirò che finché questi islamici non li spediamo a casa continueranno a*",1
Retata di centri sociali: occupavano case popolari e le affittavano a immigrati http,0
Sarebbe diventato il presidente più amato di tutti i tempi se invece dei musulmani avesse messo al bando i risvoltini ai jeans #muslimban,0
"Secessionisti, pm Brescia chiede 34 rinvii a giudizio per terrorismo ... - Il Fatto Quotidiano #Brescia http",0
"Se anche tu chiedi la chiusura di tutti i campi rom, firma e condividi questa petizione! - Firma la petizione! http",1
Oddio!! 😲 il corriere ha scritto #rom #ladre nella stessa frase! I benpensanti li sbraneranno!  http,0
"#MimmoLucano sindaco di Riace, paladino dell'accoglienza, è stato arrestato per favoreggiamento dell'immigrazione clandestina e fraudolento affidamento diretto del servizio per la raccolta dei rifiuti.  Attendiamo il commento del suo caro amico di @user. http",0
"@user @user @user  Nn li potete fare niente, so rom, nn italiani.....",0
Su #SeaWatch il Governo ha sbloccato la situazione e ha ottenuto che l’accoglienza sia condivisa con l’Europa. I migranti che arriveranno in Italia saranno accolti a costo zero. Un grazie presidente #Conte http,0
L'unico modo per integrare i rom nella nostra società è obbligarli anche con la forza a rispettare le regole e le... http,0
"Gianni #Morandi continui a cantare.  Gli riesce meglio che fare valutazioni sugli #immigrati che, ricordiamolo, sono quasi tutti clandestini",1
VoxNews: Il terrorista della porta accanto: storia del profugo fan del PD – VIDEO: Vox Vox Segui @user http,0
"@user Salvini fai attenzione, ti avviso che se non fai piu' la flat tax, perderai il 50% dei voti che ti abbiamo dato, questo anche se ci va bene la politica degli immigrati, sono le due primissime cose di egual valore che ci sta a cuore, occhio e'?",0
@user @user no ce porta i negri come te e ce li lascia ...zecca rossa devi crepare,1
"Accordo Italia-Libia sui migranti, i punti salienti: Da controllo confini a finanziamento centri accoglienza libici http",0
Freddo e fame: è questa la risposta di Roma ai migranti della zona Tiburtina? http,0
"Non sono razzista,ma chi vuole difendere gli immigrati africani, vada in Africa....facile fare beneficenza con soldi altrui!",1
#migranti  82 fancazzisti  Già arrivati a #Lampedusa. Prima arriva la nave maltese poi la Marina che li porta in Italia.  Scusate ma noi siamo veramente stanchi e stufi. Prendete x il cuxo????  @user #NoGlobalCompactMigration  http,0
Bambini rom a scuola di borseggio: 7 arresti in metropolitana (VIDEO) http,0
#notizie #Pisa Campo rom a Ospedaletto: Campo Rom Ospedaletto http #Toscana #Italia,0
"Un attacco terroristico ISLAMICO a Parigi non è un attacco terroristico ISLAMICO?  Avete paura? Siete terrorizzati? Esattamente quel che vogliono i terroristi, idioti.",1
"Incredibile, la Svizzera premia la deputata indagata per aver fatto entrare clandestinamente i migranti http",0
Tanto con il sole i nomadi non vengono più a scuola. Per qualcuno questa è la soluzione...,0
@user @user Non ho detto questo. Quello che ho scritto è che Salvini da in pasto ai suoi follower quei migranti dicendo una cosa non vera circa il loro status. E questo un ministro non dovrebbe farlo . mentre a Trapani ne ha fatti sbarcare 42 senza nessun post. Non si sente preso in giro?,0
"Blitz della Municipale, sgomberato campo rom nei pressi dello stadio http #Bari #Notizie #News",0
INCREDIBILE. Allarme terrorismo in Italia. La via Crucis nel mirino ... - InterNapoli.it http,0
"E' stato ucciso,era ampiamente previsto.Killer musulmano,fotocopia del terrorista standard. Luogo e città simbolici, origini, età e trascorsi come da copione. Perfetto per credere ad una vendetta islamica. Perfetto per chiedere solidarietà alla UE.INVECE NO.#GiletsJaunes avanti! http",0
"Si cercano tre  rom per il furto ai danni della ragazza cinese di Roma. I rom, tutti, presenti in Europa... http",0
@user @user @user quali campi di concentramento per i rom in Italia durante il fascismo?,0
"@user Di cosa straparli tu? Mercato del lavoro rovinato, immigrati che prendono sussidi piu di me che pago le tasse e banche salvate con i nostri soldi e sono fatti reali i miliardi di danni fatti da noi dove sono? Quelli dovuti alle pressioni finanziare per schiavizzarci???",1
"@user @user questi passano dai terroristi isis alla cultura ... ma i 5 stelle non predicavano il ritorno alla proipria moneta? l'italia non avrebbe bisogno della carità di nessuno men che meno da chi finanzia i terroristi ,invece andate alla carità da questa gente dignità sotto zero",0
"Una domandina : Se la #Germania vuole cacciare gli Italiani senza lavoro e poveri, allora noi possiamo cacciare i rom che rubano e mandare le ruspe nei loro campi. ? A meno che non considerate <rubare> un lavoro. http",1
"#Palermo. Allaccio non regolare al campo rom, dopo 4 mesi non è cambiato nulla: http @user",0
#londonattack chiedete ai buonisti del cavolo cosa vogliono fare con i islamici perché io se chiedo mi vengono solo insulti sulla bocca,1
"#QuintaColonna anche a Gallarate, #Marcato. nn fanno altro che ubriacarsi i musulmani.",1
"@user @user  e tempo di fermare questi maledetti assassini islamici, fuori dal Italia e la boldrini con loro",1
Ancora che i buonisti parlano : alle famiglie niente buoni libro e agli immigrati lezioni di sci. Fate schifo !!!!,1
"@user @user Hai ragione , vogliono distruggere sopratutto i nostri diritti  deportando immigrati. LEuropa non si salverà , proprio vero  che è caduta.",0
"Non solo ma opera indisturbata da qualche anno.Solo ora potremo rimandarne a casa un po' grazie al Decreto SICUREZZA.Nessuna scusante e nessun asilo per immigrati spacciatori, assassini o sfruttatori.A CASA.Avevamo già i ns. senza doverne importare.#chiudiamoiporti",1
"Roma, allarme terrorismo: cosa sta succedendo – Vi Avviso http",0
"@user @user Questi hanno il coraggio dei conigli come il loro kompagno vauro, sanno perfettamente che i loro amici neri sarebbero pronti a qualsiasi atto violento contro chi osasse criticare l'islam e maometto.",0
"una domanda. questi pseudo migranti nei loro paesi avevano sky,avevano gli smartphon,mi viene il dubbio se avevano acqua. vogliono vivere da turisti e non gli deve mancare niente. follie,offende gli italiani che lottano per la soprav.   http di @user",1
@user basta profughi in Italia perfavore basta,1
Domenica della Palme: la fede dei cristiani iracheni profughi a Erbil http http,0
@user @user Vogliamo : 1 ritorno allo IUS SANGUINIS (Diluito nel 92 dopo Soros) 2 blocco navale 3 Rimpatri di tutti i gli africani e mediorientali ! 4 Messa al bando dell'Islam! 5 nazionalizzazione delle banche! 6 riforma dell'informazione no politically correct  Siete voi quelli da votare?,1
"#Piazzapulita l'Isis andava fermata prima. Avete già dimenticato tutti i massacri contro cristiani musulmani azizi, le gole tagliate?",0
"Corriere: Tangenti, Mafia Capitale dimenticataMazzette su buche e campi rom http #roma",0
Nomadi colti sul fatto aggrediscono i carabinieri: rom col cacciavite tenta di sfregiare… http http,0
Senti senti....Amnesty comincia a rompere....quando sarà la strage dei mussulmani??...così x equilibrare i conti.... http,1
"#Salvini \""Ci sono milioni di musulmani pronti a sgozzare anche sui pianerottoli nostre case\"" #TSO URGENTISSIMO. SINDACOOOOOOOOOOOOOOOOOOOOO!",1
"In romania 200mila in piazza x protestar contro corruzione..In Italia 4 gov non eletti, disoccupazione, immigrazione e tasse al max, nulla 😈",0
"Lui è Gianni il pomodoro. Per colpa di Salveenee che non vuole far sbarcare i migranti della #SeaEye in Italia non verrà mai raccolto. Non possiamo permettere una simile barbarie, VERGOGNA!  #facciamorete #restiamoumani #portiaperti #Amburgo http",0
"Sea Eye è in ""rotta di evasione"". E Salvini fa pattugliare il mare http via @user  PERSONALMENTE MI SENTIREI PIÙ “SICURA”CON 64 MIGRANTI IN GIRO PER ITALIA CHE CON UN MINISTRO dell’INTERNO COME #SALVINI! Mi mette inquietudine ed ansia??un tipo così?",0
"@user Mi pare una buona metafora di questa Europa che calpesta i più deboli: i poveri, i lavoratori delle fasce più basse, i migranti, i ragazzi che vogliono far sentire la loro voce. Francamente inizio a rompermi le balle.",0
"@user I nostri nonni andavano fuori Italia per lavorare... fai lavorare gli immigrati... pulire fossi, verniciare i palazzi che fanno schifo, togliere le scritte dai cartelli e dai muri...  vedrai quanti se ne vanno!!",1
Salvate i cittadini di Castelvolturno e Napoli quartiere Vasto. capitale della Mafia Nigeriana @user @user @user @user @user @user @user @user @user  http,0
"Venezia, Migrante molesta bambina, i parenti quasi lo linciano. Secondo la #boldrina  la cultura di questo migrante non prevede che non si possono violentare bambine, e vanno tollerati. Cara #boldrini, noi non la pensiamo come te e i musulmani. Pensate l'avranno capito adesso?? http",0
@user @user alla caritas cè la fila di musulmani.x chiedere latte e biscotti x neonati.e pensare che ci chiamano porci/infedeli,1
@user Sono peggio degli animali e poi ci sono gli stronzi che si permettono di dire che l’Islam è una religione di pace che deve essere rispettata. Io mi auguro risorga Goffredo Di Buglione. Ne abbiamo bisogno. Mi manchi caro Goffredo.,1
"Gli spacciatori (finti migranti con il permesso umanitario e sovvenzionati dal contribuente italiano) devono essere messi al muro senza la minima pietà, vendono consapevolmente morte ai nostri ragazzi e la società ha il diritto e la giustificazione etica di condannarli a morte!",1
"#quartarepubblica #vauro sei una vergogna vuoi spiegare il dramma immigrati ridendo, e non sai nemmeno ciò che dici. Continui a parlare male dei tuoi consanguinei (gli italiani), ci sarà la svolta e spero che nel mondo non ci sia spazio per te.",0
"Roma, gli spezzano il dito per rubargli fede: caccia a due rom http http",0
"Pisa,oggi,Piazza della Stazione,#migrante si masturba su una panchina,dove ci sono donne e bambini...un signore lo reguardisce malamente,questo in un italiano stentato, spiega che ha bisogni fisiologici,quindi vuole essere lasciato in pace..😱 @user @user",1
L’agricoltura lombarda cresce soprattutto grazie ai giovani e agli stranieri http,0
"Vaticano contro Trump, appello alla chiesa Usa: ""Azione di lobby per far cambiare politica immigrazione""… http",0
"@user Si, grazie Mauro...ma girare oggi in Roma-centro è un continuo assillo da rom,ladri,petulanti,accat… http",0
"@user @user @user @user @user @user @user @user @user @user @user @user @user @user @user @user Attenzione perché a breve diventeremo come la Svezia dove avere una posizione critica nei confronti degli immigrati illegali è reato di odio razziale. Non manca molto, avete sentito la Raggi oggi sulla situazione di Roma?",0
"I migranti non rappresentano un rischio per la salute pubblica. Allarmismo, No grazie! @user http",0
"#milano Milano, rom da anni in stabili comunali di via Adriano  http",0
"@user @user @user No è la consapevolezza di essere ammalato e l’obbligo di cura.Con l’educazione al preservativo.Non puoi ignorare che i migranti siano un confuso gruppo di untori,più o meno consapevoli,allo sbaraglio.Colpa delle politiche migratorie falsamente buoniste. Curare sarebbe stato buono",1
"@user @user @user Con te non si può proprio ragionare, colpe a caso ed ora mi tiri fuori l'immigrazione. Non prendertela solo con gli studenti manifestanti in 77 città d'Italia, facile dire che questi siano vincolati da altri o ipotizzare un lavaggio del cervello, prenditela anche con altri",0
"Villaggio Boncore.Chiudono la scuola elementare per ospitare gli immigrati, accanto l'istituto che ne ospita altri @user @user",1
"Sto pensando che in fondo siamo tutti un po nomadi e un po stranieri in questa nostra Italia ""Terra di nessuno""",0
"Gli islamici non sopportano manco Peppa Pig. Manco io,ma per altri motivi. Gli islamici, francamente, avrebbero anche rotto i coglioni",1
Non manda a scuola il figlio per fargli chiedere l’elemosina: rom arrestata – webitalia360 http http,0
Che fregatura #Alfano dopo l'uccisione del terrorista a Milano  non ha potuto dare la notizia e prendersi i meriti… http,0
Era in Italia. Poteva massacrare un centinaio di italici. Gli immigrazionisti del Governo italiano tacciono. http,1
"@user Questo, perché era un immigrato. E gli immigrati vanno accolti senza se e senza ma, rispettando la loro cultura... Beh, coerente no? Quindi devono poter arrivare anche l’ISIS, i cannibali... e noi non dobbiamo reagire, sennò saremmo fascisti, razzisti, ignoranti funzionali...",1
"Roma, nuovo sgombero al Baobab di via Cupa: via migranti e tende http via @user",0
"#terrorismo in Francia,popolo esultera' per averlo ucciso. Da noi polemiche anche quando , rischiando le #FFOO, uccisero quello di Berlino.",0
#QuintaColonna in #Italia 180mila #rom di cui 90mila senza passaporto! Beh?!? Espulsione immediata!,1
