text,label
"Il fatto che i “volontari” delle #ong si scaldino tanto per i migranti,fa capire il giro di affari che c è dietro!! Come già detto, nessun “volontario” si infervora tanto per i disabili e gli anziani in difficoltà! Ah..già...non c è da guadagnarci!!! #sciurba #agorarai",0
La speranza è una sola per migrantiIl guadagno..Tutti li la speranza ..fate una grande pena. ANZICHÉ PENSARE AI NOSTRI GIOVANI UMILIATI.. CARO SIMONE http,1
Roma. Operazione black Flag contro il terrorismo http Dazebao,0
"Stanno “buttando le basi” per urlare alla strage ""propagandistica"" di migranti per colpa di @user  che ha chiuso i porti italiani. Che strano vero che tutti questi barconi siano partiti proprio dopo l'arrivo della #Aquarius di @user e @user in #Libia? http",1
"Migranti: mons. Staglianò (Noto), ""disponibilità dalla gente ad accogliere i profughi salvati dalle navi Sea Watch e Sea Eye"" | AgenSIR http",0
"Questi #animali si calmano solo a colpi di #taser. #mortacciloro  Fanno i ""pazzi"" solo perché sanno che se i poliziotti li toccano passano i guai.  Migrante ruba e pesta agenti: crolla il buonismo della sinistra sul Cara http di @user",1
@user Matteo perché 235 migranti clandestini sono potuti sbarcare a Pozzallo??? Stiamo incoraggiando le navi italiane a fare ciò che facevano le ONG! #stopinvasione,0
"@user No..ma tranquilli..va bene così!! Il sole splende, gli uccellini cinguettano e i ""poveri migranti"" son tutte brave persone. Avanti così, fino alla nostra fine... Grazie comunisti schifosi😠😠",1
"La Francia controlla, deruba e impoverisce 14 Stati africani: http",0
"il ministro @user si dice continuamente preoccupato del terrorismo islamico che in Italia non ha mai colpito. Nel frattempo estremisti di destra - FASCISTI - vengono beccati (mesi fa) a maneggiare ricina. Lei ministro, sa di che si tratta? sa quanto è pericolosa?",0
"Si scopre con prove certe che #Soros paga piddini per far politiche pro immigrazione.La #Bonino lo CONFESSA.Associazioni criminali ci fanno i miliardi.#Fico, #Mattarella e il #papa fanno propaganda.E io sarei complottista perché vedo Soros dietro di loro?MA ANDATE AFFANCULO!",0
L’argentina di Bergoglio: “Anche noi vogliamo il muro anti-immigrati”.... http,0
@user d'altronde con tutti quei migranti ... e' normale avere il buchino infiammato ... no?,0
"@user @user Mi scusi il msg ló indirizzato a chi ha detto che l'Italia,vive grazie ai migranti.. E rinnovo l'invito di andare a....",0
"Roma: banda di rom gli chiedeva il pizzo da 2 anni, ristoratore esausto li uccide a colpi di mitra - http via @user",0
"Arrestati dopo l'inseguimento, due nomadi in manette. Li riconoscete? http",0
La Meloni a Conte: «Sul tuo aereo per i migranti c’è posto per i terremotati?»   http,0
@user il nuovo stile di vita invocato dalla Boldrini! che retrogradi noi non-musulmani....non accogliere questa ricchezza culturale!,1
"@user Basta con questi immigrati! Stop al multiculturalismo, seguiamo TRUMP alla faccia della quella con problemi ment.,la Boldr.",1
"Ecco come i dati dell'#INPS smentiscono #boeri e la retorica delle ""risorse"" straniere. La maggior parte di loro ha trovato in Italia il Paese di Bengodi e prende in massa #assegniassistenziali senza aver mai lavorato http",1
"@user E' il risultato di 5 anni di ""accoglienza affaristica"" a chiunque pagasse criminali per venire in Italia. 700 000 immigrati illegali, tra i quali molti farabutti,  fatti entrare per arricchire la lobby dei soccorsi e dell'accoglienza. E Censis si stupisce per italiani  arrabbiati",1
"DITEMI VOI: VI SEMBRA UNO CHE SCAPPA DALLA FAME E DALLA GUERRA? AVETE NOTATO LA PANCIA? CHISSA' PERCHE' IO QUESTI FINTI PROFUGHI CHE STIAMO MANTENENDO DA ANNI LI VEDO TUTTI COSI'! NESSUNO CHE SIA MAGRO E DEPERITO. TUTTI BELLI GRASSI, PANCIUTI E GAUDENTI. http",1
#dallavostraparte via dall'Italia gli immigrati clandestini e tutti i politici incapaci di governare l'Italia,1
"@user Mogherini pensa Europa islamica, Pisapia alle moschea, PD ai clandestini, agl'italiani chi pensa? Silvio pensaci tu. Amo Italia!!",1
"Questi finti preti e questa finta accoglienza ! Il traffico di droga non rendeva più e padre Mussie Zerai si è ""rilanciato "" nell'immigrazione clandestina che rende più della droga !",1
#PolettiDimettiti Il figlo di @user non laureato nelle coop e tutti gli altri a morire in terra straniera. Fabrizia RIP,0
"@user @user @user @user @user @user @user La vera faccia del @user  ? Altro che Salvini,dove sono ora coloro che protestavano per i migranti del Diciotti? @user @user @user @user @user  @user http",0
Armi di #immigrazione di massa da usare contro l'Italia... La #Francia chiude i porti all'#Aquarius. http,1
Libro di prima media: una ventina di pagine sono dedicate all'#Islam e alla sua meravigliosa cultura. Nella mia epoca al massimo ci sarà stato un trafiletto. Vi sembra normale? Ovviamente non c'è alcun accenno critico. Sono disgustato#stopinvasione #StopIslam #DecretoSicurezza http,0
NON SI OSI DIRLO NEPPURE PER SCHERZO! BISOGNA MANDARE VIA SUBITO I #MIGRANTI E ANCHE GLI #IMMIGRATI REGOLARI! ALLA FINE FRAU #MERKEL INSEGNA. #SALVINI #STOPINVASIONE http,1
����������@user su @user che parla di situazione rom come1 raZZZZZista omofobo della Lega?che Dio ce ne scampi! Da cattosiniXtri redenti!,0
La Stranieri Spa vale come la Fiat: il Pil degli immigrati in Italia pesa 127 miliardi http,0
Ogni paese ha i migranti che si merita- BBC News http,0
@user Che munnezz e paese siamo!!ma i rom non sono apolidi? E petche in italia stanziali,0
"#Italia di #Renzi e quella senza lavoro, inmersa nella crisi dei valori. Affollata di #emigranti illegali con più diritti che li #italiani",1
Ora i migranti minacciano: “Siamo pronti alla guerra contro Salvini”. Lui: “L’invasione non è più consentita”  Minacciati a casa nostra..grazie al PD!#MovimentOnesti http,1
@user tutti i campi profughi in MO fate blitz teste cuoio e fate sparire tutti i veli stesi ad asciugare e non fatene fornirne piu',1
Il banco di prova della #democrazia sta nell'indifferenza o partecipazione dei cittadini. La storia si ripete #immigrationban #Trump,0
"Lucia ho trovato la spigazione alla valigetta : ..........,la maggior parte arabi e stranieri in genere che penso avessero il compito di disturbare e nulla più,cancellato parecchi LUCCHETTI che non ti permettono di leggere i loro Tweet o vedere chi seguono.",0
Risposta politically correct: La tubercolosi la portano gli immigrati quindi rinforza il sistema immunitario. I sopravvissuti saranno molto più forti. Non lamentatevi e ringraziate le risorse.,0
"quando capiranno che  l'islam si fonda sulla violenza? é Maometto stesso che dice "" uccidete gli infedeli "". Le radici di una religione hanno una importanza fondamentale .",1
@user è vero ci mancherebbe altro sei un torturatore tu è il tuo amico Massou e sei anche tu un pezzo di medioevo come i nazislamisti,1
@user In beneficenza agli immigrati clandestini o alla chiesa pedofila? Perché non fa una vera opera di bene e dona a CasaPound? http,1
@user @user @user @user @user @user @user @user @user @user @user @user @user @user @user @user rispedire a casa loro criminali stranieri no vero? Solo costi!!!,1
"@user @user E SE NON CE LAVORO, TU PORTI I MIGRANTI, STRATEGIA INTELLIGENTE, INVECE DI CAPIRE(PER TE DIFFICILE) COME PRODURRE LAVORO,PORTI I CLANDSTINI. MA VA AFFANCULO FIGACCIA DI MERDA.PORTALI  CASA TUA.",1
Il business dei falsi profughi è anche questo. http,0
"Il PM D'Alessio ha raccolto prove su reati commessi dal sind. di Riace; dal favoreggiamento del reato di immigrazione clandestina, alla truffa sui matrimoni combinati e sugli affidamenti illegali . E tutti sinistrati buonisti radical chic & company la buttano in caciara politica. http",0
@user @user Prima si soccorrono e si aiutano gli italiani in difficoltà che grazie al falso buonismo PRO IMMIGRATI sinistro sono alla fame e in mezzo a una strada. La pazienza è finita che piaccia o no al pontefice. #primagliitaliani #Salvini #stopinvasione,1
Vedo migranti cinesi che commerciano Vedo migranti dell'est che fanno i badanti Vedo migranti orientali che fanno i domestici Poi vedo neri e zingari che non fanno un caxxo e chiedono soldi Noi non siamo razzisti Noi non vogliamo essere presi per il culo #NoGlobalCompact,1
Ambasciatore : Teheran spera che l'Occidente cambi approccio alla lotta al terrorismo http,0
@user Merde islamiche. Loro e il loro maledetto Corano. Schifosi animali.  Bomba atomica su medio oriente e nord Africa.,1
"Giornata internazionale rom e sinti, inclusione ancora lontana: “Nel 2016 si è rischiato… http",0
IL GLOBAL COMPACT VORREBBE L'INVASIONE MIGRATORIA EQUIPARANDO MIGRANTI ECONOMICI E PROFUGHI. PREVEDE CHE CHIUNQUE CRITICHI L'INVASIONE SIA PERSEGUITO PENALMENTE. SI PIANIFICA LA SCOMPARSA DEI POPOLI EUROPEI E LA REPRESSIONE DEL DISSENSO. ORA VEDIAMO DA CHE PARTE STA IL M5S. http,0
"#rom #Lidl #Follonica  Suvvia ... così fan tutti! Un sottilissimo filo che separa una ""goliardata"" dal #razzismo  #biancoenero",0
Ripropongo il mio articolo sulla provenienza della #meningite #immigrati http,1
"Le 33 persone premiate da Mattarella perché ""esempio"" di civiltà - Nessuno che abbia difeso una donna dalle molestie di un nigeriano o un capotreno dalle botte di un clandestino o sventato lo scippo di un rom? Pseudovalori sempre strabici i buonismi! http",0
"@user @user Tu sei uno schiavo a 90 gradi ,sei un fallito,non ce' rimedio per uno che vota pd salvarlo.Vergognati, avete fatto invadere l'Italia di disperati ,terroristi e munnezzzzzzz,Siete il marcio dell'Italia ,finalmente che state sparendo.",1
Un reportage ben fatto che descrive il traffico dei migranti verso l'Europa http,0
"@user chi incita alla violenza contro le istituzioni è un terrorista, quindi se tanto mi da tanto.....",0
Il vergognoso sgarbo del vescovo pro-migranti a Pamela: non benedice la lapide e non incontra i genitori: http,0
"Se usassimo ""certi sistemi"" di Malta, sicuramente non sbarberebbero nemmeno a Pantelleria. Malta, isola del Mediterraneo, non accoglie mai profughi: ecco come fa. http",0
L'indignazione dei media mainstream per i razzisti di Torre Maura dopo che da anni ospita e da voce alla peggiore propaganda anti rom non è meno schifosa dei razzisti a Torre Maura.,0
"Per #meloni, #salvini, i salvinati e i fasciorazzisti i #migranti/#immirati sono refusi umani, utili solo a pagare tasse e contributi sociali/pensionistici a fondo perduto. La sindaca di #lodi rappresenta gli italioti salvinati che stanno infestando l'Italia http",0
"ROBERTO SAVIANO dichiara ad una radio francese: ""Centomila immigrati all'anno, non sono un'invasione, sono un dono Se ne è così tanto convinto li accolga a casa sua, gli Italiani sono stufi di accogliere e mantenere finti profughi. #chiudiamoiporti #stopinvasione #iostoconSalvini",1
"#Ferrara contro l'immigrazione, su #DallaVostraParte! Finalmente qualcuno che parli della situazione della mia città! #rete4 #mediaset",1
"@user @user @user @user @user @user @user @user @user @user @user Se in questo paese non c’è più la libertà di augurare la stessa sorte che è toccata alle vittime stuprate da migranti che sono poi quelli difesi dalla signora Boldrini, allora è morta la libertà di parola di pensiero e di opinione perché non c’è stata nessuna offesa",1
"Io direi di dire basta con la solita frase trita e ritrita che anche noi siamo stati migranti. I nostri bisnonni non avevano le coop che passavano loro vitto e alloggio ma squallide stanze da dividere in 10, informiamoci prima di fare paragoni assurdi. @user @user",1
Comincia proprio bene l'anno...stranieri che si accoltellano in piazza...bella merda proprio... http,1
AGGREDISCONO I POLIZIOTTIPER DIFENDERE UN MINORE CON LA REFURTIVAMA.CHI CAZZO CI STIAMO MANTENENDO IN QUESTA NAZIONESOLO DELINQUENTIVOGLIO VEDERE QUANDO SI FARÀ UNA PULIZIA.Un poliziotto ha sparato in aria per liberarsi dall'assedio di 50 rom http,1
@user si ok ma figli non se ne possono fare garantito a meno che non fai come rom ecc.ecc. li concepisci e poi mandi a elemosinare,0
@user Questo per dimostrare agli idioti buonisti di sinistra filoimmigrazionisti che nessuno vuole importare finti profughi futuri criminali da mantenere a 10 miliardi annuali questa e un invasione indotta pianificata che destabilizza i paesi europei distruggendoli tutto qui sveglia,1
"La vera unità d'Italia è avvenuta grazie a #MatteoSalvini, concetti come #terrone e #magnapolenta sono ormai desueti, per buona pace dei democratici dal fegato bollente, ora il nemico comune è l'immigrazione selvaggiamente orchestrata dai sinistri traditori",0
"Cosa vuole fare il governo sull'immigrazione (il piano di Minniti) http PORTATELI A CASA TUA MINNITI,CON BOLDRINI",0
"ONG I volontari insegnano ai migranti come recitare la parte delle vittime, come inventare storie strappalacrime e come recitare preghiere, un vero e proprio vademecum per ingannare gli agenti di frontiera   http di @user",1
"Roma, nomade tenta di investire gli agenti, loro sparano all'auto: far west al campo rom di Salone http",0
Ci fosse mai un magistrato dalla parte degli italiani. 60 Rom non voluti dai cittadini...avranno le loro ragioni o no? Adesso indagati per odio razziale solo perché non subiscono bovinamente l'invasione...assurdo?????? http,1
In Italia 181mila nuovi migranti nel 2016 (+20%). Gli italiani e la sfida dell'accoglienza. Oggi torna #Lintervista… http,0
"@user Non si può più girare in Italia, i  bastardi #pd hanno accelerato invasione di africani e musulmani. Uno schifo #gentiloni",1
"#ultimenotizie #news #notizie: Troppi stranieri in classe, la scuola mette le quote per italiani http",0
"Il multiculturalismo Una bomba antidemocratica e demografica per mettere gli uni contro gli altri. Sappiate che, un giorno, qualcuno dovrà prevalere. Chiunque vi dica che la convivenza sia possibile è in malafede. L'Islam per sua natura,non ammette mezzi termini. Siatene consci http",1
"I musulmani terroristi sono uguali a te. Vergognati, sei la donna piu'cattiva e piu' disgraziata di tutta Italia. Sei la rovina dell'Italia.",1
Allora? Ancora siete dell'idea che usare la violenza non serve a niente? Contro i luridi pezzenti #rom (e #zecche)s… http,1
Il recente passato riscritto dal Ministero della #Verità delle #democrazie occidentali  #NoNATO #NATO #terrorismo... http,0
Per tutti i moderati e filoislam moderati......guardatevi #ViaggioaKandahar su @user #moderatiuncazzo,1
"Si dobbiamo riprenderci la Sovranità maldestramente ceduta ad un'Europa che è già lardellata di islam ( V. Parigi v. lo stupro di massa in Germania a Colonia nel 2015 etc). Cedendo la sovranità, ma doveva essere consultato il Popolo, hanno reso vulnerabile anche la Costituzione.",0
Stanno perdendo una valanga di voti per l'immigrazione se ne sono accorti e tentato la virata. Chi ci crede è perdu… http,0
"Civitavecchia, donna rom sorpresa a rubare presso zona residenziale - Terzo Binario News http",0
"@user @user Troppo buonismo,chi sa quanti terroristi dietro,a tutti questi affitti clandestini !",0
"Roma, maxi-rissa al campo rom durante il censimento del Comune. Raggi: torna legalità, se ne facciano una ragione http",0
@user @user Sappiate che tutto ciò che ruota attorno all'Islam è lontano anni luce dalla nostra cultura  ch'è espressione di una LIBERTÀ conquistata con secoli di lotte e sofferenze!,1
"Treno Flaminio/ Viterbo una vera Vergogna fatiscenti, sporchi, senza una guardianeria di sorveglianza, 500.000 cittadini del Lazio scendono a Roma per lavoro da tutta la tratta Viterbo Flaminio, in balia di immigrati, borseggiatori e ritardi treni.Vergogna.@user @user",1
@user @user @user Francamente degli immigrati che giocano a pallone e vivono in Italia non può fregare di meno; mi preoccupo invece molto più dei bambini della contrada Sappusi e della la contrada amabilina qui a Marsala che non hanno nemmeno mai visto un panettone: alla faccia dell’accoglienza!,0
"@user #AsiaBibi ..... ....E il #Papa se ne frega! Lui pensa ai mussulmani e ai judei, dei #cristiani perseguitati e uccisi da attentati vari, poco gli importa, due paroline all'Angelus e amen....#Vergogna",0
"Libia, i segreti dell’accordo con l’Italia  per fermare l’arrivo dei migranti Ma servono due miliardi dall’Europa http …",0
Non possiamo difenderci perché ci arrestano..se mi scade l'assicurazione della macchina e non rinnovo in tempo mi multano gli stranieri no,1
"Liberata la masseria occupata dai #rom Prima di andarsene hanno devastato tutto, ora la bonifica. Chi paga?? http",0
"L’invasione migratoria è un “Cavallo di Troia”. L’Europa  e  la politica di sinistra  ,non credono alle Cassandre,per questo avverrà la fine del vecchio continente  a favore degli africani  e dell’Islam..",1
I bambini migranti che vivono per strada e si prostituiscono in Italia  http @user @user,0
aggiornamento: ASIA/INDONESIA - La croce fatta da un artigiano musulmano è il simbolo della Giornata indonesiana... http,0
"La #Berlinguer ha detto: - gli stranieri ci pagano le pensioni - gli Italiani non fanno figli e ci servono gli immigrati - famiglie tradizionali che orrore  - servizio sullo sgombero delle baracche Rom.   #CartaBianca  Sinistra, cancro del mondo.",0
"Oltre a migliaia di ""risorse"" irregolari, la #Aquarius di @user e @user ha scaricato in Italia rifiuti tossici.  Per le 2 #ONG, il nostro Paese era sia un campo profughi sia una discarica. http",0
"UK: Indagati 426 membri delle gang islamiche e pachistane autori di oltre 1.500 stupri anche di minori a Rotherham. http Tranquilli, gli esperti di sinistra dicono che i crimini degli immigrati e dei musulmani li percepite sovrastimati perchè siete razzisti. http",1
"vorrei sapere  quale ministro  geniale ha ideato la tessera anonima degli  immigrati  quindi  interscambiabile tra loro con la quale ottengono protessi cure odontoiatriche   oculiste  e accessori   e cure varie tutto GRATIS e perché SALVINI lo permette ancora,diamo un taglio,???",1
Se si abbassa il prezzo della manodopera non è colpa degli imprenditori che sfruttano i migranti ma è colpa di costoro #coerenza #agorarai,0
@user @user @user ad Aprilia proprio no! Si va avanti a 2/3 rapine al giorno e sono tutti stranieri la maggior parte,1
"A parte che la dieta di #Salvini  dovrebbe essere rigorosamente padana, segnalo che i fagioli sono immigrati dall'A… http",0
"A #Goro se si rifiutano i migranti apriti cielo ,tutti a dire razzisti   A #Capalbio invece no.  Questa è becera #ipocrisia comunista",0
@user benvenuti in Italia!,0
"@user @user @user Ormai ottengono tutti la ""regolarità "" o come profughi o per motivi umanitari. E utilizzano  il nostro welfare.",1
@user @user infatti finché ci hanno guadagnato con i campi #rom tutto era ok con #Alemanno #Ipocriti,0
Italia mon amour: chi sono e cosa comprano gli stranieri che decidono di investire nel mattone del Belpaese  http,0
a fammoc a chitemmuort !! muori tu e tutti i #terroristi #islamici http,1
"Milano, ladre rom senza contegno e umanità: rubano pure le urne con le ceneri dei defunti http",1
Unica soluzione è cacciare TUTTI i musulmani NON integrati fino alla 3a gen che si ammazzassero nei loro paesi come fanno da secoli MALATI!,1
"Sei rom e incinta? Se ti beccano in una casa o a borseggiare persone su bus o metro, quasi sempre te la cavi. Mostri il certificato medico che sospende la pena e non finisci in cella: art146. Così funziona da noi la giustizia e puoi tornare a rubare: 20mila furti l'anno a Milano http",1
@user Fra 20 anni vedrai che cambierai idea. Maledirai chi ha fatto entrare i musulmani in Europa.,1
@user @user @user Io da 12 mesi ho chiesto a Boldrini quanti migranti ha accolto a casa sua ma non ha mai risposto !!molto strano con tantissimi lei non ha scelto un gruppo di  questa gente raffinata e volonterosa ..dippende a cosa ...,1
"@user Ad oggi, non ho visto una sola associazione di questo tipo fare davvero filantropia.  Spacciano per solidale ciò a loro strumentale. Esempio: la fondazione #Clinton anni fa distribuì gratuitamente vaccini a donne africane contro l'epatite B. Risultato?  Tutte sterili. #Filantropi",0
"@user Voi invece con gli sgomberi cosa avete ottenuto? Ah già, avete messo i rom sotto casa delle persone. Vedasi a Baggio che prima non era invasa. VERGOGNA E RISOLVI I PROBLEMI CHE AVETE CREATO VOI",1
@user Come quelle della bonino e della fedeli? Ci avresti riempito di immigrati di ogni genere con le tue manovre e rimpinzato le banche amiche tue e della tua combriccola,0
Abbiamo iniziato a sbagliare quando ci siamo chiesti quanti migranti sbarcano e non da cosa scappano.  Matteo Orfini,0
@user Ti dimentichi che in quei milioni che sventoli al vento erano composti anche da cinesi e rom.,0
Ong di Merda. Senza i migranti niente soldi eh? Fate schifo,1
"@user @user A noi buddhisti le festività del Natale religioso non danno fastidio per nulla..... Questi non hanno il coraggio di dire che fanno questa cosa demente per leccare i mussulmani,  non le 'altre religioni'",1
@user @user Tutti quelli che viaggiavano in terza classe finivano a Ellis island. La manodopera assoldata dalle società straniere per il tramite degli agenti viaggiava in terza classe. Tanto è. Smettila di speculare a casaccio: escono fuori babbeate. http,0
"“Italiani non fanno figli, serve più immigrazione”. Grillo a favore della Grande Sostituzione http via @user",0
"La Francia controlla, deruba e impoverisce 14 Stati africani http",0
Basta immigrati anche per evitare che figli degli stranieri già in Italia da tempo si trovino a ripetere la rovina delle periferie francesi,0
#Belgio entro il 2030 diventerà #islamica e sarà sotto la #sharia.  Vogliamo fare questa fine? Se NON CACCIAMO il… http,1
"#M5S: preservativi gratis a migranti e richiedenti asilo. Ritengo che per mille motivi andrebbero dati gratis a tutti, con particolare riguardo a cretini e fascisti, affinché non si riproducano.",0
Non ho ancora visto un immigrato lavorare oltre a delinquere http,1
#Siria🇸🇾 🎄Siriani in festa a #Natale  in tutte le città siriana liberate dai terroristi ma per il Tg1 Niente Celebrazioni Chiese vuote e Niente Festa! L’unica cosa che non c’è é la vostra coscienza!#Natalesiriano #SiriaVive http,0
"Comunque approfitto per svelare a tutti voi un segreto:  Il terrorismo non ha religione, non ha provenienza, non ha ideologia.",0
"@user @user TUTTI gli islamici che conoscono BENE la loro ""religione"" dissimulano,omettono,usano il tu quoque per sviare..",1
"Non tutti gli islamici sono terroristi ,ma tutti i terroristi sono islamici (Oriana Fallaci ) #CharlieHebdo http",1
L'unico modo per ridare sicurezza all'Occidente è espellere i mussulmani. L'islam è assolutamente incompatibile con il ns sistema di vita.,1
Pagina Nuova TV -  EURONEWS ita -  L'insostenibile vita nei campi profughi vicino a Mosul http http,0
@user @user ma quali profughi sono combattenti musulmani mandati per spacciare stuprare rubare sgozzare occupare e fanno tutto questo con la complicità dei castrati istituzionali di questa repubblica criminale,1
@user 12 milioni ai rom  e gli italiani muoino  di fame COOP =MAFIA  VERGOGNA RIBELLIONE FORZA! #dallavostraparte dai che manca poco!,1
#dallavostraparte importare tutti i criminali africani e gli ex guerriglieri e un po di terroristi destabilizzeranno il paese con rivolte,1
Aggiornamenti su immigrazione e visti. - TSS e 457: cessa il servizio di priorità - Bridging VISA BVB: le regole per viaggiare - Certificati Penali: flessibilità sulle scadenze - Visto a punti: per il Victoria alcune categorie in attesa http,0
Che poi c'è un bambino straniero abbandonato a se stesso e degli italiani teste di cazzo che lo assecondano nel fare casino. #viammazzo,1
"@user saranno anche nomadi ma sono sempre in Italia a delinquere,perché non se ne vanno anche in altri paesi? Germania,Svizzera...",1
"#Treviso si scopre islamica-rom, 12 enne partorisce e lascia la scuola dell'obbligo. 13 enne incinta da rom http",0
"Albanesi finiti in manette a Fiano Romano,“ ,basta immigrazione ladri-albanesi-furti-appartamenti„Operativi tra Verona e Venezia. Arrestati a Fiano Romano. Scovati dai carabinieri di Cittadella: un 22enne un 21enne, entrambi cittadini… http",1
"Rifiuti e inquinamento, il campo nomadi della 554 finisce sotto sequestro http",0
"@user Facce di terroristi, assassini e avanzi di galera! Prossimi spacciatori di droga per le nostre citta, davanti ai negozzi a rompere le palle alla gente! A quelli bastardi del PD che li hanno fatto entrare non vanno a rompere, però a noi si!",1
"@user @user @user O sei daccordo senza discutere coi boldriniani o sei da appendere,basta!Tutte le trasmissioni sono condotte da gente che ci vuole fare inghiottire a forza che essere gay è la normalità,l'immigrazione a cazzum è la felicità o sei fascista. Ne abbiamo piene le tasche fino all'orlo!",1
"#Roma #VillaAda, stanati due rom mentre tentano di rubare in un’auto in sosta http",0
http #rom notoriamente appassionati di fughe,0
@user ritornando a Terni anche questa notte un altro immigrato ha minacciato con un coltello un ragazzo per farsi dare tutti,1
"Oggi un problema serio che e' venuto sicuramente e aumentato da un immigrazione incontrollata e non gestita e la ""mafia nigeriana"":VAi con lui frustalo 10 volte ....(intercettazione ambientale).............. http",1
@user Ipocriti farabutti. Fanno morire i terremotati per I Bastardi clandestini immigrati schifosi.,1
tutti i migranti a casa di @user e @user sembrano molto buoni e accoglienti................prrrrrrrrrrrrrrr,0
@user con l istruzione..in questi Paesi tra cui l italia le leggi nazion sulla crimin e sul terroris sn blande..,0
"New post: Roma: nomadi, 4500 in 9 aree attrezzate http",0
"Genova, operazione della Guardia di Finanza al campo nomadi di Bolzaneto http",0
